{"timestamp": 1782996390.39074, "experiment_id": "e3b2c2b9", "concept_title": "Prove Fermats Little Theorem for p=5", "concept_domain": "Probability", "research_mode": "sorry_fill", "quality": "partial", "quality_score": 0.5254, "catalog_references": ["Catalog/Probability/FermatLittleP5.lean", "Catalog/Math/ZMod.lean", "Catalog/Math/NumberTheory.lean"], "prompt_length": 17572, "files_placed": 6, "status": "keep"}
{"timestamp": 1783001630.1217744, "experiment_id": "4b429121", "concept_title": "Zero-Knowledge Theorem Proving: I Can Prove Fermat's Last Theorem Without Showing You the Proof", "concept_domain": "Probability", "research_mode": "team", "quality": "substantial", "quality_score": 0.7118800000000001, "catalog_references": [], "prompt_length": 23944, "files_placed": 7, "status": "keep"}
{"timestamp": 1783003228.0175965, "experiment_id": "5a8a4bbe", "concept_title": "Improved Constant for Domination in Cartesian Product of Graphs", "concept_domain": "NumberTheory", "research_mode": "team", "quality": "partial", "quality_score": 0.562938, "catalog_references": ["Bre\u0161ar (2017)", "Chen, Piotrowski, Shreve (1996)"], "prompt_length": 22853, "files_placed": 7, "status": "keep"}
{"timestamp": 1783007670.370445, "experiment_id": "5e4735e1", "concept_title": "[Reset] Fresh approach in NumberTheory", "concept_domain": "NumberTheory", "research_mode": "team", "quality": "partial", "quality_score": 0.68521, "catalog_references": [], "prompt_length": 23003, "files_placed": 7, "status": "keep"}
{"timestamp": 1783012236.7822456, "experiment_id": "d991c87b", "concept_title": "Zero-Knowledge Theorem Proving: I Can Prove Fermat's Last Theorem Without Showing You the Proof", "concept_domain": "Computation", "research_mode": "team", "quality": "partial", "quality_score": 0.4437857425742574, "catalog_references": [], "prompt_length": 23944, "files_placed": 7, "status": "discard"}
{"timestamp": 1783015876.4205642, "experiment_id": "bfccf79e", "concept_title": "Prove Fermats Little Theorem for p=5", "concept_domain": "Bridges", "research_mode": "team", "quality": "substantial", "quality_score": 0.712488, "catalog_references": [], "prompt_length": 22841, "files_placed": 7, "status": "keep"}
{"timestamp": 1783018506.9881632, "experiment_id": "3e52c27d", "concept_title": "Manifold-Constrained Kruskal Rank Bounds on Dichotomy Counts", "concept_domain": "Novelty", "research_mode": "team", "quality": "substantial", "quality_score": 0.7916800000000002, "catalog_references": ["cover1965geometrical", "feng2023function"], "prompt_length": 23052, "files_placed": 7, "status": "keep"}
{"timestamp": 1783023242.2309642, "experiment_id": "b714fdc8", "concept_title": "Prove Fermats Little Theorem for p=5", "concept_domain": "Applications", "research_mode": "team", "quality": "substantial", "quality_score": 0.7480399999999999, "catalog_references": [], "prompt_length": 21890, "files_placed": 2, "status": "keep"}
{"timestamp": 1783025954.4801466, "experiment_id": "7f2fc4f9", "concept_title": "Prove Fermats Little Theorem for p=5", "concept_domain": "Pythagorean", "research_mode": "formalize", "quality": "partial", "quality_score": 0.47561819905213276, "catalog_references": ["Mathlib.Data.Int.ModEq.lean", "Catalog/Pythagorean/PythagoreanTripleModFive.lean"], "prompt_length": 22854, "files_placed": 73, "status": "discard"}
{"timestamp": 1783042620.8086646, "experiment_id": "150736b0", "concept_title": "Conjecture on Absolute Boundedness of Polynomial Diophantine Tuples", "concept_domain": "Logic", "research_mode": "team", "quality": "partial", "quality_score": 0.6976800000000001, "catalog_references": ["arXiv:1904.12345", "arXiv:2005.67890"], "prompt_length": 23054, "files_placed": 7, "status": "keep"}
{"timestamp": 1783049480.5140276, "experiment_id": "e4796c8c", "concept_title": "Filtered Colimit Preservation by Sheared Witt Vectors", "concept_domain": "Probability", "research_mode": "team", "quality": "partial", "quality_score": 0.6757399999999999, "catalog_references": ["Drinfeld-Lau original construction", "Zink's Dieudonn\u00e9 theory", "Dieudonn\u00e9 modules for p-divisible groups", "Filtered colimits in algebraic K-theory"], "prompt_length": 23130, "files_placed": 7, "status": "keep"}
{"timestamp": 1783053086.7037973, "experiment_id": "f7b97a34", "concept_title": "The Anti-Fibonacci Sequence: Numbers That Avoid the Golden Ratio at All Costs", "concept_domain": "Physics", "research_mode": "team", "quality": "partial", "quality_score": 0.460800096969697, "catalog_references": [], "prompt_length": 23736, "files_placed": 6, "status": "discard"}
{"timestamp": 1783056106.815051, "experiment_id": "aad22603", "concept_title": "Path-Minimality of Positive p-Energies for Connected Bipartite Graphs", "concept_domain": "Probability", "research_mode": "team", "quality": "substantial", "quality_score": 0.8748400000000001, "catalog_references": ["math.CO"], "prompt_length": 23040, "files_placed": 7, "status": "keep"}
{"timestamp": 1783056198.0409534, "experiment_id": "5875a645", "concept_title": "Phantom Topologies: Spaces That Change When You Look at Them", "concept_domain": "Novelty", "research_mode": "team", "quality": "partial", "quality_score": 0.5700000000000001, "catalog_references": [], "prompt_length": 23975, "files_placed": 7, "status": "keep"}
{"timestamp": 1783057877.5904574, "experiment_id": "a5a22996", "concept_title": "Isomorphism of generating trees for greedy m-Tamari intervals and planar (m+1)-constellations", "concept_domain": "Pythagorean", "research_mode": "team", "quality": "partial", "quality_score": 0.5129090000000001, "catalog_references": [], "prompt_length": 23289, "files_placed": 7, "status": "keep"}
{"timestamp": 1783058035.6465778, "experiment_id": "bb3ce4ee", "concept_title": "Dark Mathematics: Theorems That Exist But Cannot Be Found", "concept_domain": "Computation", "research_mode": "team", "quality": "substantial", "quality_score": 0.7902000000000001, "catalog_references": [], "prompt_length": 24043, "files_placed": 6, "status": "keep"}
{"timestamp": 1783061894.0420582, "experiment_id": "7488be0a", "concept_title": "Sheared Witt vectors are the colimit of truncated Witt vectors", "concept_domain": "Applications", "research_mode": "team", "quality": "partial", "quality_score": 0.51904, "catalog_references": ["Drinfeld-Lau 2025", "Zink 2003", "Lau 2010", "Hoff-Lau 2026"], "prompt_length": 22884, "files_placed": 6, "status": "keep"}
{"timestamp": 1783064039.9835784, "experiment_id": "583299ca", "concept_title": "Torsion local-global compatibility at p = \u2113 for GL_n over CM fields", "concept_domain": "Cryptography", "research_mode": "team", "quality": "substantial", "quality_score": 0.7779935103225806, "catalog_references": ["math.NT", "math.RT"], "prompt_length": 23277, "files_placed": 7, "status": "keep"}
{"timestamp": 1783065337.0596917, "experiment_id": "70c42dc4", "concept_title": "Phantom Topologies: Spaces That Change When You Look at Them", "concept_domain": "Geometry", "research_mode": "team", "quality": "substantial", "quality_score": 0.7083999999999999, "catalog_references": [], "prompt_length": 23977, "files_placed": 6, "status": "keep"}
{"timestamp": 1783066104.5882003, "experiment_id": "12f18d90", "concept_title": "Knots That Think: Cognition as Braiding in Category Theory", "concept_domain": "Applications", "research_mode": "prove", "quality": "partial", "quality_score": 0.5938800000000001, "catalog_references": ["Cryptography/BraidGroup.lean"], "prompt_length": 20676, "files_placed": 6, "status": "keep"}
{"timestamp": 1783072414.3168879, "experiment_id": "9bec4051", "concept_title": "Optimality of vector-valued convolution kernels for Sidon set bounds", "concept_domain": "MachineLearning", "research_mode": "team", "quality": "partial", "quality_score": 0.4398394666666667, "catalog_references": ["arXiv:2310.12345 (hypothetical reference for the paper)"], "prompt_length": 23009, "files_placed": 7, "status": "discard"}
{"timestamp": 1783082554.7441463, "experiment_id": "f91c88c3", "concept_title": "Characterization of Balanced Distance-Hereditary Graphs by the Complement of 3-Matching", "concept_domain": "Bridges", "research_mode": "team", "quality": "substantial", "quality_score": 0.78952, "catalog_references": ["math.CO", "cs.DM"], "prompt_length": 23065, "files_placed": 7, "status": "keep"}
{"timestamp": 1783083358.000005, "experiment_id": "f498d6bb", "concept_title": "Vampire Numbers and Other Numerical Monsters: A Bestiary of Arithmetic Oddities", "concept_domain": "Novelty", "research_mode": "team", "quality": "partial", "quality_score": 0.6591141074626865, "catalog_references": [], "prompt_length": 23912, "files_placed": 7, "status": "keep"}
{"timestamp": 1783087483.9839437, "experiment_id": "6d0ee8e6", "concept_title": "Generalized Honeymoon Oberwolfach Problem with Multiple Round Tables", "concept_domain": "Shared", "research_mode": "team", "quality": "partial", "quality_score": 0.6876800000000001, "catalog_references": ["Domain/File.lean", "Catalog/FINAL/N"], "prompt_length": 23278, "files_placed": 6, "status": "keep"}
{"timestamp": 1783090185.7423737, "experiment_id": "87ba90ae", "concept_title": "Fan-structure in Selmer group distributions over p-cyclic extensions", "concept_domain": "Algebra", "research_mode": "team", "quality": "substantial", "quality_score": 0.73448, "catalog_references": ["SDtwists", "KMR13", "KMR14", "SDtwists"], "prompt_length": 23047, "files_placed": 7, "status": "keep"}
{"timestamp": 1783091758.4849238, "experiment_id": "6044c919", "concept_title": "The Anti-Fibonacci Sequence: Numbers That Avoid the Golden Ratio at All Costs", "concept_domain": "Combinatorics", "research_mode": "team", "quality": "partial", "quality_score": 0.5680000000000001, "catalog_references": [], "prompt_length": 23748, "files_placed": 7, "status": "keep"}
{"timestamp": 1783102268.9663131, "experiment_id": "db78fb28", "concept_title": "Sheared Witt vectors are the colimit of truncated Witt vectors", "concept_domain": "Tropical", "research_mode": "team", "quality": "partial", "quality_score": 0.66208, "catalog_references": ["Drinfeld-Lau 2025", "Zink 2003", "Lau 2010", "Hoff-Lau 2026"], "prompt_length": 22876, "files_placed": 6, "status": "keep"}
{"timestamp": 1783103651.60737, "experiment_id": "3d19dc30", "concept_title": "Vampire Numbers and Other Numerical Monsters: A Bestiary of Arithmetic Oddities", "concept_domain": "Applications", "research_mode": "team", "quality": "partial", "quality_score": 0.4650941176470589, "catalog_references": [], "prompt_length": 23922, "files_placed": 7, "status": "discard"}
{"timestamp": 1783108208.616256, "experiment_id": "3fe1db8c", "concept_title": "Proving the Existence of a Sufficiently Large Extremal Family", "concept_domain": "Novelty", "research_mode": "team", "quality": "substantial", "quality_score": 0.8246161538461538, "catalog_references": ["Deza-Frankl, P. (1977).", "Kupavskii, V. (2022)."], "prompt_length": 22878, "files_placed": 7, "status": "keep"}
{"timestamp": 1783108252.629575, "experiment_id": "bb55b186", "concept_title": "Path-Minimality of Positive p-Energies for Connected Bipartite Graphs", "concept_domain": "Applications", "research_mode": "team", "quality": "partial", "quality_score": 0.6012985714285713, "catalog_references": ["math.CO"], "prompt_length": 23042, "files_placed": 7, "status": "keep"}
{"timestamp": 1783108359.823685, "experiment_id": "5961bdfa", "concept_title": "Multi-kernel smoothing lemma for Sidon sets", "concept_domain": "Applications", "research_mode": "team", "quality": "substantial", "quality_score": 0.7401600000000002, "catalog_references": ["Carter et al. 2023", "Optimization Constants repository", "Tao's tentative 0.947 improvement"], "prompt_length": 22977, "files_placed": 7, "status": "keep"}
{"timestamp": 1783109655.2100806, "experiment_id": "95c356ab", "concept_title": "Exact value of G\u2083({0,2,5})", "concept_domain": "Applications", "research_mode": "team", "quality": "substantial", "quality_score": 0.8257369999999999, "catalog_references": ["Hales--Jewett numbers", "Gallai homothety numbers"], "prompt_length": 22756, "files_placed": 7, "status": "keep"}
{"timestamp": 1783112999.6397433, "experiment_id": "6d5a2dac", "concept_title": "Escher Staircases in Algebra: Infinite Ascending Chains That Loop Back", "concept_domain": "Tropical", "research_mode": "team", "quality": "partial", "quality_score": 0.67304, "catalog_references": [], "prompt_length": 24035, "files_placed": 7, "status": "keep"}
{"timestamp": 1783113871.2141523, "experiment_id": "af0095a3", "concept_title": "Phantom Topologies: Spaces That Change When You Look at Them", "concept_domain": "Novelty", "research_mode": "team", "quality": "substantial", "quality_score": 0.7636449999999999, "catalog_references": [], "prompt_length": 23975, "files_placed": 6, "status": "keep"}
{"timestamp": 1783117726.4793034, "experiment_id": "2f34538d", "concept_title": "Infinitely Many Solutions to Prime-Base Binomial Congruences", "concept_domain": "Novelty", "research_mode": "team", "quality": "substantial", "quality_score": 0.7903600000000002, "catalog_references": ["arXiv:2305.12345", "OEIS:A080469", "GuedesMachado2023"], "prompt_length": 23004, "files_placed": 7, "status": "keep"}
{"timestamp": 1783122848.6782176, "experiment_id": "ade3f670", "concept_title": "Phantom Topologies: Spaces That Change When You Look at Them", "concept_domain": "Novelty", "research_mode": "team", "quality": "partial", "quality_score": 0.46629999999999994, "catalog_references": [], "prompt_length": 23975, "files_placed": 7, "status": "discard"}
{"timestamp": 1783124193.5598764, "experiment_id": "e0253a8b", "concept_title": "The Anti-Fibonacci Sequence: Numbers That Avoid the Golden Ratio at All Costs", "concept_domain": "Applications", "research_mode": "team", "quality": "partial", "quality_score": 0.6907399999999999, "catalog_references": [], "prompt_length": 23746, "files_placed": 6, "status": "keep"}
{"timestamp": 1783126090.9745462, "experiment_id": "3a1da3d1", "concept_title": "Vampire Numbers and Other Numerical Monsters: A Bestiary of Arithmetic Oddities", "concept_domain": "Applications", "research_mode": "formalize", "quality": "substantial", "quality_score": 0.71008, "catalog_references": ["Catalog/FINAL/NumericalAlgorithms/DigitManipulation.lean", "Catalog/FINAL/Combinatorics/MultisetBasics.lean", "Catalog/FINAL/NumberTheory/ModularArithmetic.lean"], "prompt_length": 23927, "files_placed": 7, "status": "keep"}
{"timestamp": 1783129343.7580605, "experiment_id": "e3e38cc8", "concept_title": "Even Harmonic Strength of Antipodal Spherical Designs Contains 2", "concept_domain": "NumberTheory", "research_mode": "team", "quality": "partial", "quality_score": 0.5266726923076923, "catalog_references": ["Spherical Designs with Infinite Harmonic Strength"], "prompt_length": 22995, "files_placed": 7, "status": "keep"}
{"timestamp": 1783132267.4682033, "experiment_id": "01bea6c3", "concept_title": "Every b\u2011invariant edge is forcing exactly for near\u2011bipartite bricks (up to the three classical exceptions)", "concept_domain": "NumberTheory", "research_mode": "team", "quality": "partial", "quality_score": 0.573804028436019, "catalog_references": ["lovasz2009matching", "Edmonds1982", "Szigeti2002", "Carvalho2018", "Lovasz1987", "Carvalho2002II", "KCLL20", "LXY19", "CLM12"], "prompt_length": 23359, "files_placed": 8, "status": "keep"}
{"timestamp": 1783139968.3791654, "experiment_id": "a1e3ce3a", "concept_title": "Multi-kernel smoothing lemma for Sidon sets", "concept_domain": "Novelty", "research_mode": "team", "quality": "partial", "quality_score": 0.44295649681528665, "catalog_references": ["Carter et al. 2023", "Optimization Constants repository", "Tao's tentative 0.947 improvement"], "prompt_length": 22967, "files_placed": 7, "status": "discard"}
{"timestamp": 1783141571.9259605, "experiment_id": "3498198a", "concept_title": "Escher Staircases in Algebra: Infinite Ascending Chains That Loop Back", "concept_domain": "Novelty", "research_mode": "team", "quality": "substantial", "quality_score": 0.7818800000000001, "catalog_references": [], "prompt_length": 24033, "files_placed": 10, "status": "keep"}
{"timestamp": 1783142301.360621, "experiment_id": "6f613cb7", "concept_title": "Dark Mathematics: Theorems That Exist But Cannot Be Found", "concept_domain": "Novelty", "research_mode": "team", "quality": "partial", "quality_score": 0.6449999999999999, "catalog_references": [], "prompt_length": 24035, "files_placed": 7, "status": "keep"}
{"timestamp": 1783142433.6311698, "experiment_id": "ca29fc4b", "concept_title": "Phantom Topologies: Spaces That Change When You Look at Them", "concept_domain": "Applications", "research_mode": "formalize", "quality": "partial", "quality_score": 0.467453, "catalog_references": ["Catalog.Novelty.PhantomTopology.lean", "Catalog.Novelty.PhantomPossibility.lean"], "prompt_length": 23990, "files_placed": 6, "status": "discard"}
{"timestamp": 1783142591.2642624, "experiment_id": "aed51c81", "concept_title": "No solutions for odd exponents in the coprime case", "concept_domain": "Novelty", "research_mode": "sorry_fill", "quality": "partial", "quality_score": 0.6341600000000001, "catalog_references": ["NumberTheory/PadicVal.lean", "NumberTheory/Mordell.lean", "NumberTheory/Lehmer.lean", "Data.Nat.Choose.MostElementsOfPrimeDivision"], "prompt_length": 17059, "files_placed": 6, "status": "keep"}
{"timestamp": 1783149069.9167056, "experiment_id": "51b04544", "concept_title": "The list chromatic number of 3-colorable planar graphs is at most 4", "concept_domain": "Novelty", "research_mode": "team", "quality": "partial", "quality_score": 0.4546, "catalog_references": ["Mirzakhani's 63-vertex planar graph (3-colorable but not 4-choosable)"], "prompt_length": 22806, "files_placed": 8, "status": "discard"}
{"timestamp": 1783150439.122971, "experiment_id": "0a7c4b5a", "concept_title": "Lower Bound for the Proportion of Zeros on the Critical Line for PGL(3) L-functions", "concept_domain": "Applications", "research_mode": "team", "quality": "partial", "quality_score": 0.65567, "catalog_references": ["math.NT"], "prompt_length": 23114, "files_placed": 7, "status": "keep"}
{"timestamp": 1783150515.743093, "experiment_id": "4120a115", "concept_title": "Phantom Topologies: Spaces That Change When You Look at Them", "concept_domain": "Novelty", "research_mode": "team", "quality": "partial", "quality_score": 0.5206, "catalog_references": [], "prompt_length": 23975, "files_placed": 7, "status": "keep"}
{"timestamp": 1783152225.4443107, "experiment_id": "fbcfb71f", "concept_title": "Vampire Numbers and Other Numerical Monsters: A Bestiary of Arithmetic Oddities", "concept_domain": "Applications", "research_mode": "team", "quality": "substantial", "quality_score": 0.75424, "catalog_references": [], "prompt_length": 23922, "files_placed": 11, "status": "keep"}
{"timestamp": 1783153424.7341197, "experiment_id": "865247f5", "concept_title": "Explicit Quantitative Lower Bound on Power-Saving for Monic Minkowski Polynomials", "concept_domain": "Applications", "research_mode": "team", "quality": "partial", "quality_score": 0.35455610000000004, "catalog_references": ["BloomSawinSchildkrautZhelezov2026", "RocheNewtonRuzsaShenShkredov2019"], "prompt_length": 22997, "files_placed": 7, "status": "discard"}
{"timestamp": 1783156357.7032888, "experiment_id": "563a1975", "concept_title": "Sharp Threshold Constant for Cycle Games", "concept_domain": "Applications", "research_mode": "team", "quality": "partial", "quality_score": 0.4794705000000001, "catalog_references": ["Chv\u00e1tal and Erd\u0151s (1978) - Triangle game threshold", "Bednarska and \u0141uczak (2000) - Asymptotics of threshold bias", "Glazik and Srivastav (2022) - Improved Breaker strategy for C_3", "Spencer (2019) - Potential method conjecture"], "prompt_length": 23016, "files_placed": 11, "status": "discard"}
{"timestamp": 1783156575.4772675, "experiment_id": "22f3c392", "concept_title": "The Anti-Fibonacci Sequence: Numbers That Avoid the Golden Ratio at All Costs", "concept_domain": "Novelty", "research_mode": "team", "quality": "partial", "quality_score": 0.36398012292358806, "catalog_references": [], "prompt_length": 23736, "files_placed": 11, "status": "discard"}
{"timestamp": 1783156740.5819166, "experiment_id": "e62d479c", "concept_title": "Knots That Think: Cognition as Braiding in Category Theory", "concept_domain": "Applications", "research_mode": "prove", "quality": "partial", "quality_score": 0.30277126000000004, "catalog_references": ["Cryptography/BraidGroup.lean", "Algebra/PartialCube.lean", "Catalog/Algebra/ErdosRenyi/Model.lean", "Catalog/Algebra/ErdosRenyi/Concrete.lean"], "prompt_length": 23694, "files_placed": 10, "status": "discard"}
{"timestamp": 1783162611.863317, "experiment_id": "116dddb5", "concept_title": "Escher Staircases in Algebra: Infinite Ascending Chains That Loop Back", "concept_domain": "Applications", "research_mode": "team", "quality": "partial", "quality_score": 0.5346635084337349, "catalog_references": [], "prompt_length": 24043, "files_placed": 11, "status": "keep"}
{"timestamp": 1783164688.9377844, "experiment_id": "a45ab2ca", "concept_title": "Recursive Decomposition Isomorphism for General m-Tamari Intervals and Planar Constellations", "concept_domain": "Applications", "research_mode": "team", "quality": "partial", "quality_score": 0.50004, "catalog_references": ["Dermenjian's work on greedy \u03bd-Tamari posets", "Bousquet-M\u00e9lou and Chapoton's functional equation solution for m-Tamari intervals", "Flajolet and Sedgewick's Analytic Combinatorics for tree/map decompositions"], "prompt_length": 23160, "files_placed": 7, "status": "keep"}
