{"timestamp": 1781585402.9633675, "experiment_id": "6ce4a7be", "concept_title": "Metric filtration rank profiles as tropical valuation objects", "concept_domain": "Bridges", "research_mode": "formalize", "quality": "substantial", "quality_score": 0.76292, "catalog_references": ["Catalog/Applications/PoincareData/SingleLinkageUltrametric.lean", "Mathlib/Combinatorics/SimpleGraph/Connectivity", "Mathlib/Data/Finset/Basic", "Mathlib/Data/Finset/Image", "Mathlib/Order/CompleteLattice/Finset"], "prompt_length": 17613, "files_placed": 7, "status": "keep"}
{"timestamp": 1781592195.1372461, "experiment_id": "e9b0b276", "concept_title": "Berggren Lattice Orbit Classification for Post-Quantum Key Exchange", "concept_domain": "Cryptography", "research_mode": "formalize", "quality": "partial", "quality_score": 0.5321925795053004, "catalog_references": ["Catalog/FINAL/Algebra/BerggrenLorentz/Core.lean", "Algebra/BerggrenLorentz/Core.lean"], "prompt_length": 4219, "files_placed": 0, "status": "keep"}
{"timestamp": 1781594923.1921868, "experiment_id": "c38e2bf9", "concept_title": "Tropical weight enumerator profiles for binary linear codes via Smooth Poincar\u00e9 primitives", "concept_domain": "Applications", "research_mode": "formalize", "quality": "substantial", "quality_score": 0.7101600000000001, "catalog_references": ["Applications/SmoothPoincare/TopologicalCodes.lean", "Applications/SmoothPoincare/CodeDirectSum.lean", "Applications/SmoothPoincare/MinimumDistance.lean", "Applications/SmoothPoincare/SelfDualLength.lean", "Applications/SmoothPoincare/GleasonLength.lean", "Bridges/CategoricalTropicalUltrametric.lean"], "prompt_length": 17652, "files_placed": 6, "status": "keep"}
{"timestamp": 1781595069.1106985, "experiment_id": "c8fdbde8", "concept_title": "That the Fibonacci **rank of apparition** `z(p) = fibEntry p`", "concept_domain": "Logic", "research_mode": "sorry_fill", "quality": "partial", "quality_score": 0.4348039483870968, "catalog_references": ["Mathlib.Data.Nat.Fib.Basic", "Mathlib.Data.Nat.MinMax"], "prompt_length": 1571, "files_placed": 0, "status": "discard"}
{"timestamp": 1781597193.4323764, "experiment_id": "e42393e4", "concept_title": "Functor from finite linear codes to tropical valuation objects via weight-threshold profiles", "concept_domain": "Bridges", "research_mode": "formalize", "quality": "substantial", "quality_score": 0.79224, "catalog_references": ["Bridges/CategoricalTropicalUltrametric.lean", "Applications/SmoothPoincare/CodeDirectSum.lean", "Applications/SmoothPoincare/MinimumDistance.lean", "Applications/SmoothPoincare/TopologicalCodes.lean", "Applications/SmoothPoincare/SelfDualLength.lean"], "prompt_length": 17644, "files_placed": 6, "status": "keep"}
{"timestamp": 1781597227.3528833, "experiment_id": "a0671e28", "concept_title": "Exponential generating functions induce a tropical valuation profile via coefficient-support truncation", "concept_domain": "Applications", "research_mode": "formalize", "quality": "partial", "quality_score": 0.5303199999999999, "catalog_references": ["Applications/CombinatorialSpecies.lean"], "prompt_length": 2977, "files_placed": 0, "status": "keep"}
{"timestamp": 1781597253.021311, "experiment_id": "5971ea29", "concept_title": "This document collects bold, falsifiable conjectures arising from the deepening ", "concept_domain": "MachineLearning", "research_mode": "formalize", "quality": "partial", "quality_score": 0.5840000000000001, "catalog_references": ["Catalog/Bridges/ValuationDepthTropicalFunctor.lean", "Catalog/FINAL/", "Speculative/AutoResearch/ValuationDepthFollowups.lean"], "prompt_length": 4252, "files_placed": 0, "status": "keep"}
{"timestamp": 1781597285.6484244, "experiment_id": "841c1580", "concept_title": "Cycle output. This cycle formalized, in Lean 4 (0 sorries, only the standard", "concept_domain": "MachineLearning", "research_mode": "formalize", "quality": "partial", "quality_score": 0.4354, "catalog_references": ["Catalog/FINAL/"], "prompt_length": 2365, "files_placed": 0, "status": "discard"}
{"timestamp": 1781597317.3279283, "experiment_id": "835afc43", "concept_title": "Deepening: Metric filtration rank profiles as tropical valuation objects", "concept_domain": "Novelty", "research_mode": "formalize", "quality": "partial", "quality_score": 0.37346615000000005, "catalog_references": ["Catalog/FINAL/"], "prompt_length": 3247, "files_placed": 0, "status": "discard"}
{"timestamp": 1781603865.0529532, "experiment_id": "4c324de9", "concept_title": "`TropicalWeightEnumerator.lean`, the **min-plus tropicaliz", "concept_domain": "Geometry", "research_mode": "formalize", "quality": "partial", "quality_score": 0.5844, "catalog_references": ["Catalog/FINAL/Applications/SmoothPoincare/TropicalWeightEnumerator.lean", "Catalog/FINAL/Applications/SmoothPoincare/SmoothPoincare.lean"], "prompt_length": 4038, "files_placed": 0, "status": "keep"}
{"timestamp": 1781606296.0717003, "experiment_id": "14435cc3", "concept_title": "Combinatorial species exponential generating functions as a tropical valuation profile bridge", "concept_domain": "Applications", "research_mode": "formalize", "quality": "partial", "quality_score": 0.6017600000000001, "catalog_references": ["Catalog/FINAL/Applications/CombinatorialSpecies.lean"], "prompt_length": 17655, "files_placed": 7, "status": "keep"}
{"timestamp": 1781606355.9381046, "experiment_id": "d6329d46", "concept_title": "Deepening: Functor from finite linear codes to tropical valuation objects via weight-thresh", "concept_domain": "Shared", "research_mode": "team", "quality": "substantial", "quality_score": 0.7918400000000001, "catalog_references": [], "prompt_length": 18157, "files_placed": 6, "status": "keep"}
{"timestamp": 1781606381.5589771, "experiment_id": "c3d42768", "concept_title": "Korselt criterion completion and Carmichael divisor-lattice tropical flatness", "concept_domain": "Shared", "research_mode": "formalize", "quality": "partial", "quality_score": 0.57488, "catalog_references": ["Catalog/FINAL/", "Catalog/Bridges/"], "prompt_length": 2441, "files_placed": 0, "status": "keep"}
{"timestamp": 1781606948.7517014, "experiment_id": "bfb62bb9", "concept_title": "These conjectures extend `Catalog/Bridges/CodeThresholdValuation.lean`, which bu", "concept_domain": "Novelty", "research_mode": "formalize", "quality": "partial", "quality_score": 0.5236521220159152, "catalog_references": ["Catalog/Bridges/CodeThresholdValuation.lean"], "prompt_length": 3451, "files_placed": 0, "status": "keep"}
{"timestamp": 1781609117.341128, "experiment_id": "2ec4044e", "concept_title": "Tropicalized binary weight enumerator profile from Smooth Poincar\u00e9 code primitives", "concept_domain": "Applications", "research_mode": "formalize", "quality": "partial", "quality_score": 0.5527085714285715, "catalog_references": ["Catalog/Applications/SmoothPoincare/CodeDirectSum.lean"], "prompt_length": 2931, "files_placed": 0, "status": "keep"}
{"timestamp": 1781609157.5193539, "experiment_id": "ce2d79fb", "concept_title": "These directions continue the Vietoris\u2013Rips \u2194 tropical valuation program now", "concept_domain": "Geometry", "research_mode": "formalize", "quality": "partial", "quality_score": 0.46699999999999997, "catalog_references": ["Catalog/FINAL/"], "prompt_length": 17890, "files_placed": 5, "status": "discard"}
{"timestamp": 1781614363.303017, "experiment_id": "a0dd96a5", "concept_title": "These conjectures continue the research cycle begun in", "concept_domain": "Combinatorics", "research_mode": "formalize", "quality": "partial", "quality_score": 0.5271458702064897, "catalog_references": ["Catalog/FINAL/LinearAlgebra/", "Catalog/LinearAlgebra/MetricFiltrationRankProfilesCore.lean"], "prompt_length": 2833, "files_placed": 0, "status": "keep"}
{"timestamp": 1781614395.27961, "experiment_id": "16e95997", "concept_title": "Speculative: Computational Complexity as Physical Law", "concept_domain": "Physics", "research_mode": "formalize", "quality": "partial", "quality_score": 0.5482400000000001, "catalog_references": ["Catalog/FINAL/FibonacciEntryPoint.lean"], "prompt_length": 3478, "files_placed": 0, "status": "keep"}
{"timestamp": 1781616486.9722874, "experiment_id": "3b102b1d", "concept_title": "Deepening: `Catalog/Bridges/FunctorialTropicalPythagorean.lean` (0 sorr", "concept_domain": "Probability", "research_mode": "team", "quality": "substantial", "quality_score": 0.7943200000000001, "catalog_references": [], "prompt_length": 18151, "files_placed": 7, "status": "keep"}
{"timestamp": 1781622220.974152, "experiment_id": "6fe73404", "concept_title": "Proofs as DAGs: The Directed Acyclic Graph Structure of Mathematics", "concept_domain": "Applications", "research_mode": "sorry_fill", "quality": "partial", "quality_score": 0.49388999999999994, "catalog_references": ["Applications/ProofDAG/ChainBound.lean"], "prompt_length": 2320, "files_placed": 0, "status": "discard"}
{"timestamp": 1781622252.5766242, "experiment_id": "7e82348b", "concept_title": "The Mandelbrot Set's Secret Number Theory: Quadratic Recurrence and Primality", "concept_domain": "Tropical", "research_mode": "formalize", "quality": "partial", "quality_score": 0.44762947252747254, "catalog_references": ["Catalog/Algebra/ThresholdProfile.lean"], "prompt_length": 2620, "files_placed": 0, "status": "discard"}
{"timestamp": 1781624476.1793804, "experiment_id": "fba6400c", "concept_title": "The Borsuk-Ulam Theorem Implies Arrow's Impossibility: Social Choice Is Topology", "concept_domain": "Computation", "research_mode": "team", "quality": "partial", "quality_score": 0.64064, "catalog_references": [], "prompt_length": 18926, "files_placed": 6, "status": "keep"}
{"timestamp": 1781624508.9942803, "experiment_id": "ecc79db8", "concept_title": "Integrated Information via Tensor Networks", "concept_domain": "Physics", "research_mode": "formalize", "quality": "partial", "quality_score": 0.4986900000000001, "catalog_references": ["Catalog/FINAL/Computation/Kolmogorov/Basic.lean", "Catalog/FINAL/Computation/Boolean/BoolVector.lean"], "prompt_length": 3041, "files_placed": 0, "status": "discard"}
{"timestamp": 1781624530.011346, "experiment_id": "1ad32e9c", "concept_title": "Tropical Fermat's Last Theorem", "concept_domain": "Tropical", "research_mode": "formalize", "quality": "partial", "quality_score": 0.4733421090909091, "catalog_references": ["Catalog/FINAL/"], "prompt_length": 2998, "files_placed": 0, "status": "discard"}
{"timestamp": 1781626698.1158519, "experiment_id": "0d42792c", "concept_title": "Diophantine Approximation on Neural Networks: How Well Can ReLU Approximate Pi?", "concept_domain": "Tropical", "research_mode": "formalize", "quality": "partial", "quality_score": 0.5761099999999999, "catalog_references": ["Catalog/Bridges/EulerianTrailParity.lean"], "prompt_length": 16060, "files_placed": 5, "status": "keep"}
{"timestamp": 1781628879.537536, "experiment_id": "e49c5ee1", "concept_title": "Information-Theoretic Limits of Proof Search: How Hard Is It to Find a Lean Proof?", "concept_domain": "Computation", "research_mode": "formalize", "quality": "partial", "quality_score": 0.48378234883720933, "catalog_references": ["Catalog/FINAL/Computation", "Catalog/FINAL/Finite", "Catalog/FINAL/Cardinality"], "prompt_length": 3592, "files_placed": 0, "status": "discard"}
{"timestamp": 1781628932.6299813, "experiment_id": "d79ba9e2", "concept_title": "Isogeny-Based Cryptography: CSI-FiSh", "concept_domain": "Cryptography", "research_mode": "formalize", "quality": "partial", "quality_score": 0.66144, "catalog_references": ["Catalog/FINAL/"], "prompt_length": 16229, "files_placed": 5, "status": "keep"}
{"timestamp": 1781630952.293329, "experiment_id": "24a3af22", "concept_title": "Speculative: Category Theory as the DNA of Mathematics", "concept_domain": "Tropical", "research_mode": "formalize", "quality": "partial", "quality_score": 0.606, "catalog_references": ["Catalog/FINAL/"], "prompt_length": 18083, "files_placed": 2, "status": "keep"}
{"timestamp": 1781633137.0680254, "experiment_id": "eef6f30f", "concept_title": "Speculative: Mathematics as an Evolving Ecosystem", "concept_domain": "Novelty", "research_mode": "formalize", "quality": "partial", "quality_score": 0.5167481481481482, "catalog_references": ["Catalog/FINAL/", "Catalog/Novelty/EcosystemEquilibrium.lean"], "prompt_length": 2895, "files_placed": 0, "status": "keep"}
{"timestamp": 1781639437.796251, "experiment_id": "c2c261ee", "concept_title": "EML Special Functions: Gamma, Zeta, and Hypergeometric", "concept_domain": "Applications", "research_mode": "formalize", "quality": "partial", "quality_score": 0.42100000000000004, "catalog_references": ["Catalog/FINAL/"], "prompt_length": 2785, "files_placed": 0, "status": "discard"}
{"timestamp": 1781639474.4894414, "experiment_id": "fbd73212", "concept_title": "EML Single Operator Church-Turing Thesis", "concept_domain": "Applications", "research_mode": "team", "quality": "substantial", "quality_score": 0.7150400000000001, "catalog_references": [], "prompt_length": 18045, "files_placed": 8, "status": "keep"}
{"timestamp": 1781641650.1689987, "experiment_id": "1f4bbef7", "concept_title": "Automatic Sequences and the Halting Problem: When Is a Sequence Computable?", "concept_domain": "MachineLearning", "research_mode": "formalize", "quality": "substantial", "quality_score": 0.712, "catalog_references": ["Catalog/FINAL/Computation/", "Catalog/FINAL/Foundations/", "Catalog/FINAL/DiscreteMath/"], "prompt_length": 19156, "files_placed": 5, "status": "keep"}
{"timestamp": 1781641671.4574177, "experiment_id": "c1948da4", "concept_title": "Cellular Automata at the Ordinals: Transfinite Computation", "concept_domain": "Shared", "research_mode": "formalize", "quality": "partial", "quality_score": 0.6361600000000001, "catalog_references": ["Catalog/FINAL/Computation/FiniteStateAutomata.lean", "Catalog/FINAL/Order/MonotoneBoolean.lean", "Catalog/FINAL/Logic/BoolOrderLemmas.lean"], "prompt_length": 16856, "files_placed": 5, "status": "keep"}
{"timestamp": 1781641726.7629156, "experiment_id": "03edad6d", "concept_title": "Infinite-Dimensional Chess: Winning on the Hilbert Board", "concept_domain": "Logic", "research_mode": "formalize", "quality": "partial", "quality_score": 0.5057485714285714, "catalog_references": ["Catalog/FINAL/EML/SingleOperatorCompilation.lean"], "prompt_length": 1939, "files_placed": 0, "status": "keep"}
{"timestamp": 1781643929.1368196, "experiment_id": "8dbe2c7e", "concept_title": "Zombies and Qualia: Mathematics of Subjective Experience", "concept_domain": "MachineLearning", "research_mode": "formalize", "quality": "partial", "quality_score": 0.4249618181818182, "catalog_references": ["Catalog/FINAL/Combinatorics/Basic.lean"], "prompt_length": 2632, "files_placed": 0, "status": "discard"}
{"timestamp": 1781649366.1687822, "experiment_id": "fb007c35", "concept_title": "The Periodic Table of Finite Groups: Chemistry Meets Algebra", "concept_domain": "Novelty", "research_mode": "sorry_fill", "quality": "partial", "quality_score": 0.48464, "catalog_references": [], "prompt_length": 2870, "files_placed": 0, "status": "discard"}
{"timestamp": 1781653679.3714545, "experiment_id": "1aac4615", "concept_title": "Spectral Graph Theory Meets Network Robustness", "concept_domain": "MachineLearning", "research_mode": "formalize", "quality": "partial", "quality_score": 0.4180994484848485, "catalog_references": ["Mathlib/Combinatorics/SimpleGraph/LapMatrix.lean", "Mathlib/Combinatorics/SimpleGraph/Basic.lean", "Mathlib/Data/Sym2.lean", "Mathlib/LinearAlgebra/Matrix.lean", "Mathlib/Algebra/BigOperators/Ring.lean"], "prompt_length": 2464, "files_placed": 0, "status": "discard"}
{"timestamp": 1781653745.7078395, "experiment_id": "14986cd2", "concept_title": "Time Travel Consistency: Novikov's Principle as a Fixed-Point Theorem", "concept_domain": "Computation", "research_mode": "formalize", "quality": "partial", "quality_score": 0.36975260000000004, "catalog_references": ["Catalog/FINAL/Topology/", "Catalog/FINAL/Analysis/"], "prompt_length": 3681, "files_placed": 0, "status": "discard"}
{"timestamp": 1781656171.3997166, "experiment_id": "b4a517d3", "concept_title": "Self-Modifying Code That Cannot Be Stopped", "concept_domain": "Geometry", "research_mode": "formalize", "quality": "partial", "quality_score": 0.42858307692307696, "catalog_references": [], "prompt_length": 3314, "files_placed": 0, "status": "discard"}
{"timestamp": 1781656261.4841251, "experiment_id": "5f9a16a6", "concept_title": "The Topology of Argumentation: Why Debates Have Holes", "concept_domain": "Novelty", "research_mode": "formalize", "quality": "partial", "quality_score": 0.40688965517241377, "catalog_references": ["Combinatorics/SimpleGraph/Basic.lean", "Combinatorics/SimpleGraph/IndependentSet.lean", "Data/Set/Basic.lean", "Data/Fin/Basic.lean"], "prompt_length": 3110, "files_placed": 0, "status": "discard"}
{"timestamp": 1781658385.5307705, "experiment_id": "d1b34dda", "concept_title": "Speculative: Ramanujan-Style Intuition as Formalizable Meta-Reasoning", "concept_domain": "Cryptography", "research_mode": "prove", "quality": "partial", "quality_score": 0.46740400000000004, "catalog_references": ["Catalog/FINAL/"], "prompt_length": 3846, "files_placed": 0, "status": "discard"}
{"timestamp": 1781660436.574725, "experiment_id": "ed805c6d", "concept_title": "Gravity from Information: Spacetime as a Quantum Error-Correcting Code", "concept_domain": "Geometry", "research_mode": "formalize", "quality": "partial", "quality_score": 0.4728086269230769, "catalog_references": ["Catalog/FINAL/"], "prompt_length": 2360, "files_placed": 0, "status": "discard"}
{"timestamp": 1781660678.4327936, "experiment_id": "702894c4", "concept_title": "Speculative: Proof Complexity and Thermodynamic Cost", "concept_domain": "Novelty", "research_mode": "prove", "quality": "partial", "quality_score": 0.4263405714285714, "catalog_references": ["Bridges/ProofEntropy.lean"], "prompt_length": 1805, "files_placed": 0, "status": "discard"}
{"timestamp": 1781661756.434331, "experiment_id": "2d22ac65", "concept_title": "Speculative: Topological Data Analysis of Theorem Networks", "concept_domain": "Tropical", "research_mode": "sorry_fill", "quality": "partial", "quality_score": 0.5060211363636364, "catalog_references": ["Catalog/FINAL/Tropical", "Catalog/FINAL/Topology", "Catalog/FINAL/Convexity"], "prompt_length": 18076, "files_placed": 8, "status": "keep"}
{"timestamp": 1781668674.8310688, "experiment_id": "1873f003", "concept_title": "Tangled Hierarchies: Proof Systems That Reference Their Own Soundness", "concept_domain": "Geometry", "research_mode": "formalize", "quality": "partial", "quality_score": 0.4749530303030304, "catalog_references": ["Combinatorics/SimpleGraph/Basic.lean", "Data/Finset/Basic.lean"], "prompt_length": 15597, "files_placed": 5, "status": "discard"}
{"timestamp": 1781670750.6540256, "experiment_id": "29ffc67c", "concept_title": "Vampire Numbers and Other Numerical Monsters: A Bestiary of Arithmetic Oddities", "concept_domain": "Bridges", "research_mode": "formalize", "quality": "partial", "quality_score": 0.5227499999999999, "catalog_references": [], "prompt_length": 14826, "files_placed": 4, "status": "keep"}
{"timestamp": 1781672676.6089113, "experiment_id": "1cfdf3f4", "concept_title": "Causal Loops in Category Theory: When Composition Loops Back", "concept_domain": "Physics", "research_mode": "formalize", "quality": "partial", "quality_score": 0.6660400000000001, "catalog_references": ["Catalog/FINAL/", "Algebra/", "CategoryTheory/"], "prompt_length": 15415, "files_placed": 5, "status": "keep"}
{"timestamp": 1781674871.2613506, "experiment_id": "78c9ab60", "concept_title": "Non-Well-Founded Proofs: Proofs That Reference Themselves", "concept_domain": "Geometry", "research_mode": "formalize", "quality": "partial", "quality_score": 0.5606952380952381, "catalog_references": ["Catalog/FINAL/"], "prompt_length": 18843, "files_placed": 7, "status": "keep"}
{"timestamp": 1781674934.5925336, "experiment_id": "343c2db7", "concept_title": "Fractal Number Theory: Hausdorff Dimension of Prime Distributions", "concept_domain": "NumberTheory", "research_mode": "formalize", "quality": "partial", "quality_score": 0.5248201970443349, "catalog_references": ["NumberTheory/PrimeFractalLength.lean", "FINAL/"], "prompt_length": 19241, "files_placed": 6, "status": "keep"}
{"timestamp": 1781677079.132979, "experiment_id": "6fb69121", "concept_title": "The Hodge Conjecture for Neural Networks: Algebraic Cycles in Decision Surfaces", "concept_domain": "Bridges", "research_mode": "formalize", "quality": "partial", "quality_score": 0.5415809756097562, "catalog_references": ["Bridges/HodgeEPolynomial.lean"], "prompt_length": 18908, "files_placed": 5, "status": "keep"}
{"timestamp": 1781679225.4649239, "experiment_id": "63fd3989", "concept_title": "The Category Theory of Jokes: Universal Properties of Humor", "concept_domain": "Computation", "research_mode": "formalize", "quality": "partial", "quality_score": 0.2995240857142857, "catalog_references": ["Catalog/FINAL/Algebra/", "Catalog/FINAL/Foundations/", "Catalog/Algebra/"], "prompt_length": 2715, "files_placed": 0, "status": "discard"}
{"timestamp": 1781681489.6789227, "experiment_id": "11262eec", "concept_title": "Paradoxes as Theorems: Liar, Berry, and Russell Made Consistent", "concept_domain": "Computation", "research_mode": "formalize", "quality": "partial", "quality_score": 0.5355679086538463, "catalog_references": ["Catalog/FINAL/Geometry/", "Catalog/FINAL/Computation/"], "prompt_length": 17959, "files_placed": 5, "status": "keep"}
