{"timestamp": 1784194412.846496, "experiment_id": "851ec568", "concept_title": "ArXiv paper: A few remarks on the Baez-Duarte Criterion", "concept_domain": "Novelty", "research_mode": "team", "quality": "partial", "quality_score": 0.68, "catalog_references": [], "prompt_length": 3298, "files_placed": 0, "status": "keep"}
{"timestamp": 1784197327.7004006, "experiment_id": "08676759", "concept_title": "ArXiv paper: Polynomial-Time Evaluation of Aardal-Lenstra Denumerants via Constant Term Method", "concept_domain": "Applications", "research_mode": "team", "quality": "partial", "quality_score": 0.69, "catalog_references": [], "prompt_length": 12055, "files_placed": 1, "status": "keep"}
{"timestamp": 1784197337.1088934, "experiment_id": "5759ba2d", "concept_title": "ArXiv paper: The chromatic number of 3-stable Kneser graphs", "concept_domain": "Novelty", "research_mode": "team", "quality": "substantial", "quality_score": 0.72, "catalog_references": [], "prompt_length": 23962, "files_placed": 1, "status": "keep"}
{"timestamp": 1784198288.1981838, "experiment_id": "d1512647", "concept_title": "ArXiv paper: A 64-Rectangle Counterexample to Wegner's Conjecture and LP Gaps up to $5/2$", "concept_domain": "Applications", "research_mode": "team", "quality": "substantial", "quality_score": 0.71, "catalog_references": [], "prompt_length": 24679, "files_placed": 1, "status": "keep"}
{"timestamp": 1784198291.8725398, "experiment_id": "dd61fafb", "concept_title": "ArXiv paper: Improving Upper Bounds for the Maximum Clique Problem using Reduction Rules", "concept_domain": "Applications", "research_mode": "team", "quality": "substantial", "quality_score": 0.73, "catalog_references": [], "prompt_length": 20160, "files_placed": 1, "status": "keep"}
{"timestamp": 1784267869.059822, "experiment_id": "57f0b740", "concept_title": "Phantom Topologies: Spaces That Change When You Look at Them", "concept_domain": "Logic", "research_mode": "team", "quality": "substantial", "quality_score": 0.75, "catalog_references": [], "prompt_length": 25024, "files_placed": 4, "status": "keep"}
{"timestamp": 1784268827.1149244, "experiment_id": "16941ff7", "concept_title": "Escher Staircases in Algebra: Infinite Ascending Chains That Loop Back", "concept_domain": "Novelty", "research_mode": "team", "quality": "substantial", "quality_score": 0.75, "catalog_references": [], "prompt_length": 25288, "files_placed": 7, "status": "keep"}
{"timestamp": 1784268835.2024782, "experiment_id": "e2a481c0", "concept_title": "ArXiv paper: Contractions and applications of crystal skeletons: Young quasisymmetric and Stanley symmetric functions", "concept_domain": "Probability", "research_mode": "team", "quality": "partial", "quality_score": 0.65, "catalog_references": [], "prompt_length": 23791, "files_placed": 8, "status": "keep"}
{"timestamp": 1784274522.140329, "experiment_id": "fe20b520", "concept_title": "ArXiv paper: Limit laws for component-pruned sparse random graphs and percolated tori", "concept_domain": "Applications", "research_mode": "team", "quality": "partial", "quality_score": 0.6, "catalog_references": [], "prompt_length": 25157, "files_placed": 5, "status": "keep"}
{"timestamp": 1784274526.3292418, "experiment_id": "18617733", "concept_title": "Vampire Numbers and Other Numerical Monsters: A Bestiary of Arithmetic Oddities", "concept_domain": "Physics", "research_mode": "team", "quality": "substantial", "quality_score": 0.73, "catalog_references": [], "prompt_length": 24813, "files_placed": 5, "status": "keep"}
{"timestamp": 1784275476.7516003, "experiment_id": "a6705a36", "concept_title": "The Library of Babel: Combinatorics of the Universal Library", "concept_domain": "Bridges", "research_mode": "team", "quality": "substantial", "quality_score": 0.78, "catalog_references": [], "prompt_length": 25279, "files_placed": 5, "status": "keep"}
{"timestamp": 1784277355.8627434, "experiment_id": "6da0544e", "concept_title": "ArXiv paper: Record compositions of alternating permutations and noncommutative symmetric functions", "concept_domain": "Novelty", "research_mode": "team", "quality": "partial", "quality_score": 0.65, "catalog_references": [], "prompt_length": 24186, "files_placed": 5, "status": "keep"}
{"timestamp": 1784277359.7743835, "experiment_id": "3c755fa4", "concept_title": "Hyperbolic Number Theory: Arithmetic on the Poincar\u00e9 Disk", "concept_domain": "Combinatorics", "research_mode": "team", "quality": "substantial", "quality_score": 0.73, "catalog_references": [], "prompt_length": 23978, "files_placed": 4, "status": "keep"}
{"timestamp": 1784277376.7988124, "experiment_id": "322b88bd", "concept_title": "Zero-Knowledge Theorem Proving: I Can Prove Fermat's Last Theorem Without Showing You the Proof", "concept_domain": "Geometry", "research_mode": "team", "quality": "substantial", "quality_score": 0.7, "catalog_references": [], "prompt_length": 21407, "files_placed": 4, "status": "keep"}
{"timestamp": 1784279287.850309, "experiment_id": "463376b0", "concept_title": "Quantum Surreal Numbers: Superposition of All Real Numbers", "concept_domain": "NumberTheory", "research_mode": "team", "quality": "partial", "quality_score": 0.66, "catalog_references": [], "prompt_length": 25301, "files_placed": 8, "status": "keep"}
{"timestamp": 1784280250.8604038, "experiment_id": "47f9b94d", "concept_title": "Escher Staircases in Algebra: Infinite Ascending Chains That Loop Back", "concept_domain": "Computation", "research_mode": "team", "quality": "substantial", "quality_score": 0.78, "catalog_references": [], "prompt_length": 25296, "files_placed": 7, "status": "keep"}
{"timestamp": 1784281203.5815105, "experiment_id": "bcfc30de", "concept_title": "Non-Well-Founded Proofs: Proofs That Reference Themselves", "concept_domain": "Cryptography", "research_mode": "team", "quality": "substantial", "quality_score": 0.72, "catalog_references": [], "prompt_length": 25217, "files_placed": 6, "status": "keep"}
{"timestamp": 1784287953.401326, "experiment_id": "f0c4ce45", "concept_title": "The Anti-Fibonacci Sequence: Numbers That Avoid the Golden Ratio at All Costs", "concept_domain": "Bridges", "research_mode": "team", "quality": "partial", "quality_score": 0.68, "catalog_references": [], "prompt_length": 24991, "files_placed": 5, "status": "keep"}
{"timestamp": 1784289006.1874106, "experiment_id": "408bb225", "concept_title": "The Mathematics of Deja Vu: Fixed Points in Consciousness and Cognition", "concept_domain": "Tropical", "research_mode": "team", "quality": "substantial", "quality_score": 0.76, "catalog_references": [], "prompt_length": 23767, "files_placed": 4, "status": "keep"}
{"timestamp": 1784289023.731549, "experiment_id": "5f139cd0", "concept_title": "Zero-Knowledge Theorem Proving: I Can Prove Fermat's Last Theorem Without Showing You the Proof", "concept_domain": "Applications", "research_mode": "team", "quality": "substantial", "quality_score": 0.71, "catalog_references": [], "prompt_length": 25201, "files_placed": 11, "status": "keep"}
{"timestamp": 1784290058.891545, "experiment_id": "535698fb", "concept_title": "Hyperbolic Number Theory: Arithmetic on the Poincar\u00e9 Disk", "concept_domain": "Applications", "research_mode": "team", "quality": "partial", "quality_score": 0.66, "catalog_references": [], "prompt_length": 24904, "files_placed": 7, "status": "keep"}
{"timestamp": 1784290063.9320498, "experiment_id": "ad5825e2", "concept_title": "The Periodic Table of Finite Groups: Chemistry Meets Algebra", "concept_domain": "MachineLearning", "research_mode": "team", "quality": "substantial", "quality_score": 0.71, "catalog_references": [], "prompt_length": 23248, "files_placed": 5, "status": "keep"}
{"timestamp": 1784293936.0087452, "experiment_id": "8b90ccda", "concept_title": "ArXiv paper: Generalizations of nets and Latin squares", "concept_domain": "MachineLearning", "research_mode": "team", "quality": "partial", "quality_score": 0.69, "catalog_references": [], "prompt_length": 23903, "files_placed": 4, "status": "keep"}
{"timestamp": 1784294956.2721465, "experiment_id": "d1663b23", "concept_title": "ArXiv paper: A minimal modularity lifting theorem for Siegel modular forms", "concept_domain": "Applications", "research_mode": "team", "quality": "substantial", "quality_score": 0.7, "catalog_references": [], "prompt_length": 24781, "files_placed": 8, "status": "keep"}
{"timestamp": 1784294961.1333153, "experiment_id": "dcd7a4b2", "concept_title": "Quantum Surreal Numbers: Superposition of All Real Numbers", "concept_domain": "Tropical", "research_mode": "team", "quality": "substantial", "quality_score": 0.75, "catalog_references": [], "prompt_length": 25293, "files_placed": 8, "status": "keep"}
{"timestamp": 1784295951.7680573, "experiment_id": "87b73bf0", "concept_title": "The Sound of Pi: Musical Structure in Transcendental Constants", "concept_domain": "Shared", "research_mode": "team", "quality": "substantial", "quality_score": 0.72, "catalog_references": [], "prompt_length": 23145, "files_placed": 4, "status": "keep"}
{"timestamp": 1784296983.6902585, "experiment_id": "186c9eac", "concept_title": "Dark Mathematics: Theorems That Exist But Cannot Be Found", "concept_domain": "Shared", "research_mode": "team", "quality": "partial", "quality_score": 0.68, "catalog_references": [], "prompt_length": 25166, "files_placed": 10, "status": "keep"}
{"timestamp": 1784311413.0034876, "experiment_id": "0daa61af", "concept_title": "Holographic Primes: The Prime Number AdS/CFT Correspondence", "concept_domain": "Tropical", "research_mode": "team", "quality": "substantial", "quality_score": 0.72, "catalog_references": [], "prompt_length": 25349, "files_placed": 8, "status": "keep"}
{"timestamp": 1784311458.96474, "experiment_id": "1003d095", "concept_title": "Zero-Knowledge Theorem Proving: I Can Prove Fermat's Last Theorem Without Showing You the Proof", "concept_domain": "Applications", "research_mode": "team", "quality": "substantial", "quality_score": 0.74, "catalog_references": [], "prompt_length": 25201, "files_placed": 11, "status": "keep"}
{"timestamp": 1784312530.3132923, "experiment_id": "5102d77c", "concept_title": "The Mathematics of Deja Vu: Fixed Points in Consciousness and Cognition", "concept_domain": "Applications", "research_mode": "team", "quality": "partial", "quality_score": 0.67, "catalog_references": [], "prompt_length": 12655, "files_placed": 5, "status": "keep"}
{"timestamp": 1784335355.3982303, "experiment_id": "9f14a31b", "concept_title": "The Sound of Pi: Musical Structure in Transcendental Constants", "concept_domain": "Applications", "research_mode": "team", "quality": "partial", "quality_score": 0.6, "catalog_references": [], "prompt_length": 5380, "files_placed": 12, "status": "keep"}
{"timestamp": 1784335366.4977107, "experiment_id": "dfbea393", "concept_title": "Quantum Surreal Numbers: Superposition of All Real Numbers", "concept_domain": "Algebra", "research_mode": "team", "quality": "substantial", "quality_score": 0.71, "catalog_references": [], "prompt_length": 25291, "files_placed": 9, "status": "keep"}
{"timestamp": 1784336391.1721988, "experiment_id": "0f8a1331", "concept_title": "Hyperbolic Number Theory: Arithmetic on the Poincar\u00e9 Disk", "concept_domain": "Novelty", "research_mode": "team", "quality": "partial", "quality_score": 0.67, "catalog_references": [], "prompt_length": 4820, "files_placed": 6, "status": "keep"}
{"timestamp": 1784337395.9063058, "experiment_id": "406a341d", "concept_title": "Escher Staircases in Algebra: Infinite Ascending Chains That Loop Back", "concept_domain": "Pythagorean", "research_mode": "team", "quality": "partial", "quality_score": 0.63, "catalog_references": [], "prompt_length": 5573, "files_placed": 8, "status": "keep"}
{"timestamp": 1784337403.6679955, "experiment_id": "1992c474", "concept_title": "Holographic Primes: The Prime Number AdS/CFT Correspondence", "concept_domain": "Algebra", "research_mode": "team", "quality": "partial", "quality_score": 0.59, "catalog_references": [], "prompt_length": 5663, "files_placed": 8, "status": "keep"}
{"timestamp": 1784342843.8063555, "experiment_id": "e1956901", "concept_title": "The Unreasonable Effectiveness of the Number 163", "concept_domain": "Novelty", "research_mode": "team", "quality": "partial", "quality_score": 0.61, "catalog_references": [], "prompt_length": 5595, "files_placed": 2, "status": "keep"}
{"timestamp": 1784344959.9537227, "experiment_id": "fe36a9a3", "concept_title": "The Periodic Table of Finite Groups: Chemistry Meets Algebra", "concept_domain": "Bridges", "research_mode": "team", "quality": "partial", "quality_score": 0.66, "catalog_references": [], "prompt_length": 12746, "files_placed": 7, "status": "keep"}
{"timestamp": 1784344973.0883298, "experiment_id": "d69a2aa8", "concept_title": "Tropical Cryptocurrency: Mining on the Min-Plus Semiring", "concept_domain": "Algebra", "research_mode": "team", "quality": "substantial", "quality_score": 0.79, "catalog_references": [], "prompt_length": 25290, "files_placed": 4, "status": "keep"}
{"timestamp": 1784346890.112881, "experiment_id": "5ae7f8c1", "concept_title": "Surreal Topology: What Topology Does the Field of Surreal Numbers Have?", "concept_domain": "Algebra", "research_mode": "team", "quality": "substantial", "quality_score": 0.85, "catalog_references": [], "prompt_length": 25327, "files_placed": 5, "status": "keep"}
{"timestamp": 1784346894.3990827, "experiment_id": "ee626e30", "concept_title": "Chaos as a Computable Shadow: The Shadowing Lemma for Real Programs", "concept_domain": "MachineLearning", "research_mode": "team", "quality": "substantial", "quality_score": 0.76, "catalog_references": [], "prompt_length": 25257, "files_placed": 9, "status": "keep"}
{"timestamp": 1784347861.1572056, "experiment_id": "ad1766b1", "concept_title": "Arithmetic on the Moebius Band: A Number System with a Twist", "concept_domain": "Novelty", "research_mode": "team", "quality": "substantial", "quality_score": 0.7, "catalog_references": [], "prompt_length": 25199, "files_placed": 9, "status": "keep"}
{"timestamp": 1784347883.6260467, "experiment_id": "f0aa5907", "concept_title": "The Monster Group's Secret Message: Moonshine Beyond the j-Function", "concept_domain": "MachineLearning", "research_mode": "team", "quality": "substantial", "quality_score": 0.73, "catalog_references": [], "prompt_length": 25230, "files_placed": 9, "status": "keep"}
{"timestamp": 1784348884.432699, "experiment_id": "f8479bcf", "concept_title": "Knots That Think: Cognition as Braiding in Category Theory", "concept_domain": "Combinatorics", "research_mode": "team", "quality": "partial", "quality_score": 0.59, "catalog_references": [], "prompt_length": 12536, "files_placed": 2, "status": "keep"}
{"timestamp": 1784353624.7068021, "experiment_id": "b01a1ab3", "concept_title": "Dark Mathematics: Theorems That Exist But Cannot Be Found", "concept_domain": "Tropical", "research_mode": "team", "quality": "partial", "quality_score": 0.66, "catalog_references": [], "prompt_length": 5545, "files_placed": 2, "status": "keep"}
{"timestamp": 1784354590.4588685, "experiment_id": "b6dab3a0", "concept_title": "The Mathematics of Memes: Viral Information Topology", "concept_domain": "Applications", "research_mode": "team", "quality": "partial", "quality_score": 0.64, "catalog_references": [], "prompt_length": 5734, "files_placed": 3, "status": "keep"}
{"timestamp": 1784355782.7815256, "experiment_id": "e9a483ed", "concept_title": "The L-Function Universe: A Cosmic Census of All L-Functions", "concept_domain": "Computation", "research_mode": "team", "quality": "substantial", "quality_score": 0.76, "catalog_references": [], "prompt_length": 25335, "files_placed": 5, "status": "keep"}
{"timestamp": 1784356782.656709, "experiment_id": "3aa7c983", "concept_title": "Impossibility Results for Fun: Things That Cannot Be Done (But We Try Anyway)", "concept_domain": "Physics", "research_mode": "team", "quality": "partial", "quality_score": 0.62, "catalog_references": [], "prompt_length": 6107, "files_placed": 2, "status": "keep"}
{"timestamp": 1784356795.5669792, "experiment_id": "e456357e", "concept_title": "The Anti-Fibonacci Sequence: Numbers That Avoid the Golden Ratio at All Costs", "concept_domain": "Shared", "research_mode": "team", "quality": "substantial", "quality_score": 0.7, "catalog_references": [], "prompt_length": 19036, "files_placed": 4, "status": "keep"}
{"timestamp": 1784357812.6047053, "experiment_id": "717f7483", "concept_title": "Godel's Casino: Incomplete but Winnable Games", "concept_domain": "NumberTheory", "research_mode": "team", "quality": "substantial", "quality_score": 0.75, "catalog_references": [], "prompt_length": 23400, "files_placed": 4, "status": "keep"}
{"timestamp": 1784359747.4237566, "experiment_id": "f0f3cf3d", "concept_title": "The Prime Number Crossword: Filling the Gaps in the Primes", "concept_domain": "Physics", "research_mode": "team", "quality": "partial", "quality_score": 0.56, "catalog_references": [], "prompt_length": 5875, "files_placed": 3, "status": "keep"}
{"timestamp": 1784359757.2809966, "experiment_id": "70b6aa60", "concept_title": "The L-Function Oracle: What If We Could Compute L-Functions Instantly?", "concept_domain": "Logic", "research_mode": "team", "quality": "substantial", "quality_score": 0.76, "catalog_references": [], "prompt_length": 25372, "files_placed": 9, "status": "keep"}
{"timestamp": 1784360724.7081785, "experiment_id": "60e00dda", "concept_title": "Tropical Dreams: The Field with One Element Meets Tropical Geometry", "concept_domain": "Applications", "research_mode": "team", "quality": "partial", "quality_score": 0.66, "catalog_references": [], "prompt_length": 5762, "files_placed": 3, "status": "keep"}
{"timestamp": 1784360734.05098, "experiment_id": "65eb2137", "concept_title": "Impossible Geometries: Where Parallel Lines Converge AND Diverge", "concept_domain": "Logic", "research_mode": "team", "quality": "substantial", "quality_score": 0.72, "catalog_references": [], "prompt_length": 23959, "files_placed": 5, "status": "keep"}
{"timestamp": 1784364548.3954916, "experiment_id": "f25f9735", "concept_title": "Gravity from Information: Spacetime as a Quantum Error-Correcting Code", "concept_domain": "Cryptography", "research_mode": "team", "quality": "substantial", "quality_score": 0.75, "catalog_references": [], "prompt_length": 25242, "files_placed": 6, "status": "keep"}
{"timestamp": 1784365518.1292498, "experiment_id": "71fc60c7", "concept_title": "Cellular Automata as Algebraic Geometry: Wolfram's Rules Meet Grothendieck", "concept_domain": "Applications", "research_mode": "team", "quality": "substantial", "quality_score": 0.75, "catalog_references": [], "prompt_length": 23603, "files_placed": 4, "status": "keep"}
{"timestamp": 1784366492.2406137, "experiment_id": "18410e31", "concept_title": "Fractal Dimension of Proof Search: How Hard Is It to Find a Proof?", "concept_domain": "Novelty", "research_mode": "team", "quality": "substantial", "quality_score": 0.77, "catalog_references": [], "prompt_length": 25059, "files_placed": 6, "status": "keep"}
{"timestamp": 1784366496.908872, "experiment_id": "f48abc37", "concept_title": "The Periodic Table Is a Lie: Elements as Eigenvalues of Spacetime", "concept_domain": "Cryptography", "research_mode": "team", "quality": "substantial", "quality_score": 0.7, "catalog_references": [], "prompt_length": 25322, "files_placed": 5, "status": "keep"}
{"timestamp": 1784367470.2350655, "experiment_id": "12b45ad4", "concept_title": "The P vs NP of Cooking: Computational Complexity of Recipes", "concept_domain": "Novelty", "research_mode": "team", "quality": "partial", "quality_score": 0.69, "catalog_references": [], "prompt_length": 5682, "files_placed": 5, "status": "keep"}
{"timestamp": 1784368465.3097131, "experiment_id": "c49f6946", "concept_title": "The Fundamental Theorem of Cakes: Algebraic Geometry of Baking", "concept_domain": "Probability", "research_mode": "team", "quality": "partial", "quality_score": 0.62, "catalog_references": [], "prompt_length": 5481, "files_placed": 2, "status": "keep"}
{"timestamp": 1784370115.7666237, "experiment_id": "c3aba433", "concept_title": "Ramanujan's Taxicab Number as a Sum of Three Cubes: 1729 Revisited", "concept_domain": "Novelty", "research_mode": "team", "quality": "partial", "quality_score": 0.68, "catalog_references": [], "prompt_length": 12569, "files_placed": 3, "status": "keep"}
{"timestamp": 1784370124.4813666, "experiment_id": "0ebc2749", "concept_title": "The Mandelbrot Set's Secret Number Theory: Quadratic Recurrence and Primality", "concept_domain": "NumberTheory", "research_mode": "team", "quality": "substantial", "quality_score": 0.77, "catalog_references": [], "prompt_length": 24445, "files_placed": 6, "status": "keep"}
{"timestamp": 1784370128.7042058, "experiment_id": "a7676cc9", "concept_title": "Infinite Chess: Checkmate in Omega Moves", "concept_domain": "Applications", "research_mode": "team", "quality": "substantial", "quality_score": 0.7, "catalog_references": [], "prompt_length": 24645, "files_placed": 5, "status": "keep"}
{"timestamp": 1784371159.685239, "experiment_id": "21c08839", "concept_title": "Self-Improving Proofs: Proofs That Get Simpler Over Time", "concept_domain": "Cryptography", "research_mode": "team", "quality": "substantial", "quality_score": 0.73, "catalog_references": [], "prompt_length": 25325, "files_placed": 10, "status": "keep"}
{"timestamp": 1784375976.7181103, "experiment_id": "d3ef6e43", "concept_title": "Langlands for Toddlers: Galois Groups as Shapes, Automorphic Forms as Colors", "concept_domain": "Probability", "research_mode": "team", "quality": "partial", "quality_score": 0.51, "catalog_references": [], "prompt_length": 5645, "files_placed": 3, "status": "keep"}
