{"timestamp": 1781254153.5618281, "experiment_id": "9149e836", "concept_title": "Close Proofs: For metrizable separable spaces, the small inductive dimension, large ", "concept_domain": "Novelty", "research_mode": "team", "quality": "partial", "quality_score": 0.48816000000000004, "catalog_references": [], "prompt_length": 11519, "files_placed": 0, "status": "discard"}
{"timestamp": 1781254859.8831794, "experiment_id": "52837143", "concept_title": "Close Proofs: Riemann Hypothesis", "concept_domain": "Applications", "research_mode": "team", "quality": "partial", "quality_score": 0.42020353658973525, "catalog_references": [], "prompt_length": 6019, "files_placed": 0, "status": "discard"}
{"timestamp": 1781256851.7261672, "experiment_id": "1f5be36f", "concept_title": "The current formalization establishes the structural machinery (definitions of S", "concept_domain": "Novelty", "research_mode": "team", "quality": "partial", "quality_score": 0.6881600000000001, "catalog_references": [], "prompt_length": 23169, "files_placed": 9, "status": "keep"}
{"timestamp": 1781256871.9252574, "experiment_id": "c508c412", "concept_title": "Close Proofs: This cycle isolated the *arithmetic core* of Cobham's theorem (1972) \u2014", "concept_domain": "Applications", "research_mode": "team", "quality": "partial", "quality_score": 0.4453462700360554, "catalog_references": [], "prompt_length": 17655, "files_placed": 9, "status": "discard"}
{"timestamp": 1781256890.2483377, "experiment_id": "bc5a47bb", "concept_title": "Close Proofs: The file `Basic.lean` establishes a fully formal, axiom-clean depth-se", "concept_domain": "Novelty", "research_mode": "team", "quality": "partial", "quality_score": 0.6913777777777779, "catalog_references": [], "prompt_length": 17647, "files_placed": 5, "status": "keep"}
{"timestamp": 1781256918.6941595, "experiment_id": "216ef674", "concept_title": "Self-Referential Type Theory: Proofs That Modify Their Own Specifications", "concept_domain": "Applications", "research_mode": "team", "quality": "partial", "quality_score": 0.43789705882352936, "catalog_references": [], "prompt_length": 8326, "files_placed": 0, "status": "discard"}
{"timestamp": 1781256974.519205, "experiment_id": "cadf8fd4", "concept_title": "Quantum Gravity as Topological Quantum Field Theory", "concept_domain": "Novelty", "research_mode": "team", "quality": "partial", "quality_score": 0.3884790879127465, "catalog_references": [], "prompt_length": 5846, "files_placed": 0, "status": "discard"}
{"timestamp": 1781256998.5397635, "experiment_id": "7c9d6e00", "concept_title": "Close Proofs: The file `Cryptography/UniqueGamesMaxCut.lean` formalizes the combinat", "concept_domain": "Novelty", "research_mode": "team", "quality": "partial", "quality_score": 0.420615787816963, "catalog_references": [], "prompt_length": 6061, "files_placed": 0, "status": "discard"}
{"timestamp": 1781257024.003742, "experiment_id": "6bdb3b33", "concept_title": "Close Proofs: This cycle took the catalog's well-developed theory of the Fibonacci *", "concept_domain": "Novelty", "research_mode": "team", "quality": "partial", "quality_score": 0.39259304787206045, "catalog_references": [], "prompt_length": 6128, "files_placed": 0, "status": "discard"}
{"timestamp": 1781259028.5006425, "experiment_id": "c64724db", "concept_title": "Close Proofs: Bridge: Stone Duality as a Bridge Between Logic and Topology", "concept_domain": "Applications", "research_mode": "team", "quality": "partial", "quality_score": 0.6744679245283018, "catalog_references": [], "prompt_length": 17653, "files_placed": 6, "status": "keep"}
{"timestamp": 1781259054.186584, "experiment_id": "402dac72", "concept_title": "Rigorous formal foundations for the Collatz conj", "concept_domain": "Applications", "research_mode": "team", "quality": "partial", "quality_score": 0.4422962891379977, "catalog_references": [], "prompt_length": 27859, "files_placed": 6, "status": "discard"}
{"timestamp": 1781259123.4162898, "experiment_id": "3877a50a", "concept_title": "Willmore Conjecture Generalizations", "concept_domain": "Applications", "research_mode": "team", "quality": "partial", "quality_score": 0.42156790768738783, "catalog_references": [], "prompt_length": 10962, "files_placed": 0, "status": "discard"}
{"timestamp": 1781259150.2482276, "experiment_id": "e038e3ff", "concept_title": "Close Proofs: Rigorous formal framework for holographic proo", "concept_domain": "Applications", "research_mode": "team", "quality": "partial", "quality_score": 0.42155997050191446, "catalog_references": [], "prompt_length": 6065, "files_placed": 0, "status": "discard"}
{"timestamp": 1781261113.5561583, "experiment_id": "b18d987b", "concept_title": "Beal's Conjecture: Computational Evidence and Special Cases", "concept_domain": "Novelty", "research_mode": "team", "quality": "partial", "quality_score": 0.41944876347009086, "catalog_references": [], "prompt_length": 11188, "files_placed": 0, "status": "discard"}
{"timestamp": 1781261141.0555499, "experiment_id": "75a5a355", "concept_title": "Unique Games Conjecture", "concept_domain": "Applications", "research_mode": "team", "quality": "partial", "quality_score": 0.41946688292938294, "catalog_references": [], "prompt_length": 5728, "files_placed": 0, "status": "discard"}
{"timestamp": 1781261158.2185042, "experiment_id": "6f395b3c", "concept_title": "Close Proofs: The new file `Catalog/MachineLearning/PerturbedGeneralization.lean` br", "concept_domain": "Novelty", "research_mode": "team", "quality": "substantial", "quality_score": 0.7564252631578948, "catalog_references": [], "prompt_length": 17655, "files_placed": 7, "status": "keep"}
{"timestamp": 1781261181.970494, "experiment_id": "272f5326", "concept_title": "Close Proofs: Arithmetic Universality in Cellular Automata via p-adic Renormalizatio", "concept_domain": "Novelty", "research_mode": "team", "quality": "partial", "quality_score": 0.46680579704921854, "catalog_references": [], "prompt_length": 17647, "files_placed": 7, "status": "discard"}
{"timestamp": 1781261211.2936234, "experiment_id": "41d4e9fb", "concept_title": "Percolation Threshold", "concept_domain": "Novelty", "research_mode": "team", "quality": "partial", "quality_score": 0.38477189722785665, "catalog_references": [], "prompt_length": 5705, "files_placed": 0, "status": "discard"}
{"timestamp": 1781261242.4187064, "experiment_id": "a04d4f33", "concept_title": "This cycle reconstructed, on a fully self-contained Mathlib-only foundation, the", "concept_domain": "Applications", "research_mode": "team", "quality": "partial", "quality_score": 0.4509494623655914, "catalog_references": [], "prompt_length": 19897, "files_placed": 0, "status": "discard"}
{"timestamp": 1781263213.7339609, "experiment_id": "5eba8b79", "concept_title": "Information-Geometric Bridge: Fisher Metric on Statistical Manifolds", "concept_domain": "Applications", "research_mode": "team", "quality": "partial", "quality_score": 0.44270588997046284, "catalog_references": [], "prompt_length": 5833, "files_placed": 0, "status": "discard"}
{"timestamp": 1781263259.0178752, "experiment_id": "f6664d44", "concept_title": "The file `Tropical/MarkedModuli.lean` formalizes the combinatorial type `MarkedC", "concept_domain": "Applications", "research_mode": "team", "quality": "partial", "quality_score": 0.39147519379844964, "catalog_references": [], "prompt_length": 17160, "files_placed": 0, "status": "discard"}
{"timestamp": 1781263282.5487826, "experiment_id": "2c4359c4", "concept_title": "Deepening: The new file `Catalog/MachineLearning/PerturbedGeneralization.lean` br", "concept_domain": "Novelty", "research_mode": "team", "quality": "partial", "quality_score": 0.4866400000000001, "catalog_references": [], "prompt_length": 6527, "files_placed": 0, "status": "discard"}
{"timestamp": 1781263308.1364565, "experiment_id": "552e5752", "concept_title": "Close Proofs: Beal's Conjecture: Computational Evidence and Special Cases", "concept_domain": "Novelty", "research_mode": "team", "quality": "partial", "quality_score": 0.36654130055865924, "catalog_references": [], "prompt_length": 6119, "files_placed": 0, "status": "discard"}
{"timestamp": 1781265297.1229424, "experiment_id": "e636b64d", "concept_title": "Close Proofs: Tropical Hodge Theory", "concept_domain": "Novelty", "research_mode": "team", "quality": "partial", "quality_score": 0.45994068215521505, "catalog_references": [], "prompt_length": 6143, "files_placed": 0, "status": "discard"}
{"timestamp": 1781265338.634117, "experiment_id": "d18cb2aa", "concept_title": "Close Proofs: Close Proofs: Arithmetic Mirror Symmetry for Calabi-Yau", "concept_domain": "Applications", "research_mode": "team", "quality": "partial", "quality_score": 0.4537195986622074, "catalog_references": [], "prompt_length": 6188, "files_placed": 0, "status": "discard"}
{"timestamp": 1781265376.5771022, "experiment_id": "fa8b32e5", "concept_title": "Close Proofs: Willmore Conjecture Generalizations", "concept_domain": "Novelty", "research_mode": "team", "quality": "partial", "quality_score": 0.39154374264631936, "catalog_references": [], "prompt_length": 11352, "files_placed": 0, "status": "discard"}
{"timestamp": 1781265396.331975, "experiment_id": "4d172102", "concept_title": "Quantum Hamiltonian Complexity: QMA-Completeness of the Local Hamiltonian Problem", "concept_domain": "Applications", "research_mode": "team", "quality": "partial", "quality_score": 0.39123401715239203, "catalog_references": [], "prompt_length": 5892, "files_placed": 0, "status": "discard"}
{"timestamp": 1781265745.327224, "experiment_id": "8625cb36", "concept_title": "Close Proofs: Close Proofs: Formalized bridge between ReLU neural network decision", "concept_domain": "Applications", "research_mode": "team", "quality": "partial", "quality_score": 0.6064691302466465, "catalog_references": [], "prompt_length": 17661, "files_placed": 54, "status": "keep"}
{"timestamp": 1781265772.9335217, "experiment_id": "c6275cb2", "concept_title": "Neural Network Training as Renormalization Group Flow", "concept_domain": "Novelty", "research_mode": "team", "quality": "partial", "quality_score": 0.3922672204786535, "catalog_references": [], "prompt_length": 8011, "files_placed": 0, "status": "discard"}
{"timestamp": 1781265797.8629985, "experiment_id": "ddfe04a2", "concept_title": "Inverse Stereographic Cryptography: Projection as One-Way Function", "concept_domain": "Applications", "research_mode": "team", "quality": "partial", "quality_score": 0.392269783622777, "catalog_references": [], "prompt_length": 6484, "files_placed": 0, "status": "discard"}
{"timestamp": 1781265825.3100536, "experiment_id": "fe3051e8", "concept_title": "Shannon's theorem gives a lower bound |K| \u2265 |M| for perfect secrecy. The natural", "concept_domain": "Novelty", "research_mode": "team", "quality": "partial", "quality_score": 0.41620985361986607, "catalog_references": [], "prompt_length": 21921, "files_placed": 0, "status": "discard"}
{"timestamp": 1781267839.7553294, "experiment_id": "fcc1bc35", "concept_title": "Bridge: Information Geometry Connecting Statistics and Differential Geometry", "concept_domain": "Novelty", "research_mode": "team", "quality": "partial", "quality_score": 0.40828914607374056, "catalog_references": [], "prompt_length": 5979, "files_placed": 0, "status": "discard"}
{"timestamp": 1781267864.5576046, "experiment_id": "cdfb7c6a", "concept_title": "The Goldreich-Levin theorem states that for any one-way function f, the inner pr", "concept_domain": "Novelty", "research_mode": "team", "quality": "partial", "quality_score": 0.34828647058823536, "catalog_references": [], "prompt_length": 15457, "files_placed": 0, "status": "discard"}
{"timestamp": 1781267907.1821852, "experiment_id": "cb6dd4d6", "concept_title": "Post-Quantum Cryptography: Lattice-Based Key Exchange", "concept_domain": "Applications", "research_mode": "team", "quality": "partial", "quality_score": 0.391805945945946, "catalog_references": [], "prompt_length": 5937, "files_placed": 0, "status": "discard"}
{"timestamp": 1781267956.4847167, "experiment_id": "f6f4f47e", "concept_title": "Close Proofs: Shannon's theorem gives a lower bound |K| \u2265 |M| for perfect secrecy. T", "concept_domain": "Novelty", "research_mode": "team", "quality": "partial", "quality_score": 0.3936055172413794, "catalog_references": [], "prompt_length": 6240, "files_placed": 0, "status": "discard"}
{"timestamp": 1781269921.012407, "experiment_id": "9793ccf0", "concept_title": "The current framework establishes qualitative novelty certification (\u03b5-separatio", "concept_domain": "Applications", "research_mode": "team", "quality": "partial", "quality_score": 0.393814, "catalog_references": [], "prompt_length": 15101, "files_placed": 0, "status": "discard"}
{"timestamp": 1781269948.127532, "experiment_id": "b571fec8", "concept_title": "Entropy Power Inequality: Sharp Version", "concept_domain": "Applications", "research_mode": "team", "quality": "partial", "quality_score": 0.3945689855072464, "catalog_references": [], "prompt_length": 5592, "files_placed": 0, "status": "discard"}
{"timestamp": 1781269977.0175111, "experiment_id": "4a249f0b", "concept_title": "Close Proofs: File produced this cycle: `Catalog/Logic/OrdinalAnalysisBridge.lean`", "concept_domain": "Novelty", "research_mode": "team", "quality": "partial", "quality_score": 0.4042739804864254, "catalog_references": [], "prompt_length": 6071, "files_placed": 0, "status": "discard"}
{"timestamp": 1781269997.8421457, "experiment_id": "578b6877", "concept_title": "Close Proofs: This cycle replaced the softmax score `exp\u27e8q,k\u27e9` with th", "concept_domain": "Applications", "research_mode": "team", "quality": "partial", "quality_score": 0.4600000000000001, "catalog_references": [], "prompt_length": 17649, "files_placed": 7, "status": "discard"}
{"timestamp": 1781270017.0552952, "experiment_id": "97e15ee6", "concept_title": "The file `TropicalValuationLimitBridge.lean` formalizes the *easy half* of the F", "concept_domain": "Novelty", "research_mode": "team", "quality": "partial", "quality_score": 0.69648, "catalog_references": [], "prompt_length": 23547, "files_placed": 5, "status": "keep"}
{"timestamp": 1781272047.3664641, "experiment_id": "69f73c82", "concept_title": "The Lean development in `Basic.lean` formalizes the rigorous backbone of the", "concept_domain": "Applications", "research_mode": "team", "quality": "partial", "quality_score": 0.44544, "catalog_references": [], "prompt_length": 24007, "files_placed": 0, "status": "discard"}
{"timestamp": 1781272071.3602064, "experiment_id": "4d1355be", "concept_title": "ML Loss Landscape: Critical Points and Saddle Points", "concept_domain": "Novelty", "research_mode": "team", "quality": "partial", "quality_score": 0.41215000000000007, "catalog_references": [], "prompt_length": 6144, "files_placed": 0, "status": "discard"}
{"timestamp": 1781272093.886544, "experiment_id": "f14a39fc", "concept_title": "Close Proofs: **Thermodynamic Proof System** (TPS) framewo", "concept_domain": "Applications", "research_mode": "team", "quality": "partial", "quality_score": 0.6592800000000001, "catalog_references": [], "prompt_length": 17641, "files_placed": 7, "status": "keep"}
{"timestamp": 1781272114.8474424, "experiment_id": "5adb296d", "concept_title": "The file `ProofTheoreticOrdinalsEpsilon.lean` connects the abstract `OrdinalTheo", "concept_domain": "Applications", "research_mode": "team", "quality": "partial", "quality_score": 0.5413600000000001, "catalog_references": [], "prompt_length": 23735, "files_placed": 5, "status": "keep"}
{"timestamp": 1781272140.7651043, "experiment_id": "1e1865b9", "concept_title": "Reinforcement Learning: Convergence of Policy Gradient Methods", "concept_domain": "Novelty", "research_mode": "team", "quality": "partial", "quality_score": 0.39492022471910115, "catalog_references": [], "prompt_length": 5980, "files_placed": 0, "status": "discard"}
{"timestamp": 1781272165.2265875, "experiment_id": "ff948ee0", "concept_title": "This cycle's artifact: `Catalog/MachineLearning/NTKSpectral.lean`, building dire", "concept_domain": "Novelty", "research_mode": "team", "quality": "partial", "quality_score": 0.3309988173913043, "catalog_references": [], "prompt_length": 23878, "files_placed": 0, "status": "discard"}
{"timestamp": 1781274232.0972402, "experiment_id": "df064ef4", "concept_title": "Close Proofs: The file `Geometry/FractalDimension.lean` builds the **set-local** the", "concept_domain": "Applications", "research_mode": "team", "quality": "partial", "quality_score": 0.54053, "catalog_references": [], "prompt_length": 17658, "files_placed": 5, "status": "keep"}
{"timestamp": 1781274255.4830067, "experiment_id": "2de6a6f2", "concept_title": "12 fully proved theorems (zero sorry) formalizing the algebr", "concept_domain": "Applications", "research_mode": "team", "quality": "substantial", "quality_score": 0.7159200000000001, "catalog_references": [], "prompt_length": 25132, "files_placed": 6, "status": "keep"}
{"timestamp": 1781276276.0311065, "experiment_id": "d3e791e0", "concept_title": "Hilbert 16: Topology of Algebraic Curves", "concept_domain": "Novelty", "research_mode": "team", "quality": "partial", "quality_score": 0.42469214285714285, "catalog_references": [], "prompt_length": 5767, "files_placed": 0, "status": "discard"}
{"timestamp": 1781276303.962101, "experiment_id": "26bd811f", "concept_title": "This cycle attacked Beal's conjecture (`A^x + B^y = C^z` with `x,y,z > 2` and", "concept_domain": "Applications", "research_mode": "team", "quality": "partial", "quality_score": 0.5004, "catalog_references": [], "prompt_length": 23580, "files_placed": 0, "status": "keep"}
{"timestamp": 1781276327.9201267, "experiment_id": "51df7a4d", "concept_title": "The file `Catalog/Novelty/GilbertVarshamov.lean` closes the two-sided sandwich o", "concept_domain": "Applications", "research_mode": "team", "quality": "partial", "quality_score": 0.6701403592814372, "catalog_references": [], "prompt_length": 22980, "files_placed": 6, "status": "keep"}
{"timestamp": 1781276347.2364178, "experiment_id": "fbff437e", "concept_title": "The parametric continuity theorem (`parametric_fixedPoint_continuous`) establish", "concept_domain": "Applications", "research_mode": "team", "quality": "partial", "quality_score": 0.6108603592814372, "catalog_references": [], "prompt_length": 22198, "files_placed": 7, "status": "keep"}
{"timestamp": 1781276366.9729884, "experiment_id": "c86fcece", "concept_title": "This cycle closed the single open `sorry` in `Bridges/ArrowCurvature/Defs.lean`", "concept_domain": "Applications", "research_mode": "team", "quality": "partial", "quality_score": 0.5563721428571429, "catalog_references": [], "prompt_length": 22004, "files_placed": 6, "status": "keep"}
{"timestamp": 1781276403.6376324, "experiment_id": "6fdbc8aa", "concept_title": "Close Proofs: The tropical eigenvalue of a matrix A is defined as \u03bb* = min_\u03c3 (1/n) \u2211", "concept_domain": "Novelty", "research_mode": "team", "quality": "partial", "quality_score": 0.4976296296296297, "catalog_references": [], "prompt_length": 6252, "files_placed": 0, "status": "discard"}
{"timestamp": 1781278436.0664456, "experiment_id": "9513440a", "concept_title": "Bridge: Fourier Analysis as a Functor", "concept_domain": "Applications", "research_mode": "team", "quality": "partial", "quality_score": 0.3957692828828828, "catalog_references": [], "prompt_length": 6028, "files_placed": 0, "status": "discard"}
{"timestamp": 1781278462.682039, "experiment_id": "3e399b3a", "concept_title": "Combinatorial foundation for depth separation theorem", "concept_domain": "Novelty", "research_mode": "team", "quality": "partial", "quality_score": 0.44970286826735884, "catalog_references": [], "prompt_length": 18282, "files_placed": 0, "status": "discard"}
{"timestamp": 1781278507.7642362, "experiment_id": "3bd71bea", "concept_title": "Close Proofs: Hilbert 16: Topology of Algebraic Curves", "concept_domain": "Novelty", "research_mode": "team", "quality": "partial", "quality_score": 0.46850434137291286, "catalog_references": [], "prompt_length": 6210, "files_placed": 0, "status": "discard"}
{"timestamp": 1781278531.5841959, "experiment_id": "38893996", "concept_title": "Neural Scaling Spectra as Universal Renormalization Fixed-Point Invariants", "concept_domain": "Novelty", "research_mode": "team", "quality": "partial", "quality_score": 0.46024000000000004, "catalog_references": [], "prompt_length": 12997, "files_placed": 0, "status": "discard"}
{"timestamp": 1781280527.1730397, "experiment_id": "ba2ea6db", "concept_title": "Tropical Brill-Noether Theory", "concept_domain": "Applications", "research_mode": "team", "quality": "partial", "quality_score": 0.4254638554216868, "catalog_references": [], "prompt_length": 5835, "files_placed": 0, "status": "discard"}
{"timestamp": 1781280572.960422, "experiment_id": "ef4b6ac6", "concept_title": "Topological Data Analysis: Persistent Homology Stability", "concept_domain": "Applications", "research_mode": "team", "quality": "partial", "quality_score": 0.42546596710153156, "catalog_references": [], "prompt_length": 5970, "files_placed": 0, "status": "discard"}
{"timestamp": 1781280599.8507843, "experiment_id": "ee125918", "concept_title": "This cycle's artifact is `Catalog/MachineLearning/NTKSpectral.lean`. It is self-", "concept_domain": "Novelty", "research_mode": "team", "quality": "partial", "quality_score": 0.42350846312028056, "catalog_references": [], "prompt_length": 23909, "files_placed": 0, "status": "discard"}
