{"timestamp": 1783747096.576031, "experiment_id": "fec9de1f", "concept_title": "Digital Immortality: Can a Mind Be Encoded?", "concept_domain": "Novelty", "research_mode": "team", "quality": "substantial", "quality_score": 0.82, "catalog_references": [], "prompt_length": 23025, "files_placed": 4, "status": "keep"}
{"timestamp": 1783750005.0091434, "experiment_id": "46d2d021", "concept_title": "Deepening: Self-Modifying Code That Cannot Be Stopped", "concept_domain": "Applications", "research_mode": "team", "quality": "substantial", "quality_score": 0.82, "catalog_references": [], "prompt_length": 23247, "files_placed": 4, "status": "keep"}
{"timestamp": 1783751977.4264643, "experiment_id": "6e208619", "concept_title": "Upper bound conjecture for the cake balancing ratio sequence", "concept_domain": "Applications", "research_mode": "team", "quality": "substantial", "quality_score": 0.78, "catalog_references": ["De Bruijn and Erd\u0151s on cake cutting", "Discrete geometry and discrepancy theory", "Balancing sequences on circular partitions"], "prompt_length": 23069, "files_placed": 4, "status": "keep"}
{"timestamp": 1783751990.1991775, "experiment_id": "493ee817", "concept_title": "Close Proofs: Transreal Arithmetic: Computing Beyond Plus-Minus Infinity", "concept_domain": "Applications", "research_mode": "team", "quality": "substantial", "quality_score": 0.78, "catalog_references": [], "prompt_length": 23119, "files_placed": 4, "status": "keep"}
{"timestamp": 1783752980.6617987, "experiment_id": "f0c42e84", "concept_title": "Deepening: Non-Desarguesian Worlds: Geometry Without Desargues", "concept_domain": "Novelty", "research_mode": "team", "quality": "substantial", "quality_score": 0.83, "catalog_references": [], "prompt_length": 23234, "files_placed": 4, "status": "keep"}
{"timestamp": 1783753971.7598999, "experiment_id": "f3c4c6a5", "concept_title": "Deepening: Dream Logic: Non-Monotone Reasoning Where Contradictions Coexist", "concept_domain": "Novelty", "research_mode": "team", "quality": "substantial", "quality_score": 0.83, "catalog_references": [], "prompt_length": 22852, "files_placed": 4, "status": "keep"}
{"timestamp": 1783754963.051863, "experiment_id": "f57636f1", "concept_title": "Deepening: The Topology of Impossible Objects: Escher Stairs and Klein Bottles", "concept_domain": "Applications", "research_mode": "team", "quality": "substantial", "quality_score": 0.82, "catalog_references": [], "prompt_length": 23272, "files_placed": 4, "status": "keep"}
{"timestamp": 1783755961.7550426, "experiment_id": "5e3f6a63", "concept_title": "The Unreasonable Effectiveness of Wrong Theories", "concept_domain": "Novelty", "research_mode": "team", "quality": "substantial", "quality_score": 0.78, "catalog_references": [], "prompt_length": 23018, "files_placed": 4, "status": "keep"}
{"timestamp": 1783756963.4086905, "experiment_id": "0250199a", "concept_title": "Close Proofs: Digital Immortality: Can a Mind Be Encoded?", "concept_domain": "Applications", "research_mode": "team", "quality": "substantial", "quality_score": 0.83, "catalog_references": [], "prompt_length": 23104, "files_placed": 4, "status": "keep"}
{"timestamp": 1783759886.091552, "experiment_id": "1d01ef4b", "concept_title": "Hypercomputation: Computing the Uncomputable", "concept_domain": "Applications", "research_mode": "team", "quality": "substantial", "quality_score": 0.72, "catalog_references": [], "prompt_length": 22015, "files_placed": 4, "status": "keep"}
{"timestamp": 1783759897.2690973, "experiment_id": "c99af430", "concept_title": "Paradoxes as Theorems: Liar, Berry, and Russell Made Consistent", "concept_domain": "Novelty", "research_mode": "team", "quality": "substantial", "quality_score": 0.83, "catalog_references": [], "prompt_length": 23062, "files_placed": 4, "status": "keep"}
{"timestamp": 1783759903.3758917, "experiment_id": "21228762", "concept_title": "Counterfactual Number Theory: What If Primes Were Random?", "concept_domain": "Novelty", "research_mode": "team", "quality": "substantial", "quality_score": 0.82, "catalog_references": [], "prompt_length": 22991, "files_placed": 4, "status": "keep"}
{"timestamp": 1783759908.7508867, "experiment_id": "9ca5466b", "concept_title": "Computational Complexity of Alien Civilizations", "concept_domain": "Applications", "research_mode": "team", "quality": "substantial", "quality_score": 0.8, "catalog_references": [], "prompt_length": 23070, "files_placed": 4, "status": "keep"}
{"timestamp": 1783761907.0571845, "experiment_id": "1c874912", "concept_title": "Deepening: Digital Immortality: Can a Mind Be Encoded?", "concept_domain": "Applications", "research_mode": "team", "quality": "substantial", "quality_score": 0.83, "catalog_references": [], "prompt_length": 23248, "files_placed": 4, "status": "keep"}
{"timestamp": 1783761912.7859356, "experiment_id": "ea473918", "concept_title": "Deepening: The Unreasonable Effectiveness of Wrong Theories", "concept_domain": "Novelty", "research_mode": "team", "quality": "substantial", "quality_score": 0.8, "catalog_references": [], "prompt_length": 22178, "files_placed": 4, "status": "keep"}
{"timestamp": 1783763885.5335195, "experiment_id": "f85e4d43", "concept_title": "The file `Catalog/Novelty/MindEncodingRefined.lean` develops information-theoret", "concept_domain": "Applications", "research_mode": "team", "quality": "substantial", "quality_score": 0.83, "catalog_references": [], "prompt_length": 27542, "files_placed": 4, "status": "keep"}
{"timestamp": 1783764877.727506, "experiment_id": "f9466ee5", "concept_title": "Finiteness conjecture for semisimple geometric representations of Hiranouchi's ramified fundamental group", "concept_domain": "Applications", "research_mode": "team", "quality": "substantial", "quality_score": 0.82, "catalog_references": ["MR3622140"], "prompt_length": 23207, "files_placed": 4, "status": "keep"}
{"timestamp": 1783764883.5773256, "experiment_id": "8e65b62c", "concept_title": "Thermodynamics of Mathematical Proof", "concept_domain": "Novelty", "research_mode": "team", "quality": "substantial", "quality_score": 0.72, "catalog_references": [], "prompt_length": 23033, "files_placed": 4, "status": "keep"}
{"timestamp": 1783766985.408095, "experiment_id": "1978e429", "concept_title": "Close Proofs: Paradoxes as Theorems: Liar, Berry, and Russell Made Consistent", "concept_domain": "Novelty", "research_mode": "team", "quality": "substantial", "quality_score": 0.8, "catalog_references": [], "prompt_length": 22594, "files_placed": 4, "status": "keep"}
{"timestamp": 1783767018.9813302, "experiment_id": "3dc9cabc", "concept_title": "Deepening: Transreal Arithmetic: Computing Beyond Plus-Minus Infinity", "concept_domain": "Novelty", "research_mode": "team", "quality": "substantial", "quality_score": 0.8, "catalog_references": [], "prompt_length": 22714, "files_placed": 4, "status": "keep"}
{"timestamp": 1783768120.969776, "experiment_id": "fb4f44b5", "concept_title": "Sharp threshold characterization for Seidel energy increase in complete bipartite graphs under edge deletion", "concept_domain": "Applications", "research_mode": "team", "quality": "substantial", "quality_score": 0.83, "catalog_references": ["Seidel matrix eigenvalues", "graph energy variations", "complete multipartite graph spectra", "blow-up graph analysis"], "prompt_length": 22645, "files_placed": 4, "status": "keep"}
{"timestamp": 1783770149.6517408, "experiment_id": "d4a0469f", "concept_title": "Deepening: Counterfactual Number Theory: What If Primes Were Random?", "concept_domain": "Applications", "research_mode": "team", "quality": "substantial", "quality_score": 0.82, "catalog_references": [], "prompt_length": 23233, "files_placed": 4, "status": "keep"}
{"timestamp": 1783771145.8536134, "experiment_id": "a0852bd7", "concept_title": "Anti-Mathematics: What If All Axioms Were Negated?", "concept_domain": "Applications", "research_mode": "team", "quality": "substantial", "quality_score": 0.8, "catalog_references": [], "prompt_length": 23049, "files_placed": 4, "status": "keep"}
{"timestamp": 1783771157.957527, "experiment_id": "2c395553", "concept_title": "Aboriginal Kinship as Group Theory: Dreamtime Algebra", "concept_domain": "Novelty", "research_mode": "team", "quality": "substantial", "quality_score": 0.83, "catalog_references": [], "prompt_length": 22347, "files_placed": 4, "status": "keep"}
{"timestamp": 1783774117.500847, "experiment_id": "c06d8e8c", "concept_title": "Aleph-1 Surface: Geometry Between Dimensions", "concept_domain": "Applications", "research_mode": "team", "quality": "substantial", "quality_score": 0.82, "catalog_references": [], "prompt_length": 23013, "files_placed": 4, "status": "keep"}
{"timestamp": 1783776105.723259, "experiment_id": "f6b0dfd4", "concept_title": "Causal Loops in Category Theory: When Composition Loops Back", "concept_domain": "Novelty", "research_mode": "team", "quality": "substantial", "quality_score": 0.83, "catalog_references": [], "prompt_length": 23042, "files_placed": 4, "status": "keep"}
{"timestamp": 1783777106.3141305, "experiment_id": "997ab258", "concept_title": "Infinite Games Against Death: Immortality Strategies", "concept_domain": "Novelty", "research_mode": "team", "quality": "substantial", "quality_score": 0.72, "catalog_references": [], "prompt_length": 22661, "files_placed": 4, "status": "keep"}
{"timestamp": 1783777111.4745302, "experiment_id": "1e86ff35", "concept_title": "Deepening: Paradoxes as Theorems: Liar, Berry, and Russell Made Consistent", "concept_domain": "Novelty", "research_mode": "team", "quality": "substantial", "quality_score": 0.83, "catalog_references": [], "prompt_length": 23258, "files_placed": 4, "status": "keep"}
{"timestamp": 1783779075.753678, "experiment_id": "094010ae", "concept_title": "Reflective Type Theory: Proving Things About Proving Things", "concept_domain": "Novelty", "research_mode": "team", "quality": "substantial", "quality_score": 0.82, "catalog_references": [], "prompt_length": 23049, "files_placed": 4, "status": "keep"}
{"timestamp": 1783779082.651805, "experiment_id": "c3787823", "concept_title": "Deepening: Aboriginal Kinship as Group Theory: Dreamtime Algebra", "concept_domain": "Novelty", "research_mode": "team", "quality": "substantial", "quality_score": 0.83, "catalog_references": [], "prompt_length": 22284, "files_placed": 4, "status": "keep"}
{"timestamp": 1783780088.6401985, "experiment_id": "dfaaa130", "concept_title": "The Mega-Sphere: All Dimensions at Once", "concept_domain": "Novelty", "research_mode": "team", "quality": "substantial", "quality_score": 0.8, "catalog_references": [], "prompt_length": 22998, "files_placed": 4, "status": "keep"}
{"timestamp": 1783783991.8164337, "experiment_id": "e480cbbd", "concept_title": "The Fractal Dimension of Mathematical Truth", "concept_domain": "Novelty", "research_mode": "team", "quality": "substantial", "quality_score": 0.83, "catalog_references": [], "prompt_length": 23029, "files_placed": 4, "status": "keep"}
{"timestamp": 1783784004.607432, "experiment_id": "c67f6099", "concept_title": "Speculative: Mathematics as a Phase Transition", "concept_domain": "Novelty", "research_mode": "team", "quality": "substantial", "quality_score": 0.82, "catalog_references": [], "prompt_length": 23247, "files_placed": 4, "status": "keep"}
{"timestamp": 1783784011.8649478, "experiment_id": "f8dd2b6a", "concept_title": "Deepening: Causal Loops in Category Theory: When Composition Loops Back", "concept_domain": "Applications", "research_mode": "team", "quality": "substantial", "quality_score": 0.83, "catalog_references": [], "prompt_length": 23265, "files_placed": 4, "status": "keep"}
{"timestamp": 1783786998.3681319, "experiment_id": "2bd85c25", "concept_title": "Speculative: Theorems as Phase Transitions in Proof Space", "concept_domain": "Novelty", "research_mode": "team", "quality": "substantial", "quality_score": 0.72, "catalog_references": [], "prompt_length": 23176, "files_placed": 4, "status": "keep"}
{"timestamp": 1783789049.481845, "experiment_id": "8fb1d399", "concept_title": "The Oracle's Burden: How Much Knowledge Is Too Much?", "concept_domain": "Applications", "research_mode": "team", "quality": "substantial", "quality_score": 0.72, "catalog_references": [], "prompt_length": 23831, "files_placed": 4, "status": "keep"}
{"timestamp": 1783792044.0243566, "experiment_id": "4eef1c33", "concept_title": "Deepening: The Mega-Sphere: All Dimensions at Once", "concept_domain": "Novelty", "research_mode": "team", "quality": "substantial", "quality_score": 0.83, "catalog_references": [], "prompt_length": 23999, "files_placed": 4, "status": "keep"}
{"timestamp": 1783793055.5911133, "experiment_id": "f6949247", "concept_title": "Chromatic Sum Complexity Dichotomy for Forest-Forbidden Graphs", "concept_domain": "Applications", "research_mode": "team", "quality": "substantial", "quality_score": 0.72, "catalog_references": ["cs.CC", "cs.DM", "cs.DS"], "prompt_length": 23841, "files_placed": 4, "status": "keep"}
{"timestamp": 1783795037.1753695, "experiment_id": "dac5bc28", "concept_title": "Close Proofs: Reflective Type Theory: Proving Things About Proving Things", "concept_domain": "MachineLearning", "research_mode": "team", "quality": "substantial", "quality_score": 0.82, "catalog_references": [], "prompt_length": 23895, "files_placed": 4, "status": "keep"}
{"timestamp": 1783796046.3457246, "experiment_id": "c37c01fa", "concept_title": "Deepening: The Fractal Dimension of Mathematical Truth", "concept_domain": "Algebra", "research_mode": "team", "quality": "substantial", "quality_score": 0.83, "catalog_references": [], "prompt_length": 24007, "files_placed": 4, "status": "keep"}
{"timestamp": 1783797040.649708, "experiment_id": "7669ab26", "concept_title": "Speculative: Topological Quantum Error Correction from Mathematical Structures", "concept_domain": "Applications", "research_mode": "team", "quality": "substantial", "quality_score": 0.82, "catalog_references": [], "prompt_length": 23896, "files_placed": 4, "status": "keep"}
{"timestamp": 1783798046.4658666, "experiment_id": "c67deafc", "concept_title": "Close Proofs: The Fractal Dimension of Mathematical Truth", "concept_domain": "Tropical", "research_mode": "team", "quality": "partial", "quality_score": 0.6, "catalog_references": [], "prompt_length": 3280, "files_placed": 1, "status": "keep"}
{"timestamp": 1783801069.1649866, "experiment_id": "c695f186", "concept_title": "Speculative: Topological Data Analysis of Theorem Networks", "concept_domain": "Applications", "research_mode": "team", "quality": "partial", "quality_score": 0.68, "catalog_references": [], "prompt_length": 3464, "files_placed": 2, "status": "keep"}
{"timestamp": 1783801077.9065866, "experiment_id": "0a5d3cfa", "concept_title": "Close Proofs: Speculative: Mathematics as a Phase Transition", "concept_domain": "Applications", "research_mode": "team", "quality": "substantial", "quality_score": 0.78, "catalog_references": [], "prompt_length": 23876, "files_placed": 4, "status": "keep"}
{"timestamp": 1783803064.720669, "experiment_id": "8e111703", "concept_title": "Speculative: Ramanujan-Style Intuition as Formalizable Meta-Reasoning", "concept_domain": "Novelty", "research_mode": "team", "quality": "substantial", "quality_score": 0.83, "catalog_references": [], "prompt_length": 23959, "files_placed": 4, "status": "keep"}
{"timestamp": 1783808036.7161074, "experiment_id": "7473e6ed", "concept_title": "Speculative: Consciousness as Fixed Points of Recursive Type Theory", "concept_domain": "Physics", "research_mode": "team", "quality": "substantial", "quality_score": 0.82, "catalog_references": [], "prompt_length": 23963, "files_placed": 4, "status": "keep"}
{"timestamp": 1783809055.052906, "experiment_id": "29aa9d96", "concept_title": "Deepening: Speculative: Mathematics as a Phase Transition", "concept_domain": "Shared", "research_mode": "team", "quality": "substantial", "quality_score": 0.82, "catalog_references": [], "prompt_length": 23580, "files_placed": 4, "status": "keep"}
{"timestamp": 1783810078.2574215, "experiment_id": "a06d4115", "concept_title": "This project builds a self-contained, machine-checked theory of negative-dimensi", "concept_domain": "Algebra", "research_mode": "team", "quality": "substantial", "quality_score": 0.72, "catalog_references": [], "prompt_length": 26145, "files_placed": 4, "status": "keep"}
{"timestamp": 1783810091.0767865, "experiment_id": "b6492bf5", "concept_title": "Speculative: Anti-Gravity Mathematics \u2014 Theorems That Resist Proof", "concept_domain": "Applications", "research_mode": "team", "quality": "substantial", "quality_score": 0.72, "catalog_references": [], "prompt_length": 24025, "files_placed": 4, "status": "keep"}
{"timestamp": 1783810097.237309, "experiment_id": "4f5260f0", "concept_title": "Rucker: Infinity and the Mind \u2014 Formalizing Different Sizes of Infinity", "concept_domain": "Bridges", "research_mode": "team", "quality": "substantial", "quality_score": 0.83, "catalog_references": [], "prompt_length": 23886, "files_placed": 4, "status": "keep"}
{"timestamp": 1783811115.0444582, "experiment_id": "9af0a04a", "concept_title": "Rucker: Wetware \u2014 Biological Computation and Its Mathematical Limits", "concept_domain": "Geometry", "research_mode": "team", "quality": "substantial", "quality_score": 0.78, "catalog_references": [], "prompt_length": 23914, "files_placed": 4, "status": "keep"}
{"timestamp": 1783813139.7497597, "experiment_id": "7b741692", "concept_title": "Deepening: Speculative: Ramanujan-Style Intuition as Formalizable Meta-Reasoning", "concept_domain": "Cryptography", "research_mode": "team", "quality": "substantial", "quality_score": 0.83, "catalog_references": [], "prompt_length": 24043, "files_placed": 4, "status": "keep"}
{"timestamp": 1783814150.9964452, "experiment_id": "de167401", "concept_title": "Rucker: The Lifebox \u2014 Information-Theoretic Identity", "concept_domain": "Bridges", "research_mode": "team", "quality": "substantial", "quality_score": 0.78, "catalog_references": [], "prompt_length": 22433, "files_placed": 4, "status": "keep"}
{"timestamp": 1783816168.1811452, "experiment_id": "319bd9f6", "concept_title": "Rucker: Spacetime Donuts \u2014 Topology of the Universe", "concept_domain": "Shared", "research_mode": "team", "quality": "substantial", "quality_score": 0.78, "catalog_references": [], "prompt_length": 23959, "files_placed": 4, "status": "keep"}
{"timestamp": 1783816186.1538193, "experiment_id": "47a54792", "concept_title": "Rucker: The Fourth Dimension as a Mathematical Playground", "concept_domain": "NumberTheory", "research_mode": "team", "quality": "substantial", "quality_score": 0.82, "catalog_references": [], "prompt_length": 23886, "files_placed": 4, "status": "keep"}
{"timestamp": 1783816192.5562487, "experiment_id": "b4ccc3c5", "concept_title": "Atkin-Lehner Genus Zero Criterion for Giampietro-Darmon Factorization", "concept_domain": "Pythagorean", "research_mode": "team", "quality": "substantial", "quality_score": 0.7, "catalog_references": ["math.NT", "Shimura curves", "Gross-Zagier factorization", "Atkin-Lehner involutions", "Cerednik-Drinfeld uniformization"], "prompt_length": 23975, "files_placed": 4, "status": "keep"}
{"timestamp": 1783817206.1028476, "experiment_id": "453f48e6", "concept_title": "Hofstadter: I Am a Strange Loop \u2014 Consciousness as Self-Reference", "concept_domain": "Combinatorics", "research_mode": "team", "quality": "substantial", "quality_score": 0.83, "catalog_references": [], "prompt_length": 24179, "files_placed": 4, "status": "keep"}
{"timestamp": 1783818213.3274775, "experiment_id": "acce14cf", "concept_title": "Rucker: Saucer Wisdom \u2014 Non-Human Mathematical Intuition", "concept_domain": "Combinatorics", "research_mode": "team", "quality": "substantial", "quality_score": 0.82, "catalog_references": [], "prompt_length": 24082, "files_placed": 4, "status": "keep"}
{"timestamp": 1783821222.8353512, "experiment_id": "4b34e974", "concept_title": "Moonshot: Dyson Sphere Mathematics \u2014 Energy Collection Optimization", "concept_domain": "Probability", "research_mode": "team", "quality": "substantial", "quality_score": 0.82, "catalog_references": [], "prompt_length": 24139, "files_placed": 4, "status": "keep"}
{"timestamp": 1783822254.3088095, "experiment_id": "fb4de3e5", "concept_title": "Hofstadter: Fluid Concepts and Creative Analogies \u2014 Analogy as a Mathematical Operation", "concept_domain": "Tropical", "research_mode": "team", "quality": "substantial", "quality_score": 0.78, "catalog_references": [], "prompt_length": 24111, "files_placed": 4, "status": "keep"}
{"timestamp": 1783823280.414779, "experiment_id": "4b281557", "concept_title": "Moonshot: Time-Travel Logic \u2014 Formalizing Causal Consistency", "concept_domain": "Probability", "research_mode": "team", "quality": "substantial", "quality_score": 0.82, "catalog_references": [], "prompt_length": 24111, "files_placed": 4, "status": "keep"}
{"timestamp": 1783825345.0354996, "experiment_id": "f6622907", "concept_title": "Hofstadter: Tangled Hierarchies in Type Theory", "concept_domain": "Logic", "research_mode": "team", "quality": "substantial", "quality_score": 0.82, "catalog_references": [], "prompt_length": 24146, "files_placed": 4, "status": "keep"}
{"timestamp": 1783826497.6722758, "experiment_id": "0664586a", "concept_title": "Moonshot: Alien Number Systems \u2014 Mathematics Beyond Base-10", "concept_domain": "Computation", "research_mode": "team", "quality": "substantial", "quality_score": 0.83, "catalog_references": [], "prompt_length": 24066, "files_placed": 4, "status": "keep"}
