{"timestamp": 1783893555.8090968, "experiment_id": "82155f74", "concept_title": "Stability of the sharp diagonal spectral correlation inequality for monotone Boolean functions", "concept_domain": "Applications", "research_mode": "team", "quality": "substantial", "quality_score": 0.82, "catalog_references": ["arXiv:2405.12345"], "prompt_length": 23925, "files_placed": 4, "status": "keep"}
{"timestamp": 1783893573.2683942, "experiment_id": "0c4e7ae8", "concept_title": "This cycle deepens the probabilistic-method development (Erd\u0151s Ramsey lower boun", "concept_domain": "Novelty", "research_mode": "team", "quality": "substantial", "quality_score": 0.82, "catalog_references": [], "prompt_length": 27100, "files_placed": 4, "status": "keep"}
{"timestamp": 1783897953.2299423, "experiment_id": "208b1ca5", "concept_title": "Siegel-Weil Identity for the E\u2088 Lattice Theta Series", "concept_domain": "Novelty", "research_mode": "team", "quality": "substantial", "quality_score": 0.82, "catalog_references": ["math.NT", "math.AG", "Siegel-Weil formula", "Eisenstein series", "Theta series"], "prompt_length": 23959, "files_placed": 4, "status": "keep"}
{"timestamp": 1783897968.0673897, "experiment_id": "26646791", "concept_title": "Close Proofs: Recursive decomposition of greedy Tamari intervals via Dyck path struc", "concept_domain": "Novelty", "research_mode": "team", "quality": "substantial", "quality_score": 0.72, "catalog_references": [], "prompt_length": 23434, "files_placed": 4, "status": "keep"}
{"timestamp": 1783899090.7627735, "experiment_id": "4d87b490", "concept_title": "Deepening: `ThermodynamicsOfProof.lean` \u2014 the positive theory:", "concept_domain": "Applications", "research_mode": "team", "quality": "substantial", "quality_score": 0.83, "catalog_references": [], "prompt_length": 24025, "files_placed": 4, "status": "keep"}
{"timestamp": 1783899108.0203762, "experiment_id": "00319e93", "concept_title": "Deepening: This cycle deepens the probabilistic-method development (Erd\u0151s Ramsey lower boun", "concept_domain": "Novelty", "research_mode": "team", "quality": "substantial", "quality_score": 0.82, "catalog_references": [], "prompt_length": 23646, "files_placed": 4, "status": "keep"}
{"timestamp": 1783899126.1641216, "experiment_id": "82394822", "concept_title": "Number of GL(10,2)-orbits of Boolean cubic forms in 10 variables", "concept_domain": "Novelty", "research_mode": "team", "quality": "substantial", "quality_score": 0.72, "catalog_references": ["Classification of Boolean Cubic Forms in Ten Variables"], "prompt_length": 23043, "files_placed": 4, "status": "keep"}
{"timestamp": 1783900317.9797838, "experiment_id": "0242f406", "concept_title": "Close Proofs: The opposite-semicube Helly property characterizes harmonic-evenness i", "concept_domain": "Novelty", "research_mode": "team", "quality": "substantial", "quality_score": 0.72, "catalog_references": [], "prompt_length": 23847, "files_placed": 5, "status": "keep"}
{"timestamp": 1783900330.8990986, "experiment_id": "86966da0", "concept_title": "That a type which fully quantifies over itself \u2014", "concept_domain": "Applications", "research_mode": "team", "quality": "substantial", "quality_score": 0.82, "catalog_references": [], "prompt_length": 29064, "files_placed": 4, "status": "keep"}
{"timestamp": 1783901401.8039148, "experiment_id": "909a0259", "concept_title": "Deepening: The opposite-semicube Helly property characterizes harmonic-evenness in Cartesia", "concept_domain": "Novelty", "research_mode": "team", "quality": "substantial", "quality_score": 0.83, "catalog_references": [], "prompt_length": 23901, "files_placed": 5, "status": "keep"}
{"timestamp": 1783903580.3048182, "experiment_id": "28bb3270", "concept_title": "Close Proofs: Siegel-Weil Identity for the E\u2088 Lattice Theta Series", "concept_domain": "Applications", "research_mode": "team", "quality": "substantial", "quality_score": 0.83, "catalog_references": [], "prompt_length": 23416, "files_placed": 4, "status": "keep"}
{"timestamp": 1783904768.5676374, "experiment_id": "1abce342", "concept_title": "The optimal portion ratio \u03bc\u2082 equals 1 + \u03c1", "concept_domain": "Applications", "research_mode": "team", "quality": "substantial", "quality_score": 0.78, "catalog_references": ["Korsky_conjecture_mu2_equals_2", "cake_cutting_portion_bounds"], "prompt_length": 24032, "files_placed": 4, "status": "keep"}
{"timestamp": 1783905866.4593892, "experiment_id": "97b9c756", "concept_title": "Deepening: Siegel-Weil Identity for the E\u2088 Lattice Theta Series", "concept_domain": "Novelty", "research_mode": "team", "quality": "substantial", "quality_score": 0.83, "catalog_references": [], "prompt_length": 23660, "files_placed": 4, "status": "keep"}
{"timestamp": 1783905897.3180285, "experiment_id": "cbbd1369", "concept_title": "Generalized Giampietro-Darmon Factorization for Arbitrary Genus", "concept_domain": "Novelty", "research_mode": "team", "quality": "substantial", "quality_score": 0.7, "catalog_references": ["math.NT", "math.AG"], "prompt_length": 24025, "files_placed": 4, "status": "keep"}
{"timestamp": 1783905917.5291014, "experiment_id": "3959b92d", "concept_title": "Close Proofs: Bayesian Werewolf: Optimal Strategy for Social Deduction Games", "concept_domain": "Novelty", "research_mode": "team", "quality": "substantial", "quality_score": 0.82, "catalog_references": [], "prompt_length": 22785, "files_placed": 4, "status": "keep"}
{"timestamp": 1783908071.5374348, "experiment_id": "2a098803", "concept_title": "Close Proofs: The file `PhaseTransitionCurieWeiss.lean` proves that the Curie\u2013Weiss ", "concept_domain": "Novelty", "research_mode": "team", "quality": "partial", "quality_score": 0.6, "catalog_references": [], "prompt_length": 10062, "files_placed": 1, "status": "keep"}
{"timestamp": 1783908120.1435661, "experiment_id": "48b25c91", "concept_title": "These conjectures grow out of the cycle's core finding: the collection of provab", "concept_domain": "Applications", "research_mode": "team", "quality": "substantial", "quality_score": 0.72, "catalog_references": [], "prompt_length": 27423, "files_placed": 4, "status": "keep"}
{"timestamp": 1783909302.9422638, "experiment_id": "7362296f", "concept_title": "Close Proofs: Number of GL(10,2)-orbits of Boolean cubic forms in 10 variables", "concept_domain": "Novelty", "research_mode": "team", "quality": "substantial", "quality_score": 0.8, "catalog_references": [], "prompt_length": 23884, "files_placed": 4, "status": "keep"}
{"timestamp": 1783910523.3045955, "experiment_id": "ffec372c", "concept_title": "Deepening: Minimalobstructions to total rainbow forests fail the Rainbow Forest Inequality ", "concept_domain": "Applications", "research_mode": "team", "quality": "substantial", "quality_score": 0.8, "catalog_references": [], "prompt_length": 23210, "files_placed": 4, "status": "keep"}
{"timestamp": 1783910556.989227, "experiment_id": "5b1ced03", "concept_title": "Characterization of Limit Points Below the Golden Ratio Threshold for Largest Matching Roots", "concept_domain": "Novelty", "research_mode": "team", "quality": "substantial", "quality_score": 0.7, "catalog_references": ["matching_polynomials", "spectral_graph_theory", "limit_points_of_graph_roots", "golden_ratio_in_graph_theory"], "prompt_length": 24215, "files_placed": 4, "status": "keep"}
{"timestamp": 1783911757.9067924, "experiment_id": "32285b55", "concept_title": "Gamma-positivity of symmetric edge polytopes for series-parallel graphs with at most four paths", "concept_domain": "Applications", "research_mode": "team", "quality": "substantial", "quality_score": 0.83, "catalog_references": ["ohsugi-tsuchiya-conj", "higashitani-jochemko-michalek", "gal-gamma-positivity", "bruns-romer-unimodal"], "prompt_length": 23997, "files_placed": 4, "status": "keep"}
{"timestamp": 1783913924.4520736, "experiment_id": "d4192a75", "concept_title": "Equivalence of Oddomorphism and Split-Off Minor", "concept_domain": "Applications", "research_mode": "team", "quality": "substantial", "quality_score": 0.7, "catalog_references": ["roberson2022oddomorphisms", "mancinska2020quantum", "lovasz1967operations"], "prompt_length": 23576, "files_placed": 4, "status": "keep"}
{"timestamp": 1783915042.931765, "experiment_id": "53d4816b", "concept_title": "Deepening: Cellular Automata as Algebraic Geometry: Wolfram's Rules Meet Grothendieck", "concept_domain": "Novelty", "research_mode": "team", "quality": "substantial", "quality_score": 0.82, "catalog_references": [], "prompt_length": 24043, "files_placed": 4, "status": "keep"}
{"timestamp": 1783916029.8640318, "experiment_id": "4bfb0f7c", "concept_title": "Deepening: Moonshot: Dyson Sphere Mathematics \u2014 Energy Collection Optimization", "concept_domain": "Novelty", "research_mode": "team", "quality": "substantial", "quality_score": 0.83, "catalog_references": [], "prompt_length": 24035, "files_placed": 4, "status": "keep"}
{"timestamp": 1783917983.2163308, "experiment_id": "b659b436", "concept_title": "Deepening: The Uncanny Valley of Mathematics: When Proofs Are Almost Right", "concept_domain": "Applications", "research_mode": "team", "quality": "substantial", "quality_score": 0.83, "catalog_references": [], "prompt_length": 24043, "files_placed": 4, "status": "keep"}
{"timestamp": 1783919912.8268878, "experiment_id": "8e89241b", "concept_title": "Asymptotic alternating sign conjecture for Andrews q-series v\u2082(q), v\u2083(q), v\u2084(q)", "concept_domain": "Applications", "research_mode": "team", "quality": "substantial", "quality_score": 0.82, "catalog_references": ["Andrews, G. E. (1986). On the number of partitions of n into distinct parts. Bull. Amer. Math. Soc.", "Hardy, G. H. & Ramanujan, S. (1918). Asymptotic formulae in combinatory analysis. Proc. London Math. Soc.", "Folsom, A. et al. (2015). A new identity for partitions involving delta symbols. Ramanujan J.", "Rademacher, F. (1938). On the partition function p(n). Proc. London Math. Soc."], "prompt_length": 23866, "files_placed": 4, "status": "keep"}
{"timestamp": 1783919924.716569, "experiment_id": "ca370926", "concept_title": "Factorization of Cyclotomic Gauss Sum Matrix", "concept_domain": "Applications", "research_mode": "team", "quality": "substantial", "quality_score": 0.7, "catalog_references": ["Gauss_sum", "Vandermonde_matrix", "Cyclotomic_field"], "prompt_length": 23194, "files_placed": 4, "status": "keep"}
{"timestamp": 1783920020.858337, "experiment_id": "96ae8e1e", "concept_title": "Generalized variance formula for digit expansions of $1/p$ beyond powers of two", "concept_domain": "Novelty", "research_mode": "team", "quality": "substantial", "quality_score": 0.72, "catalog_references": ["Mean values and variances of the digits of $1/p$ (arXiv:xxxx.xxxxx)", "Mauduit, A., Rivat, J. (2009). \"Digits of rational numbers and characters.\"", "Erickson, J., Mauduit, A. (2021). \"On the variance of digits of $1/p$\"."], "prompt_length": 24431, "files_placed": 4, "status": "keep"}
{"timestamp": 1783922074.9140356, "experiment_id": "291fcce1", "concept_title": "Deepening: Number of GL(10,2)-orbits of Boolean cubic forms in 10 variables", "concept_domain": "Novelty", "research_mode": "team", "quality": "substantial", "quality_score": 0.72, "catalog_references": [], "prompt_length": 24028, "files_placed": 4, "status": "keep"}
{"timestamp": 1783924013.7233095, "experiment_id": "5b802ccf", "concept_title": "Previous cycles formalized Dung's abstract argumentation semantics: conflict-fre", "concept_domain": "Applications", "research_mode": "team", "quality": "substantial", "quality_score": 0.82, "catalog_references": [], "prompt_length": 25888, "files_placed": 4, "status": "keep"}
{"timestamp": 1783925099.9351642, "experiment_id": "05e37ec1", "concept_title": "Deepening: Stone Duality for Machine Learning: Neural Networks as Geometric Realizations", "concept_domain": "Novelty", "research_mode": "team", "quality": "substantial", "quality_score": 0.82, "catalog_references": [], "prompt_length": 24041, "files_placed": 4, "status": "keep"}
{"timestamp": 1783926078.862915, "experiment_id": "111bebcc", "concept_title": "Constant residue of labeled poset counts modulo 4", "concept_domain": "Applications", "research_mode": "team", "quality": "substantial", "quality_score": 0.72, "catalog_references": ["OEIS A001035"], "prompt_length": 23933, "files_placed": 4, "status": "keep"}
{"timestamp": 1783926094.166602, "experiment_id": "02c1616a", "concept_title": "Functional Equations Enforce Primitivity of Coefficients", "concept_domain": "Novelty", "research_mode": "team", "quality": "substantial", "quality_score": 0.8, "catalog_references": "allouche2018mock", "prompt_length": 23664, "files_placed": 4, "status": "keep"}
{"timestamp": 1783927096.8238003, "experiment_id": "6ed40476", "concept_title": "Deepening: Stability of the sharp diagonal spectral correlation inequality for monotone Boo", "concept_domain": "Novelty", "research_mode": "team", "quality": "substantial", "quality_score": 0.83, "catalog_references": [], "prompt_length": 24049, "files_placed": 4, "status": "keep"}
{"timestamp": 1783930065.369728, "experiment_id": "b08004d1", "concept_title": "Failure of L^p Relaxation of KNRS Conjecture Below Threshold p", "concept_domain": "Applications", "research_mode": "team", "quality": "substantial", "quality_score": 0.72, "catalog_references": ["KNRS2010", "ConlonLee2021", "Sidorenko1993"], "prompt_length": 23659, "files_placed": 4, "status": "keep"}
{"timestamp": 1783930094.6822631, "experiment_id": "57f58be0", "concept_title": "Deepening: Moonshot: Multiverse Set Theory \u2014 Mathematics Across Branches", "concept_domain": "Novelty", "research_mode": "team", "quality": "substantial", "quality_score": 0.72, "catalog_references": [], "prompt_length": 23630, "files_placed": 4, "status": "keep"}
{"timestamp": 1783931177.2706656, "experiment_id": "d31b185d", "concept_title": "Deepening: That a type which fully quantifies over itself \u2014", "concept_domain": "Novelty", "research_mode": "team", "quality": "substantial", "quality_score": 0.83, "catalog_references": [], "prompt_length": 24017, "files_placed": 4, "status": "keep"}
{"timestamp": 1783931216.3225048, "experiment_id": "1a598f10", "concept_title": "Deepening: Functional Equations Enforce Primitivity of Coefficients", "concept_domain": "Novelty", "research_mode": "team", "quality": "substantial", "quality_score": 0.8, "catalog_references": [], "prompt_length": 23686, "files_placed": 4, "status": "keep"}
{"timestamp": 1783932230.8884437, "experiment_id": "0557da65", "concept_title": "Deepening: Rucker: Infinity and the Mind \u2014 Formalizing Different Sizes of Infinity", "concept_domain": "Applications", "research_mode": "team", "quality": "substantial", "quality_score": 0.82, "catalog_references": [], "prompt_length": 23343, "files_placed": 4, "status": "keep"}
{"timestamp": 1783933189.7718487, "experiment_id": "223b6ab0", "concept_title": "Close Proofs: Rucker: Spacetime Donuts \u2014 Topology of the Universe", "concept_domain": "Applications", "research_mode": "team", "quality": "partial", "quality_score": 0.55, "catalog_references": [], "prompt_length": 10409, "files_placed": 2, "status": "keep"}
{"timestamp": 1783933200.6632864, "experiment_id": "9da8e56c", "concept_title": "Hirzebruch\u2013Riemann\u2013Roch Identity for the Integral Tangent Class of Matroids", "concept_domain": "Novelty", "research_mode": "team", "quality": "substantial", "quality_score": 0.72, "catalog_references": ["arXiv:2606.22650", "Feichtner-Yuzvinsky building sets", "wonderful compactifications of subspace arrangements", "Chow rings of matroids"], "prompt_length": 23977, "files_placed": 4, "status": "keep"}
{"timestamp": 1783936169.3862817, "experiment_id": "75061bf5", "concept_title": "Close Proofs: The Topology of Knotted Light: How Laser Beams Get Tangled", "concept_domain": "Applications", "research_mode": "team", "quality": "substantial", "quality_score": 0.72, "catalog_references": [], "prompt_length": 23896, "files_placed": 4, "status": "keep"}
{"timestamp": 1783936187.6446543, "experiment_id": "3e1dd178", "concept_title": "Deepening: Rucker: The Fourth Dimension as a Mathematical Playground", "concept_domain": "Applications", "research_mode": "team", "quality": "substantial", "quality_score": 0.82, "catalog_references": [], "prompt_length": 24036, "files_placed": 4, "status": "keep"}
{"timestamp": 1783938159.3019454, "experiment_id": "3f303e8a", "concept_title": "Close Proofs: These conjectures grow out of the cycle's core finding: the collection", "concept_domain": "Novelty", "research_mode": "team", "quality": "substantial", "quality_score": 0.72, "catalog_references": [], "prompt_length": 23894, "files_placed": 4, "status": "keep"}
{"timestamp": 1783939142.9758377, "experiment_id": "86e0e034", "concept_title": "The mission asked to interrogate the claim:", "concept_domain": "Applications", "research_mode": "team", "quality": "substantial", "quality_score": 0.74, "catalog_references": [], "prompt_length": 27360, "files_placed": 4, "status": "keep"}
{"timestamp": 1783940113.3143234, "experiment_id": "167aed7f", "concept_title": "This project formalizes an abstract, model-agnostic version of Hamkins'", "concept_domain": "Applications", "research_mode": "team", "quality": "substantial", "quality_score": 0.82, "catalog_references": [], "prompt_length": 26831, "files_placed": 4, "status": "keep"}
{"timestamp": 1783940118.715599, "experiment_id": "2f683b2c", "concept_title": "Generalized Mertens Function Recursion Identity", "concept_domain": "Applications", "research_mode": "team", "quality": "substantial", "quality_score": 0.86, "catalog_references": ["Mertens function", "M\u00f6bius function", "M\u00f6bius inversion", "combinatorial number theory", "arithmetic functions"], "prompt_length": 22843, "files_placed": 4, "status": "keep"}
{"timestamp": 1783940135.2692645, "experiment_id": "02ff061d", "concept_title": "Edge-Spectral Supersaturation for Triangles", "concept_domain": "Novelty", "research_mode": "team", "quality": "substantial", "quality_score": 0.7, "catalog_references": ["math.CO", "math.SP"], "prompt_length": 24033, "files_placed": 4, "status": "keep"}
{"timestamp": 1783941125.4989698, "experiment_id": "4cfd5e43", "concept_title": "Deepening: Isomorphisms of Meaning: When Structures Collide", "concept_domain": "Applications", "research_mode": "team", "quality": "substantial", "quality_score": 0.83, "catalog_references": [], "prompt_length": 24027, "files_placed": 4, "status": "keep"}
{"timestamp": 1783941142.8086329, "experiment_id": "59a15132", "concept_title": "Power-of-Two Characterisation of \u03bb=1 Pairwise Reflection Symmetric Latin Rectangles", "concept_domain": "Applications", "research_mode": "team", "quality": "substantial", "quality_score": 0.79, "catalog_references": ["Pairwise Reflection Symmetry in Generalized Latin Rectangles (arXiv:2406.xxxxx)"], "prompt_length": 23767, "files_placed": 4, "status": "keep"}
{"timestamp": 1783944063.6144435, "experiment_id": "191c7579", "concept_title": "This cycle deepened the singleton-hypergraph tightness result of", "concept_domain": "Applications", "research_mode": "team", "quality": "substantial", "quality_score": 0.83, "catalog_references": [], "prompt_length": 25744, "files_placed": 4, "status": "keep"}
{"timestamp": 1783945047.6355426, "experiment_id": "64d4f5fe", "concept_title": "Explicit exponential lower bound for Vietoris-Rips approximations below \u221a2 threshold", "concept_domain": "Novelty", "research_mode": "team", "quality": "substantial", "quality_score": 0.78, "catalog_references": ["VR filtrations and metric spaces", "Approximation algorithms in TDA", "Homotopy interleavings", "Doubling dimension in metric geometry"], "prompt_length": 23876, "files_placed": 4, "status": "keep"}
{"timestamp": 1783945055.303509, "experiment_id": "a1dac228", "concept_title": "Close Proofs: Edge-Spectral Supersaturation for Triangles", "concept_domain": "Novelty", "research_mode": "team", "quality": "substantial", "quality_score": 0.82, "catalog_references": [], "prompt_length": 23445, "files_placed": 4, "status": "keep"}
{"timestamp": 1783946095.2187848, "experiment_id": "290f55e0", "concept_title": "Deepening: Knots and Lattices: The Alexander Polynomial as a Lattice Path Count", "concept_domain": "Novelty", "research_mode": "team", "quality": "substantial", "quality_score": 0.83, "catalog_references": [], "prompt_length": 24037, "files_placed": 4, "status": "keep"}
{"timestamp": 1783946168.0522811, "experiment_id": "ad71c64c", "concept_title": "Full Brouwer's Laplacian Conjecture Equality Characterization", "concept_domain": "Applications", "research_mode": "team", "quality": "substantial", "quality_score": 0.72, "catalog_references": ["math.CO", "math.SP"], "prompt_length": 23720, "files_placed": 4, "status": "keep"}
{"timestamp": 1783947224.4220724, "experiment_id": "e8b8d594", "concept_title": "Maximum Determinant Bound for 4\u00d74 Unimodular Matrices with Bounded Entries", "concept_domain": "Applications", "research_mode": "team", "quality": "substantial", "quality_score": 0.82, "catalog_references": ["Hadamard's maximal determinant problem", "Ehlich-Wojtas bounds for ternary matrices", "Cohn's work on unimodular lattices", "Pellegrino's characterization of unimodular surfaces", "Computer algebra results on small unimodular matrices"], "prompt_length": 23833, "files_placed": 4, "status": "keep"}
{"timestamp": 1783949173.5160239, "experiment_id": "9f2f3b13", "concept_title": "That the geometry surrounding the Hopf fibration is", "concept_domain": "Novelty", "research_mode": "team", "quality": "substantial", "quality_score": 0.85, "catalog_references": [], "prompt_length": 28176, "files_placed": 4, "status": "keep"}
