{"timestamp": 1781334965.2774665, "experiment_id": "21edf563", "concept_title": "This cycle was a cold start on the clique-complex research thread: the catalog c", "concept_domain": "Applications", "research_mode": "team", "quality": "substantial", "quality_score": 0.8016000000000001, "catalog_references": [], "prompt_length": 25065, "files_placed": 5, "status": "keep"}
{"timestamp": 1781334987.2352269, "experiment_id": "0cdf8c0a", "concept_title": "The file `TropicalModuliDimension.lean` formalises the **numerical backbone** of", "concept_domain": "Novelty", "research_mode": "team", "quality": "partial", "quality_score": 0.5685600000000001, "catalog_references": [], "prompt_length": 17167, "files_placed": 0, "status": "keep"}
{"timestamp": 1781336860.3751707, "experiment_id": "b6904a74", "concept_title": "Close Proofs: Topological Data Analysis: Persistent Homology Stability", "concept_domain": "Applications", "research_mode": "team", "quality": "partial", "quality_score": 0.307166183006536, "catalog_references": [], "prompt_length": 6248, "files_placed": 0, "status": "discard"}
{"timestamp": 1781336881.8572557, "experiment_id": "b1999396", "concept_title": "Close Proofs: The file `Catalog/Geometry/IsingStereoRG.lean` establishes the first r", "concept_domain": "Novelty", "research_mode": "team", "quality": "partial", "quality_score": 0.5336230136986302, "catalog_references": [], "prompt_length": 17648, "files_placed": 26, "status": "keep"}
{"timestamp": 1781336899.3379817, "experiment_id": "e517b646", "concept_title": "Close Proofs: Close Proofs: This cycle built, from scratch and `sorry`-free, the ari", "concept_domain": "Applications", "research_mode": "team", "quality": "substantial", "quality_score": 0.7670104918032787, "catalog_references": [], "prompt_length": 17662, "files_placed": 6, "status": "keep"}
{"timestamp": 1781336926.1488423, "experiment_id": "72bf82d3", "concept_title": "This cycle isolated the **rigorous, provable core** of the \"spectral universalit", "concept_domain": "Novelty", "research_mode": "team", "quality": "partial", "quality_score": 0.39423915151515154, "catalog_references": [], "prompt_length": 29011, "files_placed": 0, "status": "discard"}
{"timestamp": 1781336961.821376, "experiment_id": "e88cf2f8", "concept_title": "Close Proofs: Rigorous bridge between proof search complexity (the `p", "concept_domain": "Novelty", "research_mode": "team", "quality": "partial", "quality_score": 0.56865, "catalog_references": [], "prompt_length": 6066, "files_placed": 0, "status": "keep"}
{"timestamp": 1781337886.9458232, "experiment_id": "6aa5efa8", "concept_title": "Close Proofs: The file `Core.lean` isolates the *analytic skeleton* shared by Occam,", "concept_domain": "Applications", "research_mode": "team", "quality": "partial", "quality_score": 0.5946400000000001, "catalog_references": [], "prompt_length": 6081, "files_placed": 0, "status": "keep"}
{"timestamp": 1781337907.1707065, "experiment_id": "f3375580", "concept_title": "Close Proofs: The companion file `ScalingLaws.lean` proves, from first principles, t", "concept_domain": "Novelty", "research_mode": "team", "quality": "partial", "quality_score": 0.3661209433962265, "catalog_references": [], "prompt_length": 6081, "files_placed": 0, "status": "discard"}
{"timestamp": 1781339780.3283007, "experiment_id": "6b72e438", "concept_title": "This cycle determined the **lattice structure** of the p-simulation preorder tha", "concept_domain": "Novelty", "research_mode": "team", "quality": "partial", "quality_score": 0.39060563488843814, "catalog_references": [], "prompt_length": 19842, "files_placed": 0, "status": "discard"}
{"timestamp": 1781339799.729039, "experiment_id": "d5fd302f", "concept_title": "Close Proofs: Algebraic and order-theoretic backbone of stereograph", "concept_domain": "Applications", "research_mode": "team", "quality": "partial", "quality_score": 0.5492, "catalog_references": [], "prompt_length": 17642, "files_placed": 5, "status": "keep"}
{"timestamp": 1781339836.0293796, "experiment_id": "9fcc8a3d", "concept_title": "The Fibonacci **entry point** (rank of apparition) `\u03b1(m)` \u2014 the least `k > 0` wi", "concept_domain": "Novelty", "research_mode": "team", "quality": "partial", "quality_score": 0.5717300000000001, "catalog_references": [], "prompt_length": 26355, "files_placed": 0, "status": "keep"}
{"timestamp": 1781341703.3841815, "experiment_id": "caedb329", "concept_title": "Close Proofs: Close Proofs: The sphere-packing bound gives an upper bound on code si", "concept_domain": "Novelty", "research_mode": "team", "quality": "partial", "quality_score": 0.45826999999999996, "catalog_references": [], "prompt_length": 6195, "files_placed": 0, "status": "discard"}
{"timestamp": 1781341723.2761488, "experiment_id": "a7005d73", "concept_title": "Close Proofs: This cycle attacked the two `sorry`/missing-dependency holes left in t", "concept_domain": "Applications", "research_mode": "team", "quality": "partial", "quality_score": 0.5521, "catalog_references": [], "prompt_length": 6089, "files_placed": 0, "status": "keep"}
{"timestamp": 1781341741.0668862, "experiment_id": "d879eaaa", "concept_title": "Close Proofs: Zeta Functions of Directed Graphs and the Graph Riemann Hypothesis", "concept_domain": "Novelty", "research_mode": "team", "quality": "partial", "quality_score": 0.53969, "catalog_references": [], "prompt_length": 11515, "files_placed": 0, "status": "keep"}
{"timestamp": 1781341758.428133, "experiment_id": "fb03edbd", "concept_title": "We have formalized Belnap's FOUR as a bounded distributive lattice under the tru", "concept_domain": "Applications", "research_mode": "team", "quality": "partial", "quality_score": 0.6572, "catalog_references": [], "prompt_length": 22122, "files_placed": 7, "status": "keep"}
{"timestamp": 1781341776.4860065, "experiment_id": "34c076cc", "concept_title": "This cycle isolated the *cardinal mechanism* behind the bridge between", "concept_domain": "Novelty", "research_mode": "team", "quality": "partial", "quality_score": 0.67256, "catalog_references": [], "prompt_length": 26340, "files_placed": 6, "status": "keep"}
{"timestamp": 1781342164.0553658, "experiment_id": "fee9cff0", "concept_title": "With the Laplacian sum-zero property, linear equivalence as an equivalence relat", "concept_domain": "Applications", "research_mode": "team", "quality": "partial", "quality_score": 0.51536, "catalog_references": [], "prompt_length": 22127, "files_placed": 0, "status": "keep"}
{"timestamp": 1781342179.234453, "experiment_id": "0956f915", "concept_title": "This cycle isolated the *mathematical kernel* of why anyon braiding is a", "concept_domain": "Applications", "research_mode": "team", "quality": "partial", "quality_score": 0.46926999999999996, "catalog_references": [], "prompt_length": 21061, "files_placed": 0, "status": "discard"}
{"timestamp": 1781344432.9732492, "experiment_id": "3d1663cf", "concept_title": "Close Proofs: The Fibonacci **entry point** (rank of apparition) `\u03b1(m)` \u2014 the least ", "concept_domain": "Novelty", "research_mode": "team", "quality": "partial", "quality_score": 0.5710250000000001, "catalog_references": [], "prompt_length": 6061, "files_placed": 0, "status": "keep"}
{"timestamp": 1781345308.496462, "experiment_id": "91d73f09", "concept_title": "Small but fully verified core of the **Thermodynamic Pr", "concept_domain": "Novelty", "research_mode": "team", "quality": "partial", "quality_score": 0.5007699999999999, "catalog_references": [], "prompt_length": 24846, "files_placed": 0, "status": "keep"}
{"timestamp": 1781346063.5046551, "experiment_id": "23c33985", "concept_title": "1. Oracle hierarchies for self-modification: Does the arithmetic hierarchy induc", "concept_domain": "Applications", "research_mode": "team", "quality": "partial", "quality_score": 0.4680000000000001, "catalog_references": [], "prompt_length": 8665, "files_placed": 0, "status": "discard"}
{"timestamp": 1781347934.5596173, "experiment_id": "f24ee9dc", "concept_title": "Close Proofs: Kripke-semantic core of G\u00f6del\u2013L\u00f6b provability logic", "concept_domain": "Novelty", "research_mode": "team", "quality": "partial", "quality_score": 0.6228, "catalog_references": [], "prompt_length": 17634, "files_placed": 5, "status": "keep"}
{"timestamp": 1781347951.3841567, "experiment_id": "ae289ab7", "concept_title": "Deepening: This cycle was a cold start on the clique-complex research thread: the catalog c", "concept_domain": "Novelty", "research_mode": "team", "quality": "partial", "quality_score": 0.6899, "catalog_references": [], "prompt_length": 17806, "files_placed": 5, "status": "keep"}
{"timestamp": 1781347979.1122246, "experiment_id": "23baf044", "concept_title": "Close Proofs: Proof-Complexity Holography: Geometric Duals of Formal Derivations", "concept_domain": "Novelty", "research_mode": "team", "quality": "substantial", "quality_score": 0.8291200000000001, "catalog_references": [], "prompt_length": 17647, "files_placed": 5, "status": "keep"}
{"timestamp": 1781347998.23233, "experiment_id": "7fe13ffe", "concept_title": "The file `HigherPersistence.lean` lifts the catalog's 0-dimensional persistence", "concept_domain": "Applications", "research_mode": "team", "quality": "partial", "quality_score": 0.6702816883116883, "catalog_references": [], "prompt_length": 23520, "files_placed": 6, "status": "keep"}
{"timestamp": 1781348016.2111945, "experiment_id": "0e79b530", "concept_title": "This cycle laid the load-bearing foundation of Baker\u2013Norine divisor theory on a ", "concept_domain": "Applications", "research_mode": "team", "quality": "partial", "quality_score": 0.6396416883116883, "catalog_references": [], "prompt_length": 27401, "files_placed": 6, "status": "keep"}
{"timestamp": 1781348406.2616458, "experiment_id": "2f5a8627", "concept_title": "Spectral Universality of Transformer Attention via Random Matrix Free Convolutio", "concept_domain": "Geometry", "research_mode": "team", "quality": "partial", "quality_score": 0.42701634254492316, "catalog_references": [], "prompt_length": 8124, "files_placed": 0, "status": "discard"}
{"timestamp": 1781350288.100654, "experiment_id": "bb29511f", "concept_title": "The current formalization proves Z(m,n) \u2264 (m+1)^n (polynomial upper bound) and Z", "concept_domain": "MachineLearning", "research_mode": "team", "quality": "partial", "quality_score": 0.42693036606594953, "catalog_references": [], "prompt_length": 18321, "files_placed": 0, "status": "discard"}
{"timestamp": 1781350314.342281, "experiment_id": "c3eefde2", "concept_title": "Close Proofs: This cycle was a cold start on the clique-complex research thread: the", "concept_domain": "Algebra", "research_mode": "team", "quality": "partial", "quality_score": 0.4324663043478261, "catalog_references": [], "prompt_length": 6165, "files_placed": 0, "status": "discard"}
{"timestamp": 1781350335.192055, "experiment_id": "972329f6", "concept_title": "Close Proofs: This cycle built, from scratch and `sorry`-free, the ari", "concept_domain": "Novelty", "research_mode": "team", "quality": "partial", "quality_score": 0.4512497048978154, "catalog_references": [], "prompt_length": 17638, "files_placed": 17, "status": "discard"}
{"timestamp": 1781350374.849482, "experiment_id": "3a465165", "concept_title": "This cycle laid the *formal* foundations for the logic-physics bridge \u2014 the prec", "concept_domain": "Shared", "research_mode": "team", "quality": "partial", "quality_score": 0.57464, "catalog_references": [], "prompt_length": 22049, "files_placed": 0, "status": "keep"}
{"timestamp": 1781350394.908549, "experiment_id": "0952b8cb", "concept_title": "This cycle pushed the catalog's higher-dimensional persistence backbone", "concept_domain": "Applications", "research_mode": "team", "quality": "partial", "quality_score": 0.56379, "catalog_references": [], "prompt_length": 25761, "files_placed": 0, "status": "keep"}
{"timestamp": 1781350414.6653774, "experiment_id": "160cdc8a", "concept_title": "Secure Multi-Party Computation: Theoretical Foundations", "concept_domain": "Cryptography", "research_mode": "team", "quality": "partial", "quality_score": 0.3470389523809524, "catalog_references": [], "prompt_length": 5742, "files_placed": 0, "status": "discard"}
{"timestamp": 1781352704.0513158, "experiment_id": "b7986060", "concept_title": "Deepening: Proof-Complexity Holography: Geometric Duals of Formal Derivations", "concept_domain": "Novelty", "research_mode": "team", "quality": "partial", "quality_score": 0.39192836115187085, "catalog_references": [], "prompt_length": 6525, "files_placed": 0, "status": "discard"}
{"timestamp": 1781353102.2006505, "experiment_id": "38c06554", "concept_title": "Close Proofs: The file `Catalog/Novelty/GilbertVarshamov.lean` closes the two-sided ", "concept_domain": "Pythagorean", "research_mode": "team", "quality": "partial", "quality_score": 0.4200221645663455, "catalog_references": [], "prompt_length": 6081, "files_placed": 0, "status": "discard"}
{"timestamp": 1781353496.8362222, "experiment_id": "acb48683", "concept_title": "This cycle isolated the *rank of apparition* (the Fibonacci entry point) as the ", "concept_domain": "Bridges", "research_mode": "team", "quality": "substantial", "quality_score": 0.7180000000000001, "catalog_references": [], "prompt_length": 24586, "files_placed": 6, "status": "keep"}
{"timestamp": 1781354072.665354, "experiment_id": "3968ec17", "concept_title": "Hawking Radiation: Information Paradox Formalized", "concept_domain": "Physics", "research_mode": "team", "quality": "partial", "quality_score": 0.42587966666666666, "catalog_references": [], "prompt_length": 5850, "files_placed": 0, "status": "discard"}
{"timestamp": 1781354473.1197038, "experiment_id": "68473034", "concept_title": "The current work formalizes phase transitions for one-dimensional tropical polyn", "concept_domain": "Applications", "research_mode": "team", "quality": "partial", "quality_score": 0.42915265780730893, "catalog_references": [], "prompt_length": 17120, "files_placed": 0, "status": "discard"}
{"timestamp": 1781354884.9149976, "experiment_id": "c723d759", "concept_title": "Close Proofs: Spectral Universality of Arithmetic Quantum Graphs via Expander Lifts", "concept_domain": "Tropical", "research_mode": "team", "quality": "partial", "quality_score": 0.402983011126016, "catalog_references": [], "prompt_length": 11514, "files_placed": 0, "status": "discard"}
{"timestamp": 1781356784.6232178, "experiment_id": "d52959e6", "concept_title": "Quantum Topological Phase Computation", "concept_domain": "Physics", "research_mode": "team", "quality": "partial", "quality_score": 0.4184573657024794, "catalog_references": [], "prompt_length": 6311, "files_placed": 0, "status": "discard"}
{"timestamp": 1781356798.125431, "experiment_id": "08a1059c", "concept_title": "This cycle adds `Catalog/Logic/TemporalProofOrder.lean`, the order-theoretic /", "concept_domain": "Novelty", "research_mode": "team", "quality": "partial", "quality_score": 0.4716, "catalog_references": [], "prompt_length": 23826, "files_placed": 8, "status": "discard"}
{"timestamp": 1781356819.3544083, "experiment_id": "58bf776d", "concept_title": "`Cryptography/GMW.lean`, the first secret-sharing / GMW-co", "concept_domain": "Computation", "research_mode": "team", "quality": "partial", "quality_score": 0.54258, "catalog_references": [], "prompt_length": 19345, "files_placed": 0, "status": "keep"}
{"timestamp": 1781356837.3532972, "experiment_id": "e5a1971e", "concept_title": "Close Proofs: Information-Geometric Bridge: Fisher Metric on S", "concept_domain": "Novelty", "research_mode": "team", "quality": "partial", "quality_score": 0.46525999999999995, "catalog_references": [], "prompt_length": 6145, "files_placed": 0, "status": "discard"}
{"timestamp": 1781356859.2829797, "experiment_id": "f6400414", "concept_title": "`Physics/HawkingInformation.lean` reduces the black hole information paradox to ", "concept_domain": "Computation", "research_mode": "team", "quality": "partial", "quality_score": 0.3825617575757576, "catalog_references": [], "prompt_length": 16027, "files_placed": 0, "status": "discard"}
{"timestamp": 1781356883.75333, "experiment_id": "07f1a760", "concept_title": "The phantom number framework raises a natural classification question: what is t", "concept_domain": "Algebra", "research_mode": "team", "quality": "partial", "quality_score": 0.3397149217391304, "catalog_references": [], "prompt_length": 16656, "files_placed": 0, "status": "discard"}
{"timestamp": 1781356904.1103296, "experiment_id": "5e5a1291", "concept_title": "Persistent Renormalization Fixed Points in Neural PDE Solvers", "concept_domain": "Applications", "research_mode": "team", "quality": "partial", "quality_score": 0.57408, "catalog_references": [], "prompt_length": 7960, "files_placed": 0, "status": "keep"}
{"timestamp": 1781358823.0990133, "experiment_id": "a89be084", "concept_title": "Close Proofs: This cycle laid the load-bearing foundation of Baker\u2013Norine divisor th", "concept_domain": "Applications", "research_mode": "team", "quality": "partial", "quality_score": 0.4089411764705883, "catalog_references": [], "prompt_length": 6203, "files_placed": 0, "status": "discard"}
{"timestamp": 1781358842.200184, "experiment_id": "81fcaebc", "concept_title": "The foundational file `Catalog/Computation/SelfModifyingHalt.lean` established t", "concept_domain": "Novelty", "research_mode": "team", "quality": "partial", "quality_score": 0.68776, "catalog_references": [], "prompt_length": 24578, "files_placed": 5, "status": "keep"}
{"timestamp": 1781358861.3893392, "experiment_id": "11521006", "concept_title": "Close Proofs: The current formalization proves Z(m,n) \u2264 (m+1)^n (polynomial upper bo", "concept_domain": "Shared", "research_mode": "team", "quality": "partial", "quality_score": 0.5016, "catalog_references": [], "prompt_length": 6173, "files_placed": 0, "status": "keep"}
{"timestamp": 1781358880.2610996, "experiment_id": "9261c5c6", "concept_title": "Close Proofs: Entropy-Bounded Computation framework from a cold start as", "concept_domain": "Applications", "research_mode": "team", "quality": "partial", "quality_score": 0.47485714285714287, "catalog_references": [], "prompt_length": 6079, "files_placed": 0, "status": "discard"}
{"timestamp": 1781358904.0238872, "experiment_id": "c8ba5b5f", "concept_title": "This cycle opened a constructive, finite-alphabet bridge between the Fisher\u2013Rao", "concept_domain": "Logic", "research_mode": "team", "quality": "partial", "quality_score": 0.4192815086463924, "catalog_references": [], "prompt_length": 16852, "files_placed": 0, "status": "discard"}
{"timestamp": 1781359549.7863765, "experiment_id": "faff02b9", "concept_title": "This cycle tested one structural hypothesis behind *self-referential type theory", "concept_domain": "Pythagorean", "research_mode": "team", "quality": "partial", "quality_score": 0.42727189683908756, "catalog_references": [], "prompt_length": 22381, "files_placed": 0, "status": "discard"}
{"timestamp": 1781362178.2628162, "experiment_id": "4c3aa879", "concept_title": "Close Proofs: Spectral Universality of Transformer Attention via Random Matrix Free ", "concept_domain": "Applications", "research_mode": "team", "quality": "partial", "quality_score": 0.5958047722342733, "catalog_references": [], "prompt_length": 6197, "files_placed": 0, "status": "keep"}
{"timestamp": 1781362223.0993352, "experiment_id": "8864c74a", "concept_title": "Close Proofs: Close Proofs: Deepening: Quasi-symmetric maps generalize bi-Lipschitz ", "concept_domain": "Cryptography", "research_mode": "team", "quality": "partial", "quality_score": 0.48668, "catalog_references": [], "prompt_length": 6085, "files_placed": 0, "status": "discard"}
{"timestamp": 1781362251.6963592, "experiment_id": "269bddf5", "concept_title": "Close Proofs: The file `HigherPersistence.lean` lifts the catalog's 0-dimensional pe", "concept_domain": "Cryptography", "research_mode": "team", "quality": "partial", "quality_score": 0.5655999999999999, "catalog_references": [], "prompt_length": 6089, "files_placed": 0, "status": "keep"}
{"timestamp": 1781362912.2889767, "experiment_id": "d4312d23", "concept_title": "Deepening: This cycle built, from scratch and `sorry`-free, the ari", "concept_domain": "Novelty", "research_mode": "team", "quality": "substantial", "quality_score": 0.7923639215686276, "catalog_references": [], "prompt_length": 17782, "files_placed": 21, "status": "keep"}
{"timestamp": 1781362932.75389, "experiment_id": "315ae032", "concept_title": "From-scratch clique-complex theory in", "concept_domain": "MachineLearning", "research_mode": "team", "quality": "partial", "quality_score": 0.6962400000000001, "catalog_references": [], "prompt_length": 24174, "files_placed": 6, "status": "keep"}
{"timestamp": 1781364843.9510953, "experiment_id": "9b788018", "concept_title": "Close Proofs: Impossible Geometries: Where Parallel Lines Converge AND Diverge", "concept_domain": "Pythagorean", "research_mode": "team", "quality": "substantial", "quality_score": 0.7838083582089553, "catalog_references": [], "prompt_length": 17653, "files_placed": 7, "status": "keep"}
{"timestamp": 1781364862.7005322, "experiment_id": "d4325e20", "concept_title": "This cycle isolated the two engines that drive *every* quantitative", "concept_domain": "Cryptography", "research_mode": "team", "quality": "partial", "quality_score": 0.6424483582089553, "catalog_references": [], "prompt_length": 25438, "files_placed": 6, "status": "keep"}
