{"timestamp": 1783558422.5518708, "experiment_id": "e158da3a", "concept_title": "The Mathematics of Memes: Viral Information Topology", "concept_domain": "Physics", "research_mode": "team", "quality": "partial", "quality_score": 0.15058908000000001, "catalog_references": [], "prompt_length": 4864, "files_placed": 2, "status": "discard"}
{"timestamp": 1783559204.4746678, "experiment_id": "d19fecf5", "concept_title": "Godel's Casino: Incomplete but Winnable Games", "concept_domain": "Bridges", "research_mode": "prove", "quality": "partial", "quality_score": 0.226689, "catalog_references": ["Catalog/FINAL/Probability/DefinableMeasures.lean", "Catalog/FINAL/SetTheory/Independence.lean", "Catalog/FINAL/MeasureTheory/BasicProbability.lean", "Catalog/FINAL/Logic/Provability.lean"], "prompt_length": 23470, "files_placed": 6, "status": "discard"}
{"timestamp": 1783559691.2941883, "experiment_id": "7d533993", "concept_title": "Bukh's Exact Zero-Sum-Free Density Conjecture", "concept_domain": "Cryptography", "research_mode": "team", "quality": "partial", "quality_score": 0.19905299999999998, "catalog_references": ["Mathlib.Analysis.InnerProductSpace.Sphere", "Mathlib.MeasureTheory.Measure.Haar", "Mathlib.Combinatorics.Additive"], "prompt_length": 2953, "files_placed": 2, "status": "discard"}
{"timestamp": 1783565676.923762, "experiment_id": "382fdcde", "concept_title": "Persistent Maximal Simplices Count Equals Order of the Coxeter Group", "concept_domain": "Novelty", "research_mode": "team", "quality": "partial", "quality_score": 0.19585499999999997, "catalog_references": ["math.CO"], "prompt_length": 2814, "files_placed": 2, "status": "discard"}
{"timestamp": 1783565746.5004082, "experiment_id": "d12ad473", "concept_title": "Self-Improving Proofs: Proofs That Get Simpler Over Time", "concept_domain": "Shared", "research_mode": "formalize", "quality": "partial", "quality_score": 0.240672, "catalog_references": ["Logic/Propositional.lean", "Learning/TreeComplexity.lean", "ProofMethods/Redundancy.lean"], "prompt_length": 920, "files_placed": 4, "status": "discard"}
{"timestamp": 1783567099.1620524, "experiment_id": "8d243e81", "concept_title": "Impossible Geometries: Where Parallel Lines Converge AND Diverge", "concept_domain": "Novelty", "research_mode": "formalize", "quality": "substantial", "quality_score": 0.7115, "catalog_references": ["Algebra/Geometry/MetricSpaces.lean", "Algebra/Geometry/Manifolds.lean", "Algebra/Geometry/Geodesic.lean", "Algebra/Geometry/Curvature.lean", "Novelty/SplitGeometry.lean"], "prompt_length": 23461, "files_placed": 4, "status": "keep"}
{"timestamp": 1783574206.0423956, "experiment_id": "620b641b", "concept_title": "Existence of a nontrivial cycle of length n-O(n^{2/3}) in Hamiltonian graphs with \u03b4(G) \u2265 3", "concept_domain": "Logic", "research_mode": "team", "quality": "partial", "quality_score": 0.204513, "catalog_references": ["GKN2019", "GKNT2023", "HSV2006", "TC2013"], "prompt_length": 3027, "files_placed": 2, "status": "discard"}
{"timestamp": 1783577012.1740377, "experiment_id": "3877d438", "concept_title": "List Chromatic Number Bound for Uncrowded Uniform Hypergraphs", "concept_domain": "Computation", "research_mode": "formalize", "quality": "partial", "quality_score": 0.21534899999999998, "catalog_references": [], "prompt_length": 1889, "files_placed": 2, "status": "discard"}
{"timestamp": 1783581172.9804096, "experiment_id": "ac85eee2", "concept_title": "Impossible Geometries: Where Parallel Lines Converge AND Diverge", "concept_domain": "Computation", "research_mode": "team", "quality": "partial", "quality_score": 0.207768, "catalog_references": [], "prompt_length": 4799, "files_placed": 2, "status": "discard"}
{"timestamp": 1783587272.1439981, "experiment_id": "b99a839a", "concept_title": "Tightness of the 3\u0394-1 Bound for SD-EF1 Allocations", "concept_domain": "Novelty", "research_mode": "formalize", "quality": "partial", "quality_score": 0.195, "catalog_references": ["Catalog/FINAL/GraphTheory/Basic.lean", "Catalog/FINAL/Combinatorics/ChromaticNumber.lean", "Catalog/FINAL/FairDivision/EF1Definitions.lean"], "prompt_length": 1058, "files_placed": 2, "status": "discard"}
{"timestamp": 1783587350.1267023, "experiment_id": "c4017799", "concept_title": "Self-Improving Proofs: Proofs That Get Simpler Over Time", "concept_domain": "NumberTheory", "research_mode": "team", "quality": "partial", "quality_score": 0.5808559999999999, "catalog_references": [], "prompt_length": 24070, "files_placed": 4, "status": "keep"}
{"timestamp": 1783589770.4821432, "experiment_id": "57910dd4", "concept_title": "The L-Function Universe: A Cosmic Census of All L-Functions", "concept_domain": "Applications", "research_mode": "team", "quality": "partial", "quality_score": 0.237336, "catalog_references": [], "prompt_length": 4763, "files_placed": 3, "status": "discard"}
{"timestamp": 1783593458.086266, "experiment_id": "685d9909", "concept_title": "Extension of Gaussian CLT to Rademacher random multiplicative functions in all short intervals", "concept_domain": "Pythagorean", "research_mode": "formalize", "quality": "partial", "quality_score": 0.21205153714285713, "catalog_references": ["Probability/SquarefreeVariance.lean"], "prompt_length": 20023, "files_placed": 4, "status": "discard"}
{"timestamp": 1783597568.82657, "experiment_id": "0518b354", "concept_title": "The L-Function Universe: A Cosmic Census of All L-Functions", "concept_domain": "Geometry", "research_mode": "team", "quality": "partial", "quality_score": 0.21123599999999998, "catalog_references": [], "prompt_length": 24074, "files_placed": 4, "status": "discard"}
{"timestamp": 1783599927.6192188, "experiment_id": "a6d77751", "concept_title": "Extension of Matsuno's Formula for Non-Vanishing \u03bc-Invariants", "concept_domain": "Probability", "research_mode": "team", "quality": "partial", "quality_score": 0.2268, "catalog_references": ["Spr12", "Pol03", "Mat08", "Hatley-Ray"], "prompt_length": 9461, "files_placed": 2, "status": "discard"}
{"timestamp": 1783611456.811513, "experiment_id": "f459aaa0", "concept_title": "Impossible Geometries: Where Parallel Lines Converge AND Diverge", "concept_domain": "Algebra", "research_mode": "team", "quality": "partial", "quality_score": 0.204012, "catalog_references": [], "prompt_length": 11738, "files_placed": 2, "status": "discard"}
{"timestamp": 1783612416.0769954, "experiment_id": "92311cae", "concept_title": "Symmetric Colorings of Hales-Jewett Cubes Coincide with One-Weight Colorings", "concept_domain": "Physics", "research_mode": "team", "quality": "partial", "quality_score": 0.213, "catalog_references": ["math.CO", "Hales-Jewett theorem", "Gallai homothety numbers", "van der Waerden numbers"], "prompt_length": 9662, "files_placed": 2, "status": "discard"}
{"timestamp": 1783620867.0119805, "experiment_id": "ad941b96", "concept_title": "The Mathematics of Memes: Viral Information Topology", "concept_domain": "MachineLearning", "research_mode": "formalize", "quality": "partial", "quality_score": 0.22026899999999996, "catalog_references": ["MachineLearning/MemeGraphCohomology.lean", "MachineLearning/MemeDisconnectedCohomology.lean"], "prompt_length": 1102, "files_placed": 4, "status": "discard"}
{"timestamp": 1783626891.3082268, "experiment_id": "6b4ee47d", "concept_title": "Upper Bound on Generalized Tur\u00e1n Number ex(n, K_{a,b}, K_{3,b+1})", "concept_domain": "Combinatorics", "research_mode": "team", "quality": "partial", "quality_score": 0.63, "catalog_references": ["math.CO", "Generalized Tur\u00e1n number", "Complete bipartite graphs", "K\u0151v\u00e1ri\u2013S\u00f3s\u2013Tur\u00e1n theorem"], "prompt_length": 22552, "files_placed": 4, "status": "keep"}
{"timestamp": 1783626899.5662298, "experiment_id": "52557551", "concept_title": "Local-to-Global KKL Theorem for Simplicial Complexes with Local KKL Links", "concept_domain": "Cryptography", "research_mode": "team", "quality": "partial", "quality_score": 0.63, "catalog_references": ["Kahn88", "Bafna22", "Gur22", "Gotlib23"], "prompt_length": 23112, "files_placed": 4, "status": "keep"}
{"timestamp": 1783626916.4074955, "experiment_id": "8202f9a7", "concept_title": "Conditional Refinement of Page's Theorem on Landau-Siegel Zeros", "concept_domain": "Novelty", "research_mode": "formalize", "quality": "partial", "quality_score": 0.6749863157894737, "catalog_references": ["Mathlib/NumberTheory/DirichletCharacter.lean", "Mathlib/Analysis/Complex/Log.lean", "Mathlib/Analysis/Asymptotics.lean", "FINAL/AnalyticNumberTheory/DeuringHeilbronn.lean", "FINAL/Computability/Enumerate.lean"], "prompt_length": 23249, "files_placed": 5, "status": "keep"}
{"timestamp": 1783629017.8428555, "experiment_id": "26e5c4d5", "concept_title": "Monochromatic Pythagorean Triples in Every Level Set of Completely Multiplicative Functions", "concept_domain": "Tropical", "research_mode": "team", "quality": "partial", "quality_score": 0.63, "catalog_references": ["math.NT", "math.CO", "Pythagorean_triples", "completely_multiplicative_functions", "Ramsey_theory", "partition_regularity"], "prompt_length": 23414, "files_placed": 4, "status": "keep"}
{"timestamp": 1783630076.6755316, "experiment_id": "6c21e233", "concept_title": "Total Positivity of the Interval Subdivision Transformation Matrix", "concept_domain": "Novelty", "research_mode": "prove", "quality": "partial", "quality_score": 0.618, "catalog_references": ["FINAL/Algebra/TotalPositivity.lean", "FINAL/Algebra/MatrixOperations.lean", "FINAL/Algebra/MinorTheory.lean", "FINAL/Algebra/IntervalSubdivision.lean"], "prompt_length": 22804, "files_placed": 5, "status": "keep"}
{"timestamp": 1783630081.4429746, "experiment_id": "6b9c675a", "concept_title": "Self-Improving Proofs: Proofs That Get Simpler Over Time", "concept_domain": "Novelty", "research_mode": "prove", "quality": "partial", "quality_score": 0.63, "catalog_references": ["Catalog/FINAL/Logic/ProofComplexity.lean", "Catalog/FINAL/Computability/WellFounded.lean", "Catalog/FINAL/Data/ComplexityMeasures.lean", "Catalog/FINAL/Logic/BasicProofSystems.lean"], "prompt_length": 23582, "files_placed": 5, "status": "keep"}
{"timestamp": 1783631147.9527686, "experiment_id": "c2c03fe8", "concept_title": "Tensor Amplification and Spectral Transfer for Sidorenko-Type Inequalities", "concept_domain": "Computation", "research_mode": "team", "quality": "partial", "quality_score": 0.63, "catalog_references": ["ErdosSimonovits1984", "LovaszSzegedy2006", "ConlonFoxSudakov2010", "LiSzegedy2026"], "prompt_length": 22939, "files_placed": 4, "status": "keep"}
{"timestamp": 1783632220.8845387, "experiment_id": "00f256fb", "concept_title": "Godel's Casino: Incomplete but Winnable Games", "concept_domain": "Shared", "research_mode": "team", "quality": "partial", "quality_score": 0.63, "catalog_references": [], "prompt_length": 24004, "files_placed": 4, "status": "keep"}
{"timestamp": 1783632225.610642, "experiment_id": "c38e66e4", "concept_title": "Power\u2011of\u2011Two Perfect Matching Count in Class\u202fB Graphs", "concept_domain": "NumberTheory", "research_mode": "team", "quality": "substantial", "quality_score": 0.82, "catalog_references": ["arXiv:2305.12345", "Diestel, R.\u00a0\"Graph Theory\"", "Lov\u00e1sz, L., Plummer, M.\u00a0\"Matching Theory\""], "prompt_length": 22567, "files_placed": 4, "status": "keep"}
{"timestamp": 1783635377.309989, "experiment_id": "55f141e7", "concept_title": "The L-Function Universe: A Cosmic Census of All L-Functions", "concept_domain": "Applications", "research_mode": "team", "quality": "substantial", "quality_score": 0.7, "catalog_references": [], "prompt_length": 23748, "files_placed": 4, "status": "keep"}
{"timestamp": 1783637485.501935, "experiment_id": "643186e8", "concept_title": "Tropical Dreams: The Field with One Element Meets Tropical Geometry", "concept_domain": "Algebra", "research_mode": "team", "quality": "substantial", "quality_score": 0.82, "catalog_references": [], "prompt_length": 24129, "files_placed": 4, "status": "keep"}
{"timestamp": 1783637497.4446895, "experiment_id": "84ab5171", "concept_title": "Cellular Automata as Algebraic Geometry: Wolfram's Rules Meet Grothendieck", "concept_domain": "Applications", "research_mode": "team", "quality": "substantial", "quality_score": 0.82, "catalog_references": [], "prompt_length": 23984, "files_placed": 4, "status": "keep"}
{"timestamp": 1783640645.988673, "experiment_id": "3716954d", "concept_title": "The L-Function Universe: A Cosmic Census of All L-Functions", "concept_domain": "Applications", "research_mode": "team", "quality": "substantial", "quality_score": 0.78, "catalog_references": [], "prompt_length": 24082, "files_placed": 4, "status": "keep"}
{"timestamp": 1783642869.8733635, "experiment_id": "7e60f6c2", "concept_title": "Fractal Dimension of Proof Search: How Hard Is It to Find a Proof?", "concept_domain": "Bridges", "research_mode": "team", "quality": "substantial", "quality_score": 0.83, "catalog_references": [], "prompt_length": 23900, "files_placed": 4, "status": "keep"}
{"timestamp": 1783642875.137812, "experiment_id": "c05d7abb", "concept_title": "Hilbert's Hotel for Primes: An Infinite Hotel Where Every Guest Is Prime", "concept_domain": "Novelty", "research_mode": "team", "quality": "substantial", "quality_score": 0.82, "catalog_references": [], "prompt_length": 23683, "files_placed": 4, "status": "keep"}
{"timestamp": 1783644993.3155062, "experiment_id": "acc2ac17", "concept_title": "The P vs NP of Cooking: Computational Complexity of Recipes", "concept_domain": "Logic", "research_mode": "team", "quality": "substantial", "quality_score": 0.72, "catalog_references": [], "prompt_length": 23103, "files_placed": 4, "status": "keep"}
{"timestamp": 1783646042.3196325, "experiment_id": "90ef345f", "concept_title": "The Mandelbrot Set's Secret Number Theory: Quadratic Recurrence and Primality", "concept_domain": "Probability", "research_mode": "team", "quality": "substantial", "quality_score": 0.83, "catalog_references": [], "prompt_length": 24028, "files_placed": 52, "status": "keep"}
{"timestamp": 1783648117.0192122, "experiment_id": "7ca0f553", "concept_title": "Infinite Chess: Checkmate in Omega Moves", "concept_domain": "Pythagorean", "research_mode": "team", "quality": "substantial", "quality_score": 0.82, "catalog_references": [], "prompt_length": 23366, "files_placed": 4, "status": "keep"}
{"timestamp": 1783648129.99274, "experiment_id": "4de79d68", "concept_title": "Deepening: Hilbert's Hotel for Primes: An Infinite Hotel Where Every Guest Is Prime", "concept_domain": "Logic", "research_mode": "team", "quality": "substantial", "quality_score": 0.83, "catalog_references": [], "prompt_length": 23263, "files_placed": 4, "status": "keep"}
{"timestamp": 1783651296.0712514, "experiment_id": "14000bf9", "concept_title": "The Mathematics of Jigsaw Puzzles: NP-Completeness and Topology", "concept_domain": "Novelty", "research_mode": "team", "quality": "substantial", "quality_score": 0.82, "catalog_references": [], "prompt_length": 24003, "files_placed": 4, "status": "keep"}
{"timestamp": 1783652346.962306, "experiment_id": "7976e906", "concept_title": "Exponential Lower Bound for Rips c-Approximation in Bounded Doubling Dimension", "concept_domain": "MachineLearning", "research_mode": "team", "quality": "partial", "quality_score": 0.62, "catalog_references": ["Sheehy 2013 - Linear-size approximations in bounded doubling dimension", "Rabad\u00e1n and Dey 2016 - Sparse approximations for topological inference", "Chazal et al. 2014 - Persistence stability and interleaving distances", "Wagner 2016 - Correctly approximating the Rips and \u010cech complexes"], "prompt_length": 3664, "files_placed": 3, "status": "keep"}
{"timestamp": 1783652354.7088234, "experiment_id": "7a9dcf2f", "concept_title": "The Topology of Knotted Light: How Laser Beams Get Tangled", "concept_domain": "MachineLearning", "research_mode": "team", "quality": "substantial", "quality_score": 0.78, "catalog_references": [], "prompt_length": 22791, "files_placed": 4, "status": "keep"}
{"timestamp": 1783653406.2045426, "experiment_id": "6490730e", "concept_title": "Generalized Multinomial Convolution Identity for Latin Rectangle Enumeration", "concept_domain": "MachineLearning", "research_mode": "team", "quality": "substantial", "quality_score": 0.83, "catalog_references": ["math.CO", "Gessel_formula", "Latin_rectangles", "rook_polynomials", "multinomial_coefficients"], "prompt_length": 22310, "files_placed": 4, "status": "keep"}
{"timestamp": 1783654453.7433698, "experiment_id": "4d9b342d", "concept_title": "Homotopy Type Theory of Cooking Recipes: Paths Between Dishes", "concept_domain": "Physics", "research_mode": "team", "quality": "substantial", "quality_score": 0.7, "catalog_references": [], "prompt_length": 23151, "files_placed": 4, "status": "keep"}
{"timestamp": 1783657548.8823068, "experiment_id": "298c68ef", "concept_title": "Godel's Casino: Incomplete but Winnable Games", "concept_domain": "Applications", "research_mode": "team", "quality": "substantial", "quality_score": 0.78, "catalog_references": [], "prompt_length": 24016, "files_placed": 4, "status": "keep"}
{"timestamp": 1783659651.701358, "experiment_id": "73d4b43b", "concept_title": "Proofs as DAGs: The Directed Acyclic Graph Structure of Mathematics", "concept_domain": "Applications", "research_mode": "team", "quality": "substantial", "quality_score": 0.78, "catalog_references": [], "prompt_length": 24192, "files_placed": 4, "status": "keep"}
{"timestamp": 1783660698.4838367, "experiment_id": "dd8b10c1", "concept_title": "The Fundamental Theorem of Cakes: Algebraic Geometry of Baking", "concept_domain": "Applications", "research_mode": "team", "quality": "substantial", "quality_score": 0.72, "catalog_references": [], "prompt_length": 23999, "files_placed": 4, "status": "keep"}
{"timestamp": 1783660706.8527765, "experiment_id": "4d30d98b", "concept_title": "The Zeta Function of a Graph: Number Theory on Networks", "concept_domain": "Novelty", "research_mode": "team", "quality": "substantial", "quality_score": 0.83, "catalog_references": [], "prompt_length": 24053, "files_placed": 4, "status": "keep"}
{"timestamp": 1783661747.0045683, "experiment_id": "48961a11", "concept_title": "Bayesian Werewolf: Optimal Strategy for Social Deduction Games", "concept_domain": "Applications", "research_mode": "team", "quality": "substantial", "quality_score": 0.83, "catalog_references": [], "prompt_length": 24143, "files_placed": 4, "status": "keep"}
{"timestamp": 1783661758.317827, "experiment_id": "b152086d", "concept_title": "The Uncertainty Principle Is a Fourier Thing: Position-Momentum Duality", "concept_domain": "Applications", "research_mode": "team", "quality": "substantial", "quality_score": 0.72, "catalog_references": [], "prompt_length": 23659, "files_placed": 4, "status": "keep"}
{"timestamp": 1783667850.3740513, "experiment_id": "996ff4be", "concept_title": "The Category Theory of Jokes: Universal Properties of Humor", "concept_domain": "Applications", "research_mode": "team", "quality": "substantial", "quality_score": 0.78, "catalog_references": [], "prompt_length": 24186, "files_placed": 4, "status": "keep"}
{"timestamp": 1783668818.3161378, "experiment_id": "34a8cfea", "concept_title": "Graph Coloring with Emotions: The Chromatic Polynomial Meets Psychology", "concept_domain": "Novelty", "research_mode": "team", "quality": "substantial", "quality_score": 0.82, "catalog_references": [], "prompt_length": 24124, "files_placed": 4, "status": "keep"}
{"timestamp": 1783669777.41728, "experiment_id": "956fff13", "concept_title": "Persistent Homology of Prime Numbers: The Topology of Arithmetic", "concept_domain": "Novelty", "research_mode": "team", "quality": "substantial", "quality_score": 0.82, "catalog_references": [], "prompt_length": 24107, "files_placed": 4, "status": "keep"}
{"timestamp": 1783669789.8946803, "experiment_id": "4936bb72", "concept_title": "Deepening: The Zeta Function of a Graph: Number Theory on Networks", "concept_domain": "Novelty", "research_mode": "team", "quality": "substantial", "quality_score": 0.85, "catalog_references": [], "prompt_length": 23249, "files_placed": 4, "status": "keep"}
{"timestamp": 1783670757.8270597, "experiment_id": "9696343b", "concept_title": "Persistent Homology of Musical Harmony: The Topology of Bach", "concept_domain": "Applications", "research_mode": "team", "quality": "substantial", "quality_score": 0.72, "catalog_references": [], "prompt_length": 23562, "files_placed": 4, "status": "keep"}
{"timestamp": 1783671723.3578193, "experiment_id": "39669115", "concept_title": "The P vs NP of Sudoku: Phase Transitions in Constraint Satisfaction", "concept_domain": "Applications", "research_mode": "team", "quality": "substantial", "quality_score": 0.83, "catalog_references": [], "prompt_length": 23599, "files_placed": 4, "status": "keep"}
{"timestamp": 1783672684.697108, "experiment_id": "7e49f0c7", "concept_title": "Stochastic Galois Theory: Random Permutations Have Generic Galois Groups", "concept_domain": "Novelty", "research_mode": "team", "quality": "substantial", "quality_score": 0.83, "catalog_references": [], "prompt_length": 23671, "files_placed": 4, "status": "keep"}
{"timestamp": 1783672690.152162, "experiment_id": "3fa70466", "concept_title": "Turing's Flowers: Morphogenesis as Algebraic Geometry", "concept_domain": "Novelty", "research_mode": "team", "quality": "substantial", "quality_score": 0.79, "catalog_references": [], "prompt_length": 24162, "files_placed": 4, "status": "keep"}
{"timestamp": 1783674609.9815943, "experiment_id": "9c1224fc", "concept_title": "Topological Quantum Compiling: Braid Groups as Universal Gates", "concept_domain": "Applications", "research_mode": "team", "quality": "substantial", "quality_score": 0.72, "catalog_references": [], "prompt_length": 23896, "files_placed": 4, "status": "keep"}
