{"timestamp": 1787305997.9166179, "experiment_id": "315472d4", "concept_title": "Markoff Tree Transfer — Carrying the Berggren Tree's Machinery to the Markoff Tree", "concept_domain": "Cryptography", "research_mode": "team", "quality": "substantial", "quality_score": 0.82, "catalog_references": [], "prompt_length": 28044, "files_placed": 4, "status": "keep"}
{"timestamp": 1787309256.5441766, "experiment_id": "fe1191f5", "concept_title": "Harmonic Measure on the Berggren Tree Boundary — Random Walks and the 3-adic Cantor Set", "concept_domain": "Bridges", "research_mode": "team", "quality": "substantial", "quality_score": 0.88, "catalog_references": [], "prompt_length": 27927, "files_placed": 5, "status": "keep"}
{"timestamp": 1787320749.5576415, "experiment_id": "b5bb3340", "concept_title": "Topological Quantum Computation from the Berggren Groupoid — Anyonic Braiding on the Tree Boundary", "concept_domain": "Shared", "research_mode": "team", "quality": "substantial", "quality_score": 0.78, "catalog_references": [], "prompt_length": 28308, "files_placed": 4, "status": "keep"}
{"timestamp": 1787320766.2498705, "experiment_id": "75105c60", "concept_title": "The Berggren Causal Set — Pythagorean Triples as a Discrete Model of Spacetime", "concept_domain": "Novelty", "research_mode": "team", "quality": "substantial", "quality_score": 0.82, "catalog_references": [], "prompt_length": 28043, "files_placed": 4, "status": "keep"}
{"timestamp": 1787331094.3005624, "experiment_id": "ec6993b5", "concept_title": "Strict unimodality and the bracketing of the argmax are already theorems, so the", "concept_domain": "Shared", "research_mode": "team", "quality": "substantial", "quality_score": 0.82, "catalog_references": [], "prompt_length": 25996, "files_placed": 4, "status": "keep"}
{"timestamp": 1787331112.0330598, "experiment_id": "58852b38", "concept_title": "Formalizing the Probabilistic Method: Erdos Meets Lean", "concept_domain": "Bridges", "research_mode": "team", "quality": "substantial", "quality_score": 0.89, "catalog_references": [], "prompt_length": 27117, "files_placed": 4, "status": "keep"}
{"timestamp": 1787334359.2733698, "experiment_id": "f87f1170", "concept_title": "Sharper threshold certification", "concept_domain": "Cryptography", "research_mode": "team", "quality": "substantial", "quality_score": 0.86, "catalog_references": [], "prompt_length": 26036, "files_placed": 4, "status": "keep"}
{"timestamp": 1787338588.2045662, "experiment_id": "df44f621", "concept_title": "The exact ensemble dichotomy", "concept_domain": "Combinatorics", "research_mode": "team", "quality": "substantial", "quality_score": 0.82, "catalog_references": [], "prompt_length": 26442, "files_placed": 4, "status": "keep"}
{"timestamp": 1787338601.275929, "experiment_id": "d588a53d", "concept_title": "The Pythagorean Hydra — Natural Independence for the Berggren Tree", "concept_domain": "Geometry", "research_mode": "team", "quality": "substantial", "quality_score": 0.82, "catalog_references": [], "prompt_length": 28414, "files_placed": 4, "status": "keep"}
{"timestamp": 1787341079.6308656, "experiment_id": "532d78bc", "concept_title": "The Riemann Hypothesis for the Berggren Tree — A Zeta Function with a Provable Critical Line", "concept_domain": "Novelty", "research_mode": "team", "quality": "substantial", "quality_score": 0.85, "catalog_references": [], "prompt_length": 28103, "files_placed": 4, "status": "keep"}
{"timestamp": 1787341094.5236192, "experiment_id": "63cef724", "concept_title": "Arithmetic on the Moebius Band: A Number System with a Twist", "concept_domain": "MachineLearning", "research_mode": "team", "quality": "substantial", "quality_score": 0.79, "catalog_references": [], "prompt_length": 27053, "files_placed": 4, "status": "keep"}
{"timestamp": 1787344926.2357004, "experiment_id": "018e116a", "concept_title": "Bound the length of distinguishing experiments", "concept_domain": "Pythagorean", "research_mode": "team", "quality": "substantial", "quality_score": 0.86, "catalog_references": [], "prompt_length": 26211, "files_placed": 4, "status": "keep"}
{"timestamp": 1787348360.737106, "experiment_id": "ef4f9365", "concept_title": "The Berggren Tree and the Langlands Program — Automorphic Forms on the 3-adic Boundary over Q(√2)", "concept_domain": "MachineLearning", "research_mode": "team", "quality": "substantial", "quality_score": 0.83, "catalog_references": [], "prompt_length": 28009, "files_placed": 4, "status": "keep"}
{"timestamp": 1787348375.2378685, "experiment_id": "28aa3954", "concept_title": "single-voter exchange law.", "concept_domain": "Pythagorean", "research_mode": "team", "quality": "substantial", "quality_score": 0.82, "catalog_references": [], "prompt_length": 26287, "files_placed": 4, "status": "keep"}
{"timestamp": 1787352134.5809083, "experiment_id": "3cb644d1", "concept_title": "The Tree as a Solvable Model of the abc Conjecture — The Exact Quality Spectrum of a²+b²=c²", "concept_domain": "Logic", "research_mode": "team", "quality": "substantial", "quality_score": 0.82, "catalog_references": [], "prompt_length": 28187, "files_placed": 4, "status": "keep"}
{"timestamp": 1787352148.2757144, "experiment_id": "85ca8e3d", "concept_title": "The invariant is now defined and proven to be a submonoid", "concept_domain": "Computation", "research_mode": "team", "quality": "substantial", "quality_score": 0.86, "catalog_references": [], "prompt_length": 26109, "files_placed": 4, "status": "keep"}
{"timestamp": 1787355520.1601791, "experiment_id": "1632a2eb", "concept_title": "General codiscrete construction", "concept_domain": "Combinatorics", "research_mode": "team", "quality": "substantial", "quality_score": 0.79, "catalog_references": [], "prompt_length": 25966, "files_placed": 4, "status": "keep"}
{"timestamp": 1787355533.879593, "experiment_id": "663f5de8", "concept_title": "The corrected-product operation is now a proved closure property", "concept_domain": "Computation", "research_mode": "team", "quality": "substantial", "quality_score": 0.89, "catalog_references": [], "prompt_length": 26097, "files_placed": 4, "status": "keep"}
{"timestamp": 1787360860.8263748, "experiment_id": "1210c28a", "concept_title": "Formal target: define `IsCliqueSum` (sides meeting in a fixed `k`-clique `K`); prove\n`α(G) ≥ α₁ + α₂ - 1` (an independent set meets a clique at most once) and\n`χ(G) = max(χ₁, χ₂)` for `n ≥ k`, with bo", "concept_domain": "Pythagorean", "research_mode": "team", "quality": "substantial", "quality_score": 0.82, "catalog_references": [], "prompt_length": 26198, "files_placed": 6, "status": "keep"}
{"timestamp": 1787363478.0737689, "experiment_id": "7f454a93", "concept_title": "The number of triples `(a,b,c)` with `0 < a,b,c ≤ H` that are Berggren-generated\nfrom a positive seed is `Θ(H)` — vanishingly few compared with `H³` — while the\nnumber of *Pythagorean* triples in the ", "concept_domain": "NumberTheory", "research_mode": "team", "quality": "substantial", "quality_score": 0.82, "catalog_references": [], "prompt_length": 26282, "files_placed": 4, "status": "keep"}
{"timestamp": 1787363490.4344416, "experiment_id": "11e84a32", "concept_title": "Definability boundary for external interpretations", "concept_domain": "Applications", "research_mode": "team", "quality": "substantial", "quality_score": 0.87, "catalog_references": [], "prompt_length": 26503, "files_placed": 4, "status": "keep"}
{"timestamp": 1787368086.0081367, "experiment_id": "5f0e4f5e", "concept_title": "The Lagrange engine `powerSum_rigidity` is already formalised and it isolates", "concept_domain": "Applications", "research_mode": "team", "quality": "substantial", "quality_score": 0.86, "catalog_references": [], "prompt_length": 26014, "files_placed": 4, "status": "keep"}
{"timestamp": 1787371063.8471322, "experiment_id": "16cb59c0", "concept_title": "Prove that `trace(B^n)` counts rooted closed non-backtracking walks of length `n`.", "concept_domain": "Algebra", "research_mode": "team", "quality": "substantial", "quality_score": 0.86, "catalog_references": [], "prompt_length": 25920, "files_placed": 5, "status": "keep"}
{"timestamp": 1787374215.874132, "experiment_id": "a7626bf4", "concept_title": "The real-analytic version on `|q| < 1` is proved; only the passage from `ℝ` to", "concept_domain": "Physics", "research_mode": "team", "quality": "substantial", "quality_score": 0.88, "catalog_references": [], "prompt_length": 25952, "files_placed": 9, "status": "keep"}
{"timestamp": 1787374227.9541733, "experiment_id": "71e110b3", "concept_title": "Study fair schedules under arbitrary positive rate profiles and construct exact-rate disjoint batches using prefix sums.", "concept_domain": "Novelty", "research_mode": "team", "quality": "substantial", "quality_score": 0.82, "catalog_references": [], "prompt_length": 25996, "files_placed": 8, "status": "keep"}
{"timestamp": 1787377391.1512535, "experiment_id": "eb2ba545", "concept_title": "prove *completeness* — every labelling is dominated by some DP run;", "concept_domain": "Logic", "research_mode": "team", "quality": "substantial", "quality_score": 0.85, "catalog_references": [], "prompt_length": 25886, "files_placed": 5, "status": "keep"}
{"timestamp": 1787377404.1644337, "experiment_id": "77469890", "concept_title": "FACT round-31 #2 — INDEPENDENT-VERIFICATION: the character captures exactly one bit (paper 109)", "concept_domain": "NumberTheory", "research_mode": "team", "quality": "substantial", "quality_score": 0.82, "catalog_references": [], "prompt_length": 27054, "files_placed": 4, "status": "keep"}
{"timestamp": 1787382014.4422, "experiment_id": "0e0f4ea6", "concept_title": "FACT round-29 #2 — JOINT-ANOMALY-RECONCILED: paper 91 stands, the rebuild collapsed (paper 100)", "concept_domain": "Applications", "research_mode": "team", "quality": "substantial", "quality_score": 0.82, "catalog_references": [], "prompt_length": 27392, "files_placed": 4, "status": "keep"}
{"timestamp": 1787382029.7998536, "experiment_id": "a3ad9f21", "concept_title": "FACT round-30 #4 — TRACE-BATTERY: joint capacity scaling confirmed (paper 108)", "concept_domain": "Combinatorics", "research_mode": "team", "quality": "substantial", "quality_score": 0.82, "catalog_references": [], "prompt_length": 26542, "files_placed": 4, "status": "keep"}
{"timestamp": 1787384789.9811018, "experiment_id": "d7470f1b", "concept_title": "Filtration lemma", "concept_domain": "Combinatorics", "research_mode": "team", "quality": "substantial", "quality_score": 0.86, "catalog_references": [], "prompt_length": 25961, "files_placed": 4, "status": "keep"}
{"timestamp": 1787388515.9000857, "experiment_id": "9d22f1f1", "concept_title": "FACT round-32 #3 — UNIVERSAL-S3-EXTENDED: three fields, one answer (paper 114)", "concept_domain": "Physics", "research_mode": "team", "quality": "substantial", "quality_score": 0.83, "catalog_references": [], "prompt_length": 26302, "files_placed": 4, "status": "keep"}
{"timestamp": 1787388530.8491905, "experiment_id": "e82f11a2", "concept_title": "Both ingredients are already machine-checked (the sharp bound and 1-sum closure),", "concept_domain": "MachineLearning", "research_mode": "team", "quality": "substantial", "quality_score": 0.82, "catalog_references": [], "prompt_length": 26036, "files_placed": 4, "status": "keep"}
{"timestamp": 1787391794.1074343, "experiment_id": "175408d6", "concept_title": "The Bonferroni machinery", "concept_domain": "Geometry", "research_mode": "team", "quality": "substantial", "quality_score": 0.87, "catalog_references": [], "prompt_length": 26005, "files_placed": 4, "status": "keep"}
{"timestamp": 1787398582.8935857, "experiment_id": "6f0c0f57", "concept_title": "FACT round-32 #3 — CYCLIC-CUBIC-TYPE-CHANNEL: two types, full pinning (paper 122)", "concept_domain": "Applications", "research_mode": "team", "quality": "substantial", "quality_score": 0.85, "catalog_references": [], "prompt_length": 26207, "files_placed": 4, "status": "keep"}
{"timestamp": 1787398598.8643801, "experiment_id": "08e16c4e", "concept_title": "Aleph-1 Surface: Geometry Between Dimensions", "concept_domain": "NumberTheory", "research_mode": "team", "quality": "substantial", "quality_score": 0.85, "catalog_references": [], "prompt_length": 26106, "files_placed": 4, "status": "keep"}
{"timestamp": 1787403734.8334172, "experiment_id": "0f0bd7f8", "concept_title": "Cycle 4 already provides the two witnesses and the joint-inconsistency", "concept_domain": "Probability", "research_mode": "team", "quality": "substantial", "quality_score": 0.9, "catalog_references": [], "prompt_length": 26057, "files_placed": 5, "status": "keep"}
{"timestamp": 1787403750.431133, "experiment_id": "bb070ee4", "concept_title": "The one-parameter case is already a theorem here", "concept_domain": "Algebra", "research_mode": "team", "quality": "substantial", "quality_score": 0.88, "catalog_references": [], "prompt_length": 26091, "files_placed": 4, "status": "keep"}
{"timestamp": 1787406351.684428, "experiment_id": "c99dba13", "concept_title": "The `L¹` bound integrates to a Fisher–Rao length bound* (previously\n  Conjecture 5).", "concept_domain": "Algebra", "research_mode": "team", "quality": "substantial", "quality_score": 0.85, "catalog_references": [], "prompt_length": 25967, "files_placed": 4, "status": "keep"}
{"timestamp": 1787409529.2163947, "experiment_id": "a1194bd0", "concept_title": "FACT round-37 #2 — SUBEXP-SCALE: the QS relation pool is random-equivalent at every scale (paper 130)", "concept_domain": "Shared", "research_mode": "team", "quality": "substantial", "quality_score": 0.78, "catalog_references": [], "prompt_length": 27486, "files_placed": 4, "status": "keep"}
{"timestamp": 1787412970.9425073, "experiment_id": "c08b5555", "concept_title": "Open here; the multiplicative bound `|supp f| · |supp f̂| ≥ p` is proved", "concept_domain": "Shared", "research_mode": "team", "quality": "substantial", "quality_score": 0.93, "catalog_references": [], "prompt_length": 26054, "files_placed": 5, "status": "keep"}
{"timestamp": 1787420208.0893834, "experiment_id": "ba827ea4", "concept_title": "Ternary radius-one finite-window classification", "concept_domain": "Cryptography", "research_mode": "team", "quality": "substantial", "quality_score": 0.88, "catalog_references": [], "prompt_length": 26085, "files_placed": 4, "status": "keep"}
{"timestamp": 1787420222.3388636, "experiment_id": "43b197e4", "concept_title": "FACT round-40 #1 — QR-RESIDUAL: footprint-weighted dial captures the residual (paper 145)", "concept_domain": "MachineLearning", "research_mode": "team", "quality": "substantial", "quality_score": 0.89, "catalog_references": [], "prompt_length": 26800, "files_placed": 4, "status": "keep"}
{"timestamp": 1787424603.04556, "experiment_id": "113c03c3", "concept_title": "FACT round-37 #4 — CONVERSE-CAP-THEOREM: the barrier-4 converse proved for the residue-dial stratum, universal cap 4/3 (paper 132)", "concept_domain": "Cryptography", "research_mode": "team", "quality": "substantial", "quality_score": 0.82, "catalog_references": [], "prompt_length": 27524, "files_placed": 4, "status": "keep"}
{"timestamp": 1787427377.406744, "experiment_id": "a4769f7a", "concept_title": "FACT round-35 #7 — CYCLIC-CUBIC-CONDUCTOR-13: full pinning extends across conductors (paper 126)", "concept_domain": "Bridges", "research_mode": "team", "quality": "substantial", "quality_score": 0.9, "catalog_references": [], "prompt_length": 26215, "files_placed": 13, "status": "keep"}
{"timestamp": 1787427392.7183077, "experiment_id": "ae01533d", "concept_title": "NET-52: THE-TOY-FOUR-BIT-FLOOR-DOES-NOT-TRANSFER — per-channel RTN 4-bit costs +0.79 CE on Qwen2.5-0.5B (16x the toy floor budget); group-128 halves it; depth gradient and mesh sharpness confirmed", "concept_domain": "NumberTheory", "research_mode": "team", "quality": "substantial", "quality_score": 0.78, "catalog_references": [], "prompt_length": 28607, "files_placed": 10, "status": "keep"}
{"timestamp": 1787431278.5352027, "experiment_id": "8828af22", "concept_title": "FACT round-41 #2 — HIGH-PHASE: the linear phase route is closed at both prime ranges (paper 151)", "concept_domain": "Logic", "research_mode": "team", "quality": "substantial", "quality_score": 0.79, "catalog_references": [], "prompt_length": 26587, "files_placed": 7, "status": "keep"}
{"timestamp": 1787434590.1986766, "experiment_id": "6cdc8533", "concept_title": "NET-51: THE-KV-CORE-IS-SHARED-THE-TAIL-IS-PERSONAL — base-vs-Instruct keys near-identical everywhere (layer 0 exact), delta hump-shaped peaking mid-stack, but attention decisions diverge in exactly the L22/L23 diffuse tail", "concept_domain": "Novelty", "research_mode": "team", "quality": "substantial", "quality_score": 0.78, "catalog_references": [], "prompt_length": 28445, "files_placed": 4, "status": "keep"}
{"timestamp": 1787434604.1177115, "experiment_id": "3fdce232", "concept_title": "Information reconciliation", "concept_domain": "Computation", "research_mode": "team", "quality": "substantial", "quality_score": 0.82, "catalog_references": [], "prompt_length": 25921, "files_placed": 4, "status": "keep"}
{"timestamp": 1787434615.1695182, "experiment_id": "22ca7429", "concept_title": "Rigidity gap for shallow product coins", "concept_domain": "Geometry", "research_mode": "team", "quality": "substantial", "quality_score": 0.86, "catalog_references": [], "prompt_length": 26236, "files_placed": 4, "status": "keep"}
{"timestamp": 1787441776.9374032, "experiment_id": "ccf34fd5", "concept_title": "Smooth windows", "concept_domain": "Algebra", "research_mode": "team", "quality": "substantial", "quality_score": 0.8, "catalog_references": [], "prompt_length": 25950, "files_placed": 4, "status": "keep"}
{"timestamp": 1787441787.8760412, "experiment_id": "f49038d4", "concept_title": "Define the *curvature* of the pool as\n`κ = 1 − minⱼ (C(Ω) − C(Ω∖{j})) / C({j})` where `Ω` is the whole pool.", "concept_domain": "Cryptography", "research_mode": "team", "quality": "substantial", "quality_score": 0.8, "catalog_references": [], "prompt_length": 26231, "files_placed": 4, "status": "keep"}
{"timestamp": 1787455006.7114227, "experiment_id": "aa2d71a2", "concept_title": "FACT round-43 #2 — UNIFORM-DIAL: the yield dial is draw-regime-invariant (paper 162)", "concept_domain": "Combinatorics", "research_mode": "team", "quality": "substantial", "quality_score": 0.74, "catalog_references": [], "prompt_length": 26468, "files_placed": 4, "status": "keep"}
{"timestamp": 1787455021.8683014, "experiment_id": "bc20ce21", "concept_title": "P2 (from K)", "concept_domain": "Applications", "research_mode": "team", "quality": "substantial", "quality_score": 0.82, "catalog_references": [], "prompt_length": 26095, "files_placed": 4, "status": "keep"}
{"timestamp": 1787457891.9899821, "experiment_id": "78e6d19a", "concept_title": "NET-54: THE-TAIL-IS-LOAD-BEARING-BUT-UNPORTABLE — bulk layers transplant between fine-tunes at zero cost, tail L22/23 breaks agreement with BOTH parents; sharing boundary causally established", "concept_domain": "Probability", "research_mode": "team", "quality": "substantial", "quality_score": 0.9, "catalog_references": [], "prompt_length": 28398, "files_placed": 4, "status": "keep"}
{"timestamp": 1787460814.2651303, "experiment_id": "d221a4de", "concept_title": "FACT round-41 #5 — FACTOR-LOCAL-ET: unified across-k scaling on one population (paper 154)", "concept_domain": "Probability", "research_mode": "team", "quality": "substantial", "quality_score": 0.88, "catalog_references": [], "prompt_length": 26605, "files_placed": 4, "status": "keep"}
{"timestamp": 1787463986.3158967, "experiment_id": "9b10b60b", "concept_title": "FACT round-42 #1 — ECM-COMPLETION: the lite variant scales like rho (paper 155)", "concept_domain": "Geometry", "research_mode": "team", "quality": "substantial", "quality_score": 0.79, "catalog_references": [], "prompt_length": 26648, "files_placed": 4, "status": "keep"}
{"timestamp": 1787464004.3765268, "experiment_id": "a303e67d", "concept_title": "NET-61: CONTENT-ADDITIVE-EVICTION-DOES-NOT-HELP — hybrid z(acc)+lambda*z(probe) monotonically worse with probe weight; all four cheap signal families bounded >=5.7pts below oracle", "concept_domain": "Combinatorics", "research_mode": "team", "quality": "substantial", "quality_score": 0.78, "catalog_references": [], "prompt_length": 27831, "files_placed": 4, "status": "keep"}
{"timestamp": 1787464020.963797, "experiment_id": "347a400e", "concept_title": "prove that this function is a *class function up to inversion*, i.e.", "concept_domain": "MachineLearning", "research_mode": "team", "quality": "substantial", "quality_score": 0.82, "catalog_references": [], "prompt_length": 26087, "files_placed": 4, "status": "keep"}
{"timestamp": 1787468561.1322224, "experiment_id": "cd05a1fd", "concept_title": "Concavity (old sub-conjecture 1).", "concept_domain": "Novelty", "research_mode": "team", "quality": "substantial", "quality_score": 0.72, "catalog_references": [], "prompt_length": 26021, "files_placed": 4, "status": "keep"}
{"timestamp": 1787471299.4940884, "experiment_id": "50edc087", "concept_title": "Do not infer infinite-digit laws from finite prefixes", "concept_domain": "Pythagorean", "research_mode": "team", "quality": "substantial", "quality_score": 0.8, "catalog_references": [], "prompt_length": 26068, "files_placed": 4, "status": "keep"}
{"timestamp": 1787471313.8915699, "experiment_id": "0c164125", "concept_title": "NET-73: TOKENIZATION-DENSITY-DOES-NOT-EXPLAIN-THE-DOMAIN-SHIFT — Spearman(TPW,k*) = -0.40, R2 = 0.004; code highest TPW lowest knee, French near-English TPW highest knee", "concept_domain": "Applications", "research_mode": "team", "quality": "substantial", "quality_score": 0.78, "catalog_references": [], "prompt_length": 27748, "files_placed": 4, "status": "keep"}
