{"timestamp": 1786659006.792342, "experiment_id": "a1e10693", "concept_title": "Round-3 Hypothesis Closures: Five Novel Classical Factoring Hypotheses, Tested and Closed", "concept_domain": "Computation", "research_mode": "team", "quality": "substantial", "quality_score": 0.82, "catalog_references": [], "prompt_length": 32516, "files_placed": 5, "status": "keep"}
{"timestamp": 1786662596.4873333, "experiment_id": "c7164926", "concept_title": "Round-7 Hypothesis Closures: Scoping the Noise-Floor Principle and the Trace-Lemma Frontier", "concept_domain": "Tropical", "research_mode": "team", "quality": "substantial", "quality_score": 0.78, "catalog_references": [], "prompt_length": 31389, "files_placed": 4, "status": "keep"}
{"timestamp": 1786666001.9804702, "experiment_id": "5ddbfca0", "concept_title": "Round-6 Hypothesis Closures: The Noise-Floor Principle and the Trace-Lemma Frontier", "concept_domain": "MachineLearning", "research_mode": "team", "quality": "substantial", "quality_score": 0.82, "catalog_references": [], "prompt_length": 25855, "files_placed": 4, "status": "keep"}
{"timestamp": 1786676009.232551, "experiment_id": "d99b7790", "concept_title": "The CRT-Multiplicative Free-Witness Classification and the Trace Lemma", "concept_domain": "MachineLearning", "research_mode": "team", "quality": "substantial", "quality_score": 0.82, "catalog_references": [], "prompt_length": 31543, "files_placed": 4, "status": "keep"}
{"timestamp": 1786684203.8336444, "experiment_id": "a1fe4956", "concept_title": "Exp 391 BERGGREN-PRICE-INTERLOCK: every semiprime is a node of both Pythagorean trees \u2014 the N-node identity is exact, the interlock is factoring-orthogonal", "concept_domain": "Algebra", "research_mode": "team", "quality": "substantial", "quality_score": 0.82, "catalog_references": [], "prompt_length": 28636, "files_placed": 4, "status": "keep"}
{"timestamp": 1786690227.706711, "experiment_id": "9cc9a6e9", "concept_title": "The Spectral Free-Witness: Heat-Kernel Order Recovery", "concept_domain": "Algebra", "research_mode": "team", "quality": "substantial", "quality_score": 0.82, "catalog_references": [], "prompt_length": 30300, "files_placed": 4, "status": "keep"}
{"timestamp": 1786697133.7727797, "experiment_id": "7477e654", "concept_title": "SMOOTH-SELFHINT-DENSITY: the p-1/ECM weakness is residue-invisible \u2014 asymmetric/symmetric divisibility dichotomy, self-hint program closed", "concept_domain": "Tropical", "research_mode": "team", "quality": "substantial", "quality_score": 0.85, "catalog_references": [], "prompt_length": 28038, "files_placed": 29, "status": "keep"}
{"timestamp": 1786697150.6093721, "experiment_id": "eaebe17a", "concept_title": "Exp 392 GCD-MOMENT: the semiprime gcd-moments M_k = sum gcd(x,N)^k are a closed trace-witness family \u2014 trace recoverable, never a factor (barriers 2/4/6/8)", "concept_domain": "Novelty", "research_mode": "team", "quality": "substantial", "quality_score": 0.9, "catalog_references": [], "prompt_length": 28392, "files_placed": 5, "status": "keep"}
{"timestamp": 1786697163.8795724, "experiment_id": "13788cf3", "concept_title": "Exp 399 PLUSONE-SMOOTH-NULL (round-16 #2): the Williams p+1 weakness is residue-invisible, Lucas-sequence-invisible, and discriminant-gated", "concept_domain": "Tropical", "research_mode": "team", "quality": "substantial", "quality_score": 0.85, "catalog_references": [], "prompt_length": 27869, "files_placed": 28, "status": "keep"}
{"timestamp": 1786706279.9616232, "experiment_id": "8c90b348", "concept_title": "Experiment 398: CFPERIOD-NULL \u2014 the continued-fraction period of sqrt(N) is a non-polynomial symmetric channel with zero factoring leverage", "concept_domain": "Shared", "research_mode": "team", "quality": "substantial", "quality_score": 0.82, "catalog_references": [], "prompt_length": 28220, "files_placed": 4, "status": "keep"}
{"timestamp": 1786706298.2559438, "experiment_id": "43e7ffcb", "concept_title": "The Factor3 Program: A Definitive Synthesis of the Barrier Framework", "concept_domain": "Tropical", "research_mode": "team", "quality": "substantial", "quality_score": 0.72697, "catalog_references": [], "prompt_length": 28374, "files_placed": 5, "status": "keep"}
{"timestamp": 1786709057.3746972, "experiment_id": "677413db", "concept_title": "The Extrinsic Class-Group Representation Vector is a Residue Dial, Closed", "concept_domain": "Algebra", "research_mode": "team", "quality": "substantial", "quality_score": 0.83, "catalog_references": [], "prompt_length": 27443, "files_placed": 4, "status": "keep"}
{"timestamp": 1786715402.8213694, "experiment_id": "53eb02be", "concept_title": "Experiment 397: SEQSMOOTH-NULL \u2014 mod-exp sequence stats are smoothness-blind (AUC 0.500); p-1 weakness only via running the p-1 method", "concept_domain": "Bridges", "research_mode": "team", "quality": "substantial", "quality_score": 0.86, "catalog_references": [], "prompt_length": 27714, "files_placed": 4, "status": "keep"}
{"timestamp": 1786720459.7690146, "experiment_id": "64406111", "concept_title": "Round-10 Closures: The Exhaustion of the Classical Attack Surface", "concept_domain": "Geometry", "research_mode": "team", "quality": "substantial", "quality_score": 0.85, "catalog_references": [], "prompt_length": 30784, "files_placed": 5, "status": "keep"}
{"timestamp": 1786720472.2754107, "experiment_id": "83c80b79", "concept_title": "De-Quantization Assessed: Shor's QFT Is Irreducible", "concept_domain": "Novelty", "research_mode": "team", "quality": "substantial", "quality_score": 0.86, "catalog_references": [], "prompt_length": 30205, "files_placed": 4, "status": "keep"}
{"timestamp": 1786724103.3958077, "experiment_id": "295ca744", "concept_title": "ECM-PARITY: first positive symmetric residue shadow on the GENERIC elliptic order (2|#E \u27fa cubic root \u27fa Frobenius not 3-cycle) \u2014 round-18 #1, exp 404", "concept_domain": "Algebra", "research_mode": "team", "quality": "substantial", "quality_score": 0.86, "catalog_references": [], "prompt_length": 28551, "files_placed": 4, "status": "keep"}
{"timestamp": 1786727929.3193548, "experiment_id": "e0db545b", "concept_title": "The Permutation Readout of Individual Orders, Closed", "concept_domain": "Physics", "research_mode": "team", "quality": "substantial", "quality_score": 0.91, "catalog_references": [], "prompt_length": 27832, "files_placed": 4, "status": "keep"}
{"timestamp": 1786731226.8362598, "experiment_id": "c76c12ee", "concept_title": "CM-ECM-ORDER (round-17 #1): the ECM order of a CM curve collapses to p+1 on the inert half \u2014 a residue shadow that carries no factoring leverage", "concept_domain": "Novelty", "research_mode": "team", "quality": "substantial", "quality_score": 0.82, "catalog_references": [], "prompt_length": 28359, "files_placed": 4, "status": "keep"}
{"timestamp": 1786735286.673082, "experiment_id": "8590e003", "concept_title": "CM-ECM-GENERAL: rational-torsion degeneracy, union-dilution law, 3-adic Hecke visibility (Q(sqrt(-3)) j=0 curve) \u2014 round-17 #2, exp 403", "concept_domain": "Probability", "research_mode": "team", "quality": "substantial", "quality_score": 0.87, "catalog_references": [], "prompt_length": 28104, "files_placed": 4, "status": "keep"}
{"timestamp": 1786737933.2007787, "experiment_id": "c98081c2", "concept_title": "The Class-Wide No-Pinning Lemma, Verified", "concept_domain": "Novelty", "research_mode": "team", "quality": "substantial", "quality_score": 0.82, "catalog_references": [], "prompt_length": 27325, "files_placed": 4, "status": "keep"}
{"timestamp": 1786740782.0143023, "experiment_id": "50be6807", "concept_title": "A4-FORK-PINNING: first cubic-pinned non-abelian fork (A4 V4-order, I = H(1/3) exact) \u2014 paper 75, exp 410, v186", "concept_domain": "Algebra", "research_mode": "team", "quality": "substantial", "quality_score": 0.82, "catalog_references": [], "prompt_length": 29247, "files_placed": 4, "status": "keep"}
{"timestamp": 1786744081.5308478, "experiment_id": "beb0e52b", "concept_title": "CYCLIC-CUBIC-FORK: fork-pinning \u27fa fork in the abelianization of the Galois closure (criterion verified on C3/S3/S4, paper 71)", "concept_domain": "Probability", "research_mode": "team", "quality": "substantial", "quality_score": 0.91, "catalog_references": [], "prompt_length": 28596, "files_placed": 4, "status": "keep"}
{"timestamp": 1786747689.7618566, "experiment_id": "45ac3b9d", "concept_title": "The Higher-Power Reciprocity Channel, Closed", "concept_domain": "Combinatorics", "research_mode": "team", "quality": "substantial", "quality_score": 0.78, "catalog_references": [], "prompt_length": 27315, "files_placed": 5, "status": "keep"}
{"timestamp": 1786751003.891402, "experiment_id": "1b55f202", "concept_title": "CYCLIC-TYPE-CHANNEL (round-22 #2, experiment 413, assessment v189, paper 78)", "concept_domain": "Computation", "research_mode": "team", "quality": "substantial", "quality_score": 0.79, "catalog_references": [], "prompt_length": 29210, "files_placed": 4, "status": "keep"}
{"timestamp": 1786763591.2112916, "experiment_id": "c94236ec", "concept_title": "SPLIT-COUNT-LAW: the complete symmetric fork channel is the split-count s ~ Bin(2,1/n), I(N mod f; s) = Is(n) \u2014 beats the OR cap (Is(2)=1.0, Is(3)=0.474), still factor-useless", "concept_domain": "Novelty", "research_mode": "team", "quality": "substantial", "quality_score": 0.92, "catalog_references": [], "prompt_length": 29083, "files_placed": 4, "status": "keep"}
{"timestamp": 1786763605.6108048, "experiment_id": "fefb96cd", "concept_title": "TRACEPROFILE: the trace s=p+q is the least-hidden symmetric invariant \u2014 1 bit per prime exactly, s1=1-N1 theorem", "concept_domain": "Novelty", "research_mode": "team", "quality": "substantial", "quality_score": 0.82, "catalog_references": [], "prompt_length": 27380, "files_placed": 5, "status": "keep"}
{"timestamp": 1786777506.9642775, "experiment_id": "70d03dec", "concept_title": "CYCLIC-TYPE-CHANNEL (round-22 #2, experiment 413, assessment v189, paper 78)", "concept_domain": "Physics", "research_mode": "team", "quality": "substantial", "quality_score": 0.78, "catalog_references": [], "prompt_length": 29202, "files_placed": 5, "status": "keep"}
{"timestamp": 1786780343.755137, "experiment_id": "f2bb5930", "concept_title": "CYCLIC-TYPE-CHANNEL (round-22 #2, experiment 413, assessment v189, paper 78)", "concept_domain": "Shared", "research_mode": "team", "quality": "substantial", "quality_score": 0.72, "catalog_references": [], "prompt_length": 29200, "files_placed": 7, "status": "keep"}
{"timestamp": 1786784163.3276107, "experiment_id": "35640655", "concept_title": "OR-DIAL-MAXIMUM: the semiprime OR dial has a global cap g(2)=0.3113 bits over every class-rate profile (paper 73, round-20 #1)", "concept_domain": "Bridges", "research_mode": "team", "quality": "substantial", "quality_score": 0.89, "catalog_references": [], "prompt_length": 28742, "files_placed": 5, "status": "keep"}
{"timestamp": 1786784176.6155925, "experiment_id": "ed381d4e", "concept_title": "The 3SUM-Birthday-Bound Hierarchy", "concept_domain": "Shared", "research_mode": "team", "quality": "substantial", "quality_score": 0.78, "catalog_references": [], "prompt_length": 26714, "files_placed": 4, "status": "keep"}
{"timestamp": 1786790819.3642964, "experiment_id": "67289c0d", "concept_title": "Singular Moduli Factoring and the \u221aN Barrier", "concept_domain": "Cryptography", "research_mode": "team", "quality": "substantial", "quality_score": 0.82, "catalog_references": [], "prompt_length": 26830, "files_placed": 4, "status": "keep"}
{"timestamp": 1786794066.4329665, "experiment_id": "a9efa47b", "concept_title": "Power-Sum GCD Factoring & Carmichael Periodicity", "concept_domain": "Novelty", "research_mode": "team", "quality": "substantial", "quality_score": 0.82, "catalog_references": [], "prompt_length": 26971, "files_placed": 5, "status": "keep"}
{"timestamp": 1786794083.4186413, "experiment_id": "aeab7c87", "concept_title": "The 'Only Bad Primes' Conjecture is False (elliptic curve denominators)", "concept_domain": "Applications", "research_mode": "team", "quality": "substantial", "quality_score": 0.88, "catalog_references": [], "prompt_length": 26758, "files_placed": 5, "status": "keep"}
{"timestamp": 1786799208.2511783, "experiment_id": "032d68e5", "concept_title": "The 'Only Bad Primes' Conjecture is False (elliptic curve denominators)", "concept_domain": "Bridges", "research_mode": "team", "quality": "substantial", "quality_score": 0.85, "catalog_references": [], "prompt_length": 26748, "files_placed": 5, "status": "keep"}
{"timestamp": 1786801865.5404801, "experiment_id": "43f9870f", "concept_title": "The 'Only Bad Primes' Conjecture is False (elliptic curve denominators)", "concept_domain": "Combinatorics", "research_mode": "team", "quality": "substantial", "quality_score": 0.84, "catalog_references": [], "prompt_length": 26760, "files_placed": 5, "status": "keep"}
{"timestamp": 1786805257.4707577, "experiment_id": "299127cc", "concept_title": "Exp 390 GENERIC-RECOVERY: recovery-from-hint = 2^(k-1-t_eff) \u2014 hint taxonomy closed", "concept_domain": "Combinatorics", "research_mode": "team", "quality": "substantial", "quality_score": 0.82, "catalog_references": [], "prompt_length": 27645, "files_placed": 4, "status": "keep"}
{"timestamp": 1786812528.0171607, "experiment_id": "3ce74e62", "concept_title": "Power-Sum GCD Factoring & Carmichael Periodicity", "concept_domain": "Geometry", "research_mode": "team", "quality": "substantial", "quality_score": 0.85, "catalog_references": [], "prompt_length": 26973, "files_placed": 4, "status": "keep"}
{"timestamp": 1786815808.5335183, "experiment_id": "ac45a9d9", "concept_title": "The 'Only Bad Primes' Conjecture is False (elliptic curve denominators)", "concept_domain": "Novelty", "research_mode": "team", "quality": "substantial", "quality_score": 0.85, "catalog_references": [], "prompt_length": 26748, "files_placed": 5, "status": "keep"}
{"timestamp": 1786820137.8392317, "experiment_id": "67cbe98c", "concept_title": "The 'Only Bad Primes' Conjecture is False (elliptic curve denominators)", "concept_domain": "Applications", "research_mode": "team", "quality": "partial", "quality_score": 0.55, "catalog_references": [], "prompt_length": 26758, "files_placed": 5, "status": "keep"}
{"timestamp": 1786822872.0699103, "experiment_id": "79242ce3", "concept_title": "The 'Only Bad Primes' Conjecture is False (elliptic curve denominators)", "concept_domain": "Cryptography", "research_mode": "team", "quality": "substantial", "quality_score": 0.82, "catalog_references": [], "prompt_length": 26758, "files_placed": 5, "status": "keep"}
{"timestamp": 1786833980.6632166, "experiment_id": "603eb18a", "concept_title": "NET-24: A Stateful Carry Cell Unlocks Length-General Carry \u2014 The Wall Was the Answer Function (first positive cure)", "concept_domain": "NumberTheory", "research_mode": "team", "quality": "substantial", "quality_score": 0.78, "catalog_references": [], "prompt_length": 29153, "files_placed": 4, "status": "keep"}
{"timestamp": 1786833993.555922, "experiment_id": "f0c2b697", "concept_title": "NET-25 (paper 69): DENSE-FINAL-STEP-IS-THE-CURE \u2014 the stateful-carry-cell cure was the dense EOS (final-carry) input, not the encoder's content", "concept_domain": "Logic", "research_mode": "team", "quality": "substantial", "quality_score": 0.78, "catalog_references": [], "prompt_length": 31084, "files_placed": 4, "status": "keep"}
{"timestamp": 1786840231.2530768, "experiment_id": "9c680c24", "concept_title": "NET-26 (paper 70): EOS-WIDTH-DISTRIBUTION-SHIFT \u2014 the EOS-width \"threshold\" is a one-sided P(cure) distribution shift, not a sharp boundary; CORRECTS NET-25", "concept_domain": "Tropical", "research_mode": "team", "quality": "substantial", "quality_score": 0.78, "catalog_references": [], "prompt_length": 28598, "files_placed": 4, "status": "keep"}
{"timestamp": 1786840243.2030988, "experiment_id": "802e1378", "concept_title": "NET-27 (paper 71): EOS-WIDTH-SHIFT-IS-A-MONOTONE-RAMP \u2014 P(cure) ramps 25\u219233\u219283\u2192100\u2192100% as exclusive dims go 0\u21921\u21922\u21924\u21928; no sharp width, first exclusive dim NOT sufficient; refines NET-26", "concept_domain": "NumberTheory", "research_mode": "team", "quality": "substantial", "quality_score": 0.72, "catalog_references": [], "prompt_length": 28580, "files_placed": 4, "status": "keep"}
{"timestamp": 1786840644.0753999, "experiment_id": "66af3cc3", "concept_title": "NET-31: Internalization is a seed-fixed trait among cures \u2014 same 4 seeds dependent at k=2 and k=3; NET-29's 5/6 was a seed-set-specific high; dependent seeds stay dependent at every width", "concept_domain": "NumberTheory", "research_mode": "team", "quality": "substantial", "quality_score": 0.72, "catalog_references": [], "prompt_length": 29466, "files_placed": 4, "status": "keep"}
{"timestamp": 1786845458.6278694, "experiment_id": "dc071269", "concept_title": "NET-30: INTERNALIZATION-SATURATES-AT-K=2 (k=2 freeze test \u2014 the missing middle; NET-29's \u221d-quality law corrected)", "concept_domain": "NumberTheory", "research_mode": "team", "quality": "substantial", "quality_score": 0.78, "catalog_references": [], "prompt_length": 30554, "files_placed": 4, "status": "keep"}
{"timestamp": 1786850014.199701, "experiment_id": "e67b8bbc", "concept_title": "Compression Research B1: Negative result \u2014 PRNGs cannot beat pigeonhole (proof + demo)", "concept_domain": "MachineLearning", "research_mode": "team", "quality": "substantial", "quality_score": 0.78, "catalog_references": [], "prompt_length": 26851, "files_placed": 4, "status": "keep"}
{"timestamp": 1786852812.9841163, "experiment_id": "8da3e793", "concept_title": "Compression Research A2: Learnable shared decompressors \u2014 model is free, model delta is not", "concept_domain": "Tropical", "research_mode": "team", "quality": "substantial", "quality_score": 0.78, "catalog_references": [], "prompt_length": 26940, "files_placed": 4, "status": "keep"}
{"timestamp": 1786855848.3492527, "experiment_id": "8ed04a73", "concept_title": "NET-36: The Attention-Cost Grid Is Now Two-Seed Everywhere \u2014 k*=d\u00b7ctx/32 Holds at Every Measured (depth \u00d7 context) Cell", "concept_domain": "Probability", "research_mode": "team", "quality": "substantial", "quality_score": 0.85, "catalog_references": [], "prompt_length": 29632, "files_placed": 4, "status": "keep"}
{"timestamp": 1786866361.1032846, "experiment_id": "2a357c10", "concept_title": "NET-43: The Deepest Rung Is Two-Seed 256 (k\\*=256 reproduces EXACTLY at seed=2; both honest limits closed; concave-power-2/3 law's deepest rung two-seed) \u2014 paper 87", "concept_domain": "Bridges", "research_mode": "team", "quality": "substantial", "quality_score": 0.84, "catalog_references": [], "prompt_length": 28731, "files_placed": 4, "status": "keep"}
{"timestamp": 1786873376.0879943, "experiment_id": "6c757940", "concept_title": "Sheaf-Theoretic Data Integration: When Databases Form a Sheaf", "concept_domain": "Computation", "research_mode": "team", "quality": "substantial", "quality_score": 0.89, "catalog_references": [], "prompt_length": 27245, "files_placed": 5, "status": "keep"}
{"timestamp": 1786873387.4566054, "experiment_id": "6e253e5d", "concept_title": "EML Learning Theory: Gradient Descent Convergence in the Tropical Limit", "concept_domain": "Applications", "research_mode": "team", "quality": "substantial", "quality_score": 0.82, "catalog_references": [], "prompt_length": 26120, "files_placed": 5, "status": "keep"}
{"timestamp": 1786876788.9741955, "experiment_id": "8fa1e5a5", "concept_title": "EML Transseries: Asymptotic Expansions Beyond Power Series", "concept_domain": "Applications", "research_mode": "team", "quality": "substantial", "quality_score": 0.87, "catalog_references": [], "prompt_length": 26137, "files_placed": 5, "status": "keep"}
{"timestamp": 1786880110.6110632, "experiment_id": "3b29df87", "concept_title": "Elliptic Curve Cryptography: Weil Pairing and BLS Signatures", "concept_domain": "Cryptography", "research_mode": "team", "quality": "substantial", "quality_score": 0.82, "catalog_references": [], "prompt_length": 26094, "files_placed": 4, "status": "keep"}
{"timestamp": 1786885275.8542004, "experiment_id": "ade8206b", "concept_title": "Alien Mathematics: Non-Standard Arithmetic", "concept_domain": "Novelty", "research_mode": "team", "quality": "substantial", "quality_score": 0.85, "catalog_references": [], "prompt_length": 25991, "files_placed": 4, "status": "keep"}
{"timestamp": 1786887935.3727953, "experiment_id": "37827e5f", "concept_title": "Wigner-Semicircle: Universality of the Spectral Distribution", "concept_domain": "Probability", "research_mode": "team", "quality": "substantial", "quality_score": 0.85, "catalog_references": [], "prompt_length": 26131, "files_placed": 5, "status": "keep"}
{"timestamp": 1786887945.8938687, "experiment_id": "be4e28d2", "concept_title": "**Conjecture.** A closed, connected, orientable smooth three-manifold embeds smo", "concept_domain": "Shared", "research_mode": "team", "quality": "substantial", "quality_score": 0.79, "catalog_references": [], "prompt_length": 29544, "files_placed": 5, "status": "keep"}
{"timestamp": 1786894581.1154938, "experiment_id": "25d882e7", "concept_title": "The Unreasonable Effectiveness of Wrong Theories", "concept_domain": "Physics", "research_mode": "team", "quality": "substantial", "quality_score": 0.78, "catalog_references": [], "prompt_length": 26111, "files_placed": 5, "status": "keep"}
