{"timestamp": 1783675572.1674862, "experiment_id": "e37aa20a", "concept_title": "Cryptography from Chaos: Encrypting with the Logistic Map", "concept_domain": "Novelty", "research_mode": "team", "quality": "substantial", "quality_score": 0.83, "catalog_references": [], "prompt_length": 24211, "files_placed": 4, "status": "keep"}
{"timestamp": 1783675576.3039265, "experiment_id": "207fb5b4", "concept_title": "Quantum Error Correction from Homological Algebra: CSS Codes as Cohomology", "concept_domain": "Applications", "research_mode": "team", "quality": "substantial", "quality_score": 0.83, "catalog_references": [], "prompt_length": 23931, "files_placed": 4, "status": "keep"}
{"timestamp": 1783677486.6214402, "experiment_id": "8b2bab35", "concept_title": "Deepening: Graph Coloring with Emotions: The Chromatic Polynomial Meets Psychology", "concept_domain": "Novelty", "research_mode": "team", "quality": "substantial", "quality_score": 0.83, "catalog_references": [], "prompt_length": 23040, "files_placed": 4, "status": "keep"}
{"timestamp": 1783677500.1255178, "experiment_id": "ff42203a", "concept_title": "Matroid Minors and the Graph Theorem: Robertson-Seymour for Matroids", "concept_domain": "Novelty", "research_mode": "team", "quality": "substantial", "quality_score": 0.72, "catalog_references": [], "prompt_length": 24014, "files_placed": 4, "status": "keep"}
{"timestamp": 1783680349.3459673, "experiment_id": "9b14e09c", "concept_title": "Deepening: The Mathematics of Jigsaw Puzzles: NP-Completeness and Topology", "concept_domain": "Applications", "research_mode": "team", "quality": "substantial", "quality_score": 0.82, "catalog_references": [], "prompt_length": 23268, "files_placed": 4, "status": "keep"}
{"timestamp": 1783680364.3749156, "experiment_id": "a9aa7bbf", "concept_title": "The Thermodynamics of Sorting: Entropy and Computational Work", "concept_domain": "Geometry", "research_mode": "team", "quality": "substantial", "quality_score": 0.8, "catalog_references": [], "prompt_length": 24110, "files_placed": 4, "status": "keep"}
{"timestamp": 1783682285.2289767, "experiment_id": "81ffd6ce", "concept_title": "Close Proofs: Graph Coloring with Emotions: The Chromatic Polynomial Meets Psycholog", "concept_domain": "Applications", "research_mode": "team", "quality": "partial", "quality_score": 0.6, "catalog_references": [], "prompt_length": 3263, "files_placed": 3, "status": "keep"}
{"timestamp": 1783684221.248784, "experiment_id": "da4694df", "concept_title": "The Arithmetic of Games: Surreal Numbers as Number Fields", "concept_domain": "Applications", "research_mode": "team", "quality": "substantial", "quality_score": 0.82, "catalog_references": [], "prompt_length": 23918, "files_placed": 4, "status": "keep"}
{"timestamp": 1783684234.9895673, "experiment_id": "2fed8c0e", "concept_title": "The Fourier Analysis of Collatz: Spectral Gaps in the 3n+1 Map", "concept_domain": "Geometry", "research_mode": "team", "quality": "substantial", "quality_score": 0.78, "catalog_references": [], "prompt_length": 21466, "files_placed": 4, "status": "keep"}
{"timestamp": 1783684243.3009744, "experiment_id": "9f734f3e", "concept_title": "Deepening: Turing's Flowers: Morphogenesis as Algebraic Geometry", "concept_domain": "Novelty", "research_mode": "team", "quality": "substantial", "quality_score": 0.82, "catalog_references": [], "prompt_length": 23248, "files_placed": 4, "status": "keep"}
{"timestamp": 1783684251.1440353, "experiment_id": "25448d9e", "concept_title": "Close Proofs: Turing's Flowers: Morphogenesis as Algebraic Geometry", "concept_domain": "Applications", "research_mode": "team", "quality": "substantial", "quality_score": 0.8, "catalog_references": [], "prompt_length": 15905, "files_placed": 4, "status": "keep"}
{"timestamp": 1783685229.6004086, "experiment_id": "df72d5fe", "concept_title": "Deepening: Persistent Homology of Prime Numbers: The Topology of Arithmetic", "concept_domain": "Applications", "research_mode": "team", "quality": "substantial", "quality_score": 0.83, "catalog_references": [], "prompt_length": 23269, "files_placed": 4, "status": "keep"}
{"timestamp": 1783686202.214066, "experiment_id": "2c002c80", "concept_title": "Sperner's Lemma Implies Nash Equilibria: Combinatorial Fixed Points in Game Theory", "concept_domain": "Applications", "research_mode": "team", "quality": "substantial", "quality_score": 0.78, "catalog_references": [], "prompt_length": 23475, "files_placed": 4, "status": "keep"}
{"timestamp": 1783686209.3309965, "experiment_id": "c22096e0", "concept_title": "Precise threshold for vertex\u2011Ramsey property in random perturbations", "concept_domain": "Novelty", "research_mode": "team", "quality": "substantial", "quality_score": 0.7, "catalog_references": ["LuczakRuci\u0144skiVoigt1993", "Kreuter1996", "DasMorrisTreglown2020", "Ramsey1929"], "prompt_length": 23488, "files_placed": 4, "status": "keep"}
{"timestamp": 1783687175.6945188, "experiment_id": "6528f137", "concept_title": "Deepening: Stochastic Galois Theory: Random Permutations Have Generic Galois Groups", "concept_domain": "Applications", "research_mode": "team", "quality": "substantial", "quality_score": 0.83, "catalog_references": [], "prompt_length": 23277, "files_placed": 4, "status": "keep"}
{"timestamp": 1783689098.27908, "experiment_id": "92e61cee", "concept_title": "Conjecture on Leading Term Cancellation", "concept_domain": "Novelty", "research_mode": "team", "quality": "substantial", "quality_score": 0.83, "catalog_references": ["arXiv:2203.08506", "arXiv:1609.06334"], "prompt_length": 22790, "files_placed": 4, "status": "keep"}
{"timestamp": 1783689104.4728856, "experiment_id": "0884751e", "concept_title": "The Borsuk-Ulam Theorem Implies Arrow's Impossibility: Social Choice Is Topology", "concept_domain": "Novelty", "research_mode": "team", "quality": "substantial", "quality_score": 0.72, "catalog_references": [], "prompt_length": 23882, "files_placed": 4, "status": "keep"}
{"timestamp": 1783692020.0021865, "experiment_id": "6c565e60", "concept_title": "Galois Theory of Cellular Automata: Which Rules Have Reversible Dynamics?", "concept_domain": "Applications", "research_mode": "team", "quality": "substantial", "quality_score": 0.72, "catalog_references": [], "prompt_length": 23947, "files_placed": 4, "status": "keep"}
{"timestamp": 1783692991.0284717, "experiment_id": "e40b9050", "concept_title": "Algebraic Geometry of Neural Networks: Varieties of Decision Boundaries", "concept_domain": "Novelty", "research_mode": "team", "quality": "substantial", "quality_score": 0.82, "catalog_references": [], "prompt_length": 24057, "files_placed": 4, "status": "keep"}
{"timestamp": 1783693956.725948, "experiment_id": "34e9f39c", "concept_title": "Knots and Lattices: The Alexander Polynomial as a Lattice Path Count", "concept_domain": "Applications", "research_mode": "team", "quality": "substantial", "quality_score": 0.82, "catalog_references": [], "prompt_length": 24090, "files_placed": 4, "status": "keep"}
{"timestamp": 1783693963.5105155, "experiment_id": "bb33d4fa", "concept_title": "Minimalobstructions to total rainbow forests fail the Rainbow Forest Inequality for exactly one edge subset", "concept_domain": "NumberTheory", "research_mode": "team", "quality": "substantial", "quality_score": 0.78, "catalog_references": ["Edmonds' Matroid Intersection Theorem", "Rainbow Forest Inequality"], "prompt_length": 22974, "files_placed": 4, "status": "keep"}
{"timestamp": 1783695878.3401582, "experiment_id": "8c745e9f", "concept_title": "Real-rootedness of the square of the Eulerian triangle", "concept_domain": "Novelty", "research_mode": "team", "quality": "substantial", "quality_score": 0.82, "catalog_references": ["math.CO", "real-rooted polynomials", "Eulerian numbers", "triangular matrix products"], "prompt_length": 23081, "files_placed": 4, "status": "keep"}
{"timestamp": 1783697582.3009155, "experiment_id": "f5358691", "concept_title": "Persistent Cycles in Randomized Graphs via Hyperstable Structural Constraints", "concept_domain": "Computation", "research_mode": "team", "quality": "substantial", "quality_score": 0.72, "catalog_references": ["arXiv:2310.12345 [math.CO]"], "prompt_length": 23135, "files_placed": 4, "status": "keep"}
{"timestamp": 1783698537.4614425, "experiment_id": "cd5a9d7d", "concept_title": "The Ramsey Theory of DNA: Subsequence Avoidance in Genetic Codes", "concept_domain": "Pythagorean", "research_mode": "team", "quality": "substantial", "quality_score": 0.82, "catalog_references": [], "prompt_length": 23932, "files_placed": 4, "status": "keep"}
{"timestamp": 1783700437.0695744, "experiment_id": "9d20b474", "concept_title": "Deepening: Cryptography from Chaos: Encrypting with the Logistic Map", "concept_domain": "Geometry", "research_mode": "team", "quality": "substantial", "quality_score": 0.83, "catalog_references": [], "prompt_length": 23254, "files_placed": 4, "status": "keep"}
{"timestamp": 1783700442.4527526, "experiment_id": "b77ed1ec", "concept_title": "The Collatz Conjecture Is Undecidable: What If 3n+1 Can't Be Proved?", "concept_domain": "Tropical", "research_mode": "team", "quality": "substantial", "quality_score": 0.72, "catalog_references": [], "prompt_length": 23992, "files_placed": 4, "status": "keep"}
{"timestamp": 1783701407.7771943, "experiment_id": "a1a5801c", "concept_title": "Categorification of Entropy: The Information Loss of Functors", "concept_domain": "Computation", "research_mode": "team", "quality": "substantial", "quality_score": 0.83, "catalog_references": [], "prompt_length": 22925, "files_placed": 4, "status": "keep"}
{"timestamp": 1783704249.4796805, "experiment_id": "5125e235", "concept_title": "Deepening: Conjecture on Leading Term Cancellation", "concept_domain": "Computation", "research_mode": "team", "quality": "substantial", "quality_score": 0.82, "catalog_references": [], "prompt_length": 23030, "files_placed": 4, "status": "keep"}
{"timestamp": 1783706163.331394, "experiment_id": "3d209fc8", "concept_title": "That the zero-dimensional persistent homology of the prim", "concept_domain": "Shared", "research_mode": "team", "quality": "substantial", "quality_score": 0.82, "catalog_references": [], "prompt_length": 27358, "files_placed": 4, "status": "keep"}
{"timestamp": 1783706168.9038198, "experiment_id": "17fb4d11", "concept_title": "Automatic Sequences and the Halting Problem: When Is a Sequence Computable?", "concept_domain": "Cryptography", "research_mode": "team", "quality": "substantial", "quality_score": 0.82, "catalog_references": [], "prompt_length": 24261, "files_placed": 4, "status": "keep"}
{"timestamp": 1783707127.4038572, "experiment_id": "00abb0ac", "concept_title": "The Topology of Argumentation: Why Debates Have Holes", "concept_domain": "Novelty", "research_mode": "team", "quality": "substantial", "quality_score": 0.74, "catalog_references": [], "prompt_length": 23987, "files_placed": 4, "status": "keep"}
{"timestamp": 1783709024.0180552, "experiment_id": "99c2e84e", "concept_title": "Tropical Cryptography: Min-Plus Encryption with Tropical Matrices", "concept_domain": "Physics", "research_mode": "team", "quality": "substantial", "quality_score": 0.8, "catalog_references": [], "prompt_length": 23849, "files_placed": 4, "status": "keep"}
{"timestamp": 1783710953.9260616, "experiment_id": "90792fe8", "concept_title": "Deepening: Algebraic Geometry of Neural Networks: Varieties of Decision Boundaries", "concept_domain": "Novelty", "research_mode": "team", "quality": "substantial", "quality_score": 0.83, "catalog_references": [], "prompt_length": 23266, "files_placed": 4, "status": "keep"}
{"timestamp": 1783711930.8167467, "experiment_id": "3a52b537", "concept_title": "Formalizing the Probabilistic Method: Erdos Meets Lean", "concept_domain": "Cryptography", "research_mode": "team", "quality": "substantial", "quality_score": 0.79, "catalog_references": [], "prompt_length": 24034, "files_placed": 4, "status": "keep"}
{"timestamp": 1783714814.9345767, "experiment_id": "cd868ba0", "concept_title": "Information-Theoretic Limits of Proof Search: How Hard Is It to Find a Lean Proof?", "concept_domain": "Logic", "research_mode": "team", "quality": "partial", "quality_score": 0.62, "catalog_references": [], "prompt_length": 4941, "files_placed": 2, "status": "keep"}
{"timestamp": 1783714823.5093544, "experiment_id": "f0772bca", "concept_title": "The Combinatorics of Compiler Optimization: Register Allocation as Graph Coloring", "concept_domain": "Novelty", "research_mode": "team", "quality": "substantial", "quality_score": 0.83, "catalog_references": [], "prompt_length": 24015, "files_placed": 4, "status": "keep"}
{"timestamp": 1783716768.297582, "experiment_id": "0643b2b3", "concept_title": "The Uncanny Valley of Mathematics: When Proofs Are Almost Right", "concept_domain": "Combinatorics", "research_mode": "team", "quality": "substantial", "quality_score": 0.82, "catalog_references": [], "prompt_length": 24021, "files_placed": 4, "status": "keep"}
{"timestamp": 1783717743.2278595, "experiment_id": "a6f348ea", "concept_title": "Stone Duality for Machine Learning: Neural Networks as Geometric Realizations", "concept_domain": "Physics", "research_mode": "team", "quality": "substantial", "quality_score": 0.8, "catalog_references": [], "prompt_length": 23662, "files_placed": 4, "status": "keep"}
{"timestamp": 1783718724.8623457, "experiment_id": "523eb163", "concept_title": "Hypergraph Ramsey Theory: Beyond Graphs", "concept_domain": "Logic", "research_mode": "team", "quality": "substantial", "quality_score": 0.72, "catalog_references": [], "prompt_length": 23883, "files_placed": 4, "status": "keep"}
{"timestamp": 1783719700.1391418, "experiment_id": "823f5582", "concept_title": "The Hodge Conjecture for Neural Networks: Algebraic Cycles in Decision Surfaces", "concept_domain": "Applications", "research_mode": "team", "quality": "substantial", "quality_score": 0.82, "catalog_references": [], "prompt_length": 24029, "files_placed": 4, "status": "keep"}
{"timestamp": 1783721641.699095, "experiment_id": "cf42e929", "concept_title": "The Poincare Conjecture for Data: Manifold Detection via Persistent Homology", "concept_domain": "Algebra", "research_mode": "team", "quality": "substantial", "quality_score": 0.79, "catalog_references": [], "prompt_length": 23920, "files_placed": 4, "status": "keep"}
{"timestamp": 1783721654.9761546, "experiment_id": "f9bf2df0", "concept_title": "Isomorphisms of Meaning: When Structures Collide", "concept_domain": "NumberTheory", "research_mode": "team", "quality": "substantial", "quality_score": 0.82, "catalog_references": [], "prompt_length": 22622, "files_placed": 4, "status": "keep"}
{"timestamp": 1783727432.6773248, "experiment_id": "c2b68f4a", "concept_title": "Quantum Random Walks on Cayley Graphs: Spectral Gaps and Mixing Times", "concept_domain": "Bridges", "research_mode": "team", "quality": "substantial", "quality_score": 0.78, "catalog_references": [], "prompt_length": 23173, "files_placed": 4, "status": "keep"}
{"timestamp": 1783727439.059313, "experiment_id": "0faef071", "concept_title": "Tangled Hierarchies: Proof Systems That Reference Their Own Soundness", "concept_domain": "Applications", "research_mode": "team", "quality": "substantial", "quality_score": 0.82, "catalog_references": [], "prompt_length": 23012, "files_placed": 4, "status": "keep"}
{"timestamp": 1783728423.0686293, "experiment_id": "478ae68b", "concept_title": "Strange Loops: Self-Reference and G\u00f6del's Incompleteness", "concept_domain": "Probability", "research_mode": "team", "quality": "substantial", "quality_score": 0.72, "catalog_references": [], "prompt_length": 22117, "files_placed": 4, "status": "keep"}
{"timestamp": 1783729406.398595, "experiment_id": "d0bff55a", "concept_title": "Transfinite Game Theory: Games That Last Forever", "concept_domain": "MachineLearning", "research_mode": "team", "quality": "substantial", "quality_score": 0.78, "catalog_references": [], "prompt_length": 21971, "files_placed": 4, "status": "keep"}
{"timestamp": 1783730403.0996175, "experiment_id": "0981cb8f", "concept_title": "Consciousness as Emergent Fixed Point", "concept_domain": "Probability", "research_mode": "team", "quality": "substantial", "quality_score": 0.83, "catalog_references": [], "prompt_length": 23034, "files_placed": 4, "status": "keep"}
{"timestamp": 1783730408.9080324, "experiment_id": "0ba9c9ed", "concept_title": "Infinite-Dimensional Chess: Winning on the Hilbert Board", "concept_domain": "Probability", "research_mode": "team", "quality": "substantial", "quality_score": 0.82, "catalog_references": [], "prompt_length": 23001, "files_placed": 4, "status": "keep"}
{"timestamp": 1783732338.297688, "experiment_id": "fd7d55eb", "concept_title": "Deepening: The Combinatorics of Compiler Optimization: Register Allocation as Graph Colorin", "concept_domain": "Bridges", "research_mode": "team", "quality": "substantial", "quality_score": 0.82, "catalog_references": [], "prompt_length": 23275, "files_placed": 4, "status": "keep"}
{"timestamp": 1783733331.6009164, "experiment_id": "2ca6565f", "concept_title": "Surveillance Networks: Information-Theoretic Undetectability", "concept_domain": "Applications", "research_mode": "team", "quality": "substantial", "quality_score": 0.82, "catalog_references": [], "prompt_length": 23030, "files_placed": 4, "status": "keep"}
{"timestamp": 1783733337.5131028, "experiment_id": "473442d5", "concept_title": "Deepening: The L-Function Universe: A Cosmic Census of All L-Functions", "concept_domain": "Novelty", "research_mode": "team", "quality": "substantial", "quality_score": 0.83, "catalog_references": [], "prompt_length": 22790, "files_placed": 4, "status": "keep"}
{"timestamp": 1783736279.9095807, "experiment_id": "4d12c4e3", "concept_title": "Memory Editing: When Forgetting Is a Mathematical Operation", "concept_domain": "Novelty", "research_mode": "team", "quality": "partial", "quality_score": 0.63, "catalog_references": [], "prompt_length": 10379, "files_placed": 2, "status": "keep"}
{"timestamp": 1783737272.787058, "experiment_id": "0bde247f", "concept_title": "Social Credit Scores as Topological Invariants", "concept_domain": "Applications", "research_mode": "team", "quality": "substantial", "quality_score": 0.72, "catalog_references": [], "prompt_length": 22462, "files_placed": 4, "status": "keep"}
{"timestamp": 1783737285.1124449, "experiment_id": "75fb79ca", "concept_title": "Self-Modifying Code That Cannot Be Stopped", "concept_domain": "Novelty", "research_mode": "team", "quality": "substantial", "quality_score": 0.78, "catalog_references": [], "prompt_length": 23044, "files_placed": 4, "status": "keep"}
{"timestamp": 1783737291.337548, "experiment_id": "3399a930", "concept_title": "Negative-Dimensional Topology: What Lives in Dimension -1?", "concept_domain": "Applications", "research_mode": "team", "quality": "substantial", "quality_score": 0.83, "catalog_references": [], "prompt_length": 22666, "files_placed": 4, "status": "keep"}
{"timestamp": 1783738271.4143763, "experiment_id": "0be793c6", "concept_title": "Non-Desarguesian Worlds: Geometry Without Desargues", "concept_domain": "Novelty", "research_mode": "team", "quality": "substantial", "quality_score": 0.82, "catalog_references": [], "prompt_length": 22831, "files_placed": 4, "status": "keep"}
{"timestamp": 1783738283.8214066, "experiment_id": "a547c760", "concept_title": "Sign Characterization of Microscopic Weighting on Euclidean Subsets", "concept_domain": "Applications", "research_mode": "team", "quality": "substantial", "quality_score": 0.72, "catalog_references": ["math.MG", "math.CO", "magnitude_of_metric_spaces", "negative_type_metric_spaces", "Schoenberg_embedding"], "prompt_length": 22224, "files_placed": 4, "status": "keep"}
{"timestamp": 1783738289.094916, "experiment_id": "08430233", "concept_title": "Cellular Automata at the Ordinals: Transfinite Computation", "concept_domain": "Applications", "research_mode": "team", "quality": "substantial", "quality_score": 0.72, "catalog_references": [], "prompt_length": 22990, "files_placed": 4, "status": "keep"}
{"timestamp": 1783741253.6273427, "experiment_id": "01e9ab7a", "concept_title": "The Topology of Impossible Objects: Escher Stairs and Klein Bottles", "concept_domain": "Novelty", "research_mode": "team", "quality": "substantial", "quality_score": 0.83, "catalog_references": [], "prompt_length": 23044, "files_placed": 4, "status": "keep"}
{"timestamp": 1783743200.6599133, "experiment_id": "4d0c820d", "concept_title": "Transreal Arithmetic: Computing Beyond Plus-Minus Infinity", "concept_domain": "Novelty", "research_mode": "team", "quality": "substantial", "quality_score": 0.82, "catalog_references": [], "prompt_length": 22958, "files_placed": 4, "status": "keep"}
{"timestamp": 1783744173.6574798, "experiment_id": "39ced9f7", "concept_title": "Improved adhesion bound in coarse block-cutvertex tree-decomposition", "concept_domain": "Applications", "research_mode": "team", "quality": "substantial", "quality_score": 0.72, "catalog_references": ["ADGSmallCounterexamples", "AJKW", "BLPPSep", "DGHLMGallai", "FujPapCoa", "LiuWeakCoarseMenger", "McMFat", "NgScSeCoa", "NgScSeAsyIV", "GeoPapMin"], "prompt_length": 22951, "files_placed": 4, "status": "keep"}
{"timestamp": 1783744177.946058, "experiment_id": "ace29f66", "concept_title": "Dream Logic: Non-Monotone Reasoning Where Contradictions Coexist", "concept_domain": "Novelty", "research_mode": "team", "quality": "substantial", "quality_score": 0.82, "catalog_references": [], "prompt_length": 23017, "files_placed": 4, "status": "keep"}
