{"timestamp": 1781364886.5556588, "experiment_id": "38457964", "concept_title": "The file `Bridges/CombinatorialSpecies.lean` formalizes Joyal's combinatorial sp", "concept_domain": "Bridges", "research_mode": "team", "quality": "substantial", "quality_score": 0.8055683582089552, "catalog_references": [], "prompt_length": 23253, "files_placed": 5, "status": "keep"}
{"timestamp": 1781364929.914082, "experiment_id": "b6f0ca1b", "concept_title": "This cycle deepened the *entry-point* (rank-of-apparition) theory of Fibonacci", "concept_domain": "Pythagorean", "research_mode": "team", "quality": "partial", "quality_score": 0.4478055603581938, "catalog_references": [], "prompt_length": 18104, "files_placed": 0, "status": "discard"}
{"timestamp": 1781364952.2812583, "experiment_id": "8990b611", "concept_title": "The Boltzmann Bridge sub-catalog lifts 0-dimensional persistence into a full", "concept_domain": "Cryptography", "research_mode": "team", "quality": "partial", "quality_score": 0.5051984615384616, "catalog_references": [], "prompt_length": 19251, "files_placed": 0, "status": "keep"}
{"timestamp": 1781366855.447969, "experiment_id": "48c32113", "concept_title": "Close Proofs: This cycle opened a constructive, finite-alphabet bridge between the F", "concept_domain": "Logic", "research_mode": "team", "quality": "partial", "quality_score": 0.5296819875776397, "catalog_references": [], "prompt_length": 6230, "files_placed": 0, "status": "keep"}
{"timestamp": 1781366877.3543515, "experiment_id": "db8890de", "concept_title": "Quantum Error-Correcting Codes from Expander-Derived High-Dimensional Systolic C", "concept_domain": "Applications", "research_mode": "team", "quality": "partial", "quality_score": 0.48647500000000005, "catalog_references": [], "prompt_length": 7689, "files_placed": 0, "status": "discard"}
{"timestamp": 1781366901.3462005, "experiment_id": "579e8bb3", "concept_title": "Spectral Universality of Arithmetic Hypergraph Laplacians", "concept_domain": "Cryptography", "research_mode": "team", "quality": "partial", "quality_score": 0.4478589934710892, "catalog_references": [], "prompt_length": 7463, "files_placed": 0, "status": "discard"}
{"timestamp": 1781366925.7387996, "experiment_id": "94ed24b3", "concept_title": "Close Proofs: 12 fully proved theorems (zero sorry) formalizing the algebr", "concept_domain": "Shared", "research_mode": "team", "quality": "substantial", "quality_score": 0.74704, "catalog_references": [], "prompt_length": 17639, "files_placed": 17, "status": "keep"}
{"timestamp": 1781368874.090854, "experiment_id": "c8a4744f", "concept_title": "The file `Catalog/Geometry/BoltzmannBridge.lean` establishes a rigorous spine fo", "concept_domain": "Algebra", "research_mode": "team", "quality": "partial", "quality_score": 0.55601, "catalog_references": [], "prompt_length": 16765, "files_placed": 0, "status": "keep"}
{"timestamp": 1781368896.4628077, "experiment_id": "d16144ad", "concept_title": "We proved that the biconjugate satisfies f\u2605\u2605(x) \u2264 f(x) for all x. The natural ne", "concept_domain": "Geometry", "research_mode": "team", "quality": "partial", "quality_score": 0.47067000000000003, "catalog_references": [], "prompt_length": 13450, "files_placed": 0, "status": "discard"}
{"timestamp": 1781368947.1824057, "experiment_id": "6854a3a7", "concept_title": "Renormalization Fixed Points in Transformer In-Context Learning via p-adic Atten", "concept_domain": "Shared", "research_mode": "team", "quality": "partial", "quality_score": 0.648, "catalog_references": [], "prompt_length": 18352, "files_placed": 6, "status": "keep"}
{"timestamp": 1781370896.5449784, "experiment_id": "e8431c0a", "concept_title": "Close Proofs: This cycle closed the single open `sorry` in `Bridges/ArrowCurvature/D", "concept_domain": "Computation", "research_mode": "team", "quality": "substantial", "quality_score": 0.7680000000000001, "catalog_references": [], "prompt_length": 17660, "files_placed": 6, "status": "keep"}
{"timestamp": 1781370915.7292674, "experiment_id": "381ade33", "concept_title": "Close Proofs: This cycle deepened the *entry-point* (rank-of-apparition) theory of F", "concept_domain": "Applications", "research_mode": "team", "quality": "partial", "quality_score": 0.6648000000000001, "catalog_references": [], "prompt_length": 17661, "files_placed": 5, "status": "keep"}
{"timestamp": 1781370934.217872, "experiment_id": "26841929", "concept_title": "The file `MirrorSymmetry/ArithmeticMirror.lean` formalizes a rigorous,", "concept_domain": "Geometry", "research_mode": "team", "quality": "partial", "quality_score": 0.6568, "catalog_references": [], "prompt_length": 23640, "files_placed": 5, "status": "keep"}
{"timestamp": 1781370950.8777618, "experiment_id": "dd767b4e", "concept_title": "This cycle consolidated the *rank of apparition* (the Fibonacci entry point) int", "concept_domain": "Algebra", "research_mode": "team", "quality": "partial", "quality_score": 0.6964, "catalog_references": [], "prompt_length": 25171, "files_placed": 5, "status": "keep"}
{"timestamp": 1781370972.8459535, "experiment_id": "fa3ff455", "concept_title": "Deepening: Impossible Geometries: Where Parallel Lines Converge AND Diverge", "concept_domain": "Tropical", "research_mode": "team", "quality": "partial", "quality_score": 0.39898, "catalog_references": [], "prompt_length": 6410, "files_placed": 0, "status": "discard"}
{"timestamp": 1781370994.899141, "experiment_id": "32143571", "concept_title": "This cycle repaired the broken `Shared.CarmichaelHelper` dependency \u2014 whose abse", "concept_domain": "Tropical", "research_mode": "team", "quality": "partial", "quality_score": 0.4275653846153846, "catalog_references": [], "prompt_length": 22511, "files_placed": 0, "status": "discard"}
{"timestamp": 1781372929.3404999, "experiment_id": "7bcbbfa8", "concept_title": "Close Proofs: The current work proves the key ingredients \u2014 adjunction, harmonic cha", "concept_domain": "Novelty", "research_mode": "team", "quality": "partial", "quality_score": 0.42774399224806203, "catalog_references": [], "prompt_length": 6193, "files_placed": 0, "status": "discard"}
{"timestamp": 1781372964.7966385, "experiment_id": "574dbade", "concept_title": "The Hodge filtration F^p on the complexification of a pure Hodge structure is th", "concept_domain": "Algebra", "research_mode": "team", "quality": "partial", "quality_score": 0.48496, "catalog_references": [], "prompt_length": 22834, "files_placed": 5, "status": "discard"}
{"timestamp": 1781372996.9609323, "experiment_id": "227cafdb", "concept_title": "Close Proofs: The Boltzmann Bridge sub-catalog lifts 0-dimensional persistence into ", "concept_domain": "Physics", "research_mode": "team", "quality": "partial", "quality_score": 0.4592650728862974, "catalog_references": [], "prompt_length": 6140, "files_placed": 0, "status": "discard"}
{"timestamp": 1781373019.3726983, "experiment_id": "e74c4508", "concept_title": "Close Proofs: Spectral Universality of Arithmetic Hypergraph Laplacians", "concept_domain": "Applications", "research_mode": "team", "quality": "partial", "quality_score": 0.3467600902937833, "catalog_references": [], "prompt_length": 6137, "files_placed": 0, "status": "discard"}
{"timestamp": 1781373042.1893992, "experiment_id": "ddd74ee0", "concept_title": "The previous cycle distilled Fibonacci apparition theory down to a single **spin", "concept_domain": "Physics", "research_mode": "team", "quality": "partial", "quality_score": 0.5933170967741935, "catalog_references": [], "prompt_length": 20673, "files_placed": 0, "status": "keep"}
{"timestamp": 1781373685.3423092, "experiment_id": "25b9d37f", "concept_title": "The current formalization works with fixed Rademacher sign vectors. The natural ", "concept_domain": "Applications", "research_mode": "team", "quality": "partial", "quality_score": 0.34676071520698976, "catalog_references": [], "prompt_length": 13709, "files_placed": 0, "status": "discard"}
{"timestamp": 1781375605.415803, "experiment_id": "35b6dbf4", "concept_title": "Mobius Arithmetic: Number Theory on the Mobius Band", "concept_domain": "Novelty", "research_mode": "team", "quality": "partial", "quality_score": 0.3468437111584068, "catalog_references": [], "prompt_length": 7869, "files_placed": 0, "status": "discard"}
{"timestamp": 1781375629.99664, "experiment_id": "bd06a3da", "concept_title": "Riemann Hypothesis: Zero-Free Regions", "concept_domain": "Physics", "research_mode": "team", "quality": "partial", "quality_score": 0.34668586900056464, "catalog_references": [], "prompt_length": 5789, "files_placed": 0, "status": "discard"}
{"timestamp": 1781375647.466924, "experiment_id": "7521d122", "concept_title": "The new file `Catalog/Bridges/HodgeEPolynomial.lean` introduces the two-variable", "concept_domain": "Applications", "research_mode": "team", "quality": "substantial", "quality_score": 0.7797956398104267, "catalog_references": [], "prompt_length": 22624, "files_placed": 14, "status": "keep"}
{"timestamp": 1781375671.2811449, "experiment_id": "f782ceb5", "concept_title": "This cycle promoted the Fibonacci **spine**", "concept_domain": "Novelty", "research_mode": "team", "quality": "partial", "quality_score": 0.46921999999999997, "catalog_references": [], "prompt_length": 20060, "files_placed": 0, "status": "discard"}
{"timestamp": 1781375691.533184, "experiment_id": "9258fe06", "concept_title": "Close Proofs: This cycle isolated the two engines that drive *every* quantitative", "concept_domain": "Novelty", "research_mode": "team", "quality": "partial", "quality_score": 0.5117700000000001, "catalog_references": [], "prompt_length": 6227, "files_placed": 0, "status": "keep"}
{"timestamp": 1781375710.910112, "experiment_id": "8a56e0cc", "concept_title": "The natural next step is extending our one-variable tropical polynomial convexit", "concept_domain": "Applications", "research_mode": "team", "quality": "partial", "quality_score": 0.46002999999999994, "catalog_references": [], "prompt_length": 14446, "files_placed": 0, "status": "discard"}
{"timestamp": 1781377667.7866247, "experiment_id": "95de6b55", "concept_title": "Close Proofs: The previous cycle distilled Fibonacci apparition theory down to a sin", "concept_domain": "Novelty", "research_mode": "team", "quality": "partial", "quality_score": 0.589, "catalog_references": [], "prompt_length": 6157, "files_placed": 0, "status": "keep"}
{"timestamp": 1781377691.554142, "experiment_id": "c2e8d76d", "concept_title": "This cycle isolated the *rank of apparition* `r(p) = min { k > 0 : p \u2223 F(k) }`", "concept_domain": "Novelty", "research_mode": "team", "quality": "substantial", "quality_score": 0.76214, "catalog_references": [], "prompt_length": 23002, "files_placed": 5, "status": "keep"}
{"timestamp": 1781377733.6809275, "experiment_id": "b29efa56", "concept_title": "The file `Catalog/Speculative/AutoResearch/FibonacciApparition.lean` establishes", "concept_domain": "Novelty", "research_mode": "team", "quality": "partial", "quality_score": 0.4288536842105263, "catalog_references": [], "prompt_length": 16720, "files_placed": 0, "status": "discard"}
{"timestamp": 1781377774.0975914, "experiment_id": "f1017c22", "concept_title": "Extend the novelty certification framework from individual points to *sets*,", "concept_domain": "Novelty", "research_mode": "team", "quality": "partial", "quality_score": 0.4303947368421053, "catalog_references": [], "prompt_length": 15761, "files_placed": 0, "status": "discard"}
{"timestamp": 1781379718.3163311, "experiment_id": "8239de83", "concept_title": "This cycle reframed the divisibility structure of Fibonacci numbers as a *discre", "concept_domain": "Novelty", "research_mode": "team", "quality": "partial", "quality_score": 0.3480335, "catalog_references": [], "prompt_length": 20606, "files_placed": 0, "status": "discard"}
{"timestamp": 1781379741.9119854, "experiment_id": "c0931058", "concept_title": "Deepening: The file `Bridges/CombinatorialSpecies.lean` formalizes Joyal's combinatorial sp", "concept_domain": "Applications", "research_mode": "team", "quality": "partial", "quality_score": 0.6834399999999999, "catalog_references": [], "prompt_length": 17811, "files_placed": 6, "status": "keep"}
{"timestamp": 1781379769.3958137, "experiment_id": "52e9f99d", "concept_title": "Close Proofs: The file `Bridges/CombinatorialSpecies.lean` formalizes Joyal's combin", "concept_domain": "Applications", "research_mode": "team", "quality": "partial", "quality_score": 0.61388, "catalog_references": [], "prompt_length": 17657, "files_placed": 6, "status": "keep"}
{"timestamp": 1781379796.2210891, "experiment_id": "22207698", "concept_title": "This cycle fused two strands of the catalog that had been developed", "concept_domain": "Novelty", "research_mode": "team", "quality": "substantial", "quality_score": 0.7125600000000001, "catalog_references": [], "prompt_length": 24144, "files_placed": 6, "status": "keep"}
{"timestamp": 1781379828.4369278, "experiment_id": "6d1f9fa2", "concept_title": "Close Proofs: This cycle formalized the order-theoretic engine of the persistent-hom", "concept_domain": "Novelty", "research_mode": "team", "quality": "substantial", "quality_score": 0.70224, "catalog_references": [], "prompt_length": 17652, "files_placed": 6, "status": "keep"}
{"timestamp": 1781379863.5713687, "experiment_id": "e9c77dcd", "concept_title": "Close Proofs: The new file `Catalog/Bridges/HodgeEPolynomial.lean` introduces the tw", "concept_domain": "Applications", "research_mode": "team", "quality": "partial", "quality_score": 0.43043500545256275, "catalog_references": [], "prompt_length": 6203, "files_placed": 0, "status": "discard"}
{"timestamp": 1781381796.3296373, "experiment_id": "df4adefb", "concept_title": "Deepening: This cycle isolated the *rank of apparition* `r(p) = min { k > 0 : p \u2223 F(k) }`", "concept_domain": "Applications", "research_mode": "team", "quality": "partial", "quality_score": 0.3302605952380953, "catalog_references": [], "prompt_length": 6468, "files_placed": 0, "status": "discard"}
{"timestamp": 1781381817.9985847, "experiment_id": "1d644da7", "concept_title": "Deepening: The new file `Catalog/Bridges/HodgeEPolynomial.lean` introduces the two-variable", "concept_domain": "Novelty", "research_mode": "team", "quality": "partial", "quality_score": 0.52241, "catalog_references": [], "prompt_length": 6426, "files_placed": 0, "status": "keep"}
{"timestamp": 1781381840.435807, "experiment_id": "834df1bf", "concept_title": "Close Proofs: Quantum Error-Correcting Codes from Expander-Derived High-Dimensional ", "concept_domain": "Novelty", "research_mode": "team", "quality": "partial", "quality_score": 0.4725, "catalog_references": [], "prompt_length": 6173, "files_placed": 0, "status": "discard"}
{"timestamp": 1781383972.9128802, "experiment_id": "5d88a0fb", "concept_title": "Deepening: This cycle closed the single open `sorry` in `Bridges/ArrowCurvature/D", "concept_domain": "Novelty", "research_mode": "team", "quality": "partial", "quality_score": 0.4394637082781396, "catalog_references": [], "prompt_length": 6480, "files_placed": 0, "status": "discard"}
{"timestamp": 1781383993.5925262, "experiment_id": "7770a5d8", "concept_title": "This cycle closed the simplest non-trivial case of tropical (max-plus) spectral ", "concept_domain": "Applications", "research_mode": "team", "quality": "partial", "quality_score": 0.4251261381383486, "catalog_references": [], "prompt_length": 19817, "files_placed": 0, "status": "discard"}
{"timestamp": 1781384642.3366694, "experiment_id": "c0138e6f", "concept_title": "Order-theoretic core of the Cook\u2013Reckhow program built i", "concept_domain": "Applications", "research_mode": "team", "quality": "partial", "quality_score": 0.425724044520123, "catalog_references": [], "prompt_length": 21472, "files_placed": 0, "status": "discard"}
{"timestamp": 1781384669.0779963, "experiment_id": "9ea99386", "concept_title": "Noise-Stability Phase Transition for p-adic Neural Tangent Kernels on Bruhat\u2013Tit", "concept_domain": "Novelty", "research_mode": "team", "quality": "partial", "quality_score": 0.42599656816372683, "catalog_references": [], "prompt_length": 8331, "files_placed": 0, "status": "discard"}
{"timestamp": 1781384715.6195483, "experiment_id": "5b1caa2a", "concept_title": "This cycle formalized the Fibonacci **rank of apparition** as a *local-to-global", "concept_domain": "Applications", "research_mode": "team", "quality": "substantial", "quality_score": 0.7400800000000001, "catalog_references": [], "prompt_length": 24598, "files_placed": 5, "status": "keep"}
{"timestamp": 1781386642.2018476, "experiment_id": "0c91c737", "concept_title": "Arithmetic Concentration of Nodal Counts in Random Hecke Eigenfunctions on Large", "concept_domain": "Applications", "research_mode": "team", "quality": "partial", "quality_score": 0.5556226415094341, "catalog_references": [], "prompt_length": 8297, "files_placed": 0, "status": "keep"}
{"timestamp": 1781386664.6387959, "experiment_id": "e90419e3", "concept_title": "Benford Renormalization for Cluster Variables in Rank-2 Laurent Dynamics", "concept_domain": "Applications", "research_mode": "team", "quality": "partial", "quality_score": 0.44930340213936915, "catalog_references": [], "prompt_length": 7790, "files_placed": 0, "status": "discard"}
{"timestamp": 1781386680.8289824, "experiment_id": "e48e0385", "concept_title": "Close Proofs: This cycle fused two strands of the catalog that had been developed", "concept_domain": "Applications", "research_mode": "team", "quality": "partial", "quality_score": 0.62, "catalog_references": [], "prompt_length": 17652, "files_placed": 22, "status": "keep"}
{"timestamp": 1781388653.0477655, "experiment_id": "fcd11243", "concept_title": "Close Proofs: This cycle tested one structural hypothesis behind *self-referential t", "concept_domain": "Applications", "research_mode": "team", "quality": "partial", "quality_score": 0.5069374647887324, "catalog_references": [], "prompt_length": 6150, "files_placed": 0, "status": "keep"}
{"timestamp": 1781388676.3895004, "experiment_id": "3b3337c2", "concept_title": "Mod-p Monodromy Rigidity for Ap\u00e9ry-Type Picard\u2013Fuchs Operators", "concept_domain": "Novelty", "research_mode": "team", "quality": "partial", "quality_score": 0.4235328358208955, "catalog_references": [], "prompt_length": 8115, "files_placed": 0, "status": "discard"}
{"timestamp": 1781388695.3514693, "experiment_id": "5253a57e", "concept_title": "The file `Applications/CombinatorialSpecies.lean` originally established the exp", "concept_domain": "Applications", "research_mode": "team", "quality": "substantial", "quality_score": 0.77432, "catalog_references": [], "prompt_length": 24727, "files_placed": 6, "status": "keep"}
{"timestamp": 1781388717.1798701, "experiment_id": "80ea5c05", "concept_title": "This cycle isolated the *entry point* (rank of apparition) `z(p) = ` least `k > ", "concept_domain": "Applications", "research_mode": "team", "quality": "substantial", "quality_score": 0.778, "catalog_references": [], "prompt_length": 23277, "files_placed": 5, "status": "keep"}
{"timestamp": 1781388739.5957797, "experiment_id": "91338db4", "concept_title": "This cycle laid the *global* foundations of a constructive, finite-alphabet brid", "concept_domain": "Applications", "research_mode": "team", "quality": "partial", "quality_score": 0.42578514474772544, "catalog_references": [], "prompt_length": 19329, "files_placed": 0, "status": "discard"}
{"timestamp": 1781388764.3170233, "experiment_id": "03281f44", "concept_title": "Close Proofs: Noise-Stability Phase Transition for p-adic Neural Tangent Kernels on ", "concept_domain": "Novelty", "research_mode": "team", "quality": "partial", "quality_score": 0.3330265359477125, "catalog_references": [], "prompt_length": 6115, "files_placed": 0, "status": "discard"}
{"timestamp": 1781388784.39506, "experiment_id": "69d55bd4", "concept_title": "Close Proofs: This cycle formalized the Fibonacci **rank of apparition** as a *local", "concept_domain": "Applications", "research_mode": "team", "quality": "partial", "quality_score": 0.5450618181818183, "catalog_references": [], "prompt_length": 6135, "files_placed": 0, "status": "keep"}
{"timestamp": 1781390890.8569703, "experiment_id": "4e80baa8", "concept_title": "For a Calabi-Yau threefold X defined over \u211a, the L-function L(X, s) = \u03a3 a\u2099 n\u207b\u02e2", "concept_domain": "Novelty", "research_mode": "team", "quality": "partial", "quality_score": 0.4503353609022557, "catalog_references": [], "prompt_length": 22180, "files_placed": 10, "status": "discard"}
{"timestamp": 1781390908.9189403, "experiment_id": "dbdb8fbc", "concept_title": "The file `Geometry/StereographicCapacity.lean` establishes the metric backbone o", "concept_domain": "Novelty", "research_mode": "team", "quality": "partial", "quality_score": 0.51199, "catalog_references": [], "prompt_length": 16235, "files_placed": 0, "status": "keep"}
{"timestamp": 1781390929.1531267, "experiment_id": "4aeefdc1", "concept_title": "This cycle took the single load-bearing identity of the base file", "concept_domain": "Novelty", "research_mode": "team", "quality": "partial", "quality_score": 0.41115999999999997, "catalog_references": [], "prompt_length": 25586, "files_placed": 0, "status": "discard"}
{"timestamp": 1781392902.9372575, "experiment_id": "b71aab84", "concept_title": "Close Proofs: Benford Renormalization for Cluster Variables in Rank-2 Laurent Dynami", "concept_domain": "Novelty", "research_mode": "team", "quality": "partial", "quality_score": 0.5106290909090909, "catalog_references": [], "prompt_length": 6271, "files_placed": 0, "status": "keep"}
