{"timestamp": 1783950240.2213833, "experiment_id": "e0843845", "concept_title": "The file `Catalog/Speculative/AutoResearch/MixedRadixFactorialBridge.lean`", "concept_domain": "Applications", "research_mode": "team", "quality": "substantial", "quality_score": 0.8, "catalog_references": [], "prompt_length": 27825, "files_placed": 4, "status": "keep"}
{"timestamp": 1783950275.2350948, "experiment_id": "a71dcffe", "concept_title": "The cycle established that the atomic AllDifferent constraint has a sharp", "concept_domain": "Novelty", "research_mode": "team", "quality": "substantial", "quality_score": 0.78, "catalog_references": [], "prompt_length": 27142, "files_placed": 4, "status": "keep"}
{"timestamp": 1783951325.807503, "experiment_id": "0568e201", "concept_title": "Deepening: Edge-Spectral Supersaturation for Triangles", "concept_domain": "Applications", "research_mode": "team", "quality": "substantial", "quality_score": 0.83, "catalog_references": [], "prompt_length": 23289, "files_placed": 4, "status": "keep"}
{"timestamp": 1783953270.019835, "experiment_id": "2aaaa5f9", "concept_title": "Deepening: Explicit exponential lower bound for Vietoris-Rips approximations below \u221a2 thres", "concept_domain": "Novelty", "research_mode": "team", "quality": "substantial", "quality_score": 0.82, "catalog_references": [], "prompt_length": 24044, "files_placed": 4, "status": "keep"}
{"timestamp": 1783953287.677005, "experiment_id": "162989ab", "concept_title": "Siegel-Weil Identity for the E\u2088 Lattice Theta Series", "concept_domain": "Novelty", "research_mode": "team", "quality": "substantial", "quality_score": 0.82, "catalog_references": ["math.NT", "math.AG", "Siegel-Weil formula", "Eisenstein series", "Theta series"], "prompt_length": 23959, "files_placed": 4, "status": "keep"}
{"timestamp": 1783954289.895197, "experiment_id": "477f7787", "concept_title": "Conjecture: Balanced graphs coincide with hereditary clique\u2011Helly graphs", "concept_domain": "Applications", "research_mode": "team", "quality": "substantial", "quality_score": 0.7, "catalog_references": ["https://arxiv.org/abs/xxxx"], "prompt_length": 24060, "files_placed": 4, "status": "keep"}
{"timestamp": 1783954295.6455963, "experiment_id": "5acf2050", "concept_title": "Deepening: That the geometry surrounding the Hopf fibration is", "concept_domain": "Applications", "research_mode": "team", "quality": "substantial", "quality_score": 0.82, "catalog_references": [], "prompt_length": 24025, "files_placed": 4, "status": "keep"}
{"timestamp": 1783956254.5649278, "experiment_id": "e3aaa465", "concept_title": "Universality of Transfer Functions Among Accumulation Points", "concept_domain": "Applications", "research_mode": "team", "quality": "substantial", "quality_score": 0.78, "catalog_references": ["FurediSurvey", "KeevashSurvey", "SidorenkoSurvey", "ConlonSchulke"], "prompt_length": 21281, "files_placed": 4, "status": "keep"}
{"timestamp": 1783959368.4770029, "experiment_id": "f347bf96", "concept_title": "Deepening: Maximum Determinant Bound for 4\u00d74 Unimodular Matrices with Bounded Entries", "concept_domain": "Applications", "research_mode": "team", "quality": "substantial", "quality_score": 0.78, "catalog_references": [], "prompt_length": 24053, "files_placed": 4, "status": "keep"}
{"timestamp": 1783960350.4721456, "experiment_id": "24c0b42e", "concept_title": "Fyodorov-Hiary-Keating Conjecture for the Riemann Zeta Function", "concept_domain": "Novelty", "research_mode": "team", "quality": "substantial", "quality_score": 0.72, "catalog_references": ["Fyodorov_Hiary_Keating_2012", "Arguin_Belius_Harper_2017"], "prompt_length": 23969, "files_placed": 4, "status": "keep"}
{"timestamp": 1783960368.0133774, "experiment_id": "ac37e9f5", "concept_title": "Exact topological conjugacy between the smooth logisti", "concept_domain": "Novelty", "research_mode": "team", "quality": "substantial", "quality_score": 0.82, "catalog_references": [], "prompt_length": 30118, "files_placed": 4, "status": "keep"}
{"timestamp": 1783961504.1516685, "experiment_id": "adcea684", "concept_title": "Sharp Lower Bounds for Sumsets in L\u2081 Balls in \u2124\u1d48", "concept_domain": "Applications", "research_mode": "team", "quality": "substantial", "quality_score": 0.7, "catalog_references": ["Becker, Ivanisvili, Krachun, Madrid (original hypercube conjecture)", "related works on sumsets in convex sets"], "prompt_length": 23591, "files_placed": 4, "status": "keep"}
{"timestamp": 1783962574.0535696, "experiment_id": "b222c758", "concept_title": "Deepening: Rucker: Saucer Wisdom \u2014 Non-Human Mathematical Intuition", "concept_domain": "Novelty", "research_mode": "team", "quality": "substantial", "quality_score": 0.82, "catalog_references": [], "prompt_length": 24026, "files_placed": 4, "status": "keep"}
{"timestamp": 1783962584.6604333, "experiment_id": "ee7062d3", "concept_title": "Local-to-Global KKL Theorem for Simplicial Complexes with Local KKL Links", "concept_domain": "Applications", "research_mode": "team", "quality": "substantial", "quality_score": 0.82, "catalog_references": ["Kahn88", "Bafna22", "Gur22", "Gotlib23"], "prompt_length": 23912, "files_placed": 4, "status": "keep"}
{"timestamp": 1783963579.2296584, "experiment_id": "37818bd9", "concept_title": "Extension of Matsuno's Formula for Non-Vanishing \u03bc-Invariants", "concept_domain": "Novelty", "research_mode": "team", "quality": "substantial", "quality_score": 0.7, "catalog_references": ["Spr12", "Pol03", "Mat08", "Hatley-Ray"], "prompt_length": 23725, "files_placed": 4, "status": "keep"}
{"timestamp": 1783965565.72501, "experiment_id": "ddc0d02e", "concept_title": "Deepening: Proofs as DAGs: The Directed Acyclic Graph Structure of Mathematics", "concept_domain": "Applications", "research_mode": "team", "quality": "substantial", "quality_score": 0.8, "catalog_references": [], "prompt_length": 23085, "files_placed": 4, "status": "keep"}
{"timestamp": 1783968607.2692053, "experiment_id": "d31b8b8b", "concept_title": "Sharp maximal excess of co-index under suspension for all feasible starting co-indices", "concept_domain": "Novelty", "research_mode": "team", "quality": "substantial", "quality_score": 0.74, "catalog_references": ["Csorba's theorem: B0(G) \u2243_{Z2} S(B(G))", "Borsuk\u2013Ulam theorem", "Lov\u00e1sz's box complex lower bound \u03c7(G) \u2265 coind(B(G))+2", "Simonyi\u2013Tardos\u2013Vr\u00e9cica question on co-index growth under suspension"], "prompt_length": 23906, "files_placed": 4, "status": "keep"}
{"timestamp": 1783969630.9075074, "experiment_id": "d954b0de", "concept_title": "Seidel energy strictly increases under edge deletion in Tur\u00e1n graphs", "concept_domain": "Novelty", "research_mode": "team", "quality": "substantial", "quality_score": 0.74, "catalog_references": ["math.CO", "math.SP"], "prompt_length": 23948, "files_placed": 4, "status": "keep"}
{"timestamp": 1783969647.5741549, "experiment_id": "ad0affd1", "concept_title": "Explicit exponential lower bound for Vietoris-Rips approximations below \u221a2 threshold", "concept_domain": "Applications", "research_mode": "team", "quality": "substantial", "quality_score": 0.79, "catalog_references": ["VR filtrations and metric spaces", "Approximation algorithms in TDA", "Homotopy interleavings", "Doubling dimension in metric geometry"], "prompt_length": 23886, "files_placed": 4, "status": "keep"}
{"timestamp": 1783970644.8527536, "experiment_id": "c0577eb2", "concept_title": "Deepening: Exact topological conjugacy between the smooth logisti", "concept_domain": "Applications", "research_mode": "team", "quality": "substantial", "quality_score": 0.82, "catalog_references": [], "prompt_length": 24028, "files_placed": 4, "status": "keep"}
{"timestamp": 1783970680.9133787, "experiment_id": "6e7a2b5e", "concept_title": "Deepening: Previous cycles formalized Dung's abstract argumentation semantics: conflict-fre", "concept_domain": "Applications", "research_mode": "team", "quality": "substantial", "quality_score": 0.82, "catalog_references": [], "prompt_length": 24059, "files_placed": 4, "status": "keep"}
{"timestamp": 1783970708.9335341, "experiment_id": "f3fa6ca4", "concept_title": "Siegel-Weil Identity for the E\u2088 Lattice Theta Series", "concept_domain": "Applications", "research_mode": "team", "quality": "substantial", "quality_score": 0.82, "catalog_references": ["math.NT", "math.AG", "Siegel-Weil formula", "Eisenstein series", "Theta series"], "prompt_length": 23811, "files_placed": 4, "status": "keep"}
{"timestamp": 1783973678.9959285, "experiment_id": "c81e5afa", "concept_title": "Close Proofs: The file `Catalog/Speculative/AutoResearch/MixedRadixFactorialBridge.l", "concept_domain": "Applications", "research_mode": "team", "quality": "substantial", "quality_score": 0.72, "catalog_references": [], "prompt_length": 18203, "files_placed": 4, "status": "keep"}
{"timestamp": 1783975703.4547074, "experiment_id": "ce15dd8e", "concept_title": "Close Proofs: The Uncanny Valley of Mathematics: When Proofs Are Almost Right", "concept_domain": "Applications", "research_mode": "team", "quality": "substantial", "quality_score": 0.78, "catalog_references": [], "prompt_length": 21256, "files_placed": 4, "status": "keep"}
{"timestamp": 1783977864.3073292, "experiment_id": "49ddee39", "concept_title": "Close Proofs: Sharp maximal excess of co-index under suspension for all feasible sta", "concept_domain": "Applications", "research_mode": "team", "quality": "substantial", "quality_score": 0.78, "catalog_references": [], "prompt_length": 23900, "files_placed": 4, "status": "keep"}
{"timestamp": 1783977875.772996, "experiment_id": "5fd927d4", "concept_title": "Close Proofs: The Category Theory of Jokes: Universal Properties of Humor", "concept_domain": "Applications", "research_mode": "team", "quality": "substantial", "quality_score": 0.8, "catalog_references": [], "prompt_length": 23087, "files_placed": 4, "status": "keep"}
{"timestamp": 1783980993.67877, "experiment_id": "6d984d02", "concept_title": "Infinite Pachner's Theorem for Locally Finite Triangulations", "concept_domain": "Novelty", "research_mode": "team", "quality": "partial", "quality_score": 0.62, "catalog_references": ["math.GT", "math.CO"], "prompt_length": 3058, "files_placed": 2, "status": "keep"}
{"timestamp": 1783982158.4130654, "experiment_id": "5d81b714", "concept_title": "Cone Colorful Carath\u00e9odory Theorem", "concept_domain": "Applications", "research_mode": "team", "quality": "substantial", "quality_score": 0.82, "catalog_references": ["math.CO", "math.AT", "math.MG"], "prompt_length": 23756, "files_placed": 4, "status": "keep"}
{"timestamp": 1783984407.6908643, "experiment_id": "117d6517", "concept_title": "Deepening: Hofstadter: Fluid Concepts and Creative Analogies \u2014 Analogy as a Mathematical Op", "concept_domain": "Applications", "research_mode": "team", "quality": "substantial", "quality_score": 0.83, "catalog_references": [], "prompt_length": 24055, "files_placed": 4, "status": "keep"}
{"timestamp": 1783984425.0774527, "experiment_id": "beca1e55", "concept_title": "Deepening: Transfinite Game Theory: Games That Last Forever", "concept_domain": "Applications", "research_mode": "team", "quality": "substantial", "quality_score": 0.82, "catalog_references": [], "prompt_length": 23997, "files_placed": 4, "status": "keep"}
{"timestamp": 1783985497.3962674, "experiment_id": "a0f7e73c", "concept_title": "Sharp dichotomy for the *total* d-Hoggatt numbers", "concept_domain": "Applications", "research_mode": "team", "quality": "substantial", "quality_score": 0.72, "catalog_references": [], "prompt_length": 26498, "files_placed": 4, "status": "keep"}
{"timestamp": 1783985505.7748275, "experiment_id": "664b3442", "concept_title": "Deepening: Moonshot: Time-Travel Logic \u2014 Formalizing Causal Consistency", "concept_domain": "Applications", "research_mode": "team", "quality": "substantial", "quality_score": 0.83, "catalog_references": [], "prompt_length": 24038, "files_placed": 4, "status": "keep"}
{"timestamp": 1783985513.2953389, "experiment_id": "17340490", "concept_title": "Close Proofs: The Topology of Knotted Light: How Laser Beams Get Tangled", "concept_domain": "Novelty", "research_mode": "team", "quality": "substantial", "quality_score": 0.83, "catalog_references": [], "prompt_length": 22887, "files_placed": 4, "status": "keep"}
{"timestamp": 1783986669.2054315, "experiment_id": "7547cdb0", "concept_title": "Deepening: Moonshot: Multiverse Set Theory \u2014 Mathematics Across Branches", "concept_domain": "Novelty", "research_mode": "team", "quality": "substantial", "quality_score": 0.82, "catalog_references": [], "prompt_length": 24026, "files_placed": 4, "status": "keep"}
{"timestamp": 1783989698.4880667, "experiment_id": "dbbebdc4", "concept_title": "Close Proofs: Lower bounds on clique densities using generalized inverses", "concept_domain": "Applications", "research_mode": "team", "quality": "partial", "quality_score": 0.6, "catalog_references": [], "prompt_length": 10049, "files_placed": 1, "status": "keep"}
{"timestamp": 1783990814.6214092, "experiment_id": "28ee7277", "concept_title": "Deepening: Hofstadter: I Am a Strange Loop \u2014 Consciousness as Self-Reference", "concept_domain": "Novelty", "research_mode": "team", "quality": "substantial", "quality_score": 0.85, "catalog_references": [], "prompt_length": 24035, "files_placed": 4, "status": "keep"}
{"timestamp": 1783991814.058292, "experiment_id": "1bd2f770", "concept_title": "Tight spectral gap exponent for the fixed-genus chord swap chain", "concept_domain": "Novelty", "research_mode": "team", "quality": "substantial", "quality_score": 0.82, "catalog_references": ["math.PR", "math.CO"], "prompt_length": 23822, "files_placed": 4, "status": "keep"}
{"timestamp": 1783991833.6023726, "experiment_id": "ea3218f3", "concept_title": "Minimally 1\u2011tough (K\u2081 \u222a P\u2084)-free graphs are Hamiltonian", "concept_domain": "Novelty", "research_mode": "team", "quality": "substantial", "quality_score": 0.7, "catalog_references": ["LibinlP4K1", "Nikoghosyan", "BauerNot every 2-tough"], "prompt_length": 23632, "files_placed": 4, "status": "keep"}
{"timestamp": 1783991882.0559318, "experiment_id": "ae9bfe48", "concept_title": "Cographs are generalized spectrally closed", "concept_domain": "Applications", "research_mode": "team", "quality": "substantial", "quality_score": 0.7, "catalog_references": ["arXiv:2407.XXXXX (this paper)", "Corneil et al. 'Cographs: recognition and applications' (1981)"], "prompt_length": 23827, "files_placed": 4, "status": "keep"}
{"timestamp": 1783994007.5039241, "experiment_id": "3903c2d7", "concept_title": "Bypassed", "concept_domain": "Applications", "research_mode": "team", "quality": "substantial", "quality_score": 0.82, "catalog_references": [], "prompt_length": 23458, "files_placed": 4, "status": "keep"}
{"timestamp": 1783994023.3183365, "experiment_id": "6af180ae", "concept_title": "Deepening: Generalized Multinomial Convolution Identity for Latin Rectangle Enumeration", "concept_domain": "Novelty", "research_mode": "team", "quality": "substantial", "quality_score": 0.86, "catalog_references": [], "prompt_length": 24047, "files_placed": 4, "status": "keep"}
{"timestamp": 1783995035.2854824, "experiment_id": "cf19c51c", "concept_title": "This cycle established, unconditionally, the constructive lower-bound half of th", "concept_domain": "Novelty", "research_mode": "team", "quality": "substantial", "quality_score": 0.79, "catalog_references": [], "prompt_length": 27680, "files_placed": 4, "status": "keep"}
{"timestamp": 1783998235.7945933, "experiment_id": "0782e3ca", "concept_title": "Asymptotic Expansion of Weighted Riesz Means for Sesquiharmonic Maass Forms", "concept_domain": "Applications", "research_mode": "team", "quality": "substantial", "quality_score": 0.72, "catalog_references": ["Zagier75", "DukeImamogluToth19", "BRR3"], "prompt_length": 23782, "files_placed": 4, "status": "keep"}
{"timestamp": 1783998299.329659, "experiment_id": "30210199", "concept_title": "Close Proofs: Moonshot: Alien Number Systems \u2014 Mathematics Beyond Base-10", "concept_domain": "Applications", "research_mode": "team", "quality": "substantial", "quality_score": 0.82, "catalog_references": [], "prompt_length": 23893, "files_placed": 4, "status": "keep"}
{"timestamp": 1784000447.4907994, "experiment_id": "c923638c", "concept_title": "`MatsunoIwasawaBridge.lean` builds a self-contained algebraic model of the two", "concept_domain": "Novelty", "research_mode": "team", "quality": "substantial", "quality_score": 0.82, "catalog_references": [], "prompt_length": 27421, "files_placed": 4, "status": "keep"}
{"timestamp": 1784000489.6009207, "experiment_id": "11762aec", "concept_title": "Close Proofs: Minimally 1\u2011tough (K\u2081 \u222a P\u2084)-free graphs are Hamiltonian", "concept_domain": "Novelty", "research_mode": "team", "quality": "substantial", "quality_score": 0.82, "catalog_references": [], "prompt_length": 23820, "files_placed": 4, "status": "keep"}
{"timestamp": 1784000514.6264331, "experiment_id": "7acc7a45", "concept_title": "Close Proofs: This cycle established, unconditionally, the constructive lower-bound ", "concept_domain": "Novelty", "research_mode": "team", "quality": "substantial", "quality_score": 0.83, "catalog_references": [], "prompt_length": 23890, "files_placed": 4, "status": "keep"}
{"timestamp": 1784004627.2547302, "experiment_id": "bec8fe46", "concept_title": "Close Proofs: Tight spectral gap exponent for the fixed-genus chord swap chain", "concept_domain": "Novelty", "research_mode": "team", "quality": "substantial", "quality_score": 0.85, "catalog_references": [], "prompt_length": 23884, "files_placed": 4, "status": "keep"}
{"timestamp": 1784006634.99073, "experiment_id": "2758a31c", "concept_title": "Deepening: `MatsunoIwasawaBridge.lean` builds a self-contained algebraic model of the two", "concept_domain": "Applications", "research_mode": "team", "quality": "substantial", "quality_score": 0.83, "catalog_references": [], "prompt_length": 24052, "files_placed": 4, "status": "keep"}
{"timestamp": 1784008785.9844577, "experiment_id": "33954867", "concept_title": "This cycle isolated and proved the arithmetic residue of the identity", "concept_domain": "Applications", "research_mode": "team", "quality": "substantial", "quality_score": 0.72, "catalog_references": [], "prompt_length": 26645, "files_placed": 4, "status": "keep"}
{"timestamp": 1784008801.3889773, "experiment_id": "797ab793", "concept_title": "Deepening: This cycle established, unconditionally, the constructive lower-bound", "concept_domain": "Applications", "research_mode": "team", "quality": "substantial", "quality_score": 0.82, "catalog_references": [], "prompt_length": 24043, "files_placed": 4, "status": "keep"}
{"timestamp": 1784009830.9463425, "experiment_id": "86411247", "concept_title": "This cycle deepened the combinatorial core of the set-theoretic multiverse by", "concept_domain": "Novelty", "research_mode": "team", "quality": "substantial", "quality_score": 0.8, "catalog_references": [], "prompt_length": 28569, "files_placed": 4, "status": "keep"}
{"timestamp": 1784010905.9255247, "experiment_id": "189556db", "concept_title": "Close Proofs: `MatsunoIwasawaBridge.lean` builds a self-contained algebraic model of", "concept_domain": "Applications", "research_mode": "team", "quality": "substantial", "quality_score": 0.72, "catalog_references": [], "prompt_length": 23900, "files_placed": 4, "status": "keep"}
{"timestamp": 1784010935.6416528, "experiment_id": "30ef4e5b", "concept_title": "Close Proofs: Sharp Lower Bounds for Sumsets in L\u2081 Balls in \u2124\u1d48", "concept_domain": "Novelty", "research_mode": "team", "quality": "substantial", "quality_score": 0.82, "catalog_references": [], "prompt_length": 23873, "files_placed": 4, "status": "keep"}
{"timestamp": 1784012040.518148, "experiment_id": "0abd0edb", "concept_title": "Close Proofs: Exact AVD\u2011total chromatic number of central graphs of regular graphs", "concept_domain": "Novelty", "research_mode": "team", "quality": "substantial", "quality_score": 0.78, "catalog_references": [], "prompt_length": 23228, "files_placed": 4, "status": "keep"}
{"timestamp": 1784014182.3412795, "experiment_id": "b97ab468", "concept_title": "This project formalizes a **cross-domain connector** (v27 \"Connector\" mission): ", "concept_domain": "Novelty", "research_mode": "team", "quality": "substantial", "quality_score": 0.82, "catalog_references": [], "prompt_length": 27458, "files_placed": 4, "status": "keep"}
{"timestamp": 1784014203.3866277, "experiment_id": "769cd692", "concept_title": "**suspension tower** `S\u1d4f(K)` of a free \u2124\u2082-complex as", "concept_domain": "Novelty", "research_mode": "team", "quality": "substantial", "quality_score": 0.78, "catalog_references": [], "prompt_length": 33532, "files_placed": 4, "status": "keep"}
{"timestamp": 1784018388.6710975, "experiment_id": "efa2b99e", "concept_title": "Reusable toughness toolkit centered on the *component", "concept_domain": "Applications", "research_mode": "team", "quality": "substantial", "quality_score": 0.83, "catalog_references": [], "prompt_length": 27100, "files_placed": 4, "status": "keep"}
{"timestamp": 1784018395.0478446, "experiment_id": "0a1d0253", "concept_title": "The file `Catalog/Applications/MatsunoMuExtension.lean` formalises the arithmeti", "concept_domain": "Applications", "research_mode": "team", "quality": "substantial", "quality_score": 0.82, "catalog_references": [], "prompt_length": 24930, "files_placed": 4, "status": "keep"}
