{"timestamp": 1781453849.9346557, "experiment_id": "bc66959c", "concept_title": "`Applications/BoltzmannBridge/InterleavingGeodesic.lean` closes the", "concept_domain": "Novelty", "research_mode": "team", "quality": "substantial", "quality_score": 0.7748660869565218, "catalog_references": [], "prompt_length": 25191, "files_placed": 12, "status": "keep"}
{"timestamp": 1781453883.6765373, "experiment_id": "f6061e16", "concept_title": "Close Proofs: `Applications/BoltzmannBridge/InterleavingIsometry.lean` discharges **", "concept_domain": "Applications", "research_mode": "team", "quality": "partial", "quality_score": 0.566657142857143, "catalog_references": [], "prompt_length": 6230, "files_placed": 0, "status": "keep"}
{"timestamp": 1781455860.3145397, "experiment_id": "d16da345", "concept_title": "Close Proofs: The catalog's `SmoothPoincare` files develop the *lattice* side of the", "concept_domain": "Applications", "research_mode": "team", "quality": "partial", "quality_score": 0.6925063157894736, "catalog_references": [], "prompt_length": 17660, "files_placed": 6, "status": "keep"}
{"timestamp": 1781455876.125898, "experiment_id": "d5286918", "concept_title": "The fifth cycle established *pointwise* convergence of gradient message passing", "concept_domain": "Applications", "research_mode": "team", "quality": "substantial", "quality_score": 0.7285881081081081, "catalog_references": [], "prompt_length": 24069, "files_placed": 6, "status": "keep"}
{"timestamp": 1781455896.0930946, "experiment_id": "24067fd2", "concept_title": "This cycle delivered `Catalog/Bridges/ApparitionOrderBridge.lean`, a self-contai", "concept_domain": "Novelty", "research_mode": "team", "quality": "substantial", "quality_score": 0.7492381651376147, "catalog_references": [], "prompt_length": 24941, "files_placed": 7, "status": "keep"}
{"timestamp": 1781455919.2850268, "experiment_id": "47f4bb3f", "concept_title": "The previous cycles established two layers of the spectral-depth picture for", "concept_domain": "Novelty", "research_mode": "team", "quality": "substantial", "quality_score": 0.7286333944954129, "catalog_references": [], "prompt_length": 24740, "files_placed": 6, "status": "keep"}
{"timestamp": 1781455944.2102666, "experiment_id": "4914a93f", "concept_title": "Close Proofs: The previous strands of this project pinned down two complementary pic", "concept_domain": "Applications", "research_mode": "team", "quality": "partial", "quality_score": 0.5781599999999999, "catalog_references": [], "prompt_length": 6258, "files_placed": 0, "status": "keep"}
{"timestamp": 1781455967.6858501, "experiment_id": "c4adbf52", "concept_title": "Close Proofs: This cycle pushed the discrete Hodge program from its *geometric/decom", "concept_domain": "Novelty", "research_mode": "team", "quality": "partial", "quality_score": 0.37465328853926383, "catalog_references": [], "prompt_length": 6257, "files_placed": 0, "status": "discard"}
{"timestamp": 1781457949.4293184, "experiment_id": "bd0d44c9", "concept_title": "This cycle carried the discrete Hodge program from its **operator-algebra / spec", "concept_domain": "Novelty", "research_mode": "team", "quality": "partial", "quality_score": 0.3845508657843596, "catalog_references": [], "prompt_length": 23289, "files_placed": 0, "status": "discard"}
{"timestamp": 1781457971.127847, "experiment_id": "e7fa7a56", "concept_title": "This cycle (`HodgeDeepLimit.lean`) closed the loop from *\"the residual energy ge", "concept_domain": "Novelty", "research_mode": "team", "quality": "partial", "quality_score": 0.3141528, "catalog_references": [], "prompt_length": 21882, "files_placed": 0, "status": "discard"}
{"timestamp": 1781459969.6949804, "experiment_id": "7b7d3fde", "concept_title": "This cycle isolated the *group-theoretic engine* underneath the conjecture that", "concept_domain": "Applications", "research_mode": "team", "quality": "partial", "quality_score": 0.5170339622641509, "catalog_references": [], "prompt_length": 21045, "files_placed": 0, "status": "keep"}
{"timestamp": 1781460023.3922944, "experiment_id": "6f3ef49b", "concept_title": "This cycle delivered `Catalog/Novelty/FibCarmichaelStructure.lean`, a self-conta", "concept_domain": "Applications", "research_mode": "team", "quality": "partial", "quality_score": 0.52336, "catalog_references": [], "prompt_length": 20975, "files_placed": 0, "status": "keep"}
{"timestamp": 1781460045.6412303, "experiment_id": "e40dd245", "concept_title": "Close Proofs: The previous cycles established two layers of the spectral-depth pictu", "concept_domain": "Applications", "research_mode": "team", "quality": "partial", "quality_score": 0.5433714285714286, "catalog_references": [], "prompt_length": 6195, "files_placed": 0, "status": "keep"}
{"timestamp": 1781460060.8058212, "experiment_id": "0c8e6531", "concept_title": "This cycle (`Catalog/Speculative/AutoResearch/HodgeFilterDynamics.lean`) sharpen", "concept_domain": "Novelty", "research_mode": "team", "quality": "partial", "quality_score": 0.68738, "catalog_references": [], "prompt_length": 26093, "files_placed": 5, "status": "keep"}
{"timestamp": 1781460076.057309, "experiment_id": "79dd61d7", "concept_title": "Close Proofs: This cycle delivered `Catalog/Bridges/ApparitionOrderBridge.lean`, a s", "concept_domain": "Applications", "research_mode": "team", "quality": "substantial", "quality_score": 0.7172923076923078, "catalog_references": [], "prompt_length": 17658, "files_placed": 5, "status": "keep"}
{"timestamp": 1781462071.0645819, "experiment_id": "d6769d5d", "concept_title": "Deepening: `Applications/BoltzmannBridge/InterleavingIsometry.lean` discharges **Future", "concept_domain": "Applications", "research_mode": "team", "quality": "substantial", "quality_score": 0.74884, "catalog_references": [], "prompt_length": 17807, "files_placed": 8, "status": "keep"}
{"timestamp": 1781462090.520689, "experiment_id": "fb3f3807", "concept_title": "Close Proofs: The fifth cycle established *pointwise* convergence of gradient messag", "concept_domain": "Applications", "research_mode": "team", "quality": "partial", "quality_score": 0.68156, "catalog_references": [], "prompt_length": 17663, "files_placed": 5, "status": "keep"}
{"timestamp": 1781462108.4891696, "experiment_id": "565c3737", "concept_title": "Three earlier cycles built the spectral-depth picture of Hodge\u2013Laplacian message", "concept_domain": "Novelty", "research_mode": "team", "quality": "partial", "quality_score": 0.5173699999999999, "catalog_references": [], "prompt_length": 22246, "files_placed": 0, "status": "keep"}
{"timestamp": 1781462130.9267094, "experiment_id": "b6018fb7", "concept_title": "Close Proofs: This cycle isolated the *group-theoretic engine* underneath the conjec", "concept_domain": "Novelty", "research_mode": "team", "quality": "partial", "quality_score": 0.5524, "catalog_references": [], "prompt_length": 6228, "files_placed": 0, "status": "keep"}
{"timestamp": 1781464109.6436164, "experiment_id": "bdfb3c10", "concept_title": "This cycle delivered `Catalog/Speculative/AutoResearch/EckmannHiltonMonoid.lean`", "concept_domain": "Novelty", "research_mode": "team", "quality": "partial", "quality_score": 0.599415, "catalog_references": [], "prompt_length": 21181, "files_placed": 0, "status": "keep"}
{"timestamp": 1781464130.225651, "experiment_id": "f9772880", "concept_title": "The discrete-Hodge program has, over its earlier cycles, built the *geometric/de", "concept_domain": "Novelty", "research_mode": "team", "quality": "partial", "quality_score": 0.47428000000000003, "catalog_references": [], "prompt_length": 16881, "files_placed": 0, "status": "discard"}
{"timestamp": 1781464155.668211, "experiment_id": "c48a75d5", "concept_title": "Close Proofs: This cycle (`Catalog/Speculative/AutoResearch/HodgeFilterDynamics.lean", "concept_domain": "Applications", "research_mode": "team", "quality": "partial", "quality_score": 0.36016000000000004, "catalog_references": [], "prompt_length": 6206, "files_placed": 0, "status": "discard"}
{"timestamp": 1781464172.9978776, "experiment_id": "5a4a0b2c", "concept_title": "Deepening: `Applications/BoltzmannBridge/InterleavingGeodesic.lean` closes the", "concept_domain": "Applications", "research_mode": "team", "quality": "substantial", "quality_score": 0.7868, "catalog_references": [], "prompt_length": 17797, "files_placed": 8, "status": "keep"}
{"timestamp": 1781464193.9092522, "experiment_id": "b8394462", "concept_title": "Close Proofs: Three earlier cycles built the spectral-depth picture of Hodge\u2013Laplaci", "concept_domain": "Novelty", "research_mode": "team", "quality": "partial", "quality_score": 0.4461099999999999, "catalog_references": [], "prompt_length": 6234, "files_placed": 0, "status": "discard"}
{"timestamp": 1781465922.3742304, "experiment_id": "47be570a", "concept_title": "The Boltzmann Bridge arc has, over several cycles, reduced the entire metric the", "concept_domain": "Novelty", "research_mode": "team", "quality": "partial", "quality_score": 0.5787153846153846, "catalog_references": [], "prompt_length": 21055, "files_placed": 0, "status": "keep"}
{"timestamp": 1781465948.2909474, "experiment_id": "fee45688", "concept_title": "`Applications/BoltzmannBridge/InterleavingRepresentation.lean` (Bridge IX) takes", "concept_domain": "Applications", "research_mode": "team", "quality": "partial", "quality_score": 0.523115, "catalog_references": [], "prompt_length": 21145, "files_placed": 0, "status": "keep"}
{"timestamp": 1781465978.8234615, "experiment_id": "e4fa0e67", "concept_title": "This cycle pushed the *representation/duality* program of the synthetic-HoTT", "concept_domain": "Novelty", "research_mode": "team", "quality": "partial", "quality_score": 0.5098981818181818, "catalog_references": [], "prompt_length": 23258, "files_placed": 0, "status": "keep"}
{"timestamp": 1781466008.3558285, "experiment_id": "2b2bf715", "concept_title": "Close Proofs: This cycle delivered `Catalog/Speculative/AutoResearch/EckmannHiltonMo", "concept_domain": "Novelty", "research_mode": "team", "quality": "partial", "quality_score": 0.3922723308270677, "catalog_references": [], "prompt_length": 6255, "files_placed": 0, "status": "discard"}
{"timestamp": 1781466488.3311787, "experiment_id": "cc67c014", "concept_title": "`Catalog/Applications/BoltzmannBridge/InterleavingFunctor.lean` (Bridge IX)", "concept_domain": "Novelty", "research_mode": "team", "quality": "partial", "quality_score": 0.4766809160305343, "catalog_references": [], "prompt_length": 27705, "files_placed": 0, "status": "discard"}
{"timestamp": 1781467489.6962035, "experiment_id": "601ab928", "concept_title": "The catalog's Carmichael work (`Catalog/Speculative/AutoResearch/CarmichaelCompo", "concept_domain": "Applications", "research_mode": "team", "quality": "partial", "quality_score": 0.4223894392069131, "catalog_references": [], "prompt_length": 17255, "files_placed": 0, "status": "discard"}
{"timestamp": 1781469462.5472605, "experiment_id": "e83936cd", "concept_title": "This cycle closed the conceptual loop opened by the spectral-depth-threshold wor", "concept_domain": "Applications", "research_mode": "team", "quality": "partial", "quality_score": 0.49090545454545453, "catalog_references": [], "prompt_length": 17429, "files_placed": 0, "status": "discard"}
{"timestamp": 1781469488.679105, "experiment_id": "1c463510", "concept_title": "Close Proofs: The discrete-Hodge program has, over its earlier cycles, built the *ge", "concept_domain": "Applications", "research_mode": "team", "quality": "partial", "quality_score": 0.49706666666666666, "catalog_references": [], "prompt_length": 6189, "files_placed": 0, "status": "discard"}
{"timestamp": 1781469527.880631, "experiment_id": "5204dcbf", "concept_title": "The Boltzmann Bridge arc reduced the metric theory of persistence stability to a", "concept_domain": "Tropical", "research_mode": "team", "quality": "partial", "quality_score": 0.53295, "catalog_references": [], "prompt_length": 24405, "files_placed": 0, "status": "keep"}
{"timestamp": 1781469547.4320807, "experiment_id": "dae6a9b2", "concept_title": "The previous cycle pinned down the *object-level* content of the Eckmann\u2013Hilton", "concept_domain": "Logic", "research_mode": "team", "quality": "partial", "quality_score": 0.5504199999999999, "catalog_references": [], "prompt_length": 24007, "files_placed": 0, "status": "keep"}
{"timestamp": 1781469573.7847111, "experiment_id": "a3760248", "concept_title": "Proof-Complexity Phase Transition in Lean-Definable Rewriting Dynamics", "concept_domain": "Algebra", "research_mode": "team", "quality": "partial", "quality_score": 0.35307452173913045, "catalog_references": [], "prompt_length": 8073, "files_placed": 0, "status": "discard"}
{"timestamp": 1781470908.7965767, "experiment_id": "75b4da8e", "concept_title": "Definable Ricci-Flow Renormalization Fixed Points in Simplicial Quantum Error-Co", "concept_domain": "Physics", "research_mode": "team", "quality": "partial", "quality_score": 0.5219054545454546, "catalog_references": [], "prompt_length": 7586, "files_placed": 0, "status": "keep"}
{"timestamp": 1781472907.08203, "experiment_id": "60b0b842", "concept_title": "Spectral Gap Rigidity for Hypergraph Hodge Laplacians Under Simplicial Coarse-Gr", "concept_domain": "Applications", "research_mode": "team", "quality": "partial", "quality_score": 0.44761791485129226, "catalog_references": [], "prompt_length": 7426, "files_placed": 0, "status": "discard"}
{"timestamp": 1781472924.0249805, "experiment_id": "7eb7c87e", "concept_title": "The catalog's synthetic-HoTT layer (`Catalog/Logic/HoTT/Foundations.lean`) *defi", "concept_domain": "Novelty", "research_mode": "team", "quality": "partial", "quality_score": 0.6310311834319526, "catalog_references": [], "prompt_length": 25251, "files_placed": 6, "status": "keep"}
{"timestamp": 1781472945.876815, "experiment_id": "36dba103", "concept_title": "Close Proofs: The Boltzmann Bridge arc has, over several cycles, reduced the entire ", "concept_domain": "Combinatorics", "research_mode": "team", "quality": "substantial", "quality_score": 0.7248000000000001, "catalog_references": [], "prompt_length": 17658, "files_placed": 6, "status": "keep"}
{"timestamp": 1781472969.5775597, "experiment_id": "9fe725de", "concept_title": "Close Proofs: The Boltzmann Bridge arc reduced the metric theory of persistence stab", "concept_domain": "Probability", "research_mode": "team", "quality": "partial", "quality_score": 0.49574, "catalog_references": [], "prompt_length": 6189, "files_placed": 0, "status": "discard"}
{"timestamp": 1781472991.2728724, "experiment_id": "0827184d", "concept_title": "The `SmoothPoincare` family in `Catalog/Applications/SmoothPoincare/` builds the", "concept_domain": "Pythagorean", "research_mode": "team", "quality": "partial", "quality_score": 0.47720761904761905, "catalog_references": [], "prompt_length": 21300, "files_placed": 0, "status": "discard"}
{"timestamp": 1781473010.7292714, "experiment_id": "bea64f19", "concept_title": "Close Proofs: `Applications/BoltzmannBridge/InterleavingGeodesic.lean` closes the", "concept_domain": "Combinatorics", "research_mode": "team", "quality": "partial", "quality_score": 0.5005650793650793, "catalog_references": [], "prompt_length": 6122, "files_placed": 0, "status": "keep"}
{"timestamp": 1781475021.206859, "experiment_id": "5bf359eb", "concept_title": "Close Proofs: `Applications/BoltzmannBridge/InterleavingRepresentation.lean` (Bridge", "concept_domain": "NumberTheory", "research_mode": "team", "quality": "partial", "quality_score": 0.5584189473684211, "catalog_references": [], "prompt_length": 6113, "files_placed": 0, "status": "keep"}
{"timestamp": 1781475045.7813592, "experiment_id": "977dbedb", "concept_title": "This cycle attacked the conjecture of a *sharp proof-complexity phase transition", "concept_domain": "Pythagorean", "research_mode": "team", "quality": "partial", "quality_score": 0.5267885714285714, "catalog_references": [], "prompt_length": 20958, "files_placed": 0, "status": "keep"}
{"timestamp": 1781475068.0821068, "experiment_id": "98b29bfc", "concept_title": "Noise-Stable Prime Spectrum in Definable Quantum Walks", "concept_domain": "Shared", "research_mode": "team", "quality": "partial", "quality_score": 0.44809189021044976, "catalog_references": [], "prompt_length": 8181, "files_placed": 0, "status": "discard"}
{"timestamp": 1781475090.3200495, "experiment_id": "1ef7d13b", "concept_title": "Close Proofs: Spectral Gap Rigidity for Hypergraph Hodge Laplacians Under Simplicial", "concept_domain": "MachineLearning", "research_mode": "team", "quality": "partial", "quality_score": 0.3632293438348146, "catalog_references": [], "prompt_length": 6143, "files_placed": 0, "status": "discard"}
{"timestamp": 1781475130.4229794, "experiment_id": "646379f1", "concept_title": "Algorithmic Randomness Phase Transition in Lean-Definable Cellular Automata", "concept_domain": "Cryptography", "research_mode": "team", "quality": "partial", "quality_score": 0.4289803986710964, "catalog_references": [], "prompt_length": 7693, "files_placed": 0, "status": "discard"}
{"timestamp": 1781477155.784146, "experiment_id": "91967634", "concept_title": "Close Proofs: The catalog's Carmichael work (`Catalog/Speculative/AutoResearch/Carmi", "concept_domain": "NumberTheory", "research_mode": "team", "quality": "partial", "quality_score": 0.42396336206896557, "catalog_references": [], "prompt_length": 6154, "files_placed": 0, "status": "discard"}
{"timestamp": 1781477176.144135, "experiment_id": "2ca3f901", "concept_title": "Bridge IX (`InterleavingGeodesic.lean`) turned the persistence-stability metric", "concept_domain": "Novelty", "research_mode": "team", "quality": "partial", "quality_score": 0.5287685714285715, "catalog_references": [], "prompt_length": 23719, "files_placed": 7, "status": "keep"}
{"timestamp": 1781477193.0021768, "experiment_id": "70f20089", "concept_title": "Close Proofs: The catalog's synthetic-HoTT layer (`Catalog/Logic/HoTT/Foundations.le", "concept_domain": "MachineLearning", "research_mode": "team", "quality": "substantial", "quality_score": 0.74211, "catalog_references": [], "prompt_length": 17663, "files_placed": 5, "status": "keep"}
{"timestamp": 1781477232.482391, "experiment_id": "797d0a4a", "concept_title": "Close Proofs: Noise-Stable Prime Spectrum in Definable Quantum Walks", "concept_domain": "Bridges", "research_mode": "team", "quality": "partial", "quality_score": 0.5806184615384615, "catalog_references": [], "prompt_length": 6141, "files_placed": 0, "status": "keep"}
{"timestamp": 1781477258.6225443, "experiment_id": "65303b4b", "concept_title": "Close Proofs: This cycle closed the conceptual loop opened by the spectral-depth-thr", "concept_domain": "Bridges", "research_mode": "team", "quality": "partial", "quality_score": 0.57708, "catalog_references": [], "prompt_length": 6250, "files_placed": 0, "status": "keep"}
{"timestamp": 1781479287.3875618, "experiment_id": "33bcee64", "concept_title": "Close Proofs: `Catalog/Applications/BoltzmannBridge/InterleavingFunctor.lean` (Bridg", "concept_domain": "Bridges", "research_mode": "team", "quality": "partial", "quality_score": 0.4553457142857143, "catalog_references": [], "prompt_length": 6240, "files_placed": 0, "status": "discard"}
{"timestamp": 1781479319.2511096, "experiment_id": "d787aa34", "concept_title": "Arithmetic Monodromy Rigidity in Definable Neural ODE Flows", "concept_domain": "Computation", "research_mode": "team", "quality": "partial", "quality_score": 0.38878735254059715, "catalog_references": [], "prompt_length": 7571, "files_placed": 0, "status": "discard"}
{"timestamp": 1781479335.6563482, "experiment_id": "13a80f4d", "concept_title": "Bridge IX (`InterleavingGeodesic.lean`) gave the persistence-stability arc its f", "concept_domain": "Geometry", "research_mode": "team", "quality": "partial", "quality_score": 0.6571556692913385, "catalog_references": [], "prompt_length": 25224, "files_placed": 7, "status": "keep"}
{"timestamp": 1781479359.7863529, "experiment_id": "44a857c6", "concept_title": "Close Proofs: The `SmoothPoincare` family in `Catalog/Applications/SmoothPoincare/` ", "concept_domain": "Novelty", "research_mode": "team", "quality": "partial", "quality_score": 0.39197488552751597, "catalog_references": [], "prompt_length": 6226, "files_placed": 0, "status": "discard"}
{"timestamp": 1781479380.8522117, "experiment_id": "fda530b6", "concept_title": "Close Proofs: This cycle attacked the conjecture of a *sharp proof-complexity phase ", "concept_domain": "Novelty", "research_mode": "team", "quality": "partial", "quality_score": 0.39268079867656686, "catalog_references": [], "prompt_length": 6123, "files_placed": 0, "status": "discard"}
{"timestamp": 1781479400.5094745, "experiment_id": "2d177d42", "concept_title": "Close Proofs: Bridge IX (`InterleavingGeodesic.lean`) turned the persistence-stabili", "concept_domain": "Novelty", "research_mode": "team", "quality": "partial", "quality_score": 0.40968710470035796, "catalog_references": [], "prompt_length": 6181, "files_placed": 0, "status": "discard"}
{"timestamp": 1781479422.5483859, "experiment_id": "21cd4ba3", "concept_title": "Close Proofs: This cycle pushed the *representation/duality* program of the syntheti", "concept_domain": "Applications", "research_mode": "team", "quality": "partial", "quality_score": 0.48283591836734696, "catalog_references": [], "prompt_length": 6228, "files_placed": 0, "status": "discard"}
{"timestamp": 1781481406.3131301, "experiment_id": "6285d255", "concept_title": "Linear-algebraic skeleton of the conjecture *Spectral Gap", "concept_domain": "Geometry", "research_mode": "team", "quality": "partial", "quality_score": 0.3917361274509804, "catalog_references": [], "prompt_length": 18588, "files_placed": 0, "status": "discard"}
