{"timestamp": 1780988717.5512888, "experiment_id": "e8726f6c", "concept_title": "Tropical Compactification of Moduli Spaces", "concept_domain": "Applications", "research_mode": "team", "quality": "partial", "quality_score": 0.3937062013453254, "catalog_references": [], "prompt_length": 7245, "files_placed": 0, "status": "discard"}
{"timestamp": 1780988751.1848102, "experiment_id": "48fca5d7", "concept_title": "Symplectic Mirror Descent: Gromov-Witten Invariants as a Count of Learnable Mini", "concept_domain": "Tropical", "research_mode": "team", "quality": "partial", "quality_score": 0.42585185185185187, "catalog_references": [], "prompt_length": 9058, "files_placed": 0, "status": "discard"}
{"timestamp": 1780988783.5904999, "experiment_id": "2e12503d", "concept_title": "Proof Phase Transitions: Sharp Thresholds in Automated Theorem Discovery", "concept_domain": "Tropical", "research_mode": "team", "quality": "partial", "quality_score": 0.39587041036717063, "catalog_references": [], "prompt_length": 6776, "files_placed": 0, "status": "discard"}
{"timestamp": 1780990708.1221573, "experiment_id": "7a5bfcae", "concept_title": "Yamabe Problem: Non-Compact Case", "concept_domain": "Algebra", "research_mode": "team", "quality": "partial", "quality_score": 0.42776249811358724, "catalog_references": [], "prompt_length": 7058, "files_placed": 0, "status": "discard"}
{"timestamp": 1780990740.788642, "experiment_id": "8c360873", "concept_title": "Inverse Stereographic Renormalization Group", "concept_domain": "Novelty", "research_mode": "team", "quality": "partial", "quality_score": 0.393690137460348, "catalog_references": [], "prompt_length": 5411, "files_placed": 0, "status": "discard"}
{"timestamp": 1780990779.5388331, "experiment_id": "39a00894", "concept_title": "Tropical Differential Equations: Power Series Solutions", "concept_domain": "Tropical", "research_mode": "team", "quality": "partial", "quality_score": 0.42582371899515914, "catalog_references": [], "prompt_length": 4767, "files_placed": 0, "status": "discard"}
{"timestamp": 1780990811.0761352, "experiment_id": "aecfaf36", "concept_title": "Speculative: Computational Complexity as Physical Law", "concept_domain": "Cryptography", "research_mode": "team", "quality": "partial", "quality_score": 0.4264367989976565, "catalog_references": [], "prompt_length": 4885, "files_placed": 0, "status": "discard"}
{"timestamp": 1780990842.644975, "experiment_id": "9ff1d7e2", "concept_title": "Fractal Topology: Hausdorff Dimension as a Topological Invariant", "concept_domain": "Novelty", "research_mode": "team", "quality": "partial", "quality_score": 0.42612431265106226, "catalog_references": [], "prompt_length": 6940, "files_placed": 0, "status": "discard"}
{"timestamp": 1780990901.6057434, "experiment_id": "4af997a7", "concept_title": "Zombies and Qualia: Mathematics of Subjective Experience", "concept_domain": "Novelty", "research_mode": "team", "quality": "partial", "quality_score": 0.42613257964432616, "catalog_references": [], "prompt_length": 4726, "files_placed": 0, "status": "discard"}
{"timestamp": 1780992958.579042, "experiment_id": "1c021f3c", "concept_title": "Fractal Number Theory: Hausdorff Dimension of Prime Distributions", "concept_domain": "Algebra", "research_mode": "team", "quality": "partial", "quality_score": 0.3930623418009887, "catalog_references": [], "prompt_length": 7797, "files_placed": 0, "status": "discard"}
{"timestamp": 1780992991.463661, "experiment_id": "e2c302ef", "concept_title": "Reversible Computing and Thermodynamic Efficiency", "concept_domain": "Novelty", "research_mode": "team", "quality": "partial", "quality_score": 0.39319912, "catalog_references": [], "prompt_length": 4521, "files_placed": 0, "status": "discard"}
{"timestamp": 1780993023.017582, "experiment_id": "a7f5b47e", "concept_title": "Dream Logic: Non-Monotone Reasoning Where Contradictions Coexist", "concept_domain": "Applications", "research_mode": "team", "quality": "partial", "quality_score": 0.3945414814814816, "catalog_references": [], "prompt_length": 4638, "files_placed": 0, "status": "discard"}
{"timestamp": 1780994950.0030181, "experiment_id": "f2700283", "concept_title": "Formalized framework connecting Collatz dynami", "concept_domain": "Applications", "research_mode": "team", "quality": "partial", "quality_score": 0.4255642943856718, "catalog_references": [], "prompt_length": 24862, "files_placed": 0, "status": "discard"}
{"timestamp": 1780994987.4869635, "experiment_id": "67d7e25f", "concept_title": "Code-Based Cryptography: McEliece from Goppa Codes", "concept_domain": "Applications", "research_mode": "team", "quality": "partial", "quality_score": 0.4258081468929546, "catalog_references": [], "prompt_length": 4610, "files_placed": 0, "status": "discard"}
{"timestamp": 1780995021.1002243, "experiment_id": "5c7661a0", "concept_title": "Tropical Hodge Theory", "concept_domain": "Applications", "research_mode": "team", "quality": "partial", "quality_score": 0.4266283327862276, "catalog_references": [], "prompt_length": 4714, "files_placed": 0, "status": "discard"}
{"timestamp": 1780995054.5521069, "experiment_id": "7e292267", "concept_title": "The Geometry of Consensus: Arrow's Theorem as Curvature", "concept_domain": "Applications", "research_mode": "team", "quality": "partial", "quality_score": 0.42486085725877215, "catalog_references": [], "prompt_length": 7849, "files_placed": 0, "status": "discard"}
{"timestamp": 1780995081.5594387, "experiment_id": "55bdd69f", "concept_title": "The current `zaslavsky_type_bound` proves \u2211_{k\u2264d} C(n,k) \u2264 (n+1)^d, but the", "concept_domain": "Algebra", "research_mode": "team", "quality": "partial", "quality_score": 0.36429437889326377, "catalog_references": [], "prompt_length": 21293, "files_placed": 1, "status": "discard"}
{"timestamp": 1780995212.3751104, "experiment_id": "51f15183", "concept_title": "Close Proofs: Fractal Topology: Hausdorff Dimension as a Topological Invariant", "concept_domain": "Applications", "research_mode": "team", "quality": "partial", "quality_score": 0.4272544815928248, "catalog_references": [], "prompt_length": 4852, "files_placed": 0, "status": "discard"}
{"timestamp": 1780995341.4030523, "experiment_id": "a26dcdd2", "concept_title": "Close Proofs: Zombies and Qualia: Mathematics of Subjective Experience", "concept_domain": "Novelty", "research_mode": "team", "quality": "partial", "quality_score": 0.4275834107665937, "catalog_references": [], "prompt_length": 7516, "files_placed": 0, "status": "discard"}
{"timestamp": 1780997380.196799, "experiment_id": "2c51cdc5", "concept_title": "Large Cardinal Hierarchy: Consistency Strength", "concept_domain": "Algebra", "research_mode": "team", "quality": "partial", "quality_score": 0.4244243849268141, "catalog_references": [], "prompt_length": 4304, "files_placed": 0, "status": "discard"}
{"timestamp": 1780997414.839013, "experiment_id": "28a68a13", "concept_title": "**Causal Integration Algebra** \u2014 a rigorous lattice-t", "concept_domain": "Novelty", "research_mode": "team", "quality": "partial", "quality_score": 0.4179381992755582, "catalog_references": [], "prompt_length": 23395, "files_placed": 0, "status": "discard"}
{"timestamp": 1780997452.080527, "experiment_id": "abf65010", "concept_title": "Hadamard Matrix Conjecture", "concept_domain": "Novelty", "research_mode": "team", "quality": "partial", "quality_score": 0.42157900261428133, "catalog_references": [], "prompt_length": 4540, "files_placed": 0, "status": "discard"}
{"timestamp": 1780999353.992186, "experiment_id": "72ac5da9", "concept_title": "Close Proofs: The current framework models theories by their set of provably well-or", "concept_domain": "Novelty", "research_mode": "team", "quality": "partial", "quality_score": 0.3472400950599644, "catalog_references": [], "prompt_length": 4855, "files_placed": 0, "status": "discard"}
{"timestamp": 1780999395.6518362, "experiment_id": "561a5f44", "concept_title": "Close Proofs: Code-Based Cryptography: McEliece from Goppa Codes", "concept_domain": "Novelty", "research_mode": "team", "quality": "partial", "quality_score": 0.36516384224609305, "catalog_references": [], "prompt_length": 4838, "files_placed": 0, "status": "discard"}
{"timestamp": 1780999438.6680052, "experiment_id": "bfed4ff5", "concept_title": "Tropical Differential Equations: Power Series Solutions", "concept_domain": "Novelty", "research_mode": "team", "quality": "partial", "quality_score": 0.4250386033519553, "catalog_references": [], "prompt_length": 7447, "files_placed": 0, "status": "discard"}
{"timestamp": 1780999473.709239, "experiment_id": "41fd7380", "concept_title": "Phantom Topologies: Spaces That Change When You Look at Them", "concept_domain": "Applications", "research_mode": "team", "quality": "partial", "quality_score": 0.42387027209576894, "catalog_references": [], "prompt_length": 7078, "files_placed": 0, "status": "discard"}
{"timestamp": 1781001411.674995, "experiment_id": "71ed406c", "concept_title": "Close Proofs: Close Proofs: Zombies and Qualia: Mathematics of Subjective Experience", "concept_domain": "Applications", "research_mode": "team", "quality": "partial", "quality_score": 0.3656988815675395, "catalog_references": [], "prompt_length": 4860, "files_placed": 0, "status": "discard"}
{"timestamp": 1781001519.6852415, "experiment_id": "0f684a27", "concept_title": "Kakeya Conjecture", "concept_domain": "Applications", "research_mode": "team", "quality": "partial", "quality_score": 0.4275389540180618, "catalog_references": [], "prompt_length": 4325, "files_placed": 0, "status": "discard"}
{"timestamp": 1781001612.9705343, "experiment_id": "dddb23fb", "concept_title": "Close Proofs: **Causal Integration Algebra** \u2014 a rigorous lattice-t", "concept_domain": "Novelty", "research_mode": "team", "quality": "partial", "quality_score": 0.36642262577454754, "catalog_references": [], "prompt_length": 7511, "files_placed": 0, "status": "discard"}
{"timestamp": 1781001715.0615203, "experiment_id": "5bffe06d", "concept_title": "Close Proofs: Hadamard Matrix Conjecture", "concept_domain": "Novelty", "research_mode": "team", "quality": "partial", "quality_score": 0.39557861769016217, "catalog_references": [], "prompt_length": 4802, "files_placed": 0, "status": "discard"}
{"timestamp": 1781001842.6553538, "experiment_id": "ac6121a8", "concept_title": "One-Way Functions: Existence and Hierarchy", "concept_domain": "Novelty", "research_mode": "team", "quality": "partial", "quality_score": 0.424928296449977, "catalog_references": [], "prompt_length": 4376, "files_placed": 0, "status": "discard"}
{"timestamp": 1781001947.6218383, "experiment_id": "d264e828", "concept_title": "Certified Novelty Detection for Theorem Provers", "concept_domain": "Applications", "research_mode": "team", "quality": "partial", "quality_score": 0.33277683912990047, "catalog_references": [], "prompt_length": 4445, "files_placed": 0, "status": "discard"}
{"timestamp": 1781005027.1516926, "experiment_id": "f9c3366c", "concept_title": "Close Proofs: This document describes five research conjectures extending the", "concept_domain": "Applications", "research_mode": "team", "quality": "partial", "quality_score": 0.38632137600826466, "catalog_references": [], "prompt_length": 4860, "files_placed": 0, "status": "discard"}
{"timestamp": 1781005090.7884336, "experiment_id": "743db091", "concept_title": "**Conjecture:** If `{f_t}_{t \u2208 [0,1]}` is a continuous family of contracting cau", "concept_domain": "Geometry", "research_mode": "team", "quality": "partial", "quality_score": 0.4240429527390678, "catalog_references": [], "prompt_length": 14206, "files_placed": 0, "status": "discard"}
{"timestamp": 1781005152.0211859, "experiment_id": "cb6d03de", "concept_title": "Tropical Amoebas and Ronkin Functions", "concept_domain": "Applications", "research_mode": "team", "quality": "partial", "quality_score": 0.4228838627888345, "catalog_references": [], "prompt_length": 4581, "files_placed": 0, "status": "discard"}
{"timestamp": 1781005202.2711763, "experiment_id": "33ad3e94", "concept_title": "Close Proofs: Speculative: Computational Complexity as Physical Law", "concept_domain": "Cryptography", "research_mode": "team", "quality": "partial", "quality_score": 0.4226742591387145, "catalog_references": [], "prompt_length": 4851, "files_placed": 0, "status": "discard"}
{"timestamp": 1781005325.9281223, "experiment_id": "0e08543f", "concept_title": "The EBC framework formalizes the connection between computational complexity and", "concept_domain": "Novelty", "research_mode": "team", "quality": "partial", "quality_score": 0.4216348535162887, "catalog_references": [], "prompt_length": 18756, "files_placed": 0, "status": "discard"}
{"timestamp": 1781005462.4227185, "experiment_id": "085a52a3", "concept_title": "Close Proofs: Formalized framework connecting Collatz dynami", "concept_domain": "Logic", "research_mode": "team", "quality": "partial", "quality_score": 0.42268532616338267, "catalog_references": [], "prompt_length": 4831, "files_placed": 0, "status": "discard"}
{"timestamp": 1781007015.3854864, "experiment_id": "49409cbc", "concept_title": "Tropical Brill-Noether Theory", "concept_domain": "Tropical", "research_mode": "team", "quality": "partial", "quality_score": 0.42269246691378237, "catalog_references": [], "prompt_length": 4435, "files_placed": 0, "status": "discard"}
{"timestamp": 1781007023.1987298, "experiment_id": "c74c695b", "concept_title": "Tropical Convexity: Helly, Caratheodory, and Radon", "concept_domain": "Tropical", "research_mode": "team", "quality": "partial", "quality_score": 0.4226921796391852, "catalog_references": [], "prompt_length": 4862, "files_placed": 0, "status": "discard"}
{"timestamp": 1781007132.3457983, "experiment_id": "2bc7ced0", "concept_title": "Quantum Gravity as Topological Quantum Field Theory", "concept_domain": "Pythagorean", "research_mode": "team", "quality": "partial", "quality_score": 0.42464068426836493, "catalog_references": [], "prompt_length": 5133, "files_placed": 0, "status": "discard"}
{"timestamp": 1781007370.100799, "experiment_id": "270a35e6", "concept_title": "Goldbach Conjecture", "concept_domain": "Algebra", "research_mode": "team", "quality": "partial", "quality_score": 0.4171988204113629, "catalog_references": [], "prompt_length": 15689, "files_placed": 17, "status": "discard"}
{"timestamp": 1781007591.0210938, "experiment_id": "8c5634d8", "concept_title": "Neural Tangent Kernel: Convergence of Gradient Descent", "concept_domain": "MachineLearning", "research_mode": "team", "quality": "partial", "quality_score": 0.4114152881559993, "catalog_references": [], "prompt_length": 15701, "files_placed": 39, "status": "discard"}
{"timestamp": 1781009552.3608594, "experiment_id": "7d85fa5d", "concept_title": "Close Proofs: One-Way Functions: Existence and Hierarchy", "concept_domain": "Tropical", "research_mode": "team", "quality": "partial", "quality_score": 0.421351122090187, "catalog_references": [], "prompt_length": 4774, "files_placed": 0, "status": "discard"}
{"timestamp": 1781009735.1958108, "experiment_id": "66574b97", "concept_title": "Hodge Conjecture", "concept_domain": "Algebra", "research_mode": "team", "quality": "partial", "quality_score": 0.39165216880612425, "catalog_references": [], "prompt_length": 4528, "files_placed": 0, "status": "discard"}
{"timestamp": 1781009975.9142337, "experiment_id": "605ab808", "concept_title": "The current formalization handles 0-dimensional persistence on discrete state sp", "concept_domain": "Physics", "research_mode": "team", "quality": "partial", "quality_score": 0.4241263696049941, "catalog_references": [], "prompt_length": 13046, "files_placed": 0, "status": "discard"}
{"timestamp": 1781010074.1976924, "experiment_id": "71663589", "concept_title": "Algorithmic Fairness: Individual vs Group Fairness Impossibility", "concept_domain": "Logic", "research_mode": "team", "quality": "partial", "quality_score": 0.3910579591836735, "catalog_references": [], "prompt_length": 5094, "files_placed": 0, "status": "discard"}
{"timestamp": 1781010216.8102314, "experiment_id": "e9b0acff", "concept_title": "Formally verified framework connecting spectra", "concept_domain": "Computation", "research_mode": "team", "quality": "partial", "quality_score": 0.3910110334832533, "catalog_references": [], "prompt_length": 21954, "files_placed": 0, "status": "discard"}
{"timestamp": 1781010268.1826563, "experiment_id": "e71824de", "concept_title": "**Causal Integration Algebra** \u2014 a rigorous Lean 4 fo", "concept_domain": "Computation", "research_mode": "team", "quality": "partial", "quality_score": 0.4207490825688074, "catalog_references": [], "prompt_length": 17791, "files_placed": 0, "status": "discard"}
{"timestamp": 1781010497.0559475, "experiment_id": "fd4292ca", "concept_title": "Grokking: Phase Transitions in Learning", "concept_domain": "Tropical", "research_mode": "team", "quality": "partial", "quality_score": 0.4102239448333218, "catalog_references": [], "prompt_length": 15539, "files_placed": 11, "status": "discard"}
{"timestamp": 1781010805.0020177, "experiment_id": "2443240b", "concept_title": "Close Proofs: Tropical Brill-Noether Theory", "concept_domain": "Computation", "research_mode": "team", "quality": "partial", "quality_score": 0.42305126146788996, "catalog_references": [], "prompt_length": 4810, "files_placed": 0, "status": "discard"}
{"timestamp": 1781014957.3436823, "experiment_id": "8d763884", "concept_title": "The spectral form factor K(\u03c4) = |\u2211_p exp(2\u03c0i\u03c4p)|\u00b2 / N\u00b2, summed over primes p \u2264 N", "concept_domain": "Applications", "research_mode": "team", "quality": "partial", "quality_score": 0.392177358490566, "catalog_references": [], "prompt_length": 20912, "files_placed": 0, "status": "discard"}
{"timestamp": 1781017404.5930102, "experiment_id": "ca042a62", "concept_title": "The geodesic equations for the split metric ds\u00b2 = sech\u00b2(y) dx\u00b2 + cosh\u00b2(x) dy\u00b2 yi", "concept_domain": "Geometry", "research_mode": "team", "quality": "partial", "quality_score": 0.36487075405214936, "catalog_references": [], "prompt_length": 19831, "files_placed": 0, "status": "discard"}
{"timestamp": 1781017433.7920196, "experiment_id": "e0ad2634", "concept_title": "Proof Complexity Collapse: P=NP via Proof Checking", "concept_domain": "Logic", "research_mode": "team", "quality": "partial", "quality_score": 0.3659193317335953, "catalog_references": [], "prompt_length": 16671, "files_placed": 2, "status": "discard"}
{"timestamp": 1781017470.444435, "experiment_id": "3d5b4b8d", "concept_title": "Certified Novelty Detection for Theorem Provers", "concept_domain": "Geometry", "research_mode": "team", "quality": "partial", "quality_score": 0.42148108142209806, "catalog_references": [], "prompt_length": 4713, "files_placed": 0, "status": "discard"}
{"timestamp": 1781019911.3929935, "experiment_id": "b0a2670f", "concept_title": "Proof-Theoretic Bridge: Ordinal Analysis Across Systems", "concept_domain": "Physics", "research_mode": "team", "quality": "partial", "quality_score": 0.4058645080594055, "catalog_references": [], "prompt_length": 4819, "files_placed": 0, "status": "discard"}
{"timestamp": 1781020022.756617, "experiment_id": "ad2be92e", "concept_title": "Tropical Compactification of Moduli Spaces", "concept_domain": "Novelty", "research_mode": "team", "quality": "partial", "quality_score": 0.3627455631900639, "catalog_references": [], "prompt_length": 15640, "files_placed": 12, "status": "discard"}
{"timestamp": 1781020151.4684055, "experiment_id": "a3f50a78", "concept_title": "Logic-Physics Bridge: Consistency of Physical Theories", "concept_domain": "Novelty", "research_mode": "team", "quality": "partial", "quality_score": 0.3852481001709541, "catalog_references": [], "prompt_length": 15650, "files_placed": 11, "status": "discard"}
{"timestamp": 1781020265.760695, "experiment_id": "09bd4da6", "concept_title": "Rigorous formal foundations for the Collatz conj", "concept_domain": "Computation", "research_mode": "team", "quality": "partial", "quality_score": 0.37138729946524063, "catalog_references": [], "prompt_length": 26018, "files_placed": 12, "status": "discard"}
{"timestamp": 1781022355.9104433, "experiment_id": "e6863bcc", "concept_title": "Every finite topological space has a finite lattice of open sets. The phantom", "concept_domain": "Pythagorean", "research_mode": "team", "quality": "partial", "quality_score": 0.39152943849647304, "catalog_references": [], "prompt_length": 15045, "files_placed": 0, "status": "discard"}
{"timestamp": 1781022386.9364522, "experiment_id": "19bead16", "concept_title": "Close Proofs: P vs NP Problem", "concept_domain": "Shared", "research_mode": "team", "quality": "partial", "quality_score": 0.3913334437269586, "catalog_references": [], "prompt_length": 9769, "files_placed": 0, "status": "discard"}
{"timestamp": 1781022417.3831596, "experiment_id": "4ce84d5f", "concept_title": "Idempotent Probability: Large Deviations", "concept_domain": "Tropical", "research_mode": "team", "quality": "partial", "quality_score": 0.42241428571428574, "catalog_references": [], "prompt_length": 4686, "files_placed": 0, "status": "discard"}
{"timestamp": 1781022448.2575016, "experiment_id": "5385bc70", "concept_title": "The spectral form factor K(\u03c4) = |\u2211_p exp(2\u03c0i\u03c4p)|\u00b2 / N\u00b2, summed over primes p \u2264 N", "concept_domain": "Shared", "research_mode": "team", "quality": "partial", "quality_score": 0.420240206185567, "catalog_references": [], "prompt_length": 20900, "files_placed": 0, "status": "discard"}
