{"timestamp": 1782473651.062121, "experiment_id": "3847ce48", "concept_title": "Maximum rank of self\u2011dual string C\u2011groups for alternating groups $A_{4m+3}$", "concept_domain": "MachineLearning", "research_mode": "formalize", "quality": "substantial", "quality_score": 0.75084, "catalog_references": ["Catalog/GroupTheory/Alternating/Basic.lean", "Catalog/GroupTheory/Permutation/Basic.lean", "Catalog/GroupTheory/Alternating/VertexGluing.lean", "Catalog/Algebra/Group/Automorphism.lean"], "prompt_length": 20901, "files_placed": 6, "status": "keep"}
{"timestamp": 1782473942.4990144, "experiment_id": "0e9a5064", "concept_title": "Lean-formalizable Sun truncated Legendre-symbol determinant", "concept_domain": "NumberTheory", "research_mode": "team", "quality": "substantial", "quality_score": 0.7836800000000002, "catalog_references": ["Mathlib.NumberTheory.LegendreSymbol", "Mathlib.LinearAlgebra.Matrix.Determinant", "Mathlib.Data.Polynomial.Basic", "Mathlib.Data.Matrix.Basic"], "prompt_length": 20862, "files_placed": 8, "status": "keep"}
{"timestamp": 1782475845.7777526, "experiment_id": "c72330ea", "concept_title": "Euler-Mascheroni Constant: Irrationality Approaches", "concept_domain": "Tropical", "research_mode": "prove", "quality": "partial", "quality_score": 0.5940000000000001, "catalog_references": [], "prompt_length": 20732, "files_placed": 8, "status": "keep"}
{"timestamp": 1782477576.4088585, "experiment_id": "f2499c75", "concept_title": "Idempotent Probability: Large Deviations", "concept_domain": "Tropical", "research_mode": "team", "quality": "partial", "quality_score": 0.68192, "catalog_references": [], "prompt_length": 22786, "files_placed": 7, "status": "keep"}
{"timestamp": 1782477903.4671957, "experiment_id": "72d240c8", "concept_title": "HH0 of a finite group algebra is the free module on conjugacy classes", "concept_domain": "Novelty", "research_mode": "team", "quality": "substantial", "quality_score": 0.7694400000000001, "catalog_references": ["Mathlib.Algebra.MonoidAlgebra.Basic", "Mathlib.GroupTheory.GroupAction.ConjAct", "Mathlib.LinearAlgebra.Finsupp", "Mathlib.LinearAlgebra.Quotient", "Mathlib.RingTheory.TensorProduct"], "prompt_length": 20958, "files_placed": 6, "status": "keep"}
{"timestamp": 1782479607.8635166, "experiment_id": "d4e980c4", "concept_title": "RSA Factorization with Partial p+q Knowledge and Small Private Exponent", "concept_domain": "Cryptography", "research_mode": "team", "quality": "substantial", "quality_score": 0.713, "catalog_references": ["Wiener's 1990 attack", "Continued fractions in cryptanalysis"], "prompt_length": 20757, "files_placed": 7, "status": "keep"}
{"timestamp": 1782479684.6492558, "experiment_id": "f014f8e3", "concept_title": "Asymptotic Tightness of the Alon\u2013Frankl\u2013Lov\u00e1sz Matching Bound for Random\u2011Like Hypergraphs", "concept_domain": "Novelty", "research_mode": "team", "quality": "substantial", "quality_score": 0.7510892307692308, "catalog_references": ["AFL theorem (Alon\u2013Frankl\u2013Lov\u00e1sz, 1986)", "Pseudorandom hypergraph regularity (Gowers, R\u00f6dl\u2011Schacht)", "LP\u2011based reduction to strip colourings (paper\u2019s main theorem)"], "prompt_length": 21153, "files_placed": 8, "status": "keep"}
{"timestamp": 1782479766.5636456, "experiment_id": "cb117fe9", "concept_title": "Discriminant of the Hermitian Bianchi lattice S_K", "concept_domain": "Applications", "research_mode": "team", "quality": "partial", "quality_score": 0.531112, "catalog_references": ["Paper: definition of S_K = Herm_2(O_K) with quadratic form 2 det", "Paper: use of S_K(2N) as the Neron-Severi lattice of Picard-rank-four K3 surfaces", "mathlib: Matrix.det", "mathlib: QuadraticForm", "mathlib: NumberTheory.NumberField"], "prompt_length": 21043, "files_placed": 7, "status": "keep"}
{"timestamp": 1782479986.5889525, "experiment_id": "a7c4b074", "concept_title": "No non\u2011trivial extensions of maximal symplectic groups on the superspecial K3 surface", "concept_domain": "Novelty", "research_mode": "team", "quality": "partial", "quality_score": 0.6968799999999999, "catalog_references": ["ohashi2024finite", "ohashi2024finitegroupssymplecticautomorphisms", "Mukai1988", "Brandhorst_Hofmann_2023", "DolgachevKeum2009"], "prompt_length": 23024, "files_placed": 8, "status": "keep"}
{"timestamp": 1782482347.8716705, "experiment_id": "ab42f98e", "concept_title": "Cryptography from the Collatz Conjecture: One-Way Functions from Iterated Maps", "concept_domain": "NumberTheory", "research_mode": "formalize", "quality": "substantial", "quality_score": 0.70551, "catalog_references": ["Cryptography.MerkleDamgard.lean", "Cryptography.CollatzHash.lean"], "prompt_length": 16106, "files_placed": 6, "status": "keep"}
{"timestamp": 1782484128.8879828, "experiment_id": "9c488c94", "concept_title": "Representation Theory: Character Tables of S_n", "concept_domain": "Cryptography", "research_mode": "formalize", "quality": "partial", "quality_score": 0.6903199999999999, "catalog_references": ["Catalog/Combinatorics/PartitionConjClasses.lean", "Catalog/Algebra/Equiv/Perm.lean", "Catalog/Combinatorics/PartitionTheory.lean", "Catalog/Algebra/GroupTheory/ConjugacyClasses.lean"], "prompt_length": 21342, "files_placed": 6, "status": "keep"}
{"timestamp": 1782484218.1131916, "experiment_id": "7281fa18", "concept_title": "Row-exchange under eventual contraction for the infinite asymmetric five-vertex half-strip", "concept_domain": "Novelty", "research_mode": "team", "quality": "partial", "quality_score": 0.5050399999999999, "catalog_references": ["Mathlib.Analysis.SpecificLimits.Basic", "Mathlib.Topology.Algebra.InfiniteSum.Basic", "Mathlib.Data.Matrix.Basic", "Mathlib.Data.Matrix.Notation", "Mathlib.Analysis.Normed.Field.Basic"], "prompt_length": 23125, "files_placed": 6, "status": "keep"}
{"timestamp": 1782484339.6453214, "experiment_id": "a2f737c1", "concept_title": "Realization of all even incoherence indices \u22654 by maximal standard frames", "concept_domain": "Applications", "research_mode": "team", "quality": "partial", "quality_score": 0.4444762417582418, "catalog_references": ["MossPedersen2026", "Conjecture 5.7", "Conjecture B.25"], "prompt_length": 23012, "files_placed": 7, "status": "discard"}
{"timestamp": 1782485599.2962155, "experiment_id": "abbbde7c", "concept_title": "Navier-Stokes: 2D Regularity and Partial 3D Results", "concept_domain": "Applications", "research_mode": "prove", "quality": "partial", "quality_score": 0.58216, "catalog_references": [], "prompt_length": 20746, "files_placed": 9, "status": "keep"}
{"timestamp": 1782485766.419905, "experiment_id": "113a596f", "concept_title": "EML Differential Equations: ODEs with Exponential-Logarithmic Coefficients", "concept_domain": "Novelty", "research_mode": "team", "quality": "partial", "quality_score": 0.67667, "catalog_references": [], "prompt_length": 22946, "files_placed": 7, "status": "keep"}
{"timestamp": 1782485893.5392754, "experiment_id": "bc0a8e2b", "concept_title": "Existence of Non-Trivial Boolean Degree One Functions on J_q(n,2) for q \u2265 3 and n \u2265 4", "concept_domain": "Applications", "research_mode": "team", "quality": "partial", "quality_score": 0.5310828235294118, "catalog_references": ["Bruen and Drudge 1999", "Filmus and Ihringer 2019", "Gavrilyuk and Mogilnykh 2014"], "prompt_length": 20306, "files_placed": 7, "status": "keep"}
{"timestamp": 1782490335.4708607, "experiment_id": "1ce6e294", "concept_title": "Deepening: Alien Number Systems: Beyond Base-N", "concept_domain": "Applications", "research_mode": "team", "quality": "partial", "quality_score": 0.571318, "catalog_references": [], "prompt_length": 20979, "files_placed": 6, "status": "keep"}
{"timestamp": 1782492058.1161184, "experiment_id": "be72639d", "concept_title": "Exponentialdiameter contraction under Delaunay minicenter refinement", "concept_domain": "Applications", "research_mode": "team", "quality": "substantial", "quality_score": 0.7645600000000001, "catalog_references": ["approximate Carath\u00e9odory theorem", "Maurey's empirical method"], "prompt_length": 20770, "files_placed": 9, "status": "keep"}
{"timestamp": 1782492394.7724462, "experiment_id": "5077231f", "concept_title": "Quantum Mechanics: Spectral Theory of Hydrogen", "concept_domain": "Applications", "research_mode": "prove", "quality": "partial", "quality_score": 0.6837200000000001, "catalog_references": [], "prompt_length": 20719, "files_placed": 8, "status": "keep"}
{"timestamp": 1782494509.6355011, "experiment_id": "aa3d24c5", "concept_title": "Quantum Thermodynamics: Landauer's Principle at the Nanoscale", "concept_domain": "Novelty", "research_mode": "team", "quality": "substantial", "quality_score": 0.70446, "catalog_references": [], "prompt_length": 22931, "files_placed": 7, "status": "keep"}
{"timestamp": 1782494813.214477, "experiment_id": "518f172b", "concept_title": "Natural Proofs Barrier: Formalization", "concept_domain": "Novelty", "research_mode": "team", "quality": "partial", "quality_score": 0.56304, "catalog_references": [], "prompt_length": 20672, "files_placed": 9, "status": "keep"}
{"timestamp": 1782496607.1117384, "experiment_id": "ab90b095", "concept_title": "Join-saturation equality for matchings with isolated vertices", "concept_domain": "Applications", "research_mode": "team", "quality": "partial", "quality_score": 0.62096, "catalog_references": ["Erdos-Hajnal-Moon theorem on clique saturation", "Kaszonnyi-Tuza saturation numbers for tK2", "Cameron-Puleo upper bound sat(n,K1\u2228F) \u2264 n-1+sat(n-1,F)", "This paper: equality for F=K2\u222aqK1 and F=2K2\u222aqK1"], "prompt_length": 22963, "files_placed": 7, "status": "keep"}
{"timestamp": 1782497149.767439, "experiment_id": "3be846c2", "concept_title": "Ramsey Theory: Bounds and Constructions", "concept_domain": "Applications", "research_mode": "prove", "quality": "partial", "quality_score": 0.464016452173913, "catalog_references": [], "prompt_length": 20724, "files_placed": 7, "status": "discard"}
{"timestamp": 1782497635.1521943, "experiment_id": "762ed13d", "concept_title": "Euler-Mascheroni Constant: Irrationality Approaches", "concept_domain": "Novelty", "research_mode": "prove", "quality": "partial", "quality_score": 0.521245, "catalog_references": [], "prompt_length": 20730, "files_placed": 7, "status": "keep"}
{"timestamp": 1782499716.4567652, "experiment_id": "0d192d1b", "concept_title": "Multilateral non-trivial cross-intersection product bound", "concept_domain": "Novelty", "research_mode": "team", "quality": "partial", "quality_score": 0.6544800000000001, "catalog_references": ["Erdos--Ko--Rado theorem for intersecting uniform families", "Hilton--Milner theorem for non-trivial intersecting families", "Pyber product theorem for two cross-intersecting families", "Frankl--Wang non-trivial cross-intersection product conjecture proved in the paper", "Mathlib.Data.Nat.Choose.Basic", "Mathlib.Data.Finset.Basic", "Mathlib.Algebra.BigOperators.Fin"], "prompt_length": 23061, "files_placed": 7, "status": "keep"}
{"timestamp": 1782499964.1163673, "experiment_id": "7496c7ce", "concept_title": "Zero-Knowledge Proofs in Lean: Verifiable Computation", "concept_domain": "Applications", "research_mode": "team", "quality": "substantial", "quality_score": 0.80792, "catalog_references": [], "prompt_length": 20769, "files_placed": 8, "status": "keep"}
{"timestamp": 1782501977.9393408, "experiment_id": "53529d3f", "concept_title": "Degree\u20114 vertices in the flip graph of the m\u00d7n Miura\u2011ori", "concept_domain": "Applications", "research_mode": "team", "quality": "substantial", "quality_score": 0.78512, "catalog_references": ["arXiv:2305.01234", "GineproHull2014counting", "Christensen2025origami", "Cereceda2009mixing"], "prompt_length": 20636, "files_placed": 7, "status": "keep"}
{"timestamp": 1782502105.5258791, "experiment_id": "1a8e3469", "concept_title": "Explicit bias lower bound for the density of n with s_2(n+t) >= s_2(n)", "concept_domain": "Applications", "research_mode": "team", "quality": "partial", "quality_score": 0.5860000000000001, "catalog_references": ["DrmotaKauersSpiegelhofer2016"], "prompt_length": 20660, "files_placed": 6, "status": "keep"}
{"timestamp": 1782503731.6733527, "experiment_id": "580d1f18", "concept_title": "Certified Novelty Detection for Theorem Provers", "concept_domain": "Applications", "research_mode": "team", "quality": "substantial", "quality_score": 0.73672, "catalog_references": [], "prompt_length": 20694, "files_placed": 8, "status": "keep"}
{"timestamp": 1782503818.4404798, "experiment_id": "7b228cc3", "concept_title": "EML Differential Equations: ODEs with Exponential-Logarithmic Coefficients", "concept_domain": "Applications", "research_mode": "team", "quality": "substantial", "quality_score": 0.74264, "catalog_references": [], "prompt_length": 20825, "files_placed": 8, "status": "keep"}
{"timestamp": 1782505490.862873, "experiment_id": "f247824f", "concept_title": "EML Fixed-Point Theorem: exp-log Iteration Convergence", "concept_domain": "Applications", "research_mode": "prove", "quality": "partial", "quality_score": 0.27907841739130435, "catalog_references": ["EML/FixedPointConvergence.lean"], "prompt_length": 19177, "files_placed": 5, "status": "discard"}
{"timestamp": 1782505679.9914203, "experiment_id": "1f3047ef", "concept_title": "Representation Theory: Character Tables of S_n", "concept_domain": "Applications", "research_mode": "prove", "quality": "partial", "quality_score": 0.45104400000000006, "catalog_references": [], "prompt_length": 20712, "files_placed": 7, "status": "discard"}
{"timestamp": 1782506975.2074053, "experiment_id": "bdb5ae9b", "concept_title": "Quadratic irrational density in the ratio spectrum", "concept_domain": "Novelty", "research_mode": "team", "quality": "partial", "quality_score": 0.67947, "catalog_references": ["Lagarias-Shallit bounds for Lagrange constants under integer linear fractional transformations", "Smith normal form over Z for reducing integer matrices", "Lagrange constant formula via two-sided continued fractions", "Lagrange theorem: real quadratic irrationals are exactly eventually periodic continued fractions", "Mathlib modules: Mathlib.Data.Matrix.Basic, Mathlib.NumberTheory.ContinuedFractions, Mathlib.Topology.Algebra.Order.LiminfLimsup"], "prompt_length": 20775, "files_placed": 7, "status": "keep"}
{"timestamp": 1782508173.7417865, "experiment_id": "f36ed9b7", "concept_title": "Tight asymptotic lower bound for the maximum number of strict alternating cycles in posets of fixed width", "concept_domain": "Novelty", "research_mode": "team", "quality": "partial", "quality_score": 0.54535, "catalog_references": ["Tur\u00e1n-type problem", "poset dimension", "alternating cycles", "extremal combinatorics", "Sperner theory"], "prompt_length": 20982, "files_placed": 6, "status": "keep"}
{"timestamp": 1782511863.6455212, "experiment_id": "6452feb1", "concept_title": "EML Kolmogorov-Arnold Representation", "concept_domain": "Applications", "research_mode": "team", "quality": "partial", "quality_score": 0.43033200000000005, "catalog_references": [], "prompt_length": 20957, "files_placed": 9, "status": "discard"}
{"timestamp": 1782512025.0926404, "experiment_id": "6a7e7235", "concept_title": "A 4k+4 order bound for connectivity-preserving Hamiltonian prescribed-end paths", "concept_domain": "Novelty", "research_mode": "team", "quality": "partial", "quality_score": 0.5980399999999999, "catalog_references": ["Hasunuma 2025 connectivity-preserving Hamiltonian cycle theorem", "Main theorem of the submitted paper: n \u2265 6k+6 prescribed Hamiltonian path version", "Dirac-type minimum degree Hamiltonicity", "Menger theorem and vertex-cut characterization of k-connectivity", "Lean/mathlib SimpleGraph finite graph infrastructure"], "prompt_length": 23071, "files_placed": 7, "status": "keep"}
{"timestamp": 1782513652.7687874, "experiment_id": "15963379", "concept_title": "Circuit Complexity: Monotone Lower Bounds", "concept_domain": "Novelty", "research_mode": "prove", "quality": "partial", "quality_score": 0.6772, "catalog_references": [], "prompt_length": 20727, "files_placed": 8, "status": "keep"}
{"timestamp": 1782514067.876447, "experiment_id": "3ffd492f", "concept_title": "Optimality of the Density Threshold for Linear r\u2011Uniform Hypergraphs", "concept_domain": "Novelty", "research_mode": "team", "quality": "partial", "quality_score": 0.3990000000000001, "catalog_references": ["arXiv:2210.12345", "Brown\u2013Erd\u0151s\u2013S\u00f3s conjecture", "Keevash\u2013Long 2023"], "prompt_length": 20632, "files_placed": 6, "status": "discard"}
{"timestamp": 1782514320.6412144, "experiment_id": "5544e8f5", "concept_title": "Lambda Calculus: Church-Rosser and Normalization", "concept_domain": "Applications", "research_mode": "prove", "quality": "partial", "quality_score": 0.5449999999999999, "catalog_references": ["Catalog/Logic/LambdaCalculus/Confluence.lean", "Catalog/Logic/LambdaCalculus/Par.lean", "Catalog/Logic/LambdaCalculus/Syntax.lean"], "prompt_length": 20712, "files_placed": 9, "status": "keep"}
{"timestamp": 1782517049.7968893, "experiment_id": "913e3580", "concept_title": "Plethystic Triviality of the Shifted t-Schur Basis", "concept_domain": "Applications", "research_mode": "prove", "quality": "substantial", "quality_score": 0.7981560000000001, "catalog_references": ["Catalog/Applications/ShiftedTSchur/PlethysticTriviality.lean"], "prompt_length": 21178, "files_placed": 6, "status": "keep"}
{"timestamp": 1782517152.8348303, "experiment_id": "0171d9bf", "concept_title": "Maximum size of pairwise orthogonal Italian squares is n\u20111 for prime powers", "concept_domain": "Applications", "research_mode": "team", "quality": "partial", "quality_score": 0.67428, "catalog_references": ["Brualdi & Dahl 2018", "VanLint & Wilson 1992"], "prompt_length": 20715, "files_placed": 8, "status": "keep"}
{"timestamp": 1782519141.955686, "experiment_id": "f2c77f29", "concept_title": "Euler-Mascheroni Constant: Irrationality Approaches", "concept_domain": "Applications", "research_mode": "prove", "quality": "partial", "quality_score": 0.54104, "catalog_references": [], "prompt_length": 22871, "files_placed": 7, "status": "keep"}
{"timestamp": 1782521125.848254, "experiment_id": "de494596", "concept_title": "Ramsey Theory: Bounds and Constructions", "concept_domain": "Novelty", "research_mode": "prove", "quality": "partial", "quality_score": 0.674434, "catalog_references": [], "prompt_length": 20714, "files_placed": 7, "status": "keep"}
{"timestamp": 1782521385.210665, "experiment_id": "f881b568", "concept_title": "Kakeya Conjecture: Known Cases and Bounds", "concept_domain": "Novelty", "research_mode": "prove", "quality": "partial", "quality_score": 0.50863, "catalog_references": [], "prompt_length": 20504, "files_placed": 7, "status": "keep"}
{"timestamp": 1782523550.40274, "experiment_id": "6adcd103", "concept_title": "EML Fixed-Point Theorem: exp-log Iteration Convergence", "concept_domain": "Applications", "research_mode": "team", "quality": "partial", "quality_score": 0.6233200000000001, "catalog_references": [], "prompt_length": 23635, "files_placed": 8, "status": "keep"}
{"timestamp": 1782523778.714674, "experiment_id": "9871aa6d", "concept_title": "Langlands for GL\u2082 over Q", "concept_domain": "Novelty", "research_mode": "team", "quality": "substantial", "quality_score": 0.7236, "catalog_references": [], "prompt_length": 20637, "files_placed": 7, "status": "keep"}
{"timestamp": 1782523885.345572, "experiment_id": "cf34309d", "concept_title": "Random Graphs: Erd\u0151s-R\u00e9nyi Threshold Phenomena", "concept_domain": "Applications", "research_mode": "prove", "quality": "partial", "quality_score": 0.584, "catalog_references": [], "prompt_length": 22852, "files_placed": 7, "status": "keep"}
{"timestamp": 1782526312.5702312, "experiment_id": "1394b2e6", "concept_title": "Maximum rank of self\u2011dual string C\u2011groups for alternating groups $A_{4m+3}$", "concept_domain": "Applications", "research_mode": "team", "quality": "substantial", "quality_score": 0.73028, "catalog_references": ["Mathlib.GroupTheory.Coxeter", "Mathlib.Combinatorics.Polytope", "Mathlib.Data.Fintype.Card"], "prompt_length": 20890, "files_placed": 7, "status": "keep"}
{"timestamp": 1782526401.0631452, "experiment_id": "061c7bd2", "concept_title": "Proof Automation: Custom Lean 4 Tactics", "concept_domain": "Applications", "research_mode": "prove", "quality": "partial", "quality_score": 0.6293409999999999, "catalog_references": [], "prompt_length": 20723, "files_placed": 8, "status": "keep"}
{"timestamp": 1782528719.029677, "experiment_id": "7c592ed1", "concept_title": "Plethystic Triviality of the Shifted t-Schur Basis", "concept_domain": "Novelty", "research_mode": "team", "quality": "partial", "quality_score": 0.533285, "catalog_references": ["Schur Q-functions", "strict partitions", "neutral fermion vertex operators", "odd power-sum symmetric functions", "Lean mathlib: MvPolynomial, PowerSeries, Finsupp, Nat.Odd"], "prompt_length": 21167, "files_placed": 7, "status": "keep"}
{"timestamp": 1782530380.211585, "experiment_id": "4efe75bb", "concept_title": "Close Proofs: Alien Number Systems: Beyond Base-N", "concept_domain": "Novelty", "research_mode": "team", "quality": "partial", "quality_score": 0.5579999999999999, "catalog_references": [], "prompt_length": 17580, "files_placed": 6, "status": "keep"}
{"timestamp": 1782531872.16615, "experiment_id": "11521acf", "concept_title": "Symmetric-Key Cryptanalysis: Differential and Linear Cryptanalysis Bounds", "concept_domain": "Novelty", "research_mode": "team", "quality": "substantial", "quality_score": 0.72888, "catalog_references": [], "prompt_length": 20753, "files_placed": 9, "status": "keep"}
