{"timestamp": 1785044216.394291, "experiment_id": "ce71f394", "concept_title": "EML Differential Calculus: Chain Rules for exp-log Compositions", "concept_domain": "Applications", "research_mode": "team", "quality": "substantial", "quality_score": 0.77, "catalog_references": [], "prompt_length": 25834, "files_placed": 4, "status": "keep"}
{"timestamp": 1785044221.0268488, "experiment_id": "735a1ab0", "concept_title": "Neural Tangent Kernel: Convergence", "concept_domain": "MachineLearning", "research_mode": "team", "quality": "substantial", "quality_score": 0.75, "catalog_references": [], "prompt_length": 24489, "files_placed": 4, "status": "keep"}
{"timestamp": 1785044227.0483923, "experiment_id": "078d5371", "concept_title": "Graph Coloring: Chromatic Polynomial Theory", "concept_domain": "Combinatorics", "research_mode": "prove", "quality": "substantial", "quality_score": 0.77, "catalog_references": [], "prompt_length": 23570, "files_placed": 6, "status": "keep"}
{"timestamp": 1785044238.7722478, "experiment_id": "6a88207a", "concept_title": "The Mathematics of Deja Vu: Fixed Points in Consciousness and Cognition", "concept_domain": "Novelty", "research_mode": "team", "quality": "substantial", "quality_score": 0.75, "catalog_references": [], "prompt_length": 24415, "files_placed": 4, "status": "keep"}
{"timestamp": 1785046751.6729894, "experiment_id": "d7591934", "concept_title": "Matroid Minors and the Graph Theorem: Robertson-Seymour for Matroids", "concept_domain": "Novelty", "research_mode": "team", "quality": "partial", "quality_score": 0.6299480519480519, "catalog_references": [], "prompt_length": 4591, "files_placed": 407, "status": "keep"}
{"timestamp": 1785049241.9892714, "experiment_id": "64006a56", "concept_title": "Euler Characteristic and Gauss-Bonnet", "concept_domain": "Geometry", "research_mode": "prove", "quality": "substantial", "quality_score": 0.74, "catalog_references": [], "prompt_length": 24849, "files_placed": 5, "status": "keep"}
{"timestamp": 1785058306.3321595, "experiment_id": "1ba7b435", "concept_title": "The L-Function Universe: A Cosmic Census of All L-Functions", "concept_domain": "NumberTheory", "research_mode": "team", "quality": "partial", "quality_score": 0.6243783783783784, "catalog_references": [], "prompt_length": 4783, "files_placed": 7, "status": "keep"}
{"timestamp": 1785074638.4849536, "experiment_id": "c6b3a18e", "concept_title": "Moonshot: The Last Theorem \u2014 Formalizing the Heat Death of Mathematics", "concept_domain": "Physics", "research_mode": "team", "quality": "partial", "quality_score": 0.6294117647058823, "catalog_references": [], "prompt_length": 3495, "files_placed": 7, "status": "keep"}
{"timestamp": 1785074643.7958453, "experiment_id": "c1a3ae41", "concept_title": "Algorithmic Fairness: Individual vs Group Fairness Impossibility", "concept_domain": "Computation", "research_mode": "team", "quality": "partial", "quality_score": 0.69018, "catalog_references": [], "prompt_length": 2328, "files_placed": 3, "status": "keep"}
{"timestamp": 1785074648.9406989, "experiment_id": "68e75c09", "concept_title": "Stone Duality for Machine Learning: Neural Networks as Geometric Realizations", "concept_domain": "Logic", "research_mode": "team", "quality": "partial", "quality_score": 0.63, "catalog_references": [], "prompt_length": 4609, "files_placed": 1, "status": "keep"}
{"timestamp": 1785075986.3625576, "experiment_id": "346c1c9a", "concept_title": "Deepening: Speculative: Theorems as Phase Transitions in Proof Space", "concept_domain": "Shared", "research_mode": "team", "quality": "partial", "quality_score": 0.6043828571428571, "catalog_references": [], "prompt_length": 3113, "files_placed": 3, "status": "keep"}
{"timestamp": 1785086568.945654, "experiment_id": "538b51f9", "concept_title": "EML Kolmogorov-Arnold Representation", "concept_domain": "Applications", "research_mode": "team", "quality": "partial", "quality_score": 0.63, "catalog_references": [], "prompt_length": 2700, "files_placed": 1, "status": "keep"}
{"timestamp": 1785090066.3681371, "experiment_id": "cf55a60f", "concept_title": "Quantum Thermodynamics: Landauer's Principle at the Nanoscale", "concept_domain": "Physics", "research_mode": "team", "quality": "partial", "quality_score": 0.6695599999999999, "catalog_references": [], "prompt_length": 2371, "files_placed": 3, "status": "keep"}
{"timestamp": 1785090072.1048667, "experiment_id": "c3aad27b", "concept_title": "Post-Quantum Lattice Cryptography: Formal Security Proofs", "concept_domain": "Cryptography", "research_mode": "team", "quality": "partial", "quality_score": 0.6256666666666666, "catalog_references": [], "prompt_length": 2543, "files_placed": 5, "status": "keep"}
{"timestamp": 1785090077.6908658, "experiment_id": "1782ce5d", "concept_title": "ArXiv paper: From roots to paths: graphs simultaneously irregular with respect to rooted and ordinary paths", "concept_domain": "Pythagorean", "research_mode": "team", "quality": "partial", "quality_score": 0.66484, "catalog_references": [], "prompt_length": 4510, "files_placed": 2, "status": "keep"}
{"timestamp": 1785094352.088377, "experiment_id": "b3e5f77d", "concept_title": "Rucker: The Lifebox \u2014 Information-Theoretic Identity", "concept_domain": "MachineLearning", "research_mode": "team", "quality": "partial", "quality_score": 0.6666666666666667, "catalog_references": [], "prompt_length": 3138, "files_placed": 2, "status": "keep"}
{"timestamp": 1785099120.3508186, "experiment_id": "b3ca6b38", "concept_title": "Tropical-Rank: Kapranov Rank vs Tropical Rank Equivalence Bounds", "concept_domain": "Tropical", "research_mode": "team", "quality": "partial", "quality_score": 0.6900799999999998, "catalog_references": [], "prompt_length": 1986, "files_placed": 3, "status": "keep"}
{"timestamp": 1785104657.2272992, "experiment_id": "9fe269b0", "concept_title": "Non-Desarguesian Worlds: Geometry Without Desargues", "concept_domain": "Geometry", "research_mode": "team", "quality": "substantial", "quality_score": 0.7311199999999999, "catalog_references": [], "prompt_length": 24952, "files_placed": 4, "status": "keep"}
{"timestamp": 1785108011.0694697, "experiment_id": "4a8509fd", "concept_title": "Conjecture: deciding whether a finite multiset of non-rotatable square pieces wi", "concept_domain": "Geometry", "research_mode": "team", "quality": "substantial", "quality_score": 0.7793599999999999, "catalog_references": [], "prompt_length": 26340, "files_placed": 4, "status": "keep"}
{"timestamp": 1785108546.9769914, "experiment_id": "1f5ea34f", "concept_title": "EML Number Theory: Transcendence and Algebraic Independence", "concept_domain": "Applications", "research_mode": "team", "quality": "substantial", "quality_score": 0.77698, "catalog_references": [], "prompt_length": 23141, "files_placed": 4, "status": "keep"}
{"timestamp": 1785108552.1437027, "experiment_id": "060e882c", "concept_title": "Topological-Algebraic Bridge: Fundamental Group as a Complete Invariant", "concept_domain": "Bridges", "research_mode": "team", "quality": "substantial", "quality_score": 0.79231, "catalog_references": [], "prompt_length": 24385, "files_placed": 4, "status": "keep"}
{"timestamp": 1785111594.782817, "experiment_id": "95478b50", "concept_title": "Self-Avoiding Walk: Connective Constant", "concept_domain": "Probability", "research_mode": "team", "quality": "partial", "quality_score": 0.61, "catalog_references": [], "prompt_length": 3255, "files_placed": 51, "status": "keep"}
{"timestamp": 1785111601.957352, "experiment_id": "e4773f49", "concept_title": "Perfect Numbers: Structure of Even Perfects", "concept_domain": "NumberTheory", "research_mode": "prove", "quality": "partial", "quality_score": 0.6398028571428571, "catalog_references": [], "prompt_length": 2582, "files_placed": 4, "status": "keep"}
{"timestamp": 1785111607.318976, "experiment_id": "e3956c60", "concept_title": "Alien Number Systems: Beyond Base-N", "concept_domain": "NumberTheory", "research_mode": "team", "quality": "partial", "quality_score": 0.68, "catalog_references": [], "prompt_length": 2809, "files_placed": 4, "status": "keep"}
{"timestamp": 1785117777.8130405, "experiment_id": "27eaed26", "concept_title": "Speculative: Theorems as Phase Transitions in Proof Space", "concept_domain": "Logic", "research_mode": "team", "quality": "partial", "quality_score": 0.6962981818181817, "catalog_references": [], "prompt_length": 2984, "files_placed": 3, "status": "keep"}
{"timestamp": 1785139106.1717832, "experiment_id": "27c8e30f", "concept_title": "Close Proofs: [Reset] Fresh approach in Shared", "concept_domain": "Shared", "research_mode": "team", "quality": "partial", "quality_score": 0.686, "catalog_references": [], "prompt_length": 2775, "files_placed": 25, "status": "keep"}
{"timestamp": 1785139114.7741604, "experiment_id": "e50f9bec", "concept_title": "Proof Complexity: Resolution and Cutting Planes", "concept_domain": "Logic", "research_mode": "prove", "quality": "substantial", "quality_score": 0.78468, "catalog_references": [], "prompt_length": 23560, "files_placed": 4, "status": "keep"}
{"timestamp": 1785139120.075225, "experiment_id": "92e6405b", "concept_title": "Statistical Mechanics: Ising Model Phase Transition", "concept_domain": "Probability", "research_mode": "prove", "quality": "substantial", "quality_score": 0.75773, "catalog_references": [], "prompt_length": 21244, "files_placed": 4, "status": "keep"}
{"timestamp": 1785139135.439962, "experiment_id": "f8a71afd", "concept_title": "Hilbert 11: Quadratic Forms over Algebraic Fields", "concept_domain": "Algebra", "research_mode": "team", "quality": "substantial", "quality_score": 0.75276, "catalog_references": [], "prompt_length": 23658, "files_placed": 6, "status": "keep"}
{"timestamp": 1785148158.7332277, "experiment_id": "87772396", "concept_title": "Infinite Games Against Death: Immortality Strategies", "concept_domain": "Novelty", "research_mode": "team", "quality": "partial", "quality_score": 0.6857029702970298, "catalog_references": [], "prompt_length": 2374, "files_placed": 20, "status": "keep"}
{"timestamp": 1785148163.7994812, "experiment_id": "7fa0ef0b", "concept_title": "ArXiv paper: Further thoughts on dimensions of posets", "concept_domain": "Pythagorean", "research_mode": "team", "quality": "partial", "quality_score": 0.686, "catalog_references": [], "prompt_length": 3001, "files_placed": 3, "status": "keep"}
{"timestamp": 1785159865.5186844, "experiment_id": "1443bb24", "concept_title": "Causal Inference: Do-Calculus as Formal Logic", "concept_domain": "Computation", "research_mode": "team", "quality": "substantial", "quality_score": 0.7907, "catalog_references": [], "prompt_length": 23744, "files_placed": 4, "status": "keep"}
{"timestamp": 1785221380.4438305, "experiment_id": "a68d3b50", "concept_title": "Lattice Cryptography: LWE Hardness", "concept_domain": "Cryptography", "research_mode": "prove", "quality": "substantial", "quality_score": 0.7667599999999999, "catalog_references": [], "prompt_length": 21197, "files_placed": 4, "status": "keep"}
{"timestamp": 1785241233.4480972, "experiment_id": "38d3a014", "concept_title": "Cellular Automata as Algebraic Geometry: Wolfram's Rules Meet Grothendieck", "concept_domain": "Novelty", "research_mode": "team", "quality": "substantial", "quality_score": 0.7097100000000001, "catalog_references": [], "prompt_length": 19283, "files_placed": 4, "status": "keep"}
{"timestamp": 1785241266.7879667, "experiment_id": "09a3e4f4", "concept_title": "The Monster Group's Secret Message: Moonshine Beyond the j-Function", "concept_domain": "Novelty", "research_mode": "team", "quality": "substantial", "quality_score": 0.77355, "catalog_references": [], "prompt_length": 22308, "files_placed": 4, "status": "keep"}
{"timestamp": 1785250028.863596, "experiment_id": "afbe2d9b", "concept_title": "Stereographic Neural Attention: Attention via Riemann Sphere", "concept_domain": "MachineLearning", "research_mode": "team", "quality": "substantial", "quality_score": 0.7438, "catalog_references": [], "prompt_length": 20241, "files_placed": 4, "status": "keep"}
{"timestamp": 1785250035.5436003, "experiment_id": "eae986b3", "concept_title": "Sheaf-Theoretic Data Integration: When Databases Form a Sheaf", "concept_domain": "Algebra", "research_mode": "team", "quality": "partial", "quality_score": 0.6380299999999999, "catalog_references": [], "prompt_length": 4926, "files_placed": 2, "status": "keep"}
{"timestamp": 1785258001.7490757, "experiment_id": "ee1ae94f", "concept_title": "Hilbert 12: Kronecker-Weber Generalization", "concept_domain": "NumberTheory", "research_mode": "team", "quality": "substantial", "quality_score": 0.78664, "catalog_references": [], "prompt_length": 20547, "files_placed": 4, "status": "keep"}
{"timestamp": 1785258044.2136445, "experiment_id": "a07085b6", "concept_title": "For an arbitrary activation map `a : X \u2192 (Fin k \u2192 Bool)`, the correct finite sem", "concept_domain": "Pythagorean", "research_mode": "team", "quality": "substantial", "quality_score": 0.76088, "catalog_references": [], "prompt_length": 23143, "files_placed": 4, "status": "keep"}
{"timestamp": 1785258086.4048443, "experiment_id": "b7ae8967", "concept_title": "Attention is All You Need: Formalizing Transformer Architecture", "concept_domain": "MachineLearning", "research_mode": "team", "quality": "substantial", "quality_score": 0.8002199999999999, "catalog_references": [], "prompt_length": 22694, "files_placed": 4, "status": "keep"}
{"timestamp": 1785264907.3000212, "experiment_id": "3e30c45d", "concept_title": "Isogeny-SIDH: Radical Isogeny Verification on Montgomery Curves", "concept_domain": "Cryptography", "research_mode": "team", "quality": "substantial", "quality_score": 0.7689999999999999, "catalog_references": [], "prompt_length": 23731, "files_placed": 4, "status": "keep"}
{"timestamp": 1785264968.3527007, "experiment_id": "e68f39b0", "concept_title": "`Logic/ProofSpaceTransition.lean` gives a self-contained finite theorem for a", "concept_domain": "Logic", "research_mode": "team", "quality": "substantial", "quality_score": 0.72847, "catalog_references": [], "prompt_length": 27408, "files_placed": 4, "status": "keep"}
{"timestamp": 1785265030.022219, "experiment_id": "627f5167", "concept_title": "Reflective Type Theory: Proving Things About Proving Things", "concept_domain": "Computation", "research_mode": "team", "quality": "substantial", "quality_score": 0.7662, "catalog_references": [], "prompt_length": 19950, "files_placed": 4, "status": "keep"}
{"timestamp": 1785277589.3039875, "experiment_id": "83a0d4e2", "concept_title": "Strange Attractors as Algebraic Objects", "concept_domain": "Novelty", "research_mode": "team", "quality": "substantial", "quality_score": 0.75101, "catalog_references": [], "prompt_length": 18201, "files_placed": 4, "status": "keep"}
{"timestamp": 1785277651.5588648, "experiment_id": "d54ed94e", "concept_title": "ArXiv paper: A positive square-energy strengthening of Tur\u00e1n's theorem", "concept_domain": "Computation", "research_mode": "team", "quality": "substantial", "quality_score": 0.76634, "catalog_references": [], "prompt_length": 21117, "files_placed": 4, "status": "keep"}
{"timestamp": 1785277712.6679306, "experiment_id": "8a9b8560", "concept_title": "The Ramsey Theory of DNA: Subsequence Avoidance in Genetic Codes", "concept_domain": "Combinatorics", "research_mode": "team", "quality": "substantial", "quality_score": 0.7322500000000001, "catalog_references": [], "prompt_length": 19728, "files_placed": 4, "status": "keep"}
{"timestamp": 1785281196.6927173, "experiment_id": "9da9b807", "concept_title": "Jacobian Conjecture", "concept_domain": "Geometry", "research_mode": "team", "quality": "substantial", "quality_score": 0.7645199999999999, "catalog_references": [], "prompt_length": 21021, "files_placed": 4, "status": "keep"}
{"timestamp": 1785308032.3535519, "experiment_id": "1a03af4c", "concept_title": "Langlands Program: Functoriality", "concept_domain": "Bridges", "research_mode": "team", "quality": "substantial", "quality_score": 0.78657, "catalog_references": [], "prompt_length": 20804, "files_placed": 4, "status": "keep"}
{"timestamp": 1785308094.7883325, "experiment_id": "f1303b99", "concept_title": "Game of Life Universality", "concept_domain": "Novelty", "research_mode": "team", "quality": "substantial", "quality_score": 0.81107, "catalog_references": [], "prompt_length": 23857, "files_placed": 4, "status": "keep"}
{"timestamp": 1785319100.9713802, "experiment_id": "229af38b", "concept_title": "Graceful Tree Conjecture", "concept_domain": "Algebra", "research_mode": "team", "quality": "substantial", "quality_score": 0.80057, "catalog_references": [], "prompt_length": 23836, "files_placed": 4, "status": "keep"}
{"timestamp": 1785328160.4010339, "experiment_id": "545fa377", "concept_title": "Spectral Graph Theory Meets Network Robustness", "concept_domain": "Geometry", "research_mode": "team", "quality": "substantial", "quality_score": 0.7815999999999999, "catalog_references": [], "prompt_length": 24011, "files_placed": 4, "status": "keep"}
{"timestamp": 1785328224.2382116, "experiment_id": "dff51e05", "concept_title": "Impossible Geometries: Where Parallel Lines Converge AND Diverge", "concept_domain": "Novelty", "research_mode": "team", "quality": "substantial", "quality_score": 0.78321, "catalog_references": [], "prompt_length": 24497, "files_placed": 4, "status": "keep"}
{"timestamp": 1785328288.027231, "experiment_id": "5843d50f", "concept_title": "Logic-Physics Bridge: Consistency of Physical Theories", "concept_domain": "Bridges", "research_mode": "team", "quality": "substantial", "quality_score": 0.7539499999999999, "catalog_references": [], "prompt_length": 21112, "files_placed": 4, "status": "keep"}
{"timestamp": 1785328352.60378, "experiment_id": "687f4282", "concept_title": "The Combinatorics of Compiler Optimization: Register Allocation as Graph Coloring", "concept_domain": "Novelty", "research_mode": "team", "quality": "substantial", "quality_score": 0.8022499999999999, "catalog_references": [], "prompt_length": 23080, "files_placed": 4, "status": "keep"}
{"timestamp": 1785338934.4639, "experiment_id": "5f676746", "concept_title": "EML Universal Approximation", "concept_domain": "Algebra", "research_mode": "team", "quality": "substantial", "quality_score": 0.74002, "catalog_references": [], "prompt_length": 19863, "files_placed": 4, "status": "keep"}
{"timestamp": 1785347199.2301831, "experiment_id": "d1098480", "concept_title": "Deepening: Rucker: The Fourth Dimension as a Mathematical Playground", "concept_domain": "Shared", "research_mode": "team", "quality": "partial", "quality_score": 0.685, "catalog_references": [], "prompt_length": 2808, "files_placed": 1, "status": "keep"}
{"timestamp": 1785347204.2457933, "experiment_id": "2bb5622c", "concept_title": "Algebraic Coding Theory: BCH and Reed-Solomon", "concept_domain": "Cryptography", "research_mode": "prove", "quality": "partial", "quality_score": 0.686, "catalog_references": [], "prompt_length": 2488, "files_placed": 5, "status": "keep"}
{"timestamp": 1785347270.0264926, "experiment_id": "132832ee", "concept_title": "Zero-Knowledge Proofs in Lean: Verifiable Computation", "concept_domain": "Cryptography", "research_mode": "team", "quality": "substantial", "quality_score": 0.74352, "catalog_references": [], "prompt_length": 21141, "files_placed": 4, "status": "keep"}
{"timestamp": 1785347332.7571442, "experiment_id": "e3e9c821", "concept_title": "Noether's Theorem: Symmetries and Conservation Laws", "concept_domain": "Physics", "research_mode": "prove", "quality": "substantial", "quality_score": 0.79196, "catalog_references": [], "prompt_length": 24181, "files_placed": 4, "status": "keep"}
{"timestamp": 1785347395.7418067, "experiment_id": "e771e647", "concept_title": "ArXiv paper: On a character-twisted analogue of Sch\u00e4ffer's equation", "concept_domain": "Pythagorean", "research_mode": "team", "quality": "substantial", "quality_score": 0.73183, "catalog_references": [], "prompt_length": 22186, "files_placed": 4, "status": "keep"}
{"timestamp": 1785354701.1202924, "experiment_id": "434986f0", "concept_title": "Tropical Brill-Noether Theory", "concept_domain": "Shared", "research_mode": "team", "quality": "partial", "quality_score": 0.686, "catalog_references": [], "prompt_length": 2338, "files_placed": 3, "status": "keep"}
{"timestamp": 1785354766.2309349, "experiment_id": "8c9ac99e", "concept_title": "Tropical-Neural: Duality Between Tropical Polynomials and Deep Neural Networks", "concept_domain": "Tropical", "research_mode": "team", "quality": "substantial", "quality_score": 0.7311099999999999, "catalog_references": [], "prompt_length": 23433, "files_placed": 4, "status": "keep"}
{"timestamp": 1785354829.5212262, "experiment_id": "42454fab", "concept_title": "Frankl's Union-Closed Conjecture: Partial Results", "concept_domain": "Combinatorics", "research_mode": "prove", "quality": "substantial", "quality_score": 0.7628999999999999, "catalog_references": [], "prompt_length": 24149, "files_placed": 4, "status": "keep"}
{"timestamp": 1785354834.152693, "experiment_id": "35f601c4", "concept_title": "Infinite Chess: Checkmate in Omega Moves", "concept_domain": "Computation", "research_mode": "team", "quality": "partial", "quality_score": 0.686, "catalog_references": [], "prompt_length": 4465, "files_placed": 1, "status": "keep"}
{"timestamp": 1785354838.6570275, "experiment_id": "560cda23", "concept_title": "EML Fixed-Point Theorem: exp-log Iteration Convergence", "concept_domain": "Applications", "research_mode": "team", "quality": "partial", "quality_score": 0.686, "catalog_references": [], "prompt_length": 3776, "files_placed": 2, "status": "keep"}
