{"timestamp": 1781160010.879618, "experiment_id": "1b2bde48", "concept_title": "Close Proofs: These directions extend `Catalog/MachineLearning/RademacherSpectral.le", "concept_domain": "Novelty", "research_mode": "team", "quality": "partial", "quality_score": 0.5916, "catalog_references": [], "prompt_length": 16956, "files_placed": 5, "status": "keep"}
{"timestamp": 1781160036.8443248, "experiment_id": "d4c18496", "concept_title": "Close Proofs: The Bernoulli Pinsker inequality `(p - q)\u00b2 \u2264 KL(Ber(p) \u2016 Ber(q)) / 2` ", "concept_domain": "Tropical", "research_mode": "team", "quality": "partial", "quality_score": 0.42495024376026125, "catalog_references": [], "prompt_length": 11511, "files_placed": 0, "status": "discard"}
{"timestamp": 1781163844.760621, "experiment_id": "c84ee866", "concept_title": "Reverse Mathematics: Ramsey's Theorem", "concept_domain": "Applications", "research_mode": "team", "quality": "partial", "quality_score": 0.4012183151515151, "catalog_references": [], "prompt_length": 6332, "files_placed": 0, "status": "discard"}
{"timestamp": 1781163872.1611898, "experiment_id": "dd0a519b", "concept_title": "The Bernoulli Pinsker inequality `(p - q)\u00b2 \u2264 KL(Ber(p) \u2016 Ber(q)) / 2` is now ful", "concept_domain": "Applications", "research_mode": "team", "quality": "partial", "quality_score": 0.25735685714285716, "catalog_references": [], "prompt_length": 15709, "files_placed": 0, "status": "discard"}
{"timestamp": 1781163897.6059847, "experiment_id": "95dbf745", "concept_title": "Chaos and the Three-Body Problem: Lyapunov Exponent Bounds", "concept_domain": "Applications", "research_mode": "team", "quality": "partial", "quality_score": 0.388324, "catalog_references": [], "prompt_length": 11281, "files_placed": 0, "status": "discard"}
{"timestamp": 1781163915.5877016, "experiment_id": "8c7249d2", "concept_title": "Close Proofs: Close Proofs: ML Generalization Bounds: Rademacher Complexity of Neura", "concept_domain": "Applications", "research_mode": "team", "quality": "partial", "quality_score": 0.5565599999999999, "catalog_references": [], "prompt_length": 16972, "files_placed": 5, "status": "keep"}
{"timestamp": 1781163933.316088, "experiment_id": "66c2eb30", "concept_title": "Close Proofs: Topological Quantum Computing: Braiding Universality", "concept_domain": "Applications", "research_mode": "team", "quality": "partial", "quality_score": 0.5392, "catalog_references": [], "prompt_length": 16923, "files_placed": 5, "status": "keep"}
{"timestamp": 1781163948.6343992, "experiment_id": "641a9f86", "concept_title": "Close Proofs: Foundational analytic infrastructure for formalizing", "concept_domain": "Novelty", "research_mode": "team", "quality": "partial", "quality_score": 0.51906, "catalog_references": [], "prompt_length": 14543, "files_placed": 5, "status": "keep"}
{"timestamp": 1781164001.426358, "experiment_id": "0cdd75c1", "concept_title": "Fully formal bridge between statistical inference and", "concept_domain": "Novelty", "research_mode": "team", "quality": "partial", "quality_score": 0.4191309677419356, "catalog_references": [], "prompt_length": 28998, "files_placed": 0, "status": "discard"}
{"timestamp": 1781165904.6737401, "experiment_id": "e1abb972", "concept_title": "Deepening: Information-Geometric Bridge: Fisher Metric on Statistical Manifolds", "concept_domain": "Applications", "research_mode": "team", "quality": "substantial", "quality_score": 0.8228800000000001, "catalog_references": [], "prompt_length": 17068, "files_placed": 12, "status": "keep"}
{"timestamp": 1781165931.2856402, "experiment_id": "8e4237a1", "concept_title": "The edge bound |E| \u2264 3g \u2212 3 we proved here is for *unmarked* stable tropical cur", "concept_domain": "Novelty", "research_mode": "team", "quality": "partial", "quality_score": 0.37057621052631584, "catalog_references": [], "prompt_length": 16691, "files_placed": 0, "status": "discard"}
{"timestamp": 1781165955.705378, "experiment_id": "145c21f1", "concept_title": "Close Proofs: Tropical Hodge Theory", "concept_domain": "Applications", "research_mode": "team", "quality": "partial", "quality_score": 0.41655790095479023, "catalog_references": [], "prompt_length": 6794, "files_placed": 0, "status": "discard"}
{"timestamp": 1781165981.13743, "experiment_id": "0de6354a", "concept_title": "Post-Quantum Cryptography: Lattice-Based Key Exchange", "concept_domain": "Novelty", "research_mode": "team", "quality": "partial", "quality_score": 0.4144544154291596, "catalog_references": [], "prompt_length": 11304, "files_placed": 0, "status": "discard"}
{"timestamp": 1781166058.4317985, "experiment_id": "d080735f", "concept_title": "Code-Based Cryptography: McEliece from Goppa Codes", "concept_domain": "Applications", "research_mode": "team", "quality": "partial", "quality_score": 0.4407799324271235, "catalog_references": [], "prompt_length": 6147, "files_placed": 0, "status": "discard"}
{"timestamp": 1781167998.603931, "experiment_id": "d4cfb6f8", "concept_title": "Neural Network Training as Renormalization Group Flow", "concept_domain": "Applications", "research_mode": "team", "quality": "partial", "quality_score": 0.46401961272361997, "catalog_references": [], "prompt_length": 17631, "files_placed": 20, "status": "discard"}
{"timestamp": 1781168020.01088, "experiment_id": "6ae717c3", "concept_title": "Integrated Information via Tensor Networks", "concept_domain": "Applications", "research_mode": "team", "quality": "partial", "quality_score": 0.52376, "catalog_references": [], "prompt_length": 16967, "files_placed": 5, "status": "keep"}
{"timestamp": 1781168047.0604177, "experiment_id": "fb6da1bf", "concept_title": "Close Proofs: Formalized bridge between ReLU neural network decision", "concept_domain": "Applications", "research_mode": "team", "quality": "partial", "quality_score": 0.42278176912870413, "catalog_references": [], "prompt_length": 6393, "files_placed": 0, "status": "discard"}
{"timestamp": 1781168687.1426334, "experiment_id": "57f50527", "concept_title": "Close Proofs: Post-Quantum Cryptography: Lattice-Based Key Exchange", "concept_domain": "Applications", "research_mode": "team", "quality": "partial", "quality_score": 0.36219106060606066, "catalog_references": [], "prompt_length": 6378, "files_placed": 0, "status": "discard"}
{"timestamp": 1781170624.2163785, "experiment_id": "6cc45a52", "concept_title": "The new file `Computation/SpectralChain/L2Operator.lean` lifts the spectral-chai", "concept_domain": "Novelty", "research_mode": "team", "quality": "partial", "quality_score": 0.6199720670391061, "catalog_references": [], "prompt_length": 23582, "files_placed": 14, "status": "keep"}
{"timestamp": 1781170681.128629, "experiment_id": "53d838e0", "concept_title": "Close Proofs: Proof-Net Curvature and Phase Transitions in Automated Theorem Search", "concept_domain": "Novelty", "research_mode": "team", "quality": "partial", "quality_score": 0.4216705673978762, "catalog_references": [], "prompt_length": 6386, "files_placed": 0, "status": "discard"}
{"timestamp": 1781170705.715842, "experiment_id": "4fd922a5", "concept_title": "Biological Topology: Protein Folding as Persistent Homology Optimization", "concept_domain": "Novelty", "research_mode": "team", "quality": "partial", "quality_score": 0.42528738127544097, "catalog_references": [], "prompt_length": 8847, "files_placed": 0, "status": "discard"}
{"timestamp": 1781170734.5675666, "experiment_id": "30b0e9b5", "concept_title": "Machine Learning Generalization Bounds", "concept_domain": "Applications", "research_mode": "team", "quality": "partial", "quality_score": 0.3930162367593379, "catalog_references": [], "prompt_length": 6529, "files_placed": 0, "status": "discard"}
{"timestamp": 1781170764.5637255, "experiment_id": "fcd7adef", "concept_title": "The file `Logic/Paraconsistent.lean` now contains a fully verified (axioms: `pro", "concept_domain": "Applications", "research_mode": "team", "quality": "partial", "quality_score": 0.39258494364417584, "catalog_references": [], "prompt_length": 19523, "files_placed": 0, "status": "discard"}
{"timestamp": 1781172698.2278175, "experiment_id": "a3442408", "concept_title": "The current framework considers *static* observation systems where all predicate", "concept_domain": "Applications", "research_mode": "team", "quality": "substantial", "quality_score": 0.7268563730569949, "catalog_references": [], "prompt_length": 21286, "files_placed": 58, "status": "keep"}
{"timestamp": 1781172777.9683535, "experiment_id": "d65a788c", "concept_title": "Close Proofs: Proof-Theoretic Bridge: Ordinal Analysis Across Systems", "concept_domain": "Novelty", "research_mode": "team", "quality": "partial", "quality_score": 0.4412284403669725, "catalog_references": [], "prompt_length": 11494, "files_placed": 0, "status": "discard"}
{"timestamp": 1781172805.282606, "experiment_id": "cc8fcc58", "concept_title": "Close Proofs: Close Proofs: Proof-Net Curvature and Phase Transitions in Automated T", "concept_domain": "Applications", "research_mode": "team", "quality": "partial", "quality_score": 0.3773126114649682, "catalog_references": [], "prompt_length": 6397, "files_placed": 0, "status": "discard"}
{"timestamp": 1781174730.036209, "experiment_id": "5f75d663", "concept_title": "The current framework establishes qualitative novelty certification (\u03b5-separatio", "concept_domain": "Novelty", "research_mode": "team", "quality": "substantial", "quality_score": 0.749506500445236, "catalog_references": [], "prompt_length": 21422, "files_placed": 66, "status": "keep"}
{"timestamp": 1781174769.244662, "experiment_id": "9d2e8c84", "concept_title": "Close Proofs: Machine Learning Generalization Bounds", "concept_domain": "Applications", "research_mode": "team", "quality": "partial", "quality_score": 0.5615311926605505, "catalog_references": [], "prompt_length": 16940, "files_placed": 14, "status": "keep"}
{"timestamp": 1781174828.938781, "experiment_id": "407423ba", "concept_title": "Close Proofs: The new file `Computation/SpectralChain/L2Operator.lean` lifts the spe", "concept_domain": "Novelty", "research_mode": "team", "quality": "partial", "quality_score": 0.43360000000000004, "catalog_references": [], "prompt_length": 11509, "files_placed": 0, "status": "discard"}
{"timestamp": 1781174861.863363, "experiment_id": "7b858b76", "concept_title": "Zero-Knowledge Proof Systems: Formal Verification of Privacy", "concept_domain": "Novelty", "research_mode": "team", "quality": "partial", "quality_score": 0.416284354767184, "catalog_references": [], "prompt_length": 6579, "files_placed": 0, "status": "discard"}
{"timestamp": 1781176843.8349152, "experiment_id": "f6f7fad2", "concept_title": "The file `ConstructiveFoundations.lean` establishes a self-contained HoTT", "concept_domain": "Applications", "research_mode": "team", "quality": "partial", "quality_score": 0.59718, "catalog_references": [], "prompt_length": 22047, "files_placed": 55, "status": "keep"}
{"timestamp": 1781176936.4439483, "experiment_id": "b0abf586", "concept_title": "Hilbert 6: Axiomatization of Physics", "concept_domain": "Applications", "research_mode": "team", "quality": "partial", "quality_score": 0.42574, "catalog_references": [], "prompt_length": 11105, "files_placed": 0, "status": "discard"}
{"timestamp": 1781176969.3205311, "experiment_id": "64d69b78", "concept_title": "Close Proofs: The current framework establishes qualitative novelty certification (\u03b5", "concept_domain": "Applications", "research_mode": "team", "quality": "partial", "quality_score": 0.3974505016722408, "catalog_references": [], "prompt_length": 6891, "files_placed": 0, "status": "discard"}
{"timestamp": 1781177002.8730967, "experiment_id": "496abf11", "concept_title": "Close Proofs: Close Proofs: Machine Learning Generalization Bounds", "concept_domain": "Novelty", "research_mode": "team", "quality": "partial", "quality_score": 0.36732755085256863, "catalog_references": [], "prompt_length": 6377, "files_placed": 0, "status": "discard"}
{"timestamp": 1781179566.9094505, "experiment_id": "15a7bd19", "concept_title": "Close Proofs: Formalized bridge between ReLU neural network decision", "concept_domain": "Applications", "research_mode": "team", "quality": "partial", "quality_score": 0.5095581978634464, "catalog_references": [], "prompt_length": 16958, "files_placed": 53, "status": "keep"}
{"timestamp": 1781179604.7564387, "experiment_id": "6138562d", "concept_title": "Close Proofs: Close Proofs: The current formalization handles 0-dimensional persiste", "concept_domain": "Novelty", "research_mode": "team", "quality": "partial", "quality_score": 0.4831367088607595, "catalog_references": [], "prompt_length": 16961, "files_placed": 5, "status": "discard"}
{"timestamp": 1781179637.6650374, "experiment_id": "76f09ec8", "concept_title": "This cycle built, from scratch and `sorry`-free, the arithmetic theory of the", "concept_domain": "Novelty", "research_mode": "team", "quality": "partial", "quality_score": 0.4468072078187499, "catalog_references": [], "prompt_length": 21960, "files_placed": 0, "status": "discard"}
{"timestamp": 1781181612.5577195, "experiment_id": "eb06b92f", "concept_title": "Formalize the Paley construction: for any prime power q \u2261 3 (mod 4), there exist", "concept_domain": "Novelty", "research_mode": "team", "quality": "partial", "quality_score": 0.42290948605178635, "catalog_references": [], "prompt_length": 14681, "files_placed": 0, "status": "discard"}
{"timestamp": 1781181650.285857, "experiment_id": "cd61a7ad", "concept_title": "Hawking Radiation: Information Paradox Formalized", "concept_domain": "Applications", "research_mode": "team", "quality": "partial", "quality_score": 0.4238149107142857, "catalog_references": [], "prompt_length": 6180, "files_placed": 0, "status": "discard"}
{"timestamp": 1781181684.64956, "experiment_id": "9ee7089d", "concept_title": "First rigorous, machine-checked skeleton of the", "concept_domain": "Applications", "research_mode": "team", "quality": "partial", "quality_score": 0.46736, "catalog_references": [], "prompt_length": 26778, "files_placed": 0, "status": "discard"}
{"timestamp": 1781181732.925371, "experiment_id": "84d1b2d7", "concept_title": "Consciousness as Integrated Information: Mathematical Foundations", "concept_domain": "Novelty", "research_mode": "team", "quality": "partial", "quality_score": 0.4237587309390048, "catalog_references": [], "prompt_length": 11256, "files_placed": 0, "status": "discard"}
{"timestamp": 1781181767.8396912, "experiment_id": "91c0c5ba", "concept_title": "Close Proofs: Arithmetic Mirror Symmetry for Calabi-Yau", "concept_domain": "Applications", "research_mode": "team", "quality": "partial", "quality_score": 0.42150602115320773, "catalog_references": [], "prompt_length": 6342, "files_placed": 0, "status": "discard"}
{"timestamp": 1781183050.2052662, "experiment_id": "703a169b", "concept_title": "Bridge: Logic of Provability and Fixed Points in Arithmetic", "concept_domain": "Novelty", "research_mode": "team", "quality": "partial", "quality_score": 0.4402757437781343, "catalog_references": [], "prompt_length": 6202, "files_placed": 0, "status": "discard"}
{"timestamp": 1781185031.118926, "experiment_id": "a55608ec", "concept_title": "Close Proofs: The current framework considers *static* observation systems where all", "concept_domain": "Applications", "research_mode": "team", "quality": "substantial", "quality_score": 0.7695069879518073, "catalog_references": [], "prompt_length": 16972, "files_placed": 51, "status": "keep"}
{"timestamp": 1781185060.7656336, "experiment_id": "8001e7b8", "concept_title": "Close Proofs: Close Proofs: Close Proofs: The current formalization handles 0-dimens", "concept_domain": "Applications", "research_mode": "team", "quality": "partial", "quality_score": 0.48058643628509723, "catalog_references": [], "prompt_length": 11519, "files_placed": 0, "status": "discard"}
{"timestamp": 1781185096.9703271, "experiment_id": "6e405308", "concept_title": "Close Proofs: This cycle built, from scratch and `sorry`-free, the arithmetic theory", "concept_domain": "Applications", "research_mode": "team", "quality": "partial", "quality_score": 0.6510584615384616, "catalog_references": [], "prompt_length": 16967, "files_placed": 25, "status": "keep"}
{"timestamp": 1781185123.146763, "experiment_id": "f165479e", "concept_title": "Inverse Stereographic Renormalization Group", "concept_domain": "Applications", "research_mode": "team", "quality": "partial", "quality_score": 0.45027731958762895, "catalog_references": [], "prompt_length": 7124, "files_placed": 0, "status": "discard"}
{"timestamp": 1781185149.3998883, "experiment_id": "8dea30c1", "concept_title": "Novikov Conjecture", "concept_domain": "Applications", "research_mode": "team", "quality": "partial", "quality_score": 0.4260468398268399, "catalog_references": [], "prompt_length": 5889, "files_placed": 0, "status": "discard"}
{"timestamp": 1781185177.0565693, "experiment_id": "6b9ac787", "concept_title": "Close Proofs: Bridge: Logic of Provability and Fixed Points in Arithmetic", "concept_domain": "Applications", "research_mode": "team", "quality": "partial", "quality_score": 0.3811157142857144, "catalog_references": [], "prompt_length": 6880, "files_placed": 0, "status": "discard"}
{"timestamp": 1781187141.9296262, "experiment_id": "69b5ee54", "concept_title": "Close Proofs: Formalize the Paley construction: for any prime power q \u2261 3 (mod 4), t", "concept_domain": "Applications", "research_mode": "team", "quality": "partial", "quality_score": 0.42624006968641115, "catalog_references": [], "prompt_length": 11521, "files_placed": 0, "status": "discard"}
{"timestamp": 1781187196.4779372, "experiment_id": "7ad3117a", "concept_title": "The natural next step is to formalize the Turaev-Viro state sum construction its", "concept_domain": "Novelty", "research_mode": "team", "quality": "partial", "quality_score": 0.42280000000000006, "catalog_references": [], "prompt_length": 14167, "files_placed": 0, "status": "discard"}
{"timestamp": 1781189099.8044348, "experiment_id": "1707fa10", "concept_title": "Close Proofs: Arithmetic Mirror Symmetry for Calabi-Yau", "concept_domain": "Novelty", "research_mode": "team", "quality": "partial", "quality_score": 0.2655060229885058, "catalog_references": [], "prompt_length": 6828, "files_placed": 0, "status": "discard"}
{"timestamp": 1781189120.0950003, "experiment_id": "2a456ae3", "concept_title": "Close Proofs: Close Proofs: Tropical Hodge Theory", "concept_domain": "Applications", "research_mode": "team", "quality": "partial", "quality_score": 0.58056, "catalog_references": [], "prompt_length": 16937, "files_placed": 5, "status": "keep"}
{"timestamp": 1781189148.0974479, "experiment_id": "5c546f54", "concept_title": "Topological Quantum Error Correction from Homological Persistence", "concept_domain": "Applications", "research_mode": "team", "quality": "partial", "quality_score": 0.3874700000000001, "catalog_references": [], "prompt_length": 8340, "files_placed": 0, "status": "discard"}
{"timestamp": 1781189177.229869, "experiment_id": "6f2d2808", "concept_title": "ML Loss Landscape: Critical Points and Saddle Points", "concept_domain": "Novelty", "research_mode": "team", "quality": "partial", "quality_score": 0.3935626506024097, "catalog_references": [], "prompt_length": 11413, "files_placed": 0, "status": "discard"}
{"timestamp": 1781189227.0109577, "experiment_id": "64e5a38d", "concept_title": "Close Proofs: Consciousness as Integrated Information: Mathematical Foundations", "concept_domain": "Novelty", "research_mode": "team", "quality": "partial", "quality_score": 0.4273427555555556, "catalog_references": [], "prompt_length": 6380, "files_placed": 0, "status": "discard"}
{"timestamp": 1781191184.7574933, "experiment_id": "ee25df8d", "concept_title": "`DescentSystem` abstraction from scratch (the catalog had n", "concept_domain": "Applications", "research_mode": "team", "quality": "partial", "quality_score": 0.43679999999999997, "catalog_references": [], "prompt_length": 25442, "files_placed": 7, "status": "discard"}
{"timestamp": 1781191209.8918839, "experiment_id": "649bb1d3", "concept_title": "Spectral Universality of Neural Tangent Kernels on Arithmetic Expanders", "concept_domain": "Novelty", "research_mode": "team", "quality": "partial", "quality_score": 0.38402901204819273, "catalog_references": [], "prompt_length": 8554, "files_placed": 0, "status": "discard"}
{"timestamp": 1781191230.2088807, "experiment_id": "d2b4dcf3", "concept_title": "Close Proofs: Proof-Theoretic Bridge: Ordinal Analysis Across Systems", "concept_domain": "Novelty", "research_mode": "team", "quality": "partial", "quality_score": 0.55984, "catalog_references": [], "prompt_length": 16942, "files_placed": 5, "status": "keep"}
{"timestamp": 1781191277.2261622, "experiment_id": "9a5dbb4b", "concept_title": "Close Proofs: Close Proofs: Consciousness as Integrated Information: Mathematical Fo", "concept_domain": "Novelty", "research_mode": "team", "quality": "partial", "quality_score": 0.46584000000000003, "catalog_references": [], "prompt_length": 6877, "files_placed": 0, "status": "discard"}
{"timestamp": 1781191302.7104988, "experiment_id": "00d4dbb2", "concept_title": "Thermodynamic Proof Erasure: Landauer's Principle for Mathematics", "concept_domain": "Novelty", "research_mode": "team", "quality": "partial", "quality_score": 0.42607062937062945, "catalog_references": [], "prompt_length": 13380, "files_placed": 0, "status": "discard"}
{"timestamp": 1781193259.6066628, "experiment_id": "23f1d6d2", "concept_title": "The abstract simulation preorder formalized in `ProofSystemCollapse.lean` captur", "concept_domain": "Applications", "research_mode": "team", "quality": "partial", "quality_score": 0.5274731707317073, "catalog_references": [], "prompt_length": 20957, "files_placed": 8, "status": "keep"}
