{"timestamp": 1780940106.7891846, "experiment_id": "0e25433a", "concept_title": "Tropical Convexity: Helly, Caratheodory, and Radon", "concept_domain": "Novelty", "research_mode": "team", "quality": "partial", "quality_score": 0.3636, "catalog_references": [], "prompt_length": 7222, "files_placed": 0, "status": "discard"}
{"timestamp": 1780941212.075025, "experiment_id": "2c68c8c4", "concept_title": "Zero-Knowledge Proof Systems: Formal Verification of Privacy", "concept_domain": "Logic", "research_mode": "team", "quality": "partial", "quality_score": 0.44600000000000006, "catalog_references": [], "prompt_length": 6902, "files_placed": 0, "status": "discard"}
{"timestamp": 1780941342.433782, "experiment_id": "2ea1a6d3", "concept_title": "Learning with Errors: Hardness Reductions", "concept_domain": "Computation", "research_mode": "team", "quality": "partial", "quality_score": 0.63, "catalog_references": [], "prompt_length": 10670, "files_placed": 2, "status": "keep"}
{"timestamp": 1780941462.2058632, "experiment_id": "07ee0316", "concept_title": "Rigorous algebraic foundations for probability t", "concept_domain": "Novelty", "research_mode": "team", "quality": "partial", "quality_score": 0.66968, "catalog_references": [], "prompt_length": 21944, "files_placed": 5, "status": "keep"}
{"timestamp": 1780941583.0073218, "experiment_id": "bfb64557", "concept_title": "Quantum Thermodynamics: Landauer's Principle at the Nanoscale", "concept_domain": "Physics", "research_mode": "team", "quality": "partial", "quality_score": 0.18304, "catalog_references": [], "prompt_length": 4699, "files_placed": 1, "status": "discard"}
{"timestamp": 1780943719.9451118, "experiment_id": "ed948339", "concept_title": "Formal framework for understanding mathematica", "concept_domain": "Logic", "research_mode": "team", "quality": "partial", "quality_score": 0.38784, "catalog_references": [], "prompt_length": 29452, "files_placed": 1, "status": "discard"}
{"timestamp": 1780945434.6338336, "experiment_id": "84d24cbc", "concept_title": "Transreal Arithmetic: Computing Beyond Plus-Minus Infinity", "concept_domain": "Applications", "research_mode": "team", "quality": "partial", "quality_score": 0.62584, "catalog_references": [], "prompt_length": 10938, "files_placed": 3, "status": "keep"}
{"timestamp": 1780945453.149994, "experiment_id": "d11f9df9", "concept_title": "Mind vs G\u00f6del: Can Minds Outperform Algorithms?", "concept_domain": "Computation", "research_mode": "team", "quality": "partial", "quality_score": 0.34624, "catalog_references": [], "prompt_length": 6997, "files_placed": 0, "status": "discard"}
{"timestamp": 1780945869.9174607, "experiment_id": "0b56e846", "concept_title": "Hilbert 6: Axiomatization of Physics", "concept_domain": "Shared", "research_mode": "team", "quality": "partial", "quality_score": 0.6128, "catalog_references": [], "prompt_length": 10874, "files_placed": 3, "status": "keep"}
{"timestamp": 1780945901.7096162, "experiment_id": "06d6e7ea", "concept_title": "Consciousness as Integrated Information: Mathematical Foundations", "concept_domain": "Logic", "research_mode": "team", "quality": "partial", "quality_score": 0.2988, "catalog_references": [], "prompt_length": 4848, "files_placed": 1, "status": "discard"}
{"timestamp": 1780946616.199093, "experiment_id": "84afe602", "concept_title": "Retrocausal Mathematics: Where Effects Precede Causes", "concept_domain": "MachineLearning", "research_mode": "team", "quality": "partial", "quality_score": 0.38424, "catalog_references": [], "prompt_length": 7019, "files_placed": 1, "status": "discard"}
{"timestamp": 1780946660.6559646, "experiment_id": "df98311e", "concept_title": "BabelCode as a novel mathematical structure", "concept_domain": "Shared", "research_mode": "team", "quality": "partial", "quality_score": 0.37984000000000007, "catalog_references": [], "prompt_length": 28253, "files_placed": 1, "status": "discard"}
{"timestamp": 1780946691.4792469, "experiment_id": "f60f656a", "concept_title": "Post-Quantum Cryptography: Lattice-Based Key Exchange", "concept_domain": "Cryptography", "research_mode": "team", "quality": "partial", "quality_score": 0.35464000000000007, "catalog_references": [], "prompt_length": 4671, "files_placed": 1, "status": "discard"}
{"timestamp": 1780948145.1345847, "experiment_id": "d967b204", "concept_title": "Speculative: The Universe Computes Its Own Existence (Physics = Computation)", "concept_domain": "Applications", "research_mode": "team", "quality": "partial", "quality_score": 0.26704000000000006, "catalog_references": [], "prompt_length": 5092, "files_placed": 1, "status": "discard"}
{"timestamp": 1780949177.848248, "experiment_id": "18efbb83", "concept_title": "Bridge: Logic of Provability and Fixed Points in Arithmetic", "concept_domain": "Logic", "research_mode": "team", "quality": "partial", "quality_score": 0.2552, "catalog_references": [], "prompt_length": 12417, "files_placed": 1, "status": "discard"}
{"timestamp": 1780950602.4261782, "experiment_id": "4c2eabf0", "concept_title": "Self-Modifying Code That Cannot Be Stopped", "concept_domain": "Geometry", "research_mode": "team", "quality": "partial", "quality_score": 0.5661575824175824, "catalog_references": [], "prompt_length": 12449, "files_placed": 1, "status": "keep"}
{"timestamp": 1780952658.6926458, "experiment_id": "1c0dbe4c", "concept_title": "Topological Quantum Compiling: Braid Groups as Universal Gates", "concept_domain": "Cryptography", "research_mode": "team", "quality": "partial", "quality_score": 0.16458535613769215, "catalog_references": [], "prompt_length": 9260, "files_placed": 246, "status": "discard"}
{"timestamp": 1780952983.4016328, "experiment_id": "5d44a47d", "concept_title": "Rigorous mathematical dictionary between holographic gr", "concept_domain": "Bridges", "research_mode": "team", "quality": "partial", "quality_score": 0.32509295774647884, "catalog_references": [], "prompt_length": 23688, "files_placed": 225, "status": "discard"}
{"timestamp": 1780953042.0415654, "experiment_id": "057f23ce", "concept_title": "The Poincare Conjecture for Data: Manifold Detection via Persistent Homology", "concept_domain": "Applications", "research_mode": "team", "quality": "partial", "quality_score": 0.16743922555663115, "catalog_references": [], "prompt_length": 16616, "files_placed": 7, "status": "discard"}
{"timestamp": 1780956294.8029926, "experiment_id": "fe48c4d8", "concept_title": "The Mathematics of Memes: Viral Information Topology", "concept_domain": "Cryptography", "research_mode": "team", "quality": "partial", "quality_score": 0.1702470339135116, "catalog_references": [], "prompt_length": 10044, "files_placed": 268, "status": "discard"}
{"timestamp": 1780960499.3386433, "experiment_id": "3e08a09f", "concept_title": "Stereographic Sheaf Theory: Gluing Data on Spheres", "concept_domain": "Geometry", "research_mode": "team", "quality": "partial", "quality_score": 0.36175999999999997, "catalog_references": [], "prompt_length": 9846, "files_placed": 1, "status": "discard"}
{"timestamp": 1780960533.4868023, "experiment_id": "899432dd", "concept_title": "Hilbert 16: Topology of Algebraic Curves", "concept_domain": "Geometry", "research_mode": "team", "quality": "partial", "quality_score": 0.19072647058823533, "catalog_references": [], "prompt_length": 7140, "files_placed": 20, "status": "discard"}
{"timestamp": 1780960587.6509106, "experiment_id": "f2eb6cb3", "concept_title": "Foundational contraction theory for the EML operator", "concept_domain": "Algebra", "research_mode": "team", "quality": "partial", "quality_score": 0.174, "catalog_references": [], "prompt_length": 23456, "files_placed": 9, "status": "discard"}
{"timestamp": 1780960625.3551593, "experiment_id": "549f2939", "concept_title": "Rigorous Lean 4 formalization of provability logic (GL)", "concept_domain": "Pythagorean", "research_mode": "team", "quality": "partial", "quality_score": 0.15704, "catalog_references": [], "prompt_length": 29552, "files_placed": 11, "status": "discard"}
{"timestamp": 1780960664.0182939, "experiment_id": "a2ba6239", "concept_title": "Knots That Think: Cognition as Braiding in Category Theory", "concept_domain": "Physics", "research_mode": "team", "quality": "partial", "quality_score": 0.206359902200489, "catalog_references": [], "prompt_length": 7520, "files_placed": 18, "status": "discard"}
{"timestamp": 1780960704.1686783, "experiment_id": "08293a01", "concept_title": "Time Travel Consistency: Novikov's Principle as a Fixed-Point Theorem", "concept_domain": "Algebra", "research_mode": "team", "quality": "partial", "quality_score": 0.15631270611057227, "catalog_references": [], "prompt_length": 7281, "files_placed": 29, "status": "discard"}
{"timestamp": 1780962893.0922709, "experiment_id": "0afbba2f", "concept_title": "Reverse Mathematics: Ramsey's Theorem", "concept_domain": "Shared", "research_mode": "team", "quality": "partial", "quality_score": 0.17292350364963505, "catalog_references": [], "prompt_length": 6969, "files_placed": 17, "status": "discard"}
{"timestamp": 1780963064.1416519, "experiment_id": "efa69ffd", "concept_title": "Homotopy Type Theory Foundations", "concept_domain": "Geometry", "research_mode": "team", "quality": "partial", "quality_score": 0.18504, "catalog_references": [], "prompt_length": 4954, "files_placed": 32, "status": "discard"}
{"timestamp": 1780965227.4894896, "experiment_id": "9ff4961b", "concept_title": "Rigorous foundation for probability theory ove", "concept_domain": "Bridges", "research_mode": "team", "quality": "partial", "quality_score": 0.3308, "catalog_references": [], "prompt_length": 29162, "files_placed": 8, "status": "discard"}
{"timestamp": 1780965263.7543352, "experiment_id": "53f842c3", "concept_title": "Rigorous algebraic foundations for probability t", "concept_domain": "Tropical", "research_mode": "team", "quality": "partial", "quality_score": 0.23440000000000003, "catalog_references": [], "prompt_length": 29550, "files_placed": 13, "status": "discard"}
{"timestamp": 1780965301.2908077, "experiment_id": "f8b9d9f4", "concept_title": "Scaling Laws from Statistical Mechanics", "concept_domain": "MachineLearning", "research_mode": "team", "quality": "partial", "quality_score": 0.17075260663507108, "catalog_references": [], "prompt_length": 4941, "files_placed": 17, "status": "discard"}
{"timestamp": 1780965934.297383, "experiment_id": "832ede28", "concept_title": "Research Depth via Proof-Theoretic Ordinal Analysis", "concept_domain": "Logic", "research_mode": "team", "quality": "partial", "quality_score": 0.1827669603524229, "catalog_references": [], "prompt_length": 7095, "files_placed": 0, "status": "discard"}
{"timestamp": 1780968074.9683454, "experiment_id": "45ebbcc6", "concept_title": "Spectral Universality of Proof Graphs: A Phase Transition in Formal Mathematics", "concept_domain": "Applications", "research_mode": "team", "quality": "partial", "quality_score": 0.26573323843416374, "catalog_references": [], "prompt_length": 9657, "files_placed": 0, "status": "discard"}
{"timestamp": 1780969225.7778459, "experiment_id": "5df2a894", "concept_title": "The Poincare Conjecture for Data: Manifold Detection via Persistent Homology", "concept_domain": "Computation", "research_mode": "team", "quality": "partial", "quality_score": 0.1741514826653553, "catalog_references": [], "prompt_length": 9632, "files_placed": 0, "status": "discard"}
{"timestamp": 1780969288.5875914, "experiment_id": "fbe0932d", "concept_title": "The Hodge Conjecture for Neural Networks: Algebraic Cycles in Decision Surfaces", "concept_domain": "Applications", "research_mode": "team", "quality": "partial", "quality_score": 0.15391535386785798, "catalog_references": [], "prompt_length": 9829, "files_placed": 0, "status": "discard"}
{"timestamp": 1780969340.6964138, "experiment_id": "2a933571", "concept_title": "Crystallographic Groups and Music: The 17 Wallpaper Groups of Rhythm", "concept_domain": "MachineLearning", "research_mode": "team", "quality": "partial", "quality_score": 0.23111329479768788, "catalog_references": [], "prompt_length": 10440, "files_placed": 0, "status": "discard"}
{"timestamp": 1780969397.645465, "experiment_id": "c2963b34", "concept_title": "Speculative: Topological Data Analysis of Theorem Networks", "concept_domain": "Novelty", "research_mode": "team", "quality": "partial", "quality_score": 0.23950851334180434, "catalog_references": [], "prompt_length": 7650, "files_placed": 0, "status": "discard"}
{"timestamp": 1780969439.4054363, "experiment_id": "eecdaba4", "concept_title": "Fractal Number Theory: Hausdorff Dimension of Prime Distributions", "concept_domain": "Algebra", "research_mode": "team", "quality": "partial", "quality_score": 0.27753873383253913, "catalog_references": [], "prompt_length": 10479, "files_placed": 0, "status": "discard"}
{"timestamp": 1780969650.1376863, "experiment_id": "5c9fb54c", "concept_title": "Time Travel Consistency: Novikov's Principle as a Fixed-Point Theorem", "concept_domain": "MachineLearning", "research_mode": "team", "quality": "partial", "quality_score": 0.1939310344827586, "catalog_references": [], "prompt_length": 4946, "files_placed": 0, "status": "discard"}
{"timestamp": 1780970966.0990741, "experiment_id": "8eba50e4", "concept_title": "Prime Resonance Spectroscopy: Detecting Arithmetic Structure Through Physical Sp", "concept_domain": "Novelty", "research_mode": "team", "quality": "partial", "quality_score": 0.2674233518312986, "catalog_references": [], "prompt_length": 9346, "files_placed": 0, "status": "discard"}
{"timestamp": 1780973204.1819313, "experiment_id": "91859018", "concept_title": "Entropy Power Inequality: Sharp Version", "concept_domain": "Bridges", "research_mode": "team", "quality": "partial", "quality_score": 0.29236939816388985, "catalog_references": [], "prompt_length": 7047, "files_placed": 0, "status": "discard"}
{"timestamp": 1780973360.3030007, "experiment_id": "7acd9b70", "concept_title": "Idempotent Probability: Large Deviations", "concept_domain": "Tropical", "research_mode": "team", "quality": "partial", "quality_score": 0.19916530789245446, "catalog_references": [], "prompt_length": 4741, "files_placed": 0, "status": "discard"}
{"timestamp": 1780973502.0633435, "experiment_id": "1d41288a", "concept_title": "Arithmetic Mirror Symmetry for Calabi-Yau", "concept_domain": "Bridges", "research_mode": "team", "quality": "partial", "quality_score": 0.27996726677577743, "catalog_references": [], "prompt_length": 7103, "files_placed": 0, "status": "discard"}
{"timestamp": 1780973652.3359025, "experiment_id": "7ab762ac", "concept_title": "Certified Novelty Detection for Theorem Provers", "concept_domain": "Logic", "research_mode": "team", "quality": "partial", "quality_score": 0.2135564586357039, "catalog_references": [], "prompt_length": 4431, "files_placed": 0, "status": "discard"}
{"timestamp": 1780975189.4366684, "experiment_id": "51a047ff", "concept_title": "Borges' Library of Babel: Combinatorics of Everything", "concept_domain": "Bridges", "research_mode": "team", "quality": "partial", "quality_score": 0.23552532247114732, "catalog_references": [], "prompt_length": 7325, "files_placed": 0, "status": "discard"}
{"timestamp": 1780975253.1168118, "experiment_id": "4b4f0c24", "concept_title": "Zombies and Qualia: Mathematics of Subjective Experience", "concept_domain": "Algebra", "research_mode": "team", "quality": "partial", "quality_score": 0.32443692307692307, "catalog_references": [], "prompt_length": 15748, "files_placed": 115, "status": "discard"}
{"timestamp": 1780975858.3216822, "experiment_id": "eb24b008", "concept_title": "Automatic Sequences and the Halting Problem: When Is a Sequence Computable?", "concept_domain": "Cryptography", "research_mode": "team", "quality": "partial", "quality_score": 0.2555747474747475, "catalog_references": [], "prompt_length": 7946, "files_placed": 0, "status": "discard"}
{"timestamp": 1780977948.8449051, "experiment_id": "17e8812c", "concept_title": "**Entropy-Bounded Computation (EBC)** framew", "concept_domain": "Computation", "research_mode": "team", "quality": "partial", "quality_score": 0.4813003957285953, "catalog_references": [], "prompt_length": 27503, "files_placed": 116, "status": "discard"}
{"timestamp": 1780978021.863584, "experiment_id": "c71e53b1", "concept_title": "Symplectic Mirror Descent: Gromov-Witten Invariants as a Count of Learnable Mini", "concept_domain": "MachineLearning", "research_mode": "team", "quality": "partial", "quality_score": 0.4695990099009901, "catalog_references": [], "prompt_length": 16601, "files_placed": 11, "status": "discard"}
{"timestamp": 1780978096.8010726, "experiment_id": "720cb173", "concept_title": "Stereographic Capacity Theory: Packing Bounds on Spheres via Plane Geometry", "concept_domain": "Geometry", "research_mode": "team", "quality": "partial", "quality_score": 0.43760083148790374, "catalog_references": [], "prompt_length": 16690, "files_placed": 24, "status": "discard"}
{"timestamp": 1780978132.3988996, "experiment_id": "0320765b", "concept_title": "Proof Phase Transitions: Sharp Thresholds in Random Formal Theories", "concept_domain": "Physics", "research_mode": "team", "quality": "partial", "quality_score": 0.434768389530459, "catalog_references": [], "prompt_length": 16442, "files_placed": 4, "status": "discard"}
{"timestamp": 1780978192.2492244, "experiment_id": "40370763", "concept_title": "Impossible Geometries: Where Parallel Lines Converge AND Diverge", "concept_domain": "Computation", "research_mode": "team", "quality": "partial", "quality_score": 0.47002089837753586, "catalog_references": [], "prompt_length": 16810, "files_placed": 5, "status": "discard"}
{"timestamp": 1780980270.2692685, "experiment_id": "9a030c9f", "concept_title": "ML Reinforcement Learning: Convergence of Policy Gradient Methods", "concept_domain": "MachineLearning", "research_mode": "team", "quality": "partial", "quality_score": 0.3486496, "catalog_references": [], "prompt_length": 4763, "files_placed": 0, "status": "discard"}
{"timestamp": 1780982401.3873644, "experiment_id": "debd806e", "concept_title": "The current framework models theories by their set of provably well-ordered ordi", "concept_domain": "Pythagorean", "research_mode": "team", "quality": "partial", "quality_score": 0.38829994947581153, "catalog_references": [], "prompt_length": 20076, "files_placed": 4, "status": "discard"}
{"timestamp": 1780984441.8828971, "experiment_id": "c60fd603", "concept_title": "P vs NP Problem", "concept_domain": "Logic", "research_mode": "team", "quality": "partial", "quality_score": 0.36869585004880756, "catalog_references": [], "prompt_length": 15577, "files_placed": 1, "status": "discard"}
{"timestamp": 1780984483.2544942, "experiment_id": "812a22a6", "concept_title": "Bridge: Model Theory and Algebra \u2014 Ax-Kochen and Morley's Theorem", "concept_domain": "Bridges", "research_mode": "team", "quality": "partial", "quality_score": 0.38226993545631915, "catalog_references": [], "prompt_length": 15816, "files_placed": 1, "status": "discard"}
{"timestamp": 1780984541.505727, "experiment_id": "475cd2f0", "concept_title": "**Causal Integration Algebra** \u2014 a rigorous lattice-t", "concept_domain": "Shared", "research_mode": "team", "quality": "partial", "quality_score": 0.3940269741676302, "catalog_references": [], "prompt_length": 25079, "files_placed": 1, "status": "discard"}
{"timestamp": 1780984582.1157808, "experiment_id": "f8049429", "concept_title": "Arithmetic Mirror Symmetry for Calabi-Yau", "concept_domain": "Applications", "research_mode": "team", "quality": "partial", "quality_score": 0.37070314951345035, "catalog_references": [], "prompt_length": 15584, "files_placed": 1, "status": "discard"}
{"timestamp": 1780984631.176433, "experiment_id": "820c5814", "concept_title": "This document describes five research conjectures extending the", "concept_domain": "Pythagorean", "research_mode": "team", "quality": "partial", "quality_score": 0.36626310656657907, "catalog_references": [], "prompt_length": 20828, "files_placed": 1, "status": "discard"}
{"timestamp": 1780984684.7349398, "experiment_id": "362ed1b3", "concept_title": "Dream Logic: Non-Monotone Reasoning Where Contradictions Coexist", "concept_domain": "Bridges", "research_mode": "team", "quality": "partial", "quality_score": 0.3800936166615896, "catalog_references": [], "prompt_length": 15703, "files_placed": 1, "status": "discard"}
{"timestamp": 1780986720.764154, "experiment_id": "b24021ad", "concept_title": "Phantom Topologies: Spaces That Change When You Look at Them", "concept_domain": "Pythagorean", "research_mode": "team", "quality": "partial", "quality_score": 0.39600623889137887, "catalog_references": [], "prompt_length": 7076, "files_placed": 0, "status": "discard"}
{"timestamp": 1780986753.769981, "experiment_id": "c3a9d1ce", "concept_title": "Scaling Laws from Statistical Mechanics", "concept_domain": "Applications", "research_mode": "team", "quality": "partial", "quality_score": 0.4156669498069498, "catalog_references": [], "prompt_length": 4397, "files_placed": 0, "status": "discard"}
{"timestamp": 1780986784.9939423, "experiment_id": "0cd8d761", "concept_title": "Entropy as a Topological Invariant: The Boltzmann Bridge", "concept_domain": "Applications", "research_mode": "team", "quality": "partial", "quality_score": 0.40707363366756116, "catalog_references": [], "prompt_length": 6908, "files_placed": 0, "status": "discard"}
{"timestamp": 1780988685.9380512, "experiment_id": "c8728b9d", "concept_title": "Quantum Key Distribution: BB84 Security Proof", "concept_domain": "Cryptography", "research_mode": "team", "quality": "partial", "quality_score": 0.36854940187663987, "catalog_references": [], "prompt_length": 4669, "files_placed": 0, "status": "discard"}
