{"timestamp": 1781124191.5143251, "experiment_id": "00ce84b1", "concept_title": "The file `Catalog/Bridges/AxKochenMorleyBridge.lean` installs the ultraproduct", "concept_domain": "Applications", "research_mode": "team", "quality": "partial", "quality_score": 0.32451008870214754, "catalog_references": [], "prompt_length": 20737, "files_placed": 0, "status": "discard"}
{"timestamp": 1781124295.2210548, "experiment_id": "e2bef75b", "concept_title": "Formalize the Paley construction: for any prime power q \u2261 3 (mod 4), there exist", "concept_domain": "Logic", "research_mode": "team", "quality": "partial", "quality_score": 0.4434246153846155, "catalog_references": [], "prompt_length": 15173, "files_placed": 0, "status": "discard"}
{"timestamp": 1781124374.382402, "experiment_id": "e217a1b1", "concept_title": "Tropical Moduli Spaces: Curves and Their Tropical Counterparts", "concept_domain": "Geometry", "research_mode": "team", "quality": "partial", "quality_score": 0.4261573368827076, "catalog_references": [], "prompt_length": 6225, "files_placed": 0, "status": "discard"}
{"timestamp": 1781124459.9272053, "experiment_id": "ffffd322", "concept_title": "Post-Quantum Lattice Cryptography: Formal Security Proofs", "concept_domain": "Cryptography", "research_mode": "team", "quality": "partial", "quality_score": 0.36671129411764714, "catalog_references": [], "prompt_length": 11174, "files_placed": 0, "status": "discard"}
{"timestamp": 1781124530.9254215, "experiment_id": "fd181df7", "concept_title": "Close Proofs: Close Proofs: Quantum Error Correction Threshold: The Eastin-Knill The", "concept_domain": "Computation", "research_mode": "team", "quality": "partial", "quality_score": 0.42357318160365787, "catalog_references": [], "prompt_length": 6891, "files_placed": 0, "status": "discard"}
{"timestamp": 1781124616.2049239, "experiment_id": "8ea0e641", "concept_title": "The current formalization treats Hodge diamonds as arbitrary integer-valued func", "concept_domain": "Pythagorean", "research_mode": "team", "quality": "partial", "quality_score": 0.378, "catalog_references": [], "prompt_length": 13421, "files_placed": 0, "status": "discard"}
{"timestamp": 1781128371.5784996, "experiment_id": "2638f844", "concept_title": "Integrated Information via Tensor Networks", "concept_domain": "Shared", "research_mode": "team", "quality": "partial", "quality_score": 0.42191773835920177, "catalog_references": [], "prompt_length": 11551, "files_placed": 0, "status": "discard"}
{"timestamp": 1781128527.8452175, "experiment_id": "cab85dcf", "concept_title": "The new file `Catalog/Tropical/HodgeDecomposition/Orthogonal.lean` completes the", "concept_domain": "Algebra", "research_mode": "team", "quality": "partial", "quality_score": 0.3900093082880798, "catalog_references": [], "prompt_length": 16515, "files_placed": 0, "status": "discard"}
{"timestamp": 1781128765.5577495, "experiment_id": "8c713bbe", "concept_title": "This document extends the work in `Pythagorean/DiffusionKLConvergence.lean`, whi", "concept_domain": "Physics", "research_mode": "team", "quality": "partial", "quality_score": 0.3908790523088358, "catalog_references": [], "prompt_length": 19137, "files_placed": 0, "status": "discard"}
{"timestamp": 1781128844.8224573, "experiment_id": "241100d4", "concept_title": "Stereographic Neural Attention: Attention via Riemann Sphere", "concept_domain": "MachineLearning", "research_mode": "team", "quality": "partial", "quality_score": 0.3374156535885168, "catalog_references": [], "prompt_length": 17107, "files_placed": 1, "status": "discard"}
{"timestamp": 1781128879.425335, "experiment_id": "9738390e", "concept_title": "Chaos and the Three-Body Problem: Lyapunov Exponent Bounds", "concept_domain": "Physics", "research_mode": "team", "quality": "partial", "quality_score": 0.29760835555555554, "catalog_references": [], "prompt_length": 16824, "files_placed": 1, "status": "discard"}
{"timestamp": 1781128901.646025, "experiment_id": "5d66afc2", "concept_title": "Quantum Hamiltonian Complexity: QMA-Completeness of the Local Hamiltonian Problem", "concept_domain": "Shared", "research_mode": "team", "quality": "partial", "quality_score": 0.3896, "catalog_references": [], "prompt_length": 16801, "files_placed": 1, "status": "discard"}
{"timestamp": 1781128920.2372746, "experiment_id": "ec9ae728", "concept_title": "Information-Geometric Bridge: Fisher Metric on Statistical Manifolds", "concept_domain": "Bridges", "research_mode": "team", "quality": "partial", "quality_score": 0.4768899999999999, "catalog_references": [], "prompt_length": 16825, "files_placed": 1, "status": "discard"}
{"timestamp": 1781128941.353797, "experiment_id": "4471cf7c", "concept_title": "Topological Quantum Computing: Braiding Universality", "concept_domain": "Bridges", "research_mode": "team", "quality": "partial", "quality_score": 0.5569047368421052, "catalog_references": [], "prompt_length": 16723, "files_placed": 2, "status": "keep"}
{"timestamp": 1781128961.5444543, "experiment_id": "23e7b223", "concept_title": "The file `Physics/TopologicalOrderGenus.lean` establishes, for an *abelian* anyo", "concept_domain": "Applications", "research_mode": "team", "quality": "partial", "quality_score": 0.6609863414634147, "catalog_references": [], "prompt_length": 22396, "files_placed": 1, "status": "keep"}
{"timestamp": 1781131049.105292, "experiment_id": "d6bf7ce0", "concept_title": "The edge bound |E| \u2264 3g \u2212 3 we proved here is for *unmarked* stable tropical cur", "concept_domain": "Pythagorean", "research_mode": "team", "quality": "partial", "quality_score": 0.3868614165457185, "catalog_references": [], "prompt_length": 21327, "files_placed": 0, "status": "discard"}
{"timestamp": 1781131180.3102777, "experiment_id": "f1c99be3", "concept_title": "Close Proofs: Impossible Geometries: Where Parallel Lines Converge AND Diverge", "concept_domain": "Applications", "research_mode": "team", "quality": "partial", "quality_score": 0.3651392868217055, "catalog_references": [], "prompt_length": 6395, "files_placed": 0, "status": "discard"}
{"timestamp": 1781131290.2197552, "experiment_id": "fee96555", "concept_title": "The natural next step is to formalize the actual probabilistic phase transition.", "concept_domain": "Computation", "research_mode": "team", "quality": "partial", "quality_score": 0.3594902836578348, "catalog_references": [], "prompt_length": 18055, "files_placed": 0, "status": "discard"}
{"timestamp": 1781133264.0825312, "experiment_id": "e3fcd50e", "concept_title": "The new file `Catalog/Shared/MeasurableCardinal.lean` formalizes measurable card", "concept_domain": "Pythagorean", "research_mode": "team", "quality": "partial", "quality_score": 0.3469220748860228, "catalog_references": [], "prompt_length": 18417, "files_placed": 0, "status": "discard"}
{"timestamp": 1781133296.0383248, "experiment_id": "95c08983", "concept_title": "This cycle attacked the Regev LWE encryption scheme from two complementary", "concept_domain": "Cryptography", "research_mode": "team", "quality": "partial", "quality_score": 0.3469712247785379, "catalog_references": [], "prompt_length": 23103, "files_placed": 0, "status": "discard"}
{"timestamp": 1781135282.7175384, "experiment_id": "79281e3c", "concept_title": "Entropy as a Topological Invariant: The Boltzmann Bridge", "concept_domain": "Geometry", "research_mode": "team", "quality": "partial", "quality_score": 0.3635493566393747, "catalog_references": [], "prompt_length": 8437, "files_placed": 0, "status": "discard"}
{"timestamp": 1781135441.2114751, "experiment_id": "c98f24ec", "concept_title": "Close Proofs: Proof Phase Transitions: Sharp Thresholds in Random Formal Theories", "concept_domain": "Tropical", "research_mode": "team", "quality": "partial", "quality_score": 0.49017348115299336, "catalog_references": [], "prompt_length": 16955, "files_placed": 42, "status": "discard"}
{"timestamp": 1781136434.444321, "experiment_id": "1320de4c", "concept_title": "The Basin Fixed Point Theorem shows that basin count = fixed point count for des", "concept_domain": "Geometry", "research_mode": "team", "quality": "partial", "quality_score": 0.3913445195644401, "catalog_references": [], "prompt_length": 20623, "files_placed": 0, "status": "discard"}
{"timestamp": 1781138308.1745117, "experiment_id": "7362a3dd", "concept_title": "Machine Learning Generalization Bounds", "concept_domain": "Cryptography", "research_mode": "team", "quality": "partial", "quality_score": 0.4236063843078461, "catalog_references": [], "prompt_length": 6529, "files_placed": 0, "status": "discard"}
{"timestamp": 1781140190.695098, "experiment_id": "17cbb16f", "concept_title": "Unique Games Conjecture", "concept_domain": "Cryptography", "research_mode": "team", "quality": "partial", "quality_score": 0.4253431241741524, "catalog_references": [], "prompt_length": 6424, "files_placed": 0, "status": "discard"}
{"timestamp": 1781142067.583975, "experiment_id": "a5bf1c83", "concept_title": "The current `OrdinalTheory` framework works with abstract `Ordinal` values from ", "concept_domain": "Novelty", "research_mode": "team", "quality": "partial", "quality_score": 0.454414139145638, "catalog_references": [], "prompt_length": 21757, "files_placed": 66, "status": "discard"}
{"timestamp": 1781142142.9814048, "experiment_id": "7648a3c9", "concept_title": "The entry point machinery developed here (fibEntryPoint, its divisibility proper", "concept_domain": "MachineLearning", "research_mode": "team", "quality": "partial", "quality_score": 0.3329574811176632, "catalog_references": [], "prompt_length": 20169, "files_placed": 0, "status": "discard"}
{"timestamp": 1781142168.0115168, "experiment_id": "aff165fb", "concept_title": "Close Proofs: Proof Phase Transitions: Sharp Thresholds in Random Formal Theories", "concept_domain": "Applications", "research_mode": "team", "quality": "partial", "quality_score": 0.4031388697788698, "catalog_references": [], "prompt_length": 6388, "files_placed": 0, "status": "discard"}
{"timestamp": 1781142196.9610174, "experiment_id": "8d53ae41", "concept_title": "Arithmetic Mirror Symmetry for Calabi-Yau", "concept_domain": "Logic", "research_mode": "team", "quality": "partial", "quality_score": 0.42470178571428574, "catalog_references": [], "prompt_length": 5954, "files_placed": 0, "status": "discard"}
{"timestamp": 1781142221.3621736, "experiment_id": "8d66e4da", "concept_title": "*deterministic skeleton* of derivability phase", "concept_domain": "Logic", "research_mode": "team", "quality": "partial", "quality_score": 0.42522623729562525, "catalog_references": [], "prompt_length": 20961, "files_placed": 0, "status": "discard"}
{"timestamp": 1781144115.0521073, "experiment_id": "7d6218a6", "concept_title": "The current framework models theories by their set of provably well-ordered ordi", "concept_domain": "Applications", "research_mode": "team", "quality": "partial", "quality_score": 0.46927067836885566, "catalog_references": [], "prompt_length": 21226, "files_placed": 44, "status": "discard"}
{"timestamp": 1781144164.09566, "experiment_id": "78c4e8f5", "concept_title": "Linear Merkle\u2013Damg\u00e5rd collision-resistance theory", "concept_domain": "Novelty", "research_mode": "team", "quality": "partial", "quality_score": 0.4773509441849254, "catalog_references": [], "prompt_length": 22657, "files_placed": 7, "status": "discard"}
{"timestamp": 1781144242.467867, "experiment_id": "c47fbb21", "concept_title": "Close Proofs: The current `OrdinalTheory` framework works with abstract `Ordinal` va", "concept_domain": "Shared", "research_mode": "team", "quality": "partial", "quality_score": 0.42200000000000004, "catalog_references": [], "prompt_length": 6381, "files_placed": 0, "status": "discard"}
{"timestamp": 1781146122.0304089, "experiment_id": "b8886441", "concept_title": "Hilbert 6: Axiomatization of Physics", "concept_domain": "Novelty", "research_mode": "team", "quality": "partial", "quality_score": 0.44834526528023205, "catalog_references": [], "prompt_length": 16740, "files_placed": 58, "status": "discard"}
{"timestamp": 1781146148.491713, "experiment_id": "eb8717f2", "concept_title": "We formalized the **Causal Integration Algebra** in two Lean 4 files (`Shared/Ca", "concept_domain": "Physics", "research_mode": "team", "quality": "partial", "quality_score": 0.46921741935483874, "catalog_references": [], "prompt_length": 21743, "files_placed": 22, "status": "discard"}
{"timestamp": 1781146176.278304, "experiment_id": "317cfc85", "concept_title": "This cycle took the *single-modulus* law of apparition from the catalog", "concept_domain": "Pythagorean", "research_mode": "team", "quality": "partial", "quality_score": 0.46447560918026837, "catalog_references": [], "prompt_length": 23793, "files_placed": 6, "status": "discard"}
{"timestamp": 1781146202.964474, "experiment_id": "1a6f930f", "concept_title": "Close Proofs: Close Proofs: Proof Phase Transitions: Sharp Thresholds in Random Form", "concept_domain": "Physics", "research_mode": "team", "quality": "partial", "quality_score": 0.36751286409151446, "catalog_references": [], "prompt_length": 6387, "files_placed": 0, "status": "discard"}
{"timestamp": 1781148130.7544274, "experiment_id": "b6687db3", "concept_title": "Close Proofs: Linear Merkle\u2013Damg\u00e5rd collision-resistance theory", "concept_domain": "Algebra", "research_mode": "team", "quality": "substantial", "quality_score": 0.7437351655629141, "catalog_references": [], "prompt_length": 16936, "files_placed": 24, "status": "keep"}
{"timestamp": 1781148156.2756279, "experiment_id": "ad1404ec", "concept_title": "Close Proofs: *deterministic skeleton* of derivability phase", "concept_domain": "Novelty", "research_mode": "team", "quality": "partial", "quality_score": 0.3626139077911156, "catalog_references": [], "prompt_length": 6853, "files_placed": 0, "status": "discard"}
{"timestamp": 1781148182.303391, "experiment_id": "efe2e688", "concept_title": "Close Proofs: Hilbert 6: Axiomatization of Physics", "concept_domain": "Applications", "research_mode": "team", "quality": "partial", "quality_score": 0.3666701298701299, "catalog_references": [], "prompt_length": 6859, "files_placed": 0, "status": "discard"}
{"timestamp": 1781150064.55558, "experiment_id": "f10a3386", "concept_title": "Our `exists_revSim_of_surjective` proves that surjective endofunctions on `Fin n", "concept_domain": "Computation", "research_mode": "team", "quality": "partial", "quality_score": 0.39285247847509086, "catalog_references": [], "prompt_length": 17219, "files_placed": 0, "status": "discard"}
{"timestamp": 1781150092.3437247, "experiment_id": "f5768dbe", "concept_title": "Close Proofs: ML Generalization Bounds: Rademacher Complexity of Neural Networks", "concept_domain": "Applications", "research_mode": "team", "quality": "partial", "quality_score": 0.42712674710910004, "catalog_references": [], "prompt_length": 6409, "files_placed": 0, "status": "discard"}
{"timestamp": 1781150117.6031241, "experiment_id": "801819be", "concept_title": "Close Proofs: The exponential decay bound `diffusionAlphaBar_exp_bound` shows that t", "concept_domain": "Applications", "research_mode": "team", "quality": "partial", "quality_score": 0.4257391053254438, "catalog_references": [], "prompt_length": 6899, "files_placed": 0, "status": "discard"}
{"timestamp": 1781150141.474571, "experiment_id": "d689d82a", "concept_title": "Foundational analytic infrastructure for formalizing", "concept_domain": "Computation", "research_mode": "team", "quality": "partial", "quality_score": 0.4247071324712644, "catalog_references": [], "prompt_length": 21223, "files_placed": 0, "status": "discard"}
{"timestamp": 1781152069.9361813, "experiment_id": "9cb11ef6", "concept_title": "Combinatorial-Categorical Bridge: Species of Structures as Functors", "concept_domain": "Bridges", "research_mode": "team", "quality": "partial", "quality_score": 0.4053302972651605, "catalog_references": [], "prompt_length": 11252, "files_placed": 0, "status": "discard"}
{"timestamp": 1781152130.1091359, "experiment_id": "d1cd701c", "concept_title": "Natural Proofs Barrier: Formalization", "concept_domain": "Novelty", "research_mode": "team", "quality": "partial", "quality_score": 0.42301492299904075, "catalog_references": [], "prompt_length": 5958, "files_placed": 0, "status": "discard"}
{"timestamp": 1781152165.619269, "experiment_id": "2d1925a2", "concept_title": "Close Proofs: The file `Physics/TopologicalOrderGenus.lean` establishes, for an *abe", "concept_domain": "Bridges", "research_mode": "team", "quality": "partial", "quality_score": 0.4424218176711069, "catalog_references": [], "prompt_length": 6395, "files_placed": 0, "status": "discard"}
{"timestamp": 1781152201.7567372, "experiment_id": "b76f9023", "concept_title": "Formalize Baker\u2013Norine's tropical Riemann-Roch theorem: for a divisor D on a met", "concept_domain": "Bridges", "research_mode": "team", "quality": "partial", "quality_score": 0.4389612679740952, "catalog_references": [], "prompt_length": 13521, "files_placed": 0, "status": "discard"}
{"timestamp": 1781152236.607201, "experiment_id": "4a120010", "concept_title": "Cobham's theorem (1972) states that if a sequence is both j-automatic and k-auto", "concept_domain": "Applications", "research_mode": "team", "quality": "partial", "quality_score": 0.42428457219251337, "catalog_references": [], "prompt_length": 25499, "files_placed": 0, "status": "discard"}
{"timestamp": 1781154142.4846346, "experiment_id": "bf0d0460", "concept_title": "The Bernoulli Pinsker inequality `(p - q)\u00b2 \u2264 KL(Ber(p) \u2016 Ber(q)) / 2` is now ful", "concept_domain": "Novelty", "research_mode": "team", "quality": "partial", "quality_score": 0.4062769072164949, "catalog_references": [], "prompt_length": 21626, "files_placed": 91, "status": "discard"}
{"timestamp": 1781154172.2181404, "experiment_id": "98b2ef1b", "concept_title": "The geometric convergence theorem (`gdResidual_geometric_decay`) assumes a contr", "concept_domain": "Bridges", "research_mode": "team", "quality": "partial", "quality_score": 0.48764719535476486, "catalog_references": [], "prompt_length": 20797, "files_placed": 16, "status": "discard"}
{"timestamp": 1781154198.10814, "experiment_id": "57276ea9", "concept_title": "These directions extend `Catalog/MachineLearning/RademacherSpectral.lean`, which", "concept_domain": "Novelty", "research_mode": "team", "quality": "partial", "quality_score": 0.42093477633570636, "catalog_references": [], "prompt_length": 16921, "files_placed": 0, "status": "discard"}
{"timestamp": 1781154224.0516465, "experiment_id": "a4e33a5f", "concept_title": "Close Proofs: Close Proofs: Combinatorial-Categorical Bridge: Species of Structures ", "concept_domain": "Novelty", "research_mode": "team", "quality": "partial", "quality_score": 0.40712477582952444, "catalog_references": [], "prompt_length": 11519, "files_placed": 0, "status": "discard"}
{"timestamp": 1781154248.0525568, "experiment_id": "91bb2e2e", "concept_title": "Close Proofs: Natural Proofs Barrier: Formalization", "concept_domain": "Applications", "research_mode": "team", "quality": "partial", "quality_score": 0.39118481398424465, "catalog_references": [], "prompt_length": 6860, "files_placed": 0, "status": "discard"}
{"timestamp": 1781157960.6005015, "experiment_id": "7caf72b5", "concept_title": "Close Proofs: Close Proofs: Poincar\u00e9 Conjecture Revisited: 4D Smooth", "concept_domain": "Novelty", "research_mode": "team", "quality": "partial", "quality_score": 0.3889235286095566, "catalog_references": [], "prompt_length": 11501, "files_placed": 0, "status": "discard"}
{"timestamp": 1781158005.7232285, "experiment_id": "8b64729b", "concept_title": "Tropical Scheme Theory: Groebner Bases over the Tropical Semiring", "concept_domain": "Tropical", "research_mode": "team", "quality": "partial", "quality_score": 0.3080766980392157, "catalog_references": [], "prompt_length": 11260, "files_placed": 0, "status": "discard"}
{"timestamp": 1781158028.6951234, "experiment_id": "1c3d05a7", "concept_title": "Tropical Moduli Spaces: Curves and Their Tropical Counterparts", "concept_domain": "Tropical", "research_mode": "team", "quality": "partial", "quality_score": 0.42216, "catalog_references": [], "prompt_length": 6721, "files_placed": 0, "status": "discard"}
{"timestamp": 1781159935.9465094, "experiment_id": "7797813f", "concept_title": "Homotopy Type Theory Foundations", "concept_domain": "Applications", "research_mode": "team", "quality": "partial", "quality_score": 0.34765556521739127, "catalog_references": [], "prompt_length": 11085, "files_placed": 0, "status": "discard"}
{"timestamp": 1781159956.5351284, "experiment_id": "3f13837e", "concept_title": "The file `Paraconsistent.lean` builds a fully verified (axioms: `propext`, `Clas", "concept_domain": "Tropical", "research_mode": "team", "quality": "substantial", "quality_score": 0.72472, "catalog_references": [], "prompt_length": 22808, "files_placed": 5, "status": "keep"}
{"timestamp": 1781159975.046662, "experiment_id": "8d1c1869", "concept_title": "Information-Geometric Bridge: Fisher Metric on Statistical Manifolds", "concept_domain": "Novelty", "research_mode": "team", "quality": "substantial", "quality_score": 0.7575200000000001, "catalog_references": [], "prompt_length": 16825, "files_placed": 5, "status": "keep"}
{"timestamp": 1781159992.0477188, "experiment_id": "46e45ca8", "concept_title": "This cycle promoted a piece of *proof-internal scaffolding* from the catalog's C", "concept_domain": "Novelty", "research_mode": "team", "quality": "substantial", "quality_score": 0.71902, "catalog_references": [], "prompt_length": 26612, "files_placed": 5, "status": "keep"}
