{"timestamp": 1787648518.215485, "experiment_id": "7957a9f1", "concept_title": "FACT round-75 #3 — U9-DRIFT-POWER-B (exp 569b): letter-of-rule null at 76.8M pairs; both poolings fail independence — twice-gated sub-1 candidate awaits seed 20260825", "concept_domain": "Physics", "research_mode": "team", "quality": "substantial", "quality_score": 0.82, "catalog_references": [], "prompt_length": 28968, "files_placed": 4, "status": "keep"}
{"timestamp": 1787651574.0780375, "experiment_id": "5223d87b", "concept_title": "FACT round-78 #2 — QR-VS-OVERDISPERSION (exp 576): NEW-STRUCTURE-MAP-ENTRY — small-prime QR dial does NOT explain u≈10 overdispersion (best D-red 14.2% vs H1 bar 30%); ≥86% is N-structure beyond every recorded mechanism; papers-136/139 line does not extend to scale; + P̂ RESOLUTION-LIMIT rider on paper 225's erratum thread", "concept_domain": "Logic", "research_mode": "team", "quality": "substantial", "quality_score": 0.75, "catalog_references": [], "prompt_length": 29513, "files_placed": 5, "status": "keep"}
{"timestamp": 1787651588.9618404, "experiment_id": "d3d53c1e", "concept_title": "Parallel residual blocks obey a tensor-product certificate", "concept_domain": "Algebra", "research_mode": "team", "quality": "substantial", "quality_score": 0.82, "catalog_references": [], "prompt_length": 26171, "files_placed": 5, "status": "keep"}
{"timestamp": 1787651604.0074048, "experiment_id": "9b3c75c4", "concept_title": "FACT round-78 #1 — GAP-L4-MEASURE + paper-219 ERRATUM: positional-stratum measure framework F1>F2>F3 — r̄-identity universal object (MC err 0.23%), master inequality S ≤ min(1/(Λ·Θ·q̂), 2^k_bits/(Λ·Θ)) PROVEN via majorization; F3 baseline-conditional after verifier (5.365<5.4054 undercut); table error 29.0698→29.3152 at stored P̂=0.9853, feasibility unaffected; converse roadmap EMPTY", "concept_domain": "Applications", "research_mode": "team", "quality": "substantial", "quality_score": 0.82, "catalog_references": [], "prompt_length": 29092, "files_placed": 4, "status": "keep"}
{"timestamp": 1787655074.8814392, "experiment_id": "a22e921b", "concept_title": "FACT round-77 #2 — K-TAXONOMY (GAP-L8 closed): k_pin / k_opt^cost / k_opt^econ formally defined and never conflated — exact identity econ ≡ census under W ↔ 2(T₀−1), +1.000 resolves paper 219's +~1 note", "concept_domain": "Cryptography", "research_mode": "team", "quality": "substantial", "quality_score": 0.78, "catalog_references": [], "prompt_length": 28677, "files_placed": 4, "status": "keep"}
{"timestamp": 1787658316.0947, "experiment_id": "539def03", "concept_title": "Both endpoints are formalised and the numerics of Section 4 of", "concept_domain": "Pythagorean", "research_mode": "team", "quality": "substantial", "quality_score": 0.83, "catalog_references": [], "prompt_length": 26100, "files_placed": 4, "status": "keep"}
{"timestamp": 1787658329.8503397, "experiment_id": "2111d025", "concept_title": "FACT round-79 #1 — PRODUCT-DIAL-SCALESHIFT (exp 577 + verifyL7b): WINDOW-STRONGER-NOT-SHIFTED — H1 scale-shift REFUTED (no QR window past 400; B*=400 confirms papers-136/139 location), 1/ℓ-weighted dial is the law (48% D-red, saturates by 400, corr .999) — paper-226 SECONDARIES erratum-grade (reciprocity-flip dial-form artifacts, flip 100%-on-condition), its PRIMARY null stands", "concept_domain": "Algebra", "research_mode": "team", "quality": "substantial", "quality_score": 0.78, "catalog_references": [], "prompt_length": 29349, "files_placed": 4, "status": "keep"}
{"timestamp": 1787663590.959152, "experiment_id": "d59c6a1a", "concept_title": "Thin-Shell Counting under a Thickness Budget", "concept_domain": "Cryptography", "research_mode": "team", "quality": "substantial", "quality_score": 0.85, "catalog_references": ["Shared.ShellThicknessSharp", "Shared.ShellThicknessRate"], "prompt_length": 26642, "files_placed": 4, "status": "keep"}
{"timestamp": 1787666736.30603, "experiment_id": "05a687ab", "concept_title": "Formalize normalized gap and pair-correlation statistics for finite spectra.", "concept_domain": "Computation", "research_mode": "team", "quality": "substantial", "quality_score": 0.82, "catalog_references": [], "prompt_length": 26055, "files_placed": 4, "status": "keep"}
{"timestamp": 1787666751.1535568, "experiment_id": "ea4eae2e", "concept_title": "FACT round-79 #2 — HIT-POSITION-STRUCTURE (exp 578): POSITIONAL-STRUCTURE-REAL amended BEYOND-MAGNITUDE — pooled KS D=0.09519 p=6.9e-76 (9565 hits/127 hit-rich Ns, paired control null); stratified check decisive: conditioning on all 8 v-cells RAISES D to 0.10423, 7/8 cells fire, permutation p<0.0005 — real within-N geometry in the smooth locus of j²−N; first positive carrier candidate for the ~39–61% residual", "concept_domain": "NumberTheory", "research_mode": "team", "quality": "substantial", "quality_score": 0.78, "catalog_references": [], "prompt_length": 28870, "files_placed": 4, "status": "keep"}
{"timestamp": 1787673720.2536707, "experiment_id": "128c5007", "concept_title": "FACT round-82 #1 — BINWIDTH-USHIFT-PROBE (exp 582): MIXED-INCONCLUSIVE — STABLE GEOMETRIC WINDOW FEATURE at u*≈0.65; paper 232", "concept_domain": "Computation", "research_mode": "team", "quality": "substantial", "quality_score": 0.74, "catalog_references": [], "prompt_length": 28497, "files_placed": 4, "status": "keep"}
{"timestamp": 1787673738.0152113, "experiment_id": "4c991400", "concept_title": "Matrix-level modular action", "concept_domain": "Shared", "research_mode": "team", "quality": "substantial", "quality_score": 0.8, "catalog_references": [], "prompt_length": 25980, "files_placed": 4, "status": "keep"}
{"timestamp": 1787677016.3951964, "experiment_id": "a32bc1e4", "concept_title": "Destructive verification", "concept_domain": "Combinatorics", "research_mode": "team", "quality": "substantial", "quality_score": 0.82, "catalog_references": [], "prompt_length": 26051, "files_placed": 4, "status": "keep"}
{"timestamp": 1787680021.5793486, "experiment_id": "6247b80f", "concept_title": "The reduction is proved, and the 194 values `c_g(1)` are tabulated", "concept_domain": "Shared", "research_mode": "team", "quality": "substantial", "quality_score": 0.82, "catalog_references": [], "prompt_length": 26027, "files_placed": 4, "status": "keep"}
{"timestamp": 1787684307.8587542, "experiment_id": "a08d5a50", "concept_title": "FACT round-80 #1 — PROFILE-FORM (exp 579): positional layer gets a LAW — small-j hit profile = POWER LAW T(x)≈0.0295·(1+x)^−1.104 (b boot95 [0.991,1.218], Akaike weight 0.987; ΔAICc exp +9.2 / logistic +11.5 degenerate / linear +16.9) — harmonic decline whose bulk IS the Dickman gradient; beyond-Dickman residual PEAKED not monotone: ±20% concave mid-window hump max 1.23 @ x≈0.67 between end deficits 0.80/0.90 (quadratic dAICc 50.5, c-CI [−0.62,−0.14], vertex 0.59 interior), invariant across all three r-brackets; paper-228 follow-up (a) closed", "concept_domain": "NumberTheory", "research_mode": "team", "quality": "substantial", "quality_score": 0.86, "catalog_references": [], "prompt_length": 27293, "files_placed": 4, "status": "keep"}
{"timestamp": 1787684326.403677, "experiment_id": "7b6f9981", "concept_title": "Parametric families", "concept_domain": "NumberTheory", "research_mode": "team", "quality": "substantial", "quality_score": 0.79, "catalog_references": [], "prompt_length": 25983, "files_placed": 4, "status": "keep"}
{"timestamp": 1787690851.8492138, "experiment_id": "7af52a9c", "concept_title": "C4. The `±2` obstruction is the only obstruction: classify the ternary Pythagorean trees", "concept_domain": "Physics", "research_mode": "team", "quality": "substantial", "quality_score": 0.86, "catalog_references": [], "prompt_length": 26587, "files_placed": 4, "status": "keep"}
{"timestamp": 1787698001.7141962, "experiment_id": "acd2f64e", "concept_title": "FACT round-84 #1 — EDGE-KERNEL-REFINEMENT (exp 588): H1 CONFIRMED — paper 234's left-edge tension resolves as GENUINE STRUCTURE, not noise: two-component kernel beats single power law ΔAICc −37.3 (LRT p=9.3e-10), FLAT BULK b=.57 [.41,.77] + NARROW LEFT-EDGE SPIKE b_edge≥~10.6 (cap-censored; cap-40 posthoc interior optimum 22.5 confirms, improvement GROWS to −42.5) carrying 8.6% [6.4,10.8]% of mass; fitted left-decile .1617 COVERS observed .1620 while single law's .1415 misses; controls show NO kernel (ΔAICc +4.3, w≈1e-4); 56% of SSR improvement in first decile, ~0% at u*≈0.65 hump → edge-driven, orthogonal to paper 232's feature; single −1.104 law RETIRED as final form (canonical profile = bulk+spike); ERRATUM-GRADE PROVENANCE FLAG: paper 234's quoted .2346 not reproducible under canonical normalization (.1620 measured) — likely combined-edge definitional mismatch with paper 230 (.162+.072), flagged for reconciliation", "concept_domain": "Pythagorean", "research_mode": "team", "quality": "substantial", "quality_score": 0.78, "catalog_references": [], "prompt_length": 30913, "files_placed": 4, "status": "keep"}
{"timestamp": 1787701215.9819787, "experiment_id": "e645a8ec", "concept_title": "FACT round-80 #2 — POSITIONAL-RATE-LINK (exp 580): H0 INDEPENDENT LAYERS — hit-rich vs hit-poor positional profiles indistinguishable at registered bars (interaction LRT χ²=51.31/df49 p=0.383, perm p=0.34; pooled rich-poor KS D=0.0462 raw p=0.0038 FAILS Bonferroni p_adj=0.049); edge-decile excess replicates universally 0.229/0.245/0.230 across terciles; control-arm family-B fired spuriously on dense size-matched controls (perm p=0.012, quasi-separation) — design flagged fragile; paper-228 positional and rate entries remain SEPARATE layers", "concept_domain": "Probability", "research_mode": "team", "quality": "substantial", "quality_score": 0.85, "catalog_references": [], "prompt_length": 27692, "files_placed": 4, "status": "keep"}
{"timestamp": 1787701233.7161307, "experiment_id": "0dec095c", "concept_title": "FACT round-82 #2 — SHAPE-TEST-NONPARAM (exp 583): H0_CHANNEL_CLOSES — LRT stat=100.6 df=3 p=1.17e-21 perm 0/400: real non-linearity but STEEP MONOTONE DECLINE; PAPER-229 ERRATUM: peaked residual = baseline leakage, power law stands", "concept_domain": "Novelty", "research_mode": "team", "quality": "substantial", "quality_score": 0.72, "catalog_references": [], "prompt_length": 28543, "files_placed": 5, "status": "keep"}
{"timestamp": 1787709612.1556573, "experiment_id": "7b0f4515", "concept_title": "FACT round-83 #1 — SYNTHESIS-R73-80 (papers-only): MAP-CONSOLIDATED-ONE-TENSION — five closures confirmed (Berggren all-faces, MA-1 both routes, u~10 gate rejection = +-5-15% envelope, converse roadmap EMPTY master inequality proven, canonical 1/l dial saturates by 400 corr .999); two record corrections mechanism-named (paper-159 wall rejected by early-fire trace law; 226-secondaries reciprocity-flip artifact + 229 residual baseline leakage — power law STANDS strengthened); three new laws (early-fire trace; Lambda prior-shape channel WITH scope boundaries: hard-balance 1.58x does NOT deploy, RSA pools ascending LOSES ~44%; harmonic-weight saturation); CONTRADICTION SCAN 7 pairs -> 4 clean + 2 resolved covering both readings (226-vs-227 dial-form difference; 232-vs-229 agreement-about-a-ghost via shared M_pred) + 1 UNRESOLVED MINOR TENSION carried forward: bulk exponent -1.10 vs steeper-than-harmonic LEFT EDGE (.2346/.162/2.54) — named refinement harmonic-bulk x steeper-edge kernel", "concept_domain": "Probability", "research_mode": "team", "quality": "substantial", "quality_score": 0.84, "catalog_references": [], "prompt_length": 31023, "files_placed": 5, "status": "keep"}
{"timestamp": 1787714364.1537938, "experiment_id": "56a9e19d", "concept_title": "NET-95 THE-WEIGHT-FLOOR-COLLAPSED: every weight rung from 8.5 to 2.6 bpw stays deployable on a 7B (q2_k just +16.2%) — the toy sub-6-bit floor was quantizer-quality x scale, not a bit-width law; weights curve smoothly where cache keys cliff", "concept_domain": "Novelty", "research_mode": "team", "quality": "substantial", "quality_score": 0.79, "catalog_references": [], "prompt_length": 27981, "files_placed": 5, "status": "keep"}
{"timestamp": 1787714381.1707258, "experiment_id": "56c4877a", "concept_title": "Local-unitary normal form", "concept_domain": "Combinatorics", "research_mode": "team", "quality": "substantial", "quality_score": 0.85, "catalog_references": [], "prompt_length": 26052, "files_placed": 4, "status": "keep"}
{"timestamp": 1787714396.519947, "experiment_id": "217690eb", "concept_title": "FACT round-83 #4 — NEIGHBOR-SMOOTHNESS-COVARIATE (exp 585): H0 NOTHING-BEYOND-QR — local factorization structure around N carries nothing beyond the QR dial (dR2=+0.0195: QR-alone .411 -> joint .431; perm p=0.389 with null q95=0.046 > observed; best single neighbor |r|=0.16); FOUR-CLASS NEGATIVE completes the coverage claim — ~40% u≈10 rate residual is TESTED-AND-FAILED not not-yet-tested (QR dial real 227/235/236; neighborhood null this; positional independent layer 228-230; S_indiv null 226/227); closes paper 234 ranked queue #1; PROVENANCE UNVERIFIED disclosed (exp581 npz holds no N array — population regenerated by documented recipe seed 20260827, isqrt fingerprint 0/128, hash 30009f0c… recorded; results conditional on balanced-96-bit exchangeability)", "concept_domain": "MachineLearning", "research_mode": "team", "quality": "substantial", "quality_score": 0.82, "catalog_references": [], "prompt_length": 28330, "files_placed": 4, "status": "keep"}
{"timestamp": 1787720221.7544703, "experiment_id": "733effba", "concept_title": "FACT round-81 #1 — HUMP-MECHANISM (exp 581): MIXED-INCONCLUSIVE by letter, STRUCTURALLY DECISIVE — no decomposition family met the HUMP bars (pooled fitted-peak boot95-lo 1.0094 vs bar 1.05; raw max still bin 33), but composition carriers die arithmetically: observed LPF masses [0,0,.0007,.9993] — 99.93% of hits share ONE band (>1e4) so H1a single-band-carrier is impossible; inside it concavity replicates in ALL THREE descriptive LPF terciles (c=-0.18/-0.25/-0.44), pooled vertex x=0.5901 == exp579's independent 0.5896 (raw max bin33 exact); k100 conditioning does NOT remove the excess (t2/t3 flat ±2% vs pooled +4.8%); controls clean everywhere; sole-survivor channel = H0 window/polynomial geometry of j²−N itself; named probe: direct j-grid/v-size sensitivity (bin-width permutation, u-grid shift); REGENERATION PASS sha256 55729f1c99c0b5d2 byte-exact 9594/9594 hits + full controls + grids + lineage quartet + master hash", "concept_domain": "Algebra", "research_mode": "team", "quality": "substantial", "quality_score": 0.82, "catalog_references": [], "prompt_length": 29922, "files_placed": 4, "status": "keep"}
{"timestamp": 1787723531.8595126, "experiment_id": "c2e74b6a", "concept_title": "Finite model property with an explicit bound", "concept_domain": "Logic", "research_mode": "team", "quality": "substantial", "quality_score": 0.88, "catalog_references": [], "prompt_length": 26020, "files_placed": 5, "status": "keep"}
{"timestamp": 1787728210.8561764, "experiment_id": "55b01213", "concept_title": "FACT round-84 #2 — SPIKE-ORIGIN (exp 589): H0-MIXED — paper 238's left-edge spike DECOMPOSES into ~half tiny-v inclusion artifact + half GENUINE small-|v| structure persisting among full-size v≥2^95 hits (w_edge .0794 → .0403 kept-CI-excludes-0); exclusion clause PROVABLY DEGENERATE (D1 ⇒ v<2^95 by arithmetic); kernel SURVIVES at reduced strength", "concept_domain": "Cryptography", "research_mode": "team", "quality": "substantial", "quality_score": 0.82, "catalog_references": [], "prompt_length": 30274, "files_placed": 4, "status": "keep"}
{"timestamp": 1787728228.4021263, "experiment_id": "5e9b52ad", "concept_title": "Kneser input for many lines", "concept_domain": "Computation", "research_mode": "team", "quality": "substantial", "quality_score": 0.82, "catalog_references": [], "prompt_length": 26218, "files_placed": 4, "status": "keep"}
{"timestamp": 1787731258.880532, "experiment_id": "3b9c1eb4", "concept_title": "FACT round-86 #1 — U065-FEATURE-MECHANISM (exp 588b FINAL): MIXED-PARTIAL — hump REAL over exact Dickman baseline (amp .116±.036 z=3.23, control null) but NO single carrier — parity/3|v/5|v/7|v/omega100/gcd ALL remove 0% (worst strata z 2.4–4.6); excess ARITHMETIC-INTERNAL, divisibility-distributed (~45–60% absorbed by m|v conditioning) → routes paper 232 feature to DIVISIBILITY-MIXTURE BASELINE model not per-hit binary covariates; TWO-PASS: blind arm 13 recipes NO_MATCH → surrogate baseline VOIDed pre-verdict (A2) → coordinator amendment A3 exact regeneration (order-walk 128/128, hits re-validated exp569 tester)", "concept_domain": "Computation", "research_mode": "team", "quality": "substantial", "quality_score": 0.84, "catalog_references": [], "prompt_length": 29723, "files_placed": 4, "status": "keep"}
{"timestamp": 1787731274.5030675, "experiment_id": "92ebc5bc", "concept_title": "FACT round-88 #2 — EDGE-CAP (exp 594 FINAL): H0 — SPIKE STEEPNESS UNIDENTIFIABLE AT THIS DATA SIZE (kernel itself MASSIVELY CONFIRMED) — cap ladder dAICc -99.6/-99.6/-101.3/-101.3 at caps 10/20/40/80 retains paper-238 two-component kernel beyond doubt (single-law b=1.160 replicates papers 229/238 ~1.104), BUT b_edge climbs .833*/.833*/40.000(=cap)/40.46 with boot CI [15.2, 80.0] hitting successive caps (cap-80 hit 26.7%, cap-40 hit 60%) — paper 238's registered delta=10 was a HARD CENSOR: canonical wording AMENDED to flat bulk + left-edge spike b_edge >~15 LOWER BOUND ONLY; controls clean (+4.85, w~8e-7)", "concept_domain": "MachineLearning", "research_mode": "team", "quality": "substantial", "quality_score": 0.78, "catalog_references": [], "prompt_length": 29313, "files_placed": 4, "status": "keep"}
{"timestamp": 1787735020.0537233, "experiment_id": "220a83a3", "concept_title": "Fix a large modulus `m` and consider the Berggren moves acting on `(ℤ/m)³`.", "concept_domain": "Cryptography", "research_mode": "team", "quality": "substantial", "quality_score": 0.82, "catalog_references": [], "prompt_length": 26157, "files_placed": 4, "status": "keep"}
{"timestamp": 1787741596.731964, "experiment_id": "8eac1b6d", "concept_title": "Cellular Automata as Algebraic Geometry: Wolfram's Rules Meet Grothendieck", "concept_domain": "Novelty", "research_mode": "team", "quality": "substantial", "quality_score": 0.82, "catalog_references": [], "prompt_length": 27067, "files_placed": 4, "status": "keep"}
{"timestamp": 1787741617.3623958, "experiment_id": "837a61ec", "concept_title": "FACT round-83 #2 — WEIGHT-EXPONENT-FIT (exp 586): H1_HARMONIC_REFINED — dial weight exponent alpha_hat=0.5 not 1 (single-peaked R2 curve .32/.50/.62/.58/.47/.30, dR2=+0.151>=bar; boot CI [0.5,0.5] excludes 1 decisively 492/500); ERRATUM-GRADE SUPERSESSION of paper 227's adopted 1/l covariate -> 1/sqrt(l) lab-wide (+31% relative dial power on identical data)", "concept_domain": "Tropical", "research_mode": "team", "quality": "substantial", "quality_score": 0.72, "catalog_references": [], "prompt_length": 28737, "files_placed": 4, "status": "keep"}
{"timestamp": 1787744792.3148081, "experiment_id": "44bf5a41", "concept_title": "FACT round-83 #3 — BSTAR-TRANSFER (exp 587): H1_BSTAR_TRANSFERS — B*=400 transfers to the sqrt-weight (R2 .528/.598/.624/.591/.614 over B=100/200/400/800/1600, unique interior argmax); closes paper 235 §3's named owed-check; dR2(sqrt-harm) positive at all 5 windows (+0.089..+0.151) no weight-x-window interaction; harmonic recomputed = flat plateau w/ edge peak 1600 (+0.006 noise) so interior-window signal is sqrt-specific; boot {400:276,1600:178} — saturation by 400, no gain through 1600; S400 stored column identified as unweighted count dial", "concept_domain": "Combinatorics", "research_mode": "team", "quality": "substantial", "quality_score": 0.72, "catalog_references": [], "prompt_length": 29010, "files_placed": 4, "status": "keep"}
{"timestamp": 1787750279.0115266, "experiment_id": "20511e4a", "concept_title": "FACT round-76 #2 — U9-DRIFT-GATE (exp 569c): GATE REJECTED by sign flip — fresh seed 20260825 reads r=1.1536 SURPLUS where the 20260824 family read deficit; randomness stands through u≈11 with a measured ±5–15% single-run fluctuation envelope", "concept_domain": "Pythagorean", "research_mode": "team", "quality": "substantial", "quality_score": 0.78, "catalog_references": [], "prompt_length": 28374, "files_placed": 5, "status": "keep"}
{"timestamp": 1787750297.1279328, "experiment_id": "5260665b", "concept_title": "FACT round-77 #1 — GENERATOR-TILT (exp 575): H1 REFUTED DECISIVELY — RSA-style pools read z=0.6356 [0.6150,0.6562] TOP-HEAVY and window-ascending LOSES ~44% (S=0.5578±0.0217); Λ-dominance CONFINED to artificial hard-balance pools; paper-221 L7-a CLOSED", "concept_domain": "Novelty", "research_mode": "team", "quality": "substantial", "quality_score": 0.83, "catalog_references": [], "prompt_length": 28749, "files_placed": 4, "status": "keep"}
{"timestamp": 1787753312.283734, "experiment_id": "6ca543a1", "concept_title": "Kernel patterns", "concept_domain": "Geometry", "research_mode": "team", "quality": "substantial", "quality_score": 0.82, "catalog_references": [], "prompt_length": 25924, "files_placed": 4, "status": "keep"}
{"timestamp": 1787759704.351878, "experiment_id": "1bcec21a", "concept_title": "Canonical alpha-connections", "concept_domain": "Combinatorics", "research_mode": "team", "quality": "substantial", "quality_score": 0.78, "catalog_references": [], "prompt_length": 26095, "files_placed": 4, "status": "keep"}
{"timestamp": 1787763647.6470153, "experiment_id": "b3980a1a", "concept_title": "Strengthen certified computation", "concept_domain": "MachineLearning", "research_mode": "team", "quality": "substantial", "quality_score": 0.82, "catalog_references": [], "prompt_length": 25977, "files_placed": 4, "status": "keep"}
