{"timestamp": 1788557410.4553173, "experiment_id": "2d4305e2", "concept_title": "FACT round-42 #6 — TABLE-CLOSURE: the g/Is/A/X tables shut at n=25 (paper 160)", "concept_domain": "MachineLearning", "research_mode": "team", "quality": "substantial", "quality_score": 0.88, "catalog_references": [], "prompt_length": 26697, "files_placed": 4, "status": "keep"}
{"timestamp": 1788566860.7904572, "experiment_id": "79cda873", "concept_title": "FACT round-42 #4 — ECM-PLANE-COMPLETION: five methods, one population, one functional (paper 158)", "concept_domain": "Tropical", "research_mode": "team", "quality": "substantial", "quality_score": 0.79, "catalog_references": [], "prompt_length": 26746, "files_placed": 4, "status": "keep"}
{"timestamp": 1788566880.476641, "experiment_id": "a7aa0976", "concept_title": "FACT round-42 #3 — DEGREE-SEVEN: the ladder's last gap below ten (paper 157)", "concept_domain": "Physics", "research_mode": "team", "quality": "substantial", "quality_score": 0.82, "catalog_references": [], "prompt_length": 26480, "files_placed": 4, "status": "keep"}
{"timestamp": 1788566899.8912516, "experiment_id": "b3a54ad0", "concept_title": "Both regimes are proved unconditionally here", "concept_domain": "Novelty", "research_mode": "team", "quality": "substantial", "quality_score": 0.82, "catalog_references": [], "prompt_length": 26115, "files_placed": 4, "status": "keep"}
{"timestamp": 1788582592.6683674, "experiment_id": "8d588bfb", "concept_title": "FACT round-42 #5 — FACTOR-LOCAL-ET FULL: the plane measured, ECM's validity edge found (paper 159)", "concept_domain": "Bridges", "research_mode": "team", "quality": "substantial", "quality_score": 0.85, "catalog_references": [], "prompt_length": 26932, "files_placed": 4, "status": "keep"}
{"timestamp": 1788624345.1425412, "experiment_id": "41afeb86", "concept_title": "FACT round-41 #1 — PHASE-FEATURES: low-prime phases are sub-threshold and window-local (paper 150)", "concept_domain": "Novelty", "research_mode": "team", "quality": "substantial", "quality_score": 0.87, "catalog_references": [], "prompt_length": 26935, "files_placed": 4, "status": "keep"}
{"timestamp": 1788642944.6675177, "experiment_id": "b58657bf", "concept_title": "A tail-exponent measurement protocol", "concept_domain": "Shared", "research_mode": "team", "quality": "substantial", "quality_score": 0.82, "catalog_references": [], "prompt_length": 26050, "files_placed": 4, "status": "keep"}
{"timestamp": 1788674320.4357357, "experiment_id": "de8ca052", "concept_title": "Metaplectic Extension of the Gabor Window Action", "concept_domain": "Geometry", "research_mode": "team", "quality": "substantial", "quality_score": 0.82, "catalog_references": ["Algebra.SmoothWindows.GaborOperators", "Algebra.SmoothWindows.GaussianWindow", "Algebra.SmoothWindows.ScaleSpace"], "prompt_length": 27034, "files_placed": 4, "status": "keep"}
{"timestamp": 1788710054.933448, "experiment_id": "0c24f2ff", "concept_title": "Moment Fingerprint Classification", "concept_domain": "Algebra", "research_mode": "team", "quality": "substantial", "quality_score": 0.82, "catalog_references": ["Computation.SpectralPoissonVsGUE"], "prompt_length": 26610, "files_placed": 4, "status": "keep"}
{"timestamp": 1788747791.6100414, "experiment_id": "794ffb3f", "concept_title": "define “quotient step” and “evolutionary path” before attempting the full\n  decomposition conjecture;", "concept_domain": "Shared", "research_mode": "team", "quality": "substantial", "quality_score": 0.82, "catalog_references": [], "prompt_length": 25956, "files_placed": 4, "status": "keep"}
{"timestamp": 1788775217.7960913, "experiment_id": "cc3115b2", "concept_title": "Standard-part projection-valued measures", "concept_domain": "Algebra", "research_mode": "team", "quality": "substantial", "quality_score": 0.85, "catalog_references": [], "prompt_length": 26512, "files_placed": 4, "status": "keep"}
{"timestamp": 1788819397.4161952, "experiment_id": "fd463ee8", "concept_title": "A finite, explicit improvement over three middle layers", "concept_domain": "Physics", "research_mode": "team", "quality": "substantial", "quality_score": 0.72, "catalog_references": [], "prompt_length": 26503, "files_placed": 5, "status": "keep"}
{"timestamp": 1788827552.946695, "experiment_id": "69567235", "concept_title": "D3. Nonlinear probe ceiling on the pooled window population", "concept_domain": "Bridges", "research_mode": "team", "quality": "substantial", "quality_score": 0.85, "catalog_references": [], "prompt_length": 26811, "files_placed": 4, "status": "keep"}
{"timestamp": 1788861131.3081079, "experiment_id": "e050cc19", "concept_title": "Depth-`L` lower bound from oscillations", "concept_domain": "Algebra", "research_mode": "team", "quality": "substantial", "quality_score": 0.88, "catalog_references": [], "prompt_length": 26106, "files_placed": 4, "status": "keep"}
{"timestamp": 1788901633.8133702, "experiment_id": "e6e33149", "concept_title": "One-Sidedness of Conditional-Independence Artifacts", "concept_domain": "Novelty", "research_mode": "team", "quality": "substantial", "quality_score": 0.86, "catalog_references": ["Applications.JointLabelReconciliation", "Applications.LabelEntropyDeficit"], "prompt_length": 26752, "files_placed": 4, "status": "keep"}
{"timestamp": 1788909821.2094707, "experiment_id": "4b011f56", "concept_title": "Uniqueness of the A/X Crossing", "concept_domain": "Novelty", "research_mode": "team", "quality": "substantial", "quality_score": 0.82, "catalog_references": ["Catalog.Combinatorics.ForkChannelExactConstants"], "prompt_length": 26455, "files_placed": 4, "status": "keep"}
{"timestamp": 1788971724.9275, "experiment_id": "4c85503d", "concept_title": "Constrained = penalised", "concept_domain": "Tropical", "research_mode": "team", "quality": "substantial", "quality_score": 0.86, "catalog_references": [], "prompt_length": 25972, "files_placed": 5, "status": "keep"}
{"timestamp": 1789016224.7414062, "experiment_id": "01cb7b4b", "concept_title": "Product constructions with bounded chord repair", "concept_domain": "Algebra", "research_mode": "team", "quality": "substantial", "quality_score": 0.78, "catalog_references": [], "prompt_length": 26509, "files_placed": 4, "status": "keep"}
{"timestamp": 1789062084.821606, "experiment_id": "ad3686b6", "concept_title": "Comonotone Repair Distance", "concept_domain": "Bridges", "research_mode": "team", "quality": "substantial", "quality_score": 0.83, "catalog_references": ["Combinatorics.UniformDialRegimeHomotopy"], "prompt_length": 26433, "files_placed": 4, "status": "keep"}
{"timestamp": 1789086803.470156, "experiment_id": "0e02e0b5", "concept_title": "Next-cycle sub-conjectures (v19c thread continuation)", "concept_domain": "NumberTheory", "research_mode": "team", "quality": "substantial", "quality_score": 0.85, "catalog_references": [], "prompt_length": 26004, "files_placed": 5, "status": "keep"}
{"timestamp": 1789103616.2190635, "experiment_id": "5c4155a3", "concept_title": "as `q⁻¹ · (unit of ℂ⟦X⟧)`.  The", "concept_domain": "Bridges", "research_mode": "team", "quality": "substantial", "quality_score": 0.70417, "catalog_references": [], "prompt_length": 22624, "files_placed": 4, "status": "keep"}
{"timestamp": 1789135237.9526834, "experiment_id": "63101e70", "concept_title": "Rung Budget for Plateau Identification", "concept_domain": "Combinatorics", "research_mode": "team", "quality": "substantial", "quality_score": 0.81, "catalog_references": ["Catalog.Physics.TDialU108Capacity", "Catalog.Physics.TDialU108BandLoss"], "prompt_length": 26688, "files_placed": 4, "status": "keep"}
{"timestamp": 1789157225.9516873, "experiment_id": "e0933184", "concept_title": "Square-Root Law for Optimal Batch Size under Sub-Quadratic Multiplication", "concept_domain": "Computation", "research_mode": "team", "quality": "substantial", "quality_score": 0.82, "catalog_references": ["Catalog.Applications.BatchSmoothnessYield", "Catalog.Applications.BatchSmoothnessCost"], "prompt_length": 26799, "files_placed": 5, "status": "keep"}
{"timestamp": 1789204591.5172055, "experiment_id": "b4f715c2", "concept_title": "General separated principal filtrations", "concept_domain": "Shared", "research_mode": "team", "quality": "substantial", "quality_score": 0.78, "catalog_references": [], "prompt_length": 25996, "files_placed": 6, "status": "keep"}
{"timestamp": 1789217860.4958563, "experiment_id": "1494cb60", "concept_title": "q-Vandermonde / q-binomial theorem", "concept_domain": "Applications", "research_mode": "team", "quality": "substantial", "quality_score": 0.82, "catalog_references": [], "prompt_length": 25984, "files_placed": 4, "status": "keep"}
{"timestamp": 1789237903.383911, "experiment_id": "a118b9c6", "concept_title": "Effective reconstruction", "concept_domain": "Novelty", "research_mode": "team", "quality": "substantial", "quality_score": 0.82, "catalog_references": [], "prompt_length": 26044, "files_placed": 4, "status": "keep"}
{"timestamp": 1789261006.5426571, "experiment_id": "cc88cab4", "concept_title": "Inadmissibility of Sign-Blind Dial Reporting", "concept_domain": "Algebra", "research_mode": "team", "quality": "substantial", "quality_score": 0.86, "catalog_references": ["Catalog.Combinatorics.ExtendedDialMomentGeometry"], "prompt_length": 26681, "files_placed": 5, "status": "keep"}
{"timestamp": 1789299925.2164454, "experiment_id": "87769612", "concept_title": "Genuinely dependent solutions at every nontrivial finite cardinality", "concept_domain": "Tropical", "research_mode": "team", "quality": "substantial", "quality_score": 0.85, "catalog_references": [], "prompt_length": 26008, "files_placed": 4, "status": "keep"}
{"timestamp": 1789323157.6506035, "experiment_id": "cb6515e1", "concept_title": "Seven-state strong-connectivity conjecture", "concept_domain": "Novelty", "research_mode": "team", "quality": "substantial", "quality_score": 0.82, "catalog_references": [], "prompt_length": 26057, "files_placed": 4, "status": "keep"}
{"timestamp": 1789391079.200216, "experiment_id": "5c150b3f", "concept_title": "Moonshine from the Null Cone — The Berggren Groupoid, the Lorentzian Leech Lattice, and the Monster", "concept_domain": "MachineLearning", "research_mode": "team", "quality": "substantial", "quality_score": 0.83, "catalog_references": [], "prompt_length": 28548, "files_placed": 4, "status": "keep"}
{"timestamp": 1789410955.848915, "experiment_id": "caf9cc55", "concept_title": "The Collatz-Berggren Bridge — Transferring the Lorentz Invariant to the Inverse Collatz Tree", "concept_domain": "Probability", "research_mode": "team", "quality": "substantial", "quality_score": 0.81, "catalog_references": [], "prompt_length": 28081, "files_placed": 4, "status": "keep"}
{"timestamp": 1789467168.4614913, "experiment_id": "841548e6", "concept_title": "The Euler Brick Tree — Berggren Descent and the Perfect Cuboid", "concept_domain": "Tropical", "research_mode": "team", "quality": "substantial", "quality_score": 0.83, "catalog_references": [], "prompt_length": 28431, "files_placed": 4, "status": "keep"}
{"timestamp": 1789498774.98894, "experiment_id": "6f1658d7", "concept_title": "The Congruent Number Laboratory — The Berggren Tree's Area Function and the Birch–Swinnerton-Dyer Frontier", "concept_domain": "Combinatorics", "research_mode": "team", "quality": "substantial", "quality_score": 0.88, "catalog_references": [], "prompt_length": 28526, "files_placed": 4, "status": "keep"}
{"timestamp": 1789535559.4852915, "experiment_id": "173bd3d0", "concept_title": "FACT round-24 #1 — NONABELIAN-TYPE-CHANNEL: the type channel is exactly its abelianization content (paper 80)", "concept_domain": "Cryptography", "research_mode": "team", "quality": "substantial", "quality_score": 0.84, "catalog_references": [], "prompt_length": 30073, "files_placed": 4, "status": "keep"}
{"timestamp": 1789570685.2912316, "experiment_id": "903508ab", "concept_title": "FACT round-24 #3 — QUINTIC-TYPE-CHANNEL: the abelianization law at degree five, F₂₀ and the first C₄ dial (paper 82)", "concept_domain": "Bridges", "research_mode": "team", "quality": "substantial", "quality_score": 0.82, "catalog_references": [], "prompt_length": 29114, "files_placed": 4, "status": "keep"}
{"timestamp": 1789603326.9573872, "experiment_id": "9c40082c", "concept_title": "FACT round-24 #2 — BERGGREN-3ADIC: the tree position of the N-node is adically sealed (paper 81)", "concept_domain": "Cryptography", "research_mode": "team", "quality": "substantial", "quality_score": 0.87, "catalog_references": [], "prompt_length": 29737, "files_placed": 4, "status": "keep"}
{"timestamp": 1789638154.5933428, "experiment_id": "078881d5", "concept_title": "FACT round-24 #5 — D₅-QUINTIC: the quintic row complete (paper 84)", "concept_domain": "MachineLearning", "research_mode": "team", "quality": "substantial", "quality_score": 0.84, "catalog_references": [], "prompt_length": 29067, "files_placed": 5, "status": "keep"}
{"timestamp": 1789655416.825816, "experiment_id": "aa0d333b", "concept_title": "FACT round-24 #4 — S₅/A₅ QUINTIC ENDPOINTS: the largest entropy collapses, the perfect group seals (paper 83)", "concept_domain": "MachineLearning", "research_mode": "team", "quality": "substantial", "quality_score": 0.83, "catalog_references": [], "prompt_length": 29195, "files_placed": 5, "status": "keep"}
{"timestamp": 1789688798.7447455, "experiment_id": "c73f4ca7", "concept_title": "FACT round-25 #2 — QUBIT-TRADE3: the fungibility ramp on real semiprimes (paper 86)", "concept_domain": "Bridges", "research_mode": "team", "quality": "substantial", "quality_score": 0.85, "catalog_references": [], "prompt_length": 28616, "files_placed": 5, "status": "keep"}
{"timestamp": 1789695540.3639455, "experiment_id": "6bf15a63", "concept_title": "FACT round-25 #3 — QUBIT-TRADE4: the three-axis resource surface, standard-corner optimum (paper 87)", "concept_domain": "Shared", "research_mode": "team", "quality": "substantial", "quality_score": 0.72, "catalog_references": [], "prompt_length": 28009, "files_placed": 4, "status": "keep"}
{"timestamp": 1789748472.3636322, "experiment_id": "b5786d61", "concept_title": "FACT round-27 #2 — BATTERY-CAPACITY: synergy compounds, the 4-field joint more than doubles its marginals (paper 92)", "concept_domain": "MachineLearning", "research_mode": "team", "quality": "substantial", "quality_score": 0.84, "catalog_references": [], "prompt_length": 27725, "files_placed": 4, "status": "keep"}
{"timestamp": 1789758397.4157789, "experiment_id": "24d71196", "concept_title": "FACT round-25 #1 — QUBIT-TRADE2: one register bit is worth one sample, the fungibility ramp (paper 85)", "concept_domain": "Shared", "research_mode": "team", "quality": "substantial", "quality_score": 0.82, "catalog_references": [], "prompt_length": 29418, "files_placed": 4, "status": "keep"}
{"timestamp": 1789774831.2767112, "experiment_id": "a55a0103", "concept_title": "FACT round-27 #1 — DIAL-INDEPENDENCE: synergy and overlap in the battery space (paper 91)", "concept_domain": "MachineLearning", "research_mode": "team", "quality": "substantial", "quality_score": 0.82, "catalog_references": [], "prompt_length": 28020, "files_placed": 4, "status": "keep"}
{"timestamp": 1789829515.0684304, "experiment_id": "020da4dc", "concept_title": "FACT round-26 #3 — SUBEXP-STRATUM: the fourth stratum stays unmeasured at toy scale, an honest inconclusive (paper 90)", "concept_domain": "Algebra", "research_mode": "team", "quality": "substantial", "quality_score": 0.78, "catalog_references": [], "prompt_length": 28132, "files_placed": 4, "status": "keep"}
{"timestamp": 1789854414.1298544, "experiment_id": "d309ec20", "concept_title": "FACT round-26 #1 — CONVERSE-COST-CURVE: the empirical barrier-4 across the witness family (paper 88)", "concept_domain": "Combinatorics", "research_mode": "team", "quality": "substantial", "quality_score": 0.83, "catalog_references": [], "prompt_length": 27590, "files_placed": 4, "status": "keep"}
{"timestamp": 1789861312.8264887, "experiment_id": "cfb5ebd4", "concept_title": "FACT round-26 #2 — THREE-STRATA-PLANE: definition-routes, methods, quantum on one measured plane (paper 89)", "concept_domain": "Cryptography", "research_mode": "team", "quality": "substantial", "quality_score": 0.78, "catalog_references": [], "prompt_length": 28341, "files_placed": 4, "status": "keep"}
{"timestamp": 1789921306.470155, "experiment_id": "fbb83685", "concept_title": "FACT round-28 #1 — METHOD-LOCALITY: ECM and rho track the factor, not the modulus (paper 95)", "concept_domain": "Physics", "research_mode": "team", "quality": "substantial", "quality_score": 0.82, "catalog_references": [], "prompt_length": 27233, "files_placed": 4, "status": "keep"}
{"timestamp": 1789947020.9290342, "experiment_id": "587eb79b", "concept_title": "FACT round-27 #3 — JOINT-WALL-VERIFIED: the battery's factor-blindness stands, the wall was bias (paper 93)", "concept_domain": "Computation", "research_mode": "team", "quality": "substantial", "quality_score": 0.85, "catalog_references": [], "prompt_length": 27043, "files_placed": 4, "status": "keep"}
{"timestamp": 1789954676.2752876, "experiment_id": "643f7ea2", "concept_title": "FACT round-27 #4 — BATTERY-SCALING: the capacity curve saturates at the label-entropy ceiling (paper 94)", "concept_domain": "Bridges", "research_mode": "team", "quality": "substantial", "quality_score": 0.82, "catalog_references": [], "prompt_length": 27594, "files_placed": 4, "status": "keep"}
{"timestamp": 1790019571.1980786, "experiment_id": "61cd19b1", "concept_title": "FACT round-28 #4 — BATTERY-UTILITY: the labels are not filters (paper 98)", "concept_domain": "Pythagorean", "research_mode": "team", "quality": "substantial", "quality_score": 0.8, "catalog_references": [], "prompt_length": 27483, "files_placed": 4, "status": "keep"}
{"timestamp": 1790031151.2388396, "experiment_id": "900e5fcb", "concept_title": "FACT round-29 #1 — THE-SUM-DIFFERENCE-SPLIT: the factor-residue hint value (paper 99)", "concept_domain": "Algebra", "research_mode": "team", "quality": "substantial", "quality_score": 0.82, "catalog_references": [], "prompt_length": 27827, "files_placed": 4, "status": "keep"}
{"timestamp": 1790078871.11166, "experiment_id": "79072e03", "concept_title": "FACT round-28 #3 — REPRODUCIBILITY-AUDIT: every keystone reproduces bit-for-bit (paper 97)", "concept_domain": "Computation", "research_mode": "team", "quality": "substantial", "quality_score": 0.82, "catalog_references": [], "prompt_length": 27529, "files_placed": 5, "status": "keep"}
{"timestamp": 1790107844.3988416, "experiment_id": "0c9eb490", "concept_title": "FACT round-28 #2 — THE-GAP-LOCAL-METHOD: Fermat completes the locality taxonomy (paper 96)", "concept_domain": "Shared", "research_mode": "team", "quality": "substantial", "quality_score": 0.82, "catalog_references": [], "prompt_length": 27646, "files_placed": 4, "status": "keep"}
{"timestamp": 1790145519.530075, "experiment_id": "6c5b75ba", "concept_title": "FACT round-29 #1 — AUDIT-EXTENSION: six keystones, zero drift (paper 103)", "concept_domain": "NumberTheory", "research_mode": "team", "quality": "substantial", "quality_score": 0.75, "catalog_references": [], "prompt_length": 27341, "files_placed": 4, "status": "keep"}
{"timestamp": 1790184051.6739614, "experiment_id": "5a9c6b89", "concept_title": "FACT round-30 #2 — SD-WALL-TEST: the hinted view is factor-blind too (paper 102)", "concept_domain": "Computation", "research_mode": "team", "quality": "substantial", "quality_score": 0.82, "catalog_references": [], "prompt_length": 27073, "files_placed": 4, "status": "keep"}
{"timestamp": 1790252470.0826, "experiment_id": "0ed62b99", "concept_title": "FACT round-30 #1 — HINT-VALUE-JOINT: hints compound like capacities (paper 101)", "concept_domain": "Bridges", "research_mode": "team", "quality": "substantial", "quality_score": 0.82, "catalog_references": [], "prompt_length": 27087, "files_placed": 4, "status": "keep"}
{"timestamp": 1790270722.852798, "experiment_id": "e5322766", "concept_title": "FACT round-31 #1 — CROSS-PROGRAMME-CONSISTENCY: all post-resume results verified (paper 107)", "concept_domain": "Probability", "research_mode": "team", "quality": "partial", "quality_score": 0.55, "catalog_references": [], "prompt_length": 27020, "files_placed": 4, "status": "keep"}
{"timestamp": 1790292934.4458833, "experiment_id": "15a3f6e6", "concept_title": "FACT round-30 #3 — CYCLIC-SEXTIC: degree 6 completes the type-channel ladder (paper 106)", "concept_domain": "Physics", "research_mode": "team", "quality": "substantial", "quality_score": 0.72, "catalog_references": [], "prompt_length": 26299, "files_placed": 4, "status": "keep"}
{"timestamp": 1790322190.3233724, "experiment_id": "e43cce79", "concept_title": "FACT round-30 #2 — HINT-S-D-DECOMPOSITION: the routing structure is dial-dependent (paper 105)", "concept_domain": "Cryptography", "research_mode": "team", "quality": "substantial", "quality_score": 0.72, "catalog_references": [], "prompt_length": 26932, "files_placed": 4, "status": "keep"}
{"timestamp": 1790359013.7569096, "experiment_id": "293082f5", "concept_title": "FACT round-30 #1 — HINT-TABLE-COMPLETION: the six-dial hint-value table (paper 104)", "concept_domain": "Geometry", "research_mode": "team", "quality": "substantial", "quality_score": 0.72, "catalog_references": [], "prompt_length": 26723, "files_placed": 4, "status": "keep"}
{"timestamp": 1790416740.246691, "experiment_id": "ccd8891f", "concept_title": "FACT round-32 #2 — ETALE-DIAL: the type channel for reducible polynomials (paper 113)", "concept_domain": "Bridges", "research_mode": "team", "quality": "substantial", "quality_score": 0.75, "catalog_references": [], "prompt_length": 26913, "files_placed": 4, "status": "keep"}
