{"timestamp": 1781193286.352294, "experiment_id": "b939dcd0", "concept_title": "Reverse Mathematics: Ramsey's Theorem", "concept_domain": "Applications", "research_mode": "team", "quality": "partial", "quality_score": 0.44171100715224065, "catalog_references": [], "prompt_length": 10960, "files_placed": 0, "status": "discard"}
{"timestamp": 1781193327.7972386, "experiment_id": "46eb7967", "concept_title": "Beal's Conjecture: Computational Evidence and Special Cases", "concept_domain": "Novelty", "research_mode": "team", "quality": "partial", "quality_score": 0.3778333333333334, "catalog_references": [], "prompt_length": 11188, "files_placed": 0, "status": "discard"}
{"timestamp": 1781193353.7042143, "experiment_id": "436a6e78", "concept_title": "12 fully proved theorems (zero sorry) formalizing the algebr", "concept_domain": "Applications", "research_mode": "team", "quality": "partial", "quality_score": 0.43164615384615385, "catalog_references": [], "prompt_length": 21835, "files_placed": 0, "status": "discard"}
{"timestamp": 1781193377.3705072, "experiment_id": "26580044", "concept_title": "The natural next step is to formalize the actual probabilistic phase transition.", "concept_domain": "Applications", "research_mode": "team", "quality": "partial", "quality_score": 0.44696, "catalog_references": [], "prompt_length": 23181, "files_placed": 0, "status": "discard"}
{"timestamp": 1781195321.707036, "experiment_id": "c927a292", "concept_title": "This cycle isolated the structural reason Hausdorff dimension behaves like a", "concept_domain": "Novelty", "research_mode": "team", "quality": "substantial", "quality_score": 0.7295200000000001, "catalog_references": [], "prompt_length": 25354, "files_placed": 7, "status": "keep"}
{"timestamp": 1781195386.040054, "experiment_id": "7e407b8a", "concept_title": "Zeta Functions of Directed Graphs and the Graph Riemann Hypothesis", "concept_domain": "Applications", "research_mode": "team", "quality": "partial", "quality_score": 0.4066114983147033, "catalog_references": [], "prompt_length": 13729, "files_placed": 0, "status": "discard"}
{"timestamp": 1781197305.2016833, "experiment_id": "646015c5", "concept_title": "Quantum Topological Phase Computation", "concept_domain": "Novelty", "research_mode": "team", "quality": "partial", "quality_score": 0.6955957377049181, "catalog_references": [], "prompt_length": 16983, "files_placed": 10, "status": "keep"}
{"timestamp": 1781197376.522396, "experiment_id": "d1cc9a51", "concept_title": "Rigorous formal framework for holographic proo", "concept_domain": "Applications", "research_mode": "team", "quality": "partial", "quality_score": 0.4230388096160698, "catalog_references": [], "prompt_length": 37331, "files_placed": 0, "status": "discard"}
{"timestamp": 1781197409.6822438, "experiment_id": "33b8272c", "concept_title": "Close Proofs: Formalize Baker\u2013Norine's tropical Riemann-Roch theorem: for a divisor ", "concept_domain": "Novelty", "research_mode": "team", "quality": "partial", "quality_score": 0.42119809731775676, "catalog_references": [], "prompt_length": 6881, "files_placed": 0, "status": "discard"}
{"timestamp": 1781197441.5009973, "experiment_id": "bea7184b", "concept_title": "Natural Proofs Barrier: Formalization", "concept_domain": "Novelty", "research_mode": "team", "quality": "substantial", "quality_score": 0.7585066666666667, "catalog_references": [], "prompt_length": 16734, "files_placed": 15, "status": "keep"}
{"timestamp": 1781199374.5041246, "experiment_id": "8e0cdf42", "concept_title": "The file `Catalog/Physics/ProofPhaseTransitions/RandomKSAT.lean` establishes, fu", "concept_domain": "Novelty", "research_mode": "team", "quality": "substantial", "quality_score": 0.7418812903225807, "catalog_references": [], "prompt_length": 23582, "files_placed": 6, "status": "keep"}
{"timestamp": 1781199406.8910267, "experiment_id": "02c2ea6f", "concept_title": "Close Proofs: Cobham's theorem (1972) states that if a sequence is both j-automatic ", "concept_domain": "Applications", "research_mode": "team", "quality": "substantial", "quality_score": 0.7191438202247191, "catalog_references": [], "prompt_length": 16971, "files_placed": 6, "status": "keep"}
{"timestamp": 1781199523.7167537, "experiment_id": "0c76a614", "concept_title": "The file `Tropical/MarkedModuli.lean` formalizes the combinatorial type `MarkedC", "concept_domain": "Applications", "research_mode": "team", "quality": "partial", "quality_score": 0.45349362853091946, "catalog_references": [], "prompt_length": 17305, "files_placed": 0, "status": "discard"}
{"timestamp": 1781199676.0342748, "experiment_id": "c88e9d3c", "concept_title": "Close Proofs: The current formalization handles 0-dimensional persistence on discret", "concept_domain": "Applications", "research_mode": "team", "quality": "partial", "quality_score": 0.5243702528507684, "catalog_references": [], "prompt_length": 16966, "files_placed": 45, "status": "keep"}
{"timestamp": 1781200990.969362, "experiment_id": "75439445", "concept_title": "Close Proofs: Proof-Theoretic Bridge: Ordinal Analysis Across Systems", "concept_domain": "Novelty", "research_mode": "team", "quality": "partial", "quality_score": 0.4435260077984994, "catalog_references": [], "prompt_length": 6370, "files_placed": 0, "status": "discard"}
{"timestamp": 1781202900.686437, "experiment_id": "395ae6a4", "concept_title": "Close Proofs: Close Proofs: Formalize Baker\u2013Norine's tropical Riemann-Roch theorem: ", "concept_domain": "Applications", "research_mode": "team", "quality": "partial", "quality_score": 0.3647040026595745, "catalog_references": [], "prompt_length": 6395, "files_placed": 0, "status": "discard"}
{"timestamp": 1781202957.1635315, "experiment_id": "c390fa53", "concept_title": "This cycle added `Catalog/Pythagorean/FibonacciEntryFactorization.lean`, which p", "concept_domain": "Novelty", "research_mode": "team", "quality": "partial", "quality_score": 0.42425706848676353, "catalog_references": [], "prompt_length": 18165, "files_placed": 0, "status": "discard"}
{"timestamp": 1781202983.2632885, "experiment_id": "f3a4b926", "concept_title": "This cycle replaced the softmax score `exp\u27e8q,k\u27e9` with the **Cauchy kernel**", "concept_domain": "Novelty", "research_mode": "team", "quality": "partial", "quality_score": 0.42422903013366364, "catalog_references": [], "prompt_length": 24172, "files_placed": 0, "status": "discard"}
{"timestamp": 1781203010.0185359, "experiment_id": "0c7f47f2", "concept_title": "Close Proofs: The file `Catalog/Physics/ProofPhaseTransitions/RandomKSAT.lean` estab", "concept_domain": "Applications", "research_mode": "team", "quality": "partial", "quality_score": 0.5141264353312303, "catalog_references": [], "prompt_length": 11517, "files_placed": 0, "status": "keep"}
{"timestamp": 1781203043.2856598, "experiment_id": "8ad04b32", "concept_title": "Deepening: Natural Proofs Barrier: Formalization", "concept_domain": "Applications", "research_mode": "team", "quality": "partial", "quality_score": 0.3642926757831543, "catalog_references": [], "prompt_length": 6947, "files_placed": 0, "status": "discard"}
{"timestamp": 1781203078.6463828, "experiment_id": "c3738d7c", "concept_title": "We have formalized Belnap's FOUR as a bounded distributive lattice under the tru", "concept_domain": "Algebra", "research_mode": "team", "quality": "partial", "quality_score": 0.3331148597352188, "catalog_references": [], "prompt_length": 20413, "files_placed": 0, "status": "discard"}
{"timestamp": 1781203105.6884892, "experiment_id": "2b45544c", "concept_title": "Close Proofs: Close Proofs: Proof-Theoretic Bridge: Ordinal Analysis Across Systems", "concept_domain": "Logic", "research_mode": "team", "quality": "partial", "quality_score": 0.4762122653316646, "catalog_references": [], "prompt_length": 11506, "files_placed": 0, "status": "discard"}
{"timestamp": 1781205084.6292598, "experiment_id": "fe45d287", "concept_title": "Close Proofs: Quantum Topological Phase Computation", "concept_domain": "Applications", "research_mode": "team", "quality": "partial", "quality_score": 0.42048535895849587, "catalog_references": [], "prompt_length": 16934, "files_placed": 93, "status": "discard"}
{"timestamp": 1781205137.0785396, "experiment_id": "aea50e63", "concept_title": "Emergent Spacetime from Quantum Entanglement", "concept_domain": "Physics", "research_mode": "team", "quality": "partial", "quality_score": 0.42083833289097083, "catalog_references": [], "prompt_length": 6609, "files_placed": 0, "status": "discard"}
{"timestamp": 1781205162.7260525, "experiment_id": "59c23f07", "concept_title": "This cycle attacked the ordinal-analysis target \"construct an order-preserving", "concept_domain": "Pythagorean", "research_mode": "team", "quality": "partial", "quality_score": 0.446075332998814, "catalog_references": [], "prompt_length": 23703, "files_placed": 0, "status": "discard"}
{"timestamp": 1781205189.1188657, "experiment_id": "257f7c90", "concept_title": "The file `Catalog/Geometry/IsingStereoRG.lean` establishes the first rigorous, m", "concept_domain": "Geometry", "research_mode": "team", "quality": "partial", "quality_score": 0.4702857868020305, "catalog_references": [], "prompt_length": 21617, "files_placed": 0, "status": "discard"}
{"timestamp": 1781205218.479161, "experiment_id": "d5040457", "concept_title": "Close Proofs: This cycle added `Catalog/Pythagorean/FibonacciEntryFactorization.lean", "concept_domain": "Cryptography", "research_mode": "team", "quality": "partial", "quality_score": 0.44605926683783637, "catalog_references": [], "prompt_length": 6891, "files_placed": 0, "status": "discard"}
{"timestamp": 1781207187.7952247, "experiment_id": "6f689cb5", "concept_title": "Deepening: Deepening: Information-Geometric Bridge: Fisher Metric on Statistical Manifolds", "concept_domain": "Computation", "research_mode": "team", "quality": "partial", "quality_score": 0.5584065473145781, "catalog_references": [], "prompt_length": 17121, "files_placed": 68, "status": "keep"}
{"timestamp": 1781207237.6767948, "experiment_id": "15f2a404", "concept_title": "The new file `Catalog/MachineLearning/PerturbedGeneralization.lean` bridges the", "concept_domain": "MachineLearning", "research_mode": "team", "quality": "partial", "quality_score": 0.4452582322322522, "catalog_references": [], "prompt_length": 15690, "files_placed": 0, "status": "discard"}
{"timestamp": 1781208201.4814851, "experiment_id": "678735f0", "concept_title": "This cycle added `Catalog/Pythagorean/FibonacciEntryFactorization.lean`, which c", "concept_domain": "Tropical", "research_mode": "team", "quality": "partial", "quality_score": 0.4209817001424355, "catalog_references": [], "prompt_length": 18217, "files_placed": 0, "status": "discard"}
{"timestamp": 1781210159.7671788, "experiment_id": "e89bd153", "concept_title": "Close Proofs: The geometric convergence theorem (`gdResidual_geometric_decay`) assum", "concept_domain": "Bridges", "research_mode": "team", "quality": "partial", "quality_score": 0.5075143063932449, "catalog_references": [], "prompt_length": 6879, "files_placed": 0, "status": "keep"}
{"timestamp": 1781210194.2643638, "experiment_id": "12ce834d", "concept_title": "Close Proofs: This cycle replaced the softmax score `exp\u27e8q,k\u27e9` with the **Cauchy ker", "concept_domain": "Cryptography", "research_mode": "team", "quality": "partial", "quality_score": 0.5266337160120846, "catalog_references": [], "prompt_length": 16967, "files_placed": 51, "status": "keep"}
{"timestamp": 1781210221.8747592, "experiment_id": "d3e341ac", "concept_title": "ML Generalization Bounds: Rademacher Complexity of Neural Networks", "concept_domain": "MachineLearning", "research_mode": "team", "quality": "partial", "quality_score": 0.42471904317354037, "catalog_references": [], "prompt_length": 6273, "files_placed": 0, "status": "discard"}
{"timestamp": 1781210269.6523721, "experiment_id": "1aaaec8c", "concept_title": "**Entropy-Bounded Computation (EBC)** framew", "concept_domain": "Applications", "research_mode": "team", "quality": "partial", "quality_score": 0.4247214531347132, "catalog_references": [], "prompt_length": 29777, "files_placed": 0, "status": "discard"}
{"timestamp": 1781210315.3971632, "experiment_id": "dfec1e39", "concept_title": "Secure Multi-Party Computation: Theoretical Foundations", "concept_domain": "Novelty", "research_mode": "team", "quality": "partial", "quality_score": 0.42693098591549294, "catalog_references": [], "prompt_length": 6542, "files_placed": 0, "status": "discard"}
{"timestamp": 1781212250.8672726, "experiment_id": "d1d1af48", "concept_title": "Close Proofs: Close Proofs: The sphere-packing bound gives an upper bound on code si", "concept_domain": "Novelty", "research_mode": "team", "quality": "partial", "quality_score": 0.43581040015019235, "catalog_references": [], "prompt_length": 16962, "files_placed": 30, "status": "discard"}
{"timestamp": 1781212270.4930887, "experiment_id": "09c1a5a3", "concept_title": "Close Proofs: Close Proofs: The file `Physics/TopologicalOrderGenus.lean` establishe", "concept_domain": "Bridges", "research_mode": "team", "quality": "partial", "quality_score": 0.50544, "catalog_references": [], "prompt_length": 16956, "files_placed": 7, "status": "keep"}
{"timestamp": 1781212313.7822275, "experiment_id": "266bd9fd", "concept_title": "The file `Catalog/Cryptography/AdditiveSecretSharingMPC.lean` formalizes the", "concept_domain": "Applications", "research_mode": "team", "quality": "partial", "quality_score": 0.34440080000000006, "catalog_references": [], "prompt_length": 19177, "files_placed": 0, "status": "discard"}
{"timestamp": 1781212337.1660378, "experiment_id": "43d192bd", "concept_title": "The file `Catalog/MachineLearning/PerturbedGeneralization.lean` isolates a singl", "concept_domain": "Shared", "research_mode": "team", "quality": "partial", "quality_score": 0.41189397260273974, "catalog_references": [], "prompt_length": 18879, "files_placed": 0, "status": "discard"}
{"timestamp": 1781212361.4447534, "experiment_id": "c907b356", "concept_title": "The file `Catalog/Logic/OrdinalCollapsingBridge.lean` formalizes a genuine", "concept_domain": "Novelty", "research_mode": "team", "quality": "partial", "quality_score": 0.4311574194628065, "catalog_references": [], "prompt_length": 14963, "files_placed": 0, "status": "discard"}
{"timestamp": 1781214330.4190805, "experiment_id": "08bb99d3", "concept_title": "The file `TropicalValuationLimitBridge.lean` formalizes the *easy half* of the F", "concept_domain": "Bridges", "research_mode": "team", "quality": "partial", "quality_score": 0.6373599999999999, "catalog_references": [], "prompt_length": 22856, "files_placed": 8, "status": "keep"}
{"timestamp": 1781214354.824172, "experiment_id": "f104f990", "concept_title": "Stereographic Neural Attention: Attention via Riemann Sphere", "concept_domain": "Applications", "research_mode": "team", "quality": "partial", "quality_score": 0.3965830303030303, "catalog_references": [], "prompt_length": 6687, "files_placed": 0, "status": "discard"}
{"timestamp": 1781214383.321256, "experiment_id": "781ad714", "concept_title": "We proved that the biconjugate satisfies f\u2605\u2605(x) \u2264 f(x) for all x. The natural ne", "concept_domain": "Applications", "research_mode": "team", "quality": "partial", "quality_score": 0.41658424369747904, "catalog_references": [], "prompt_length": 18745, "files_placed": 0, "status": "discard"}
{"timestamp": 1781214426.3819253, "experiment_id": "fe68f57d", "concept_title": "Close Proofs: The file `Catalog/Logic/OrdinalCollapsingBridge.lean` formalizes a gen", "concept_domain": "Applications", "research_mode": "team", "quality": "partial", "quality_score": 0.416611724137931, "catalog_references": [], "prompt_length": 11515, "files_placed": 0, "status": "discard"}
{"timestamp": 1781214449.4653926, "experiment_id": "6d292d8d", "concept_title": "Close Proofs: Close Proofs: The geometric convergence theorem (`gdResidual_geometric", "concept_domain": "Novelty", "research_mode": "team", "quality": "partial", "quality_score": 0.4277464864864866, "catalog_references": [], "prompt_length": 6385, "files_placed": 0, "status": "discard"}
{"timestamp": 1781216395.3843, "experiment_id": "abd63a3a", "concept_title": "Close Proofs: **Entropy-Bounded Computation (EBC)** framew", "concept_domain": "Novelty", "research_mode": "team", "quality": "partial", "quality_score": 0.4154796923076923, "catalog_references": [], "prompt_length": 16935, "files_placed": 7, "status": "discard"}
{"timestamp": 1781216419.7025034, "experiment_id": "7e3b9455", "concept_title": "Close Proofs: Close Proofs: The file `Catalog/Physics/ProofPhaseTransitions/RandomKS", "concept_domain": "Applications", "research_mode": "team", "quality": "partial", "quality_score": 0.3193885714285714, "catalog_references": [], "prompt_length": 6405, "files_placed": 0, "status": "discard"}
{"timestamp": 1781216442.689386, "experiment_id": "2b33cc7d", "concept_title": "Homotopy Type Theory as Foundations", "concept_domain": "Novelty", "research_mode": "team", "quality": "partial", "quality_score": 0.44416, "catalog_references": [], "prompt_length": 6468, "files_placed": 0, "status": "discard"}
{"timestamp": 1781218423.2058284, "experiment_id": "8c5a0c42", "concept_title": "Topological Quantum Error Correction from Homological Persistence", "concept_domain": "Novelty", "research_mode": "team", "quality": "partial", "quality_score": 0.3607679130434783, "catalog_references": [], "prompt_length": 8826, "files_placed": 0, "status": "discard"}
{"timestamp": 1781218447.2147863, "experiment_id": "b7ccdc16", "concept_title": "Stereographic Proof Compression: Proofs on Spheres", "concept_domain": "Applications", "research_mode": "team", "quality": "partial", "quality_score": 0.46504, "catalog_references": [], "prompt_length": 6563, "files_placed": 0, "status": "discard"}
{"timestamp": 1781218470.3865366, "experiment_id": "d99e1c89", "concept_title": "The file `Catalog/Tropical/TropicalModuliCompactification.lean` formalizes the", "concept_domain": "Novelty", "research_mode": "team", "quality": "partial", "quality_score": 0.42687600000000003, "catalog_references": [], "prompt_length": 18019, "files_placed": 0, "status": "discard"}
{"timestamp": 1781218493.0057118, "experiment_id": "c24e10d3", "concept_title": "Close Proofs: Learning with Errors: Hardness Reductions", "concept_domain": "Applications", "research_mode": "team", "quality": "partial", "quality_score": 0.49496000000000007, "catalog_references": [], "prompt_length": 16884, "files_placed": 6, "status": "discard"}
{"timestamp": 1781218514.81944, "experiment_id": "f2a6afcb", "concept_title": "Formal foundations for the logic-physics bridge: the", "concept_domain": "Applications", "research_mode": "team", "quality": "partial", "quality_score": 0.64544, "catalog_references": [], "prompt_length": 24297, "files_placed": 5, "status": "keep"}
{"timestamp": 1781218540.433318, "experiment_id": "dca61d37", "concept_title": "*deterministic skeleton* of derivability phase transi", "concept_domain": "Applications", "research_mode": "team", "quality": "partial", "quality_score": 0.48440000000000005, "catalog_references": [], "prompt_length": 22736, "files_placed": 0, "status": "discard"}
{"timestamp": 1781218563.5820265, "experiment_id": "72db03c0", "concept_title": "This cycle closed the satisfiable side of the first-moment picture for random", "concept_domain": "Novelty", "research_mode": "team", "quality": "partial", "quality_score": 0.3936876233183857, "catalog_references": [], "prompt_length": 18062, "files_placed": 0, "status": "discard"}
{"timestamp": 1781220572.642555, "experiment_id": "6326c0d0", "concept_title": "For a Calabi-Yau threefold X defined over \u211a, the L-function L(X, s) = \u03a3 a\u2099 n\u207b\u02e2", "concept_domain": "Novelty", "research_mode": "team", "quality": "partial", "quality_score": 0.4236000000000001, "catalog_references": [], "prompt_length": 15427, "files_placed": 0, "status": "discard"}
{"timestamp": 1781220617.7224236, "experiment_id": "e161e808", "concept_title": "The file `Tropical/MarkedModuli.lean` formalizes the combinatorial type `MarkedC", "concept_domain": "Applications", "research_mode": "team", "quality": "partial", "quality_score": 0.3844413214518583, "catalog_references": [], "prompt_length": 17801, "files_placed": 0, "status": "discard"}
{"timestamp": 1781220641.1739247, "experiment_id": "20c085e6", "concept_title": "Close Proofs: Emergent Spacetime from Quantum Entanglement", "concept_domain": "Novelty", "research_mode": "team", "quality": "partial", "quality_score": 0.46162500000000006, "catalog_references": [], "prompt_length": 6357, "files_placed": 0, "status": "discard"}
{"timestamp": 1781222627.0419877, "experiment_id": "8e0a810d", "concept_title": "Temporal Logic of Proofs: When You Prove Something Matters", "concept_domain": "Novelty", "research_mode": "team", "quality": "partial", "quality_score": 0.4842181818181819, "catalog_references": [], "prompt_length": 17679, "files_placed": 5, "status": "discard"}
{"timestamp": 1781222653.5512125, "experiment_id": "f0d8d579", "concept_title": "Bridge: Information Geometry Connecting Statistics and Differential Geometry", "concept_domain": "Applications", "research_mode": "team", "quality": "partial", "quality_score": 0.4073433452924594, "catalog_references": [], "prompt_length": 6805, "files_placed": 0, "status": "discard"}
{"timestamp": 1781222674.5984185, "experiment_id": "22f6ffd2", "concept_title": "Close Proofs: Close Proofs: Close Proofs: Dream Logic: Non-Monotone Reasoning Where ", "concept_domain": "Applications", "research_mode": "team", "quality": "partial", "quality_score": 0.6714818494055483, "catalog_references": [], "prompt_length": 16971, "files_placed": 6, "status": "keep"}
