{"timestamp": 1782533457.6842864, "experiment_id": "887d83d7", "concept_title": "Resolution of Erd\u0151s Problem 550 on Tree versus Complete Multipartite Ramsey Numbers", "concept_domain": "Novelty", "research_mode": "team", "quality": "partial", "quality_score": 0.5740799999999999, "catalog_references": ["Erd\u0151s Problem 550", "Chv\u00e1tal's theorem", "Burr's bound"], "prompt_length": 20767, "files_placed": 8, "status": "keep"}
{"timestamp": 1782533583.9962184, "experiment_id": "8ed8ca57", "concept_title": "Sharp approximate Carath\u00e9odory theorem and application to iterated Delaunay refinement", "concept_domain": "Novelty", "research_mode": "prove|formalize|counterexample|sorry_fill", "quality": "substantial", "quality_score": 0.7478369230769231, "catalog_references": ["Domain/File.lean", "Catalog/FINAL"], "prompt_length": 22790, "files_placed": 6, "status": "keep"}
{"timestamp": 1782533789.4155333, "experiment_id": "49ad7738", "concept_title": "Tightness of the unit-shift bound for Euler's totient function", "concept_domain": "Applications", "research_mode": "formalize", "quality": "partial", "quality_score": 0.6950400000000001, "catalog_references": ["Catalog/Applications/TotientUnitShift.lean", "Catalog/NumberTheory/ArithmeticFunctions.lean", "Catalog/NumberTheory/SieveMethods.lean", "Catalog/NumberTheory/SmoothNumbers.lean"], "prompt_length": 20711, "files_placed": 6, "status": "keep"}
{"timestamp": 1782535522.2799902, "experiment_id": "236373d0", "concept_title": "Navier-Stokes: 2D Regularity and Partial 3D Results", "concept_domain": "Novelty", "research_mode": "prove", "quality": "partial", "quality_score": 0.53432, "catalog_references": [], "prompt_length": 20736, "files_placed": 7, "status": "keep"}
{"timestamp": 1782538327.4461794, "experiment_id": "905ed2dd", "concept_title": "EML Fixed-Point Theorem: exp-log Iteration Convergence", "concept_domain": "Novelty", "research_mode": "team", "quality": "substantial", "quality_score": 0.76274, "catalog_references": [], "prompt_length": 21494, "files_placed": 8, "status": "keep"}
{"timestamp": 1782538439.192361, "experiment_id": "802107a7", "concept_title": "Transmission Zero Forcing Number Equals Domination Number on Trees", "concept_domain": "Novelty", "research_mode": "team", "quality": "partial", "quality_score": 0.6666400000000001, "catalog_references": [], "prompt_length": 20750, "files_placed": 7, "status": "keep"}
{"timestamp": 1782538520.411436, "experiment_id": "688a9cbf", "concept_title": "Strange Attractors as Algebraic Objects", "concept_domain": "Applications", "research_mode": "team", "quality": "partial", "quality_score": 0.57899, "catalog_references": [], "prompt_length": 20935, "files_placed": 9, "status": "keep"}
{"timestamp": 1782538728.7941616, "experiment_id": "8e92c627", "concept_title": "Exact asymptotic value of the average stack-sorting depth", "concept_domain": "Applications", "research_mode": "prove", "quality": "partial", "quality_score": 0.5924299999999999, "catalog_references": ["Catalog/Applications/StackSortingDepth.lean"], "prompt_length": 20206, "files_placed": 6, "status": "keep"}
{"timestamp": 1782541599.2044902, "experiment_id": "7f4f0e8d", "concept_title": "Proof Strategy Mining from Deep Mathematics", "concept_domain": "Novelty", "research_mode": "team", "quality": "partial", "quality_score": 0.505788, "catalog_references": [], "prompt_length": 20658, "files_placed": 9, "status": "keep"}
{"timestamp": 1782543185.5936582, "experiment_id": "ed2a76aa", "concept_title": "Non-Finite-Axiomatization of Measurable Majorities via the Incoherence Index", "concept_domain": "Novelty", "research_mode": "team", "quality": "partial", "quality_score": 0.60416, "catalog_references": ["arXiv:2606.23853", "MossPedersen2026"], "prompt_length": 20834, "files_placed": 8, "status": "keep"}
{"timestamp": 1782543293.3173792, "experiment_id": "22e3c34e", "concept_title": "Close Proofs: These conjectures continue the research cycle begun in", "concept_domain": "Applications", "research_mode": "team", "quality": "partial", "quality_score": 0.55076, "catalog_references": [], "prompt_length": 20893, "files_placed": 8, "status": "keep"}
{"timestamp": 1782543364.3194623, "experiment_id": "438f30b4", "concept_title": "EML Universal Approximation: Density of EML Functions", "concept_domain": "Applications", "research_mode": "team", "quality": "partial", "quality_score": 0.34, "catalog_references": [], "prompt_length": 20767, "files_placed": 6, "status": "discard"}
{"timestamp": 1782544914.1749744, "experiment_id": "43f6ae62", "concept_title": "Code-Based Cryptography: McEliece from Goppa Codes", "concept_domain": "Applications", "research_mode": "team", "quality": "substantial", "quality_score": 0.7796, "catalog_references": [], "prompt_length": 20779, "files_placed": 9, "status": "keep"}
{"timestamp": 1782545047.4965155, "experiment_id": "669193db", "concept_title": "Exponentialdiameter contraction under Delaunay minicenter refinement", "concept_domain": "Novelty", "research_mode": "prove", "quality": "substantial", "quality_score": 0.71552, "catalog_references": ["Applications/DelaunayContraction/PerturbedContraction.lean", "Core/MetricSpaces/Basic.lean", "Core/RealAnalysis/Series.lean", "Applications/Geometry/Delaunay.lean"], "prompt_length": 22892, "files_placed": 6, "status": "keep"}
{"timestamp": 1782546635.0286572, "experiment_id": "57a09ecd", "concept_title": "EML Fixed-Point Theorem: exp-log Iteration Convergence", "concept_domain": "Applications", "research_mode": "team", "quality": "partial", "quality_score": 0.31055800000000006, "catalog_references": [], "prompt_length": 23635, "files_placed": 51, "status": "discard"}
{"timestamp": 1782548208.5035145, "experiment_id": "08b15f3b", "concept_title": "Effective Computability of Erd\u0151s-550 Threshold", "concept_domain": "Applications", "research_mode": "prove", "quality": "partial", "quality_score": 0.6261199999999999, "catalog_references": ["Algebra/ErdosGinzburgZivConstructive.lean", "Algebra/ChevalleyWarning.lean", "Algebra/MultiplicativeInductionTactics.lean"], "prompt_length": 20870, "files_placed": 6, "status": "keep"}
{"timestamp": 1782550047.1823072, "experiment_id": "d6c98458", "concept_title": "Collatz Conjecture", "concept_domain": "Applications", "research_mode": "formalize", "quality": "partial", "quality_score": 0.4269881818181818, "catalog_references": ["Catalog/Applications/Collatz/Basic.lean", "Catalog/Applications/Collatz/CycleObstruction.lean"], "prompt_length": 20677, "files_placed": 43, "status": "discard"}
{"timestamp": 1782550210.8090262, "experiment_id": "982feb93", "concept_title": "Exponential Information Complexity Lower Bound for Periodic L_p-Discrepancy via Duality Framework", "concept_domain": "Novelty", "research_mode": "team", "quality": "partial", "quality_score": 0.35044872340425537, "catalog_references": ["math.NA (Numerical Analysis)", "math.NT (Number Theory - related to discrepancy sequences)"], "prompt_length": 22926, "files_placed": 45, "status": "discard"}
{"timestamp": 1782552579.635494, "experiment_id": "10d0f89d", "concept_title": "Perfect Numbers: Structure of Even Perfects", "concept_domain": "Applications", "research_mode": "prove", "quality": "partial", "quality_score": 0.38911390243902444, "catalog_references": [], "prompt_length": 20752, "files_placed": 42, "status": "discard"}
{"timestamp": 1782552836.836363, "experiment_id": "d409a01c", "concept_title": "Linear Brown--Erdos--Sos o(n^2) conjecture at the paper's span threshold", "concept_domain": "Novelty", "research_mode": "sorry_fill", "quality": "partial", "quality_score": 0.69727, "catalog_references": ["Catalog/Novelty/LinearBrownErdosSos.lean", "Catalog/Algebra/ErdosRenyi/Model.lean"], "prompt_length": 21053, "files_placed": 3, "status": "keep"}
{"timestamp": 1782553369.6421747, "experiment_id": "4a61f37f", "concept_title": "EML Interpolation Theory: Stone-Weierstrass for exp-log Networks", "concept_domain": "Novelty", "research_mode": "team", "quality": "partial", "quality_score": 0.38234703875969, "catalog_references": [], "prompt_length": 21710, "files_placed": 9, "status": "discard"}
{"timestamp": 1782555008.5318277, "experiment_id": "710a2a8b", "concept_title": "Universal Approximation: Quantitative Bounds", "concept_domain": "Applications", "research_mode": "prove", "quality": "partial", "quality_score": 0.415178125, "catalog_references": [], "prompt_length": 22881, "files_placed": 23, "status": "discard"}
{"timestamp": 1782556336.927884, "experiment_id": "af3ea261", "concept_title": "Fano-plane threshold for additive strong blocking sets in the h=1 case", "concept_domain": "Novelty", "research_mode": "prove", "quality": "partial", "quality_score": 0.5364949999999999, "catalog_references": ["Catalog/Algebra/ErdosRenyi/Model.lean", "Catalog/Algebra/NormalNumbers/CyclicNormal.lean", "Catalog/Algebra/ErdosRenyi/Concrete.lean"], "prompt_length": 22993, "files_placed": 16, "status": "keep"}
{"timestamp": 1782560076.6929178, "experiment_id": "53256563", "concept_title": "Quantum Thermodynamics: Landauer's Principle at the Nanoscale", "concept_domain": "Novelty", "research_mode": "team", "quality": "partial", "quality_score": 0.65187, "catalog_references": [], "prompt_length": 20800, "files_placed": 29, "status": "keep"}
{"timestamp": 1782561344.0812764, "experiment_id": "53364cc2", "concept_title": "Cusick's sum-of-digits conjecture with explicit bias bound", "concept_domain": "Applications", "research_mode": "team", "quality": "partial", "quality_score": 0.6837600000000001, "catalog_references": ["math.NT", "math.CO"], "prompt_length": 23104, "files_placed": 34, "status": "keep"}
{"timestamp": 1782562086.2787857, "experiment_id": "a151a9c3", "concept_title": "Birkhoff polytopes have the clique-face property only in dimensions n <= 2", "concept_domain": "Applications", "research_mode": "prove", "quality": "partial", "quality_score": 0.5405, "catalog_references": ["Mathlib.Analysis.Convex.Polytope", "Mathlib.Combinatorics.GraphTheory.Basic", "Mathlib.Algebra.GroupPower.Permutation", "Mathlib.Data.Matrix.Basic", "Mathlib.Analysis.Convex.Hull"], "prompt_length": 20775, "files_placed": 7, "status": "keep"}
{"timestamp": 1782568310.822561, "experiment_id": "2cb7b634", "concept_title": "Extremal Graph Theory: Tur\u00e1n and Szemer\u00e9di", "concept_domain": "Novelty", "research_mode": "prove", "quality": "substantial", "quality_score": 0.7014400000000001, "catalog_references": [], "prompt_length": 20685, "files_placed": 38, "status": "keep"}
{"timestamp": 1782568435.835884, "experiment_id": "eb034b80", "concept_title": "Tropical Riemann-Roch Theorem", "concept_domain": "Novelty", "research_mode": "team", "quality": "substantial", "quality_score": 0.8360800000000002, "catalog_references": [], "prompt_length": 20672, "files_placed": 35, "status": "keep"}
{"timestamp": 1782568571.680655, "experiment_id": "f0d5604e", "concept_title": "Conjecture: The limit of average stack-sorting depth equals Defant's upper bound", "concept_domain": "Applications", "research_mode": "team", "quality": "partial", "quality_score": 0.5150000000000001, "catalog_references": ["West (1990)", "Defant (2020)", "zhang26"], "prompt_length": 22887, "files_placed": 7, "status": "keep"}
{"timestamp": 1782568675.480602, "experiment_id": "a880054f", "concept_title": "Maximum size of pairwise orthogonal Italian squares is n\u20111 for prime powers", "concept_domain": "Novelty", "research_mode": "prove", "quality": "partial", "quality_score": 0.3646502272727273, "catalog_references": ["Catalog/Applications/ItalianSquares/UpperBound.lean", "Catalog/Algebra/FiniteFields/FieldExtensions.lean", "Catalog/Combinatorics/DesignTheory/OrthogonalArrays.lean"], "prompt_length": 20706, "files_placed": 7, "status": "discard"}
{"timestamp": 1782569807.019163, "experiment_id": "beb2abc2", "concept_title": "Uniqueness of Extremal Graphons in Sparse Threshold Problems", "concept_domain": "Novelty", "research_mode": "team", "quality": "partial", "quality_score": 0.5954, "catalog_references": ["Day & Sarkar's sparse threshold conjecture", "Fractional independence number \u03b1*(H)", "Three-step threshold graphon characterization"], "prompt_length": 22870, "files_placed": 7, "status": "keep"}
{"timestamp": 1782569915.67654, "experiment_id": "06caccbf", "concept_title": "Excluded minors for bias graphs gainable over cyclic groups \ud835\udc4d\u209a", "concept_domain": "Novelty", "research_mode": "formalize", "quality": "partial", "quality_score": 0.463, "catalog_references": ["Catalog/FINAL/Algebra/BiasedGraph.lean", "Catalog/FINAL/Algebra/Group/Zp.lean", "Catalog/FINAL/Graph/Minors.lean", "Catalog/FINAL/Graph/Operations.lean", "Catalog/FINAL/Algebra/NormalNumbers/CyclicNormal.lean"], "prompt_length": 20611, "files_placed": 6, "status": "discard"}
{"timestamp": 1782573527.9138782, "experiment_id": "31cf2713", "concept_title": "Plethystic Triviality of the Shifted t-Schur Basis", "concept_domain": "Applications", "research_mode": "formalize", "quality": "substantial", "quality_score": 0.70696, "catalog_references": ["Catalog/Novelty/DiagonalPlethysmGroup.lean", "Catalog/FINAL/MonoidMorphisms.lean", "Catalog/FINAL/EvidenceTheory.lean"], "prompt_length": 21182, "files_placed": 12, "status": "keep"}
{"timestamp": 1782575545.7867851, "experiment_id": "c85b45b6", "concept_title": "Pfaffian Giambelli Formula for Shifted t-Schur Functions", "concept_domain": "Applications", "research_mode": "team", "quality": "partial", "quality_score": 0.6839200000000001, "catalog_references": ["Greaves--Jing--Zhu operator construction", "Schur Q-functions and strict partitions", "Vertex operator algebras and symmetric functions", "Pfaffian Giambelli formulas"], "prompt_length": 21028, "files_placed": 8, "status": "keep"}
{"timestamp": 1782575656.2008858, "experiment_id": "10d599ef", "concept_title": "Langlands Correspondence: GL(1) Case", "concept_domain": "Applications", "research_mode": "prove", "quality": "partial", "quality_score": 0.64325, "catalog_references": [], "prompt_length": 22841, "files_placed": 7, "status": "keep"}
{"timestamp": 1782577183.090968, "experiment_id": "e4cbdb61", "concept_title": "Row Sum Fibonacci Property of Pascal-like Riordan Array", "concept_domain": "Novelty", "research_mode": "team", "quality": "partial", "quality_score": 0.5522400000000001, "catalog_references": ["math.CO", "Riordan_arrays", "Fibonacci_numbers", "Binomial_coefficients"], "prompt_length": 20914, "files_placed": 12, "status": "keep"}
{"timestamp": 1782577523.6228466, "experiment_id": "6fec91f1", "concept_title": "EML Differential Equations: ODEs with Exponential-Logarithmic Coefficients", "concept_domain": "Applications", "research_mode": "prove|formalize|counterexample", "quality": "substantial", "quality_score": 0.7897859999999999, "catalog_references": ["Catalog/FINAL/EMLDifferentialGalois", "Catalog/FINAL/EML_Structure"], "prompt_length": 20851, "files_placed": 12, "status": "keep"}
{"timestamp": 1782579467.1224322, "experiment_id": "492e1625", "concept_title": "Algebraic Characterization of Panmagic Affine Permutations over Z_n", "concept_domain": "Applications", "research_mode": "team", "quality": "partial", "quality_score": 0.66648, "catalog_references": ["math.CO", "math.GR", "math.NT"], "prompt_length": 21039, "files_placed": 12, "status": "keep"}
{"timestamp": 1782579720.2748446, "experiment_id": "d36ccdc3", "concept_title": "Unbounded 2-adic valuation of coefficients in F_m(x)^m for m \u2265 2", "concept_domain": "Novelty", "research_mode": "sorry_fill", "quality": "partial", "quality_score": 0.41604728262910795, "catalog_references": ["Novelty/ThueMorsePowerValuation.lean", "Novelty/ThueMorsePowerParityShadow.lean"], "prompt_length": 20641, "files_placed": 7, "status": "discard"}
{"timestamp": 1782580318.5264368, "experiment_id": "33ec0c7d", "concept_title": "Characterization of Modular Rank Four Nahm Sums via Discriminant Condition", "concept_domain": "Applications", "research_mode": "prove", "quality": "partial", "quality_score": 0.5884799999999999, "catalog_references": ["Catalog/Applications/NahmSums/Discriminant.lean", "Catalog/Algebra/ErdosRenyi/Model.lean"], "prompt_length": 23035, "files_placed": 14, "status": "keep"}
{"timestamp": 1782584080.67712, "experiment_id": "bd70abee", "concept_title": "Explicit bias lower bound for the density of n with s_2(n+t) >= s_2(n)", "concept_domain": "Applications", "research_mode": "team", "quality": "substantial", "quality_score": 0.7003299999999999, "catalog_references": ["DrmotaKauersSpiegelhofer2016"], "prompt_length": 20660, "files_placed": 9, "status": "keep"}
{"timestamp": 1782585816.5003266, "experiment_id": "f8a707b1", "concept_title": "Twin Prime Gaps: Zhang-Maynard Formalization", "concept_domain": "Novelty", "research_mode": "prove", "quality": "substantial", "quality_score": 0.7756646153846154, "catalog_references": [], "prompt_length": 22854, "files_placed": 8, "status": "keep"}
{"timestamp": 1782585904.980944, "experiment_id": "2ff65a6a", "concept_title": "Bridge: Tropical Geometry as a Limit of Classical Algebraic Geometry", "concept_domain": "Novelty", "research_mode": "prove", "quality": "partial", "quality_score": 0.6490400000000001, "catalog_references": ["Mathlib/Algebra/Valuation/Basic.lean", "Mathlib/Analysis/Calculus/Deriv/Polynomial.lean"], "prompt_length": 20857, "files_placed": 10, "status": "keep"}
{"timestamp": 1782586049.6127007, "experiment_id": "e8be0a2a", "concept_title": "EML Transseries: Asymptotic Expansions Beyond Power Series", "concept_domain": "Applications", "research_mode": "team", "quality": "substantial", "quality_score": 0.8740959999999999, "catalog_references": [], "prompt_length": 22947, "files_placed": 8, "status": "keep"}
{"timestamp": 1782586226.48547, "experiment_id": "4398a39a", "concept_title": "Proof Automation: Custom Lean 4 Tactics", "concept_domain": "Applications", "research_mode": "prove", "quality": "partial", "quality_score": 0.6822699999999999, "catalog_references": [], "prompt_length": 20723, "files_placed": 6, "status": "keep"}
{"timestamp": 1782586921.8237038, "experiment_id": "935abbfb", "concept_title": "Character Class Contradiction", "concept_domain": "Novelty", "research_mode": "formalize", "quality": "partial", "quality_score": 0.484642, "catalog_references": ["Catalog/FINAL/Matrix/Basic.lean", "Catalog/FINAL/LinearAlgebra/Matrix/Charpoly.lean", "Catalog/FINAL/NumberTheory/ZetaFunction.lean"], "prompt_length": 17728, "files_placed": 6, "status": "discard"}
{"timestamp": 1782589081.1061563, "experiment_id": "f2fdcb78", "concept_title": "Ramsey Theory: Bounds and Constructions", "concept_domain": "Applications", "research_mode": "prove", "quality": "substantial", "quality_score": 0.84592, "catalog_references": [], "prompt_length": 20724, "files_placed": 8, "status": "keep"}
{"timestamp": 1782589288.6896713, "experiment_id": "bdfd9dbb", "concept_title": "Polynomial-Logarithmic Time Algorithm for Global Label Min-Cut", "concept_domain": "Physics", "research_mode": "prove", "quality": "partial", "quality_score": 0.3683071607142858, "catalog_references": ["Catalog/GraphTheory/Treewidth.lean", "Catalog/GraphTheory/PlanarSeparator.lean", "Catalog/Algorithms/TreeDecompositionDP.lean", "Catalog/TopologicalGraphTheory/GenusEmbedding.lean", "Catalog/Combinatorics/GridMinorTheorem.lean"], "prompt_length": 20721, "files_placed": 6, "status": "discard"}
{"timestamp": 1782590454.3206143, "experiment_id": "2e08d081", "concept_title": "A Prime-Power Criterion for GCDs of Binomial Coefficients with Restricted Upper Index Range", "concept_domain": "Novelty", "research_mode": "formalize", "quality": "partial", "quality_score": 0.6115200000000001, "catalog_references": ["Catalog/Novelty/BinomialGCDFRange.lean", "Catalog/Novelty/BinomialGCDA080170.lean", "Catalog/Novelty/BinomialGCDA080170PrimePower.lean"], "prompt_length": 18552, "files_placed": 6, "status": "keep"}
{"timestamp": 1782592709.0098555, "experiment_id": "e3ff7cf5", "concept_title": "Complement-split minima exceed the quasi-star/quasi-clique envelope for semi-induced stars S_{k,1}", "concept_domain": "Applications", "research_mode": "team", "quality": "substantial", "quality_score": 0.7938000000000001, "catalog_references": ["math.CO/2025_fix_density_S21", "Balogh_Lidicky_Mubayi_Pfender_Volec_star_inducibility", "Basit_Granet_Horsley_Kundgen_Staden_semi_inducibility"], "prompt_length": 21207, "files_placed": 7, "status": "keep"}
{"timestamp": 1782594142.1359255, "experiment_id": "a33a1330", "concept_title": "EML Fixed-Point Theorem: exp-log Iteration Convergence", "concept_domain": "Applications", "research_mode": "team", "quality": "partial", "quality_score": 0.6787, "catalog_references": [], "prompt_length": 23635, "files_placed": 7, "status": "keep"}
{"timestamp": 1782594278.215191, "experiment_id": "b3c4aeb5", "concept_title": "Fano-plane threshold for additive strong blocking sets in the h=1 case", "concept_domain": "Novelty", "research_mode": "team", "quality": "partial", "quality_score": 0.59463, "catalog_references": ["Mathlib.Data.ZMod.Basic", "Mathlib.LinearAlgebra.FiniteDimensional", "Mathlib.LinearAlgebra.ProjectiveSpace", "Mathlib.LinearAlgebra.Dimension.Finrank", "Mathlib.Data.Finset.Card"], "prompt_length": 19421, "files_placed": 6, "status": "keep"}
{"timestamp": 1782596139.1587524, "experiment_id": "dd8b8392", "concept_title": "EML Differential Equations: ODEs with Exponential-Logarithmic Coefficients", "concept_domain": "Applications", "research_mode": "team", "quality": "partial", "quality_score": 0.47243587450980395, "catalog_references": [], "prompt_length": 22956, "files_placed": 7, "status": "discard"}
