{"timestamp": 1782821945.6167865, "experiment_id": "e6cf72d1", "concept_title": "Universal Approximation: Quantitative Bounds", "concept_domain": "Tropical", "research_mode": "formalize", "quality": "partial", "quality_score": 0.65752, "catalog_references": [], "prompt_length": 22885, "files_placed": 6, "status": "keep"}
{"timestamp": 1782823239.4265883, "experiment_id": "65d4cbfc", "concept_title": "Balla's Conjecture for \u03b1 = 1/3", "concept_domain": "Bridges", "research_mode": "prove", "quality": "partial", "quality_score": 0.5948800000000001, "catalog_references": ["Catalog/FINAL/SpectralBound.lean"], "prompt_length": 22453, "files_placed": 6, "status": "keep"}
{"timestamp": 1782835672.4780118, "experiment_id": "913b7f3f", "concept_title": "Elliptic Curve Cryptography: Weil Pairing and BLS Signatures", "concept_domain": "Novelty", "research_mode": "team", "quality": "partial", "quality_score": 0.682396, "catalog_references": [], "prompt_length": 22902, "files_placed": 7, "status": "keep"}
{"timestamp": 1782838502.1896727, "experiment_id": "65ebb6ab", "concept_title": "No-Stretching Property of GF(2) Quotient Labelings from Edge Partitions", "concept_domain": "Applications", "research_mode": "prove", "quality": "partial", "quality_score": 0.5526146420618556, "catalog_references": ["Mathlib/Combinatorics/SimpleGraph/Connectivity.lean", "Mathlib/Combinatorics/SimpleGraph/Walk.lean", "Mathlib/Data/Fin/Vec.lean", "Mathlib/Data/ZMod/Basic.lean", "Mathlib/Data/Fintype/Card.lean", "Mathlib/Tactic/Linarith.lean"], "prompt_length": 23091, "files_placed": 6, "status": "keep"}
{"timestamp": 1782842455.5663414, "experiment_id": "d5c197ae", "concept_title": "Birch and Swinnerton-Dyer Conjecture", "concept_domain": "Probability", "research_mode": "prove", "quality": "partial", "quality_score": 0.4285765151515152, "catalog_references": ["Catalog/FINAL/Probability/", "Catalog/FINAL/Combinatorics/"], "prompt_length": 22812, "files_placed": 6, "status": "discard"}
{"timestamp": 1782847428.40514, "experiment_id": "3131feed", "concept_title": "Goldbach Verification Framework", "concept_domain": "Probability", "research_mode": "prove", "quality": "partial", "quality_score": 0.41286596521739133, "catalog_references": ["GoldbachReps.lean"], "prompt_length": 20889, "files_placed": 6, "status": "discard"}
{"timestamp": 1782867552.7659268, "experiment_id": "83afa678", "concept_title": "Fourier Analysis on Finite Groups", "concept_domain": "Applications", "research_mode": "prove", "quality": "partial", "quality_score": 0.60704, "catalog_references": [], "prompt_length": 22857, "files_placed": 8, "status": "keep"}
{"timestamp": 1782870650.250151, "experiment_id": "c69c4ab9", "concept_title": "Square-Root Cancellation for GL(2) Triple Correlation Sums", "concept_domain": "Logic", "research_mode": "sorry_fill", "quality": "partial", "quality_score": 0.4328038727272727, "catalog_references": [], "prompt_length": 21584, "files_placed": 6, "status": "discard"}
{"timestamp": 1782874159.2235715, "experiment_id": "adbfcd0f", "concept_title": "Stereographic Fourier Analysis: Spherical Harmonics via Plane Waves", "concept_domain": "Applications", "research_mode": "formalize", "quality": "partial", "quality_score": 0.45705761904761916, "catalog_references": ["Applications/StereographicProjection.lean", "Analysis/InnerProductSpace/Basic.lean"], "prompt_length": 18738, "files_placed": 6, "status": "discard"}
{"timestamp": 1782878549.766744, "experiment_id": "650b150d", "concept_title": "Convex Position Minimizes Plane Graphs", "concept_domain": "Novelty", "research_mode": "team", "quality": "partial", "quality_score": 0.516675, "catalog_references": ["math.CO", "52C10", "05C30", "05C10"], "prompt_length": 23158, "files_placed": 6, "status": "keep"}
{"timestamp": 1782879682.975145, "experiment_id": "562c0234", "concept_title": "Zero-Knowledge Proof Systems: Formal Verification of Privacy", "concept_domain": "Physics", "research_mode": "team", "quality": "substantial", "quality_score": 0.74152, "catalog_references": [], "prompt_length": 22870, "files_placed": 7, "status": "keep"}
{"timestamp": 1782892962.2993863, "experiment_id": "90d1d2b2", "concept_title": "Projective Plane Coupon Collection Slowness", "concept_domain": "Novelty", "research_mode": "sorry_fill", "quality": "partial", "quality_score": 0.3699978030769231, "catalog_references": [], "prompt_length": 19778, "files_placed": 6, "status": "discard"}
{"timestamp": 1782895744.2996008, "experiment_id": "3fc75f2f", "concept_title": "Quadratic Reciprocity: Five Proofs Formalized", "concept_domain": "NumberTheory", "research_mode": "prove", "quality": "partial", "quality_score": 0.3972276, "catalog_references": ["NumberTheory/LegendreSymbol/Basic.lean", "Data/ZMod/Basic.lean", "Data/ZMod/Quotient.lean", "Data/Nat/Prime/Defs.lean"], "prompt_length": 19865, "files_placed": 6, "status": "discard"}
{"timestamp": 1782909246.7890906, "experiment_id": "3257177e", "concept_title": "Euler Product for Autocorrelation of Simultaneously Visible Lattice Points", "concept_domain": "MachineLearning", "research_mode": "formalize", "quality": "partial", "quality_score": 0.5029119272727274, "catalog_references": ["MachineLearning/VisibleLattice/Core.lean"], "prompt_length": 23383, "files_placed": 6, "status": "keep"}
{"timestamp": 1782910720.8396838, "experiment_id": "ddab9e68", "concept_title": "Crystal Reflections Preserve d-Balanced Property of Partitions", "concept_domain": "Computation", "research_mode": "sorry_fill", "quality": "partial", "quality_score": 0.63296, "catalog_references": [], "prompt_length": 18296, "files_placed": 6, "status": "keep"}
{"timestamp": 1782910929.9957325, "experiment_id": "c4e68c8d", "concept_title": "STRD Domatic Number Equals One for Graphs with a Degree-3 Vertex", "concept_domain": "Cryptography", "research_mode": "formalize", "quality": "partial", "quality_score": 0.6812400000000001, "catalog_references": ["Catalog.GraphTheory.SubgraphProperties", "Catalog.Algebra.Order", "Catalog.Logic.Function", "Catalog.Data.Fin", "Catalog.Mathlib.Data.Real.Basic"], "prompt_length": 23040, "files_placed": 6, "status": "keep"}
{"timestamp": 1782912573.6845195, "experiment_id": "fb9fd2df", "concept_title": "The 29-vertex augmented unit-distance graph has geometric fractional chromatic number strictly greater than 4", "concept_domain": "Geometry", "research_mode": "team", "quality": "substantial", "quality_score": 0.8091999999999999, "catalog_references": ["MRVZ", "deGrey", "Er87"], "prompt_length": 23271, "files_placed": 7, "status": "keep"}
{"timestamp": 1782919158.2859132, "experiment_id": "8875d434", "concept_title": "Minimum Independence Ratio Constraint", "concept_domain": "Computation", "research_mode": "team", "quality": "substantial", "quality_score": 0.7476214285714285, "catalog_references": "Matolcsi, Ruzsa, Varga, Zs\u00e1mboki", "prompt_length": 22779, "files_placed": 7, "status": "keep"}
{"timestamp": 1782919262.1263342, "experiment_id": "52dd778d", "concept_title": "Infinite Sign Changes of Symmetric Power L-Function Coefficients over Sums of m Squares for All Even m", "concept_domain": "Applications", "research_mode": "team", "quality": "substantial", "quality_score": 0.7232000000000001, "catalog_references": ["math.NT", "11F11", "11F30", "11E25"], "prompt_length": 23153, "files_placed": 6, "status": "keep"}
{"timestamp": 1782919550.480782, "experiment_id": "dd442784", "concept_title": "Dimension of Second Clique Homology for Latin Square Graphs", "concept_domain": "Novelty", "research_mode": "prove", "quality": "substantial", "quality_score": 0.759526, "catalog_references": ["Catalog/FINAL/SetTheory/Basic.lean", "Catalog/FINAL/Combinatorics/EulerCharacteristic.lean", "Catalog/FINAL/AlgebraicTopology/SimplicialChains.lean"], "prompt_length": 22899, "files_placed": 6, "status": "keep"}
{"timestamp": 1782924666.0974264, "experiment_id": "0eefe6b1", "concept_title": "Digit Sum Formula for Prime Reciprocals with Half-Order Periods", "concept_domain": "Shared", "research_mode": "team", "quality": "partial", "quality_score": 0.65777, "catalog_references": ["math.NT", "Dedekind sums", "Generalized Bernoulli numbers", "Digit expansions"], "prompt_length": 22871, "files_placed": 7, "status": "keep"}
{"timestamp": 1782924732.415186, "experiment_id": "04b163c8", "concept_title": "Sum of digits of 1/p for half-period length and p \u2261 1 mod 4", "concept_domain": "Combinatorics", "research_mode": "prove", "quality": "partial", "quality_score": 0.6772579999999999, "catalog_references": ["DigitSumFullPeriod.lean", "DigitSumHalfPeriod.lean", "Mathlib.NumberTheory.OrderOfElement.lean", "Mathlib.Data.Nat.Digits.lean"], "prompt_length": 22629, "files_placed": 6, "status": "keep"}
{"timestamp": 1782926286.492278, "experiment_id": "c56262ed", "concept_title": "Learning with Errors: Hardness Reductions", "concept_domain": "Applications", "research_mode": "team", "quality": "partial", "quality_score": 0.456932, "catalog_references": [], "prompt_length": 22767, "files_placed": 8, "status": "discard"}
{"timestamp": 1782927913.9107513, "experiment_id": "33af5349", "concept_title": "Sensitivity Conjecture Extensions", "concept_domain": "Algebra", "research_mode": "team", "quality": "partial", "quality_score": 0.48355851612903233, "catalog_references": [], "prompt_length": 22796, "files_placed": 7, "status": "discard"}
{"timestamp": 1782930884.6170242, "experiment_id": "e5cb827b", "concept_title": "Geometric fractional chromatic number of the 29-vertex augmented configuration exceeds 4", "concept_domain": "Algebra", "research_mode": "team", "quality": "partial", "quality_score": 0.45374800000000004, "catalog_references": ["MRVZ_27_vertex_config", "de_Grey_chromatic_number", "Erdos_independence_ratio_problem"], "prompt_length": 23135, "files_placed": 7, "status": "discard"}
{"timestamp": 1782931481.8974164, "experiment_id": "21b9f7f8", "concept_title": "Franke Decomposition for SL(2, Z) Automorphic Forms", "concept_domain": "Applications", "research_mode": "team", "quality": "partial", "quality_score": 0.6964000000000001, "catalog_references": ["math.NT", "math.RT", "math.SP"], "prompt_length": 22858, "files_placed": 7, "status": "keep"}
{"timestamp": 1782936619.6628828, "experiment_id": "f1070a48", "concept_title": "Existence of a finite unit-distance graph in R\u00b2 with independence ratio below 1/4", "concept_domain": "Novelty", "research_mode": "team", "quality": "substantial", "quality_score": 0.8322400000000001, "catalog_references": ["math.CO", "unit_distance_graphs", "fractional_chromatic_number", "Hadwiger-Nelson_problem", "Erdos_independence_ratio"], "prompt_length": 22997, "files_placed": 8, "status": "keep"}
{"timestamp": 1782940821.6172142, "experiment_id": "c732c146", "concept_title": "\u03b2(Z\u2082 \u00d7 Z_{2^n}) = 2^{n+1} + 2 for all positive integers n", "concept_domain": "Algebra", "research_mode": "sorry_fill", "quality": "partial", "quality_score": 0.6195219999999999, "catalog_references": ["FINAL/Algebra/BetaTropical.lean", "FINAL/Algebra/PosetConstructions.lean", "FINAL/Algebra/BetaLowerBounds.lean"], "prompt_length": 19899, "files_placed": 6, "status": "keep"}
{"timestamp": 1782942117.7867022, "experiment_id": "f29abd01", "concept_title": "Non-3-Colorability of C4-Free Diameter-2 Graphs with Maximum Degree at least 17", "concept_domain": "Novelty", "research_mode": "team", "quality": "partial", "quality_score": 0.61208, "catalog_references": ["math.CO", "cs.DM"], "prompt_length": 22831, "files_placed": 7, "status": "keep"}
{"timestamp": 1782943547.8415942, "experiment_id": "acbfd883", "concept_title": "Infinite Sign Changes of Symmetric Power L-Function Coefficients over Sums of m Squares for All Even m", "concept_domain": "Novelty", "research_mode": "team", "quality": "partial", "quality_score": 0.65944, "catalog_references": ["math.NT", "11F11", "11F30", "11E25"], "prompt_length": 23164, "files_placed": 7, "status": "keep"}
{"timestamp": 1782947420.389706, "experiment_id": "7469cf90", "concept_title": "Proof Automation: Custom Lean 4 Tactics", "concept_domain": "Applications", "research_mode": "prove", "quality": "partial", "quality_score": 0.6437080000000001, "catalog_references": [], "prompt_length": 22862, "files_placed": 9, "status": "keep"}
{"timestamp": 1782948689.8042452, "experiment_id": "a725bb00", "concept_title": "Petersen Graph Non-Embeddability into Abelian Cayley Graphs", "concept_domain": "Applications", "research_mode": "team", "quality": "substantial", "quality_score": 0.7976880000000001, "catalog_references": ["mathlib4#Combinatorics.SimpleGraph.Walk", "mathlib4#Combinatorics.SimpleGraph.IsometricEmbedding", "mathlib4#GroupTheory.Cayley", "mathlib4#Data.Finsupp.Defs"], "prompt_length": 23442, "files_placed": 7, "status": "keep"}
{"timestamp": 1782950080.8000882, "experiment_id": "35d54dba", "concept_title": "Minimum Independence Ratio Constraint", "concept_domain": "Novelty", "research_mode": "team", "quality": "partial", "quality_score": 0.527476, "catalog_references": "Matolcsi, Ruzsa, Varga, Zs\u00e1mboki", "prompt_length": 22771, "files_placed": 8, "status": "keep"}
{"timestamp": 1782953230.555692, "experiment_id": "307e78f2", "concept_title": "Exact sign law for coefficients of Ramanujan's third order mock theta function \u03c1(q)", "concept_domain": "Novelty", "research_mode": "team", "quality": "partial", "quality_score": 0.46884433623188404, "catalog_references": ["math.NT", "q-series", "mock_theta_functions", "Ramanujan", "partition_theory"], "prompt_length": 23072, "files_placed": 7, "status": "discard"}
{"timestamp": 1782954910.3437953, "experiment_id": "b87dcfdc", "concept_title": "Hilbert 12: Kronecker-Weber Generalization", "concept_domain": "Novelty", "research_mode": "team", "quality": "substantial", "quality_score": 0.84436, "catalog_references": [], "prompt_length": 22794, "files_placed": 8, "status": "keep"}
{"timestamp": 1782955473.7416492, "experiment_id": "f955b422", "concept_title": "Improved Bilu-Linial Spectral Bound via Interlacing Families", "concept_domain": "Novelty", "research_mode": "prove", "quality": "partial", "quality_score": 0.6399900000000001, "catalog_references": ["Catalog/Novelty/SignedGraphSpectralEquality.lean"], "prompt_length": 19887, "files_placed": 6, "status": "keep"}
{"timestamp": 1782957593.2308655, "experiment_id": "946cfca3", "concept_title": "Balla's Conjecture for \u03b1 = 1/3", "concept_domain": "Applications", "research_mode": "team", "quality": "partial", "quality_score": 0.557, "catalog_references": ["Lemmens-Seidel-73", "Balla-Draxler-Keevash-Sudakov-18", "Jiang-Polyanskii-20"], "prompt_length": 22935, "files_placed": 7, "status": "keep"}
{"timestamp": 1782957747.537704, "experiment_id": "50540462", "concept_title": "Uniform Extremality for Siblings of the Coupon Collector", "concept_domain": "Novelty", "research_mode": "team", "quality": "substantial", "quality_score": 0.7700800000000001, "catalog_references": ["coupon_collector", "Schur_concavity", "majorization", "stochastic_optimization"], "prompt_length": 23023, "files_placed": 7, "status": "keep"}
{"timestamp": 1782959265.3646398, "experiment_id": "38047daa", "concept_title": "Uniqueness of the Critical 2-Vertex Augmentation of G27", "concept_domain": "Novelty", "research_mode": "team", "quality": "partial", "quality_score": 0.6813500000000001, "catalog_references": ["math.CO", "unit_distance_graphs", "geometric_fractional_chromatic_number"], "prompt_length": 23147, "files_placed": 7, "status": "keep"}
{"timestamp": 1782959359.9355757, "experiment_id": "f4462f16", "concept_title": "No-Stretching Property of GF(2) Quotient Labelings from Edge Partitions", "concept_domain": "Applications", "research_mode": "team", "quality": "substantial", "quality_score": 0.79052, "catalog_references": ["Djokovic-Winkler relation", "partial cubes", "isometric embeddings", "Cayley graphs of abelian groups", "GF(2) linear algebra"], "prompt_length": 23125, "files_placed": 6, "status": "keep"}
{"timestamp": 1782960504.337376, "experiment_id": "135cab00", "concept_title": "Classification of \u03c1-dominant elements in B(\u03c1) for symmetrizable Kac-Moody algebras", "concept_domain": "Novelty", "research_mode": "team", "quality": "substantial", "quality_score": 0.7176246153846154, "catalog_references": ["arXiv:xxxx.xxxxx", "math.RT", "math.CO"], "prompt_length": 23224, "files_placed": 7, "status": "keep"}
{"timestamp": 1782964266.918954, "experiment_id": "d80d981e", "concept_title": "Non-embeddability of the Petersen graph into tropical abelian Cayley graphs", "concept_domain": "Tropical", "research_mode": "prove", "quality": "substantial", "quality_score": 0.87056, "catalog_references": ["Applications/PetersenGraphNonEmbeddability.lean", "Algebra/Tropical/FundamentalTheorem/Bezout.lean", "Bridges/ValuationSkeletonDuality/Core.lean"], "prompt_length": 22652, "files_placed": 7, "status": "keep"}
{"timestamp": 1782964556.5220203, "experiment_id": "6501d983", "concept_title": "Deepening: Hilbert 12: Kronecker-Weber Generalization", "concept_domain": "Applications", "research_mode": "formalize", "quality": "partial", "quality_score": 0.6341419999999999, "catalog_references": ["Catalog/Novelty/ClassGroup.lean", "Catalog/Final/NumberTheory/ClassFieldTheory.lean", "Catalog/Novelty/CyclotomicGaloisDegree.lean"], "prompt_length": 20436, "files_placed": 6, "status": "keep"}
{"timestamp": 1782969517.0986981, "experiment_id": "8b6fc6d0", "concept_title": "unnamed_concept", "concept_domain": "Pythagorean", "research_mode": "prove", "quality": "substantial", "quality_score": 0.7859200000000002, "catalog_references": [], "prompt_length": 22690, "files_placed": 8, "status": "keep"}
{"timestamp": 1782971898.929803, "experiment_id": "89d6c3ef", "concept_title": "ML-guided theorem discovery via adaptive proof distillation (NeuralProofMining)", "concept_domain": "MachineLearning", "research_mode": "formalize", "quality": "partial", "quality_score": 0.6913, "catalog_references": ["Applications/EMLActivationDensity.lean", "Applications/HoTT/ConstructiveFoundations.lean", "Bridges/EMLSpectralSemantics.lean", "Bridges/ValuationSkeletonDuality/Core.lean"], "prompt_length": 22763, "files_placed": 69, "status": "keep"}
{"timestamp": 1782977525.5017319, "experiment_id": "3ce1bfcd", "concept_title": "Quantum Surreal Numbers: Superposition of All Real Numbers", "concept_domain": "Geometry", "research_mode": "team", "quality": "partial", "quality_score": 0.3795434181818182, "catalog_references": [], "prompt_length": 24038, "files_placed": 32, "status": "discard"}
{"timestamp": 1782978933.240673, "experiment_id": "756bc0b6", "concept_title": "Refined enumeration of greedy Tamari intervals by valley count equals refined enumeration of bipartite planar maps by black vertex count", "concept_domain": "Applications", "research_mode": "team", "quality": "partial", "quality_score": 0.389, "catalog_references": ["math.CO"], "prompt_length": 23036, "files_placed": 44, "status": "discard"}
{"timestamp": 1782982592.99689, "experiment_id": "8b7f43f1", "concept_title": "OEIS sequence: Maximal number of \"good\" manifolds in an n-nice polytope.", "concept_domain": "Novelty", "research_mode": "team", "quality": "substantial", "quality_score": 0.7303200000000001, "catalog_references": [], "prompt_length": 23004, "files_placed": 7, "status": "keep"}
{"timestamp": 1782982940.0777135, "experiment_id": "4055f798", "concept_title": "The Library of Babel: Combinatorics of the Universal Library", "concept_domain": "Cryptography", "research_mode": "team", "quality": "substantial", "quality_score": 0.7906799999999999, "catalog_references": [], "prompt_length": 24034, "files_placed": 58, "status": "keep"}
{"timestamp": 1782983130.8269985, "experiment_id": "7f18348a", "concept_title": "Prove Fermats Little Theorem for p=5", "concept_domain": "Physics", "research_mode": "team", "quality": "partial", "quality_score": 0.3417571627906977, "catalog_references": [], "prompt_length": 22841, "files_placed": 39, "status": "discard"}
{"timestamp": 1782990804.077513, "experiment_id": "ce78e135", "concept_title": "Prove Fermats Little Theorem for p=5", "concept_domain": "Logic", "research_mode": "team", "quality": "partial", "quality_score": 0.48488999999999993, "catalog_references": [], "prompt_length": 20513, "files_placed": 7, "status": "discard"}
{"timestamp": 1782993327.9112096, "experiment_id": "e39940c9", "concept_title": "Entanglement-Inspired Algorithmic Complexity in Noncommutative Spaces", "concept_domain": "Shared", "research_mode": "team", "quality": "partial", "quality_score": 0.45987362, "catalog_references": [], "prompt_length": 23061, "files_placed": 8, "status": "discard"}
{"timestamp": 1782994717.6112192, "experiment_id": "4fe41de5", "concept_title": "Prove Fermats Little Theorem for p=5", "concept_domain": "Probability", "research_mode": "prove", "quality": "partial", "quality_score": 0.22782352380952384, "catalog_references": ["Catalog/Arithmetic/BasicModularArithmetic.lean", "Catalog/NumberTheory/ResidueClasses.lean"], "prompt_length": 299, "files_placed": 0, "status": "discard"}
{"timestamp": 1782994969.8400552, "experiment_id": "813a28d3", "concept_title": "Hyperbolic Number Theory: Arithmetic on the Poincar\u00e9 Disk", "concept_domain": "Combinatorics", "research_mode": "prove", "quality": "partial", "quality_score": 0.6896399999999999, "catalog_references": ["Catalog/Geometry/HyperbolicDisk/Integers.lean"], "prompt_length": 23250, "files_placed": 6, "status": "keep"}
