{"timestamp": 1785540394.62755, "experiment_id": "e86cdc26", "concept_title": "Asymptotic Brill-Noether Existence for Random Regular Graphs at Half-Canonical Degree", "concept_domain": "Computation", "research_mode": "team", "quality": "substantial", "quality_score": 0.8002199999999999, "catalog_references": ["Asymptotic Brill-Noether Existence at the Half-Canonical Degree: Energy Pairing, Cheeger Inequality and Covering Radii"], "prompt_length": 21509, "files_placed": 4, "status": "keep"}
{"timestamp": 1785540471.2330306, "experiment_id": "a7ba7617", "concept_title": "Zero-Point-Harvesting: Thermodynamic Upper Bound for Vacuum Energy Extraction", "concept_domain": "Shared", "research_mode": "team", "quality": "substantial", "quality_score": 0.76172, "catalog_references": [], "prompt_length": 23475, "files_placed": 4, "status": "keep"}
{"timestamp": 1785556735.3176336, "experiment_id": "bb566a68", "concept_title": "EML Transseries: Asymptotic Expansions Beyond Power Series", "concept_domain": "Applications", "research_mode": "team", "quality": "substantial", "quality_score": 0.7828599999999999, "catalog_references": [], "prompt_length": 23220, "files_placed": 4, "status": "keep"}
{"timestamp": 1785558029.7251797, "experiment_id": "150a94b2", "concept_title": "EML Neural Network Expressiveness: Depth vs Width", "concept_domain": "Applications", "research_mode": "team", "quality": "substantial", "quality_score": 0.73519, "catalog_references": [], "prompt_length": 20830, "files_placed": 4, "status": "keep"}
{"timestamp": 1785558105.2307253, "experiment_id": "788947d7", "concept_title": "EML Number Theory: Transcendence and Algebraic Independence", "concept_domain": "Applications", "research_mode": "team", "quality": "substantial", "quality_score": 0.7986800000000001, "catalog_references": [], "prompt_length": 23810, "files_placed": 4, "status": "keep"}
{"timestamp": 1785566849.7977579, "experiment_id": "04022a5b", "concept_title": "Moonshot: Nanotechnology Computation \u2014 Molecular Computing Limits", "concept_domain": "Novelty", "research_mode": "team", "quality": "partial", "quality_score": 0.686, "catalog_references": [], "prompt_length": 3453, "files_placed": 1, "status": "keep"}
{"timestamp": 1785566890.4052677, "experiment_id": "d58932ad", "concept_title": "Inverse Stereographic Persistence: Topological Data Analysis on Spheres", "concept_domain": "Computation", "research_mode": "team", "quality": "substantial", "quality_score": 0.7725, "catalog_references": [], "prompt_length": 22704, "files_placed": 4, "status": "keep"}
{"timestamp": 1785576607.3918452, "experiment_id": "ed94092b", "concept_title": "The general reconstruction conjecture remains open. The formal results in `Catal", "concept_domain": "Combinatorics", "research_mode": "team", "quality": "substantial", "quality_score": 0.7667599999999999, "catalog_references": [], "prompt_length": 25263, "files_placed": 4, "status": "keep"}
{"timestamp": 1785576685.5200646, "experiment_id": "cb10fc42", "concept_title": "ArXiv paper: Strongly complete sets and a conjecture of Erd\u0151s", "concept_domain": "Logic", "research_mode": "team", "quality": "substantial", "quality_score": 0.7388999999999999, "catalog_references": [], "prompt_length": 25339, "files_placed": 4, "status": "keep"}
{"timestamp": 1785584649.1409643, "experiment_id": "0e1eb0cb", "concept_title": "Tropical Matroid Theory: Bergman Fans and Tropical Linear Spaces", "concept_domain": "Tropical", "research_mode": "team", "quality": "substantial", "quality_score": 0.80043, "catalog_references": [], "prompt_length": 23742, "files_placed": 4, "status": "keep"}
{"timestamp": 1785584724.4928021, "experiment_id": "ee0c99e7", "concept_title": "ML Universal Approximation: Width vs Depth Trade-offs", "concept_domain": "MachineLearning", "research_mode": "team", "quality": "substantial", "quality_score": 0.80029, "catalog_references": [], "prompt_length": 24095, "files_placed": 4, "status": "keep"}
{"timestamp": 1785584800.0558913, "experiment_id": "febd9c83", "concept_title": "Future directions from cycle a5e9a5f6", "concept_domain": "Geometry", "research_mode": "team", "quality": "substantial", "quality_score": 0.74513, "catalog_references": [], "prompt_length": 21202, "files_placed": 4, "status": "keep"}
{"timestamp": 1785593062.4143794, "experiment_id": "c0a515f0", "concept_title": "Certified Adversarial Robustness via Sheaf Cohomology", "concept_domain": "MachineLearning", "research_mode": "team", "quality": "substantial", "quality_score": 0.7776099999999999, "catalog_references": [], "prompt_length": 23750, "files_placed": 4, "status": "keep"}
{"timestamp": 1785598090.9719858, "experiment_id": "9cde2d61", "concept_title": "Alien Mathematics: Non-Standard Arithmetic", "concept_domain": "Novelty", "research_mode": "team", "quality": "partial", "quality_score": 0.686, "catalog_references": [], "prompt_length": 2130, "files_placed": 5, "status": "keep"}
{"timestamp": 1785604967.7479792, "experiment_id": "7726ff6e", "concept_title": "1. **Converse criterion.** Prove that uniform frequencies of all aligned base-`b", "concept_domain": "NumberTheory", "research_mode": "team", "quality": "partial", "quality_score": 0.686, "catalog_references": [], "prompt_length": 5504, "files_placed": 2, "status": "keep"}
{"timestamp": 1785605048.300471, "experiment_id": "647e3d96", "concept_title": "Observer-Dependent-Reality: Collapse Dynamics in Perceptual State Fields", "concept_domain": "Physics", "research_mode": "team", "quality": "substantial", "quality_score": 0.7752299999999999, "catalog_references": [], "prompt_length": 21213, "files_placed": 4, "status": "keep"}
{"timestamp": 1785605126.3309286, "experiment_id": "66e718fe", "concept_title": "Retrocausal Proof Theory: Proving Theorems by Their Consequences", "concept_domain": "Novelty", "research_mode": "team", "quality": "substantial", "quality_score": 0.8129599999999999, "catalog_references": [], "prompt_length": 26870, "files_placed": 5, "status": "keep"}
{"timestamp": 1785608493.4900582, "experiment_id": "a7f30302", "concept_title": "Deepening: Galois Theory of Cellular Automata: Which Rules Have Reversible Dynamics?", "concept_domain": "Novelty", "research_mode": "team", "quality": "substantial", "quality_score": 0.78251, "catalog_references": [], "prompt_length": 25074, "files_placed": 4, "status": "keep"}
{"timestamp": 1785608573.0551383, "experiment_id": "6c98f572", "concept_title": "Bridge: Fourier Analysis as a Functor", "concept_domain": "Computation", "research_mode": "team", "quality": "substantial", "quality_score": 0.80505, "catalog_references": [], "prompt_length": 24839, "files_placed": 4, "status": "keep"}
{"timestamp": 1785608579.8240707, "experiment_id": "74a8a74b", "concept_title": "EML Special Functions: Gamma, Zeta, and Hypergeometric", "concept_domain": "Applications", "research_mode": "team", "quality": "partial", "quality_score": 0.69669, "catalog_references": [], "prompt_length": 2775, "files_placed": 2, "status": "keep"}
{"timestamp": 1785613391.957213, "experiment_id": "9fb19498", "concept_title": "Tropical Intersection Theory", "concept_domain": "Tropical", "research_mode": "team", "quality": "substantial", "quality_score": 0.79021, "catalog_references": [], "prompt_length": 21358, "files_placed": 4, "status": "keep"}
{"timestamp": 1785619018.1953359, "experiment_id": "3cce8c08", "concept_title": "EML Learning Theory: Gradient Descent Convergence in the Tropical Limit", "concept_domain": "Applications", "research_mode": "team", "quality": "substantial", "quality_score": 0.76564, "catalog_references": [], "prompt_length": 23906, "files_placed": 4, "status": "keep"}
{"timestamp": 1785619081.287724, "experiment_id": "b080b405", "concept_title": "ArXiv paper: Alternating adjacent-sum polytopes: transfer matrices and Ehrhart series", "concept_domain": "Cryptography", "research_mode": "team", "quality": "substantial", "quality_score": 0.7891599999999999, "catalog_references": [], "prompt_length": 22501, "files_placed": 4, "status": "keep"}
{"timestamp": 1785622825.403842, "experiment_id": "0f65effc", "concept_title": "Tropical Scheme Theory: Groebner Bases over the Tropical Semiring", "concept_domain": "Tropical", "research_mode": "team", "quality": "substantial", "quality_score": 0.7809699999999999, "catalog_references": [], "prompt_length": 24632, "files_placed": 4, "status": "keep"}
{"timestamp": 1785622903.4483035, "experiment_id": "d4159430", "concept_title": "Ramsey-Bounds: Exponential Bounds for Diagonal Ramsey Numbers", "concept_domain": "Combinatorics", "research_mode": "team", "quality": "substantial", "quality_score": 0.7496799999999999, "catalog_references": [], "prompt_length": 22729, "files_placed": 4, "status": "keep"}
{"timestamp": 1785626497.419269, "experiment_id": "645d6476", "concept_title": "Information Geometry: Fisher Metric on Statistical Models", "concept_domain": "Probability", "research_mode": "prove", "quality": "partial", "quality_score": 0.686, "catalog_references": [], "prompt_length": 2506, "files_placed": 2, "status": "keep"}
{"timestamp": 1785626501.6964386, "experiment_id": "b58f013e", "concept_title": "Catalan's Conjecture Generalizations", "concept_domain": "NumberTheory", "research_mode": "team", "quality": "partial", "quality_score": 0.6972499999999999, "catalog_references": [], "prompt_length": 2459, "files_placed": 1, "status": "keep"}
{"timestamp": 1785626580.00202, "experiment_id": "7b912198", "concept_title": "Non-Archimedean Probability via Surreal Numbers", "concept_domain": "Novelty", "research_mode": "team", "quality": "substantial", "quality_score": 0.7734099999999999, "catalog_references": [], "prompt_length": 26198, "files_placed": 4, "status": "keep"}
{"timestamp": 1785626658.8568294, "experiment_id": "d333f65d", "concept_title": "Percolation Threshold", "concept_domain": "Probability", "research_mode": "team", "quality": "substantial", "quality_score": 0.76111, "catalog_references": [], "prompt_length": 25978, "files_placed": 5, "status": "keep"}
{"timestamp": 1785626737.71349, "experiment_id": "316f6446", "concept_title": "Deepening: Zero-Point-Harvesting: Thermodynamic Upper Bound for Vacuum Energy Extraction", "concept_domain": "Shared", "research_mode": "team", "quality": "substantial", "quality_score": 0.8021799999999999, "catalog_references": [], "prompt_length": 24273, "files_placed": 4, "status": "keep"}
{"timestamp": 1785626742.468728, "experiment_id": "8eaed4e7", "concept_title": "**Conjecture.** For every fixed uniformity `r \u2265 3`, there are infinitely many pa", "concept_domain": "Algebra", "research_mode": "team", "quality": "partial", "quality_score": 0.692, "catalog_references": [], "prompt_length": 9512, "files_placed": 2, "status": "keep"}
{"timestamp": 1785626747.0828075, "experiment_id": "61f6b5cb", "concept_title": "Homomorphic Encryption: Computing on Encrypted Data", "concept_domain": "Computation", "research_mode": "team", "quality": "partial", "quality_score": 0.683, "catalog_references": [], "prompt_length": 2738, "files_placed": 1, "status": "keep"}
{"timestamp": 1785653755.2705927, "experiment_id": "18622a4a", "concept_title": "EML Single Operator Church-Turing Thesis", "concept_domain": "Applications", "research_mode": "team", "quality": "substantial", "quality_score": 0.77537, "catalog_references": [], "prompt_length": 25735, "files_placed": 4, "status": "keep"}
{"timestamp": 1785662937.9689367, "experiment_id": "2bc344f1", "concept_title": "Multilinear-Maps: Cryptographic Hardness of Graded Encoding Systems", "concept_domain": "Cryptography", "research_mode": "team", "quality": "substantial", "quality_score": 0.80715, "catalog_references": [], "prompt_length": 24537, "files_placed": 4, "status": "keep"}
{"timestamp": 1785663003.2064245, "experiment_id": "dd55976d", "concept_title": "Category-Theoretic Neural Architectures", "concept_domain": "Bridges", "research_mode": "team", "quality": "substantial", "quality_score": 0.7913999999999999, "catalog_references": [], "prompt_length": 23222, "files_placed": 4, "status": "keep"}
{"timestamp": 1785663068.593895, "experiment_id": "be8c4b71", "concept_title": "EML Interpolation Theory: Stone-Weierstrass for exp-log Networks", "concept_domain": "Applications", "research_mode": "team", "quality": "substantial", "quality_score": 0.8084800000000001, "catalog_references": [], "prompt_length": 25830, "files_placed": 4, "status": "keep"}
{"timestamp": 1785663135.6173368, "experiment_id": "e801d98f", "concept_title": "ArXiv paper: Transformation Semigroup Perspective on the Magma Monoid", "concept_domain": "Tropical", "research_mode": "team", "quality": "substantial", "quality_score": 0.76179, "catalog_references": [], "prompt_length": 24018, "files_placed": 4, "status": "keep"}
{"timestamp": 1785663201.6477454, "experiment_id": "01a8c97a", "concept_title": "Cosmic-Horror-Geometry: Non-Euclidean Spatial Invariants of Mad Architectures", "concept_domain": "Geometry", "research_mode": "team", "quality": "substantial", "quality_score": 0.72854, "catalog_references": [], "prompt_length": 22701, "files_placed": 4, "status": "keep"}
{"timestamp": 1785671054.0340939, "experiment_id": "ffa9af78", "concept_title": "Exact fiber cardinality.: Upgrade the explicit injection of `2^n` seeds to", "concept_domain": "Algebra", "research_mode": "team", "quality": "substantial", "quality_score": 0.74086, "catalog_references": [], "prompt_length": 25115, "files_placed": 4, "status": "keep"}
{"timestamp": 1785671137.8403125, "experiment_id": "8e0a0c8a", "concept_title": "Consciousness as Integrated Information: Mathematical Foundations", "concept_domain": "Novelty", "research_mode": "team", "quality": "substantial", "quality_score": 0.75983, "catalog_references": [], "prompt_length": 22246, "files_placed": 4, "status": "keep"}
{"timestamp": 1785679422.0689266, "experiment_id": "405d388b", "concept_title": "Earlier cycles settled the **deterministic** game: complementing a world negates", "concept_domain": "Logic", "research_mode": "team", "quality": "substantial", "quality_score": 0.8013399999999999, "catalog_references": [], "prompt_length": 28874, "files_placed": 4, "status": "keep"}
{"timestamp": 1785684578.1221244, "experiment_id": "ef4982e9", "concept_title": "Bridge: Galois Connections Between Order Theory and Topology", "concept_domain": "Bridges", "research_mode": "team", "quality": "substantial", "quality_score": 0.78888, "catalog_references": [], "prompt_length": 21818, "files_placed": 4, "status": "keep"}
{"timestamp": 1785691410.0273223, "experiment_id": "111aa6d2", "concept_title": "The deterministic incidence-capacity obstruction \u2014 that any cover of a graph by", "concept_domain": "Physics", "research_mode": "team", "quality": "partial", "quality_score": 0.69767, "catalog_references": [], "prompt_length": 10132, "files_placed": 2, "status": "keep"}
{"timestamp": 1785691491.996926, "experiment_id": "c945ec38", "concept_title": "Deepening: Non-Archimedean Probability via Surreal Numbers", "concept_domain": "Novelty", "research_mode": "team", "quality": "substantial", "quality_score": 0.77894, "catalog_references": [], "prompt_length": 24723, "files_placed": 5, "status": "keep"}
{"timestamp": 1785691574.315492, "experiment_id": "b0710fef", "concept_title": "Moonshot: Brain-Computer Interface Mathematics \u2014 Neural Coding Theorems", "concept_domain": "Novelty", "research_mode": "team", "quality": "substantial", "quality_score": 0.7679199999999999, "catalog_references": [], "prompt_length": 25868, "files_placed": 5, "status": "keep"}
{"timestamp": 1785694957.3120363, "experiment_id": "4ae649eb", "concept_title": "PAC-Bayes Bounds: Information-Theoretic Generalization", "concept_domain": "MachineLearning", "research_mode": "team", "quality": "substantial", "quality_score": 0.79196, "catalog_references": [], "prompt_length": 25042, "files_placed": 4, "status": "keep"}
{"timestamp": 1785695038.9053817, "experiment_id": "2acb9b42", "concept_title": "Bourgain's Slicing Problem", "concept_domain": "Shared", "research_mode": "team", "quality": "substantial", "quality_score": 0.7411399999999999, "catalog_references": [], "prompt_length": 20962, "files_placed": 4, "status": "keep"}
{"timestamp": 1785705601.0868635, "experiment_id": "5814a7d4", "concept_title": "Sensitivity Conjecture Extensions", "concept_domain": "Computation", "research_mode": "team", "quality": "substantial", "quality_score": 0.74072, "catalog_references": [], "prompt_length": 25171, "files_placed": 4, "status": "keep"}
{"timestamp": 1785709075.276266, "experiment_id": "064bb153", "concept_title": "There exists a canonically normalized real-valued functional on the quaternionic", "concept_domain": "Geometry", "research_mode": "team", "quality": "substantial", "quality_score": 0.75976, "catalog_references": [], "prompt_length": 29109, "files_placed": 4, "status": "keep"}
{"timestamp": 1785709125.5726151, "experiment_id": "3c45e0b1", "concept_title": "1. **Uniform-distribution privacy.** For every finite field `F`, threshold `t > ", "concept_domain": "MachineLearning", "research_mode": "team", "quality": "substantial", "quality_score": 0.73575, "catalog_references": [], "prompt_length": 22168, "files_placed": 4, "status": "keep"}
{"timestamp": 1785709175.8384118, "experiment_id": "5907c59d", "concept_title": "Emergent Spacetime from Quantum Entanglement", "concept_domain": "Novelty", "research_mode": "team", "quality": "substantial", "quality_score": 0.78678, "catalog_references": [], "prompt_length": 22519, "files_placed": 4, "status": "keep"}
{"timestamp": 1785709226.7425973, "experiment_id": "f15cd85a", "concept_title": "Perfect Cuboid (Euler Brick)", "concept_domain": "Geometry", "research_mode": "team", "quality": "substantial", "quality_score": 0.76837, "catalog_references": [], "prompt_length": 23608, "files_placed": 4, "status": "keep"}
{"timestamp": 1785712860.9258862, "experiment_id": "17b35eaf", "concept_title": "Temporal Logic of Proofs: When You Prove Something Matters", "concept_domain": "Novelty", "research_mode": "team", "quality": "partial", "quality_score": 0.68012, "catalog_references": [], "prompt_length": 25938, "files_placed": 5, "status": "keep"}
{"timestamp": 1785712945.7183611, "experiment_id": "5c8fc610", "concept_title": "Sonic Mathematics: Counterpoint as Category Theory", "concept_domain": "Novelty", "research_mode": "team", "quality": "partial", "quality_score": 0.67235, "catalog_references": [], "prompt_length": 25086, "files_placed": 5, "status": "keep"}
{"timestamp": 1785713030.5720036, "experiment_id": "c7c1ec6d", "concept_title": "The formal results in `Catalog/Applications/EMLQuantumActivation.lean` show that", "concept_domain": "NumberTheory", "research_mode": "team", "quality": "substantial", "quality_score": 0.7667599999999999, "catalog_references": [], "prompt_length": 22476, "files_placed": 4, "status": "keep"}
{"timestamp": 1785716515.8510134, "experiment_id": "d7c83314", "concept_title": "Stereographic Capacity Theory: Packing Bounds on Spheres via Plane Geometry", "concept_domain": "NumberTheory", "research_mode": "team", "quality": "substantial", "quality_score": 0.7814599999999999, "catalog_references": [], "prompt_length": 26609, "files_placed": 4, "status": "keep"}
{"timestamp": 1785716600.4163218, "experiment_id": "76a9f834", "concept_title": "`Catalog/Probability/PercolationThreshold.lean` proves a chain of finite,", "concept_domain": "Cryptography", "research_mode": "team", "quality": "substantial", "quality_score": 0.7250399999999999, "catalog_references": [], "prompt_length": 23555, "files_placed": 4, "status": "keep"}
{"timestamp": 1785716685.3668106, "experiment_id": "5bb368e2", "concept_title": "Wall-Sun-Sun Primes", "concept_domain": "NumberTheory", "research_mode": "team", "quality": "substantial", "quality_score": 0.7482099999999999, "catalog_references": [], "prompt_length": 21078, "files_placed": 4, "status": "keep"}
{"timestamp": 1785729846.5157046, "experiment_id": "bffb7591", "concept_title": "Existence of Dense Sets without Large t\u2011Fold Sumsets", "concept_domain": "Pythagorean", "research_mode": "team", "quality": "substantial", "quality_score": 0.77061, "catalog_references": ["https://arxiv.org/abs/2109.13305", "https://arxiv.org/abs/2206.10289", "https://arxiv.org/abs/2307.06441"], "prompt_length": 23802, "files_placed": 4, "status": "keep"}
{"timestamp": 1785729934.035065, "experiment_id": "06b881ae", "concept_title": "Inverse Stereographic Neural Field Theory", "concept_domain": "Physics", "research_mode": "team", "quality": "substantial", "quality_score": 0.78433, "catalog_references": [], "prompt_length": 25098, "files_placed": 4, "status": "keep"}
{"timestamp": 1785744321.5207562, "experiment_id": "ab554343", "concept_title": "Consciousness as Integrated Information", "concept_domain": "Novelty", "research_mode": "team", "quality": "substantial", "quality_score": 0.79623, "catalog_references": [], "prompt_length": 24023, "files_placed": 4, "status": "keep"}
{"timestamp": 1785744426.5415447, "experiment_id": "4db4579d", "concept_title": "Bridge: Category Theory as Universal Language for Mathematics", "concept_domain": "Shared", "research_mode": "team", "quality": "substantial", "quality_score": 0.80477, "catalog_references": [], "prompt_length": 24806, "files_placed": 4, "status": "keep"}
{"timestamp": 1785758012.1395397, "experiment_id": "362b8901", "concept_title": "EML Integration in Finite Terms: The Risch Algorithm", "concept_domain": "Applications", "research_mode": "team", "quality": "substantial", "quality_score": 0.7657699999999998, "catalog_references": [], "prompt_length": 24895, "files_placed": 4, "status": "keep"}
