{"timestamp": 1786329832.8591588, "experiment_id": "78f0a7c3", "concept_title": "Cycle IX is `Catalog/Novelty/HyperbolicBerggrenSilverGrowth.lean` (compiles agai", "concept_domain": "NumberTheory", "research_mode": "team", "quality": "substantial", "quality_score": 0.740175, "catalog_references": [], "prompt_length": 32065, "files_placed": 4, "status": "keep"}
{"timestamp": 1786338125.1940718, "experiment_id": "8c828661", "concept_title": "Pythagorean triplet tree on Poincare half plane: lines and stars and curves", "concept_domain": "NumberTheory", "research_mode": "team", "quality": "partial", "quality_score": 0.627125, "catalog_references": [], "prompt_length": 64256, "files_placed": 4, "status": "keep"}
{"timestamp": 1786407351.3930173, "experiment_id": "2c070abd", "concept_title": "Deepening: Tropical Convexity and Helly Theorem", "concept_domain": "Tropical", "research_mode": "team", "quality": "partial", "quality_score": 0.627125, "catalog_references": [], "prompt_length": 26210, "files_placed": 4, "status": "keep"}
{"timestamp": 1786407456.0119853, "experiment_id": "23bf86f8", "concept_title": "Rainbow Arithmetic Progression Threshold Conjecture", "concept_domain": "Shared", "research_mode": "team", "quality": "partial", "quality_score": 0.6376340955882351, "catalog_references": ["Jungi\u0107, V., Licht, M., Mahdian, M., Ne\u0161et\u0159il, J., Radoi\u010di\u0107, R. (2007). Avoiding rainbow triangles in edge colored complete graphs. Combinatorica, 27(2), 211-224.", "Conlon, D., Fox, J., Sudakov, B. (2015). Ramsey numbers of graphs with bounded chromatic number. Combinatorica, 35(2), 155-174.", "Balogh, J., Linz, M., Mattos, L. (2015). Bounds on multipartite Ramsey numbers. Electronic Journal of Combinatorics, 22(1), P1.10.", "Bollob\u00e1s, B. (1986). Combinatorics: Set Systems, Hypergraphs, Posets, and Probabilities. Cambridge University Press."], "prompt_length": 26062, "files_placed": 4, "status": "keep"}
{"timestamp": 1786410609.430112, "experiment_id": "2db5094c", "concept_title": "Lines that appear when Berggren Pythagorean Triplet Tree is plotted on a Poincare half plane", "concept_domain": "Pythagorean", "research_mode": "team", "quality": "partial", "quality_score": 0.6298458474603094, "catalog_references": [], "prompt_length": 73723, "files_placed": 5, "status": "keep"}
{"timestamp": 1786410761.6336904, "experiment_id": "4c1e8096", "concept_title": "The formal development proves the algebraic Gauss\u2013Bonnet invariant for a", "concept_domain": "Geometry", "research_mode": "team", "quality": "substantial", "quality_score": 0.71709, "catalog_references": [], "prompt_length": 27812, "files_placed": 4, "status": "keep"}
{"timestamp": 1786415743.421229, "experiment_id": "e69eca5d", "concept_title": "`Catalog/Combinatorics/BernoulliThresholdCoupling.lean`,", "concept_domain": "Logic", "research_mode": "team", "quality": "partial", "quality_score": 0.683555, "catalog_references": [], "prompt_length": 16198, "files_placed": 8, "status": "keep"}
{"timestamp": 1786415852.731846, "experiment_id": "de149d0f", "concept_title": "Doppelg\u00e4nger-Phase-Lock: Quantum Telepathic Synchronization of Dual Agents", "concept_domain": "Applications", "research_mode": "team", "quality": "partial", "quality_score": 0.6301902500000001, "catalog_references": [], "prompt_length": 26000, "files_placed": 4, "status": "keep"}
{"timestamp": 1786415959.4857166, "experiment_id": "94177336", "concept_title": "Close Proofs: Zero-Knowledge Theorem Proving: I Can Prove Fermat's Last Theorem With", "concept_domain": "Applications", "research_mode": "team", "quality": "partial", "quality_score": 0.6348185595414201, "catalog_references": [], "prompt_length": 26228, "files_placed": 4, "status": "keep"}
{"timestamp": 1786423741.2152374, "experiment_id": "6b69485b", "concept_title": "Lines that appear when Berggren Pythagorean Triplet Tree is plotted on a Poincare half plane", "concept_domain": "Cryptography", "research_mode": "team", "quality": "substantial", "quality_score": 0.720175, "catalog_references": [], "prompt_length": 73725, "files_placed": 5, "status": "keep"}
{"timestamp": 1786423850.472273, "experiment_id": "2c80b5b7", "concept_title": "Let two prefix-free encodings of the same deductive system translate into one an", "concept_domain": "Shared", "research_mode": "team", "quality": "substantial", "quality_score": 0.727445, "catalog_references": [], "prompt_length": 29636, "files_placed": 4, "status": "keep"}
{"timestamp": 1786428828.8018734, "experiment_id": "d1971d75", "concept_title": "The accompanying Lean file establishes the basic definitions, finite-perturbatio", "concept_domain": "Combinatorics", "research_mode": "team", "quality": "substantial", "quality_score": 0.747205, "catalog_references": [], "prompt_length": 28751, "files_placed": 4, "status": "keep"}
{"timestamp": 1786428935.7460637, "experiment_id": "fadf9a22", "concept_title": "Deepening: Concrete, falsifiable conjectures arising from the formalization in", "concept_domain": "Combinatorics", "research_mode": "team", "quality": "partial", "quality_score": 0.6286056450320513, "catalog_references": [], "prompt_length": 26373, "files_placed": 4, "status": "keep"}
{"timestamp": 1786429042.7413795, "experiment_id": "610f4688", "concept_title": "**Conjecture.** For a comparator network implemented by reversible gates with a", "concept_domain": "Novelty", "research_mode": "team", "quality": "substantial", "quality_score": 0.71196, "catalog_references": [], "prompt_length": 29131, "files_placed": 4, "status": "keep"}
{"timestamp": 1786434453.9484382, "experiment_id": "0dad7f8d", "concept_title": "ArXiv paper: The chain replacement of a poset flow", "concept_domain": "Algebra", "research_mode": "team", "quality": "partial", "quality_score": 0.627125, "catalog_references": [], "prompt_length": 26585, "files_placed": 4, "status": "keep"}
{"timestamp": 1786434562.7619984, "experiment_id": "04a5f386", "concept_title": "**Conjecture.** For every finite relational signature and finite model, there is", "concept_domain": "Probability", "research_mode": "team", "quality": "substantial", "quality_score": 0.718325, "catalog_references": [], "prompt_length": 29394, "files_placed": 4, "status": "keep"}
{"timestamp": 1786434670.2924378, "experiment_id": "a55e871b", "concept_title": "ArXiv paper: Adjacency-degree algebras and spectral determination of graphs", "concept_domain": "Physics", "research_mode": "team", "quality": "partial", "quality_score": 0.627125, "catalog_references": [], "prompt_length": 26965, "files_placed": 4, "status": "keep"}
{"timestamp": 1786434778.2261562, "experiment_id": "5bbe180d", "concept_title": "Deepening: Attention is All You Need: Formalizing Transformer Architecture", "concept_domain": "MachineLearning", "research_mode": "team", "quality": "substantial", "quality_score": 0.7456849999999999, "catalog_references": [], "prompt_length": 26368, "files_placed": 4, "status": "keep"}
{"timestamp": 1786434887.2927237, "experiment_id": "fb9255eb", "concept_title": "State the CSS dictionary with two classical codes precisely.: The mission", "concept_domain": "Geometry", "research_mode": "team", "quality": "partial", "quality_score": 0.627125, "catalog_references": [], "prompt_length": 28021, "files_placed": 4, "status": "keep"}
{"timestamp": 1786440243.3084, "experiment_id": "3bb7c316", "concept_title": "Future directions from cycle 4c2c71e5", "concept_domain": "Novelty", "research_mode": "team", "quality": "substantial", "quality_score": 0.741695, "catalog_references": [], "prompt_length": 27142, "files_placed": 5, "status": "keep"}
{"timestamp": 1786443663.5456095, "experiment_id": "c31d2b69", "concept_title": "Define periodic left and right shifts explicitly and derive the Rule 110 sing", "concept_domain": "Computation", "research_mode": "team", "quality": "partial", "quality_score": 0.627125, "catalog_references": [], "prompt_length": 27206, "files_placed": 4, "status": "keep"}
{"timestamp": 1786443775.2780437, "experiment_id": "2d369115", "concept_title": "Algorithmic-Immune-System: Autonomous Code Parasite Neutralization", "concept_domain": "Shared", "research_mode": "team", "quality": "partial", "quality_score": 0.627125, "catalog_references": [], "prompt_length": 25944, "files_placed": 4, "status": "keep"}
{"timestamp": 1786443887.400323, "experiment_id": "c56f6a79", "concept_title": "Diophantine-Lattice: Spectral Bounds on Non-Homogeneous Quadratic Forms", "concept_domain": "Applications", "research_mode": "team", "quality": "substantial", "quality_score": 0.71215, "catalog_references": [], "prompt_length": 25977, "files_placed": 4, "status": "keep"}
{"timestamp": 1786443999.9564722, "experiment_id": "f2796053", "concept_title": "Construct explicit formal, graphical, and contrapuntal syntax categories whose m", "concept_domain": "Logic", "research_mode": "team", "quality": "substantial", "quality_score": 0.743025, "catalog_references": [], "prompt_length": 29746, "files_placed": 4, "status": "keep"}
{"timestamp": 1786461921.8048792, "experiment_id": "30b679f8", "concept_title": "ArXiv paper: Various Bialgebras Of Representative Functions On Free Monoids", "concept_domain": "Novelty", "research_mode": "team", "quality": "substantial", "quality_score": 0.7355200000000001, "catalog_references": [], "prompt_length": 26902, "files_placed": 4, "status": "keep"}
{"timestamp": 1786461993.5266666, "experiment_id": "6225a932", "concept_title": "Deepening: The Fourier Analysis of Collatz: Spectral Gaps in the 3n+1 Map", "concept_domain": "MachineLearning", "research_mode": "team", "quality": "partial", "quality_score": 0.627125, "catalog_references": [], "prompt_length": 26374, "files_placed": 4, "status": "keep"}
{"timestamp": 1786465350.6843774, "experiment_id": "a062ecaf", "concept_title": "Deepening: Strange Attractors as Algebraic Objects", "concept_domain": "Novelty", "research_mode": "team", "quality": "substantial", "quality_score": 0.7526200000000001, "catalog_references": [], "prompt_length": 26326, "files_placed": 6, "status": "keep"}
{"timestamp": 1786465460.4364429, "experiment_id": "ea23936f", "concept_title": "Deepening: Tropical Scheme Theory: Groebner Bases over the Tropical Semiring", "concept_domain": "Tropical", "research_mode": "team", "quality": "partial", "quality_score": 0.627125, "catalog_references": [], "prompt_length": 26316, "files_placed": 4, "status": "keep"}
{"timestamp": 1786465571.9131184, "experiment_id": "5b1761bc", "concept_title": "The following are concrete conjectures extending the formal model in `Catalog/No", "concept_domain": "Logic", "research_mode": "team", "quality": "partial", "quality_score": 0.627125, "catalog_references": [], "prompt_length": 27663, "files_placed": 4, "status": "keep"}
{"timestamp": 1786465681.9568157, "experiment_id": "6db0a277", "concept_title": "For every finite terminating normalization system equipped with a probability la", "concept_domain": "Computation", "research_mode": "team", "quality": "partial", "quality_score": 0.6345797888127854, "catalog_references": [], "prompt_length": 29271, "files_placed": 5, "status": "keep"}
{"timestamp": 1786476523.7066753, "experiment_id": "b7dba88e", "concept_title": "Deepening: ArXiv paper: Transformation Semigroup Perspective on the Magma Monoid", "concept_domain": "Tropical", "research_mode": "team", "quality": "substantial", "quality_score": 0.7419800000000001, "catalog_references": [], "prompt_length": 26360, "files_placed": 4, "status": "keep"}
{"timestamp": 1786476613.8205605, "experiment_id": "ea50968d", "concept_title": "Derived from the results proved in `Catalog/Novelty/ArithmetizedQFTReflection.le", "concept_domain": "Algebra", "research_mode": "team", "quality": "partial", "quality_score": 0.627125, "catalog_references": [], "prompt_length": 33559, "files_placed": 4, "status": "keep"}
{"timestamp": 1786476704.7240498, "experiment_id": "832153cb", "concept_title": "Derived from the nine research cycles formalised in `Catalog/Novelty/Diophantine", "concept_domain": "Physics", "research_mode": "team", "quality": "substantial", "quality_score": 0.715855, "catalog_references": [], "prompt_length": 35522, "files_placed": 4, "status": "keep"}
{"timestamp": 1786476795.982901, "experiment_id": "5ac3c62c", "concept_title": "The formalization in `Catalog/Shared/SolomonZeta/` (mirrored in the buildable li", "concept_domain": "NumberTheory", "research_mode": "team", "quality": "substantial", "quality_score": 0.7516700000000001, "catalog_references": [], "prompt_length": 33690, "files_placed": 4, "status": "keep"}
{"timestamp": 1786476887.7685506, "experiment_id": "9cee3a4c", "concept_title": "Deepening: Certified Adversarial Robustness via Sheaf Cohomology", "concept_domain": "MachineLearning", "research_mode": "team", "quality": "partial", "quality_score": 0.627125, "catalog_references": [], "prompt_length": 26307, "files_placed": 4, "status": "keep"}
{"timestamp": 1786486447.32948, "experiment_id": "09812d2e", "concept_title": "A Conditional-Impossibility Framework for Classical Factoring", "concept_domain": "Cryptography", "research_mode": "team", "quality": "partial", "quality_score": 0.6313436554247915, "catalog_references": [], "prompt_length": 27225, "files_placed": 4, "status": "keep"}
{"timestamp": 1786494077.0532837, "experiment_id": "869ec8f3", "concept_title": "The CRT-Split No-Go: Why N-Alone Iteration Cannot Factor in Poly(log N)", "concept_domain": "Bridges", "research_mode": "team", "quality": "partial", "quality_score": 0.627125, "catalog_references": [], "prompt_length": 27233, "files_placed": 4, "status": "keep"}
{"timestamp": 1786548119.5122664, "experiment_id": "646c7606", "concept_title": "Jacobi Gauss-Sum Phase Collapse", "concept_domain": "Novelty", "research_mode": "team", "quality": "substantial", "quality_score": 0.82, "catalog_references": [], "prompt_length": 26746, "files_placed": 4, "status": "keep"}
{"timestamp": 1786551515.8407354, "experiment_id": "64ac4ffd", "concept_title": "Three Structural Barrier Theorems for Integer Factorization", "concept_domain": "Pythagorean", "research_mode": "team", "quality": "substantial", "quality_score": 0.78, "catalog_references": [], "prompt_length": 27127, "files_placed": 4, "status": "keep"}
{"timestamp": 1786555174.4650233, "experiment_id": "f566f199", "concept_title": "The Quantum-Classical Boundary in Integer Factorization", "concept_domain": "Computation", "research_mode": "team", "quality": "substantial", "quality_score": 0.84, "catalog_references": [], "prompt_length": 27314, "files_placed": 4, "status": "keep"}
{"timestamp": 1786572591.2255297, "experiment_id": "a055589e", "concept_title": "The Structural Orthogonality Framework (8 barriers)", "concept_domain": "Probability", "research_mode": "team", "quality": "substantial", "quality_score": 0.85, "catalog_references": [], "prompt_length": 26924, "files_placed": 5, "status": "keep"}
{"timestamp": 1786576151.8384943, "experiment_id": "219576b7", "concept_title": "A Knot-Number Theory Bridge (Alexander polynomial)", "concept_domain": "Computation", "research_mode": "team", "quality": "substantial", "quality_score": 0.9, "catalog_references": [], "prompt_length": 26777, "files_placed": 5, "status": "keep"}
{"timestamp": 1786579523.7045913, "experiment_id": "24da7a57", "concept_title": "Round-11 Closures: The Definitive Closure of the Classical Surface", "concept_domain": "Combinatorics", "research_mode": "team", "quality": "substantial", "quality_score": 0.84, "catalog_references": [], "prompt_length": 30091, "files_placed": 4, "status": "keep"}
{"timestamp": 1786579535.5189736, "experiment_id": "fb76e61b", "concept_title": "The Asymmetric CRT-Split of a^{N-1} is Factor-Blind, Closed", "concept_domain": "Cryptography", "research_mode": "team", "quality": "substantial", "quality_score": 0.85, "catalog_references": [], "prompt_length": 27478, "files_placed": 4, "status": "keep"}
{"timestamp": 1786589678.5677423, "experiment_id": "5b29bc32", "concept_title": "The Non-CRT-Separable Half-Plane Circle Count, Closed", "concept_domain": "MachineLearning", "research_mode": "team", "quality": "substantial", "quality_score": 0.86, "catalog_references": [], "prompt_length": 27686, "files_placed": 4, "status": "keep"}
{"timestamp": 1786589690.7514722, "experiment_id": "83939baf", "concept_title": "The De-Quantization Frontier, Closed", "concept_domain": "Pythagorean", "research_mode": "team", "quality": "substantial", "quality_score": 0.82, "catalog_references": [], "prompt_length": 29994, "files_placed": 5, "status": "keep"}
{"timestamp": 1786589703.5266232, "experiment_id": "a46abb10", "concept_title": "De-Quantizing Quantum Mechanics: Mathematical Frameworks for Classical Emulation of Quantum Algorithms", "concept_domain": "Computation", "research_mode": "team", "quality": "substantial", "quality_score": 0.82, "catalog_references": [], "prompt_length": 28486, "files_placed": 4, "status": "keep"}
{"timestamp": 1786597912.9965398, "experiment_id": "579ae41a", "concept_title": "The Order x Jacobi Joint Law is N-Determined, Closed", "concept_domain": "Computation", "research_mode": "team", "quality": "substantial", "quality_score": 0.82, "catalog_references": [], "prompt_length": 27319, "files_placed": 67, "status": "keep"}
{"timestamp": 1786603994.8763983, "experiment_id": "a3466461", "concept_title": "The Symmetry-Breaking Cost of Factoring, Measured", "concept_domain": "Novelty", "research_mode": "team", "quality": "substantial", "quality_score": 0.82, "catalog_references": [], "prompt_length": 27267, "files_placed": 4, "status": "keep"}
{"timestamp": 1786604007.4401407, "experiment_id": "d8dbb938", "concept_title": "Residue Dials Cannot Amplify a Coppersmith Hint, Closed", "concept_domain": "Combinatorics", "research_mode": "team", "quality": "substantial", "quality_score": 0.82, "catalog_references": [], "prompt_length": 27200, "files_placed": 5, "status": "keep"}
{"timestamp": 1786611071.5126631, "experiment_id": "6092c7cd", "concept_title": "The Partial Free-Witness Threshold is the Trace, Closed", "concept_domain": "Algebra", "research_mode": "team", "quality": "substantial", "quality_score": 0.82, "catalog_references": [], "prompt_length": 27303, "files_placed": 4, "status": "keep"}
{"timestamp": 1786617420.574775, "experiment_id": "0c649bb1", "concept_title": "The Derived-Modulus Corner, Closed", "concept_domain": "Physics", "research_mode": "team", "quality": "substantial", "quality_score": 0.85, "catalog_references": [], "prompt_length": 27200, "files_placed": 4, "status": "keep"}
{"timestamp": 1786629331.8426852, "experiment_id": "db97959f", "concept_title": "The Jacobi-Signed Circle Count Escapes the Residue Dial, at the Weil Floor", "concept_domain": "Tropical", "research_mode": "team", "quality": "substantial", "quality_score": 0.86, "catalog_references": [], "prompt_length": 27325, "files_placed": 4, "status": "keep"}
{"timestamp": 1786629345.733454, "experiment_id": "20cf0514", "concept_title": "INTERVAL-HINT: the trace-set filter is exact (2^-omega pruning) but does not amplify \u2014 residue filters fully closed", "concept_domain": "Applications", "research_mode": "team", "quality": "substantial", "quality_score": 0.82, "catalog_references": [], "prompt_length": 27430, "files_placed": 4, "status": "keep"}
{"timestamp": 1786634506.6929502, "experiment_id": "9e8cd1f4", "concept_title": "The Quantum Register Cannot Be Shrunk: QUBIT-TRADE, Closed", "concept_domain": "Algebra", "research_mode": "team", "quality": "substantial", "quality_score": 0.87, "catalog_references": [], "prompt_length": 27027, "files_placed": 4, "status": "keep"}
{"timestamp": 1786634519.975865, "experiment_id": "6753d65f", "concept_title": "The Residue-Leakage Curve and the Dirichlet No-Pruning Theorem, Closed", "concept_domain": "Bridges", "research_mode": "team", "quality": "substantial", "quality_score": 0.89, "catalog_references": [], "prompt_length": 27364, "files_placed": 5, "status": "keep"}
{"timestamp": 1786641549.409981, "experiment_id": "560413ae", "concept_title": "Entanglement-Monotone: Formalization of Logarithmic Negativity Bounds", "concept_domain": "Physics", "research_mode": "team", "quality": "substantial", "quality_score": 0.82, "catalog_references": [], "prompt_length": 25952, "files_placed": 4, "status": "keep"}
{"timestamp": 1786644897.7243412, "experiment_id": "c80347ac", "concept_title": "EMPIRICAL-DEGREE: the factoring function is spectrally flat \u2014 no low-degree parity of N approximates any factor bit; the j=2 anomaly resolves as a symmetric top-bit fluctuation", "concept_domain": "Novelty", "research_mode": "team", "quality": "substantial", "quality_score": 0.82, "catalog_references": [], "prompt_length": 28298, "files_placed": 5, "status": "keep"}
{"timestamp": 1786644913.179383, "experiment_id": "b7a22960", "concept_title": "Construct a Boolean-valued universe whose generic quotients instantiate the abst", "concept_domain": "Logic", "research_mode": "team", "quality": "substantial", "quality_score": 0.82, "catalog_references": [], "prompt_length": 29899, "files_placed": 4, "status": "keep"}
{"timestamp": 1786655401.939574, "experiment_id": "f3293094", "concept_title": "Round-4 Hypothesis Closures: Five Novel Attacks via Exotic Resources, Tested and Closed", "concept_domain": "Tropical", "research_mode": "team", "quality": "substantial", "quality_score": 0.82, "catalog_references": [], "prompt_length": 31821, "files_placed": 4, "status": "keep"}
{"timestamp": 1786655415.0330653, "experiment_id": "ab9891cb", "concept_title": "The 3SUM-Birthday-Bound Hierarchy", "concept_domain": "Logic", "research_mode": "team", "quality": "substantial", "quality_score": 0.78, "catalog_references": [], "prompt_length": 26712, "files_placed": 4, "status": "keep"}
