{"timestamp": 1782193560.0220256, "experiment_id": "70e63d82", "concept_title": "Bridge: Galois Connections Between Order Theory and Topology", "concept_domain": "Bridges", "research_mode": "prove", "quality": "partial", "quality_score": 0.47904, "catalog_references": ["Mathlib.Order.GaloisConnection", "Mathlib.Order.CompleteLattice", "Mathlib.Order.FixedPoints", "Mathlib.RingTheory.Ideal.Basic", "Mathlib.AlgebraicGeometry.PrimeSpectrum.Basic", "Mathlib.Topology.Order.Alexandrov"], "prompt_length": 22186, "files_placed": 6, "status": "discard"}
{"timestamp": 1782196810.4808896, "experiment_id": "3db2ad68", "concept_title": "Close Proofs: These conjectures continue the research cycle begun in", "concept_domain": "Pythagorean", "research_mode": "formalize", "quality": "partial", "quality_score": 0.3935206787878788, "catalog_references": [], "prompt_length": 15787, "files_placed": 6, "status": "discard"}
{"timestamp": 1782199923.6680057, "experiment_id": "54153a72", "concept_title": "Convex Geometry: Brunn-Minkowski Theory", "concept_domain": "Geometry", "research_mode": "sorry_fill", "quality": "partial", "quality_score": 0.56159, "catalog_references": ["Mathlib/MeasureTheory/Measure/Haar/Lebesgue.lean", "Mathlib/MeasureTheory/Measure/MeasureSpace.lean", "Mathlib/Data/Set/Pointwise/Basic.lean", "Mathlib/Topology/Instances/Real.lean"], "prompt_length": 14828, "files_placed": 6, "status": "keep"}
{"timestamp": 1782200314.6255047, "experiment_id": "62850b85", "concept_title": "Attention Mechanisms: Mathematical Properties", "concept_domain": "MachineLearning", "research_mode": "sorry_fill", "quality": "partial", "quality_score": 0.4446527272727273, "catalog_references": [], "prompt_length": 18541, "files_placed": 6, "status": "discard"}
{"timestamp": 1782203462.1205785, "experiment_id": "07255b71", "concept_title": "Sierpi\u0144ski Numbers: Covering Systems", "concept_domain": "Tropical", "research_mode": "sorry_fill", "quality": "partial", "quality_score": 0.5811999999999999, "catalog_references": [], "prompt_length": 20830, "files_placed": 6, "status": "keep"}
{"timestamp": 1782211258.145683, "experiment_id": "731f1c25", "concept_title": "Learning with Errors: Hardness Reductions", "concept_domain": "Cryptography", "research_mode": "formalize", "quality": "partial", "quality_score": 0.67588, "catalog_references": ["Cryptography/LWE/SearchDecisionCore.lean", "Cryptography/LWE/WorstCaseLattice.lean", "Catalog/FINAL/Cryptography/LWE/SearchDecisionCore.lean", "Catalog/FINAL/Cryptography/LWE/WorstCaseLattice.lean"], "prompt_length": 20633, "files_placed": 2, "status": "keep"}
{"timestamp": 1782212399.497289, "experiment_id": "bf529381", "concept_title": "Close Proofs: These conjectures continue the research cycle begun in", "concept_domain": "Shared", "research_mode": "formalize", "quality": "partial", "quality_score": 0.34015242857142863, "catalog_references": [], "prompt_length": 2180, "files_placed": 2, "status": "discard"}
{"timestamp": 1782214848.867755, "experiment_id": "57fbcb2f", "concept_title": "OEIS sequence: \"Orderly\" Friedman numbers (or \"good\" or \"nice\" Friedman numbers): Friedman numbers (A036057) where the construction digits are used in the proper order.", "concept_domain": "Probability", "research_mode": "formalize", "quality": "partial", "quality_score": 0.48476875555555554, "catalog_references": [], "prompt_length": 22376, "files_placed": 6, "status": "discard"}
{"timestamp": 1782226919.77717, "experiment_id": "0de5396c", "concept_title": "Rucker 'Gnarl' and Continuous-Valued Cellular Automata", "concept_domain": "Novelty", "research_mode": "team", "quality": "partial", "quality_score": 0.5094479615384615, "catalog_references": [], "prompt_length": 20743, "files_placed": 6, "status": "keep"}
{"timestamp": 1782229306.4991267, "experiment_id": "d1c9c6b9", "concept_title": "Sperner's Lemma Implies Nash Equilibria: Combinatorial Fixed Points in Game Theory", "concept_domain": "Combinatorics", "research_mode": "prove", "quality": "partial", "quality_score": 0.6288, "catalog_references": ["Mathlib.Combinatorics.Simplex.Sperner", "Mathlib.Topology.Simplices", "Mathlib.GameTheory.Basic", "Mathlib.Analysis.Convex.Basic", "Catalog/FINAL/"], "prompt_length": 21869, "files_placed": 6, "status": "keep"}
{"timestamp": 1782242727.2614489, "experiment_id": "5a2118a3", "concept_title": "Quantum Key Distribution: BB84 Security Proof", "concept_domain": "Cryptography", "research_mode": "prove", "quality": "partial", "quality_score": 0.49160000000000004, "catalog_references": ["Cryptography/PrivacyAmplification/InnerProductUniversal.lean"], "prompt_length": 21131, "files_placed": 6, "status": "discard"}
{"timestamp": 1782256373.9598742, "experiment_id": "a2ad5506", "concept_title": "Self-Modifying Research via Reflective Type Theory", "concept_domain": "Logic", "research_mode": "sorry_fill", "quality": "partial", "quality_score": 0.38339676363636366, "catalog_references": [], "prompt_length": 1859, "files_placed": 2, "status": "discard"}
{"timestamp": 1782258457.6302948, "experiment_id": "d9f17c93", "concept_title": "Pickover Clifford Attractor Family", "concept_domain": "MachineLearning", "research_mode": "prove", "quality": "partial", "quality_score": 0.3829593469387754, "catalog_references": [], "prompt_length": 4115, "files_placed": 2, "status": "discard"}
{"timestamp": 1782258670.904091, "experiment_id": "a4a5a639", "concept_title": "Rucker 'Gnarl' and Continuous-Valued Cellular Automata", "concept_domain": "Novelty", "research_mode": "formalize", "quality": "partial", "quality_score": 0.3493306711864407, "catalog_references": [], "prompt_length": 3227, "files_placed": 2, "status": "discard"}
{"timestamp": 1782260478.4652233, "experiment_id": "2b44c5bb", "concept_title": "Statistical Mechanics: Ising Model Phase Transition", "concept_domain": "Probability", "research_mode": "sorry_fill", "quality": "partial", "quality_score": 0.6913, "catalog_references": ["Probability/IsingCriticalTemperature.lean"], "prompt_length": 15628, "files_placed": 6, "status": "keep"}
{"timestamp": 1782264132.1709213, "experiment_id": "0dfef380", "concept_title": "Proof Automation: Custom Lean 4 Tactics", "concept_domain": "Bridges", "research_mode": "formalize", "quality": "substantial", "quality_score": 0.7484, "catalog_references": [], "prompt_length": 20717, "files_placed": 6, "status": "keep"}
{"timestamp": 1782264956.8825355, "experiment_id": "e56a1e16", "concept_title": "EML Universal Approximation: Density of EML Functions", "concept_domain": "Tropical", "research_mode": "formalize", "quality": "substantial", "quality_score": 0.86528, "catalog_references": ["Catalog/FINAL/EML/Cube.lean", "Catalog/FINAL/EML/CoordinateProjections.lean", "Catalog/FINAL/EML/EMLFunctions.lean", "Catalog/FINAL/EML/StoneWeierstrass.lean", "Catalog/FINAL/EML/LogSumExp.lean"], "prompt_length": 20764, "files_placed": 6, "status": "keep"}
{"timestamp": 1782266388.6680973, "experiment_id": "a5fa8083", "concept_title": "Close Proofs: These conjectures continue the research cycle begun in", "concept_domain": "Computation", "research_mode": "sorry_fill", "quality": "substantial", "quality_score": 0.789328, "catalog_references": ["Algebra/FittingKernelBound.lean", "Algebra/FittingStabilizationBound.lean", "Algebra/TransEndoFitting.lean", "LinearAlgebra/FiniteDimensional.lean", "LinearAlgebra/Submodule.lean"], "prompt_length": 17770, "files_placed": 6, "status": "keep"}
{"timestamp": 1782267298.6385357, "experiment_id": "7e71ceda", "concept_title": "Hamiltonian Compression Factor of Cubic Edge-Transitive Graphs", "concept_domain": "Physics", "research_mode": "formalize", "quality": "partial", "quality_score": 0.48598591282051284, "catalog_references": ["Physics/Catalog/Leans-Matic", "Advanced Topology/ANNL/Topology/Combinatorics", "Combinatorics/Algebra/Algebraic/Group/Group Theory"], "prompt_length": 21765, "files_placed": 6, "status": "discard"}
{"timestamp": 1782275523.1763415, "experiment_id": "f39e2cb3", "concept_title": "Langlands Correspondence: GL(1) Case", "concept_domain": "NumberTheory", "research_mode": "prove", "quality": "partial", "quality_score": 0.57755, "catalog_references": [], "prompt_length": 22841, "files_placed": 7, "status": "keep"}
{"timestamp": 1782276035.7386003, "experiment_id": "146bc8b0", "concept_title": "Homotopy Type Theory Foundations", "concept_domain": "Geometry", "research_mode": "team", "quality": "partial", "quality_score": 0.48341799999999996, "catalog_references": [], "prompt_length": 22799, "files_placed": 8, "status": "discard"}
{"timestamp": 1782278253.2065196, "experiment_id": "81f9ab1d", "concept_title": "EML Transseries: Asymptotic Expansions Beyond Power Series", "concept_domain": "Geometry", "research_mode": "sorry_fill", "quality": "substantial", "quality_score": 0.702, "catalog_references": ["Catalog/EML/Transseries/Field.lean", "Catalog/EML/Transseries/OrderedField.lean"], "prompt_length": 20814, "files_placed": 6, "status": "keep"}
{"timestamp": 1782281651.3832905, "experiment_id": "d453f6ce", "concept_title": "Secret Sharing: Shamir's Scheme and Verifiable Variants", "concept_domain": "Cryptography", "research_mode": "team", "quality": "partial", "quality_score": 0.5671600000000001, "catalog_references": [], "prompt_length": 20810, "files_placed": 7, "status": "keep"}
{"timestamp": 1782283528.6008985, "experiment_id": "f9dc8407", "concept_title": "Tropical Curves and Chip-Firing Games", "concept_domain": "Combinatorics", "research_mode": "formalize", "quality": "partial", "quality_score": 0.6342000000000001, "catalog_references": ["Tropical/ChipFiring/ChipFiringGameBasics.lean", "Tropical/ChipFiring/ChipImpl.lean"], "prompt_length": 18338, "files_placed": 6, "status": "keep"}
{"timestamp": 1782286963.989706, "experiment_id": "67990ab1", "concept_title": "NISQ-Optimized Quantum Error Mitigation via Algebraic Topology", "concept_domain": "Pythagorean", "research_mode": "team", "quality": "partial", "quality_score": 0.48928166666666667, "catalog_references": [], "prompt_length": 21039, "files_placed": 6, "status": "discard"}
{"timestamp": 1782288565.0580297, "experiment_id": "1e3d4863", "concept_title": "Whitehead Problem: Independence from ZFC", "concept_domain": "Novelty", "research_mode": "formalize", "quality": "substantial", "quality_score": 0.729932, "catalog_references": ["Catalog/AbelianGroup/Torsion.lean", "Catalog/GroupTheory/Projective.lean", "Catalog/ExtensionSequences/SplittingMaps.lean"], "prompt_length": 20034, "files_placed": 6, "status": "keep"}
{"timestamp": 1782290344.0103724, "experiment_id": "bcd85103", "concept_title": "Type Theory: Cubical Type Theory Foundations", "concept_domain": "Algebra", "research_mode": "prove|formalize", "quality": "partial", "quality_score": 0.63257, "catalog_references": ["Catalog/FINAL/Algebra/CubicalTypeTheory", "Domain/QuotientCircleTorus"], "prompt_length": 20703, "files_placed": 6, "status": "keep"}
{"timestamp": 1782293590.5530407, "experiment_id": "f0048c68", "concept_title": "Symmetric Group Generation Probability", "concept_domain": "Novelty", "research_mode": "formalize", "quality": "partial", "quality_score": 0.4162, "catalog_references": ["Novelty/SymmetricGroupGeneration.lean"], "prompt_length": 20559, "files_placed": 6, "status": "discard"}
{"timestamp": 1782297367.3777096, "experiment_id": "91104b94", "concept_title": "Consciousness as Integrated Information", "concept_domain": "Novelty", "research_mode": "team", "quality": "partial", "quality_score": 0.67432, "catalog_references": [], "prompt_length": 22817, "files_placed": 6, "status": "keep"}
{"timestamp": 1782298689.1218195, "experiment_id": "44e772b7", "concept_title": "Existence of Non-Trivial Boolean Degree One Functions on J_q(n,2) for q \u2265 3 and n \u2265 4", "concept_domain": "Shared", "research_mode": "formalize", "quality": "partial", "quality_score": 0.69522, "catalog_references": ["Shared/GrassmannJq2LineCounts.lean", "Shared/BooleanDegreeOne.lean"], "prompt_length": 20715, "files_placed": 7, "status": "keep"}
{"timestamp": 1782298987.8038864, "experiment_id": "43854327", "concept_title": "NISQ-Optimized Quantum Error Mitigation via Algebraic Topology", "concept_domain": "Logic", "research_mode": "team", "quality": "partial", "quality_score": 0.43844913758865245, "catalog_references": [], "prompt_length": 23158, "files_placed": 7, "status": "discard"}
{"timestamp": 1782303324.6509, "experiment_id": "758d973b", "concept_title": "Degree-normalized linked tree-cut decompositions for locally finite graphs", "concept_domain": "Novelty", "research_mode": "team", "quality": "partial", "quality_score": 0.51744, "catalog_references": ["Tree-cut decomposition", "finite adhesion", "linked tree-cut decomposition", "componental rooted tree-cut decomposition", "edge-end", "undominated edge-end", "edge-degree of an end", "locally finite graph", "Main theorem: every graph admits a linked componental finite-adhesion rooted tree-cut decomposition displaying all undominated edge-ends"], "prompt_length": 23424, "files_placed": 7, "status": "keep"}
{"timestamp": 1782306621.4396486, "experiment_id": "1670a4b8", "concept_title": "Ramsey Theory: Bounds and Constructions", "concept_domain": "Algebra", "research_mode": "prove", "quality": "partial", "quality_score": 0.61528, "catalog_references": [], "prompt_length": 20132, "files_placed": 7, "status": "keep"}
{"timestamp": 1782306897.430885, "experiment_id": "cd0ef092", "concept_title": "Proof Automation: Custom Lean 4 Tactics", "concept_domain": "Bridges", "research_mode": "prove", "quality": "substantial", "quality_score": 0.7045299999999999, "catalog_references": [], "prompt_length": 20713, "files_placed": 8, "status": "keep"}
{"timestamp": 1782306970.8667443, "experiment_id": "168f9c96", "concept_title": "Conformability remains NP-complete for all fixed independence numbers at least 3", "concept_domain": "Algebra", "research_mode": "team", "quality": "partial", "quality_score": 0.68184, "catalog_references": ["math.CO", "cs.CC", "perfect_triangle_packing", "overfull_conjecture", "total_coloring"], "prompt_length": 21096, "files_placed": 7, "status": "keep"}
{"timestamp": 1782312862.7953434, "experiment_id": "4a138f86", "concept_title": "EML Interpolation Theory: Stone-Weierstrass for exp-log Networks", "concept_domain": "Cryptography", "research_mode": "formalize", "quality": "partial", "quality_score": 0.6288800000000001, "catalog_references": ["Catalog/EML/StoneWeierstrassApprox.lean"], "prompt_length": 21621, "files_placed": 6, "status": "keep"}
{"timestamp": 1782314333.9765892, "experiment_id": "72f1519b", "concept_title": "Degree\u20114 vertices in the flip graph of the m\u00d7n Miura\u2011ori", "concept_domain": "Pythagorean", "research_mode": "team", "quality": "partial", "quality_score": 0.5317089325931801, "catalog_references": ["arXiv:2305.01234", "GineproHull2014counting", "Christensen2025origami", "Cereceda2009mixing"], "prompt_length": 22765, "files_placed": 6, "status": "keep"}
{"timestamp": 1782318088.0470185, "experiment_id": "c235005e", "concept_title": "Symmetrized Monomial Generates T-Ideal in Acyclic Path Algebras", "concept_domain": "Geometry", "research_mode": "team", "quality": "partial", "quality_score": 0.5303045714285715, "catalog_references": ["Amitsur-Levitzki Theorem (MR36751)", "Irelli et al. (irelli2025quiverspolynomialidentities)"], "prompt_length": 20687, "files_placed": 7, "status": "keep"}
{"timestamp": 1782318556.442914, "experiment_id": "f8c355ed", "concept_title": "Lattice Cryptography: LWE Hardness", "concept_domain": "Pythagorean", "research_mode": "formalize", "quality": "substantial", "quality_score": 0.7276800000000001, "catalog_references": ["FINAL/Pythagorean/BrahmaguptaFib.lean", "FINAL/NumberTheory/PrimeSplitting.lean", "FINAL/Cryptography/LWE/SearchDecisionCore.lean", "FINAL/Cryptography/LWE/GaussianBridge.lean"], "prompt_length": 20421, "files_placed": 9, "status": "keep"}
{"timestamp": 1782320557.8812456, "experiment_id": "ceeb135f", "concept_title": "Euler-Mascheroni Constant: Irrationality Approaches", "concept_domain": "NumberTheory", "research_mode": "prove", "quality": "partial", "quality_score": 0.6807300000000001, "catalog_references": [], "prompt_length": 20740, "files_placed": 7, "status": "keep"}
{"timestamp": 1782322128.7826104, "experiment_id": "449dda28", "concept_title": "EML Transseries: Asymptotic Expansions Beyond Power Series", "concept_domain": "Applications", "research_mode": "formalize", "quality": "partial", "quality_score": 0.67296, "catalog_references": ["Catalog/EML/Transseries/Field.lean", "Catalog/EML/Transseries/OrderedField.lean"], "prompt_length": 22952, "files_placed": 6, "status": "keep"}
{"timestamp": 1782325351.0010228, "experiment_id": "935bc3f6", "concept_title": "EML Universal Approximation", "concept_domain": "Applications", "research_mode": "team", "quality": "substantial", "quality_score": 0.7770400000000002, "catalog_references": [], "prompt_length": 20690, "files_placed": 7, "status": "keep"}
{"timestamp": 1782327482.2825158, "experiment_id": "71ab9721", "concept_title": "Euler-Mascheroni Constant: Irrationality Approaches", "concept_domain": "MachineLearning", "research_mode": "prove", "quality": "partial", "quality_score": 0.6771, "catalog_references": [], "prompt_length": 20746, "files_placed": 8, "status": "keep"}
{"timestamp": 1782327750.250994, "experiment_id": "a1973066", "concept_title": "Brocard's Problem: n! + 1 = m\u00b2", "concept_domain": "Probability", "research_mode": "team", "quality": "substantial", "quality_score": 0.7684399999999999, "catalog_references": [], "prompt_length": 20666, "files_placed": 6, "status": "keep"}
{"timestamp": 1782332379.9991376, "experiment_id": "d3c0af99", "concept_title": "Minimal Minor-Closed Classes Below 3/2 Have Single Forbidden Minors", "concept_domain": "Probability", "research_mode": "team", "quality": "partial", "quality_score": 0.63104, "catalog_references": ["Diestel2010Book"], "prompt_length": 20739, "files_placed": 8, "status": "keep"}
{"timestamp": 1782332903.247572, "experiment_id": "50adb4ee", "concept_title": "Necessity of Homological Condition for Spectral Radius Bound", "concept_domain": "Physics", "research_mode": "team", "quality": "partial", "quality_score": 0.49653899999999995, "catalog_references": ["math.CO", "math.SP"], "prompt_length": 20691, "files_placed": 7, "status": "discard"}
{"timestamp": 1782334668.0048742, "experiment_id": "5a434903", "concept_title": "Extremal Graph Theory: Tur\u00e1n and Szemer\u00e9di", "concept_domain": "Probability", "research_mode": "formalize", "quality": "partial", "quality_score": 0.333456, "catalog_references": ["Catalog/Novelty/GenTuranK3tUpperBound.lean", "Catalog/Novelty/GenTuranK3tDownwardClosure.lean"], "prompt_length": 15192, "files_placed": 6, "status": "discard"}
{"timestamp": 1782336637.503255, "experiment_id": "18853638", "concept_title": "Corrected Uniform Witness Bound for (d+1)-Uniform Families", "concept_domain": "Novelty", "research_mode": "prove", "quality": "partial", "quality_score": 0.42325214328358207, "catalog_references": ["Foundations/ConceptFamily.lean", "Foundations/Shattering.lean", "CombinatorialBridge/FiniteCounting.lean", "PigeonholeInjectionBridge/CardinalityBounds.lean"], "prompt_length": 20996, "files_placed": 6, "status": "discard"}
{"timestamp": 1782336982.274953, "experiment_id": "6ddef5de", "concept_title": "Diffusion Models as Stochastic Differential Equations", "concept_domain": "Physics", "research_mode": "formalize", "quality": "partial", "quality_score": 0.66248, "catalog_references": [], "prompt_length": 20800, "files_placed": 6, "status": "keep"}
{"timestamp": 1782340393.6447482, "experiment_id": "72ef5a59", "concept_title": "Interpolation of Partial-Twuality Polynomials in Binary Delta-Matroids", "concept_domain": "Tropical", "research_mode": "team", "quality": "partial", "quality_score": 0.6934400000000001, "catalog_references": ["Gross, Mansour and Tucker", "Yan and Jin", "Chmutov"], "prompt_length": 20757, "files_placed": 8, "status": "keep"}
{"timestamp": 1782340449.8729155, "experiment_id": "1d985141", "concept_title": "Proof Strategy Mining from Deep Mathematics", "concept_domain": "Tropical", "research_mode": "sorry_fill", "quality": "substantial", "quality_score": 0.751851, "catalog_references": ["Catalog/FINAL/Tropical/Core/TropicalPolynomials.lean", "Catalog/Tropical/Core/TropicalPolynomials.lean"], "prompt_length": 19062, "files_placed": 6, "status": "keep"}
{"timestamp": 1782342120.0445607, "experiment_id": "ef60a392", "concept_title": "Cusick's Sum-of-Digits Explicit Bound", "concept_domain": "Applications", "research_mode": "team", "quality": "substantial", "quality_score": 0.77328, "catalog_references": ["Cusick_sum_of_digits_conjecture", "binary_sum_of_digits_function", "2_adic_valuation_binomial_coefficients", "carry_propagation_binary_addition"], "prompt_length": 20805, "files_placed": 8, "status": "keep"}
{"timestamp": 1782343620.056161, "experiment_id": "04a6a732", "concept_title": "NISQ-Optimized Quantum Error Mitigation via Algebraic Topology", "concept_domain": "Novelty", "research_mode": "team", "quality": "partial", "quality_score": 0.6946599999999999, "catalog_references": [], "prompt_length": 21031, "files_placed": 8, "status": "keep"}
{"timestamp": 1782343725.0799136, "experiment_id": "b45eb1d8", "concept_title": "Stability of Cayley Digraphs of Abelian Groups of Odd Order", "concept_domain": "Applications", "research_mode": "team", "quality": "substantial", "quality_score": 0.7496, "catalog_references": ["math.CO", "math.GR"], "prompt_length": 22887, "files_placed": 7, "status": "keep"}
