{"timestamp": 1781022646.9042277, "experiment_id": "c808c311", "concept_title": "We formalized the log-reciprocal metric on primes: d(p,q) = |1/log(p) - 1/log(q)", "concept_domain": "Pythagorean", "research_mode": "team", "quality": "partial", "quality_score": 0.42061894714924586, "catalog_references": [], "prompt_length": 19876, "files_placed": 0, "status": "discard"}
{"timestamp": 1781024504.6993957, "experiment_id": "1f2f8815", "concept_title": "Diffusion Models as Stochastic Differential Equations", "concept_domain": "MachineLearning", "research_mode": "team", "quality": "partial", "quality_score": 0.41977631987577635, "catalog_references": [], "prompt_length": 4971, "files_placed": 0, "status": "discard"}
{"timestamp": 1781024548.9449112, "experiment_id": "00126c0b", "concept_title": "Formal obstruction theory for EML-solvability of linear", "concept_domain": "Bridges", "research_mode": "team", "quality": "partial", "quality_score": 0.38646674999999997, "catalog_references": [], "prompt_length": 25567, "files_placed": 8, "status": "discard"}
{"timestamp": 1781026281.1181903, "experiment_id": "9425faf8", "concept_title": "Close Proofs: Logic-Physics Bridge: Consistency of Physical Theories", "concept_domain": "Tropical", "research_mode": "team", "quality": "partial", "quality_score": 0.37594581874079436, "catalog_references": [], "prompt_length": 9816, "files_placed": 0, "status": "discard"}
{"timestamp": 1781026392.6548371, "experiment_id": "87d8b0f1", "concept_title": "Close Proofs: Speculative: Computational Complexity as Physical Law", "concept_domain": "Novelty", "research_mode": "team", "quality": "partial", "quality_score": 0.422173544973545, "catalog_references": [], "prompt_length": 9823, "files_placed": 0, "status": "discard"}
{"timestamp": 1781026568.12334, "experiment_id": "ad363765", "concept_title": "ML Generalization Bounds: Rademacher Complexity of Neural Networks", "concept_domain": "MachineLearning", "research_mode": "team", "quality": "partial", "quality_score": 0.42067745979894616, "catalog_references": [], "prompt_length": 5012, "files_placed": 0, "status": "discard"}
{"timestamp": 1781026694.1876934, "experiment_id": "3ceb0fcb", "concept_title": "ML Universal Approximation: Width vs Depth Trade-offs", "concept_domain": "Algebra", "research_mode": "team", "quality": "partial", "quality_score": 0.42121556242331565, "catalog_references": [], "prompt_length": 9821, "files_placed": 0, "status": "discard"}
{"timestamp": 1781027016.2866013, "experiment_id": "0f735599", "concept_title": "Causal Inference: Do-Calculus as Formal Logic", "concept_domain": "Physics", "research_mode": "team", "quality": "partial", "quality_score": 0.36621510701629356, "catalog_references": [], "prompt_length": 4829, "files_placed": 0, "status": "discard"}
{"timestamp": 1781029026.6941366, "experiment_id": "484dd4da", "concept_title": "Close Proofs: Tropical Compactification of Moduli Spaces", "concept_domain": "Tropical", "research_mode": "team", "quality": "partial", "quality_score": 0.4193960895051324, "catalog_references": [], "prompt_length": 5100, "files_placed": 0, "status": "discard"}
{"timestamp": 1781029056.857333, "experiment_id": "8fed00f0", "concept_title": "Close Proofs: Neural Tangent Kernel: Convergence of Gradient Descent", "concept_domain": "Novelty", "research_mode": "team", "quality": "partial", "quality_score": 0.4221649177538802, "catalog_references": [], "prompt_length": 5619, "files_placed": 0, "status": "discard"}
{"timestamp": 1781029119.5711987, "experiment_id": "d8dd49c5", "concept_title": "ML Universal Approximation: Width vs Depth Trade-offs", "concept_domain": "Computation", "research_mode": "team", "quality": "partial", "quality_score": 0.3442593304246488, "catalog_references": [], "prompt_length": 5123, "files_placed": 0, "status": "discard"}
{"timestamp": 1781029880.8115745, "experiment_id": "2a7892ae", "concept_title": "The tropical analogue of eigenvalues \u2014 values \u03bb such that A \u2297 x = \u03bb \u2297 x in the t", "concept_domain": "Computation", "research_mode": "team", "quality": "partial", "quality_score": 0.44596028646150354, "catalog_references": [], "prompt_length": 21132, "files_placed": 72, "status": "discard"}
{"timestamp": 1781030072.897451, "experiment_id": "6baa451c", "concept_title": "The current formalization proves that the tropical segment equals the tropical c", "concept_domain": "Algebra", "research_mode": "team", "quality": "partial", "quality_score": 0.3939594106346972, "catalog_references": [], "prompt_length": 12128, "files_placed": 0, "status": "discard"}
{"timestamp": 1781030271.168848, "experiment_id": "15e5810c", "concept_title": "Formalized bridge between ReLU neural network decision", "concept_domain": "MachineLearning", "research_mode": "team", "quality": "partial", "quality_score": 0.45138134445121236, "catalog_references": [], "prompt_length": 25921, "files_placed": 18, "status": "discard"}
{"timestamp": 1781030401.0309389, "experiment_id": "5a904574", "concept_title": "Belnap's FOUR\u2082 is the smallest non-trivial paraconsistent bilattice. A natural g", "concept_domain": "Geometry", "research_mode": "team", "quality": "partial", "quality_score": 0.4429310119047619, "catalog_references": [], "prompt_length": 20633, "files_placed": 7, "status": "discard"}
{"timestamp": 1781032468.2048147, "experiment_id": "7447269b", "concept_title": "Rigorous Lean 4 formalization of provability logic (GL)", "concept_domain": "Tropical", "research_mode": "team", "quality": "partial", "quality_score": 0.39339772243974636, "catalog_references": [], "prompt_length": 27141, "files_placed": 0, "status": "discard"}
{"timestamp": 1781032549.0542545, "experiment_id": "4a83fa98", "concept_title": "Close Proofs: Close Proofs: Neural Tangent Kernel: Convergence of Gradient Descent", "concept_domain": "Pythagorean", "research_mode": "team", "quality": "partial", "quality_score": 0.38766439024390253, "catalog_references": [], "prompt_length": 10254, "files_placed": 0, "status": "discard"}
{"timestamp": 1781034956.495856, "experiment_id": "0c7bdbdf", "concept_title": "Cryptographic Hash Functions: Collision Resistance from Hard Problems", "concept_domain": "Cryptography", "research_mode": "team", "quality": "partial", "quality_score": 0.3790869106263195, "catalog_references": [], "prompt_length": 16403, "files_placed": 1, "status": "discard"}
{"timestamp": 1781035037.0707967, "experiment_id": "ee624f37", "concept_title": "Learning with Errors: Hardness Reductions", "concept_domain": "Cryptography", "research_mode": "team", "quality": "partial", "quality_score": 0.36850115677321155, "catalog_references": [], "prompt_length": 16229, "files_placed": 1, "status": "discard"}
{"timestamp": 1781035143.0132117, "experiment_id": "30f8d3db", "concept_title": "Diffusion Models as Stochastic Differential Equations", "concept_domain": "Physics", "research_mode": "team", "quality": "partial", "quality_score": 0.397392211299052, "catalog_references": [], "prompt_length": 16396, "files_placed": 1, "status": "discard"}
{"timestamp": 1781037487.7909954, "experiment_id": "ff75cf9e", "concept_title": "The exponential decay bound `diffusionAlphaBar_exp_bound` shows that the signal ", "concept_domain": "Pythagorean", "research_mode": "team", "quality": "partial", "quality_score": 0.3512538461538462, "catalog_references": [], "prompt_length": 21415, "files_placed": 1, "status": "discard"}
{"timestamp": 1781037601.5909817, "experiment_id": "ee23b747", "concept_title": "The current formalization proves existence of a QBER threshold Q* via the interm", "concept_domain": "Novelty", "research_mode": "team", "quality": "partial", "quality_score": 0.3644997162423633, "catalog_references": [], "prompt_length": 19160, "files_placed": 0, "status": "discard"}
{"timestamp": 1781037813.953226, "experiment_id": "9fe7196f", "concept_title": "The clique complex \u0394(G) admits a natural chain complex over \u2124: the k-th chain gr", "concept_domain": "Shared", "research_mode": "team", "quality": "partial", "quality_score": 0.42149288146735914, "catalog_references": [], "prompt_length": 13806, "files_placed": 0, "status": "discard"}
{"timestamp": 1781038951.7525706, "experiment_id": "0a3c1ef8", "concept_title": "The Baker-Norine theorem states that for a divisor D on a graph G of genus g,", "concept_domain": "Novelty", "research_mode": "team", "quality": "partial", "quality_score": 0.4123264481792717, "catalog_references": [], "prompt_length": 12215, "files_placed": 0, "status": "discard"}
{"timestamp": 1781040866.9199634, "experiment_id": "e86a6105", "concept_title": "Close Proofs: Tropical Amoebas and Ronkin Functions", "concept_domain": "Novelty", "research_mode": "team", "quality": "partial", "quality_score": 0.3913372551861914, "catalog_references": [], "prompt_length": 5101, "files_placed": 0, "status": "discard"}
{"timestamp": 1781042769.0834556, "experiment_id": "46ab2efc", "concept_title": "Close Proofs: Tropical Differential Equations: Power Series Solutions", "concept_domain": "Shared", "research_mode": "team", "quality": "partial", "quality_score": 0.4154342601357922, "catalog_references": [], "prompt_length": 10235, "files_placed": 0, "status": "discard"}
{"timestamp": 1781044660.4219625, "experiment_id": "b5f4fcb3", "concept_title": "Close Proofs: Formal obstruction theory for EML-solvability of linear", "concept_domain": "Novelty", "research_mode": "team", "quality": "partial", "quality_score": 0.4230981953006567, "catalog_references": [], "prompt_length": 10233, "files_placed": 0, "status": "discard"}
{"timestamp": 1781047877.984362, "experiment_id": "cbf2a369", "concept_title": "Neural Tangent Kernel: Convergence of Gradient Descent", "concept_domain": "MachineLearning", "research_mode": "team", "quality": "partial", "quality_score": 0.3938362033817576, "catalog_references": [], "prompt_length": 10016, "files_placed": 0, "status": "discard"}
{"timestamp": 1781047909.790787, "experiment_id": "30386f7b", "concept_title": "Scaling Laws from Statistical Mechanics", "concept_domain": "Physics", "research_mode": "team", "quality": "partial", "quality_score": 0.3959450885488579, "catalog_references": [], "prompt_length": 4663, "files_placed": 0, "status": "discard"}
{"timestamp": 1781076794.9594681, "experiment_id": "c5e28125", "concept_title": "Stereographic Capacity Theory: Packing Bounds on Spheres via Plane Geometry", "concept_domain": "Geometry", "research_mode": "team", "quality": "partial", "quality_score": 0.42590000000000006, "catalog_references": [], "prompt_length": 9142, "files_placed": 0, "status": "discard"}
{"timestamp": 1781077311.3089929, "experiment_id": "a732c4a4", "concept_title": "Close Proofs: The clique complex \u0394(G) admits a natural chain complex over \u2124: the k-t", "concept_domain": "Shared", "research_mode": "team", "quality": "partial", "quality_score": 0.6916, "catalog_references": [], "prompt_length": 16493, "files_placed": 6, "status": "keep"}
{"timestamp": 1781077343.0320725, "experiment_id": "b74ebc0e", "concept_title": "Integrated Information via Tensor Networks", "concept_domain": "Computation", "research_mode": "team", "quality": "partial", "quality_score": 0.52264, "catalog_references": [], "prompt_length": 16504, "files_placed": 7, "status": "keep"}
{"timestamp": 1781077363.480467, "experiment_id": "cfdc7072", "concept_title": "Elliptic Curve Cryptography: Weil Pairing and BLS Signatures", "concept_domain": "Novelty", "research_mode": "team", "quality": "partial", "quality_score": 0.4771938461538462, "catalog_references": [], "prompt_length": 16364, "files_placed": 6, "status": "discard"}
{"timestamp": 1781077629.011243, "experiment_id": "9c6faf0b", "concept_title": "Close Proofs: Close Proofs: Tropical Compactification of Moduli Spaces", "concept_domain": "Tropical", "research_mode": "team", "quality": "partial", "quality_score": 0.44479402985074634, "catalog_references": [], "prompt_length": 16485, "files_placed": 6, "status": "discard"}
{"timestamp": 1781079419.3168433, "experiment_id": "30991756", "concept_title": "Willmore Conjecture Generalizations", "concept_domain": "Geometry", "research_mode": "team", "quality": "partial", "quality_score": 0.36540312121212126, "catalog_references": [], "prompt_length": 5830, "files_placed": 0, "status": "discard"}
{"timestamp": 1781079463.4892523, "experiment_id": "1c00f06d", "concept_title": "Mobius Arithmetic: Number Theory on the Mobius Band", "concept_domain": "Geometry", "research_mode": "team", "quality": "partial", "quality_score": 0.4232653836882282, "catalog_references": [], "prompt_length": 13140, "files_placed": 0, "status": "discard"}
{"timestamp": 1781081541.1596415, "experiment_id": "b07a6f73", "concept_title": "The next step in the large cardinal hierarchy after Mahlo is the measurable card", "concept_domain": "Shared", "research_mode": "team", "quality": "partial", "quality_score": 0.3901142153309169, "catalog_references": [], "prompt_length": 16255, "files_placed": 0, "status": "discard"}
{"timestamp": 1781081581.932434, "experiment_id": "1cfa3ae8", "concept_title": "The natural next step is to construct the simplicial chain complex from our `ASC", "concept_domain": "Novelty", "research_mode": "team", "quality": "partial", "quality_score": 0.3901194851122603, "catalog_references": [], "prompt_length": 20237, "files_placed": 0, "status": "discard"}
{"timestamp": 1781081627.1888015, "experiment_id": "3c1eb401", "concept_title": "Topological Data Analysis: Persistent Homology Stability", "concept_domain": "Computation", "research_mode": "team", "quality": "partial", "quality_score": 0.3479058538100068, "catalog_references": [], "prompt_length": 6609, "files_placed": 0, "status": "discard"}
{"timestamp": 1781081662.7827556, "experiment_id": "861cf18b", "concept_title": "Spectral Universality of Gradient Descent on Arithmetic Moduli", "concept_domain": "Novelty", "research_mode": "team", "quality": "partial", "quality_score": 0.34786964167489404, "catalog_references": [], "prompt_length": 12951, "files_placed": 0, "status": "discard"}
{"timestamp": 1781081691.5788195, "experiment_id": "02022d1b", "concept_title": "Quantum Key Distribution: BB84 Security Proof", "concept_domain": "Pythagorean", "research_mode": "team", "quality": "partial", "quality_score": 0.34792142456168895, "catalog_references": [], "prompt_length": 6204, "files_placed": 0, "status": "discard"}
{"timestamp": 1781081748.1568913, "experiment_id": "9b4d748e", "concept_title": "Logic-Physics Bridge: Consistency of Physical Theories", "concept_domain": "Novelty", "research_mode": "team", "quality": "partial", "quality_score": 0.36414626047650445, "catalog_references": [], "prompt_length": 6069, "files_placed": 0, "status": "discard"}
{"timestamp": 1781083877.683316, "experiment_id": "c2873aaf", "concept_title": "Algebraic Statistics: Markov Bases for Contingency Tables", "concept_domain": "Algebra", "research_mode": "team", "quality": "partial", "quality_score": 0.5663674620390456, "catalog_references": [], "prompt_length": 16321, "files_placed": 29, "status": "keep"}
{"timestamp": 1781083924.5344725, "experiment_id": "fa6907ec", "concept_title": "Idempotent Probability: Large Deviations", "concept_domain": "Logic", "research_mode": "team", "quality": "partial", "quality_score": 0.3482620905923346, "catalog_references": [], "prompt_length": 5941, "files_placed": 0, "status": "discard"}
{"timestamp": 1781083955.78781, "experiment_id": "adc0a650", "concept_title": "Natural Proofs Barrier: Formalization", "concept_domain": "Logic", "research_mode": "team", "quality": "partial", "quality_score": 0.41994790874524723, "catalog_references": [], "prompt_length": 5954, "files_placed": 0, "status": "discard"}
{"timestamp": 1781083987.3672512, "experiment_id": "eb3522cc", "concept_title": "Code-Based Cryptography: McEliece from Goppa Codes", "concept_domain": "Cryptography", "research_mode": "team", "quality": "partial", "quality_score": 0.42242853403141367, "catalog_references": [], "prompt_length": 6147, "files_placed": 0, "status": "discard"}
{"timestamp": 1781084016.6916025, "experiment_id": "8ab52039", "concept_title": "Spectral Universality of Transformer Weight Dynamics", "concept_domain": "MachineLearning", "research_mode": "team", "quality": "partial", "quality_score": 0.42052921319796965, "catalog_references": [], "prompt_length": 8353, "files_placed": 0, "status": "discard"}
{"timestamp": 1781084041.3681054, "experiment_id": "d44e1688", "concept_title": "Zero-Knowledge Proof Systems: Formal Verification of Privacy", "concept_domain": "Cryptography", "research_mode": "team", "quality": "partial", "quality_score": 0.420468219765343, "catalog_references": [], "prompt_length": 6093, "files_placed": 0, "status": "discard"}
{"timestamp": 1781084070.0408397, "experiment_id": "56e03640", "concept_title": "Tropical Compactification of Moduli Spaces", "concept_domain": "Applications", "research_mode": "team", "quality": "partial", "quality_score": 0.421931287180069, "catalog_references": [], "prompt_length": 11223, "files_placed": 0, "status": "discard"}
{"timestamp": 1781086245.7745464, "experiment_id": "6ea2dca0", "concept_title": "ML Loss Landscape: Critical Points and Saddle Points", "concept_domain": "Novelty", "research_mode": "team", "quality": "partial", "quality_score": 0.3552181666666667, "catalog_references": [], "prompt_length": 11413, "files_placed": 0, "status": "discard"}
{"timestamp": 1781086278.6251824, "experiment_id": "7c34e56a", "concept_title": "Close Proofs: Stereographic Capacity Theory: Packing Bounds on Spheres via Plane Geo", "concept_domain": "Novelty", "research_mode": "team", "quality": "partial", "quality_score": 0.4271388507219377, "catalog_references": [], "prompt_length": 6883, "files_placed": 0, "status": "discard"}
{"timestamp": 1781086306.6432505, "experiment_id": "c6c6f4f3", "concept_title": "Topological Order: Anyon Statistics from Ground State Degeneracy", "concept_domain": "Physics", "research_mode": "team", "quality": "partial", "quality_score": 0.4259588109132625, "catalog_references": [], "prompt_length": 6615, "files_placed": 0, "status": "discard"}
{"timestamp": 1781086364.5608983, "experiment_id": "bd0970ea", "concept_title": "Our framework shows that soundness implies consistency but not vice versa, with ", "concept_domain": "Novelty", "research_mode": "team", "quality": "partial", "quality_score": 0.42836959355170645, "catalog_references": [], "prompt_length": 14163, "files_placed": 0, "status": "discard"}
{"timestamp": 1781088487.3162367, "experiment_id": "664852e6", "concept_title": "The EBC framework now spans three files with 0 sorry's:", "concept_domain": "Bridges", "research_mode": "team", "quality": "partial", "quality_score": 0.4617939212432683, "catalog_references": [], "prompt_length": 22848, "files_placed": 22, "status": "discard"}
{"timestamp": 1781088583.1912322, "experiment_id": "45fd103a", "concept_title": "Quantum Thermodynamics: Landauer's Principle at the Nanoscale", "concept_domain": "Physics", "research_mode": "team", "quality": "partial", "quality_score": 0.42623522129371716, "catalog_references": [], "prompt_length": 11344, "files_placed": 0, "status": "discard"}
{"timestamp": 1781088676.256739, "experiment_id": "a3d4dbfc", "concept_title": "Bridge: Model Theory and Algebra \u2014 Ax-Kochen and Morley's Theorem", "concept_domain": "Bridges", "research_mode": "team", "quality": "substantial", "quality_score": 0.7368, "catalog_references": [], "prompt_length": 16503, "files_placed": 11, "status": "keep"}
{"timestamp": 1781088771.8493774, "experiment_id": "cb7c1dc0", "concept_title": "Close Proofs: Dream Logic: Non-Monotone Reasoning Where Contradictions Coexist", "concept_domain": "Tropical", "research_mode": "team", "quality": "partial", "quality_score": 0.4572079470198676, "catalog_references": [], "prompt_length": 16492, "files_placed": 14, "status": "discard"}
{"timestamp": 1781088875.4267592, "experiment_id": "a692ed5d", "concept_title": "The natural policy gradient uses the Fisher information matrix F(\u03b8) to define a", "concept_domain": "Applications", "research_mode": "team", "quality": "partial", "quality_score": 0.36234535552983826, "catalog_references": [], "prompt_length": 19736, "files_placed": 0, "status": "discard"}
{"timestamp": 1781091535.9094958, "experiment_id": "7007fa32", "concept_title": "Quasi-symmetric maps generalize bi-Lipschitz maps by allowing the distortion con", "concept_domain": "Novelty", "research_mode": "team", "quality": "substantial", "quality_score": 0.75224, "catalog_references": [], "prompt_length": 20485, "files_placed": 18, "status": "keep"}
{"timestamp": 1781091564.5915787, "experiment_id": "ab70c7a2", "concept_title": "Close Proofs: Close Proofs: Fractal Topology: Hausdorff Dimension as a Topological I", "concept_domain": "Novelty", "research_mode": "team", "quality": "partial", "quality_score": 0.3938235955056181, "catalog_references": [], "prompt_length": 11519, "files_placed": 0, "status": "discard"}
{"timestamp": 1781091616.908191, "experiment_id": "6bb23550", "concept_title": "Zero-Knowledge Proofs in Lean: Verifiable Computation", "concept_domain": "Applications", "research_mode": "team", "quality": "partial", "quality_score": 0.4275015444015444, "catalog_references": [], "prompt_length": 6126, "files_placed": 0, "status": "discard"}
{"timestamp": 1781093737.386289, "experiment_id": "f5f2f195", "concept_title": "Formalize the Paley construction: for any prime power q \u2261 3 (mod 4), there exist", "concept_domain": "Novelty", "research_mode": "team", "quality": "partial", "quality_score": 0.5432, "catalog_references": [], "prompt_length": 20656, "files_placed": 17, "status": "keep"}
