{"timestamp": 1781280622.8305712, "experiment_id": "2a5bb902", "concept_title": "The sphere-packing bound gives an upper bound on code size, but the", "concept_domain": "Applications", "research_mode": "team", "quality": "partial", "quality_score": 0.5291335915882679, "catalog_references": [], "prompt_length": 21144, "files_placed": 20, "status": "keep"}
{"timestamp": 1781280646.8251047, "experiment_id": "392c9e56", "concept_title": "Close Proofs: **Conjecture:** If `{f_t}_{t \u2208 [0,1]}` is a continuous family of contr", "concept_domain": "Applications", "research_mode": "team", "quality": "substantial", "quality_score": 0.7850491896144769, "catalog_references": [], "prompt_length": 17658, "files_placed": 29, "status": "keep"}
{"timestamp": 1781280675.8841686, "experiment_id": "7883a0f1", "concept_title": "ML Reinforcement Learning: Convergence of Policy Gradient Methods", "concept_domain": "Novelty", "research_mode": "team", "quality": "partial", "quality_score": 0.39114037475888686, "catalog_references": [], "prompt_length": 5970, "files_placed": 0, "status": "discard"}
{"timestamp": 1781283135.2983708, "experiment_id": "6a3c3d29", "concept_title": "Grokking: Phase Transitions in Learning", "concept_domain": "Novelty", "research_mode": "team", "quality": "partial", "quality_score": 0.39101602091210536, "catalog_references": [], "prompt_length": 5633, "files_placed": 0, "status": "discard"}
{"timestamp": 1781283163.015767, "experiment_id": "04265d4a", "concept_title": "The entry point machinery developed here (fibEntryPoint, its divisibility proper", "concept_domain": "Applications", "research_mode": "team", "quality": "partial", "quality_score": 0.3912435479571841, "catalog_references": [], "prompt_length": 14719, "files_placed": 0, "status": "discard"}
{"timestamp": 1781283841.754406, "experiment_id": "1736668d", "concept_title": "Close Proofs: The file `Computation/SpectralChain/Core.lean` builds, from first prin", "concept_domain": "Applications", "research_mode": "team", "quality": "substantial", "quality_score": 0.7025182961460447, "catalog_references": [], "prompt_length": 17662, "files_placed": 16, "status": "keep"}
{"timestamp": 1781283872.0305874, "experiment_id": "d5fc9b31", "concept_title": "Close Proofs: This cycle formalized a self-contained fragment of **predicative ordin", "concept_domain": "Applications", "research_mode": "team", "quality": "partial", "quality_score": 0.5296000000000001, "catalog_references": [], "prompt_length": 6152, "files_placed": 0, "status": "keep"}
{"timestamp": 1781283901.4385755, "experiment_id": "391316ae", "concept_title": "We proved the scaling law for the special case \u03b1 = 2 (eigenvalues \u03bb_k = 1/k\u00b2),", "concept_domain": "Novelty", "research_mode": "team", "quality": "partial", "quality_score": 0.41598027928038067, "catalog_references": [], "prompt_length": 18825, "files_placed": 0, "status": "discard"}
{"timestamp": 1781283930.1463478, "experiment_id": "90ba0898", "concept_title": "Close Proofs: The abstract simulation preorder formalized in `ProofSystemCollapse.le", "concept_domain": "Novelty", "research_mode": "team", "quality": "partial", "quality_score": 0.49296, "catalog_references": [], "prompt_length": 11515, "files_placed": 0, "status": "discard"}
{"timestamp": 1781283975.5246332, "experiment_id": "515da4b4", "concept_title": "Vaught's Conjecture", "concept_domain": "Novelty", "research_mode": "team", "quality": "partial", "quality_score": 0.41550559573607687, "catalog_references": [], "prompt_length": 10992, "files_placed": 0, "status": "discard"}
{"timestamp": 1781285988.4884086, "experiment_id": "a319fb5a", "concept_title": "The new file `Catalog/Speculative/AutoResearch/VaughtTypeSpace.lean` establishes", "concept_domain": "Applications", "research_mode": "team", "quality": "partial", "quality_score": 0.41607931313695384, "catalog_references": [], "prompt_length": 17247, "files_placed": 0, "status": "discard"}
{"timestamp": 1781286008.0352473, "experiment_id": "aec0362d", "concept_title": "Close Proofs: This cycle's artifact is `Catalog/MachineLearning/NTKSpectral.lean`. I", "concept_domain": "Novelty", "research_mode": "team", "quality": "substantial", "quality_score": 0.7005600000000001, "catalog_references": [], "prompt_length": 17648, "files_placed": 19, "status": "keep"}
{"timestamp": 1781286092.7593167, "experiment_id": "327d0ee0", "concept_title": "Spectral Universality of Arithmetic Quantum Graphs via Expander Lifts", "concept_domain": "Cryptography", "research_mode": "team", "quality": "partial", "quality_score": 0.461982054263566, "catalog_references": [], "prompt_length": 7650, "files_placed": 0, "status": "discard"}
{"timestamp": 1781286114.330368, "experiment_id": "edc9fa45", "concept_title": "The breakpoint count bound we proved (`TropPoly.breakpoint_count_le`) shows that", "concept_domain": "MachineLearning", "research_mode": "team", "quality": "partial", "quality_score": 0.33849651376146783, "catalog_references": [], "prompt_length": 15701, "files_placed": 0, "status": "discard"}
{"timestamp": 1781288118.53522, "experiment_id": "de2ddd30", "concept_title": "Generalization Bounds via Rademacher Complexity", "concept_domain": "MachineLearning", "research_mode": "team", "quality": "partial", "quality_score": 0.38347462341197824, "catalog_references": [], "prompt_length": 11336, "files_placed": 0, "status": "discard"}
{"timestamp": 1781288162.3818455, "experiment_id": "ff0f663c", "concept_title": "The natural next step is to formalize the actual probabilistic phase transition.", "concept_domain": "Novelty", "research_mode": "team", "quality": "partial", "quality_score": 0.45543999999999996, "catalog_references": [], "prompt_length": 23491, "files_placed": 6, "status": "discard"}
{"timestamp": 1781288182.4958336, "experiment_id": "ec1b3df1", "concept_title": "Reversible Computing and Thermodynamic Efficiency", "concept_domain": "Physics", "research_mode": "team", "quality": "substantial", "quality_score": 0.8572, "catalog_references": [], "prompt_length": 17466, "files_placed": 6, "status": "keep"}
{"timestamp": 1781288203.9871182, "experiment_id": "f7a0c2c6", "concept_title": "The file `Logic/LobFixedPoint.lean` isolates the purely order-theoretic core of", "concept_domain": "Bridges", "research_mode": "team", "quality": "substantial", "quality_score": 0.7927200000000001, "catalog_references": [], "prompt_length": 23000, "files_placed": 7, "status": "keep"}
{"timestamp": 1781288235.3001254, "experiment_id": "a42ace1d", "concept_title": "The file `Catalog/Tropical/MultivariatePhaseTransition.lean` lifts the", "concept_domain": "Pythagorean", "research_mode": "team", "quality": "partial", "quality_score": 0.42720140370833815, "catalog_references": [], "prompt_length": 16484, "files_placed": 0, "status": "discard"}
{"timestamp": 1781290241.18209, "experiment_id": "b88ce3e6", "concept_title": "Close Proofs: The Geometry of Consensus: Arrow's Theorem as Curvature", "concept_domain": "Applications", "research_mode": "team", "quality": "partial", "quality_score": 0.4244736473721831, "catalog_references": [], "prompt_length": 6247, "files_placed": 0, "status": "discard"}
{"timestamp": 1781290267.6027286, "experiment_id": "5d6012bf", "concept_title": "We proved that KL(p\u2016q) \u2265 0 for discrete distributions. The natural next step is ", "concept_domain": "Applications", "research_mode": "team", "quality": "partial", "quality_score": 0.42579538983050846, "catalog_references": [], "prompt_length": 14651, "files_placed": 0, "status": "discard"}
{"timestamp": 1781290290.7133918, "experiment_id": "6622a58e", "concept_title": "The file `Geometry/ImpossibleParallels.lean` establishes a clean combinatorial", "concept_domain": "Algebra", "research_mode": "team", "quality": "partial", "quality_score": 0.4570636363636364, "catalog_references": [], "prompt_length": 31367, "files_placed": 0, "status": "discard"}
{"timestamp": 1781290312.2830603, "experiment_id": "89c02d7b", "concept_title": "The file `WillmoreEnergy.lean` establishes the elementary half of the Willmore", "concept_domain": "Geometry", "research_mode": "team", "quality": "partial", "quality_score": 0.6796971428571429, "catalog_references": [], "prompt_length": 21944, "files_placed": 9, "status": "keep"}
{"timestamp": 1781291044.4042475, "experiment_id": "eb987111", "concept_title": "The 2\u00d72 eigenvalue formula `tropEigval2(A) = min(A\u2080\u2080, A\u2081\u2081, (A\u2080\u2081+A\u2081\u2080)/2)` general", "concept_domain": "Shared", "research_mode": "team", "quality": "partial", "quality_score": 0.468519697204969, "catalog_references": [], "prompt_length": 16442, "files_placed": 0, "status": "discard"}
{"timestamp": 1781293040.9703672, "experiment_id": "297d1b03", "concept_title": "This cycle moved the catalog's Dream Logic line of work from the *object level* ", "concept_domain": "Logic", "research_mode": "team", "quality": "partial", "quality_score": 0.65664, "catalog_references": [], "prompt_length": 27156, "files_placed": 8, "status": "keep"}
{"timestamp": 1781293061.4932375, "experiment_id": "039d1273", "concept_title": "Rigorous Lean 4 formalization of provability logic (GL)", "concept_domain": "Novelty", "research_mode": "team", "quality": "partial", "quality_score": 0.518, "catalog_references": [], "prompt_length": 28640, "files_placed": 6, "status": "keep"}
{"timestamp": 1781293081.230163, "experiment_id": "112283ee", "concept_title": "The file `Computation/EastinKnill.lean` isolates the *algebraic kernel* of the", "concept_domain": "Logic", "research_mode": "team", "quality": "partial", "quality_score": 0.528, "catalog_references": [], "prompt_length": 23205, "files_placed": 5, "status": "keep"}
{"timestamp": 1781293102.1103845, "experiment_id": "026d95cd", "concept_title": "Close Proofs: Formally verified framework (`Computation/SpectralChain/`)", "concept_domain": "Geometry", "research_mode": "team", "quality": "partial", "quality_score": 0.6783541984732825, "catalog_references": [], "prompt_length": 17643, "files_placed": 5, "status": "keep"}
{"timestamp": 1781293128.2001145, "experiment_id": "1b242915", "concept_title": "Close Proofs: The 2\u00d72 eigenvalue formula `tropEigval2(A) = min(A\u2080\u2080, A\u2081\u2081, (A\u2080\u2081+A\u2081\u2080)/2", "concept_domain": "Novelty", "research_mode": "team", "quality": "partial", "quality_score": 0.35738121332085937, "catalog_references": [], "prompt_length": 6232, "files_placed": 0, "status": "discard"}
{"timestamp": 1781293152.2396798, "experiment_id": "17757f75", "concept_title": "The file `Catalog/Logic/ProofPhaseTransitions.lean` builds the formal scaffoldin", "concept_domain": "Computation", "research_mode": "team", "quality": "partial", "quality_score": 0.4879733096085409, "catalog_references": [], "prompt_length": 18339, "files_placed": 0, "status": "discard"}
{"timestamp": 1781293179.6524174, "experiment_id": "ec77cfcd", "concept_title": "Machine Learning Generalization Bounds", "concept_domain": "Applications", "research_mode": "team", "quality": "partial", "quality_score": 0.4253320224897054, "catalog_references": [], "prompt_length": 5888, "files_placed": 0, "status": "discard"}
{"timestamp": 1781293208.5839472, "experiment_id": "274d33e1", "concept_title": "This cycle formalized the **abstract simulation preorder** at the core of the", "concept_domain": "Applications", "research_mode": "team", "quality": "partial", "quality_score": 0.48271501416430596, "catalog_references": [], "prompt_length": 22654, "files_placed": 0, "status": "discard"}
{"timestamp": 1781293235.844291, "experiment_id": "1d743d09", "concept_title": "Close Proofs: Close Proofs: Stereographic Capacity Theory: Packing Bounds on Spheres", "concept_domain": "Computation", "research_mode": "team", "quality": "partial", "quality_score": 0.4249980380691213, "catalog_references": [], "prompt_length": 6256, "files_placed": 0, "status": "discard"}
{"timestamp": 1781295252.7681344, "experiment_id": "4ed3b8d2", "concept_title": "Close Proofs: The file `WillmoreEnergy.lean` establishes the elementary half of the ", "concept_domain": "Applications", "research_mode": "team", "quality": "partial", "quality_score": 0.5236799999999999, "catalog_references": [], "prompt_length": 6081, "files_placed": 0, "status": "keep"}
{"timestamp": 1781295281.6996906, "experiment_id": "420383c4", "concept_title": "Proof-Complexity Holography: Geometric Duals of Formal Derivations", "concept_domain": "Applications", "research_mode": "team", "quality": "partial", "quality_score": 0.421786275426701, "catalog_references": [], "prompt_length": 7870, "files_placed": 0, "status": "discard"}
{"timestamp": 1781295306.517544, "experiment_id": "edc11b94", "concept_title": "Close Proofs: Unique Games Conjecture", "concept_domain": "Applications", "research_mode": "team", "quality": "partial", "quality_score": 0.44827414634146345, "catalog_references": [], "prompt_length": 6187, "files_placed": 0, "status": "discard"}
{"timestamp": 1781295330.5660126, "experiment_id": "ccee9dd9", "concept_title": "The Basin Fixed Point Theorem shows that basin count = fixed point count for des", "concept_domain": "Applications", "research_mode": "team", "quality": "partial", "quality_score": 0.39080412790697683, "catalog_references": [], "prompt_length": 20631, "files_placed": 0, "status": "discard"}
{"timestamp": 1781295352.4468038, "experiment_id": "e5c39a01", "concept_title": "Quantum Entanglement Monogamy: CKW Inequality", "concept_domain": "Tropical", "research_mode": "team", "quality": "partial", "quality_score": 0.4230854833161335, "catalog_references": [], "prompt_length": 5941, "files_placed": 0, "status": "discard"}
{"timestamp": 1781297356.2874882, "experiment_id": "eebcb553", "concept_title": "Quantum Error Correction Bounds", "concept_domain": "Novelty", "research_mode": "team", "quality": "partial", "quality_score": 0.4233152643938781, "catalog_references": [], "prompt_length": 5656, "files_placed": 0, "status": "discard"}
{"timestamp": 1781298029.5159447, "experiment_id": "3f1d10c1", "concept_title": "Bridge: Logic of Provability and Fixed Points in Arithmetic", "concept_domain": "Novelty", "research_mode": "team", "quality": "partial", "quality_score": 0.43998808099401754, "catalog_references": [], "prompt_length": 5888, "files_placed": 0, "status": "discard"}
{"timestamp": 1781298055.3391662, "experiment_id": "29b65c84", "concept_title": "Close Proofs: Learning with Errors: Hardness Reductions", "concept_domain": "Novelty", "research_mode": "team", "quality": "partial", "quality_score": 0.4224549216300941, "catalog_references": [], "prompt_length": 6048, "files_placed": 0, "status": "discard"}
{"timestamp": 1781300077.827286, "experiment_id": "53842178", "concept_title": "Tropical Amoebas and Ronkin Functions", "concept_domain": "Tropical", "research_mode": "team", "quality": "partial", "quality_score": 0.45050989871260894, "catalog_references": [], "prompt_length": 5884, "files_placed": 0, "status": "discard"}
{"timestamp": 1781300104.0374548, "experiment_id": "fc10b57a", "concept_title": "Tropical Hodge Theory", "concept_domain": "Novelty", "research_mode": "team", "quality": "partial", "quality_score": 0.44876800607287454, "catalog_references": [], "prompt_length": 5684, "files_placed": 0, "status": "discard"}
{"timestamp": 1781300126.5589392, "experiment_id": "85489e07", "concept_title": "The file `Catalog/Cryptography/QuantumSecurity/BB84Security.lean` formalizes the", "concept_domain": "Novelty", "research_mode": "team", "quality": "partial", "quality_score": 0.45050989871260894, "catalog_references": [], "prompt_length": 17342, "files_placed": 0, "status": "discard"}
{"timestamp": 1781300146.1622176, "experiment_id": "48107262", "concept_title": "This cycle pushed the binary-tree collision-resistance theory of", "concept_domain": "Novelty", "research_mode": "team", "quality": "partial", "quality_score": 0.5109600000000001, "catalog_references": [], "prompt_length": 23398, "files_placed": 0, "status": "keep"}
{"timestamp": 1781300183.0141299, "experiment_id": "1407a635", "concept_title": "Close Proofs: Belnap's FOUR\u2082 is the smallest non-trivial paraconsistent bilattice. A", "concept_domain": "Applications", "research_mode": "team", "quality": "partial", "quality_score": 0.43117439116517287, "catalog_references": [], "prompt_length": 17658, "files_placed": 8, "status": "discard"}
{"timestamp": 1781300205.881371, "experiment_id": "0d1124f4", "concept_title": "The cycle set out to test a single structural hypothesis behind *Self-Referentia", "concept_domain": "Applications", "research_mode": "team", "quality": "partial", "quality_score": 0.45050989871260894, "catalog_references": [], "prompt_length": 19949, "files_placed": 0, "status": "discard"}
{"timestamp": 1781302244.3528805, "experiment_id": "f78a91cf", "concept_title": "Close Proofs: Information-Geometric Bridge: Fisher Metric on Statistical Manifolds", "concept_domain": "Applications", "research_mode": "team", "quality": "partial", "quality_score": 0.46637291241123907, "catalog_references": [], "prompt_length": 6258, "files_placed": 0, "status": "discard"}
{"timestamp": 1781302264.5624607, "experiment_id": "ff5654a7", "concept_title": "Self-contained, sorry-free Lean 4 formalization of the", "concept_domain": "Novelty", "research_mode": "team", "quality": "partial", "quality_score": 0.5484, "catalog_references": [], "prompt_length": 26913, "files_placed": 17, "status": "keep"}
{"timestamp": 1781302286.2111886, "experiment_id": "6af3ea9a", "concept_title": "The abstract simulation preorder formalized in `ProofSystemCollapse.lean` captur", "concept_domain": "Applications", "research_mode": "team", "quality": "partial", "quality_score": 0.47530989871260887, "catalog_references": [], "prompt_length": 21648, "files_placed": 5, "status": "discard"}
{"timestamp": 1781302325.7410603, "experiment_id": "07b372d1", "concept_title": "The natural next step is to formalize the Turaev-Viro state sum construction its", "concept_domain": "Applications", "research_mode": "team", "quality": "partial", "quality_score": 0.3869936824877251, "catalog_references": [], "prompt_length": 13428, "files_placed": 0, "status": "discard"}
{"timestamp": 1781304374.5444667, "experiment_id": "abe09acb", "concept_title": "Proof Complexity Collapse: P=NP via Proof Checking", "concept_domain": "Applications", "research_mode": "team", "quality": "partial", "quality_score": 0.54256, "catalog_references": [], "prompt_length": 8404, "files_placed": 0, "status": "keep"}
{"timestamp": 1781304397.6093183, "experiment_id": "b2c37cfb", "concept_title": "Close Proofs: The file `Catalog/Tropical/AmoebaRonkin.lean` builds a computation-fre", "concept_domain": "Novelty", "research_mode": "team", "quality": "partial", "quality_score": 0.4328211538461538, "catalog_references": [], "prompt_length": 6065, "files_placed": 0, "status": "discard"}
{"timestamp": 1781304417.9385505, "experiment_id": "4d121eae", "concept_title": "Quasi-symmetric maps generalize bi-Lipschitz maps by allowing the distortion con", "concept_domain": "Novelty", "research_mode": "team", "quality": "partial", "quality_score": 0.47216, "catalog_references": [], "prompt_length": 21637, "files_placed": 6, "status": "discard"}
{"timestamp": 1781304437.082859, "experiment_id": "0ce7a9d1", "concept_title": "Predicative-ordinal-analysis fragment", "concept_domain": "Applications", "research_mode": "team", "quality": "substantial", "quality_score": 0.7887200000000001, "catalog_references": [], "prompt_length": 24292, "files_placed": 5, "status": "keep"}
{"timestamp": 1781304457.6914217, "experiment_id": "4acdb3b1", "concept_title": "This cycle opened a constructive bridge between three faces of ordinal analysis,", "concept_domain": "Novelty", "research_mode": "team", "quality": "substantial", "quality_score": 0.7075200000000001, "catalog_references": [], "prompt_length": 23023, "files_placed": 5, "status": "keep"}
{"timestamp": 1781304478.1599536, "experiment_id": "54f590fe", "concept_title": "Inverse Stereographic Renormalization Group", "concept_domain": "Applications", "research_mode": "team", "quality": "partial", "quality_score": 0.4881714285714286, "catalog_references": [], "prompt_length": 11752, "files_placed": 0, "status": "discard"}
{"timestamp": 1781306555.27449, "experiment_id": "2c008695", "concept_title": "Close Proofs: The file `Catalog/Logic/ProofPhaseTransitions.lean` builds the formal ", "concept_domain": "Applications", "research_mode": "team", "quality": "substantial", "quality_score": 0.7200673684210526, "catalog_references": [], "prompt_length": 17662, "files_placed": 11, "status": "keep"}
{"timestamp": 1781306596.8551428, "experiment_id": "b199d8e4", "concept_title": "Neural Tangent Kernel: Convergence of Gradient Descent", "concept_domain": "Novelty", "research_mode": "team", "quality": "partial", "quality_score": 0.4171150256166983, "catalog_references": [], "prompt_length": 11261, "files_placed": 0, "status": "discard"}
{"timestamp": 1781308624.2073076, "experiment_id": "6b53a099", "concept_title": "The companion file `ScalingLaws.lean` proves, from first principles, that a", "concept_domain": "Applications", "research_mode": "team", "quality": "partial", "quality_score": 0.44961733156446465, "catalog_references": [], "prompt_length": 16482, "files_placed": 0, "status": "discard"}
{"timestamp": 1781308659.1239233, "experiment_id": "387a188b", "concept_title": "Close Proofs: This cycle opened a constructive bridge between three faces of ordinal", "concept_domain": "Applications", "research_mode": "team", "quality": "partial", "quality_score": 0.4916929824561404, "catalog_references": [], "prompt_length": 6138, "files_placed": 0, "status": "discard"}
