{"timestamp": 1781222699.304203, "experiment_id": "12ad0dc1", "concept_title": "Tropical Scheme Theory: Groebner Bases over the Tropical Semiring", "concept_domain": "Novelty", "research_mode": "team", "quality": "partial", "quality_score": 0.3915433267695307, "catalog_references": [], "prompt_length": 6134, "files_placed": 0, "status": "discard"}
{"timestamp": 1781222725.1631603, "experiment_id": "4f12ad45", "concept_title": "Bridge: Stone Duality as a Bridge Between Logic and Topology", "concept_domain": "Applications", "research_mode": "team", "quality": "partial", "quality_score": 0.4075518181284935, "catalog_references": [], "prompt_length": 11459, "files_placed": 0, "status": "discard"}
{"timestamp": 1781222755.3645573, "experiment_id": "82a52ca9", "concept_title": "Close Proofs: Close Proofs: Emergent Spacetime from Quantum Entanglement", "concept_domain": "Applications", "research_mode": "team", "quality": "partial", "quality_score": 0.37677894736842105, "catalog_references": [], "prompt_length": 6379, "files_placed": 0, "status": "discard"}
{"timestamp": 1781222880.5300276, "experiment_id": "d0fd806b", "concept_title": "Close Proofs: Close Proofs: The current framework considers *static* observation sys", "concept_domain": "Applications", "research_mode": "team", "quality": "partial", "quality_score": 0.6945139641943734, "catalog_references": [], "prompt_length": 16971, "files_placed": 4, "status": "keep"}
{"timestamp": 1781223929.7603958, "experiment_id": "3806581d", "concept_title": "The phantom number of a topology \u03c4 is the minimum cardinality of a set of strict", "concept_domain": "Novelty", "research_mode": "team", "quality": "partial", "quality_score": 0.3939046935570474, "catalog_references": [], "prompt_length": 20851, "files_placed": 0, "status": "discard"}
{"timestamp": 1781228045.7230945, "experiment_id": "d1320b37", "concept_title": "Catalog's topological theory of protein folding", "concept_domain": "Applications", "research_mode": "team", "quality": "partial", "quality_score": 0.39258081674030143, "catalog_references": [], "prompt_length": 28304, "files_placed": 0, "status": "discard"}
{"timestamp": 1781228077.5623016, "experiment_id": "9544890d", "concept_title": "Close Proofs: Bridge: Information Geometry Connecting Statistics and Differential Ge", "concept_domain": "Applications", "research_mode": "team", "quality": "partial", "quality_score": 0.37927958973062376, "catalog_references": [], "prompt_length": 6403, "files_placed": 0, "status": "discard"}
{"timestamp": 1781228106.168332, "experiment_id": "ee73107a", "concept_title": "Stereographic Proof Compression: Proofs on Spheres", "concept_domain": "Novelty", "research_mode": "team", "quality": "partial", "quality_score": 0.42645480643106826, "catalog_references": [], "prompt_length": 6553, "files_placed": 0, "status": "discard"}
{"timestamp": 1781228143.1501884, "experiment_id": "1711ca61", "concept_title": "This cycle formalized a self-contained fragment of **predicative ordinal analysi", "concept_domain": "Applications", "research_mode": "team", "quality": "partial", "quality_score": 0.4107094228460233, "catalog_references": [], "prompt_length": 26313, "files_placed": 64, "status": "discard"}
{"timestamp": 1781228174.8580363, "experiment_id": "f654455b", "concept_title": "The tropical eigenvalue of a matrix A is defined as \u03bb* = min_\u03c3 (1/n) \u2211\u1d62 A(i, \u03c3(i", "concept_domain": "Applications", "research_mode": "team", "quality": "partial", "quality_score": 0.42751776216216214, "catalog_references": [], "prompt_length": 19213, "files_placed": 0, "status": "discard"}
{"timestamp": 1781228203.5771449, "experiment_id": "957135aa", "concept_title": "The current framework models theories by their set of provably well-ordered ordi", "concept_domain": "Cryptography", "research_mode": "team", "quality": "partial", "quality_score": 0.4273086834234807, "catalog_references": [], "prompt_length": 20013, "files_placed": 0, "status": "discard"}
{"timestamp": 1781228242.683697, "experiment_id": "4b5245d6", "concept_title": "**Thermodynamic Proof System** (TPS) framewo", "concept_domain": "MachineLearning", "research_mode": "team", "quality": "partial", "quality_score": 0.42663647741594823, "catalog_references": [], "prompt_length": 26165, "files_placed": 0, "status": "discard"}
{"timestamp": 1781230286.141642, "experiment_id": "08c2e9e7", "concept_title": "Close Proofs: Stereographic Proof Compression: Proofs on Spheres", "concept_domain": "Logic", "research_mode": "team", "quality": "partial", "quality_score": 0.38858, "catalog_references": [], "prompt_length": 6049, "files_placed": 0, "status": "discard"}
{"timestamp": 1781232208.0447166, "experiment_id": "4933d22f", "concept_title": "The file `TropicalDeterminant.lean` formalizes the tropical (min-plus) determina", "concept_domain": "Tropical", "research_mode": "team", "quality": "partial", "quality_score": 0.3481687313432836, "catalog_references": [], "prompt_length": 16030, "files_placed": 0, "status": "discard"}
{"timestamp": 1781232233.6244187, "experiment_id": "8f5fa392", "concept_title": "Topological Order: Anyon Statistics from Ground State Degeneracy", "concept_domain": "Physics", "research_mode": "team", "quality": "partial", "quality_score": 0.3479808695652174, "catalog_references": [], "prompt_length": 5866, "files_placed": 0, "status": "discard"}
{"timestamp": 1781232251.26463, "experiment_id": "0805a8b9", "concept_title": "The file `Catalog/Applications/CombinatorialSpecies.lean` establishes the first ", "concept_domain": "Novelty", "research_mode": "team", "quality": "partial", "quality_score": 0.60229, "catalog_references": [], "prompt_length": 23290, "files_placed": 5, "status": "keep"}
{"timestamp": 1781232275.8305922, "experiment_id": "46c01927", "concept_title": "Close Proofs: Tropical Convexity: Helly, Caratheodory, and Radon", "concept_domain": "Tropical", "research_mode": "team", "quality": "partial", "quality_score": 0.3481550454082831, "catalog_references": [], "prompt_length": 6049, "files_placed": 0, "status": "discard"}
{"timestamp": 1781232298.681505, "experiment_id": "96d5c1f4", "concept_title": "**Entropy-Bounded Computation (EBC)** framew", "concept_domain": "Novelty", "research_mode": "team", "quality": "partial", "quality_score": 0.42342827225130897, "catalog_references": [], "prompt_length": 29567, "files_placed": 0, "status": "discard"}
{"timestamp": 1781232321.734181, "experiment_id": "f9553fb7", "concept_title": "Close Proofs: Close Proofs: Quantum Topological Phase Computation", "concept_domain": "Applications", "research_mode": "team", "quality": "partial", "quality_score": 0.39081137569714386, "catalog_references": [], "prompt_length": 6190, "files_placed": 0, "status": "discard"}
{"timestamp": 1781232347.5432727, "experiment_id": "c9236a0d", "concept_title": "Topological Quantum Computing: Braiding Universality", "concept_domain": "Applications", "research_mode": "team", "quality": "partial", "quality_score": 0.38877590980466054, "catalog_references": [], "prompt_length": 11055, "files_placed": 0, "status": "discard"}
{"timestamp": 1781232371.8623142, "experiment_id": "45114de6", "concept_title": "Close Proofs: Close Proofs: Close Proofs: Proof-Theoretic Bridge: Ordinal Analysis A", "concept_domain": "Geometry", "research_mode": "team", "quality": "partial", "quality_score": 0.32767624615384616, "catalog_references": [], "prompt_length": 6185, "files_placed": 0, "status": "discard"}
{"timestamp": 1781236332.219379, "experiment_id": "9b2bee2f", "concept_title": "This cycle isolated the *primitivity* layer of Fibonacci divisibility theory and", "concept_domain": "Algebra", "research_mode": "team", "quality": "partial", "quality_score": 0.66176, "catalog_references": [], "prompt_length": 25720, "files_placed": 5, "status": "keep"}
{"timestamp": 1781236369.5025666, "experiment_id": "f1cb7dfa", "concept_title": "Close Proofs: Arithmetic Mirror Symmetry for Calabi-Yau", "concept_domain": "Novelty", "research_mode": "team", "quality": "partial", "quality_score": 0.4038523076923077, "catalog_references": [], "prompt_length": 17607, "files_placed": 5, "status": "discard"}
{"timestamp": 1781236384.6603742, "experiment_id": "5039f952", "concept_title": "Close Proofs: Close Proofs: One-Way Functions: Existence and Hierarchy", "concept_domain": "Applications", "research_mode": "team", "quality": "partial", "quality_score": 0.52037, "catalog_references": [], "prompt_length": 17645, "files_placed": 5, "status": "keep"}
{"timestamp": 1781236429.2831092, "experiment_id": "6bd3627f", "concept_title": "Close Proofs: Temporal Logic of Proofs: When You Prove Something Matters", "concept_domain": "Shared", "research_mode": "team", "quality": "partial", "quality_score": 0.42694976958525344, "catalog_references": [], "prompt_length": 6047, "files_placed": 0, "status": "discard"}
{"timestamp": 1781238410.7107058, "experiment_id": "2ce3e872", "concept_title": "The current formalization uses an abstract `DSepOracle` satisfying graphoid axio", "concept_domain": "Algebra", "research_mode": "team", "quality": "substantial", "quality_score": 0.73536, "catalog_references": [], "prompt_length": 21080, "files_placed": 5, "status": "keep"}
{"timestamp": 1781238432.3939676, "experiment_id": "3aabcb67", "concept_title": "Our `exists_revSim_of_surjective` proves that surjective endofunctions on `Fin n", "concept_domain": "Computation", "research_mode": "team", "quality": "partial", "quality_score": 0.65648, "catalog_references": [], "prompt_length": 22833, "files_placed": 7, "status": "keep"}
{"timestamp": 1781238460.1538086, "experiment_id": "1a6844f3", "concept_title": "The `tropical_power_gap_diagonal` theorem establishes that negative-diagonal tro", "concept_domain": "Shared", "research_mode": "team", "quality": "partial", "quality_score": 0.4230574283559578, "catalog_references": [], "prompt_length": 21991, "files_placed": 0, "status": "discard"}
{"timestamp": 1781238478.5802016, "experiment_id": "84c2dc55", "concept_title": "Rigorous formal framework for holographic proo", "concept_domain": "Novelty", "research_mode": "team", "quality": "partial", "quality_score": 0.39824000000000004, "catalog_references": [], "prompt_length": 30550, "files_placed": 1, "status": "discard"}
{"timestamp": 1781238494.800749, "experiment_id": "f1b37415", "concept_title": "Algebraic Statistics: Markov Bases for Contingency Tables", "concept_domain": "Algebra", "research_mode": "team", "quality": "partial", "quality_score": 0.55808, "catalog_references": [], "prompt_length": 17473, "files_placed": 1, "status": "keep"}
{"timestamp": 1781240891.0165746, "experiment_id": "74a1d7b5", "concept_title": "One-Way Functions: Existence and Hierarchy", "concept_domain": "Cryptography", "research_mode": "team", "quality": "partial", "quality_score": 0.41800000000000004, "catalog_references": [], "prompt_length": 5697, "files_placed": 0, "status": "discard"}
{"timestamp": 1781240918.6150725, "experiment_id": "85e56c16", "concept_title": "Close Proofs: This cycle attacked the ordinal-analysis target \"construct an order-pr", "concept_domain": "Pythagorean", "research_mode": "team", "quality": "partial", "quality_score": 0.4243189090909092, "catalog_references": [], "prompt_length": 6171, "files_placed": 0, "status": "discard"}
{"timestamp": 1781240987.1730683, "experiment_id": "d0a10181", "concept_title": "This cycle isolated the *arithmetic core* of Cobham's theorem (1972) \u2014 the hypot", "concept_domain": "Logic", "research_mode": "team", "quality": "partial", "quality_score": 0.4637520661157025, "catalog_references": [], "prompt_length": 21511, "files_placed": 0, "status": "discard"}
{"timestamp": 1781241017.8511965, "experiment_id": "79e9cee9", "concept_title": "Arithmetic Holography: Spectral Reconstruction of Zeta Zeros from Hyperbolic Qua", "concept_domain": "Computation", "research_mode": "team", "quality": "partial", "quality_score": 0.4238298920968213, "catalog_references": [], "prompt_length": 7565, "files_placed": 0, "status": "discard"}
{"timestamp": 1781241042.6780214, "experiment_id": "5d4e58d8", "concept_title": "Close Proofs: The `tropical_power_gap_diagonal` theorem establishes that negative-di", "concept_domain": "Shared", "research_mode": "team", "quality": "partial", "quality_score": 0.391338040151338, "catalog_references": [], "prompt_length": 11502, "files_placed": 0, "status": "discard"}
{"timestamp": 1781244277.8516622, "experiment_id": "ccb9b034", "concept_title": "Algebraic and order-theoretic backbone of stereograph", "concept_domain": "Geometry", "research_mode": "team", "quality": "partial", "quality_score": 0.4230047699860463, "catalog_references": [], "prompt_length": 18196, "files_placed": 0, "status": "discard"}
{"timestamp": 1781244297.0013964, "experiment_id": "166e1d18", "concept_title": "Close Proofs: Close Proofs: This cycle replaced the softmax score `exp\u27e8q,k\u27e9` with th", "concept_domain": "Cryptography", "research_mode": "team", "quality": "partial", "quality_score": 0.6270279310344827, "catalog_references": [], "prompt_length": 17664, "files_placed": 6, "status": "keep"}
{"timestamp": 1781244319.14936, "experiment_id": "352bb006", "concept_title": "Extend the integration deficiency framework to a full Shannon entropy formalizat", "concept_domain": "Algebra", "research_mode": "team", "quality": "partial", "quality_score": 0.569817731958763, "catalog_references": [], "prompt_length": 22005, "files_placed": 6, "status": "keep"}
{"timestamp": 1781244341.0868752, "experiment_id": "dbb92078", "concept_title": "The current framework uses a fixed novelty threshold \u03b4. A natural extension is t", "concept_domain": "Algebra", "research_mode": "team", "quality": "partial", "quality_score": 0.5326478527607362, "catalog_references": [], "prompt_length": 21525, "files_placed": 8, "status": "keep"}
{"timestamp": 1781244366.9886236, "experiment_id": "40c66050", "concept_title": "The file `Catalog/Tropical/AmoebaRonkin.lean` builds a computation-free core of ", "concept_domain": "Geometry", "research_mode": "team", "quality": "partial", "quality_score": 0.45279458538636536, "catalog_references": [], "prompt_length": 16125, "files_placed": 0, "status": "discard"}
{"timestamp": 1781244391.5816538, "experiment_id": "d9a1f300", "concept_title": "Emergent Spacetime from Quantum Entanglement", "concept_domain": "Applications", "research_mode": "team", "quality": "partial", "quality_score": 0.4265751974662272, "catalog_references": [], "prompt_length": 5870, "files_placed": 0, "status": "discard"}
{"timestamp": 1781244432.602271, "experiment_id": "cd56fc3f", "concept_title": "The file `Geometry/FractalDimension.lean` builds the **set-local** theory of Hau", "concept_domain": "Bridges", "research_mode": "team", "quality": "partial", "quality_score": 0.4664804886256563, "catalog_references": [], "prompt_length": 14690, "files_placed": 0, "status": "discard"}
{"timestamp": 1781246418.5756972, "experiment_id": "bf726cd6", "concept_title": "Foundational analytic infrastructure for formalizing", "concept_domain": "Algebra", "research_mode": "team", "quality": "partial", "quality_score": 0.42794696278511407, "catalog_references": [], "prompt_length": 20493, "files_placed": 0, "status": "discard"}
{"timestamp": 1781246452.1744664, "experiment_id": "64c5b386", "concept_title": "Close Proofs: We proved that the biconjugate satisfies f\u2605\u2605(x) \u2264 f(x) for all x. The ", "concept_domain": "Applications", "research_mode": "team", "quality": "partial", "quality_score": 0.5784016886543535, "catalog_references": [], "prompt_length": 17661, "files_placed": 64, "status": "keep"}
{"timestamp": 1781246476.8438385, "experiment_id": "22a0bd52", "concept_title": "This cycle formalized the *exactly linearized* (lazy) regime of the Neural", "concept_domain": "MachineLearning", "research_mode": "team", "quality": "partial", "quality_score": 0.450120542936445, "catalog_references": [], "prompt_length": 21651, "files_placed": 0, "status": "discard"}
{"timestamp": 1781246506.703015, "experiment_id": "5a9af5e7", "concept_title": "This cycle mapped the *provability boundary* of Beal's Conjecture", "concept_domain": "Novelty", "research_mode": "team", "quality": "partial", "quality_score": 0.39484764685436224, "catalog_references": [], "prompt_length": 23082, "files_placed": 0, "status": "discard"}
{"timestamp": 1781247803.0495667, "experiment_id": "24eec4d0", "concept_title": "Arithmetic Universality in Cellular Automata via p-adic Renormalization", "concept_domain": "Physics", "research_mode": "team", "quality": "partial", "quality_score": 0.5297781456953643, "catalog_references": [], "prompt_length": 7465, "files_placed": 0, "status": "keep"}
{"timestamp": 1781247841.6766446, "experiment_id": "c77582cd", "concept_title": "Post-Quantum Lattice Cryptography: Formal Security Proofs", "concept_domain": "Applications", "research_mode": "team", "quality": "partial", "quality_score": 0.3938176119194529, "catalog_references": [], "prompt_length": 5905, "files_placed": 0, "status": "discard"}
{"timestamp": 1781249892.1535447, "experiment_id": "3c9f09e3", "concept_title": "Close Proofs: Close Proofs: Cobham's theorem (1972) states that if a sequence is bot", "concept_domain": "Tropical", "research_mode": "team", "quality": "partial", "quality_score": 0.6822099399599733, "catalog_references": [], "prompt_length": 17655, "files_placed": 52, "status": "keep"}
{"timestamp": 1781249923.3269892, "experiment_id": "eb6925c9", "concept_title": "Tropical Convexity: Helly, Caratheodory, and Radon", "concept_domain": "Tropical", "research_mode": "team", "quality": "partial", "quality_score": 0.41666551724137935, "catalog_references": [], "prompt_length": 6254, "files_placed": 0, "status": "discard"}
{"timestamp": 1781249947.9873128, "experiment_id": "e4794f0b", "concept_title": "The geometric convergence theorem (`gdResidual_geometric_decay`) assumes a contr", "concept_domain": "Novelty", "research_mode": "team", "quality": "partial", "quality_score": 0.425387342317181, "catalog_references": [], "prompt_length": 13841, "files_placed": 0, "status": "discard"}
{"timestamp": 1781249974.3666, "experiment_id": "5e87f3f5", "concept_title": "File produced this cycle: `Catalog/Logic/OrdinalAnalysisBridge.lean`", "concept_domain": "Tropical", "research_mode": "team", "quality": "partial", "quality_score": 0.43751518656488697, "catalog_references": [], "prompt_length": 22710, "files_placed": 0, "status": "discard"}
{"timestamp": 1781249999.3230917, "experiment_id": "4481648b", "concept_title": "The file `Catalog/Tropical/TropicalModuliCompactification.lean` formalizes the", "concept_domain": "Applications", "research_mode": "team", "quality": "partial", "quality_score": 0.42618312230779276, "catalog_references": [], "prompt_length": 22657, "files_placed": 0, "status": "discard"}
{"timestamp": 1781251976.5892818, "experiment_id": "db9f5342", "concept_title": "Stereographic Capacity Theory: Packing Bounds on Spheres via Plane Geometry", "concept_domain": "Novelty", "research_mode": "team", "quality": "partial", "quality_score": 0.4251357191547376, "catalog_references": [], "prompt_length": 8418, "files_placed": 0, "status": "discard"}
{"timestamp": 1781252003.0479636, "experiment_id": "cdf4a43d", "concept_title": "Riemann Hypothesis", "concept_domain": "Novelty", "research_mode": "team", "quality": "partial", "quality_score": 0.423168720830206, "catalog_references": [], "prompt_length": 11295, "files_placed": 0, "status": "discard"}
{"timestamp": 1781252031.0120022, "experiment_id": "5dac3011", "concept_title": "The file `Basic.lean` establishes a fully formal, axiom-clean depth-separation", "concept_domain": "Novelty", "research_mode": "team", "quality": "partial", "quality_score": 0.4599545454545455, "catalog_references": [], "prompt_length": 22742, "files_placed": 15, "status": "discard"}
{"timestamp": 1781252054.1921039, "experiment_id": "c3e56876", "concept_title": "Close Proofs: Close Proofs: This cycle added `Catalog/Pythagorean/FibonacciEntryFact", "concept_domain": "Novelty", "research_mode": "team", "quality": "substantial", "quality_score": 0.7157600000000001, "catalog_references": [], "prompt_length": 17653, "files_placed": 6, "status": "keep"}
{"timestamp": 1781252086.2727602, "experiment_id": "1057d1bf", "concept_title": "Stereographic Neural Attention: Attention via Riemann Sphere", "concept_domain": "Applications", "research_mode": "team", "quality": "partial", "quality_score": 0.3871908755760369, "catalog_references": [], "prompt_length": 6434, "files_placed": 0, "status": "discard"}
{"timestamp": 1781254058.5492086, "experiment_id": "013d7bfa", "concept_title": "For metrizable separable spaces, the small inductive dimension, large inductive ", "concept_domain": "Novelty", "research_mode": "team", "quality": "partial", "quality_score": 0.3857670226691309, "catalog_references": [], "prompt_length": 16553, "files_placed": 0, "status": "discard"}
{"timestamp": 1781254103.3193889, "experiment_id": "033e273c", "concept_title": "This cycle took the catalog's well-developed theory of the Fibonacci **rank of", "concept_domain": "Novelty", "research_mode": "team", "quality": "partial", "quality_score": 0.4205088649149455, "catalog_references": [], "prompt_length": 26497, "files_placed": 0, "status": "discard"}
{"timestamp": 1781254127.6206555, "experiment_id": "2d7b5930", "concept_title": "The file `Cryptography/UniqueGamesMaxCut.lean` formalizes the combinatorial core", "concept_domain": "Novelty", "research_mode": "team", "quality": "partial", "quality_score": 0.41054934142153693, "catalog_references": [], "prompt_length": 22123, "files_placed": 0, "status": "discard"}
