{"timestamp": 1781093765.0297325, "experiment_id": "3766d88d", "concept_title": "Consciousness as Integrated Information: Mathematical Foundations", "concept_domain": "Applications", "research_mode": "team", "quality": "partial", "quality_score": 0.44479402985074634, "catalog_references": [], "prompt_length": 16385, "files_placed": 9, "status": "discard"}
{"timestamp": 1781093901.3992517, "experiment_id": "8b7c5a90", "concept_title": "This document outlines research directions extending the formalized noise schedu", "concept_domain": "Applications", "research_mode": "team", "quality": "partial", "quality_score": 0.393046913118527, "catalog_references": [], "prompt_length": 16581, "files_placed": 0, "status": "discard"}
{"timestamp": 1781095969.2167637, "experiment_id": "00b42e00", "concept_title": "Bridge: Tropical Geometry as a Limit of Classical Algebraic Geometry", "concept_domain": "Applications", "research_mode": "team", "quality": "substantial", "quality_score": 0.7349600000000001, "catalog_references": [], "prompt_length": 16467, "files_placed": 11, "status": "keep"}
{"timestamp": 1781095989.9424284, "experiment_id": "13ee828e", "concept_title": "Close Proofs: Stereographic Capacity Theory: Packing Bounds on Spheres via Plane Geo", "concept_domain": "Applications", "research_mode": "team", "quality": "partial", "quality_score": 0.4688, "catalog_references": [], "prompt_length": 16506, "files_placed": 5, "status": "discard"}
{"timestamp": 1781096017.2587352, "experiment_id": "0c7cf1ad", "concept_title": "Tropical Amoebas and Ronkin Functions", "concept_domain": "Novelty", "research_mode": "team", "quality": "partial", "quality_score": 0.4454591482599714, "catalog_references": [], "prompt_length": 16334, "files_placed": 5, "status": "discard"}
{"timestamp": 1781096041.1643682, "experiment_id": "b676b19c", "concept_title": "Deepening: Quasi-symmetric maps generalize bi-Lipschitz maps by allowing the distortion con", "concept_domain": "Applications", "research_mode": "team", "quality": "partial", "quality_score": 0.6667314285714285, "catalog_references": [], "prompt_length": 16659, "files_placed": 7, "status": "keep"}
{"timestamp": 1781098251.610515, "experiment_id": "977b4a27", "concept_title": "Homotopy Type Theory as Foundations", "concept_domain": "Applications", "research_mode": "team", "quality": "partial", "quality_score": 0.38542590476190475, "catalog_references": [], "prompt_length": 5982, "files_placed": 0, "status": "discard"}
{"timestamp": 1781098315.1365776, "experiment_id": "1fb367df", "concept_title": "Cryptography from the Collatz Conjecture: One-Way Functions from Iterated Maps", "concept_domain": "Novelty", "research_mode": "team", "quality": "partial", "quality_score": 0.4243940966010734, "catalog_references": [], "prompt_length": 7982, "files_placed": 0, "status": "discard"}
{"timestamp": 1781098345.4779549, "experiment_id": "a8094d32", "concept_title": "Homotopy Type Theory Foundations", "concept_domain": "Applications", "research_mode": "team", "quality": "partial", "quality_score": 0.3680552050473187, "catalog_references": [], "prompt_length": 5961, "files_placed": 0, "status": "discard"}
{"timestamp": 1781098376.2643275, "experiment_id": "82a36638", "concept_title": "Tropical Matroid Theory: Bergman Fans and Tropical Linear Spaces", "concept_domain": "Novelty", "research_mode": "team", "quality": "partial", "quality_score": 0.39191811794937415, "catalog_references": [], "prompt_length": 6619, "files_placed": 0, "status": "discard"}
{"timestamp": 1781100440.9087946, "experiment_id": "24c7b7e9", "concept_title": "ML Universal Approximation: Width vs Depth Trade-offs", "concept_domain": "Applications", "research_mode": "team", "quality": "partial", "quality_score": 0.5460879746835443, "catalog_references": [], "prompt_length": 16501, "files_placed": 19, "status": "keep"}
{"timestamp": 1781100465.3478363, "experiment_id": "8e8b7fb9", "concept_title": "Biological Topology: Protein Folding as Persistent Homology Optimization", "concept_domain": "Novelty", "research_mode": "team", "quality": "partial", "quality_score": 0.6368867100977198, "catalog_references": [], "prompt_length": 17228, "files_placed": 5, "status": "keep"}
{"timestamp": 1781100496.0611303, "experiment_id": "ea08ccd3", "concept_title": "The natural next step after soundness is **completeness**: every tautology is pr", "concept_domain": "Applications", "research_mode": "team", "quality": "partial", "quality_score": 0.39160427539900466, "catalog_references": [], "prompt_length": 13719, "files_placed": 0, "status": "discard"}
{"timestamp": 1781100522.7088373, "experiment_id": "51a00311", "concept_title": "Tropical Differential Equations: Power Series Solutions", "concept_domain": "Novelty", "research_mode": "team", "quality": "partial", "quality_score": 0.6597028571428571, "catalog_references": [], "prompt_length": 16440, "files_placed": 5, "status": "keep"}
{"timestamp": 1781100547.7227979, "experiment_id": "6e02950d", "concept_title": "Close Proofs: Tropical Hodge Theory", "concept_domain": "Novelty", "research_mode": "team", "quality": "partial", "quality_score": 0.3916190712547626, "catalog_references": [], "prompt_length": 6288, "files_placed": 0, "status": "discard"}
{"timestamp": 1781102678.8362608, "experiment_id": "47b6d2a8", "concept_title": "Close Proofs: Close Proofs: Fractal Topology: Hausdorff Dimension as a Topological I", "concept_domain": "Novelty", "research_mode": "team", "quality": "partial", "quality_score": 0.4211639751552796, "catalog_references": [], "prompt_length": 11519, "files_placed": 0, "status": "discard"}
{"timestamp": 1781102707.359319, "experiment_id": "1478bf77", "concept_title": "Cryptography from the Collatz Conjecture: One-Way Functions from Iterated Maps", "concept_domain": "Applications", "research_mode": "team", "quality": "partial", "quality_score": 0.3472088230324739, "catalog_references": [], "prompt_length": 8488, "files_placed": 0, "status": "discard"}
{"timestamp": 1781102738.390365, "experiment_id": "5d36b8f2", "concept_title": "For metrizable separable spaces, the small inductive dimension, large inductive ", "concept_domain": "Applications", "research_mode": "team", "quality": "partial", "quality_score": 0.43072778832463227, "catalog_references": [], "prompt_length": 16763, "files_placed": 0, "status": "discard"}
{"timestamp": 1781102775.7020292, "experiment_id": "a78aff5b", "concept_title": "Close Proofs: Stereographic Capacity Theory: Packing Bounds on Spheres via Plane Geo", "concept_domain": "Applications", "research_mode": "team", "quality": "partial", "quality_score": 0.4398512396694215, "catalog_references": [], "prompt_length": 6397, "files_placed": 0, "status": "discard"}
{"timestamp": 1781102805.4624398, "experiment_id": "e654db2b", "concept_title": "Poincar\u00e9 Conjecture Revisited: 4D Smooth", "concept_domain": "Novelty", "research_mode": "team", "quality": "partial", "quality_score": 0.4298611851377323, "catalog_references": [], "prompt_length": 11235, "files_placed": 0, "status": "discard"}
{"timestamp": 1781102834.5395038, "experiment_id": "ce98ef61", "concept_title": "Quantum Error Correction Threshold: The Eastin-Knill Theorem", "concept_domain": "Applications", "research_mode": "team", "quality": "partial", "quality_score": 0.4287979608909338, "catalog_references": [], "prompt_length": 6639, "files_placed": 0, "status": "discard"}
{"timestamp": 1781103020.1003444, "experiment_id": "467fe1ce", "concept_title": "Close Proofs: Biological Topology: Protein Folding as Persistent Homology Optimizati", "concept_domain": "Applications", "research_mode": "team", "quality": "partial", "quality_score": 0.42299178043432134, "catalog_references": [], "prompt_length": 11519, "files_placed": 0, "status": "discard"}
{"timestamp": 1781105205.0083356, "experiment_id": "110d7684", "concept_title": "Bridge: Tropical Geometry as a Limit of Classical Algebraic Geometry", "concept_domain": "Novelty", "research_mode": "team", "quality": "partial", "quality_score": 0.466330888618381, "catalog_references": [], "prompt_length": 16457, "files_placed": 75, "status": "discard"}
{"timestamp": 1781105255.5737638, "experiment_id": "bd82c9f7", "concept_title": "The edge bound |E| \u2264 3g \u2212 3 we proved here is for *unmarked* stable tropical cur", "concept_domain": "Novelty", "research_mode": "team", "quality": "partial", "quality_score": 0.45010730276026956, "catalog_references": [], "prompt_length": 16195, "files_placed": 0, "status": "discard"}
{"timestamp": 1781107314.25897, "experiment_id": "4301a51e", "concept_title": "Close Proofs: Dream Logic: Non-Monotone Reasoning Where Contradictions Coexist", "concept_domain": "Novelty", "research_mode": "team", "quality": "partial", "quality_score": 0.6259713779527559, "catalog_references": [], "prompt_length": 16490, "files_placed": 38, "status": "keep"}
{"timestamp": 1781107341.1251814, "experiment_id": "849e27bd", "concept_title": "Close Proofs: Cryptographic Hash Functions: Collision Resistance from Hard Problems", "concept_domain": "Novelty", "research_mode": "team", "quality": "partial", "quality_score": 0.47216, "catalog_references": [], "prompt_length": 16499, "files_placed": 11, "status": "discard"}
{"timestamp": 1781107369.479014, "experiment_id": "8eb2ea12", "concept_title": "Close Proofs: Close Proofs: Biological Topology: Protein Folding as Persistent Homol", "concept_domain": "Novelty", "research_mode": "team", "quality": "partial", "quality_score": 0.45893473684210534, "catalog_references": [], "prompt_length": 11521, "files_placed": 0, "status": "discard"}
{"timestamp": 1781107397.7023504, "experiment_id": "0866bc70", "concept_title": "Close Proofs: Poincar\u00e9 Conjecture Revisited: 4D Smooth", "concept_domain": "Applications", "research_mode": "team", "quality": "partial", "quality_score": 0.6420416858237549, "catalog_references": [], "prompt_length": 16475, "files_placed": 5, "status": "keep"}
{"timestamp": 1781109496.2072115, "experiment_id": "156a9dac", "concept_title": "This cycle built, from scratch, a small but complete formal theory of **Markov b", "concept_domain": "Novelty", "research_mode": "team", "quality": "partial", "quality_score": 0.4516494975276531, "catalog_references": [], "prompt_length": 31455, "files_placed": 0, "status": "discard"}
{"timestamp": 1781109543.6295707, "experiment_id": "890ec8d0", "concept_title": "Formally verified framework (`Computation/SpectralChain/`)", "concept_domain": "Applications", "research_mode": "team", "quality": "substantial", "quality_score": 0.7169511769059955, "catalog_references": [], "prompt_length": 20965, "files_placed": 42, "status": "keep"}
{"timestamp": 1781109600.302252, "experiment_id": "15bf99fa", "concept_title": "Close Proofs: The Geometry of Consensus: Arrow's Theorem as Curvature", "concept_domain": "Applications", "research_mode": "team", "quality": "partial", "quality_score": 0.3926585882352942, "catalog_references": [], "prompt_length": 6888, "files_placed": 0, "status": "discard"}
{"timestamp": 1781109672.3302104, "experiment_id": "a1d5b8be", "concept_title": "The Lean development in `Catalog/Speculative/ProteinFolding.lean` establishes th", "concept_domain": "Novelty", "research_mode": "team", "quality": "partial", "quality_score": 0.3325844686255552, "catalog_references": [], "prompt_length": 16757, "files_placed": 0, "status": "discard"}
{"timestamp": 1781109753.5458024, "experiment_id": "eaba392c", "concept_title": "Close Proofs: Close Proofs: Close Proofs: Biological Topology: Protein Folding as Pe", "concept_domain": "Applications", "research_mode": "team", "quality": "partial", "quality_score": 0.30260957808968963, "catalog_references": [], "prompt_length": 11517, "files_placed": 0, "status": "discard"}
{"timestamp": 1781112159.9084046, "experiment_id": "cd85332e", "concept_title": "Combinatorial-Categorical Bridge: Species of Structures as Functors", "concept_domain": "Novelty", "research_mode": "team", "quality": "partial", "quality_score": 0.44020478955913583, "catalog_references": [], "prompt_length": 6128, "files_placed": 0, "status": "discard"}
{"timestamp": 1781112186.0554945, "experiment_id": "5f504979", "concept_title": "The current work formalizes phase transitions for one-dimensional tropical polyn", "concept_domain": "Novelty", "research_mode": "team", "quality": "partial", "quality_score": 0.42661057142857145, "catalog_references": [], "prompt_length": 17363, "files_placed": 0, "status": "discard"}
{"timestamp": 1781112215.2873657, "experiment_id": "61489e94", "concept_title": "Close Proofs: Bridge: Tropical Geometry as a Limit of Classical Algebraic Geometry", "concept_domain": "Novelty", "research_mode": "team", "quality": "partial", "quality_score": 0.40878829385403337, "catalog_references": [], "prompt_length": 6881, "files_placed": 0, "status": "discard"}
{"timestamp": 1781112240.4414332, "experiment_id": "90709731", "concept_title": "The file `Computation/SpectralChain/Core.lean` builds, from first principles, a", "concept_domain": "Applications", "research_mode": "team", "quality": "partial", "quality_score": 0.413682651308325, "catalog_references": [], "prompt_length": 19076, "files_placed": 0, "status": "discard"}
{"timestamp": 1781112300.0284564, "experiment_id": "4cb3cf07", "concept_title": "The sphere-packing bound gives an upper bound on code size, but the", "concept_domain": "Novelty", "research_mode": "team", "quality": "partial", "quality_score": 0.42107199292386754, "catalog_references": [], "prompt_length": 13346, "files_placed": 0, "status": "discard"}
{"timestamp": 1781112330.1345918, "experiment_id": "4a22377a", "concept_title": "Biological Topology: Protein Folding as Persistent Homology Optimization", "concept_domain": "Novelty", "research_mode": "team", "quality": "partial", "quality_score": 0.3895102234402711, "catalog_references": [], "prompt_length": 13475, "files_placed": 0, "status": "discard"}
{"timestamp": 1781114472.236589, "experiment_id": "52583c93", "concept_title": "Close Proofs: Deepening: Quasi-symmetric maps generalize bi-Lipschitz maps by allowi", "concept_domain": "Applications", "research_mode": "team", "quality": "partial", "quality_score": 0.5693259284497445, "catalog_references": [], "prompt_length": 16511, "files_placed": 47, "status": "keep"}
{"timestamp": 1781114508.732102, "experiment_id": "1cc61293", "concept_title": "Close Proofs: This cycle built, from scratch, a small but complete formal theory of ", "concept_domain": "Novelty", "research_mode": "team", "quality": "partial", "quality_score": 0.5133138461538462, "catalog_references": [], "prompt_length": 16496, "files_placed": 43, "status": "keep"}
{"timestamp": 1781114538.1926088, "experiment_id": "007b54b3", "concept_title": "Close Proofs: The current formalization handles 0-dimensional persistence on discret", "concept_domain": "Applications", "research_mode": "team", "quality": "partial", "quality_score": 0.5184915068493151, "catalog_references": [], "prompt_length": 16505, "files_placed": 13, "status": "keep"}
{"timestamp": 1781114563.3656495, "experiment_id": "8ec07443", "concept_title": "Vaught's Conjecture", "concept_domain": "Novelty", "research_mode": "team", "quality": "partial", "quality_score": 0.4243129032258065, "catalog_references": [], "prompt_length": 10992, "files_placed": 0, "status": "discard"}
{"timestamp": 1781114619.658247, "experiment_id": "73456b84", "concept_title": "Close Proofs: Close Proofs: Bridge: Tropical Geometry as a Limit of Classical Algebr", "concept_domain": "Applications", "research_mode": "team", "quality": "partial", "quality_score": 0.46739555555555556, "catalog_references": [], "prompt_length": 6397, "files_placed": 0, "status": "discard"}
{"timestamp": 1781116733.0756385, "experiment_id": "d8cbaf8d", "concept_title": "Close Proofs: Combinatorial-Categorical Bridge: Species of Structures as Functors", "concept_domain": "Applications", "research_mode": "team", "quality": "substantial", "quality_score": 0.7351678504672897, "catalog_references": [], "prompt_length": 16503, "files_placed": 35, "status": "keep"}
{"timestamp": 1781116758.3721926, "experiment_id": "7c700d36", "concept_title": "Willmore Conjecture Generalizations", "concept_domain": "Novelty", "research_mode": "team", "quality": "partial", "quality_score": 0.39450544933239157, "catalog_references": [], "prompt_length": 5828, "files_placed": 0, "status": "discard"}
{"timestamp": 1781116787.6273165, "experiment_id": "29de36fe", "concept_title": "12 fully proved theorems (zero sorry) formalizing the algebr", "concept_domain": "Applications", "research_mode": "team", "quality": "partial", "quality_score": 0.42551992094861657, "catalog_references": [], "prompt_length": 21835, "files_placed": 0, "status": "discard"}
{"timestamp": 1781116815.6862884, "experiment_id": "c06b5eac", "concept_title": "Close Proofs: Vaught's Conjecture", "concept_domain": "Novelty", "research_mode": "team", "quality": "partial", "quality_score": 0.42601143291163, "catalog_references": [], "prompt_length": 6756, "files_placed": 0, "status": "discard"}
{"timestamp": 1781118908.199278, "experiment_id": "36e23838", "concept_title": "One-Way Functions: Existence and Hierarchy", "concept_domain": "Novelty", "research_mode": "team", "quality": "partial", "quality_score": 0.4260742436595407, "catalog_references": [], "prompt_length": 6409, "files_placed": 0, "status": "discard"}
{"timestamp": 1781118936.8763556, "experiment_id": "4f7be04a", "concept_title": "This cycle deepened the set-local Hausdorff-dimension distortion theory begun in", "concept_domain": "Novelty", "research_mode": "team", "quality": "partial", "quality_score": 0.4260833084998099, "catalog_references": [], "prompt_length": 21849, "files_placed": 0, "status": "discard"}
{"timestamp": 1781118960.2591884, "experiment_id": "26dedf74", "concept_title": "Close Proofs: The sphere-packing bound gives an upper bound on code size, but the", "concept_domain": "Applications", "research_mode": "team", "quality": "partial", "quality_score": 0.4235007131031736, "catalog_references": [], "prompt_length": 6890, "files_placed": 0, "status": "discard"}
{"timestamp": 1781118989.3836322, "experiment_id": "40aa69a1", "concept_title": "Close Proofs: Close Proofs: Dream Logic: Non-Monotone Reasoning Where Contradictions", "concept_domain": "Applications", "research_mode": "team", "quality": "partial", "quality_score": 0.42371387323221976, "catalog_references": [], "prompt_length": 11519, "files_placed": 0, "status": "discard"}
{"timestamp": 1781119693.8539183, "experiment_id": "f2b46b34", "concept_title": "Close Proofs: Close Proofs: This cycle built, from scratch, a small but complete for", "concept_domain": "Novelty", "research_mode": "team", "quality": "partial", "quality_score": 0.3912990401468267, "catalog_references": [], "prompt_length": 6385, "files_placed": 0, "status": "discard"}
{"timestamp": 1781121734.5741427, "experiment_id": "75fdee88", "concept_title": "Close Proofs: Dream Logic: Non-Monotone Reasoning Where Contradictions Coexist", "concept_domain": "Applications", "research_mode": "team", "quality": "partial", "quality_score": 0.3652599549546376, "catalog_references": [], "prompt_length": 6389, "files_placed": 0, "status": "discard"}
{"timestamp": 1781121763.7526295, "experiment_id": "a8df97b3", "concept_title": "Close Proofs: Quantum Error Correction Threshold: The Eastin-Knill Theorem", "concept_domain": "Novelty", "research_mode": "team", "quality": "partial", "quality_score": 0.42589131144393244, "catalog_references": [], "prompt_length": 6385, "files_placed": 0, "status": "discard"}
{"timestamp": 1781121790.3546736, "experiment_id": "c9963744", "concept_title": "Close Proofs: ML Generalization Bounds: Rademacher Complexity of Neural Networks", "concept_domain": "Applications", "research_mode": "team", "quality": "partial", "quality_score": 0.4258971662448692, "catalog_references": [], "prompt_length": 6905, "files_placed": 0, "status": "discard"}
{"timestamp": 1781121842.2139971, "experiment_id": "525efab1", "concept_title": "Entropy-Bounded Computation framework from a cold start as", "concept_domain": "Applications", "research_mode": "team", "quality": "partial", "quality_score": 0.4186049841106417, "catalog_references": [], "prompt_length": 33129, "files_placed": 0, "status": "discard"}
{"timestamp": 1781121867.6293776, "experiment_id": "cfcb9cb6", "concept_title": "Close Proofs: Close Proofs: Vaught's Conjecture", "concept_domain": "Applications", "research_mode": "team", "quality": "partial", "quality_score": 0.3586020499459617, "catalog_references": [], "prompt_length": 6352, "files_placed": 0, "status": "discard"}
{"timestamp": 1781121897.5898376, "experiment_id": "cc78e8bc", "concept_title": "Close Proofs: This cycle deepened the set-local Hausdorff-dimension distortion theor", "concept_domain": "Novelty", "research_mode": "team", "quality": "partial", "quality_score": 0.388758201915289, "catalog_references": [], "prompt_length": 6881, "files_placed": 0, "status": "discard"}
{"timestamp": 1781121919.8866596, "experiment_id": "4583bab4", "concept_title": "Proof-Net Curvature and Phase Transitions in Automated Theorem Search", "concept_domain": "Tropical", "research_mode": "team", "quality": "partial", "quality_score": 0.44448714179738874, "catalog_references": [], "prompt_length": 8760, "files_placed": 0, "status": "discard"}
{"timestamp": 1781124066.9051192, "experiment_id": "4ee497a4", "concept_title": "Close Proofs: Formalized framework connecting Collatz dynami", "concept_domain": "Novelty", "research_mode": "team", "quality": "partial", "quality_score": 0.4355796948696299, "catalog_references": [], "prompt_length": 16938, "files_placed": 24, "status": "discard"}
