{"timestamp": 1783166030.633062, "experiment_id": "c2b51bcc", "concept_title": "Close Proofs: Phantom Topologies: Spaces That Change When You Look at Them", "concept_domain": "Applications", "research_mode": "sorry_fill", "quality": "partial", "quality_score": 0.4724886610169492, "catalog_references": ["Novelty/Basic.lean", "Applications/IntegratedInformation/Definitions.lean"], "prompt_length": 23127, "files_placed": 9, "status": "discard"}
{"timestamp": 1783166298.1621811, "experiment_id": "0f872c04", "concept_title": "Monotonicity of the minimal absolute value of sums of fifth roots of unity within each residue class modulo 5", "concept_domain": "Novelty", "research_mode": "formalize", "quality": "partial", "quality_score": 0.62536, "catalog_references": ["Catalog/FINAL/Novelty/FifthRootSumMinimal.lean", "Catalog/FINAL/Probability/FermatLittleFive.lean"], "prompt_length": 22903, "files_placed": 11, "status": "keep"}
{"timestamp": 1783172952.4032252, "experiment_id": "c63aa9e3", "concept_title": "Eventual congruence of mis\u00e8re P\u2011positions in nuclear escalation ladders", "concept_domain": "Novelty", "research_mode": "team", "quality": "partial", "quality_score": 0.6148, "catalog_references": ["kahn1965", "guysmith1956", "sprague1935", "grundy1939", "conway1976", "schelling1960", "schelling1966", "impartial_combinatorial_games_nuclear_escalation_2023"], "prompt_length": 23298, "files_placed": 6, "status": "keep"}
{"timestamp": 1783176033.5187042, "experiment_id": "ee6f49cd", "concept_title": "Classification of Discrete d-Pseudomanifolds with 2d+7 Vertices", "concept_domain": "Applications", "research_mode": "team", "quality": "substantial", "quality_score": 0.7998400000000001, "catalog_references": ["arXiv:2405.XXXXX"], "prompt_length": 23063, "files_placed": 7, "status": "keep"}
{"timestamp": 1783178061.809479, "experiment_id": "244691c2", "concept_title": "Scheme-theoretic stabilizer of regular unipotent conjugacy classes under the center of the simply connected cover", "concept_domain": "Applications", "research_mode": "team", "quality": "substantial", "quality_score": 0.8009580000000001, "catalog_references": ["Steinberg's description of $\\pi_0(Z_{G'}(g))$ for semisimple $g$", "Cotner-Springer example on non-smooth centralizers in $\\mathrm{PGL}_2$", "Universal covers and fundamental groups in algebraic groups"], "prompt_length": 23296, "files_placed": 7, "status": "keep"}
{"timestamp": 1783178382.6183043, "experiment_id": "242f16a7", "concept_title": "Sufficiency of obvious necessary conditions for the generalized honeymoon Oberwolfach problem with multiple round tables", "concept_domain": "Novelty", "research_mode": "prove", "quality": "substantial", "quality_score": 0.79104, "catalog_references": ["FINAL/GraphTheory/RegularGraph.lean", "FINAL/GraphTheory/Cycle.lean", "FINAL/GraphTheory/GraphFactor.lean", "FINAL/Combinatorics/Design.lean"], "prompt_length": 23165, "files_placed": 6, "status": "keep"}
{"timestamp": 1783181657.5666277, "experiment_id": "605be963", "concept_title": "The Anti-Fibonacci Sequence: Numbers That Avoid the Golden Ratio at All Costs", "concept_domain": "Novelty", "research_mode": "team", "quality": "partial", "quality_score": 0.6772, "catalog_references": [], "prompt_length": 23736, "files_placed": 7, "status": "keep"}
{"timestamp": 1783181918.8646622, "experiment_id": "4bc47ce8", "concept_title": "Escher Staircases in Algebra: Infinite Ascending Chains That Loop Back", "concept_domain": "Applications", "research_mode": "team", "quality": "partial", "quality_score": 0.69479, "catalog_references": [], "prompt_length": 24043, "files_placed": 6, "status": "keep"}
{"timestamp": 1783188471.5087414, "experiment_id": "bb909d34", "concept_title": "Anabelomorphic Equivalence", "concept_domain": "Applications", "research_mode": "team", "quality": "substantial", "quality_score": 0.8344800000000001, "catalog_references": ["Fargues and Scholze 2024", "Joshi 2020a"], "prompt_length": 22802, "files_placed": 8, "status": "keep"}
{"timestamp": 1783191477.6231713, "experiment_id": "829d5920", "concept_title": "Characterization of Bipartite Partial Duals of Orientable Hypermaps", "concept_domain": "Applications", "research_mode": "team", "quality": "partial", "quality_score": 0.6395200000000001, "catalog_references": ["math.CO", "ribbon graphs", "partial duality"], "prompt_length": 23025, "files_placed": 8, "status": "keep"}
{"timestamp": 1783202842.1423347, "experiment_id": "0a41cc78", "concept_title": "Explicit Formula for 2-adic Valuation of Shifted Perrin Numbers", "concept_domain": "Novelty", "research_mode": "team", "quality": "substantial", "quality_score": 0.7258007692307691, "catalog_references": ["11B39", "11D88"], "prompt_length": 23285, "files_placed": 6, "status": "keep"}
{"timestamp": 1783203550.2100875, "experiment_id": "054477b4", "concept_title": "Non\u2011existence of non\u2011constant colorings satisfying the blend condition on finite strongly connected edge\u2011weighted digraphs", "concept_domain": "Novelty", "research_mode": "team", "quality": "partial", "quality_score": 0.4514887166666668, "catalog_references": ["arXiv:2305.12345 [math.CO]"], "prompt_length": 23055, "files_placed": 7, "status": "discard"}
{"timestamp": 1783203953.484239, "experiment_id": "bdd384c4", "concept_title": "Phantom Topologies: Spaces That Change When You Look at Them", "concept_domain": "Novelty", "research_mode": "team", "quality": "substantial", "quality_score": 0.83176, "catalog_references": [], "prompt_length": 23975, "files_placed": 7, "status": "keep"}
{"timestamp": 1783284085.947066, "experiment_id": "a7402c18", "concept_title": "Seymour's second neighborhood conjecture for oriented graphs", "concept_domain": "Probability", "research_mode": "team", "quality": "partial", "quality_score": 0.6096, "catalog_references": ["DeanLatka1995", "Fisher1996", "HavetThomasse2000", "AiGerkeGutinWangYeoZhou2024", "BrantnerBrockmanKaySnively2009", "CohnGodboleHarknessZhang2016", "DaraFrancisJacobNarayanan2022", "EspunyDiazGiraoGranetKronenberg2024"], "prompt_length": 22893, "files_placed": 7, "status": "keep"}
{"timestamp": 1783285959.349592, "experiment_id": "1da6d023", "concept_title": "Exact 2-adic valuation of coefficients of T(x)^m for m \u2261 1 mod 4", "concept_domain": "MachineLearning", "research_mode": "team", "quality": "partial", "quality_score": 0.5940000000000001, "catalog_references": ["math.CO"], "prompt_length": 23000, "files_placed": 8, "status": "keep"}
{"timestamp": 1783287221.6389031, "experiment_id": "2e937390", "concept_title": "Young Conjugation Induces a Measure-Preserving Involution on the Natural Extension of the Triangle Map", "concept_domain": "Novelty", "research_mode": "team", "quality": "partial", "quality_score": 0.5295662942477877, "catalog_references": ["Arnold's KAM theorem and invariant structures", "Khinchin's work on continued fractions", "Young's tower construction in ergodic theory", "Veech's measurements and exchange transformations"], "prompt_length": 23433, "files_placed": 8, "status": "keep"}
{"timestamp": 1783287339.3366995, "experiment_id": "59aff0ea", "concept_title": "Sign Alternation in q-Hypergeometric Series via Oscillatory Asymptotics Near Roots of Unity", "concept_domain": "Applications", "research_mode": "team", "quality": "substantial", "quality_score": 0.8076800000000002, "catalog_references": ["Andrews' Ramanujan's Lost Notebook", "Folsom-Males-Rolen-Storzer on v1(q)", "Zwegers' mock modular forms", "Zagier's quantum modular forms"], "prompt_length": 22980, "files_placed": 7, "status": "keep"}
{"timestamp": 1783291690.8005304, "experiment_id": "d01d52df", "concept_title": "Conjecture on the Structure of Minimal Obstructions to Total Rainbow Forests", "concept_domain": "Novelty", "research_mode": "team", "quality": "partial", "quality_score": 0.642, "catalog_references": ["Ox2007", "GM2009", "Bro2021"], "prompt_length": 22918, "files_placed": 8, "status": "keep"}
{"timestamp": 1783301171.2930837, "experiment_id": "4591bde2", "concept_title": "Kernel\u2011cover characterisation of the weighted Davenport constant", "concept_domain": "Algebra", "research_mode": "team", "quality": "partial", "quality_score": 0.5155438642611684, "catalog_references": ["G. Wang, Comm. Algebra 2025"], "prompt_length": 22990, "files_placed": 7, "status": "keep"}
{"timestamp": 1783303378.4156458, "experiment_id": "e545fdf8", "concept_title": "Joint descendants of the last k vertices in random d-DAGs", "concept_domain": "Combinatorics", "research_mode": "sorry_fill", "quality": "partial", "quality_score": 0.3599485585714286, "catalog_references": ["Catalog/Applications/RainbowTriangle/Defs.lean", "Catalog/Applications/RainbowTriangle/ColorClass.lean", "Catalog/FINAL/Combinatorics/Proper.lean"], "prompt_length": 21817, "files_placed": 6, "status": "discard"}
{"timestamp": 1783307127.343497, "experiment_id": "e29ffbac", "concept_title": "Classification of regular 4\u2011maniplexes via tetravalent graph censuses", "concept_domain": "Tropical", "research_mode": "sorry_fill", "quality": "partial", "quality_score": 0.3793292235294118, "catalog_references": [], "prompt_length": 18240, "files_placed": 6, "status": "discard"}
{"timestamp": 1783316446.7683156, "experiment_id": "e92fe2c1", "concept_title": "Formalized Rogers\u2013Ramanujan identities for q-Pochhammer symbols", "concept_domain": "Shared", "research_mode": "team", "quality": "partial", "quality_score": 0.46650342687540775, "catalog_references": ["Andrews1974", "Rogers1958", "GasperRahman1990"], "prompt_length": 23239, "files_placed": 6, "status": "discard"}
{"timestamp": 1783324250.203682, "experiment_id": "1e8c0c26", "concept_title": "Tightness of Edge Deletion Bound in Hyperstability Extension of Erd\u0151s-Gallai Theorem", "concept_domain": "Novelty", "research_mode": "prove", "quality": "partial", "quality_score": 0.420858, "catalog_references": ["Mathlib.Combinatorics.SimpleGraph.VertexCover", "Mathlib.Combinatorics.SimpleGraph.Connectivity", "Mathlib.Combinatorics.SimpleGraph.Bipartite", "Mathlib.Combinatorics.SimpleGraph.Basic", "Mathlib.Data.Fintype.Basic"], "prompt_length": 20221, "files_placed": 6, "status": "discard"}
{"timestamp": 1783329239.4831312, "experiment_id": "24d6d8b7", "concept_title": "Discrete homotopy groups of quasisymmetric cubical sets", "concept_domain": "Novelty", "research_mode": "team", "quality": "partial", "quality_score": 0.511, "catalog_references": ["Babson et al. (2013), Atkins & Gwilliam", "Carranza & Kapulkin (2008)"], "prompt_length": 23081, "files_placed": 7, "status": "keep"}
{"timestamp": 1783330946.290687, "experiment_id": "e50512ae", "concept_title": "Optimality of the polynomial factor in the Naslund\u2013Sawin bound for sunflower\u2011free families", "concept_domain": "Applications", "research_mode": "sorry_fill", "quality": "substantial", "quality_score": 0.74264, "catalog_references": ["Algebra/ErdosRenyi/Threshold.lean", "Algebra/HypercubeRegularity.lean"], "prompt_length": 22999, "files_placed": 6, "status": "keep"}
{"timestamp": 1783335875.9154303, "experiment_id": "2058237b", "concept_title": "Characterization of the Aharoni-Korman Conjecture via Saturated Chains", "concept_domain": "Logic", "research_mode": "sorry_fill", "quality": "partial", "quality_score": 0.49753964866339334, "catalog_references": ["Logic/AharoniKorman/CoWellFounded.lean"], "prompt_length": 22946, "files_placed": 6, "status": "discard"}
{"timestamp": 1783338804.2182944, "experiment_id": "a793b4d3", "concept_title": "Chain Covers in the Boolean Lattice", "concept_domain": "Cryptography", "research_mode": "sorry_fill", "quality": "partial", "quality_score": 0.5242404210526316, "catalog_references": ["Mathlib.Order.Antichain", "Mathlib.Order.Chain", "Mathlib.Data.Finset.Basic", "Mathlib.Data.Finset.Card", "Mathlib.Combinatorics.Enumerative.Choose"], "prompt_length": 18851, "files_placed": 6, "status": "keep"}
{"timestamp": 1783345963.4737153, "experiment_id": "70354b52", "concept_title": "Monotonicity and Jumps of Minimal Absolute Values of Fifth Roots of Unity Sums", "concept_domain": "Computation", "research_mode": "team", "quality": "partial", "quality_score": 0.63344, "catalog_references": ["math.NT", "math.CO"], "prompt_length": 23104, "files_placed": 7, "status": "keep"}
{"timestamp": 1783348118.680931, "experiment_id": "ecf65bf0", "concept_title": "Explicit Quantitative Lower Bound on Power-Saving for Monic Minkowski Polynomials", "concept_domain": "Geometry", "research_mode": "team", "quality": "partial", "quality_score": 0.6173599999999999, "catalog_references": ["BloomSawinSchildkrautZhelezov2026", "RocheNewtonRuzsaShenShkredov2019"], "prompt_length": 22989, "files_placed": 8, "status": "keep"}
{"timestamp": 1783351767.7449493, "experiment_id": "048b9775", "concept_title": "Vanishing of the Benson--Krause--Schwede canonical class for pro-2 Demushkin groups", "concept_domain": "Computation", "research_mode": "team", "quality": "substantial", "quality_score": 0.7059866666666667, "catalog_references": ["arXiv:2305.12345"], "prompt_length": 23036, "files_placed": 4, "status": "keep"}
{"timestamp": 1783363064.151628, "experiment_id": "c1fb9afb", "concept_title": "Joint descendants of the last k vertices in random d-DAGs", "concept_domain": "NumberTheory", "research_mode": "formalize", "quality": "partial", "quality_score": 0.45366952380952386, "catalog_references": ["Catalog/FINAL/Analysis/SpecialFunctions/Gamma.lean"], "prompt_length": 18616, "files_placed": 5, "status": "discard"}
{"timestamp": 1783366317.3812065, "experiment_id": "c7c6cf29", "concept_title": "Real-rootedness of the square of the Eulerian triangle", "concept_domain": "NumberTheory", "research_mode": "formalize", "quality": "partial", "quality_score": 0.43457572380952386, "catalog_references": [], "prompt_length": 18808, "files_placed": 4, "status": "discard"}
{"timestamp": 1783367456.439199, "experiment_id": "935491ef", "concept_title": "Minimal dimension of non-\u03b3-positive symmetric edge polytopes", "concept_domain": "Probability", "research_mode": "team", "quality": "substantial", "quality_score": 0.70296, "catalog_references": ["ohsugi-tsuchiya-conj", "higashitani-jochemko-michalek", "gal", "branden-gamma"], "prompt_length": 22964, "files_placed": 4, "status": "keep"}
{"timestamp": 1783388927.9137373, "experiment_id": "92285bf9", "concept_title": "Sharp Threshold Constant for Cycle Games", "concept_domain": "Combinatorics", "research_mode": "team", "quality": "partial", "quality_score": 0.57296, "catalog_references": ["Chv\u00e1tal and Erd\u0151s (1978) - Triangle game threshold", "Bednarska and \u0141uczak (2000) - Asymptotics of threshold bias", "Glazik and Srivastav (2022) - Improved Breaker strategy for C_3", "Spencer (2019) - Potential method conjecture"], "prompt_length": 23018, "files_placed": 4, "status": "keep"}
{"timestamp": 1783394233.119623, "experiment_id": "4231f6a2", "concept_title": "Characterization of Extremal Graphs for Positive Lin--Lu--Yau Curvature", "concept_domain": "Novelty", "research_mode": "team", "quality": "partial", "quality_score": 0.50904, "catalog_references": ["math.CO 05C35 - Extremal problems for graphs", "math.CO 05C05 - Graph connectivity", "math.DG 53C21 - Curves and surfaces in Riemannian manifolds", "math.PR 60B12 - Discrete groups and ergodic theory"], "prompt_length": 23372, "files_placed": 4, "status": "keep"}
{"timestamp": 1783400672.7121606, "experiment_id": "eb8019d8", "concept_title": "Existence of Optimal Equidistant Codes for n \u2261 2 mod 4 with Unidentified Subcase Structure", "concept_domain": "Novelty", "research_mode": "team", "quality": "partial", "quality_score": 0.49735784528301885, "catalog_references": ["MB", "IS95", "vanLint84"], "prompt_length": 23033, "files_placed": 4, "status": "discard"}
{"timestamp": 1783404943.3561862, "experiment_id": "5156da6e", "concept_title": "The Aharoni-Korman Conjecture for Well-Founded FAC Posets", "concept_domain": "Probability", "research_mode": "formalize", "quality": "partial", "quality_score": 0.5183991264367817, "catalog_references": ["Mathlib.Order.WellFounded", "Mathlib.Order.Antichain", "Mathlib.Order.Chain", "Mathlib.Data.Fintype.Basic", "Mathlib.Data.Set.Finite", "Mathlib.Order.Ordinal.Basic"], "prompt_length": 23329, "files_placed": 4, "status": "keep"}
{"timestamp": 1783424128.3218846, "experiment_id": "3b621fb7", "concept_title": "Conjecture: Balanced graphs coincide with hereditary clique\u2011Helly graphs", "concept_domain": "MachineLearning", "research_mode": "formalize", "quality": "partial", "quality_score": 0.39727681, "catalog_references": [], "prompt_length": 22576, "files_placed": 4, "status": "discard"}
{"timestamp": 1783443679.033434, "experiment_id": "236b0246", "concept_title": "Infinite Log-Concavity of Total d-Hoggatt Numbers", "concept_domain": "Tropical", "research_mode": "prove", "quality": "partial", "quality_score": 0.4996542252252253, "catalog_references": ["Catalog/FINAL/HoggattLogConcavity.lean"], "prompt_length": 20331, "files_placed": 5, "status": "discard"}
{"timestamp": 1783462209.1344266, "experiment_id": "ea22db3c", "concept_title": "The opposite-semicube Helly property characterizes harmonic-evenness in Cartesian products of partial cubes", "concept_domain": "Bridges", "research_mode": "sorry_fill", "quality": "partial", "quality_score": 0.40624133333333334, "catalog_references": [], "prompt_length": 18197, "files_placed": 4, "status": "discard"}
{"timestamp": 1783478066.9088583, "experiment_id": "44d92b62", "concept_title": "Impossibility Results for Fun: Things That Cannot Be Done (But We Try Anyway)", "concept_domain": "Cryptography", "research_mode": "team", "quality": "partial", "quality_score": 0.43460760000000004, "catalog_references": [], "prompt_length": 23653, "files_placed": 4, "status": "discard"}
{"timestamp": 1783478150.0281134, "experiment_id": "4aec9d8b", "concept_title": "Antipodality Characterization via Opposite-Semicube Helly Property", "concept_domain": "Bridges", "research_mode": "sorry_fill", "quality": "partial", "quality_score": 0.542, "catalog_references": [], "prompt_length": 22880, "files_placed": 4, "status": "keep"}
{"timestamp": 1783478252.701808, "experiment_id": "55b8bae9", "concept_title": "Gir\u00e3o-Kittipassorn-Narayanan Conjecture on Long Nontrivial Cycles", "concept_domain": "Physics", "research_mode": "formalize", "quality": "partial", "quality_score": 0.69272, "catalog_references": ["Catalog/Math/GraphTheory/LongNontrivialCycles.lean", "Catalog/Math/GraphTheory/BasicDefinitions.lean", "Catalog/Math/GraphTheory/HamiltonianCycles.lean"], "prompt_length": 23053, "files_placed": 4, "status": "keep"}
{"timestamp": 1783488956.862611, "experiment_id": "d9ca63e8", "concept_title": "Tropical Cryptocurrency: Mining on the Min-Plus Semiring", "concept_domain": "Pythagorean", "research_mode": "sorry_fill", "quality": "partial", "quality_score": 0.4666111, "catalog_references": ["Tropical/MinPlusAlgebra.lean", "Catalog/FINAL/Tropical/*.lean"], "prompt_length": 19164, "files_placed": 4, "status": "discard"}
{"timestamp": 1783530036.6716409, "experiment_id": "02608f80", "concept_title": "The Unreasonable Effectiveness of the Number 163", "concept_domain": "MachineLearning", "research_mode": "team", "quality": "partial", "quality_score": 0.18028799999999998, "catalog_references": [], "prompt_length": 11537, "files_placed": 2, "status": "discard"}
{"timestamp": 1783531008.1449444, "experiment_id": "d82d98aa", "concept_title": "Matsuno-type Formula for Supersingular Iwasawa Lambda-Invariants", "concept_domain": "Geometry", "research_mode": "team", "quality": "partial", "quality_score": 0.20087999999999998, "catalog_references": ["math.NT", "Iwasawa theory", "Elliptic curves", "p-adic L-functions"], "prompt_length": 22013, "files_placed": 1, "status": "discard"}
{"timestamp": 1783532602.4823987, "experiment_id": "396b76ab", "concept_title": "Surreal Topology: What Topology Does the Field of Surreal Numbers Have?", "concept_domain": "Geometry", "research_mode": "team", "quality": "partial", "quality_score": 0.214224, "catalog_references": [], "prompt_length": 22692, "files_placed": 1, "status": "discard"}
{"timestamp": 1783534271.5118978, "experiment_id": "cbe7147b", "concept_title": "Arithmetic on the Moebius Band: A Number System with a Twist", "concept_domain": "Algebra", "research_mode": "counterexample", "quality": "partial", "quality_score": 0.5326040000000001, "catalog_references": ["Algebra/MoebiusArithmetic.lean"], "prompt_length": 22186, "files_placed": 1, "status": "keep"}
{"timestamp": 1783539791.2145543, "experiment_id": "8dce6893", "concept_title": "Chaos as a Computable Shadow: The Shadowing Lemma for Real Programs", "concept_domain": "Computation", "research_mode": "team", "quality": "partial", "quality_score": 0.217608, "catalog_references": [], "prompt_length": 4590, "files_placed": 3, "status": "discard"}
{"timestamp": 1783542986.0368729, "experiment_id": "06c3f92b", "concept_title": "The Monster Group's Secret Message: Moonshine Beyond the j-Function", "concept_domain": "Tropical", "research_mode": "formalize", "quality": "partial", "quality_score": 0.224808, "catalog_references": ["Catalog/FINAL/Tropical/ModularForms.lean", "Catalog/FINAL/Arithmetic/LocalFields.lean", "Catalog/FINAL/Tropical/ModularSymbols.lean"], "prompt_length": 629, "files_placed": 3, "status": "discard"}
{"timestamp": 1783547893.9632056, "experiment_id": "492f9d48", "concept_title": "Impossible Geometries: Where Parallel Lines Converge AND Diverge", "concept_domain": "Algebra", "research_mode": "team", "quality": "partial", "quality_score": 0.160512, "catalog_references": [], "prompt_length": 23797, "files_placed": 3, "status": "discard"}
