{"timestamp": 1788257334.1434968, "experiment_id": "00fe96df", "concept_title": "NET-84: TAIL-AWARE-MIXED-PRECISION-WORKS — keeping L22/L23 at fp32 gains +1.8pts over full 4-bit GPTQ; three evidence lines converge on tail-as-one-unit prescription", "concept_domain": "Computation", "research_mode": "team", "quality": "substantial", "quality_score": 0.82, "catalog_references": [], "prompt_length": 27353, "files_placed": 5, "status": "keep"}
{"timestamp": 1788274509.4712958, "experiment_id": "3c91f334", "concept_title": "Each conjecture below is stated so that it can be *falsified* by a single Lean\ncounterexample.", "concept_domain": "Novelty", "research_mode": "team", "quality": "substantial", "quality_score": 0.84, "catalog_references": [], "prompt_length": 25944, "files_placed": 4, "status": "keep"}
{"timestamp": 1788287542.9927936, "experiment_id": "b96d5582", "concept_title": "FACT round-91 #2 — CONSECUTIVE-V-DEPENDENCY (exp 599): H0_PURE_DENSITY — mid-window hits INDEPENDENT given position — lag profile lags 1–20 flat/slightly negative ρ ∈ [−0.020, −0.002] vs 0.05 bar (MC p 0.128–0.969), runs null both readings (Z +0.85 textbook / +0.89 density-calibrated vs 3.29), POWER CONFIRMED (injected lag-1 ρ_det = 0.337 detected at argmax exactly lag 1) — u* ≈ 0.65 excess = PURE DENSITY / rate heterogeneity, NO sequence structure — POSITIONAL THREAD CLOSES COMPLETELY (228–230 → 231 → 238/240 → 241–242 → 248)", "concept_domain": "Bridges", "research_mode": "team", "quality": "substantial", "quality_score": 0.86, "catalog_references": [], "prompt_length": 29557, "files_placed": 4, "status": "keep"}
{"timestamp": 1788287561.5307398, "experiment_id": "f5ddf1b2", "concept_title": "The dichotomy, the local homeomorphism property and the semicontinuity", "concept_domain": "Tropical", "research_mode": "team", "quality": "partial", "quality_score": 0.6729149999999999, "catalog_references": [], "prompt_length": 22750, "files_placed": 4, "status": "keep"}
{"timestamp": 1788287574.842341, "experiment_id": "b20378a3", "concept_title": "FACT round-61 #2 — TDIAL-U56B: fresh-seed replication confirms validity but edge not established (paper 187)", "concept_domain": "MachineLearning", "research_mode": "team", "quality": "substantial", "quality_score": 0.84, "catalog_references": [], "prompt_length": 26384, "files_placed": 4, "status": "keep"}
{"timestamp": 1788287592.1207616, "experiment_id": "eb1faf15", "concept_title": "FACT round-67 #2 — TDIAL-U100: the dial begins to fade at bitlen 100 (paper 188)", "concept_domain": "Novelty", "research_mode": "team", "quality": "substantial", "quality_score": 0.84, "catalog_references": [], "prompt_length": 26484, "files_placed": 4, "status": "keep"}
{"timestamp": 1788287610.1485958, "experiment_id": "6d23453a", "concept_title": "FACT round-67 #1 — TDIAL-U84-CROSS: approaching but not yet crossed (paper 188)", "concept_domain": "Novelty", "research_mode": "team", "quality": "substantial", "quality_score": 0.79, "catalog_references": [], "prompt_length": 26314, "files_placed": 4, "status": "keep"}
{"timestamp": 1788287626.1193173, "experiment_id": "b4f872e1", "concept_title": "NET-75: THE-FRENCH-KNEE-IS-FORTY — extended grid pins k*(fr@1024)=40, exactly double English prose's 20; tokenizer-tax is a domain-dependent multiplier", "concept_domain": "Physics", "research_mode": "team", "quality": "substantial", "quality_score": 0.78, "catalog_references": [], "prompt_length": 27278, "files_placed": 5, "status": "keep"}
{"timestamp": 1788299309.851302, "experiment_id": "f7361634", "concept_title": "Margin Scarcity as the Portability Predictor", "concept_domain": "Applications", "research_mode": "team", "quality": "substantial", "quality_score": 0.78, "catalog_references": ["Catalog.Probability.TailTransplantCost", "Catalog.Novelty.KVDecisionDissociation"], "prompt_length": 26581, "files_placed": 4, "status": "keep"}
{"timestamp": 1788308165.7068305, "experiment_id": "f3ffa89b", "concept_title": "FACT round-66 #1 — TDIAL-U80: the dial lands on the floor at bitlen 80 (paper 187)", "concept_domain": "Applications", "research_mode": "team", "quality": "substantial", "quality_score": 0.82, "catalog_references": [], "prompt_length": 26511, "files_placed": 4, "status": "keep"}
{"timestamp": 1788308185.8900018, "experiment_id": "d4f58bc3", "concept_title": "NET-83: THE-INTEGRATION-IS-SUPER-ADDITIVE — GPTQ4+top-k degrades WORSE than sum of parts (14.0% vs expected 11.5%); sparse attention amplifies quantization noise", "concept_domain": "Applications", "research_mode": "team", "quality": "substantial", "quality_score": 0.86, "catalog_references": [], "prompt_length": 27513, "files_placed": 4, "status": "keep"}
{"timestamp": 1788308206.6499991, "experiment_id": "108711a9", "concept_title": "FACT round-55 #2 — D12-SEMIPRIME: the degree-12 semiprime pair channel matches law (paper 183)", "concept_domain": "Combinatorics", "research_mode": "team", "quality": "substantial", "quality_score": 0.82, "catalog_references": [], "prompt_length": 26360, "files_placed": 4, "status": "keep"}
{"timestamp": 1788308226.1009336, "experiment_id": "384c4d0f", "concept_title": "NET-66: SCALE-DELAYS-CONTEXT-SENSITIVITY-BY-ONE-DOUBLING — 1.5B chain breaks at 2048 ({16,16,20}); broken curve equals the 0.5B shifted one octave (1.5B@2048 = 0.5B@1024 = 20)", "concept_domain": "Combinatorics", "research_mode": "team", "quality": "substantial", "quality_score": 0.84, "catalog_references": [], "prompt_length": 27547, "files_placed": 4, "status": "keep"}
{"timestamp": 1788323968.9430964, "experiment_id": "79285565", "concept_title": "Pole-order obstruction", "concept_domain": "Shared", "research_mode": "team", "quality": "substantial", "quality_score": 0.87, "catalog_references": [], "prompt_length": 25999, "files_placed": 4, "status": "keep"}
{"timestamp": 1788341938.5280547, "experiment_id": "4d41e431", "concept_title": "The degrees `1, 2, 3` are already proved this way (`degree_one_exact`,", "concept_domain": "Bridges", "research_mode": "team", "quality": "substantial", "quality_score": 0.89, "catalog_references": [], "prompt_length": 26185, "files_placed": 4, "status": "keep"}
{"timestamp": 1788341955.6214566, "experiment_id": "a75b3939", "concept_title": "NET-59: NO-SINGLE-LAYER-IS-THE-BOTTLENECK — solo-layer top-k profiles are flat (all 24 layers within 0.6pts at k=16, tail L23 literally best); the tail's specialness is epistatic, not individual fragility", "concept_domain": "Probability", "research_mode": "team", "quality": "substantial", "quality_score": 0.88, "catalog_references": [], "prompt_length": 28060, "files_placed": 4, "status": "keep"}
{"timestamp": 1788341973.9955144, "experiment_id": "fe7714ae", "concept_title": "Spherical Cap Power Ceiling for Near-Threshold Correlation Tests", "concept_domain": "Physics", "research_mode": "team", "quality": "substantial", "quality_score": 0.84, "catalog_references": ["Catalog.Novelty.TDialU84ApproachNotCrossed", "Catalog.Algebra.ZeroFitDialU72Parity"], "prompt_length": 26771, "files_placed": 4, "status": "keep"}
{"timestamp": 1788341991.255827, "experiment_id": "0bdc483a", "concept_title": "NET-62: THE-KNEE-LANDS-ON-THE-FINE-GRID — 0.5B knee at ctx=1024 is k*=20 (fine grid), chain now strictly monotone {16,20,24}; size-invariance sharpens; 2048 corpus-B reading was a coarse-grid artifact", "concept_domain": "NumberTheory", "research_mode": "team", "quality": "substantial", "quality_score": 0.78, "catalog_references": [], "prompt_length": 27389, "files_placed": 4, "status": "keep"}
{"timestamp": 1788342010.2691164, "experiment_id": "53c2b4c2", "concept_title": "NET-74: TOP8-MASS-IS-THE-STRONGEST-STRUCTURAL-PREDICTOR — Spearman(top8-mass, k*) = +0.80 strongest of three measures; knee set by residual tail spread, not head concentration", "concept_domain": "Physics", "research_mode": "team", "quality": "substantial", "quality_score": 0.82, "catalog_references": [], "prompt_length": 27793, "files_placed": 4, "status": "keep"}
{"timestamp": 1788342029.4558098, "experiment_id": "54a9fda9", "concept_title": "FACT round-54 #1 — BALANCED-BKEY: the T-dial is robust across bitlen and u (paper 181)", "concept_domain": "Cryptography", "research_mode": "team", "quality": "substantial", "quality_score": 0.82, "catalog_references": [], "prompt_length": 26341, "files_placed": 4, "status": "keep"}
{"timestamp": 1788359473.2738311, "experiment_id": "aa167cd7", "concept_title": "Asymptotic comparison beyond coefficient extensionality", "concept_domain": "NumberTheory", "research_mode": "team", "quality": "substantial", "quality_score": 0.86, "catalog_references": [], "prompt_length": 26458, "files_placed": 4, "status": "keep"}
{"timestamp": 1788374649.5422904, "experiment_id": "240c61ef", "concept_title": "Adjoining the top member preserves a witness", "concept_domain": "Computation", "research_mode": "team", "quality": "substantial", "quality_score": 0.82, "catalog_references": [], "prompt_length": 26054, "files_placed": 4, "status": "keep"}
{"timestamp": 1788374667.106563, "experiment_id": "fe441855", "concept_title": "NET-58: CONTENT-IS-A-WEAK-PREDICTOR-OF-IMPORTANCE — linear probes recover only R2~0.33 of key future-attention; content-based eviction ~1pt over accumulation, 10pts below oracle; importance is relational, not intrinsic", "concept_domain": "Novelty", "research_mode": "team", "quality": "substantial", "quality_score": 0.82, "catalog_references": [], "prompt_length": 28000, "files_placed": 4, "status": "keep"}
{"timestamp": 1788374685.7127533, "experiment_id": "efbccac8", "concept_title": "NET-57: THE-KNEES-ARE-CORPUS-ROBUST — independent wikitext shard replicates the knees exactly ({16,32} at {512,1024}) with controls matching to four decimals; the ~30-key budget holds across 3 contexts x 2 corpora x 2 model sizes", "concept_domain": "Algebra", "research_mode": "team", "quality": "substantial", "quality_score": 0.82, "catalog_references": [], "prompt_length": 27729, "files_placed": 4, "status": "keep"}
{"timestamp": 1788374705.087015, "experiment_id": "f3a0d241", "concept_title": "NET-55: THE-KNEE-IS-SIZE-INVARIANT — Qwen2.5-1.5B posts k*={16,16} at ctx={512,1024}, identical-to-half the 0.5B knees; tripling parameters did not raise the lossless attention budget by one key", "concept_domain": "Pythagorean", "research_mode": "team", "quality": "substantial", "quality_score": 0.82, "catalog_references": [], "prompt_length": 28577, "files_placed": 4, "status": "keep"}
{"timestamp": 1788374724.631116, "experiment_id": "ee56ba3a", "concept_title": "NET-56: THE-ORACLE-OVERSTATES-THE-DEPLOYABLE-WIN — streaming heavy-hitter eviction retains 0.86-0.92 where the oracle posts 0.99+ at matched budgets; trained attention is prunable in retrospect, not predictable online", "concept_domain": "Novelty", "research_mode": "team", "quality": "substantial", "quality_score": 0.8, "catalog_references": [], "prompt_length": 28771, "files_placed": 5, "status": "keep"}
{"timestamp": 1788385855.5860438, "experiment_id": "5c95862a", "concept_title": "FACT round-51 #3 — T-DIAL-60-UNIF: the dial survives uniform draws at bitlen 60 (paper 184)", "concept_domain": "Pythagorean", "research_mode": "team", "quality": "substantial", "quality_score": 0.85, "catalog_references": [], "prompt_length": 26299, "files_placed": 5, "status": "keep"}
{"timestamp": 1788385871.7440853, "experiment_id": "c90a227e", "concept_title": "Generalize from permutations of distinct elements to multisets with repeated keys.", "concept_domain": "Novelty", "research_mode": "team", "quality": "substantial", "quality_score": 0.82, "catalog_references": [], "prompt_length": 26077, "files_placed": 5, "status": "keep"}
{"timestamp": 1788394641.7228901, "experiment_id": "c9885d74", "concept_title": "Reed–Solomon dimension and MDS equality", "concept_domain": "Physics", "research_mode": "team", "quality": "substantial", "quality_score": 0.83, "catalog_references": [], "prompt_length": 26015, "files_placed": 4, "status": "keep"}
{"timestamp": 1788394658.8242853, "experiment_id": "5f5fd816", "concept_title": "FACT round-50 — DEGREE-12-COMPOSITE: full pinning at the first composite-order abelian group (paper 180)", "concept_domain": "Pythagorean", "research_mode": "team", "quality": "substantial", "quality_score": 0.82, "catalog_references": [], "prompt_length": 26544, "files_placed": 5, "status": "keep"}
{"timestamp": 1788394677.0811505, "experiment_id": "a9de2f0b", "concept_title": "FACT round-55 #1 — BALANCED-BKEY: the T-dial's decline is gradual, not a cliff (paper 182 addendum)", "concept_domain": "Combinatorics", "research_mode": "team", "quality": "substantial", "quality_score": 0.78, "catalog_references": [], "prompt_length": 26403, "files_placed": 4, "status": "keep"}
{"timestamp": 1788394697.2101138, "experiment_id": "8c9b3d94", "concept_title": "FACT round-51 #1 — EXTENDED-DIAL: the prime-power feature does not replicate (paper 181)", "concept_domain": "Combinatorics", "research_mode": "team", "quality": "substantial", "quality_score": 0.82, "catalog_references": [], "prompt_length": 26535, "files_placed": 4, "status": "keep"}
{"timestamp": 1788410345.9617805, "experiment_id": "8ec45b40", "concept_title": "Bisimulation versus isomorphism as semantic resolution", "concept_domain": "NumberTheory", "research_mode": "team", "quality": "substantial", "quality_score": 0.85, "catalog_references": [], "prompt_length": 26490, "files_placed": 4, "status": "keep"}
{"timestamp": 1788410361.324777, "experiment_id": "42a2aa0b", "concept_title": "FACT round-50 — DEGREE-11: full pinning at Q(zeta_23)+ completes the ladder through degree 11 (paper 180 addendum)", "concept_domain": "Shared", "research_mode": "team", "quality": "substantial", "quality_score": 0.84, "catalog_references": [], "prompt_length": 26399, "files_placed": 4, "status": "keep"}
{"timestamp": 1788429110.140997, "experiment_id": "88e58a70", "concept_title": "FACT round-52 #1 — T-DIAL-UNIF-48: the zero-fit dial holds on uniform draws at bitlen 48 (paper 182)", "concept_domain": "Cryptography", "research_mode": "team", "quality": "substantial", "quality_score": 0.78, "catalog_references": [], "prompt_length": 26464, "files_placed": 5, "status": "keep"}
{"timestamp": 1788429129.4618297, "experiment_id": "98caf022", "concept_title": "Real-Parameter Scale Flow on Knee Chains", "concept_domain": "Tropical", "research_mode": "team", "quality": "substantial", "quality_score": 0.82, "catalog_references": ["Combinatorics.OctaveShiftLaw", "Combinatorics.OctaveShiftStability"], "prompt_length": 26571, "files_placed": 4, "status": "keep"}
{"timestamp": 1788429146.7987359, "experiment_id": "14592ce7", "concept_title": "FACT round-49 #2 — T-DIAL-60: the degradation plateaus (paper 179)", "concept_domain": "Combinatorics", "research_mode": "team", "quality": "substantial", "quality_score": 0.82, "catalog_references": [], "prompt_length": 26493, "files_placed": 4, "status": "keep"}
{"timestamp": 1788429166.9639778, "experiment_id": "025e0adb", "concept_title": "FACT round-49 #1 — T-DIAL-56: the bitlen-stability has a practical floor (paper 178)", "concept_domain": "Shared", "research_mode": "team", "quality": "substantial", "quality_score": 0.82, "catalog_references": [], "prompt_length": 26417, "files_placed": 4, "status": "keep"}
{"timestamp": 1788446180.4391317, "experiment_id": "24e44638", "concept_title": "Uniqueness of the Two-Point Transreal Compactification", "concept_domain": "Novelty", "research_mode": "team", "quality": "substantial", "quality_score": 0.86, "catalog_references": ["Cryptography.Transreal.Topology", "Cryptography.Transreal.Core"], "prompt_length": 26737, "files_placed": 4, "status": "keep"}
{"timestamp": 1788460815.605897, "experiment_id": "ed88da41", "concept_title": "FACT round-48 #2 — T-DIAL-UNIF-HB: the dial holds at the regime × bitlen intersection (paper 177)", "concept_domain": "Bridges", "research_mode": "team", "quality": "substantial", "quality_score": 0.88, "catalog_references": [], "prompt_length": 26512, "files_placed": 38, "status": "keep"}
{"timestamp": 1788460836.081668, "experiment_id": "d00ca27a", "concept_title": "Sturmian Structure of the Argmax Staircase", "concept_domain": "MachineLearning", "research_mode": "team", "quality": "substantial", "quality_score": 0.86, "catalog_references": ["Shared.UnimodalArgmaxBinomial"], "prompt_length": 26684, "files_placed": 5, "status": "keep"}
{"timestamp": 1788460853.8347204, "experiment_id": "8aeaf6ab", "concept_title": "FACT round-47 #1 — T-DIAL-BITLEN: the zero-fit dial is bitlen-stable (paper 175)", "concept_domain": "Pythagorean", "research_mode": "team", "quality": "substantial", "quality_score": 0.78, "catalog_references": [], "prompt_length": 26468, "files_placed": 5, "status": "keep"}
{"timestamp": 1788460874.2522824, "experiment_id": "776b8f2a", "concept_title": "FACT round-45 #3 — TIGHT-U-RECAL: reweighting cannot recover the tight-u drop (paper 170)", "concept_domain": "NumberTheory", "research_mode": "team", "quality": "substantial", "quality_score": 0.82, "catalog_references": [], "prompt_length": 26930, "files_placed": 10, "status": "keep"}
{"timestamp": 1788471841.3759527, "experiment_id": "0688a872", "concept_title": "FACT round-48 #1 — MA1-EFFECTIVE: equidistribution holds to three significant figures (paper 176)", "concept_domain": "Bridges", "research_mode": "team", "quality": "substantial", "quality_score": 0.84, "catalog_references": [], "prompt_length": 26514, "files_placed": 31, "status": "keep"}
{"timestamp": 1788471859.7455063, "experiment_id": "e2f91544", "concept_title": "General `O(N)` model", "concept_domain": "Physics", "research_mode": "team", "quality": "substantial", "quality_score": 0.78, "catalog_references": [], "prompt_length": 25915, "files_placed": 5, "status": "keep"}
{"timestamp": 1788480472.7231991, "experiment_id": "671d5841", "concept_title": "FACT round-46 #2 — PPOW-MULTISEED: the prime-power lift replicates across seeds and grows with window length (paper 173)", "concept_domain": "Probability", "research_mode": "team", "quality": "substantial", "quality_score": 0.86, "catalog_references": [], "prompt_length": 26500, "files_placed": 4, "status": "keep"}
{"timestamp": 1788480492.862417, "experiment_id": "60926357", "concept_title": "Conjecture C (sharper silent-error constant) — PROVED.*", "concept_domain": "MachineLearning", "research_mode": "team", "quality": "substantial", "quality_score": 0.85, "catalog_references": [], "prompt_length": 26410, "files_placed": 5, "status": "keep"}
{"timestamp": 1788480509.6298761, "experiment_id": "575f19d4", "concept_title": "FACT round-45 #2 — U-HARDEN: the u-sensitivity is mostly intrinsic, partly resolution (paper 168)", "concept_domain": "Logic", "research_mode": "team", "quality": "substantial", "quality_score": 0.78, "catalog_references": [], "prompt_length": 26809, "files_placed": 4, "status": "keep"}
{"timestamp": 1788496474.4778848, "experiment_id": "63061d5b", "concept_title": "FACT round-95 #4 — KAPPA-SUFFICIENCY-SCALE (exp 606): H1 AT ALL THREE SCALES — composition order κ replicates fresh + holds across bits {72,96,128} (Δ +0.087/+0.083/+0.059, perm_p 1/501 everywhere) with SCALE-STABLE NEGATIVE slope β≈−0.35 — but SUFFICIENCY BREAKS at 128 bits (cell identity adds beyond κ exactly where smoothness is rare) — graded law: log-rate ≈ dial − 0.35κ + identity terms switching on near u≈4.5", "concept_domain": "Novelty", "research_mode": "team", "quality": "substantial", "quality_score": 0.84, "catalog_references": [], "prompt_length": 29258, "files_placed": 6, "status": "keep"}
{"timestamp": 1788496491.3506887, "experiment_id": "3831c02e", "concept_title": "FACT round-45 #1 — U35-LOCALIZED: above the floor everywhere, degrades everywhere (paper 167)", "concept_domain": "Novelty", "research_mode": "team", "quality": "substantial", "quality_score": 0.78, "catalog_references": [], "prompt_length": 26751, "files_placed": 4, "status": "keep"}
{"timestamp": 1788496509.9488404, "experiment_id": "f5f0f634", "concept_title": "FACT round-46 #1 — MID-PRIME-HUNT: prime-power hits carry the tight-u residual (paper 172)", "concept_domain": "Applications", "research_mode": "team", "quality": "substantial", "quality_score": 0.82, "catalog_references": [], "prompt_length": 26612, "files_placed": 5, "status": "keep"}
{"timestamp": 1788514845.3790884, "experiment_id": "5109f84c", "concept_title": "FACT round-44 #2 — T-DIAL-AXES: regime holds, u breaks (paper 166)", "concept_domain": "Geometry", "research_mode": "team", "quality": "substantial", "quality_score": 0.82, "catalog_references": [], "prompt_length": 26699, "files_placed": 5, "status": "keep"}
{"timestamp": 1788546332.9696681, "experiment_id": "135e0dcb", "concept_title": "FACT round-43 #4 — QRLOTTO-DIAL: the zero-fit theory dial holds (paper 164)", "concept_domain": "Bridges", "research_mode": "team", "quality": "substantial", "quality_score": 0.86, "catalog_references": [], "prompt_length": 26899, "files_placed": 5, "status": "keep"}
{"timestamp": 1788546352.6453462, "experiment_id": "fbb2311e", "concept_title": "FACT round-43 #1 — TABLE-CLOSURE FULL: the exact asymptotic constants of the fork channels (paper 161)", "concept_domain": "Combinatorics", "research_mode": "team", "quality": "substantial", "quality_score": 0.72, "catalog_references": [], "prompt_length": 26693, "files_placed": 4, "status": "keep"}
{"timestamp": 1788546372.888016, "experiment_id": "5b4963ae", "concept_title": "Riemann Convergence of Bhattacharyya Angle Sums", "concept_domain": "Pythagorean", "research_mode": "team", "quality": "substantial", "quality_score": 0.86, "catalog_references": ["Catalog.Algebra.FisherRaoLength.Core"], "prompt_length": 26878, "files_placed": 4, "status": "keep"}
