{"timestamp": 1787475000.6737742, "experiment_id": "3eae19ad", "concept_title": "FACT round-61 #1 — TDIAL-U64: the zero-fit dial holds at bitlen 64 with count parity (paper 185)", "concept_domain": "Novelty", "research_mode": "team", "quality": "substantial", "quality_score": 0.85, "catalog_references": [], "prompt_length": 26533, "files_placed": 6, "status": "keep"}
{"timestamp": 1787478260.191725, "experiment_id": "0ef4aed2", "concept_title": "FACT round-65 #1 — TDIAL-U76: the zero-fit dial holds at bitlen 76 (paper 186)", "concept_domain": "Novelty", "research_mode": "team", "quality": "substantial", "quality_score": 0.82, "catalog_references": [], "prompt_length": 26374, "files_placed": 4, "status": "keep"}
{"timestamp": 1787481677.6998606, "experiment_id": "b8859dfd", "concept_title": "Parity-corrected asymptotics for the information-free game", "concept_domain": "Physics", "research_mode": "team", "quality": "substantial", "quality_score": 0.86, "catalog_references": [], "prompt_length": 26356, "files_placed": 4, "status": "keep"}
{"timestamp": 1787484970.0137236, "experiment_id": "04d3a29d", "concept_title": "Guarded transfer principle for real analysis", "concept_domain": "Cryptography", "research_mode": "team", "quality": "substantial", "quality_score": 0.82, "catalog_references": [], "prompt_length": 26515, "files_placed": 4, "status": "keep"}
{"timestamp": 1787484982.9916852, "experiment_id": "3d2c810c", "concept_title": "NET-68: CODE-NEEDS-FEWER-KEYS — domain jump to Python shifts the knee chain down one fine step ({12,16} vs {16,20}); budget law now domain-parameterized", "concept_domain": "Applications", "research_mode": "team", "quality": "substantial", "quality_score": 0.82, "catalog_references": [], "prompt_length": 27568, "files_placed": 5, "status": "keep"}
{"timestamp": 1787490200.8318126, "experiment_id": "258afb8b", "concept_title": "NET-72: THE-FRENCH-KNEE-EXCEEDS-THE-GRID — no grid point reaches the bar on French prose (knee >24 @512, >32 @1024); domain shifts are NOT ±4 fine-steps", "concept_domain": "Novelty", "research_mode": "team", "quality": "substantial", "quality_score": 0.78, "catalog_references": [], "prompt_length": 27441, "files_placed": 5, "status": "keep"}
{"timestamp": 1787490216.2061627, "experiment_id": "242b27e9", "concept_title": "Finite-Key Bounds on a Certified Asymptotic Core", "concept_domain": "Applications", "research_mode": "team", "quality": "substantial", "quality_score": 0.85, "catalog_references": ["Cryptography.BB84.PrivacyAmplification", "Cryptography.BB84.ThresholdPadeDigits"], "prompt_length": 26691, "files_placed": 4, "status": "keep"}
{"timestamp": 1787492854.490921, "experiment_id": "e4ce2d9a", "concept_title": "NET-71: THE-TOKENIZER-TAX-IS-FOUR-KEYS — German prose shifts knees up exactly one fine step ({20,24} vs {16,20}); four-domain deployment table complete", "concept_domain": "Logic", "research_mode": "team", "quality": "substantial", "quality_score": 0.78, "catalog_references": [], "prompt_length": 27482, "files_placed": 4, "status": "keep"}
{"timestamp": 1787499438.7118075, "experiment_id": "7797dc46", "concept_title": "Known versus unresolved cards.", "concept_domain": "MachineLearning", "research_mode": "team", "quality": "substantial", "quality_score": 0.85, "catalog_references": [], "prompt_length": 25988, "files_placed": 4, "status": "keep"}
{"timestamp": 1787499452.717789, "experiment_id": "f099f0f6", "concept_title": "Moment hierarchy", "concept_domain": "Logic", "research_mode": "team", "quality": "substantial", "quality_score": 0.85, "catalog_references": [], "prompt_length": 25934, "files_placed": 4, "status": "keep"}
{"timestamp": 1787503469.1872563, "experiment_id": "4caf1d72", "concept_title": "Escape criterion iteration", "concept_domain": "Novelty", "research_mode": "team", "quality": "substantial", "quality_score": 0.82, "catalog_references": [], "prompt_length": 25922, "files_placed": 4, "status": "keep"}
{"timestamp": 1787506538.2792945, "experiment_id": "43ad4483", "concept_title": "A radix-growth threshold", "concept_domain": "Physics", "research_mode": "team", "quality": "substantial", "quality_score": 0.82, "catalog_references": [], "prompt_length": 26056, "files_placed": 4, "status": "keep"}
{"timestamp": 1787506552.1519442, "experiment_id": "6f1d7e50", "concept_title": "Cut-indexed defects", "concept_domain": "Novelty", "research_mode": "team", "quality": "substantial", "quality_score": 0.82, "catalog_references": [], "prompt_length": 25911, "files_placed": 4, "status": "keep"}
{"timestamp": 1787510976.2367291, "experiment_id": "86b92df3", "concept_title": "NET-70: MATH-READS-AS-PROSE — mathematical text leaves knees exactly at prose values ({16,20}) despite 12-pt lower accuracy; three-domain table complete (prose=16, code=12, math=16)", "concept_domain": "Combinatorics", "research_mode": "team", "quality": "substantial", "quality_score": 0.78, "catalog_references": [], "prompt_length": 27630, "files_placed": 6, "status": "keep"}
{"timestamp": 1787510992.8832219, "experiment_id": "620a1130", "concept_title": "Separate temporal and pitch lags", "concept_domain": "Tropical", "research_mode": "team", "quality": "substantial", "quality_score": 0.82, "catalog_references": [], "prompt_length": 26058, "files_placed": 4, "status": "keep"}
{"timestamp": 1787513754.2687564, "experiment_id": "147eac16", "concept_title": "FACT round-58 #1 — TDIAL-U52: the dial survives uniform draws at bitlen 52 (paper 183 addendum)", "concept_domain": "MachineLearning", "research_mode": "team", "quality": "substantial", "quality_score": 0.84, "catalog_references": [], "prompt_length": 26404, "files_placed": 5, "status": "keep"}
{"timestamp": 1787517620.3741019, "experiment_id": "3a849502", "concept_title": "The breakdown theorem is formalised and the two measured normalised distributions", "concept_domain": "Computation", "research_mode": "team", "quality": "substantial", "quality_score": 0.82, "catalog_references": [], "prompt_length": 26087, "files_placed": 5, "status": "keep"}
{"timestamp": 1787524761.0828457, "experiment_id": "4be48a30", "concept_title": "NET-65: SIXTEEN-IS-REAL — all sub-16 points fail on Qwen2.5-1.5B at ctx=1024 (knee exactly 16); scale flattens the context response: {16,20,24}@0.5B vs flat {16,16}@1.5B", "concept_domain": "Shared", "research_mode": "team", "quality": "substantial", "quality_score": 0.78, "catalog_references": [], "prompt_length": 27199, "files_placed": 5, "status": "keep"}
{"timestamp": 1787528207.6838167, "experiment_id": "c38d70d3", "concept_title": "NET-64: THE-CORPUS-B-DISAGREEMENT-WAS-A-GRID-ARTIFACT — corpus-B fine knee at 2048 is also 24; the {16,20,24} chain replicates exactly across both corpora at all three contexts", "concept_domain": "Probability", "research_mode": "team", "quality": "substantial", "quality_score": 0.85, "catalog_references": [], "prompt_length": 27317, "files_placed": 4, "status": "keep"}
{"timestamp": 1787536759.1929364, "experiment_id": "198a9f40", "concept_title": "NET-63: THE-2048-KNEE-IS-TWENTY-FOUR — fine grid confirms k*(2048)=24 with healthy margins; 0.5B chain {16,20,24} strictly monotone across all contexts", "concept_domain": "Bridges", "research_mode": "team", "quality": "substantial", "quality_score": 0.84, "catalog_references": [], "prompt_length": 27257, "files_placed": 5, "status": "keep"}
{"timestamp": 1787536776.0179234, "experiment_id": "58176b8d", "concept_title": "FACT round-63 #1 — TDIAL-U72: the zero-fit dial holds at bitlen 72 with count parity (paper 185)", "concept_domain": "Algebra", "research_mode": "team", "quality": "substantial", "quality_score": 0.82, "catalog_references": [], "prompt_length": 26457, "files_placed": 4, "status": "keep"}
{"timestamp": 1787541470.2271676, "experiment_id": "499e80a3", "concept_title": "NET-67: SCALE-HALVES-THE-CONTEXT-INCREMENT — 1.5B knee at 2048 is 18 not 20; both models start at 16 keys, scale halves the +per-doubling increment (+4 -> +2)", "concept_domain": "Novelty", "research_mode": "team", "quality": "substantial", "quality_score": 0.78, "catalog_references": [], "prompt_length": 27203, "files_placed": 4, "status": "keep"}
{"timestamp": 1787544635.5043216, "experiment_id": "2292d7e8", "concept_title": "C4 (reward hacking is a covariance) — PROVED at first order.*", "concept_domain": "Computation", "research_mode": "team", "quality": "substantial", "quality_score": 0.82, "catalog_references": [], "prompt_length": 26214, "files_placed": 4, "status": "keep"}
{"timestamp": 1787547747.7624724, "experiment_id": "05978b53", "concept_title": "Conjecture. `sup_{[0,1]²} |prodGate h x y − x y| = h²/3 + O(h⁴)`, attained at", "concept_domain": "Bridges", "research_mode": "team", "quality": "substantial", "quality_score": 0.89, "catalog_references": [], "prompt_length": 26138, "files_placed": 4, "status": "keep"}
{"timestamp": 1787547763.133643, "experiment_id": "9f4b7d2b", "concept_title": "FACT round-57 #1 — TDIAL-U48B: the zero-fit dial holds on uniform draws at bitlen 48 (paper 184)", "concept_domain": "Novelty", "research_mode": "team", "quality": "substantial", "quality_score": 0.84, "catalog_references": [], "prompt_length": 26285, "files_placed": 4, "status": "keep"}
{"timestamp": 1787547778.2222462, "experiment_id": "33808f71", "concept_title": "NET-69: CONTENT-WEAKNESS-IS-DOMAIN-UNIVERSAL — probes recover only R2=0.32 on code too; probe-only loses to accumulation by 12pts; hybrid non-degrading (+0.3)", "concept_domain": "Novelty", "research_mode": "team", "quality": "substantial", "quality_score": 0.78, "catalog_references": [], "prompt_length": 27481, "files_placed": 4, "status": "keep"}
{"timestamp": 1787556132.3636425, "experiment_id": "fdd9261c", "concept_title": "Define Laurent q-series with the standard `q⁻¹ + O(q)` normalization and formalize the pole\n   order of finite products.", "concept_domain": "NumberTheory", "research_mode": "team", "quality": "substantial", "quality_score": 0.82, "catalog_references": [], "prompt_length": 26060, "files_placed": 4, "status": "keep"}
{"timestamp": 1787556145.4881642, "experiment_id": "6c27d6f0", "concept_title": "NET-60: THE-EPISTASIS-LIVES-IN-THE-TAIL-PAIR — L22+L23 solo costs sum to 0.06pts but joint pruning costs 0.42pts (7x super-additive); the last two layers are one coordinated unit", "concept_domain": "Tropical", "research_mode": "team", "quality": "substantial", "quality_score": 0.82, "catalog_references": [], "prompt_length": 28061, "files_placed": 5, "status": "keep"}
{"timestamp": 1787562354.9010124, "experiment_id": "3be10ac1", "concept_title": "FACT round-56 #1 — TDIAL-BITLEN: the zero-fit dial holds at exact-bitlen-48 uniform (paper 183)", "concept_domain": "Pythagorean", "research_mode": "team", "quality": "substantial", "quality_score": 0.83, "catalog_references": [], "prompt_length": 26392, "files_placed": 4, "status": "keep"}
{"timestamp": 1787565918.9358077, "experiment_id": "c293906f", "concept_title": "NET-76: THE-DOMAIN-FACTOR-IS-MULTIPLICATIVE — complete 5-domain × 2-context table: each domain's entire budget curve scales by one multiplicative factor (code 0.75x to FR 2.0x)", "concept_domain": "Probability", "research_mode": "team", "quality": "substantial", "quality_score": 0.88, "catalog_references": [], "prompt_length": 27266, "files_placed": 4, "status": "keep"}
{"timestamp": 1787565936.6064894, "experiment_id": "93d08ac5", "concept_title": "For `d ≥ 1`, `N ≥ 2`, the thickness of the outermost equal-volume", "concept_domain": "Shared", "research_mode": "team", "quality": "substantial", "quality_score": 0.82, "catalog_references": [], "prompt_length": 26182, "files_placed": 4, "status": "keep"}
{"timestamp": 1787568907.373643, "experiment_id": "95bfbbbf", "concept_title": "NET-78: THE-INCREMENT-ACCELERATES-AT-4096 — knee jumps to k*=40 (increment +16/doubling vs prior +4); linear increment law breaks after three doublings; phase transition in context-sensitivity", "concept_domain": "Novelty", "research_mode": "team", "quality": "substantial", "quality_score": 0.82, "catalog_references": [], "prompt_length": 27551, "files_placed": 4, "status": "keep"}
{"timestamp": 1787571919.6525447, "experiment_id": "59651b5d", "concept_title": "FACT round-69 #1 — TDIAL-U92: the dial reaches the floor at bitlen 92 (paper 190, partial)", "concept_domain": "MachineLearning", "research_mode": "team", "quality": "substantial", "quality_score": 0.79, "catalog_references": [], "prompt_length": 26404, "files_placed": 4, "status": "keep"}
{"timestamp": 1787577258.9712462, "experiment_id": "c96b94a8", "concept_title": "FACT round-68 #1 — TDIAL-U88: the dial drops below the floor at bitlen 88 (paper 189)", "concept_domain": "Pythagorean", "research_mode": "team", "quality": "substantial", "quality_score": 0.78, "catalog_references": [], "prompt_length": 26445, "files_placed": 4, "status": "keep"}
{"timestamp": 1787577273.1077406, "experiment_id": "6f277833", "concept_title": "C3. The even/odd dichotomy of the one-bit cap", "concept_domain": "Tropical", "research_mode": "team", "quality": "substantial", "quality_score": 0.83, "catalog_references": [], "prompt_length": 26623, "files_placed": 4, "status": "keep"}
{"timestamp": 1787577285.1476843, "experiment_id": "f45042dc", "concept_title": "NET-79: THE-ACCELERATION-IS-UNIVERSAL — 1.5B knee at 4096 is 56 (every point 16-44 fails); acceleration amplifies with scale (19x vs 4x); size relationship INVERTS past phase transition", "concept_domain": "Pythagorean", "research_mode": "team", "quality": "substantial", "quality_score": 0.82, "catalog_references": [], "prompt_length": 27902, "files_placed": 4, "status": "keep"}
{"timestamp": 1787580244.7849374, "experiment_id": "7934932a", "concept_title": "Sharper normalization", "concept_domain": "MachineLearning", "research_mode": "team", "quality": "substantial", "quality_score": 0.84, "catalog_references": [], "prompt_length": 25989, "files_placed": 4, "status": "keep"}
{"timestamp": 1787587046.5088007, "experiment_id": "9d509f0a", "concept_title": "FACT round-68 #3 — TDIAL-U64B: fresh-seed replication confirms the dial at bitlen 64 (paper 190)", "concept_domain": "Algebra", "research_mode": "team", "quality": "substantial", "quality_score": 0.87, "catalog_references": [], "prompt_length": 26519, "files_placed": 4, "status": "keep"}
{"timestamp": 1787587065.9782598, "experiment_id": "99ec0ece", "concept_title": "The P vs NP of Cooking: Computational Complexity of Recipes", "concept_domain": "Novelty", "research_mode": "team", "quality": "substantial", "quality_score": 0.82, "catalog_references": [], "prompt_length": 27220, "files_placed": 4, "status": "keep"}
{"timestamp": 1787587081.2143095, "experiment_id": "a331ba56", "concept_title": "Complementation as a free involution", "concept_domain": "Novelty", "research_mode": "team", "quality": "substantial", "quality_score": 0.84, "catalog_references": [], "prompt_length": 26350, "files_placed": 4, "status": "keep"}
{"timestamp": 1787593691.2799773, "experiment_id": "194ffa72", "concept_title": "Exact off-resonance window formula", "concept_domain": "NumberTheory", "research_mode": "team", "quality": "substantial", "quality_score": 0.87, "catalog_references": [], "prompt_length": 25990, "files_placed": 4, "status": "keep"}
{"timestamp": 1787593704.712188, "experiment_id": "a3cbf41f", "concept_title": "NET-87: CODE-AT-4096-IS-PROTECTED — code knee @4096 is 32 vs prose 40; domain factor narrows at long context", "concept_domain": "Novelty", "research_mode": "team", "quality": "substantial", "quality_score": 0.81, "catalog_references": [], "prompt_length": 26872, "files_placed": 5, "status": "keep"}
{"timestamp": 1787593721.8209941, "experiment_id": "d4951edd", "concept_title": "FACT round-70 #5 — PRICE-2ADIC-LETTERS: the Price tree's alphabet lives at 2-adics; Gauss magnitudes proven residue dials (paper 196)", "concept_domain": "Cryptography", "research_mode": "team", "quality": "substantial", "quality_score": 0.82, "catalog_references": [], "prompt_length": 27357, "files_placed": 4, "status": "keep"}
{"timestamp": 1787600775.2431211, "experiment_id": "ed2d0af8", "concept_title": "The Category Theory of Jokes: Universal Properties of Humor", "concept_domain": "Applications", "research_mode": "team", "quality": "substantial", "quality_score": 0.78, "catalog_references": [], "prompt_length": 27279, "files_placed": 4, "status": "keep"}
{"timestamp": 1787604597.0348222, "experiment_id": "2a9ba724", "concept_title": "Per-tag reflection depths are freely realizable", "concept_domain": "NumberTheory", "research_mode": "team", "quality": "substantial", "quality_score": 0.8, "catalog_references": [], "prompt_length": 27152, "files_placed": 4, "status": "keep"}
{"timestamp": 1787604612.1181078, "experiment_id": "969a5dc4", "concept_title": "FACT round-70 #4 — DEPTH-DECAY: the magnitude channel sees only the first steps (paper 195)", "concept_domain": "Cryptography", "research_mode": "team", "quality": "substantial", "quality_score": 0.85, "catalog_references": [], "prompt_length": 27150, "files_placed": 4, "status": "keep"}
{"timestamp": 1787611552.738043, "experiment_id": "886e75dc", "concept_title": "FACT round-70 #6 — MAGNITUDE-MIRROR: energy-ascent channel RETRACTED; the tree sealed against all realized probes (paper 197, errata to 193/195)", "concept_domain": "Combinatorics", "research_mode": "team", "quality": "substantial", "quality_score": 0.82, "catalog_references": [], "prompt_length": 27815, "files_placed": 4, "status": "keep"}
{"timestamp": 1787614597.6622548, "experiment_id": "51837664", "concept_title": "FACT round-71 #1 — TWO-ADIC-PRICE-LAW: two clicks of visibility then sealed; exact v2(p+q) mechanism (paper 198)", "concept_domain": "Probability", "research_mode": "team", "quality": "substantial", "quality_score": 0.87, "catalog_references": [], "prompt_length": 27443, "files_placed": 4, "status": "keep"}
{"timestamp": 1787614614.1848183, "experiment_id": "ed1b07dd", "concept_title": "E3.  The margin does not", "concept_domain": "Computation", "research_mode": "team", "quality": "substantial", "quality_score": 0.79, "catalog_references": [], "prompt_length": 26841, "files_placed": 4, "status": "keep"}
{"timestamp": 1787614628.9524004, "experiment_id": "eef05184", "concept_title": "Weighted / signed sums", "concept_domain": "Novelty", "research_mode": "team", "quality": "substantial", "quality_score": 0.8, "catalog_references": [], "prompt_length": 25902, "files_placed": 4, "status": "keep"}
{"timestamp": 1787627664.5099716, "experiment_id": "80241759", "concept_title": "Parameter-derived depth", "concept_domain": "Physics", "research_mode": "team", "quality": "substantial", "quality_score": 0.79, "catalog_references": [], "prompt_length": 25935, "files_placed": 4, "status": "keep"}
{"timestamp": 1787627674.8173153, "experiment_id": "22848dce", "concept_title": "Exponential lower bound via quartet codes", "concept_domain": "Combinatorics", "research_mode": "team", "quality": "substantial", "quality_score": 0.82, "catalog_references": [], "prompt_length": 26605, "files_placed": 4, "status": "keep"}
{"timestamp": 1787636994.4728022, "experiment_id": "569bc76d", "concept_title": "Ellipsoids", "concept_domain": "Bridges", "research_mode": "team", "quality": "substantial", "quality_score": 0.88, "catalog_references": [], "prompt_length": 25968, "files_placed": 5, "status": "keep"}
{"timestamp": 1787637009.5685904, "experiment_id": "40fe72ea", "concept_title": "FACT round-73 #1 — PORTFOLIO: no universal winner, no dial edge; regret tail is N-invisible (paper 206)", "concept_domain": "Probability", "research_mode": "team", "quality": "substantial", "quality_score": 0.88, "catalog_references": [], "prompt_length": 26855, "files_placed": 4, "status": "keep"}
{"timestamp": 1787637028.7828002, "experiment_id": "4aeadf94", "concept_title": "FACT round-72 #4 — TDIAL-U120: rebound was noise, fade continues below the hypothesized floor (paper 204)", "concept_domain": "Algebra", "research_mode": "team", "quality": "substantial", "quality_score": 0.84, "catalog_references": [], "prompt_length": 26545, "files_placed": 4, "status": "keep"}
{"timestamp": 1787637046.302756, "experiment_id": "9061d61f", "concept_title": "FACT round-75 #2 — COLLISION-VS-ORDER-TRACE: H1 and H2 both REFUTED with inverted geometry — low-B1 success sits far above the collision floor (65.0%/62.5% vs 16.47%, cross-bitlen z p=0.82); hits fire near step ZERO at high B1 (median 0.09–0.10, final-20% tail 0/55, binom p≈0.004) — paper-159 amendment-candidate REJECTED as stated; new early-fire trace law added", "concept_domain": "Novelty", "research_mode": "team", "quality": "substantial", "quality_score": 0.78, "catalog_references": [], "prompt_length": 28674, "files_placed": 4, "status": "keep"}
{"timestamp": 1787644815.2558873, "experiment_id": "9fb758b1", "concept_title": "C1 (drift constant is the standard deviation) — PROVED.*", "concept_domain": "Algebra", "research_mode": "team", "quality": "substantial", "quality_score": 0.82, "catalog_references": [], "prompt_length": 26429, "files_placed": 4, "status": "keep"}
{"timestamp": 1787644831.0127742, "experiment_id": "16c9261f", "concept_title": "NET-96 THE-COST-LAW-CLOSES-THE-LOOP: cost-law argmax from extracted survival curves reproduces measured speculation optima exactly (prose d=4, code d=8); per-position differencing at n=4 prompts under-resolved (lesson: instrument directly)", "concept_domain": "Computation", "research_mode": "team", "quality": "substantial", "quality_score": 0.78, "catalog_references": [], "prompt_length": 27116, "files_placed": 4, "status": "keep"}
{"timestamp": 1787644848.3006315, "experiment_id": "4578ca8c", "concept_title": "Midpoint-corrected acceleration", "concept_domain": "Computation", "research_mode": "team", "quality": "substantial", "quality_score": 0.86, "catalog_references": [], "prompt_length": 26083, "files_placed": 4, "status": "keep"}
