{"timestamp": 1781895934.8264868, "experiment_id": "225644b1", "concept_title": "The Library of Babel: Combinatorics of the Universal Library", "concept_domain": "Probability", "research_mode": "team", "quality": "partial", "quality_score": 0.44512863813229575, "catalog_references": [], "prompt_length": 23471, "files_placed": 9, "status": "discard"}
{"timestamp": 1781903196.6832395, "experiment_id": "89bf180f", "concept_title": "Random Graphs: Erd\u0151s-R\u00e9nyi Threshold Phenomena", "concept_domain": "NumberTheory", "research_mode": "sorry_fill", "quality": "partial", "quality_score": 0.4910402434782609, "catalog_references": ["Combinatorics/ErdosRenyi.lean"], "prompt_length": 3021, "files_placed": 0, "status": "discard"}
{"timestamp": 1781903946.050415, "experiment_id": "ead94fbc", "concept_title": "Sheaf-Theoretic Data Integration: When Databases Form a Sheaf", "concept_domain": "Applications", "research_mode": "formalize", "quality": "partial", "quality_score": 0.45100000000000007, "catalog_references": ["Tropical.ComplexityTransfer", "Distribution.Analysis", "Algebra.Elements"], "prompt_length": 245, "files_placed": 0, "status": "discard"}
{"timestamp": 1781910385.1551619, "experiment_id": "bf1e3b75", "concept_title": "Speculative: Anti-Gravity Mathematics \u2014 Theorems That Resist Proof", "concept_domain": "Applications", "research_mode": "prove|formalize|counterexample", "quality": "partial", "quality_score": 0.49552432432432436, "catalog_references": ["Domain/File.lean", "Catalog/FINAL"], "prompt_length": 20590, "files_placed": 11, "status": "discard"}
{"timestamp": 1781920974.9778144, "experiment_id": "d1e35069", "concept_title": "Dream Logic: Non-Monotone Reasoning Where Contradictions Coexist", "concept_domain": "NumberTheory", "research_mode": "prove", "quality": "partial", "quality_score": 0.40854, "catalog_references": [], "prompt_length": 1707, "files_placed": 0, "status": "discard"}
{"timestamp": 1781922436.8758469, "experiment_id": "c50363b9", "concept_title": "Tropical Cryptography: Min-Plus Encryption with Tropical Matrices", "concept_domain": "Tropical", "research_mode": "counterexample", "quality": "substantial", "quality_score": 0.723184, "catalog_references": [], "prompt_length": 19719, "files_placed": 6, "status": "keep"}
{"timestamp": 1781931596.2079763, "experiment_id": "35a8dda5", "concept_title": "Sheaf-Theoretic Data Integration: When Databases Form a Sheaf", "concept_domain": "Cryptography", "research_mode": "team", "quality": "substantial", "quality_score": 0.74408, "catalog_references": [], "prompt_length": 21926, "files_placed": 12, "status": "keep"}
{"timestamp": 1781931953.909033, "experiment_id": "5e9b4daa", "concept_title": "Tropical Cryptography: Min-Plus Encryption with Tropical Matrices", "concept_domain": "Cryptography", "research_mode": "team", "quality": "substantial", "quality_score": 0.79384, "catalog_references": [], "prompt_length": 22038, "files_placed": 7, "status": "keep"}
{"timestamp": 1781932166.22816, "experiment_id": "972d4c89", "concept_title": "Ramsey Theory: Bounds and Constructions", "concept_domain": "Applications", "research_mode": "formalize", "quality": "substantial", "quality_score": 0.8524, "catalog_references": ["Catalog/FINAL/Graph/SimpleGraph.lean", "Catalog/FINAL/Combinatorial/Ramsey.lean"], "prompt_length": 22859, "files_placed": 12, "status": "keep"}
{"timestamp": 1781932428.7439208, "experiment_id": "0c649dc0", "concept_title": "Speculative: Anti-Gravity Mathematics \u2014 Theorems That Resist Proof", "concept_domain": "Cryptography", "research_mode": "formalize", "quality": "partial", "quality_score": 0.5379381188118812, "catalog_references": ["Cryptography/HardnessHierarchy.lean", "Cryptography/ProofComplexity.lean", "Cryptography/PrimeAssumptions.lean", "Topology/Alexandrov.lean"], "prompt_length": 23164, "files_placed": 12, "status": "keep"}
{"timestamp": 1781935104.181104, "experiment_id": "38689f4d", "concept_title": "Dream Logic: Non-Monotone Reasoning Where Contradictions Coexist", "concept_domain": "Algebra", "research_mode": "sorry_fill", "quality": "partial", "quality_score": 0.5154196374622356, "catalog_references": [], "prompt_length": 20795, "files_placed": 22, "status": "keep"}
{"timestamp": 1781938226.6433876, "experiment_id": "6d018212", "concept_title": "Randomly piercing algebraic sets and its implications", "concept_domain": "Computation", "research_mode": "formalize", "quality": "partial", "quality_score": 0.5091087694974004, "catalog_references": [], "prompt_length": 22836, "files_placed": 12, "status": "keep"}
{"timestamp": 1781940872.474001, "experiment_id": "df051b46", "concept_title": "Close Proofs: These conjectures continue the research cycle begun in", "concept_domain": "Combinatorics", "research_mode": "team", "quality": "substantial", "quality_score": 0.8183600000000001, "catalog_references": [], "prompt_length": 20895, "files_placed": 22, "status": "keep"}
{"timestamp": 1781941678.0654156, "experiment_id": "8e353e57", "concept_title": "Derived from the cycle whose verified results live in", "concept_domain": "Logic", "research_mode": "sorry_fill", "quality": "partial", "quality_score": 0.63384, "catalog_references": ["Logic/ParaconsistentParadox.lean", "Logic/ParadoxSelfSoundness.lean", "Computation/ParadoxesAsTheorems.lean"], "prompt_length": 25699, "files_placed": 19, "status": "keep"}
{"timestamp": 1781944962.5339963, "experiment_id": "db367995", "concept_title": "Invariant Subspace Problem", "concept_domain": "Novelty", "research_mode": "team", "quality": "partial", "quality_score": 0.42152284276729557, "catalog_references": [], "prompt_length": 6962, "files_placed": 0, "status": "discard"}
{"timestamp": 1781948074.6974795, "experiment_id": "443cc80d", "concept_title": "Tensor Network Holography for Quantum Gravity with Categorical Entanglement Reno", "concept_domain": "Geometry", "research_mode": "prove", "quality": "substantial", "quality_score": 0.7460199999999999, "catalog_references": ["Mathlib.Data.Matrix.Basic", "Mathlib.LinearAlgebra.Matrix.Determinant.Basic", "Mathlib.Tactic"], "prompt_length": 22022, "files_placed": 19, "status": "keep"}
{"timestamp": 1781949792.106174, "experiment_id": "7b66a66e", "concept_title": "Semiprime cyclotomic transfer for square-sided dice", "concept_domain": "NumberTheory", "research_mode": "formalize", "quality": "partial", "quality_score": 0.4596814054054055, "catalog_references": [], "prompt_length": 20967, "files_placed": 9, "status": "discard"}
{"timestamp": 1781950845.0534296, "experiment_id": "acb790ee", "concept_title": "Complexity\u2011Driven Emergence of Spacetime from Random Tensor Networks", "concept_domain": "Physics", "research_mode": "formalize", "quality": "substantial", "quality_score": 0.8075699999999999, "catalog_references": ["Mathlib/Data/Nat/Fib.lean", "Mathlib/Data/Nat/GCD.lean", "Physics/RandomTensorNetwork/Threshold.lean"], "prompt_length": 23878, "files_placed": 5, "status": "keep"}
{"timestamp": 1781953433.9718106, "experiment_id": "5eb69ea3", "concept_title": "Topological Generalization Bounds for Deep Learning", "concept_domain": "Algebra", "research_mode": "formalize", "quality": "partial", "quality_score": 0.5579941436464089, "catalog_references": ["Catalog/FINAL/Computation/TreeMetric/TreeMetric.lean", "Catalog/FINAL/Computation/TreeMetric/FiniteTreeMetric.lean", "Catalog/Computation/TreeMetric/"], "prompt_length": 20890, "files_placed": 7, "status": "keep"}
{"timestamp": 1781953658.446875, "experiment_id": "bcf3395e", "concept_title": "Ramsey Theory: Bounds and Constructions", "concept_domain": "Geometry", "research_mode": "prove", "quality": "partial", "quality_score": 0.4537146432932148, "catalog_references": ["MachineLearning/RamseyFirstMoment.lean", "Catalog/Geometry/RamseyProbabilistic/Counting.lean"], "prompt_length": 893, "files_placed": 0, "status": "discard"}
{"timestamp": 1781953843.426164, "experiment_id": "722e1f4a", "concept_title": "The Library of Babel: Combinatorics of the Universal Library", "concept_domain": "Applications", "research_mode": "formalize", "quality": "partial", "quality_score": 0.654, "catalog_references": ["Catalog/FINAL/Combinatorics/Counting.lean", "Catalog/FINAL/Combinatorics/FiniteSets.lean", "Catalog/FINAL/Data/Fin.lean"], "prompt_length": 21811, "files_placed": 22, "status": "keep"}
{"timestamp": 1781956935.0604768, "experiment_id": "47b46667", "concept_title": "The Library of Babel: Combinatorics of the Universal Library", "concept_domain": "Shared", "research_mode": "team", "quality": "partial", "quality_score": 0.4507929497716895, "catalog_references": [], "prompt_length": 9243, "files_placed": 0, "status": "discard"}
{"timestamp": 1781959525.4815772, "experiment_id": "00fd88ec", "concept_title": "Arithmetic Mirror Symmetry for Calabi-Yau", "concept_domain": "Novelty", "research_mode": "team", "quality": "partial", "quality_score": 0.5112, "catalog_references": [], "prompt_length": 6446, "files_placed": 0, "status": "keep"}
{"timestamp": 1781963009.2259195, "experiment_id": "fdab34f3", "concept_title": "Complexity\u2011Driven Emergence of Spacetime from Random Tensor Networks", "concept_domain": "Tropical", "research_mode": "prove", "quality": "partial", "quality_score": 0.4961724137931035, "catalog_references": ["CategoryTheory.lean", "IsomorphismFamily.linestring", "YonedaUniversalBridge.lean"], "prompt_length": 23876, "files_placed": 21, "status": "discard"}
{"timestamp": 1781965211.0400536, "experiment_id": "831891b4", "concept_title": "Quantum Mechanics: Spectral Theory of Hydrogen", "concept_domain": "Physics", "research_mode": "sorry_fill", "quality": "partial", "quality_score": 0.49792574394463673, "catalog_references": ["GroupTheory/MatrixGroup/Basic.lean", "NumberTheory/PythagoreanTriples.lean", "Algebra/QuadraticForms.lean", "Data.Matrix.Basic.lean"], "prompt_length": 672, "files_placed": 0, "status": "discard"}
{"timestamp": 1781965944.0094702, "experiment_id": "d94e79ee", "concept_title": "Linear recurrence for coefficients of Ramanujan's third order mock theta function f(q)", "concept_domain": "Bridges", "research_mode": "team", "quality": "partial", "quality_score": 0.68624, "catalog_references": ["math.NT/0305267", "math.NT/0707.0092", "math.NT/1502.03068"], "prompt_length": 20724, "files_placed": 7, "status": "keep"}
{"timestamp": 1781968409.6296165, "experiment_id": "ebc08ab7", "concept_title": "Tropical Differential Equations: Power Series Solutions", "concept_domain": "Pythagorean", "research_mode": "prove|formalize|construct_counterexample", "quality": "partial", "quality_score": 0.4770719626168225, "catalog_references": ["Domain/File.lean", "Domain/FiniteSemirings.glendown.tlas.lam"], "prompt_length": 459, "files_placed": 0, "status": "discard"}
{"timestamp": 1781968864.0489306, "experiment_id": "bab04850", "concept_title": "Complexity\u2011Driven Emergence of Spacetime from Random Tensor Networks", "concept_domain": "Pythagorean", "research_mode": "team", "quality": "partial", "quality_score": 0.4604252747252747, "catalog_references": [], "prompt_length": 3529, "files_placed": 0, "status": "discard"}
{"timestamp": 1781971953.5102181, "experiment_id": "d9e56a6a", "concept_title": "*normalization functor into the probability simplex*", "concept_domain": "Tropical", "research_mode": "prove", "quality": "partial", "quality_score": 0.5512728045325779, "catalog_references": ["Algebra/GroupTheory.lean", "Algebra/Algebra.lean", "Tropical/Algebra.lean", "Data/Finset.lean"], "prompt_length": 27006, "files_placed": 16, "status": "keep"}
{"timestamp": 1781972109.6093948, "experiment_id": "c4b2f906", "concept_title": "Necessary threshold for cubic generalized Tur\u00e1n growth against K_{3,t}", "concept_domain": "Novelty", "research_mode": "team", "quality": "partial", "quality_score": 0.5545492752326414, "catalog_references": ["Alon-Shikhelman generalized Tur\u00e1n numbers", "K\u0151v\u00e1ri-S\u00f3s-Tur\u00e1n theorem", "Janzer-Longbrake-Yepremyan theorem for ex(n,K_{a,b},K_{3,t})", "Finite-field incidence constructions for bipartite Tur\u00e1n problems"], "prompt_length": 23115, "files_placed": 7, "status": "keep"}
{"timestamp": 1781979771.4778183, "experiment_id": "656b45a0", "concept_title": "Two boundary facts of the prime crossword in", "concept_domain": "Pythagorean", "research_mode": "sorry_fill", "quality": "partial", "quality_score": 0.46081729863543053, "catalog_references": ["Algebra/LibraryOfBabel.lean", "Catalog/Algebra/LibraryOfBabel.lean", "Catalog/Algebra/MDSUncertainty.lean"], "prompt_length": 23109, "files_placed": 8, "status": "discard"}
{"timestamp": 1781983022.0500906, "experiment_id": "6b3462b3", "concept_title": "The Library of Babel: Combinatorics of the Universal Library", "concept_domain": "Novelty", "research_mode": "formalize", "quality": "partial", "quality_score": 0.5003999261633124, "catalog_references": ["Algebra/LibraryOfBabelProbability.lean"], "prompt_length": 21801, "files_placed": 6, "status": "keep"}
{"timestamp": 1781983998.1093373, "experiment_id": "47c79c52", "concept_title": "Formalizing Graph Linear Notation in Lean 4", "concept_domain": "Probability", "research_mode": "formalize", "quality": "partial", "quality_score": 0.69352, "catalog_references": ["Mathlib/Combinatorics/SimpleGraph/Basic.lean", "Mathlib/Data/Finset/Max.lean", "Mathlib/GroupTheory/Perm/Basic.lean"], "prompt_length": 20809, "files_placed": 6, "status": "keep"}
{"timestamp": 1781984871.4533901, "experiment_id": "977d0362", "concept_title": "Fixed partial Latin patterns occur with asymptotic probability n^{-k}", "concept_domain": "Applications", "research_mode": "formalize", "quality": "partial", "quality_score": 0.5126619770114944, "catalog_references": ["Combinatorics/LatinSquare/CellUniform.lean", "Combinatorics/LatinSquare/Basic.lean", "Combinatorics/Equiv/Perm.lean"], "prompt_length": 21814, "files_placed": 6, "status": "keep"}
{"timestamp": 1781986599.0137272, "experiment_id": "0d8fceb6", "concept_title": "Recurrence for the Winning Probability in the Generalized Game", "concept_domain": "Applications", "research_mode": "sorry_fill", "quality": "substantial", "quality_score": 0.7248279999999999, "catalog_references": ["Catalog/FINAL/Applications/QGame/Recurrence.lean", "Catalog/Applications/QGame/Recurrence.lean"], "prompt_length": 17612, "files_placed": 8, "status": "keep"}
{"timestamp": 1781987221.7067626, "experiment_id": "808095a3", "concept_title": "Complexity\u2011Driven Emergence of Spacetime from Random Tensor Networks", "concept_domain": "Applications", "research_mode": "formalize", "quality": "partial", "quality_score": 0.453335, "catalog_references": ["FINAL/Bridges/SubmodularCurvature.lean", "FINAL/Bridges/HolographicCoding.lean"], "prompt_length": 2853, "files_placed": 0, "status": "discard"}
{"timestamp": 1781987579.9565938, "experiment_id": "0f4e6c03", "concept_title": "Homotopy Type Theory Foundations", "concept_domain": "Novelty", "research_mode": "team", "quality": "partial", "quality_score": 0.5147914097421203, "catalog_references": [], "prompt_length": 6458, "files_placed": 0, "status": "keep"}
{"timestamp": 1781995090.645002, "experiment_id": "b4d505d3", "concept_title": "Universal Approximation: Quantitative Bounds", "concept_domain": "Novelty", "research_mode": "prove", "quality": "partial", "quality_score": 0.5528152173913043, "catalog_references": ["Catalog/FINAL/MachineLearning/ReLUDepthWidth.lean"], "prompt_length": 20740, "files_placed": 27, "status": "keep"}
{"timestamp": 1781995508.4721057, "experiment_id": "4a5dda39", "concept_title": "Complexity\u2011Driven Emergence of Spacetime from Random Tensor Networks", "concept_domain": "MachineLearning", "research_mode": "team", "quality": "partial", "quality_score": 0.6604548751733703, "catalog_references": [], "prompt_length": 21758, "files_placed": 5, "status": "keep"}
{"timestamp": 1781995756.0386689, "experiment_id": "bf991533", "concept_title": "Navier-Stokes: 2D Regularity and Partial 3D Results", "concept_domain": "MachineLearning", "research_mode": "prove", "quality": "partial", "quality_score": 0.5450164281345566, "catalog_references": [], "prompt_length": 22883, "files_placed": 8, "status": "keep"}
{"timestamp": 1781995973.280332, "experiment_id": "f832cbd3", "concept_title": "The Library of Babel: Combinatorics of the Universal Library", "concept_domain": "Novelty", "research_mode": "formalize", "quality": "partial", "quality_score": 0.543562, "catalog_references": [], "prompt_length": 23932, "files_placed": 15, "status": "keep"}
{"timestamp": 1781999626.4424791, "experiment_id": "568da95c", "concept_title": "EML Quantum Activation Functions", "concept_domain": "Applications", "research_mode": "formalize", "quality": "partial", "quality_score": 0.4444041217391304, "catalog_references": ["Mathlib/Data/Complex/Basic.lean", "Mathlib/Analysis/SpecialFunctions/Trigonometric/Complex.lean", "Mathlib/LinearAlgebra/Matrix/Basic.lean", "Mathlib/LinearAlgebra/Matrix/Determinant.lean", "Mathlib/LinearAlgebra/Matrix/Star.lean", "Mathlib/LinearAlgebra/Matrix/NonsingularInverse.lean"], "prompt_length": 4436, "files_placed": 0, "status": "discard"}
{"timestamp": 1782002209.7558742, "experiment_id": "97399ed6", "concept_title": "The Library of Babel: Combinatorics of the Universal Library", "concept_domain": "Applications", "research_mode": "team", "quality": "substantial", "quality_score": 0.71035, "catalog_references": [], "prompt_length": 23937, "files_placed": 8, "status": "keep"}
{"timestamp": 1782002407.2829587, "experiment_id": "2683755a", "concept_title": "Bounded tree-independence in K_{1,d}-free graphs excluding a planar minor", "concept_domain": "MachineLearning", "research_mode": "prove", "quality": "partial", "quality_score": 0.5860000000000001, "catalog_references": ["GraphTheory/Treewidth.lean", "GraphTheory/Minors.lean", "GraphTheory/TreeDecomposition.lean", "GraphTheory/InducedMinors.lean", "Combinatorics/GraphSeries.lean"], "prompt_length": 20838, "files_placed": 6, "status": "keep"}
{"timestamp": 1782005266.1166344, "experiment_id": "f370d5ee", "concept_title": "Consciousness as Integrated Information", "concept_domain": "Novelty", "research_mode": "prove", "quality": "partial", "quality_score": 0.4935106666666667, "catalog_references": ["Catalog/Cryptography/LeftoverHashLemma.lean"], "prompt_length": 4144, "files_placed": 0, "status": "discard"}
{"timestamp": 1782008931.4501803, "experiment_id": "3e812933", "concept_title": "Packing isolating sets exist in finite block graphs", "concept_domain": "Probability", "research_mode": "team", "quality": "partial", "quality_score": 0.6599999999999999, "catalog_references": ["Mathlib.Combinatorics.SimpleGraph.Basic", "Mathlib.Combinatorics.SimpleGraph.Connectivity", "Mathlib.Data.Set.Finite", "Mathlib.Data.Finset.Basic"], "prompt_length": 20782, "files_placed": 8, "status": "keep"}
{"timestamp": 1782011731.933886, "experiment_id": "ddafecee", "concept_title": "Alien Mathematics: Non-Standard Arithmetic", "concept_domain": "Novelty", "research_mode": "formalize", "quality": "partial", "quality_score": 0.68521, "catalog_references": ["Catalog/Algebra/SemiringBasic.lean", "Catalog/Algebra/OrderedStructures.lean", "Catalog/SetTheory/FinProperties.lean"], "prompt_length": 18809, "files_placed": 6, "status": "keep"}
{"timestamp": 1782014290.2648892, "experiment_id": "7a341625", "concept_title": "Game of Life Universality", "concept_domain": "Novelty", "research_mode": "prove", "quality": "partial", "quality_score": 0.5548463972823172, "catalog_references": ["Catalog/FINAL/Computation/CellularAutomata/FinitePatterns.lean", "Catalog/FINAL/Mathlib/NaturalNumbers.lean", "Catalog/FINAL/Algebra/OrderedTypes.lean"], "prompt_length": 22773, "files_placed": 10, "status": "keep"}
{"timestamp": 1782016847.4185221, "experiment_id": "ab651d5d", "concept_title": "Bridge: Galois Connections Between Order Theory and Topology", "concept_domain": "Shared", "research_mode": "team", "quality": "partial", "quality_score": 0.4484232, "catalog_references": [], "prompt_length": 6970, "files_placed": 0, "status": "discard"}
{"timestamp": 1782017445.7064912, "experiment_id": "5ab82683", "concept_title": "Complete intersectionproperty of Fitting ideals for tree graphs", "concept_domain": "Tropical", "research_mode": "prove", "quality": "partial", "quality_score": 0.2857096, "catalog_references": ["Catalog/Tropical/TreeVariableIdeal.lean", "Axioms/MultiplicativeAlgebra.lean"], "prompt_length": 157, "files_placed": 0, "status": "discard"}
{"timestamp": 1782022995.1949272, "experiment_id": "971b371e", "concept_title": "Perfect Numbers: Structure of Even Perfects", "concept_domain": "Combinatorics", "research_mode": "formalize", "quality": "partial", "quality_score": 0.3106280036849378, "catalog_references": ["NumberTheory/PerfectNumbers.lean", "NumberTheory/ArithmeticFunction.lean", "NumberTheory/Divisors.lean", "Data/Nat/Prime.lean", "Data/Finset/Basic.lean"], "prompt_length": 1886, "files_placed": 0, "status": "discard"}
{"timestamp": 1782025572.7293646, "experiment_id": "43fe3cd5", "concept_title": "Complexity\u2011Driven Emergence of Spacetime from Random Tensor Networks", "concept_domain": "Computation", "research_mode": "prove", "quality": "partial", "quality_score": 0.37623999999999996, "catalog_references": ["Catalog/Applications/FibonacciEntryPoints.lean", "Catalog/Applications/FibonacciPisanoRepresentation.lean", "Catalog/Bridges/FibEntryPointDvdPisano.lean"], "prompt_length": 3819, "files_placed": 0, "status": "discard"}
{"timestamp": 1782026048.9884515, "experiment_id": "42f0bfda", "concept_title": "Fixed partial Latin patterns occur with asymptotic probability n^{-k}", "concept_domain": "Combinatorics", "research_mode": "formalize", "quality": "partial", "quality_score": 0.5537937826789618, "catalog_references": [], "prompt_length": 21036, "files_placed": 17, "status": "keep"}
