{"timestamp": 1787772049.748836, "experiment_id": "1a774383", "concept_title": "FACT round-85 #1 — SPIKE-ORIGIN-RESOLVED (exp 589 FINAL): H1a-INCLUSION-ARTIFACT + ERRATUM to paper 239 — paper 238's left-edge spike is tiny-v composition ENTIRELY (100% of D1 hits bitlen(v)<96 by window geometry; rr_d1 1.000/1.097 size-matched; kept-fit persistence = truncation-boundary gradient [96,98) dAICc 5.94 sub-bar, >=98 -0.40); NO positional kernel component survives", "concept_domain": "Probability", "research_mode": "team", "quality": "substantial", "quality_score": 0.78, "catalog_references": [], "prompt_length": 29460, "files_placed": 4, "status": "keep"}
{"timestamp": 1787772067.2088015, "experiment_id": "95a534e1", "concept_title": "FACT round-87 #2 — U065-FRESH-SEED-GATE (exp 592 FINAL): GATE-H0 FIRES — feature DOES NOT REPLICATE on fresh seed 20260902 (amp .074±.038 raw z=1.97; null-calibrated z_cal=-1.08 vs original z_cal+1.53/raw 4.11); pipeline EXONERATED (generator EXACT_MATCH vs stored lineage, ALL_DISJOINT vs all six prior seeds, CTRL-A clean maxdev .034) — PAPER 242 ENTRY AMENDED SINGLE-SEED-UNCONFIRMED, z=4.11 flagged possibly max-statistic-sweep-inflated; kappa composition layer SURVIVES two-seed (top cell 2,3,5|v&7∤v and all-cleared bottom coincide, spread .649–1.432 vs .645–1.406); named reopen: single-hypothesis u*=0.65 test on >=3 pooled seeds", "concept_domain": "Combinatorics", "research_mode": "team", "quality": "substantial", "quality_score": 0.81, "catalog_references": [], "prompt_length": 30755, "files_placed": 5, "status": "keep"}
{"timestamp": 1787787263.2993834, "experiment_id": "40d19005", "concept_title": "OEIS sequence: Stack polyominoes with square core.", "concept_domain": "Physics", "research_mode": "team", "quality": "substantial", "quality_score": 0.84, "catalog_references": [], "prompt_length": 26053, "files_placed": 4, "status": "keep"}
{"timestamp": 1787824206.379813, "experiment_id": "7ae2917a", "concept_title": "Composition of PCP locality with commitment hiding", "concept_domain": "MachineLearning", "research_mode": "team", "quality": "substantial", "quality_score": 0.82, "catalog_references": [], "prompt_length": 26057, "files_placed": 4, "status": "keep"}
{"timestamp": 1787824222.4362843, "experiment_id": "9524045a", "concept_title": "FACT round-88 #1 — LARGE-P-TRACE (exp 595 FINAL): H1 TRUE / H0 REFUTED — exp570's picture REPLICATES at bitlen 32 — cell found_p rates scale-stable at EVERY fraction (26: .65/.75/.60 vs 32: .75/.775/.75; z p=.33/.79/.15, CIs overlap), KS rejects uniformity ALL SIX cells (p≤.002; medians .073–.293, late-tail ≤13%) — collision floor SUBDOMINANT quantified (first-curve 2.6× baseline at (32,.125); found_q 9–16 vs found_p 24–31) — CHAIN CLOSED papers 215→218→244: low-B1 guarded-affine success = scale-stable order-completion firing early, no collapse toward 1−exp(−1.44·B1/p) through bitlen 32", "concept_domain": "Shared", "research_mode": "team", "quality": "substantial", "quality_score": 0.78, "catalog_references": [], "prompt_length": 29932, "files_placed": 4, "status": "keep"}
{"timestamp": 1787862716.3701255, "experiment_id": "10b0e429", "concept_title": "FACT round-92 #1 — F1-TIGHTNESS-CONNECTION (THEORY, no new physics): BOUND-SLACK-BY-X = 1.15 [1.10, 1.22] ON MEASURED DATA; EQUALITY PROVABLY UNATTAINABLE — paper-225 F1 master inequality connected to measured positional profile: Lam=0.766 (verified 0.765671), Theta_asc=0.867 [0.8193,0.9076], qhat unidentified; pi-flat equality REFUTED three ways (KS p=7e-76 / LRT p=9e-10 / binning-free p=1e-21) => no realizable policy attains the bound; gap X=C0/C_sort=1.15302 [1.10175,1.22054] policy-independent via identity chain; TIGHTNESS-CIRCULARITY CATCH: all four legacy anchors' P_hat are law inversions with Lam*Theta~=1.00-1.04 BY CONSTRUCTION — anchor tightness not-currently-decidable; DECIDABLE CLOSER named: scan-simulation on exp578 npz predicts S~=1.31 vs bound 1.51 (two-sided); independent verifier PASS 3/3, 0 discrepancies", "concept_domain": "Probability", "research_mode": "team", "quality": "substantial", "quality_score": 0.87, "catalog_references": [], "prompt_length": 29856, "files_placed": 4, "status": "keep"}
{"timestamp": 1787862736.4553125, "experiment_id": "b58ee289", "concept_title": "FACT round-91 #1 — J-FEATURE-SWEEP (exp 598): H0_CARRIER_OPEN — no j-arithmetic feature carries the mid-window excess — all 8 registered families honest R≤1.11 (mod-7 best p=0.36), F5 raw max j≡73 mod 105 R=1.558 BELOW null median-max 1.633 (global perm p=0.754, extreme-value noise over 105 cells) — j-arithmetic class ELIMINATED → consecutive-v polynomial-sequence dependency study per pre-registration", "concept_domain": "Logic", "research_mode": "team", "quality": "substantial", "quality_score": 0.86, "catalog_references": [], "prompt_length": 28243, "files_placed": 4, "status": "keep"}
{"timestamp": 1787894753.3032804, "experiment_id": "94eeec9f", "concept_title": "NET-94 THE-ROLE-SPLIT-CONFIRMED: K8/V4 cache is quality-free (+0.14%) at ~6 avg bits — the serving default; key-side cliff is a two-stage fall (free @8b, +868% @5b, +38,000% @4b) while values stay free to raw 4-bit", "concept_domain": "Algebra", "research_mode": "team", "quality": "substantial", "quality_score": 0.83, "catalog_references": [], "prompt_length": 26906, "files_placed": 4, "status": "keep"}
{"timestamp": 1787927233.693702, "experiment_id": "5be8ecbc", "concept_title": "NET-93 KEYS-OWN-THE-CLIFF: 4-bit cache KEYS alone annihilate the model (+35,597%) while 4-bit VALUES alone are free (+0.17%) — a four-order-of-magnitude asymmetry; no block-scaling format rescues keys", "concept_domain": "Novelty", "research_mode": "team", "quality": "substantial", "quality_score": 0.82, "catalog_references": [], "prompt_length": 27634, "files_placed": 4, "status": "keep"}
{"timestamp": 1787927251.9378257, "experiment_id": "497c96d6", "concept_title": "FACT round-74 #6 — ECM-STAGE2-WALL: the recorded destruction wall does not exist under outcome-separated accounting — B1 ≥ p+1+2√p makes every curve succeed, not die (self-audit of paper 159)", "concept_domain": "Physics", "research_mode": "team", "quality": "substantial", "quality_score": 0.82, "catalog_references": [], "prompt_length": 29461, "files_placed": 4, "status": "keep"}
{"timestamp": 1787942642.2365146, "experiment_id": "523b9317", "concept_title": "FACT round-74 #7 — U9-DRIFT-POWER: independent-seed replication returns the sub-1 drift to null (cut-1e6 r=0.99 CI [0.919,1.010] covers 1); pooled with paper 214 pilot joint point ~0.97 — banked tension downgraded to open at reduced weight", "concept_domain": "Probability", "research_mode": "team", "quality": "substantial", "quality_score": 0.76, "catalog_references": [], "prompt_length": 29351, "files_placed": 4, "status": "keep"}
{"timestamp": 1787969590.2691903, "experiment_id": "601f1720", "concept_title": "FACT round-74 #3 — SEQHINT-COMPOUND-LAW: sequential ADAPTIVE hints compound superlinearly (s(12)/s(3) = 165x unbalanced / 21x balanced, r(12) = 240x [220,261]) but saturate EXACTLY at the isolation ceiling (100% pinned at k=20, zero barrier events) while fixed batteries price linearly or carry literally ZERO bits in the balanced stratum — one pricing structure, two faces; paper-138 linearity reconciled", "concept_domain": "Pythagorean", "research_mode": "team", "quality": "substantial", "quality_score": 0.85, "catalog_references": [], "prompt_length": 29693, "files_placed": 4, "status": "keep"}
{"timestamp": 1787969609.5785925, "experiment_id": "6060f6d0", "concept_title": "FACT round-74 #2 — ORBIT-DIAL-CAP-TEST: mod-N orbit revealed set carries ZERO per-N factor information (max |z| +2.29, MI ≤ 0.09 bits vs 1–3-bit residue dials); its 2.0× read beats the 4/3 cap ONLY as the N-invariant parity skip (paired z vs fixed dial = 0.0) — constant-shave, not a barrier event; triplet-tree campaign CLOSED", "concept_domain": "Tropical", "research_mode": "team", "quality": "substantial", "quality_score": 0.78, "catalog_references": [], "prompt_length": 29326, "files_placed": 4, "status": "keep"}
{"timestamp": 1787994245.112938, "experiment_id": "3596d147", "concept_title": "FACT round-74 #4 — MA1-EFFECTIVITY-SWEEP: quadratic-character L-value magnitude does NOT carry AP-deviation effectivity at toy scale (clean H0 honest negative at two scales: R²=0.0187 registered x=2^26 / R²=0.0785 scaled x=2^28 vs 0.8/0.5 bars; deviation field modulus-size-dominated, baseline OBS~log m R²=0.79) — MA-1 stays axiomatic, SIGN-BLIND scope disclosed", "concept_domain": "Bridges", "research_mode": "team", "quality": "substantial", "quality_score": 0.8, "catalog_references": [], "prompt_length": 29625, "files_placed": 4, "status": "keep"}
{"timestamp": 1787994259.0607493, "experiment_id": "25df59ed", "concept_title": "Which-Factor Wall as a Cross-Population Invariant", "concept_domain": "Algebra", "research_mode": "team", "quality": "substantial", "quality_score": 0.86, "catalog_references": ["Combinatorics.TraceBatteryWall"], "prompt_length": 26717, "files_placed": 5, "status": "keep"}
{"timestamp": 1788013792.396517, "experiment_id": "90e1e335", "concept_title": "FACT round-74 #1 — ORACLE-REALIZATION-GAP: the 0.48-bit oracle sensor is unrealized by every N-computable policy (strict crediting 0% both seeds); barrier-6 circularity quantified at 73-77% of peak", "concept_domain": "Novelty", "research_mode": "team", "quality": "substantial", "quality_score": 0.8, "catalog_references": [], "prompt_length": 29013, "files_placed": 4, "status": "keep"}
{"timestamp": 1788013808.4714816, "experiment_id": "062fc32a", "concept_title": "FACT round-73 #4 — SCALE-SMOOTHNESS-DEVIATION: x²−N smoothness is random-level at u=6–8.5 (tightest bound |r−1|≤0.217); per-N clustering and QR dial both die above u≈7", "concept_domain": "NumberTheory", "research_mode": "team", "quality": "substantial", "quality_score": 0.78, "catalog_references": [], "prompt_length": 27927, "files_placed": 5, "status": "keep"}
{"timestamp": 1788028238.242171, "experiment_id": "f671dcbf", "concept_title": "NET-92 THE-KV-CLIFF: 8-bit KV cache is quality-free (+0.10% worst case) while 4-bit KV annihilates the model (PPL 7.11 -> 2714.6, +38000%) — the KV precision axis has no usable middle at ctx 2048", "concept_domain": "Logic", "research_mode": "team", "quality": "substantial", "quality_score": 0.78, "catalog_references": [], "prompt_length": 27645, "files_placed": 4, "status": "keep"}
{"timestamp": 1788028256.0526338, "experiment_id": "3f9d41d2", "concept_title": "FACT round-73 #3 — BATCH-AMORTIZATION: batch smoothness-testing wins its phase (+10.4% flat model) but testing is only 11.6% of per-factor work; word model reverses at large pools", "concept_domain": "Applications", "research_mode": "team", "quality": "substantial", "quality_score": 0.74, "catalog_references": [], "prompt_length": 27218, "files_placed": 4, "status": "keep"}
{"timestamp": 1788039925.157965, "experiment_id": "f5dbb89f", "concept_title": "The Fermi Paradox as a Pigeonhole Principle: Why We Are Alone", "concept_domain": "Pythagorean", "research_mode": "team", "quality": "substantial", "quality_score": 0.78, "catalog_references": [], "prompt_length": 27352, "files_placed": 4, "status": "keep"}
{"timestamp": 1788039936.807108, "experiment_id": "68de46a5", "concept_title": "FACT round-75 #4 — BARRIER4-POSITIONAL-CONVERSE draft (VERIFIED): positional/magnitude stratum of the barrier-4 converse recorded as DRAFT-WITH-CAVEATS — certified-silence law S_A=1/[μP+(1−P)(1−μ)] supersedes drafted fire-or-silent form (14 algebra failures caught by independent verification); T2 saturation V=log₂W+½ exact on dyadic W∈[2,4096]; Conjecture D factors S(R∘F)=S(R)·S(F) with sup_F=4/3 — residue cap 4/3 governs COST-class actions while position works the SET-class tail: 5.19×>4/3 is class-crossing not cap-breaking; zero arithmetic errors in recheck; named GAPs L4/L7/L8 are the next work", "concept_domain": "Tropical", "research_mode": "team", "quality": "substantial", "quality_score": 0.72, "catalog_references": [], "prompt_length": 29113, "files_placed": 4, "status": "keep"}
{"timestamp": 1788049309.6481245, "experiment_id": "c9c85c67", "concept_title": "FACT round-72 #5 — MODULAR-DYNAMICS: projected Berggren tree is collision-free but trial-division-slow (alpha=1.007); guidance null (paper 205)", "concept_domain": "Cryptography", "research_mode": "team", "quality": "substantial", "quality_score": 0.82, "catalog_references": [], "prompt_length": 27191, "files_placed": 4, "status": "keep"}
{"timestamp": 1788072079.2303412, "experiment_id": "9b32ba78", "concept_title": "Local character at every point", "concept_domain": "Cryptography", "research_mode": "team", "quality": "substantial", "quality_score": 0.83, "catalog_references": [], "prompt_length": 26025, "files_placed": 4, "status": "keep"}
{"timestamp": 1788072094.844006, "experiment_id": "342e465c", "concept_title": "NET-91 THE-CHEAP-DRAFT-WINS-AND-CODE-DRAFTS-DEEP: speculative decoding of a 7B LLM entirely on CPU pays up to 1.66x — smaller draft wins every cell (cost dominance), optimal depth is domain-parameterized (code deep, prose collapses past d=4 into a net loss)", "concept_domain": "Shared", "research_mode": "team", "quality": "substantial", "quality_score": 0.82, "catalog_references": [], "prompt_length": 28687, "files_placed": 4, "status": "keep"}
{"timestamp": 1788094511.5644732, "experiment_id": "17477782", "concept_title": "Completeness / compactness", "concept_domain": "MachineLearning", "research_mode": "team", "quality": "substantial", "quality_score": 0.9, "catalog_references": [], "prompt_length": 26050, "files_placed": 5, "status": "keep"}
{"timestamp": 1788094528.661027, "experiment_id": "b50cc5ce", "concept_title": "Test curvature only after identifiability", "concept_domain": "Combinatorics", "research_mode": "team", "quality": "substantial", "quality_score": 0.85, "catalog_references": [], "prompt_length": 26012, "files_placed": 5, "status": "keep"}
{"timestamp": 1788111040.9836202, "experiment_id": "b63aa142", "concept_title": "FACT round-72 #1 — EULER-LOSES: two-squares route measured — algebra exact, class 25%, cost 5.7x Fermat (paper 201)", "concept_domain": "Algebra", "research_mode": "team", "quality": "substantial", "quality_score": 0.87, "catalog_references": [], "prompt_length": 26956, "files_placed": 4, "status": "keep"}
{"timestamp": 1788132680.7594097, "experiment_id": "9c1e5dc4", "concept_title": "FACT round-71 #2 — TDIAL-U116: the fade REBOUNDS, floor forming near 0.46–0.49 (paper 200)", "concept_domain": "Probability", "research_mode": "team", "quality": "substantial", "quality_score": 0.84, "catalog_references": [], "prompt_length": 26880, "files_placed": 4, "status": "keep"}
{"timestamp": 1788132699.656585, "experiment_id": "181f9c07", "concept_title": "F4. Sharpening the chain upper bound from $2^d - 1$ to $O(d)$", "concept_domain": "Algebra", "research_mode": "team", "quality": "substantial", "quality_score": 0.72, "catalog_references": [], "prompt_length": 26393, "files_placed": 4, "status": "keep"}
{"timestamp": 1788154564.7088075, "experiment_id": "be2e1d6c", "concept_title": "FACT rounds 70–71 SYNTHESIS — THE TWO-TREE CLOSURE: Pythagorean trees sealed at four strengths; exact laws + method laws consolidated (paper 199)", "concept_domain": "Bridges", "research_mode": "team", "quality": "substantial", "quality_score": 0.87, "catalog_references": [], "prompt_length": 27554, "files_placed": 5, "status": "keep"}
{"timestamp": 1788154583.8754678, "experiment_id": "ecb169bf", "concept_title": "FACT round-72 #2/#3 — TREE-SIEVE invalid-as-stated (random-gcd lottery); MULTI-TARGET relaxation lands at trial division (papers 202–203)", "concept_domain": "Bridges", "research_mode": "team", "quality": "substantial", "quality_score": 0.86, "catalog_references": [], "prompt_length": 27185, "files_placed": 4, "status": "keep"}
{"timestamp": 1788184299.7380383, "experiment_id": "00e162eb", "concept_title": "FACT round-70 #3 — ASCENT-COST: exact branch-oracle economics; effective branching refuted; master-law mapping refuted (paper 194)", "concept_domain": "Novelty", "research_mode": "team", "quality": "substantial", "quality_score": 0.82, "catalog_references": [], "prompt_length": 27634, "files_placed": 4, "status": "keep"}
{"timestamp": 1788184319.2785854, "experiment_id": "898d17cb", "concept_title": "The floor is sharp", "concept_domain": "Physics", "research_mode": "team", "quality": "substantial", "quality_score": 0.82, "catalog_references": [], "prompt_length": 25928, "files_placed": 4, "status": "keep"}
{"timestamp": 1788184334.3270001, "experiment_id": "e8ef44c2", "concept_title": "Persistent Homology of Prime Numbers: The Topology of Arithmetic", "concept_domain": "NumberTheory", "research_mode": "team", "quality": "substantial", "quality_score": 0.82, "catalog_references": [], "prompt_length": 27210, "files_placed": 5, "status": "keep"}
{"timestamp": 1788184351.0140247, "experiment_id": "df74e96c", "concept_title": "FACT round-76 #1 — GAP-L7-FALSIFICATION (verified): L7 FALSE-IN-PRINCIPLE as drafted, replaced by L7' — extremal order = population mass-sort (window-ascending beats descending 1.58x±0.03 n=2400; sign-flip crossover E[√r]=1.1716); master inequality S ≤ (4/3)·T1-cap/Λ zero violations; wheel hits T1 law 3.741 vs 3.750; Jacobi witness dropped (algebraic degeneracy) → keyed-vs-fixed mod-3 control; paper 137 refined not contradicted (1.078× vs 1.08×); L7-a measure deployed generator tilt named next", "concept_domain": "Novelty", "research_mode": "team", "quality": "substantial", "quality_score": 0.83, "catalog_references": [], "prompt_length": 31147, "files_placed": 4, "status": "keep"}
{"timestamp": 1788206779.1160066, "experiment_id": "4467887a", "concept_title": "FACT round-70 #2 — ENERGY-ASCENT: a magnitude channel sees the Berggren branch letters; mechanism positional (paper 193)", "concept_domain": "Combinatorics", "research_mode": "team", "quality": "substantial", "quality_score": 0.85, "catalog_references": [], "prompt_length": 27602, "files_placed": 4, "status": "keep"}
{"timestamp": 1788220332.8777924, "experiment_id": "c4f754ac", "concept_title": "FACT round-73 #2 — ADAPTIVE-QS: dial predicts yield (rho 0.74-0.84) but naive reallocation loses; skip-flip wins deployment (paper 207)", "concept_domain": "Probability", "research_mode": "team", "quality": "substantial", "quality_score": 0.83, "catalog_references": [], "prompt_length": 26702, "files_placed": 5, "status": "keep"}
{"timestamp": 1788220347.9546795, "experiment_id": "2f2e652e", "concept_title": "NET-88: THE-TOKENIZER-TAX-EXPLODES — German prose at 4096 needs >56 keys (all points fail); +4 fine-step tax becomes >=+16 at long context (4x amplification)", "concept_domain": "Algebra", "research_mode": "team", "quality": "substantial", "quality_score": 0.78, "catalog_references": [], "prompt_length": 27469, "files_placed": 4, "status": "keep"}
{"timestamp": 1788220364.076717, "experiment_id": "51790419", "concept_title": "FACT round-70 #1 — TDIAL-U112: the fade continues below the band at bitlen 112 (paper 192)", "concept_domain": "Novelty", "research_mode": "team", "quality": "substantial", "quality_score": 0.79, "catalog_references": [], "prompt_length": 26693, "files_placed": 4, "status": "keep"}
{"timestamp": 1788220380.4472342, "experiment_id": "c8871952", "concept_title": "FACT round-87 #1 — MIXTURE-BASELINE (exp 588c FINAL): H0 — u*≈0.65 excess SURVIVES full divisibility mixture (amp .177±.043 z=4.11≥bar, peak t=0.65 exact, removal 0%) — composition FLAT in t, rates real but t-independent → DIVISIBILITY IS A RATE DIAL NOT A POSITION DIAL; NEW MAP ENTRY: NON-DIVISIBILITY POSITIONAL MECHANISM; chain 232→241→242 complete; CTRL-B caveat z_cal=1.53<2 disclosed; named follow-up: find the non-divisibility carrier", "concept_domain": "Shared", "research_mode": "team", "quality": "substantial", "quality_score": 0.82, "catalog_references": [], "prompt_length": 29999, "files_placed": 4, "status": "keep"}
{"timestamp": 1788239361.1965046, "experiment_id": "ed4056bf", "concept_title": "FACT round-69 #2 — TDIAL-U108: the dial drops below the band at bitlen 108 (paper 191)", "concept_domain": "Physics", "research_mode": "team", "quality": "substantial", "quality_score": 0.82, "catalog_references": [], "prompt_length": 26486, "files_placed": 4, "status": "keep"}
{"timestamp": 1788257256.6028936, "experiment_id": "1aa0b577", "concept_title": "NET-90 THE-SYMMETRIC-MIXTURE-BUMP: 50/50 code+prose costs +4 keys above BOTH pure domains — the mixing-ratio response is a bump, not a line/dip/ramp", "concept_domain": "Probability", "research_mode": "team", "quality": "substantial", "quality_score": 0.88, "catalog_references": [], "prompt_length": 27839, "files_placed": 4, "status": "keep"}
{"timestamp": 1788257276.8525238, "experiment_id": "17866175", "concept_title": "NET-89: THE-MIXED-DOMAIN-STARTS-LOW-AND-RISES-FAST — interleaved code+prose knees {12,20}: starts at code's level but rises at double the expected rate", "concept_domain": "Probability", "research_mode": "team", "quality": "substantial", "quality_score": 0.9, "catalog_references": [], "prompt_length": 27387, "files_placed": 4, "status": "keep"}
{"timestamp": 1788257296.8330991, "experiment_id": "d451fd97", "concept_title": "Backward-error semantics for floating-point chaotic programs", "concept_domain": "Novelty", "research_mode": "team", "quality": "substantial", "quality_score": 0.82, "catalog_references": [], "prompt_length": 26496, "files_placed": 4, "status": "keep"}
{"timestamp": 1788257315.6154282, "experiment_id": "26c8c1ed", "concept_title": "FACT round-68 #2 — TDIAL-U104: the fade continues at bitlen 104 (paper 189)", "concept_domain": "MachineLearning", "research_mode": "team", "quality": "substantial", "quality_score": 0.88, "catalog_references": [], "prompt_length": 26330, "files_placed": 4, "status": "keep"}
