{"timestamp": 1784454572.6453094, "experiment_id": "19a1a7a8", "concept_title": "The Poincare Conjecture for Data: Manifold Detection via Persistent Homology", "concept_domain": "Applications", "research_mode": "team", "quality": "substantial", "quality_score": 0.76, "catalog_references": [], "prompt_length": 25185, "files_placed": 8, "status": "keep"}
{"timestamp": 1784455610.2528164, "experiment_id": "2d0916f9", "concept_title": "Strange Loops: Self-Reference and G\u00f6del's Incompleteness", "concept_domain": "Applications", "research_mode": "team", "quality": "partial", "quality_score": 0.55, "catalog_references": [], "prompt_length": 3612, "files_placed": 5, "status": "keep"}
{"timestamp": 1784455617.1762106, "experiment_id": "e5cc823f", "concept_title": "Consciousness as Emergent Fixed Point", "concept_domain": "Applications", "research_mode": "team", "quality": "partial", "quality_score": 0.69, "catalog_references": [], "prompt_length": 3556, "files_placed": 5, "status": "keep"}
{"timestamp": 1784456654.1604445, "experiment_id": "1c1d1205", "concept_title": "Mind vs G\u00f6del: Can Minds Outperform Algorithms?", "concept_domain": "Applications", "research_mode": "team", "quality": "partial", "quality_score": 0.67, "catalog_references": [], "prompt_length": 3500, "files_placed": 8, "status": "keep"}
{"timestamp": 1784456664.2201023, "experiment_id": "3cc7aff9", "concept_title": "The Geometry of Consensus: Arrow's Theorem as Curvature", "concept_domain": "Shared", "research_mode": "team", "quality": "partial", "quality_score": 0.69, "catalog_references": [], "prompt_length": 6196, "files_placed": 2, "status": "keep"}
{"timestamp": 1784459750.5721092, "experiment_id": "86896469", "concept_title": "Stone Duality for Machine Learning: Neural Networks as Geometric Realizations", "concept_domain": "Novelty", "research_mode": "team", "quality": "substantial", "quality_score": 0.76, "catalog_references": [], "prompt_length": 25256, "files_placed": 8, "status": "keep"}
{"timestamp": 1784459778.51409, "experiment_id": "198023c0", "concept_title": "Isomorphisms of Meaning: When Structures Collide", "concept_domain": "Applications", "research_mode": "team", "quality": "substantial", "quality_score": 0.72, "catalog_references": [], "prompt_length": 24299, "files_placed": 10, "status": "keep"}
{"timestamp": 1784460865.347142, "experiment_id": "e170790e", "concept_title": "Social Credit Scores as Topological Invariants", "concept_domain": "Applications", "research_mode": "team", "quality": "partial", "quality_score": 0.67, "catalog_references": [], "prompt_length": 3535, "files_placed": 5, "status": "keep"}
{"timestamp": 1784461937.6321058, "experiment_id": "a9bce66e", "concept_title": "Transreal Arithmetic: Computing Beyond Plus-Minus Infinity", "concept_domain": "Applications", "research_mode": "team", "quality": "partial", "quality_score": 0.63, "catalog_references": [], "prompt_length": 10589, "files_placed": 5, "status": "keep"}
{"timestamp": 1784461955.408499, "experiment_id": "b14c422f", "concept_title": "Non-Desarguesian Worlds: Geometry Without Desargues", "concept_domain": "Applications", "research_mode": "team", "quality": "partial", "quality_score": 0.6181967213114754, "catalog_references": [], "prompt_length": 10623, "files_placed": 8, "status": "keep"}
{"timestamp": 1784461963.3787525, "experiment_id": "a88a4e5d", "concept_title": "Cellular Automata at the Ordinals: Transfinite Computation", "concept_domain": "Applications", "research_mode": "team", "quality": "partial", "quality_score": 0.6256666666666666, "catalog_references": [], "prompt_length": 11032, "files_placed": 1, "status": "keep"}
{"timestamp": 1784461968.4706318, "experiment_id": "5f462d59", "concept_title": "Surveillance Networks: Information-Theoretic Undetectability", "concept_domain": "Novelty", "research_mode": "team", "quality": "substantial", "quality_score": 0.78, "catalog_references": [], "prompt_length": 24275, "files_placed": 7, "status": "keep"}
{"timestamp": 1784463099.6541038, "experiment_id": "3603d4d1", "concept_title": "Transfinite Game Theory: Games That Last Forever", "concept_domain": "Geometry", "research_mode": "team", "quality": "partial", "quality_score": 0.5663199999999999, "catalog_references": [], "prompt_length": 10640, "files_placed": 0, "status": "keep"}
{"timestamp": 1784463104.7110436, "experiment_id": "6d1b5339", "concept_title": "Infinite-Dimensional Chess: Winning on the Hilbert Board", "concept_domain": "Applications", "research_mode": "team", "quality": "substantial", "quality_score": 0.79, "catalog_references": [], "prompt_length": 23295, "files_placed": 4, "status": "keep"}
{"timestamp": 1784474151.4098997, "experiment_id": "f0066f11", "concept_title": "Flatland Catastrophe: When 2D Physics Breaks", "concept_domain": "Novelty", "research_mode": "team", "quality": "partial", "quality_score": 0.67, "catalog_references": [], "prompt_length": 3499, "files_placed": 3, "status": "keep"}
{"timestamp": 1784474159.2401018, "experiment_id": "622eb97b", "concept_title": "Digital Immortality: Can a Mind Be Encoded?", "concept_domain": "Applications", "research_mode": "team", "quality": "partial", "quality_score": 0.69, "catalog_references": [], "prompt_length": 3534, "files_placed": 7, "status": "keep"}
{"timestamp": 1784477233.631629, "experiment_id": "2d8c7907", "concept_title": "Memory Editing: When Forgetting Is a Mathematical Operation", "concept_domain": "Applications", "research_mode": "team", "quality": "substantial", "quality_score": 0.76, "catalog_references": [], "prompt_length": 21748, "files_placed": 5, "status": "keep"}
{"timestamp": 1784477237.483422, "experiment_id": "8d3b0867", "concept_title": "Deepening: The Thermodynamics of Sorting: Entropy and Computational Work", "concept_domain": "Applications", "research_mode": "team", "quality": "substantial", "quality_score": 0.8, "catalog_references": [], "prompt_length": 20424, "files_placed": 5, "status": "keep"}
{"timestamp": 1784478263.5198598, "experiment_id": "d23a186f", "concept_title": "The Unreasonable Effectiveness of Wrong Theories", "concept_domain": "Novelty", "research_mode": "team", "quality": "partial", "quality_score": 0.69, "catalog_references": [], "prompt_length": 3510, "files_placed": 3, "status": "keep"}
{"timestamp": 1784480311.884444, "experiment_id": "d5e79e07", "concept_title": "The Topology of Impossible Objects: Escher Stairs and Klein Bottles", "concept_domain": "Applications", "research_mode": "team", "quality": "substantial", "quality_score": 0.73, "catalog_references": [], "prompt_length": 22718, "files_placed": 5, "status": "keep"}
{"timestamp": 1784481341.414822, "experiment_id": "7881a56b", "concept_title": "ArXiv paper: Reproducing the k-copwin Algorithm: Theory vs. Implementation", "concept_domain": "Novelty", "research_mode": "team", "quality": "substantial", "quality_score": 0.79, "catalog_references": [], "prompt_length": 24743, "files_placed": 5, "status": "keep"}
{"timestamp": 1784482362.0897865, "experiment_id": "32ad85ae", "concept_title": "Anti-Mathematics: What If All Axioms Were Negated?", "concept_domain": "Applications", "research_mode": "team", "quality": "partial", "quality_score": 0.67, "catalog_references": [], "prompt_length": 10697, "files_placed": 6, "status": "keep"}
{"timestamp": 1784482370.2905912, "experiment_id": "cf6c2cd9", "concept_title": "Surreal Topology: Open Sets at Infinity", "concept_domain": "Applications", "research_mode": "team", "quality": "substantial", "quality_score": 0.79, "catalog_references": [], "prompt_length": 23362, "files_placed": 8, "status": "keep"}
{"timestamp": 1784483400.1259837, "experiment_id": "25709a4b", "concept_title": "Retrocausal Mathematics: Where Effects Precede Causes", "concept_domain": "Applications", "research_mode": "team", "quality": "partial", "quality_score": 0.58, "catalog_references": [], "prompt_length": 3544, "files_placed": 6, "status": "keep"}
{"timestamp": 1784486473.9122531, "experiment_id": "d0217292", "concept_title": "Negative-Dimensional Topology: What Lives in Dimension -1?", "concept_domain": "Novelty", "research_mode": "team", "quality": "substantial", "quality_score": 0.73, "catalog_references": [], "prompt_length": 24279, "files_placed": 4, "status": "keep"}
{"timestamp": 1784489569.0374413, "experiment_id": "961be33a", "concept_title": "Categorical Physics: The Shape of a Theory of Everything", "concept_domain": "Applications", "research_mode": "team", "quality": "partial", "quality_score": 0.61, "catalog_references": [], "prompt_length": 3599, "files_placed": 7, "status": "keep"}
{"timestamp": 1784491715.5298703, "experiment_id": "4c40ce69", "concept_title": "Counterfactual Number Theory: What If Primes Were Random?", "concept_domain": "Novelty", "research_mode": "team", "quality": "substantial", "quality_score": 0.7, "catalog_references": [], "prompt_length": 22667, "files_placed": 8, "status": "keep"}
{"timestamp": 1784491719.549386, "experiment_id": "af530f4e", "concept_title": "Hypercomputation: Computing the Uncomputable", "concept_domain": "Novelty", "research_mode": "team", "quality": "substantial", "quality_score": 0.77, "catalog_references": [], "prompt_length": 24284, "files_placed": 9, "status": "keep"}
{"timestamp": 1784492754.5932384, "experiment_id": "238d5b60", "concept_title": "Aleph-1 Surface: Geometry Between Dimensions", "concept_domain": "Applications", "research_mode": "team", "quality": "substantial", "quality_score": 0.76, "catalog_references": [], "prompt_length": 23886, "files_placed": 9, "status": "keep"}
{"timestamp": 1784492782.1168566, "experiment_id": "9fc00121", "concept_title": "Computational Complexity of Alien Civilizations", "concept_domain": "Novelty", "research_mode": "team", "quality": "substantial", "quality_score": 0.77, "catalog_references": [], "prompt_length": 24315, "files_placed": 8, "status": "keep"}
{"timestamp": 1784492797.6484876, "experiment_id": "7286e7be", "concept_title": "Dream Logic: Non-Monotone Reasoning Where Contradictions Coexist", "concept_domain": "Novelty", "research_mode": "team", "quality": "substantial", "quality_score": 0.74, "catalog_references": [], "prompt_length": 24272, "files_placed": 9, "status": "keep"}
{"timestamp": 1784493852.4453871, "experiment_id": "3dea732a", "concept_title": "Time Travel Consistency: Novikov's Principle as a Fixed-Point Theorem", "concept_domain": "Applications", "research_mode": "team", "quality": "substantial", "quality_score": 0.78, "catalog_references": [], "prompt_length": 24270, "files_placed": 9, "status": "keep"}
{"timestamp": 1784498566.020855, "experiment_id": "93551ae8", "concept_title": "ArXiv paper: On strongly regular signed graphs of higher girth", "concept_domain": "Applications", "research_mode": "team", "quality": "partial", "quality_score": 0.65, "catalog_references": [], "prompt_length": 4360, "files_placed": 10, "status": "keep"}
{"timestamp": 1784498571.4198732, "experiment_id": "c231497c", "concept_title": "Quantum Proofs of Classical Theorems", "concept_domain": "Applications", "research_mode": "team", "quality": "partial", "quality_score": 0.69, "catalog_references": [], "prompt_length": 10273, "files_placed": 4, "status": "keep"}
{"timestamp": 1784498594.4256032, "experiment_id": "cb3d5d14", "concept_title": "Self-Modifying Code That Cannot Be Stopped", "concept_domain": "Novelty", "research_mode": "team", "quality": "substantial", "quality_score": 0.8, "catalog_references": [], "prompt_length": 24299, "files_placed": 15, "status": "keep"}
{"timestamp": 1784499627.7247705, "experiment_id": "14bbfbeb", "concept_title": "Fermat Near-Misses in the Twilight Zone", "concept_domain": "Novelty", "research_mode": "team", "quality": "partial", "quality_score": 0.62, "catalog_references": [], "prompt_length": 3479, "files_placed": 3, "status": "keep"}
{"timestamp": 1784500717.9162657, "experiment_id": "606f7bdd", "concept_title": "Zombies and Qualia: Mathematics of Subjective Experience", "concept_domain": "Applications", "research_mode": "team", "quality": "substantial", "quality_score": 0.73, "catalog_references": [], "prompt_length": 24327, "files_placed": 13, "status": "keep"}
{"timestamp": 1784502823.5692532, "experiment_id": "671e7568", "concept_title": "The Oracle's Burden: How Much Knowledge Is Too Much?", "concept_domain": "Applications", "research_mode": "team", "quality": "partial", "quality_score": 0.67, "catalog_references": [], "prompt_length": 3608, "files_placed": 10, "status": "keep"}
{"timestamp": 1784503868.0614252, "experiment_id": "00cf3210", "concept_title": "Rainbow Arithmetic Progression Threshold Conjecture", "concept_domain": "Probability", "research_mode": "team", "quality": "partial", "quality_score": 0.6, "catalog_references": ["Jungi\u0107, V., Licht, M., Mahdian, M., Ne\u0161et\u0159il, J., Radoi\u010di\u0107, R. (2007). Avoiding rainbow triangles in edge colored complete graphs. Combinatorica, 27(2), 211-224.", "Conlon, D., Fox, J., Sudakov, B. (2015). Ramsey numbers of graphs with bounded chromatic number. Combinatorica, 35(2), 155-174.", "Balogh, J., Linz, M., Mattos, L. (2015). Bounds on multipartite Ramsey numbers. Electronic Journal of Combinatorics, 22(1), P1.10.", "Bollob\u00e1s, B. (1986). Combinatorics: Set Systems, Hypergraphs, Posets, and Probabilities. Cambridge University Press."], "prompt_length": 11231, "files_placed": 2, "status": "keep"}
{"timestamp": 1784503877.660845, "experiment_id": "ca6fc5a2", "concept_title": "Paradoxes as Theorems: Liar, Berry, and Russell Made Consistent", "concept_domain": "Applications", "research_mode": "team", "quality": "substantial", "quality_score": 0.72, "catalog_references": [], "prompt_length": 24327, "files_placed": 5, "status": "keep"}
{"timestamp": 1784506994.2631652, "experiment_id": "28042806", "concept_title": "Speculative: Mathematics as a Phase Transition", "concept_domain": "Physics", "research_mode": "team", "quality": "partial", "quality_score": 0.56, "catalog_references": [], "prompt_length": 3997, "files_placed": 2, "status": "keep"}
{"timestamp": 1784507006.9818094, "experiment_id": "65e81f6c", "concept_title": "Borges' Library of Babel: Combinatorics of Everything", "concept_domain": "Geometry", "research_mode": "team", "quality": "substantial", "quality_score": 0.8, "catalog_references": [], "prompt_length": 22748, "files_placed": 12, "status": "keep"}
{"timestamp": 1784507010.709905, "experiment_id": "27f58424", "concept_title": "Close Proofs: Self-Modifying Code That Cannot Be Stopped", "concept_domain": "Cryptography", "research_mode": "team", "quality": "substantial", "quality_score": 0.82, "catalog_references": [], "prompt_length": 23038, "files_placed": 5, "status": "keep"}
{"timestamp": 1784508064.9528556, "experiment_id": "c930e14b", "concept_title": "Infinite Games Against Death: Immortality Strategies", "concept_domain": "Algebra", "research_mode": "team", "quality": "substantial", "quality_score": 0.71, "catalog_references": [], "prompt_length": 24280, "files_placed": 12, "status": "keep"}
{"timestamp": 1784512218.190899, "experiment_id": "e3086657", "concept_title": "The Mega-Sphere: All Dimensions at Once", "concept_domain": "Algebra", "research_mode": "team", "quality": "partial", "quality_score": 0.68, "catalog_references": [], "prompt_length": 10610, "files_placed": 2, "status": "keep"}
{"timestamp": 1784512229.1669354, "experiment_id": "0cd9c194", "concept_title": "Speculative: Theorems as Phase Transitions in Proof Space", "concept_domain": "Combinatorics", "research_mode": "team", "quality": "partial", "quality_score": 0.69, "catalog_references": [], "prompt_length": 11041, "files_placed": 10, "status": "keep"}
{"timestamp": 1784513283.6602614, "experiment_id": "8797684d", "concept_title": "Speculative: Mathematics as an Evolving Ecosystem", "concept_domain": "MachineLearning", "research_mode": "team", "quality": "partial", "quality_score": 0.67, "catalog_references": [], "prompt_length": 3819, "files_placed": 7, "status": "keep"}
{"timestamp": 1784513292.0922976, "experiment_id": "b3f0d755", "concept_title": "Causal Loops in Category Theory: When Composition Loops Back", "concept_domain": "Cryptography", "research_mode": "team", "quality": "substantial", "quality_score": 0.75, "catalog_references": [], "prompt_length": 24307, "files_placed": 4, "status": "keep"}
{"timestamp": 1784513299.1186917, "experiment_id": "c1b3f8da", "concept_title": "ArXiv paper: On Small Doubling in Right-Ordered Groups and Baumslag-Solitar Groups-II", "concept_domain": "Pythagorean", "research_mode": "team", "quality": "substantial", "quality_score": 0.74, "catalog_references": [], "prompt_length": 24730, "files_placed": 13, "status": "keep"}
{"timestamp": 1784516527.4761508, "experiment_id": "d4bc25af", "concept_title": "ArXiv paper: Efficient Hamilton covers and linear arboricity of random graphs", "concept_domain": "Logic", "research_mode": "team", "quality": "partial", "quality_score": 0.65, "catalog_references": [], "prompt_length": 5178, "files_placed": 10, "status": "keep"}
{"timestamp": 1784518514.828653, "experiment_id": "b44b7357", "concept_title": "Speculative: Consciousness as Fixed Points of Recursive Type Theory", "concept_domain": "Novelty", "research_mode": "team", "quality": "substantial", "quality_score": 0.75, "catalog_references": [], "prompt_length": 24449, "files_placed": 12, "status": "keep"}
{"timestamp": 1784518518.7081366, "experiment_id": "ea7d1cf2", "concept_title": "Speculative: Topological Quantum Error Correction from Mathematical Structures", "concept_domain": "NumberTheory", "research_mode": "team", "quality": "substantial", "quality_score": 0.71, "catalog_references": [], "prompt_length": 24382, "files_placed": 11, "status": "keep"}
{"timestamp": 1784526540.3309019, "experiment_id": "e3542946", "concept_title": "Speculative: Computational Complexity as Physical Law", "concept_domain": "MachineLearning", "research_mode": "team", "quality": "substantial", "quality_score": 0.78, "catalog_references": [], "prompt_length": 24406, "files_placed": 1, "status": "keep"}
{"timestamp": 1784540503.3776097, "experiment_id": "50f62832", "concept_title": "Speculative: Number Theory as Music Theory", "concept_domain": "Bridges", "research_mode": "team", "quality": "partial", "quality_score": 0.68, "catalog_references": [], "prompt_length": 10924, "files_placed": 17, "status": "keep"}
{"timestamp": 1784540509.5549943, "experiment_id": "955187b3", "concept_title": "The Mega-Sphere: All Dimensions at Once", "concept_domain": "Novelty", "research_mode": "team", "quality": "partial", "quality_score": 0.68, "catalog_references": [], "prompt_length": 3495, "files_placed": 10, "status": "keep"}
{"timestamp": 1784540515.1880493, "experiment_id": "dd6a308e", "concept_title": "Deepening: ArXiv paper: Reproducing the k-copwin Algorithm: Theory vs. Implementation", "concept_domain": "Pythagorean", "research_mode": "team", "quality": "substantial", "quality_score": 0.79, "catalog_references": [], "prompt_length": 24532, "files_placed": 8, "status": "keep"}
{"timestamp": 1784540520.142474, "experiment_id": "d14aad94", "concept_title": "Speculative: Proof Complexity and Thermodynamic Cost", "concept_domain": "MachineLearning", "research_mode": "team", "quality": "substantial", "quality_score": 0.71, "catalog_references": [], "prompt_length": 24419, "files_placed": 7, "status": "keep"}
{"timestamp": 1784540542.6433218, "experiment_id": "79f58a3a", "concept_title": "Speculative: Category Theory as the DNA of Mathematics", "concept_domain": "Logic", "research_mode": "team", "quality": "substantial", "quality_score": 0.72, "catalog_references": [], "prompt_length": 24443, "files_placed": 14, "status": "keep"}
{"timestamp": 1784560168.949486, "experiment_id": "d87f0198", "concept_title": "The Oracle's Burden: How Much Knowledge Is Too Much?", "concept_domain": "Computation", "research_mode": "team", "quality": "partial", "quality_score": 0.69, "catalog_references": [], "prompt_length": 10330, "files_placed": 15, "status": "keep"}
{"timestamp": 1784560175.7926166, "experiment_id": "e3b4f2fe", "concept_title": "Speculative: Topological Data Analysis of Theorem Networks", "concept_domain": "Shared", "research_mode": "team", "quality": "substantial", "quality_score": 0.75, "catalog_references": [], "prompt_length": 24437, "files_placed": 15, "status": "keep"}
{"timestamp": 1784560180.102056, "experiment_id": "fd569acd", "concept_title": "Borges' Library of Babel: Combinatorics of Everything", "concept_domain": "Bridges", "research_mode": "team", "quality": "substantial", "quality_score": 0.76, "catalog_references": [], "prompt_length": 23657, "files_placed": 9, "status": "keep"}
{"timestamp": 1784580501.347979, "experiment_id": "d0cb2642", "concept_title": "Deepening: Godel's Casino: Incomplete but Winnable Games", "concept_domain": "NumberTheory", "research_mode": "team", "quality": "substantial", "quality_score": 0.78, "catalog_references": [], "prompt_length": 23287, "files_placed": 5, "status": "keep"}
{"timestamp": 1784580505.6110039, "experiment_id": "4505be0f", "concept_title": "Deepening: Quantum Random Walks on Cayley Graphs: Spectral Gaps and Mixing Times", "concept_domain": "Combinatorics", "research_mode": "team", "quality": "substantial", "quality_score": 0.77, "catalog_references": [], "prompt_length": 21711, "files_placed": 4, "status": "keep"}
{"timestamp": 1784580511.1896505, "experiment_id": "2f321176", "concept_title": "Speculative: Mathematics as a Phase Transition", "concept_domain": "NumberTheory", "research_mode": "team", "quality": "substantial", "quality_score": 0.7, "catalog_references": [], "prompt_length": 24512, "files_placed": 4, "status": "keep"}
