{"timestamp": 1785758099.1783667, "experiment_id": "2125bb42", "concept_title": "The accompanying Lean development settles the operator-algebraic core used by", "concept_domain": "Combinatorics", "research_mode": "team", "quality": "substantial", "quality_score": 0.71783, "catalog_references": [], "prompt_length": 26283, "files_placed": 4, "status": "keep"}
{"timestamp": 1785758103.9217887, "experiment_id": "1343d96e", "concept_title": "Deepening: Stereographic Capacity Theory: Packing Bounds on Spheres via Plane Geometry", "concept_domain": "NumberTheory", "research_mode": "team", "quality": "partial", "quality_score": 0.65648, "catalog_references": [], "prompt_length": 3169, "files_placed": 2, "status": "keep"}
{"timestamp": 1785770739.2461183, "experiment_id": "f7f562cc", "concept_title": "Random Graphs: Erd\u0151s-R\u00e9nyi Threshold Phenomena", "concept_domain": "Probability", "research_mode": "prove", "quality": "substantial", "quality_score": 0.78272, "catalog_references": [], "prompt_length": 24436, "files_placed": 4, "status": "keep"}
{"timestamp": 1785770829.2902553, "experiment_id": "a60d1c49", "concept_title": "ML Attention Mechanism: Formal Properties of Transformers", "concept_domain": "MachineLearning", "research_mode": "team", "quality": "substantial", "quality_score": 0.78167, "catalog_references": [], "prompt_length": 21659, "files_placed": 4, "status": "keep"}
{"timestamp": 1785770919.0934584, "experiment_id": "38046e56", "concept_title": "Knot-Jones: Quantum Group Verification of Khovanov Invariants", "concept_domain": "Geometry", "research_mode": "team", "quality": "substantial", "quality_score": 0.77922, "catalog_references": [], "prompt_length": 21447, "files_placed": 4, "status": "keep"}
{"timestamp": 1785778250.8860831, "experiment_id": "e4843e14", "concept_title": "1. **Mixed-area B\u00e9zout.** For two balanced plane tropical curves whose Newton po", "concept_domain": "Algebra", "research_mode": "team", "quality": "substantial", "quality_score": 0.7439399999999999, "catalog_references": [], "prompt_length": 20230, "files_placed": 4, "status": "keep"}
{"timestamp": 1785778341.0363631, "experiment_id": "eb6ff95e", "concept_title": "Quantum Information: No-Cloning and Teleportation", "concept_domain": "Computation", "research_mode": "prove", "quality": "substantial", "quality_score": 0.7944100000000001, "catalog_references": [], "prompt_length": 22822, "files_placed": 4, "status": "keep"}
{"timestamp": 1785793133.388511, "experiment_id": "92412bd6", "concept_title": "Deepening: Game of Life Universality", "concept_domain": "Novelty", "research_mode": "team", "quality": "partial", "quality_score": 0.686, "catalog_references": [], "prompt_length": 2816, "files_placed": 2, "status": "keep"}
{"timestamp": 1785793198.3173723, "experiment_id": "18ab6902", "concept_title": "ArXiv paper: Sufficient conditions for $(K_2 \\cup kK_1)$-free graphs to be Hamilton-connected", "concept_domain": "Bridges", "research_mode": "team", "quality": "substantial", "quality_score": 0.72693, "catalog_references": [], "prompt_length": 22427, "files_placed": 4, "status": "keep"}
{"timestamp": 1785793260.8872454, "experiment_id": "60e2b23a", "concept_title": "Deepening: Percolation Threshold", "concept_domain": "Probability", "research_mode": "team", "quality": "substantial", "quality_score": 0.72259, "catalog_references": [], "prompt_length": 21474, "files_placed": 4, "status": "keep"}
{"timestamp": 1785799666.3103733, "experiment_id": "c0621a16", "concept_title": "Twin Prime Gaps: Zhang-Maynard Formalization", "concept_domain": "Novelty", "research_mode": "prove", "quality": "partial", "quality_score": 0.686, "catalog_references": [], "prompt_length": 2233, "files_placed": 3, "status": "keep"}
{"timestamp": 1785799728.7225845, "experiment_id": "f8e43caa", "concept_title": "Grokking: Phase Transitions in Learning", "concept_domain": "MachineLearning", "research_mode": "team", "quality": "substantial", "quality_score": 0.77257, "catalog_references": [], "prompt_length": 22286, "files_placed": 4, "status": "keep"}
{"timestamp": 1785799791.9929142, "experiment_id": "28c84414", "concept_title": "Deepening: Bridge: Category Theory as Universal Language for Mathematics", "concept_domain": "Shared", "research_mode": "team", "quality": "substantial", "quality_score": 0.73729, "catalog_references": [], "prompt_length": 21719, "files_placed": 4, "status": "keep"}
{"timestamp": 1785799854.9845614, "experiment_id": "8fa54bf5", "concept_title": "Tropical Convexity and Helly Theorem", "concept_domain": "Tropical", "research_mode": "team", "quality": "substantial", "quality_score": 0.7597999999999998, "catalog_references": [], "prompt_length": 24391, "files_placed": 4, "status": "keep"}
{"timestamp": 1785806369.5510035, "experiment_id": "87f6aef5", "concept_title": "Zero-Knowledge Proof Systems: Formal Verification of Privacy", "concept_domain": "Shared", "research_mode": "team", "quality": "substantial", "quality_score": 0.76207, "catalog_references": [], "prompt_length": 22929, "files_placed": 4, "status": "keep"}
{"timestamp": 1785806458.8893185, "experiment_id": "bae1175e", "concept_title": "Close Proofs: The Fractal Dimension of Mathematical Truth", "concept_domain": "Combinatorics", "research_mode": "team", "quality": "substantial", "quality_score": 0.7559799999999999, "catalog_references": [], "prompt_length": 24541, "files_placed": 4, "status": "keep"}
{"timestamp": 1785815132.2487447, "experiment_id": "94d22408", "concept_title": "Existence of Hilbert class fields.: For every number field `K`, construct", "concept_domain": "Pythagorean", "research_mode": "team", "quality": "substantial", "quality_score": 0.7906299999999999, "catalog_references": [], "prompt_length": 27453, "files_placed": 4, "status": "keep"}
{"timestamp": 1785826116.5775707, "experiment_id": "a5f7aac5", "concept_title": "Deepening: Hilbert 12: Kronecker-Weber Generalization", "concept_domain": "NumberTheory", "research_mode": "team", "quality": "partial", "quality_score": 0.6853135011441648, "catalog_references": [], "prompt_length": 2573, "files_placed": 62, "status": "keep"}
{"timestamp": 1785846379.0634484, "experiment_id": "1ed3fd3a", "concept_title": "**Conjecture.** There is an absolute constant `c > 0` such that every sufficient", "concept_domain": "Computation", "research_mode": "team", "quality": "partial", "quality_score": 0.686, "catalog_references": [], "prompt_length": 9686, "files_placed": 3, "status": "keep"}
{"timestamp": 1785846470.1429386, "experiment_id": "a65c164b", "concept_title": "Homological Algebra: Derived Functors", "concept_domain": "Algebra", "research_mode": "prove", "quality": "substantial", "quality_score": 0.78643, "catalog_references": [], "prompt_length": 26003, "files_placed": 4, "status": "keep"}
{"timestamp": 1785858136.9691172, "experiment_id": "6ef351e2", "concept_title": "Proof-Theoretic Bridge: Ordinal Analysis Across Systems", "concept_domain": "Bridges", "research_mode": "team", "quality": "partial", "quality_score": 0.686, "catalog_references": [], "prompt_length": 2231, "files_placed": 5, "status": "keep"}
{"timestamp": 1785874065.862441, "experiment_id": "3652ac9b", "concept_title": "ArXiv paper: Learning the Graphical Nature of Symmetries", "concept_domain": "Algebra", "research_mode": "team", "quality": "partial", "quality_score": 0.686, "catalog_references": [], "prompt_length": 4231, "files_placed": 53, "status": "keep"}
{"timestamp": 1785874129.642306, "experiment_id": "6337dbc1", "concept_title": "Deepening: Topological-Algebraic Bridge: Fundamental Group as a Complete Invariant", "concept_domain": "Bridges", "research_mode": "team", "quality": "substantial", "quality_score": 0.78433, "catalog_references": [], "prompt_length": 26308, "files_placed": 4, "status": "keep"}
{"timestamp": 1785885931.2803578, "experiment_id": "52522972", "concept_title": "Isogeny-Based Cryptography: Supersingular Isogeny Diffie-Hellman", "concept_domain": "Cryptography", "research_mode": "team", "quality": "partial", "quality_score": 0.686, "catalog_references": [], "prompt_length": 2599, "files_placed": 65, "status": "keep"}
{"timestamp": 1785885937.4652615, "experiment_id": "1d44d635", "concept_title": "ArXiv paper: Roman-Type Domination on Convex and Chordal Bipartite Graphs: Algorithms and Hardness", "concept_domain": "Geometry", "research_mode": "team", "quality": "partial", "quality_score": 0.686, "catalog_references": [], "prompt_length": 4451, "files_placed": 6, "status": "keep"}
{"timestamp": 1785885944.860868, "experiment_id": "8d083ef6", "concept_title": "**Conjecture.** For a nonuniform distribution on finite network histories and an", "concept_domain": "Applications", "research_mode": "team", "quality": "partial", "quality_score": 0.686, "catalog_references": [], "prompt_length": 11470, "files_placed": 3, "status": "keep"}
{"timestamp": 1785885949.823508, "experiment_id": "a08998f9", "concept_title": "1. **Catalog-level CGMS input.** For the catalog's eventual diagonal Ramsey-numb", "concept_domain": "Combinatorics", "research_mode": "team", "quality": "partial", "quality_score": 0.686, "catalog_references": [], "prompt_length": 6139, "files_placed": 2, "status": "keep"}
{"timestamp": 1785901275.6151047, "experiment_id": "3a707635", "concept_title": "EML Differential Equations: ODEs with Exponential-Logarithmic Coefficients", "concept_domain": "Applications", "research_mode": "team", "quality": "substantial", "quality_score": 0.7555699999999999, "catalog_references": [], "prompt_length": 26146, "files_placed": 5, "status": "keep"}
{"timestamp": 1785901280.5764446, "experiment_id": "f993c4fa", "concept_title": "This project formalizes, in Lean 4 (Mathlib), the quantitative and logical core", "concept_domain": "Physics", "research_mode": "team", "quality": "partial", "quality_score": 0.686, "catalog_references": [], "prompt_length": 10963, "files_placed": 8, "status": "keep"}
{"timestamp": 1785912572.096646, "experiment_id": "caed44fe", "concept_title": "`Catalog/Bridges/GraphTheory/K2UnionIndependentFree.lean` now gives a self-conta", "concept_domain": "Combinatorics", "research_mode": "team", "quality": "partial", "quality_score": 0.686, "catalog_references": [], "prompt_length": 6738, "files_placed": 8, "status": "keep"}
{"timestamp": 1785912665.1002047, "experiment_id": "6077433a", "concept_title": "ArXiv paper: Magnitude homology of tope graphs", "concept_domain": "Geometry", "research_mode": "team", "quality": "substantial", "quality_score": 0.78776, "catalog_references": [], "prompt_length": 26484, "files_placed": 4, "status": "keep"}
{"timestamp": 1785912759.3828564, "experiment_id": "6ffc84c2", "concept_title": "1. **Finite-key probability formula.** For every finite type `V`, independent", "concept_domain": "Combinatorics", "research_mode": "team", "quality": "substantial", "quality_score": 0.7892299999999999, "catalog_references": [], "prompt_length": 26969, "files_placed": 4, "status": "keep"}
{"timestamp": 1785912854.0740738, "experiment_id": "e9c14674", "concept_title": "ArXiv paper: Gilbert's disc model conditioned on the square lattice", "concept_domain": "Shared", "research_mode": "team", "quality": "substantial", "quality_score": 0.78349, "catalog_references": [], "prompt_length": 26690, "files_placed": 5, "status": "keep"}
{"timestamp": 1785912948.3264878, "experiment_id": "5357ee14", "concept_title": "**Conjecture.** Every finite sequence of signed-literal revisions has a unique n", "concept_domain": "Shared", "research_mode": "team", "quality": "substantial", "quality_score": 0.79609, "catalog_references": [], "prompt_length": 29145, "files_placed": 4, "status": "keep"}
{"timestamp": 1785912953.636697, "experiment_id": "6a4657f8", "concept_title": "Zero-Knowledge Proofs in Lean: Verifiable Computation", "concept_domain": "Shared", "research_mode": "team", "quality": "partial", "quality_score": 0.686, "catalog_references": [], "prompt_length": 2587, "files_placed": 5, "status": "keep"}
{"timestamp": 1785923812.844036, "experiment_id": "f96004ff", "concept_title": "Let a compact smooth submanifold have reach at least `\u03c4`, and let a finite sampl", "concept_domain": "Bridges", "research_mode": "team", "quality": "partial", "quality_score": 0.686, "catalog_references": [], "prompt_length": 10283, "files_placed": 14, "status": "keep"}
{"timestamp": 1785923821.7262425, "experiment_id": "a6a59cd3", "concept_title": "ArXiv paper: Hardness of Vertex Splitting: Cographs, Chordal Graphs, and Beyond", "concept_domain": "Bridges", "research_mode": "team", "quality": "partial", "quality_score": 0.686, "catalog_references": [], "prompt_length": 4057, "files_placed": 13, "status": "keep"}
{"timestamp": 1785923832.2374804, "experiment_id": "9f23a455", "concept_title": "Zero-Knowledge Proofs: Schnorr Protocol", "concept_domain": "Cryptography", "research_mode": "prove", "quality": "partial", "quality_score": 0.686, "catalog_references": [], "prompt_length": 2212, "files_placed": 5, "status": "keep"}
{"timestamp": 1785932659.515739, "experiment_id": "d9d67aec", "concept_title": "ArXiv paper: Asymptotic Brill-Noether Existence at the Half-Canonical Degree: Energy Pairing, Cheeger Inequality and Covering Radii", "concept_domain": "Pythagorean", "research_mode": "team", "quality": "partial", "quality_score": 0.686, "catalog_references": [], "prompt_length": 4586, "files_placed": 11, "status": "keep"}
{"timestamp": 1785932665.2567067, "experiment_id": "8fa60fb0", "concept_title": "The conditional Hilbert-class-field interface in `Catalog/NumberTheory/` contain", "concept_domain": "NumberTheory", "research_mode": "team", "quality": "partial", "quality_score": 0.686, "catalog_references": [], "prompt_length": 10790, "files_placed": 4, "status": "keep"}
{"timestamp": 1785932758.3930385, "experiment_id": "8dd43c13", "concept_title": "EML-Activation-Monotonicity: Global Convexity Conditions for EML Transcendentals", "concept_domain": "Applications", "research_mode": "team", "quality": "substantial", "quality_score": 0.79294, "catalog_references": [], "prompt_length": 25813, "files_placed": 4, "status": "keep"}
{"timestamp": 1785932764.164224, "experiment_id": "f14ecb01", "concept_title": "Deepening: Random Graphs: Erd\u0151s-R\u00e9nyi Threshold Phenomena", "concept_domain": "Probability", "research_mode": "team", "quality": "partial", "quality_score": 0.686, "catalog_references": [], "prompt_length": 2675, "files_placed": 10, "status": "keep"}
{"timestamp": 1785932769.7550368, "experiment_id": "2d9904f9", "concept_title": "1. **Full CKW inequality.** For every normalized pure three-qubit amplitude tens", "concept_domain": "Combinatorics", "research_mode": "team", "quality": "partial", "quality_score": 0.686, "catalog_references": [], "prompt_length": 5192, "files_placed": 2, "status": "keep"}
{"timestamp": 1785941466.2883978, "experiment_id": "3664af53", "concept_title": "ArXiv paper: Asymptotically sharp bounds for affine subspace statistics in $\\mathbb F_2^n$", "concept_domain": "Applications", "research_mode": "team", "quality": "partial", "quality_score": 0.686, "catalog_references": [], "prompt_length": 4418, "files_placed": 6, "status": "keep"}
{"timestamp": 1785941474.015275, "experiment_id": "b369f029", "concept_title": "Combinatorial-Categorical Bridge: Species of Structures as Functors", "concept_domain": "Bridges", "research_mode": "team", "quality": "partial", "quality_score": 0.686, "catalog_references": [], "prompt_length": 2606, "files_placed": 16, "status": "keep"}
{"timestamp": 1785941481.8908134, "experiment_id": "52648a00", "concept_title": "ArXiv paper: On the maximum size of $B_3$-free families", "concept_domain": "Bridges", "research_mode": "team", "quality": "partial", "quality_score": 0.686, "catalog_references": [], "prompt_length": 3985, "files_placed": 4, "status": "keep"}
{"timestamp": 1785941489.4366896, "experiment_id": "7c424175", "concept_title": "Deepening: ArXiv paper: Gilbert's disc model conditioned on the square lattice", "concept_domain": "Shared", "research_mode": "team", "quality": "partial", "quality_score": 0.686, "catalog_references": [], "prompt_length": 3084, "files_placed": 5, "status": "keep"}
{"timestamp": 1785941495.2497895, "experiment_id": "2e6f6f76", "concept_title": "Deepening: Lattice Cryptography: LWE Hardness", "concept_domain": "Cryptography", "research_mode": "team", "quality": "partial", "quality_score": 0.686, "catalog_references": [], "prompt_length": 2683, "files_placed": 4, "status": "keep"}
{"timestamp": 1785949346.6535134, "experiment_id": "63e5c24f", "concept_title": "ArXiv paper: Finding Nearly-Periodic Components in Digraphs and Markov Chains from the Spectrum of Rotated Laplacian Matrices", "concept_domain": "Computation", "research_mode": "team", "quality": "substantial", "quality_score": 0.7934299999999999, "catalog_references": [], "prompt_length": 27073, "files_placed": 4, "status": "keep"}
{"timestamp": 1785949353.3896375, "experiment_id": "36894b52", "concept_title": "These conjectures are derived from the results proved this cycle in", "concept_domain": "Logic", "research_mode": "team", "quality": "partial", "quality_score": 0.686, "catalog_references": [], "prompt_length": 11029, "files_placed": 6, "status": "keep"}
{"timestamp": 1785949358.5453823, "experiment_id": "70c10cae", "concept_title": "ArXiv paper: Quantum determinants in polynomial time", "concept_domain": "Physics", "research_mode": "team", "quality": "partial", "quality_score": 0.686, "catalog_references": [], "prompt_length": 3461, "files_placed": 3, "status": "keep"}
{"timestamp": 1785956605.1741836, "experiment_id": "069d69dc", "concept_title": "**Conjecture.** For every finite connected two-dimensional cell complex and ever", "concept_domain": "Geometry", "research_mode": "team", "quality": "partial", "quality_score": 0.686, "catalog_references": [], "prompt_length": 9234, "files_placed": 6, "status": "keep"}
{"timestamp": 1785956619.889989, "experiment_id": "018a4d2d", "concept_title": "Dense Sets Without Large Sumsets", "concept_domain": "Bridges", "research_mode": "team", "quality": "partial", "quality_score": 0.686, "catalog_references": ["Hernandez and Hetzel's recent result on sharp bounds", "Kra, Moreira, Richter, and Robertson's original conjecture"], "prompt_length": 2659, "files_placed": 10, "status": "keep"}
{"timestamp": 1785963291.8088648, "experiment_id": "08d2b371", "concept_title": "Deepening: Topological-Algebraic Bridge: Fundamental Group as a Complete Invariant", "concept_domain": "Bridges", "research_mode": "team", "quality": "substantial", "quality_score": 0.79196, "catalog_references": [], "prompt_length": 26359, "files_placed": 4, "status": "keep"}
{"timestamp": 1785968951.4042351, "experiment_id": "0763cd86", "concept_title": "Future directions from cycle 4be361b7", "concept_domain": "Computation", "research_mode": "team", "quality": "partial", "quality_score": 0.686, "catalog_references": [], "prompt_length": 4707, "files_placed": 66, "status": "keep"}
{"timestamp": 1785968957.230081, "experiment_id": "5b6f1a1d", "concept_title": "All formal results live in four files, which together compile with no `sorry` an", "concept_domain": "Geometry", "research_mode": "team", "quality": "partial", "quality_score": 0.686, "catalog_references": [], "prompt_length": 22275, "files_placed": 8, "status": "keep"}
{"timestamp": 1785968961.8468003, "experiment_id": "f52c2f13", "concept_title": "Deepening: **Conjecture.** Every finite sequence of signed-literal revisions has a unique n", "concept_domain": "Shared", "research_mode": "team", "quality": "partial", "quality_score": 0.686, "catalog_references": [], "prompt_length": 3161, "files_placed": 2, "status": "keep"}
{"timestamp": 1785969027.3434005, "experiment_id": "785c09ab", "concept_title": "**Conjecture.** Every normalized, translation-equivariant, coordinatewise-minimu", "concept_domain": "Tropical", "research_mode": "team", "quality": "substantial", "quality_score": 0.7857999999999999, "catalog_references": [], "prompt_length": 29670, "files_placed": 4, "status": "keep"}
{"timestamp": 1785975487.741514, "experiment_id": "fc0b5c3a", "concept_title": "Existence of \u03b4\u2011dense sets avoiding large sumsets", "concept_domain": "Bridges", "research_mode": "team", "quality": "partial", "quality_score": 0.686, "catalog_references": ["Kra, Moreira, Richter, Robertson 2025, Conjecture 4.10", "Hern\u00e1ndez & Hetzel 2026, sharpness of sumset bounds", "Moreira 2019, proof of Erd\u0151s conjecture via ergodic theory"], "prompt_length": 2755, "files_placed": 11, "status": "keep"}
{"timestamp": 1785975493.3814209, "experiment_id": "10a6c20b", "concept_title": "Speculative: Tropical Mathematics of Social Choice", "concept_domain": "Probability", "research_mode": "team", "quality": "partial", "quality_score": 0.686, "catalog_references": [], "prompt_length": 2778, "files_placed": 9, "status": "keep"}
{"timestamp": 1785987876.685406, "experiment_id": "b20da64b", "concept_title": "Integrated Information via Tensor Networks", "concept_domain": "Novelty", "research_mode": "team", "quality": "partial", "quality_score": 0.686, "catalog_references": [], "prompt_length": 2580, "files_placed": 12, "status": "keep"}
{"timestamp": 1785987883.4608397, "experiment_id": "716ebed1", "concept_title": "Deepening: Moonshot: Brain-Computer Interface Mathematics \u2014 Neural Coding Theorems", "concept_domain": "Novelty", "research_mode": "team", "quality": "partial", "quality_score": 0.686, "catalog_references": [], "prompt_length": 3146, "files_placed": 5, "status": "keep"}
{"timestamp": 1785987889.2718158, "experiment_id": "059cccbd", "concept_title": "Future directions from cycle 6622cac1", "concept_domain": "Probability", "research_mode": "team", "quality": "partial", "quality_score": 0.6545542168674698, "catalog_references": [], "prompt_length": 5079, "files_placed": 12, "status": "keep"}
