{"timestamp": 1784376953.9201305, "experiment_id": "5df99ff8", "concept_title": "The Aperiodic Monotile: One Shape to Tile Them All", "concept_domain": "Tropical", "research_mode": "team", "quality": "partial", "quality_score": 0.57, "catalog_references": [], "prompt_length": 5464, "files_placed": 3, "status": "keep"}
{"timestamp": 1784376963.0250452, "experiment_id": "fff627f3", "concept_title": "Hilbert's Hotel for Primes: An Infinite Hotel Where Every Guest Is Prime", "concept_domain": "Pythagorean", "research_mode": "team", "quality": "substantial", "quality_score": 0.77, "catalog_references": [], "prompt_length": 25236, "files_placed": 4, "status": "keep"}
{"timestamp": 1784377938.7608721, "experiment_id": "4920904c", "concept_title": "Erdos-Renyi on Acid: Random Graphs That Hallucinate", "concept_domain": "Logic", "research_mode": "team", "quality": "substantial", "quality_score": 0.8, "catalog_references": [], "prompt_length": 25360, "files_placed": 8, "status": "keep"}
{"timestamp": 1784378920.0516975, "experiment_id": "f86cfe8a", "concept_title": "The Topology of Knotted Light: How Laser Beams Get Tangled", "concept_domain": "Novelty", "research_mode": "team", "quality": "substantial", "quality_score": 0.76, "catalog_references": [], "prompt_length": 25265, "files_placed": 5, "status": "keep"}
{"timestamp": 1784378923.5082316, "experiment_id": "154045db", "concept_title": "The Mathematics of Jigsaw Puzzles: NP-Completeness and Topology", "concept_domain": "Shared", "research_mode": "team", "quality": "substantial", "quality_score": 0.74, "catalog_references": [], "prompt_length": 25256, "files_placed": 5, "status": "keep"}
{"timestamp": 1784380894.6317487, "experiment_id": "b596d3d1", "concept_title": "Quantum Entanglement as Algebraic Topology: The Linking Number Is Entanglement", "concept_domain": "Pythagorean", "research_mode": "team", "quality": "substantial", "quality_score": 0.75, "catalog_references": [], "prompt_length": 25197, "files_placed": 6, "status": "keep"}
{"timestamp": 1784381884.9337234, "experiment_id": "26ad8b0e", "concept_title": "ArXiv paper: Strongly complete sets and a conjecture of Erd\u0151s", "concept_domain": "Logic", "research_mode": "team", "quality": "partial", "quality_score": 0.64, "catalog_references": [], "prompt_length": 4693, "files_placed": 4, "status": "keep"}
{"timestamp": 1784381894.2001007, "experiment_id": "7a438864", "concept_title": "The Fermi Paradox as a Pigeonhole Principle: Why We Are Alone", "concept_domain": "Computation", "research_mode": "team", "quality": "partial", "quality_score": 0.66, "catalog_references": [], "prompt_length": 6005, "files_placed": 3, "status": "keep"}
{"timestamp": 1784381903.0369718, "experiment_id": "115a4ee3", "concept_title": "Deepening: Fractal Dimension of Proof Search: How Hard Is It to Find a Proof?", "concept_domain": "Applications", "research_mode": "team", "quality": "substantial", "quality_score": 0.78, "catalog_references": [], "prompt_length": 24526, "files_placed": 10, "status": "keep"}
{"timestamp": 1784382899.0414197, "experiment_id": "7328a55d", "concept_title": "Fractal Number Theory: Hausdorff Dimension of Prime Distributions", "concept_domain": "Bridges", "research_mode": "team", "quality": "substantial", "quality_score": 0.7, "catalog_references": [], "prompt_length": 18982, "files_placed": 4, "status": "keep"}
{"timestamp": 1784385843.316192, "experiment_id": "fb82936b", "concept_title": "Homotopy Type Theory of Cooking Recipes: Paths Between Dishes", "concept_domain": "Physics", "research_mode": "team", "quality": "partial", "quality_score": 0.63, "catalog_references": [], "prompt_length": 5661, "files_placed": 5, "status": "keep"}
{"timestamp": 1784385852.235688, "experiment_id": "64b7f63b", "concept_title": "Close Proofs: Fractal Dimension of Proof Search: How Hard Is It to Find a Proof?", "concept_domain": "Combinatorics", "research_mode": "team", "quality": "substantial", "quality_score": 0.73, "catalog_references": [], "prompt_length": 22694, "files_placed": 7, "status": "keep"}
{"timestamp": 1784385869.5236068, "experiment_id": "c83ba873", "concept_title": "Bayesian Werewolf: Optimal Strategy for Social Deduction Games", "concept_domain": "Applications", "research_mode": "team", "quality": "substantial", "quality_score": 0.75, "catalog_references": [], "prompt_length": 25398, "files_placed": 5, "status": "keep"}
{"timestamp": 1784386895.4577794, "experiment_id": "fc5e97aa", "concept_title": "Proofs as DAGs: The Directed Acyclic Graph Structure of Mathematics", "concept_domain": "Bridges", "research_mode": "team", "quality": "substantial", "quality_score": 0.76, "catalog_references": [], "prompt_length": 25318, "files_placed": 9, "status": "keep"}
{"timestamp": 1784387877.6746778, "experiment_id": "beeab68d", "concept_title": "ArXiv paper: Clique spectral extremal problem on disjoint color-critical graphs", "concept_domain": "Physics", "research_mode": "team", "quality": "partial", "quality_score": 0.65, "catalog_references": [], "prompt_length": 4191, "files_placed": 5, "status": "keep"}
{"timestamp": 1784387886.7803028, "experiment_id": "9b57ae5c", "concept_title": "Turing's Flowers: Morphogenesis as Algebraic Geometry", "concept_domain": "Geometry", "research_mode": "team", "quality": "partial", "quality_score": 0.69, "catalog_references": [], "prompt_length": 12939, "files_placed": 5, "status": "keep"}
{"timestamp": 1784387895.799254, "experiment_id": "44b2da31", "concept_title": "Graph Coloring with Emotions: The Chromatic Polynomial Meets Psychology", "concept_domain": "Geometry", "research_mode": "team", "quality": "substantial", "quality_score": 0.71, "catalog_references": [], "prompt_length": 25081, "files_placed": 5, "status": "keep"}
{"timestamp": 1784388926.1121457, "experiment_id": "6e1376aa", "concept_title": "Deepening: The Topology of Knotted Light: How Laser Beams Get Tangled", "concept_domain": "Novelty", "research_mode": "team", "quality": "substantial", "quality_score": 0.8, "catalog_references": [], "prompt_length": 21989, "files_placed": 4, "status": "keep"}
{"timestamp": 1784388958.2816367, "experiment_id": "6e1b10f7", "concept_title": "The Zeta Function of a Graph: Number Theory on Networks", "concept_domain": "Applications", "research_mode": "team", "quality": "substantial", "quality_score": 0.74, "catalog_references": [], "prompt_length": 24640, "files_placed": 11, "status": "keep"}
{"timestamp": 1784397461.7235186, "experiment_id": "2170ccdf", "concept_title": "Stochastic Galois Theory: Random Permutations Have Generic Galois Groups", "concept_domain": "Algebra", "research_mode": "team", "quality": "substantial", "quality_score": 0.74, "catalog_references": [], "prompt_length": 23546, "files_placed": 6, "status": "keep"}
{"timestamp": 1784401312.736207, "experiment_id": "57f5aa5e", "concept_title": "Deepening: Tropical Cryptocurrency: Mining on the Min-Plus Semiring", "concept_domain": "Applications", "research_mode": "team", "quality": "substantial", "quality_score": 0.82, "catalog_references": [], "prompt_length": 24463, "files_placed": 6, "status": "keep"}
{"timestamp": 1784402678.5742288, "experiment_id": "74205c89", "concept_title": "Topological Quantum Compiling: Braid Groups as Universal Gates", "concept_domain": "MachineLearning", "research_mode": "team", "quality": "partial", "quality_score": 0.69, "catalog_references": [], "prompt_length": 12448, "files_placed": 2, "status": "keep"}
{"timestamp": 1784402690.725829, "experiment_id": "d757b941", "concept_title": "The Uncertainty Principle Is a Fourier Thing: Position-Momentum Duality", "concept_domain": "MachineLearning", "research_mode": "team", "quality": "substantial", "quality_score": 0.73, "catalog_references": [], "prompt_length": 25463, "files_placed": 4, "status": "keep"}
{"timestamp": 1784403011.3505526, "experiment_id": "091f8315", "concept_title": "Cryptography from Chaos: Encrypting with the Logistic Map", "concept_domain": "Novelty", "research_mode": "team", "quality": "substantial", "quality_score": 0.8, "catalog_references": [], "prompt_length": 25466, "files_placed": 7, "status": "keep"}
{"timestamp": 1784403015.5585086, "experiment_id": "d13e4521", "concept_title": "Persistent Homology of Prime Numbers: The Topology of Arithmetic", "concept_domain": "MachineLearning", "research_mode": "team", "quality": "substantial", "quality_score": 0.74, "catalog_references": [], "prompt_length": 25342, "files_placed": 6, "status": "keep"}
{"timestamp": 1784408409.4541159, "experiment_id": "cbc5314c", "concept_title": "The P vs NP of Sudoku: Phase Transitions in Constraint Satisfaction", "concept_domain": "Algebra", "research_mode": "team", "quality": "substantial", "quality_score": 0.8, "catalog_references": [], "prompt_length": 25079, "files_placed": 6, "status": "keep"}
{"timestamp": 1784412367.5549154, "experiment_id": "6cb3854b", "concept_title": "The Category Theory of Jokes: Universal Properties of Humor", "concept_domain": "Pythagorean", "research_mode": "team", "quality": "partial", "quality_score": 0.65, "catalog_references": [], "prompt_length": 5784, "files_placed": 5, "status": "keep"}
{"timestamp": 1784413363.7967784, "experiment_id": "ac79ade1", "concept_title": "1. **Intrinsic curvature identification.** The proved curvature formula", "concept_domain": "Algebra", "research_mode": "team", "quality": "substantial", "quality_score": 0.75, "catalog_references": [], "prompt_length": 25582, "files_placed": 9, "status": "keep"}
{"timestamp": 1784414373.4444153, "experiment_id": "f2f32f44", "concept_title": "The Fourier Transform of the Riemann Zeta: Hearing the Primes", "concept_domain": "Combinatorics", "research_mode": "team", "quality": "partial", "quality_score": 0.67, "catalog_references": [], "prompt_length": 5530, "files_placed": 6, "status": "keep"}
{"timestamp": 1784417351.6535614, "experiment_id": "ac5fc431", "concept_title": "Galois Theory of Cellular Automata: Which Rules Have Reversible Dynamics?", "concept_domain": "Novelty", "research_mode": "team", "quality": "partial", "quality_score": 0.69, "catalog_references": [], "prompt_length": 12756, "files_placed": 4, "status": "keep"}
{"timestamp": 1784417362.0601592, "experiment_id": "bcb31ca6", "concept_title": "Deepening: Cryptography from Chaos: Encrypting with the Logistic Map", "concept_domain": "Bridges", "research_mode": "team", "quality": "substantial", "quality_score": 0.83, "catalog_references": [], "prompt_length": 22737, "files_placed": 5, "status": "keep"}
{"timestamp": 1784421891.6330738, "experiment_id": "cf69678e", "concept_title": "The Arithmetic of Games: Surreal Numbers as Number Fields", "concept_domain": "Combinatorics", "research_mode": "team", "quality": "substantial", "quality_score": 0.75, "catalog_references": [], "prompt_length": 25175, "files_placed": 8, "status": "keep"}
{"timestamp": 1784421897.863722, "experiment_id": "ae36b246", "concept_title": "ArXiv paper: On the maximum size of $B_3$-free families", "concept_domain": "Novelty", "research_mode": "team", "quality": "substantial", "quality_score": 0.7, "catalog_references": [], "prompt_length": 25087, "files_placed": 10, "status": "keep"}
{"timestamp": 1784421902.838571, "experiment_id": "cf73743c", "concept_title": "Quantum Error Correction from Homological Algebra: CSS Codes as Cohomology", "concept_domain": "Shared", "research_mode": "team", "quality": "substantial", "quality_score": 0.75, "catalog_references": [], "prompt_length": 24363, "files_placed": 5, "status": "keep"}
{"timestamp": 1784422966.35912, "experiment_id": "7bc47166", "concept_title": "The Thermodynamics of Sorting: Entropy and Computational Work", "concept_domain": "Shared", "research_mode": "team", "quality": "substantial", "quality_score": 0.78, "catalog_references": [], "prompt_length": 25361, "files_placed": 7, "status": "keep"}
{"timestamp": 1784426809.930838, "experiment_id": "f017f3a3", "concept_title": "Sperner's Lemma Implies Nash Equilibria: Combinatorial Fixed Points in Game Theory", "concept_domain": "Applications", "research_mode": "team", "quality": "partial", "quality_score": 0.63, "catalog_references": [], "prompt_length": 5676, "files_placed": 6, "status": "keep"}
{"timestamp": 1784426863.7936428, "experiment_id": "99a8a1e3", "concept_title": "The Borsuk-Ulam Theorem Implies Arrow's Impossibility: Social Choice Is Topology", "concept_domain": "Cryptography", "research_mode": "team", "quality": "partial", "quality_score": 0.66, "catalog_references": [], "prompt_length": 5552, "files_placed": 3, "status": "keep"}
{"timestamp": 1784426885.6767778, "experiment_id": "20c9506b", "concept_title": "The Collatz Conjecture Is Undecidable: What If 3n+1 Can't Be Proved?", "concept_domain": "Physics", "research_mode": "team", "quality": "partial", "quality_score": 0.69, "catalog_references": [], "prompt_length": 5408, "files_placed": 2, "status": "keep"}
{"timestamp": 1784427994.0454192, "experiment_id": "eb62b00a", "concept_title": "Matroid Minors and the Graph Theorem: Robertson-Seymour for Matroids", "concept_domain": "Bridges", "research_mode": "team", "quality": "substantial", "quality_score": 0.7, "catalog_references": [], "prompt_length": 23317, "files_placed": 9, "status": "keep"}
{"timestamp": 1784429080.95323, "experiment_id": "f59cf451", "concept_title": "Persistent Homology of Musical Harmony: The Topology of Bach", "concept_domain": "Computation", "research_mode": "team", "quality": "partial", "quality_score": 0.63, "catalog_references": [], "prompt_length": 5349, "files_placed": 6, "status": "keep"}
{"timestamp": 1784429091.282593, "experiment_id": "4c2c71e5", "concept_title": "The Fourier Analysis of Collatz: Spectral Gaps in the 3n+1 Map", "concept_domain": "MachineLearning", "research_mode": "team", "quality": "substantial", "quality_score": 0.8, "catalog_references": [], "prompt_length": 23465, "files_placed": 8, "status": "keep"}
{"timestamp": 1784431226.3606226, "experiment_id": "c2f98a25", "concept_title": "Quantum Groups from Number Theory: The Riemann Hypothesis as a Representation Problem", "concept_domain": "NumberTheory", "research_mode": "team", "quality": "partial", "quality_score": 0.64, "catalog_references": [], "prompt_length": 5600, "files_placed": 7, "status": "keep"}
{"timestamp": 1784431237.049036, "experiment_id": "ef699512", "concept_title": "Crystallographic Groups and Music: The 17 Wallpaper Groups of Rhythm", "concept_domain": "Applications", "research_mode": "team", "quality": "substantial", "quality_score": 0.72, "catalog_references": [], "prompt_length": 24302, "files_placed": 8, "status": "keep"}
{"timestamp": 1784433283.5253167, "experiment_id": "9867adb2", "concept_title": "Algebraic Geometry of Neural Networks: Varieties of Decision Boundaries", "concept_domain": "Physics", "research_mode": "team", "quality": "substantial", "quality_score": 0.75, "catalog_references": [], "prompt_length": 25312, "files_placed": 8, "status": "keep"}
{"timestamp": 1784433317.808618, "experiment_id": "76d5023e", "concept_title": "Knots and Lattices: The Alexander Polynomial as a Lattice Path Count", "concept_domain": "Physics", "research_mode": "team", "quality": "substantial", "quality_score": 0.78, "catalog_references": [], "prompt_length": 25335, "files_placed": 5, "status": "keep"}
{"timestamp": 1784435352.0119116, "experiment_id": "fa73eeee", "concept_title": "**Conjecture.** There is a natural joint scaling of the prime cutoff `x`, occupa", "concept_domain": "Algebra", "research_mode": "team", "quality": "substantial", "quality_score": 0.76, "catalog_references": [], "prompt_length": 26857, "files_placed": 4, "status": "keep"}
{"timestamp": 1784435377.9947946, "experiment_id": "8201cdaf", "concept_title": "Automatic Sequences and the Halting Problem: When Is a Sequence Computable?", "concept_domain": "Novelty", "research_mode": "team", "quality": "substantial", "quality_score": 0.79, "catalog_references": [], "prompt_length": 23717, "files_placed": 8, "status": "keep"}
{"timestamp": 1784436545.8911874, "experiment_id": "2eae5d0f", "concept_title": "Half\u2011canonical Brill\u2011Noether existence for k\u2011regular graphs", "concept_domain": "Probability", "research_mode": "team", "quality": "partial", "quality_score": 0.64, "catalog_references": ["Bak08", "ArbCorGriHar85", "JenRan21", "Vog26"], "prompt_length": 10675, "files_placed": 5, "status": "keep"}
{"timestamp": 1784439566.4221253, "experiment_id": "c58345ac", "concept_title": "The Hodge Conjecture for Neural Networks: Algebraic Cycles in Decision Surfaces", "concept_domain": "Probability", "research_mode": "team", "quality": "substantial", "quality_score": 0.71, "catalog_references": [], "prompt_length": 25282, "files_placed": 8, "status": "keep"}
{"timestamp": 1784439569.9826317, "experiment_id": "08d3e2eb", "concept_title": "Formalizing the Probabilistic Method: Erdos Meets Lean", "concept_domain": "Novelty", "research_mode": "team", "quality": "substantial", "quality_score": 0.75, "catalog_references": [], "prompt_length": 25279, "files_placed": 8, "status": "keep"}
{"timestamp": 1784440589.1013575, "experiment_id": "cc0903e0", "concept_title": "Categorification of Entropy: The Information Loss of Functors", "concept_domain": "Tropical", "research_mode": "team", "quality": "substantial", "quality_score": 0.74, "catalog_references": [], "prompt_length": 25286, "files_placed": 9, "status": "keep"}
{"timestamp": 1784441597.2512338, "experiment_id": "4b7e775f", "concept_title": "Information Geometry of Optimization: Natural Gradient Follows Geodesics", "concept_domain": "Pythagorean", "research_mode": "team", "quality": "substantial", "quality_score": 0.73, "catalog_references": [], "prompt_length": 25316, "files_placed": 11, "status": "keep"}
{"timestamp": 1784442657.760823, "experiment_id": "8280a2b4", "concept_title": "The Riemann-Roch Theorem for Graphs: Chip-Firing and the Canonical Divisor", "concept_domain": "Algebra", "research_mode": "team", "quality": "substantial", "quality_score": 0.76, "catalog_references": [], "prompt_length": 25199, "files_placed": 7, "status": "keep"}
{"timestamp": 1784445690.16183, "experiment_id": "d67581f7", "concept_title": "Tropical Cryptography: Min-Plus Encryption with Tropical Matrices", "concept_domain": "Pythagorean", "research_mode": "team", "quality": "substantial", "quality_score": 0.78, "catalog_references": [], "prompt_length": 24834, "files_placed": 9, "status": "keep"}
{"timestamp": 1784445726.8407822, "experiment_id": "192fa110", "concept_title": "The Combinatorics of Compiler Optimization: Register Allocation as Graph Coloring", "concept_domain": "Combinatorics", "research_mode": "team", "quality": "substantial", "quality_score": 0.76, "catalog_references": [], "prompt_length": 25282, "files_placed": 12, "status": "keep"}
{"timestamp": 1784446740.4209132, "experiment_id": "5b9ebbbb", "concept_title": "The Spectral Gap of Sudoku: When Puzzles Become Phase Transitions", "concept_domain": "Novelty", "research_mode": "team", "quality": "partial", "quality_score": 0.58, "catalog_references": [], "prompt_length": 5945, "files_placed": 8, "status": "keep"}
{"timestamp": 1784446803.0679395, "experiment_id": "d00870b3", "concept_title": "The Ramsey Theory of DNA: Subsequence Avoidance in Genetic Codes", "concept_domain": "Tropical", "research_mode": "team", "quality": "substantial", "quality_score": 0.7, "catalog_references": [], "prompt_length": 25181, "files_placed": 10, "status": "keep"}
{"timestamp": 1784448050.902677, "experiment_id": "77a52651", "concept_title": "Quantum Random Walks on Cayley Graphs: Spectral Gaps and Mixing Times", "concept_domain": "Combinatorics", "research_mode": "team", "quality": "substantial", "quality_score": 0.8, "catalog_references": [], "prompt_length": 23018, "files_placed": 4, "status": "keep"}
{"timestamp": 1784449298.9693122, "experiment_id": "91c16818", "concept_title": "Sheaf-Theoretic Data Integration: When Databases Form a Sheaf", "concept_domain": "Novelty", "research_mode": "team", "quality": "substantial", "quality_score": 0.71, "catalog_references": [], "prompt_length": 19626, "files_placed": 7, "status": "keep"}
{"timestamp": 1784449402.6664464, "experiment_id": "6fa68166", "concept_title": "The Topology of Argumentation: Why Debates Have Holes", "concept_domain": "Algebra", "research_mode": "team", "quality": "substantial", "quality_score": 0.7, "catalog_references": [], "prompt_length": 25242, "files_placed": 14, "status": "keep"}
{"timestamp": 1784450659.9003153, "experiment_id": "735120d5", "concept_title": "The Uncanny Valley of Mathematics: When Proofs Are Almost Right", "concept_domain": "Combinatorics", "research_mode": "team", "quality": "substantial", "quality_score": 0.72, "catalog_references": [], "prompt_length": 25276, "files_placed": 7, "status": "keep"}
{"timestamp": 1784452489.9361885, "experiment_id": "5961ca02", "concept_title": "Tangled Hierarchies: Proof Systems That Reference Their Own Soundness", "concept_domain": "Geometry", "research_mode": "team", "quality": "partial", "quality_score": 0.69, "catalog_references": [], "prompt_length": 3484, "files_placed": 9, "status": "keep"}
{"timestamp": 1784452498.1018329, "experiment_id": "d1a99009", "concept_title": "Information-Theoretic Limits of Proof Search: How Hard Is It to Find a Lean Proof?", "concept_domain": "Combinatorics", "research_mode": "team", "quality": "substantial", "quality_score": 0.71, "catalog_references": [], "prompt_length": 25205, "files_placed": 13, "status": "keep"}
{"timestamp": 1784454569.0799239, "experiment_id": "8b838f97", "concept_title": "Hypergraph Ramsey Theory: Beyond Graphs", "concept_domain": "Novelty", "research_mode": "team", "quality": "substantial", "quality_score": 0.79, "catalog_references": [], "prompt_length": 25142, "files_placed": 11, "status": "keep"}
