{"timestamp": 1784087209.8174014, "experiment_id": "7ea29a05", "concept_title": "This cycle promoted the component-count toughness toolkit from a collection of", "concept_domain": "Shared", "research_mode": "team", "quality": "substantial", "quality_score": 0.9, "catalog_references": [], "prompt_length": 27461, "files_placed": 8, "status": "keep"}
{"timestamp": 1784087219.8609645, "experiment_id": "dc502c2d", "concept_title": "This cycle deepens the theory of two-player **well-founded (transfinite) games**", "concept_domain": "MachineLearning", "research_mode": "team", "quality": "substantial", "quality_score": 0.91, "catalog_references": [], "prompt_length": 27158, "files_placed": 4, "status": "keep"}
{"timestamp": 1784088516.0980606, "experiment_id": "42e1a665", "concept_title": "Close Proofs: Bypassed", "concept_domain": "Shared", "research_mode": "team", "quality": "substantial", "quality_score": 0.88, "catalog_references": [], "prompt_length": 22974, "files_placed": 8, "status": "keep"}
{"timestamp": 1784088521.3118172, "experiment_id": "ca1c3afc", "concept_title": "For every natural number `k`, the factorial-code space of length `k` should admi", "concept_domain": "Novelty", "research_mode": "team", "quality": "substantial", "quality_score": 0.87, "catalog_references": [], "prompt_length": 24581, "files_placed": 5, "status": "keep"}
{"timestamp": 1784088543.222689, "experiment_id": "0ee2f71b", "concept_title": "Deepening: The optimal portion ratio \u03bc\u2082 equals 1 + \u03c1", "concept_domain": "Novelty", "research_mode": "team", "quality": "substantial", "quality_score": 0.88, "catalog_references": [], "prompt_length": 19738, "files_placed": 4, "status": "keep"}
{"timestamp": 1784091752.9084172, "experiment_id": "22a6ce83", "concept_title": "This cycle closed the two-sided estimate for the one-dimensional swap model: the", "concept_domain": "Physics", "research_mode": "team", "quality": "substantial", "quality_score": 0.91, "catalog_references": [], "prompt_length": 30900, "files_placed": 4, "status": "keep"}
{"timestamp": 1784091758.2351508, "experiment_id": "582560af", "concept_title": "The results of this cycle establish that the Euler characteristic extends to", "concept_domain": "NumberTheory", "research_mode": "team", "quality": "substantial", "quality_score": 0.91, "catalog_references": [], "prompt_length": 27057, "files_placed": 6, "status": "keep"}
{"timestamp": 1784092384.0173824, "experiment_id": "98ba1a43", "concept_title": "The file `TangledSoundness.lean` develops the semantic core of self-referential", "concept_domain": "Bridges", "research_mode": "team", "quality": "substantial", "quality_score": 0.92, "catalog_references": [], "prompt_length": 25213, "files_placed": 13, "status": "keep"}
{"timestamp": 1784092978.6108277, "experiment_id": "bd321901", "concept_title": "Deepening: Two-parameter picture of *witness complexity* for the", "concept_domain": "Combinatorics", "research_mode": "team", "quality": "substantial", "quality_score": 0.93, "catalog_references": [], "prompt_length": 23295, "files_placed": 5, "status": "keep"}
{"timestamp": 1784094044.0724576, "experiment_id": "3c80004e", "concept_title": "Constructive, lower-bound half of the co-index theory", "concept_domain": "Physics", "research_mode": "team", "quality": "substantial", "quality_score": 0.9, "catalog_references": [], "prompt_length": 25085, "files_placed": 5, "status": "keep"}
{"timestamp": 1784094065.4020946, "experiment_id": "e72af703", "concept_title": "Close Proofs: For every natural number `k`, the factorial-code space of length `k` s", "concept_domain": "MachineLearning", "research_mode": "team", "quality": "substantial", "quality_score": 0.91, "catalog_references": [], "prompt_length": 23763, "files_placed": 4, "status": "keep"}
{"timestamp": 1784095145.2730937, "experiment_id": "7385ba7c", "concept_title": "Deepening: For every natural number `k`, the factorial-code space of length `k` should admi", "concept_domain": "Pythagorean", "research_mode": "team", "quality": "substantial", "quality_score": 0.91, "catalog_references": [], "prompt_length": 22199, "files_placed": 5, "status": "keep"}
{"timestamp": 1784095153.1024206, "experiment_id": "b1453a16", "concept_title": "This cycle adds `ArgumentationKernelGame.lean`, a self-contained bridge file tha", "concept_domain": "Bridges", "research_mode": "team", "quality": "substantial", "quality_score": 0.93, "catalog_references": [], "prompt_length": 23905, "files_placed": 4, "status": "keep"}
{"timestamp": 1784096217.4094715, "experiment_id": "d4584015", "concept_title": "ArXiv paper: Adjoint Bloch--Kato Selmer groups of regular algebraic automorphic Galois representations", "concept_domain": "Geometry", "research_mode": "team", "quality": "substantial", "quality_score": 0.82, "catalog_references": [], "prompt_length": 24055, "files_placed": 4, "status": "keep"}
{"timestamp": 1784098333.0094054, "experiment_id": "80f7c124", "concept_title": "Elementary spectral-moment foundations of Seidel", "concept_domain": "Shared", "research_mode": "team", "quality": "substantial", "quality_score": 0.73, "catalog_references": [], "prompt_length": 35128, "files_placed": 6, "status": "keep"}
{"timestamp": 1784098337.22712, "experiment_id": "2ed994b6", "concept_title": "OEIS sequence: \"Orderly\" Friedman numbers (or \"good\" or \"nice\" Friedman numbers): Friedman numbers (A036057) where the construction digits are used in the proper order.", "concept_domain": "Novelty", "research_mode": "team", "quality": "substantial", "quality_score": 0.7, "catalog_references": [], "prompt_length": 23965, "files_placed": 6, "status": "keep"}
{"timestamp": 1784099415.1836915, "experiment_id": "d1d26693", "concept_title": "Zero-Knowledge Theorem Proving: I Can Prove Fermat's Last Theorem Without Showing You the Proof", "concept_domain": "Probability", "research_mode": "team", "quality": "substantial", "quality_score": 0.75, "catalog_references": [], "prompt_length": 24003, "files_placed": 4, "status": "keep"}
{"timestamp": 1784100483.48279, "experiment_id": "7704d4fe", "concept_title": "Phantom Topologies: Spaces That Change When You Look at Them", "concept_domain": "Applications", "research_mode": "team", "quality": "partial", "quality_score": 0.66, "catalog_references": [], "prompt_length": 5434, "files_placed": 2, "status": "keep"}
{"timestamp": 1784100491.2084634, "experiment_id": "f6b1d920", "concept_title": "The Library of Babel: Combinatorics of the Universal Library", "concept_domain": "Geometry", "research_mode": "team", "quality": "substantial", "quality_score": 0.76, "catalog_references": [], "prompt_length": 21822, "files_placed": 6, "status": "keep"}
{"timestamp": 1784100494.9952, "experiment_id": "a8d24466", "concept_title": "Hyperbolic Number Theory: Arithmetic on the Poincar\u00e9 Disk", "concept_domain": "NumberTheory", "research_mode": "team", "quality": "substantial", "quality_score": 0.73, "catalog_references": [], "prompt_length": 22892, "files_placed": 4, "status": "keep"}
{"timestamp": 1784103698.4863167, "experiment_id": "192aef6c", "concept_title": "OEIS sequence: Maximal number of \"good\" manifolds in an n-nice polytope.", "concept_domain": "NumberTheory", "research_mode": "team", "quality": "partial", "quality_score": 0.55, "catalog_references": [], "prompt_length": 3487, "files_placed": 3, "status": "keep"}
{"timestamp": 1784103706.749393, "experiment_id": "cf605784", "concept_title": "Close Proofs: This cycle promoted the component-count toughness toolkit from a colle", "concept_domain": "NumberTheory", "research_mode": "team", "quality": "substantial", "quality_score": 0.8, "catalog_references": [], "prompt_length": 22847, "files_placed": 17, "status": "keep"}
{"timestamp": 1784105867.0920856, "experiment_id": "5dadc373", "concept_title": "Vampire Numbers and Other Numerical Monsters: A Bestiary of Arithmetic Oddities", "concept_domain": "NumberTheory", "research_mode": "team", "quality": "partial", "quality_score": 0.68, "catalog_references": [], "prompt_length": 5257, "files_placed": 7, "status": "keep"}
{"timestamp": 1784105876.5297782, "experiment_id": "0f633d08", "concept_title": "ArXiv paper: Magnitude homology of tope graphs", "concept_domain": "Logic", "research_mode": "team", "quality": "partial", "quality_score": 0.66, "catalog_references": [], "prompt_length": 10998, "files_placed": 8, "status": "keep"}
{"timestamp": 1784105885.9182599, "experiment_id": "4368e5ed", "concept_title": "ArXiv paper: On the maximum size of $B_3$-free families", "concept_domain": "Tropical", "research_mode": "team", "quality": "partial", "quality_score": 0.65, "catalog_references": [], "prompt_length": 12279, "files_placed": 8, "status": "keep"}
{"timestamp": 1784105897.3133276, "experiment_id": "c5a6c2ed", "concept_title": "OEIS sequence: \"Orderly\" Friedman numbers (or \"good\" or \"nice\" Friedman numbers): Friedman numbers (A036057) where the construction digits are used in the proper order.", "concept_domain": "Applications", "research_mode": "team", "quality": "substantial", "quality_score": 0.7, "catalog_references": [], "prompt_length": 23975, "files_placed": 12, "status": "keep"}
{"timestamp": 1784122973.1745338, "experiment_id": "fcbd747f", "concept_title": "ArXiv paper: On the maximum size of $B_3$-free families", "concept_domain": "Probability", "research_mode": "team", "quality": "partial", "quality_score": 0.61, "catalog_references": [], "prompt_length": 5142, "files_placed": 2, "status": "keep"}
{"timestamp": 1784122981.316959, "experiment_id": "e93835e7", "concept_title": "ArXiv paper: Improving Upper Bounds for the Maximum Clique Problem using Reduction Rules", "concept_domain": "Bridges", "research_mode": "team", "quality": "partial", "quality_score": 0.68, "catalog_references": [], "prompt_length": 5275, "files_placed": 2, "status": "keep"}
{"timestamp": 1784122992.5690262, "experiment_id": "08212964", "concept_title": "ArXiv paper: From roots to paths: graphs simultaneously irregular with respect to rooted and ordinary paths", "concept_domain": "Logic", "research_mode": "team", "quality": "partial", "quality_score": 0.68, "catalog_references": [], "prompt_length": 5344, "files_placed": 1, "status": "keep"}
{"timestamp": 1784125214.2468731, "experiment_id": "d2c19f81", "concept_title": "ArXiv paper: Quantum Latin Squares of Order Six with Cardinalities Nineteen, Twenty-One, and Twenty-Three", "concept_domain": "NumberTheory", "research_mode": "team", "quality": "partial", "quality_score": 0.67, "catalog_references": [], "prompt_length": 12091, "files_placed": 2, "status": "keep"}
{"timestamp": 1784141082.2836862, "experiment_id": "772aa8b4", "concept_title": "ArXiv paper: Superlinear complexity of the $(3/2)^n$ steering word", "concept_domain": "Novelty", "research_mode": "team", "quality": "substantial", "quality_score": 0.7, "catalog_references": [], "prompt_length": 23360, "files_placed": 4, "status": "keep"}
{"timestamp": 1784148321.6372526, "experiment_id": "2152d45c", "concept_title": "ArXiv paper: Even smaller universal posets", "concept_domain": "Cryptography", "research_mode": "team", "quality": "partial", "quality_score": 0.61, "catalog_references": [], "prompt_length": 11056, "files_placed": 0, "status": "keep"}
{"timestamp": 1784148328.8195586, "experiment_id": "9b262bd9", "concept_title": "ArXiv paper: A Note on Iterated Beatty Sequences", "concept_domain": "Tropical", "research_mode": "team", "quality": "partial", "quality_score": 0.69, "catalog_references": [], "prompt_length": 10863, "files_placed": 0, "status": "keep"}
{"timestamp": 1784150366.6526024, "experiment_id": "e0f3150d", "concept_title": "ArXiv paper: Magnitude homology of tope graphs", "concept_domain": "Geometry", "research_mode": "team", "quality": "partial", "quality_score": 0.67, "catalog_references": [], "prompt_length": 11447, "files_placed": 0, "status": "keep"}
{"timestamp": 1784150377.5733998, "experiment_id": "7c4372de", "concept_title": "ArXiv paper: Claw-free cubic graphs and zero forcing", "concept_domain": "Applications", "research_mode": "team", "quality": "partial", "quality_score": 0.58, "catalog_references": [], "prompt_length": 5074, "files_placed": 2, "status": "keep"}
{"timestamp": 1784150387.478817, "experiment_id": "1a2ab56f", "concept_title": "ArXiv paper: On Agreement Subtrees in Multiple Pylogenetic Trees", "concept_domain": "Novelty", "research_mode": "team", "quality": "partial", "quality_score": 0.65, "catalog_references": [], "prompt_length": 4445, "files_placed": 0, "status": "keep"}
{"timestamp": 1784150395.3604505, "experiment_id": "7a91e930", "concept_title": "ArXiv paper: Large sets of mutually orthogonal quantum Latin squares", "concept_domain": "Geometry", "research_mode": "team", "quality": "partial", "quality_score": 0.68, "catalog_references": [], "prompt_length": 3792, "files_placed": 0, "status": "keep"}
{"timestamp": 1784151436.9004478, "experiment_id": "4dee9bd5", "concept_title": "ArXiv paper: The chromatic number of 3-stable Kneser graphs", "concept_domain": "Tropical", "research_mode": "team", "quality": "partial", "quality_score": 0.65, "catalog_references": [], "prompt_length": 4988, "files_placed": 0, "status": "keep"}
{"timestamp": 1784152470.6264927, "experiment_id": "dae162a9", "concept_title": "ArXiv paper: Superlinear complexity of the $(3/2)^n$ steering word", "concept_domain": "Computation", "research_mode": "team", "quality": "partial", "quality_score": 0.63, "catalog_references": [], "prompt_length": 4239, "files_placed": 0, "status": "keep"}
{"timestamp": 1784152477.4246612, "experiment_id": "d68f278c", "concept_title": "ArXiv paper: Improving Upper Bounds for the Maximum Clique Problem using Reduction Rules", "concept_domain": "Applications", "research_mode": "team", "quality": "substantial", "quality_score": 0.76, "catalog_references": [], "prompt_length": 18545, "files_placed": 1, "status": "keep"}
{"timestamp": 1784166426.3042302, "experiment_id": "f4980b02", "concept_title": "ArXiv paper: Counting oriented spanning trees in generalized join digraphs", "concept_domain": "MachineLearning", "research_mode": "team", "quality": "substantial", "quality_score": 0.74, "catalog_references": [], "prompt_length": 23254, "files_placed": 1, "status": "keep"}
{"timestamp": 1784169855.3149464, "experiment_id": "a373adc5", "concept_title": "Hyperbolic Number Theory: Arithmetic on the Poincar\u00e9 Disk", "concept_domain": "Physics", "research_mode": "team", "quality": "partial", "quality_score": 0.68, "catalog_references": [], "prompt_length": 20978, "files_placed": 1, "status": "keep"}
{"timestamp": 1784170903.6452153, "experiment_id": "e23ed960", "concept_title": "ArXiv paper: Claw-free cubic graphs and zero forcing", "concept_domain": "Applications", "research_mode": "team", "quality": "partial", "quality_score": 0.53, "catalog_references": [], "prompt_length": 17519, "files_placed": 1, "status": "keep"}
{"timestamp": 1784172990.1791759, "experiment_id": "57481379", "concept_title": "ArXiv paper: Quantum Latin Squares of Order Six with Cardinalities Nineteen, Twenty-One, and Twenty-Three", "concept_domain": "Physics", "research_mode": "team", "quality": "substantial", "quality_score": 0.75, "catalog_references": [], "prompt_length": 24701, "files_placed": 1, "status": "keep"}
{"timestamp": 1784174038.907747, "experiment_id": "8d2137d3", "concept_title": "The Library of Babel: Combinatorics of the Universal Library", "concept_domain": "Combinatorics", "research_mode": "team", "quality": "substantial", "quality_score": 0.7, "catalog_references": [], "prompt_length": 24805, "files_placed": 1, "status": "keep"}
{"timestamp": 1784175046.1941707, "experiment_id": "e2c77d51", "concept_title": "Vampire Numbers and Other Numerical Monsters: A Bestiary of Arithmetic Oddities", "concept_domain": "Algebra", "research_mode": "team", "quality": "partial", "quality_score": 0.65, "catalog_references": [], "prompt_length": 24681, "files_placed": 1, "status": "keep"}
{"timestamp": 1784176027.070725, "experiment_id": "4665f966", "concept_title": "The Anti-Fibonacci Sequence: Numbers That Avoid the Golden Ratio at All Costs", "concept_domain": "Combinatorics", "research_mode": "team", "quality": "substantial", "quality_score": 0.71, "catalog_references": [], "prompt_length": 22425, "files_placed": 1, "status": "keep"}
{"timestamp": 1784178930.86812, "experiment_id": "5543d24b", "concept_title": "Non-Well-Founded Proofs: Proofs That Reference Themselves", "concept_domain": "Combinatorics", "research_mode": "team", "quality": "partial", "quality_score": 0.64, "catalog_references": [], "prompt_length": 24733, "files_placed": 1, "status": "keep"}
{"timestamp": 1784179917.6842592, "experiment_id": "573ee086", "concept_title": "Zero-Knowledge Theorem Proving: I Can Prove Fermat's Last Theorem Without Showing You the Proof", "concept_domain": "Algebra", "research_mode": "team", "quality": "substantial", "quality_score": 0.73, "catalog_references": [], "prompt_length": 24705, "files_placed": 1, "status": "keep"}
{"timestamp": 1784179928.3649418, "experiment_id": "352675e9", "concept_title": "ArXiv paper: Ray and end spaces: characterizations and classification up to homeomorphism", "concept_domain": "Applications", "research_mode": "team", "quality": "substantial", "quality_score": 0.71, "catalog_references": [], "prompt_length": 24679, "files_placed": 1, "status": "keep"}
{"timestamp": 1784180863.7574737, "experiment_id": "499d98ab", "concept_title": "ArXiv paper: Learning the Graphical Nature of Symmetries", "concept_domain": "Novelty", "research_mode": "team", "quality": "substantial", "quality_score": 0.76, "catalog_references": [], "prompt_length": 24603, "files_placed": 4, "status": "keep"}
{"timestamp": 1784180915.569529, "experiment_id": "58c6edf0", "concept_title": "ArXiv paper: The chromatic number of 3-stable Kneser graphs", "concept_domain": "Pythagorean", "research_mode": "team", "quality": "substantial", "quality_score": 0.73, "catalog_references": [], "prompt_length": 24521, "files_placed": 2, "status": "keep"}
{"timestamp": 1784180933.871826, "experiment_id": "4e53cd7c", "concept_title": "ArXiv paper: Moment-based PPT criteria for random bipartite states", "concept_domain": "Pythagorean", "research_mode": "team", "quality": "substantial", "quality_score": 0.7, "catalog_references": [], "prompt_length": 24631, "files_placed": 1, "status": "keep"}
{"timestamp": 1784185701.9192386, "experiment_id": "aa7167bb", "concept_title": "ArXiv paper: Contractions and applications of crystal skeletons: Young quasisymmetric and Stanley symmetric functions", "concept_domain": "Novelty", "research_mode": "team", "quality": "partial", "quality_score": 0.62, "catalog_references": [], "prompt_length": 5203, "files_placed": 0, "status": "keep"}
{"timestamp": 1784185708.9500616, "experiment_id": "cca295e6", "concept_title": "ArXiv paper: Hypergraph Turan with bounded matching number", "concept_domain": "Shared", "research_mode": "team", "quality": "substantial", "quality_score": 0.71, "catalog_references": [], "prompt_length": 24443, "files_placed": 2, "status": "keep"}
{"timestamp": 1784186653.3815475, "experiment_id": "b71e4678", "concept_title": "ArXiv paper: From roots to paths: graphs simultaneously irregular with respect to rooted and ordinary paths", "concept_domain": "Pythagorean", "research_mode": "team", "quality": "partial", "quality_score": 0.67, "catalog_references": [], "prompt_length": 24655, "files_placed": 1, "status": "keep"}
{"timestamp": 1784190542.630976, "experiment_id": "d8f04178", "concept_title": "ArXiv paper: Euler systems and the symmetric square of a Hida family", "concept_domain": "Novelty", "research_mode": "team", "quality": "partial", "quality_score": 0.52, "catalog_references": [], "prompt_length": 4390, "files_placed": 1, "status": "keep"}
{"timestamp": 1784190550.5542872, "experiment_id": "cdb5c1e4", "concept_title": "ArXiv paper: Cyclic Projective Orbits on Rational Normal Curves and MDS Codes", "concept_domain": "Shared", "research_mode": "team", "quality": "partial", "quality_score": 0.61, "catalog_references": [], "prompt_length": 5254, "files_placed": 0, "status": "keep"}
{"timestamp": 1784190562.044603, "experiment_id": "7d82c497", "concept_title": "ArXiv paper: Fractal uncertainty principle over $\\mathbb{Q}_p$", "concept_domain": "Novelty", "research_mode": "team", "quality": "substantial", "quality_score": 0.7, "catalog_references": [], "prompt_length": 23725, "files_placed": 2, "status": "keep"}
{"timestamp": 1784190565.6982331, "experiment_id": "e2f5c991", "concept_title": "ArXiv paper: Claw-free cubic graphs and zero forcing", "concept_domain": "Novelty", "research_mode": "team", "quality": "substantial", "quality_score": 0.72, "catalog_references": [], "prompt_length": 24564, "files_placed": 1, "status": "keep"}
{"timestamp": 1784193440.0940516, "experiment_id": "19cecd78", "concept_title": "ArXiv paper: Far-apart Erd\u0151s--P\u00f3sa property of long cycles", "concept_domain": "Applications", "research_mode": "team", "quality": "partial", "quality_score": 0.69, "catalog_references": [], "prompt_length": 12622, "files_placed": 0, "status": "keep"}
{"timestamp": 1784193448.062364, "experiment_id": "557a7f03", "concept_title": "ArXiv paper: Local flag algebras", "concept_domain": "Applications", "research_mode": "team", "quality": "partial", "quality_score": 0.66, "catalog_references": [], "prompt_length": 11125, "files_placed": 0, "status": "keep"}
{"timestamp": 1784193455.9021478, "experiment_id": "d1e62d74", "concept_title": "OEIS sequence: Maximal number of \"good\" manifolds in an n-nice polytope.", "concept_domain": "Novelty", "research_mode": "team", "quality": "partial", "quality_score": 0.6, "catalog_references": [], "prompt_length": 3511, "files_placed": 0, "status": "keep"}
