{"timestamp": 1781308679.7917604, "experiment_id": "c432039d", "concept_title": "Deepening: Close Proofs: The current framework considers *static* observation systems where", "concept_domain": "Novelty", "research_mode": "team", "quality": "substantial", "quality_score": 0.7545574690508942, "catalog_references": [], "prompt_length": 17806, "files_placed": 4, "status": "keep"}
{"timestamp": 1781308699.5046322, "experiment_id": "bdd5cb68", "concept_title": "This cycle laid the missing foundation for the \"proof phase transition\" program.", "concept_domain": "Novelty", "research_mode": "team", "quality": "substantial", "quality_score": 0.7651974690508941, "catalog_references": [], "prompt_length": 25995, "files_placed": 6, "status": "keep"}
{"timestamp": 1781308722.562928, "experiment_id": "1ebdc56b", "concept_title": "Deepening: The file `Logic/LobFixedPoint.lean` isolates the purely order-theoretic core of", "concept_domain": "Applications", "research_mode": "team", "quality": "partial", "quality_score": 0.5479162011173184, "catalog_references": [], "prompt_length": 17810, "files_placed": 9, "status": "keep"}
{"timestamp": 1781308744.431701, "experiment_id": "9883562d", "concept_title": "Close Proofs: This cycle formalized the **abstract simulation preorder** at the core", "concept_domain": "Novelty", "research_mode": "team", "quality": "partial", "quality_score": 0.5563100449775112, "catalog_references": [], "prompt_length": 17653, "files_placed": 12, "status": "keep"}
{"timestamp": 1781310723.5961936, "experiment_id": "b09b4f29", "concept_title": "Close Proofs: Self-Referential Type Theory: Proofs That Modify Their Own Specificati", "concept_domain": "Novelty", "research_mode": "team", "quality": "partial", "quality_score": 0.42325954592363263, "catalog_references": [], "prompt_length": 6079, "files_placed": 0, "status": "discard"}
{"timestamp": 1781310747.2456915, "experiment_id": "759d6b7d", "concept_title": "Close Proofs: Stereographic Capacity Theory: Packing Bounds on Spheres", "concept_domain": "Novelty", "research_mode": "team", "quality": "partial", "quality_score": 0.5360561937716263, "catalog_references": [], "prompt_length": 17638, "files_placed": 11, "status": "keep"}
{"timestamp": 1781310809.1790419, "experiment_id": "bf95d4b1", "concept_title": "Deepening: The current framework considers *static* observation systems where", "concept_domain": "Novelty", "research_mode": "team", "quality": "partial", "quality_score": 0.5736000000000001, "catalog_references": [], "prompt_length": 11794, "files_placed": 0, "status": "keep"}
{"timestamp": 1781312803.3388162, "experiment_id": "3ad944ca", "concept_title": "This cycle established, in `Catalog/Logic/IdempotentProbabilityLDP.lean`, the", "concept_domain": "Applications", "research_mode": "team", "quality": "partial", "quality_score": 0.54503, "catalog_references": [], "prompt_length": 17122, "files_placed": 0, "status": "keep"}
{"timestamp": 1781312822.1883998, "experiment_id": "9a7f63d4", "concept_title": "The file `CertifiedNovelty.lean` establishes the quantitative core of metric nov", "concept_domain": "Novelty", "research_mode": "team", "quality": "partial", "quality_score": 0.5117799999999999, "catalog_references": [], "prompt_length": 16353, "files_placed": 0, "status": "keep"}
{"timestamp": 1781312847.189925, "experiment_id": "12f4360f", "concept_title": "Inverse Stereographic Persistence: Topological Data Analysis on Spheres", "concept_domain": "Applications", "research_mode": "team", "quality": "partial", "quality_score": 0.6672800000000001, "catalog_references": [], "prompt_length": 18677, "files_placed": 5, "status": "keep"}
{"timestamp": 1781312866.875986, "experiment_id": "cef8f402", "concept_title": "Close Proofs: This cycle laid the missing foundation for the \"proof phase transition", "concept_domain": "Applications", "research_mode": "team", "quality": "substantial", "quality_score": 0.7716000000000001, "catalog_references": [], "prompt_length": 17657, "files_placed": 5, "status": "keep"}
{"timestamp": 1781314929.290006, "experiment_id": "69ddf823", "concept_title": "Close Proofs: The file `Tropical/MarkedModuli.lean` formalizes the combinatorial typ", "concept_domain": "Applications", "research_mode": "team", "quality": "partial", "quality_score": 0.5428825531914894, "catalog_references": [], "prompt_length": 6083, "files_placed": 0, "status": "keep"}
{"timestamp": 1781314954.0118585, "experiment_id": "e67c94c3", "concept_title": "Structural backbone of the `OrdinalTheory` framework", "concept_domain": "Novelty", "research_mode": "team", "quality": "partial", "quality_score": 0.49520000000000003, "catalog_references": [], "prompt_length": 19084, "files_placed": 0, "status": "discard"}
{"timestamp": 1781314973.036214, "experiment_id": "0256b9e7", "concept_title": "Poincar\u00e9 Conjecture Revisited: 4D Smooth", "concept_domain": "Applications", "research_mode": "team", "quality": "partial", "quality_score": 0.53344, "catalog_references": [], "prompt_length": 17513, "files_placed": 11, "status": "keep"}
{"timestamp": 1781314989.6095672, "experiment_id": "334c0262", "concept_title": "Deepening: This cycle laid the missing foundation for the \"proof phase transition\" program.", "concept_domain": "Applications", "research_mode": "team", "quality": "partial", "quality_score": 0.522, "catalog_references": [], "prompt_length": 17811, "files_placed": 5, "status": "keep"}
{"timestamp": 1781315013.6947727, "experiment_id": "76994116", "concept_title": "This cycle closed the simplest non-trivial case of tropical spectral theory in f", "concept_domain": "Applications", "research_mode": "team", "quality": "partial", "quality_score": 0.51742, "catalog_references": [], "prompt_length": 16646, "files_placed": 0, "status": "keep"}
{"timestamp": 1781317084.3344295, "experiment_id": "c91a5155", "concept_title": "Close Proofs: Reverse Mathematics: Ramsey's Theorem", "concept_domain": "Novelty", "research_mode": "team", "quality": "partial", "quality_score": 0.59956, "catalog_references": [], "prompt_length": 5908, "files_placed": 0, "status": "keep"}
{"timestamp": 1781317106.2496357, "experiment_id": "f16f9f91", "concept_title": "Close Proofs: This cycle moved the catalog's Dream Logic line of work from the *obje", "concept_domain": "Novelty", "research_mode": "team", "quality": "partial", "quality_score": 0.6836800000000001, "catalog_references": [], "prompt_length": 17643, "files_placed": 5, "status": "keep"}
{"timestamp": 1781317121.0669625, "experiment_id": "3da4b14d", "concept_title": "**order-theoretic core of the Cook\u2013Reckhow program** as a", "concept_domain": "Applications", "research_mode": "team", "quality": "partial", "quality_score": 0.67055, "catalog_references": [], "prompt_length": 24585, "files_placed": 5, "status": "keep"}
{"timestamp": 1781317164.3000174, "experiment_id": "366a3697", "concept_title": "This cycle isolated the structural reason Hausdorff dimension behaves like a", "concept_domain": "Applications", "research_mode": "team", "quality": "partial", "quality_score": 0.5201600000000001, "catalog_references": [], "prompt_length": 22916, "files_placed": 0, "status": "keep"}
{"timestamp": 1781319188.1225321, "experiment_id": "6da7e7ea", "concept_title": "Close Proofs: ML Generalization Bounds: Rademacher Complexity of Neural Networks", "concept_domain": "Novelty", "research_mode": "team", "quality": "partial", "quality_score": 0.5016, "catalog_references": [], "prompt_length": 6254, "files_placed": 0, "status": "keep"}
{"timestamp": 1781319224.4363015, "experiment_id": "24e21d72", "concept_title": "Close Proofs: Neural Network Training as Renormalization Group Flow", "concept_domain": "Applications", "research_mode": "team", "quality": "partial", "quality_score": 0.64768, "catalog_references": [], "prompt_length": 17646, "files_placed": 5, "status": "keep"}
{"timestamp": 1781319246.0548196, "experiment_id": "b3509a2a", "concept_title": "Entropy as a Topological Invariant: The Boltzmann Bridge", "concept_domain": "Novelty", "research_mode": "team", "quality": "partial", "quality_score": 0.3590884415584415, "catalog_references": [], "prompt_length": 8182, "files_placed": 0, "status": "discard"}
{"timestamp": 1781319269.0525272, "experiment_id": "83a29cb7", "concept_title": "Rigorous bridge between proof search complexity (the `p", "concept_domain": "Applications", "research_mode": "team", "quality": "partial", "quality_score": 0.41683806250419164, "catalog_references": [], "prompt_length": 26596, "files_placed": 0, "status": "discard"}
{"timestamp": 1781321196.4535708, "experiment_id": "332bd095", "concept_title": "Formal foundations for the logic-physics bridge: the", "concept_domain": "Novelty", "research_mode": "team", "quality": "partial", "quality_score": 0.41818023348168765, "catalog_references": [], "prompt_length": 20796, "files_placed": 0, "status": "discard"}
{"timestamp": 1781321219.9615788, "experiment_id": "0183297f", "concept_title": "Close Proofs: The current formalization handles 0-dimensional persistence on discret", "concept_domain": "Novelty", "research_mode": "team", "quality": "partial", "quality_score": 0.4359272727272727, "catalog_references": [], "prompt_length": 6069, "files_placed": 0, "status": "discard"}
{"timestamp": 1781321241.80541, "experiment_id": "cb00416d", "concept_title": "Thermodynamic Proof Erasure: Landauer's Principle for Mathematics", "concept_domain": "Applications", "research_mode": "team", "quality": "partial", "quality_score": 0.410850132231405, "catalog_references": [], "prompt_length": 18323, "files_placed": 6, "status": "discard"}
{"timestamp": 1781321266.872284, "experiment_id": "90562f43", "concept_title": "*capacity / packing* layer on top of the catalog's Fibonacci", "concept_domain": "Novelty", "research_mode": "team", "quality": "partial", "quality_score": 0.4556, "catalog_references": [], "prompt_length": 19774, "files_placed": 0, "status": "discard"}
{"timestamp": 1781323174.9130933, "experiment_id": "3e1c98ae", "concept_title": "The Yamabe constant Y(M,[g]) on a compact manifold is always finite and bounded ", "concept_domain": "Novelty", "research_mode": "team", "quality": "partial", "quality_score": 0.4213778374169006, "catalog_references": [], "prompt_length": 17249, "files_placed": 0, "status": "discard"}
{"timestamp": 1781323193.7274644, "experiment_id": "00d3bac3", "concept_title": "**order-theoretic core of G\u00f6del\u2013L\u00f6b provability logic GL**", "concept_domain": "Novelty", "research_mode": "team", "quality": "substantial", "quality_score": 0.7660915736040609, "catalog_references": [], "prompt_length": 25392, "files_placed": 11, "status": "keep"}
{"timestamp": 1781323213.2042196, "experiment_id": "d497e126", "concept_title": "Kripke-semantic core of G\u00f6del\u2013L\u00f6b provability logic", "concept_domain": "Applications", "research_mode": "team", "quality": "substantial", "quality_score": 0.7239168975069252, "catalog_references": [], "prompt_length": 25838, "files_placed": 7, "status": "keep"}
{"timestamp": 1781323240.9875698, "experiment_id": "35b751f0", "concept_title": "Close Proofs: Inverse Stereographic Renormalization Group", "concept_domain": "Applications", "research_mode": "team", "quality": "partial", "quality_score": 0.5729568975069252, "catalog_references": [], "prompt_length": 17635, "files_placed": 35, "status": "keep"}
{"timestamp": 1781323564.7394736, "experiment_id": "a6231eff", "concept_title": "Deepening: This cycle laid the missing foundation for the \"proof phase transition", "concept_domain": "Applications", "research_mode": "team", "quality": "substantial", "quality_score": 0.75616, "catalog_references": [], "prompt_length": 17805, "files_placed": 5, "status": "keep"}
{"timestamp": 1781323585.0153987, "experiment_id": "51071f40", "concept_title": "Close Proofs: This cycle formalized the *exactly linearized* (lazy) regime of the Ne", "concept_domain": "Applications", "research_mode": "team", "quality": "partial", "quality_score": 0.51766, "catalog_references": [], "prompt_length": 6262, "files_placed": 0, "status": "keep"}
{"timestamp": 1781323602.7086582, "experiment_id": "46168548", "concept_title": "Two complementary bodies of work in tropical mathematics.", "concept_domain": "Applications", "research_mode": "team", "quality": "partial", "quality_score": 0.53538, "catalog_references": [], "prompt_length": 23165, "files_placed": 0, "status": "keep"}
{"timestamp": 1781323636.5631895, "experiment_id": "0f472503", "concept_title": "Close Proofs: The exponential decay bound `diffusionAlphaBar_exp_bound` shows that t", "concept_domain": "Applications", "research_mode": "team", "quality": "partial", "quality_score": 0.48329999999999995, "catalog_references": [], "prompt_length": 6177, "files_placed": 0, "status": "discard"}
{"timestamp": 1781325511.328798, "experiment_id": "447d1e0c", "concept_title": "Close Proofs: Formal foundations for the logic-physics bridge: the", "concept_domain": "Novelty", "research_mode": "team", "quality": "partial", "quality_score": 0.6629942857142858, "catalog_references": [], "prompt_length": 17629, "files_placed": 6, "status": "keep"}
{"timestamp": 1781325544.8608108, "experiment_id": "26ce0f31", "concept_title": "Close Proofs: Deepening: Deepening: Information-Geometric Bridge: Fisher Metric on S", "concept_domain": "Applications", "research_mode": "team", "quality": "partial", "quality_score": 0.5666399999999999, "catalog_references": [], "prompt_length": 6091, "files_placed": 0, "status": "keep"}
{"timestamp": 1781325567.5061016, "experiment_id": "4cf49fbe", "concept_title": "Inverse Stereographic Neural Field Theory", "concept_domain": "Applications", "research_mode": "team", "quality": "partial", "quality_score": 0.5352800000000001, "catalog_references": [], "prompt_length": 8436, "files_placed": 0, "status": "keep"}
{"timestamp": 1781325589.907244, "experiment_id": "4f688592", "concept_title": "Close Proofs: **order-theoretic core of G\u00f6del\u2013L\u00f6b provability logic GL**", "concept_domain": "Applications", "research_mode": "team", "quality": "partial", "quality_score": 0.41576, "catalog_references": [], "prompt_length": 6238, "files_placed": 0, "status": "discard"}
{"timestamp": 1781327452.1675708, "experiment_id": "b22baf94", "concept_title": "Close Proofs: Proof Complexity Collapse: P=NP via Proof Checking", "concept_domain": "Applications", "research_mode": "team", "quality": "partial", "quality_score": 0.41218720969267864, "catalog_references": [], "prompt_length": 6236, "files_placed": 0, "status": "discard"}
{"timestamp": 1781327474.8322837, "experiment_id": "537ee9cf", "concept_title": "Order-theoretic core of the Cook\u2013Reckhow program (built", "concept_domain": "Novelty", "research_mode": "team", "quality": "partial", "quality_score": 0.42371660159716057, "catalog_references": [], "prompt_length": 20740, "files_placed": 0, "status": "discard"}
{"timestamp": 1781327495.8361495, "experiment_id": "5ede79df", "concept_title": "Zeta Functions of Directed Graphs and the Graph Riemann Hypothesis", "concept_domain": "Novelty", "research_mode": "team", "quality": "partial", "quality_score": 0.423843023255814, "catalog_references": [], "prompt_length": 8369, "files_placed": 0, "status": "discard"}
{"timestamp": 1781327516.7432983, "experiment_id": "62a9082d", "concept_title": "Close Proofs: The Yamabe constant Y(M,[g]) on a compact manifold is always finite an", "concept_domain": "Applications", "research_mode": "team", "quality": "partial", "quality_score": 0.42573513513513517, "catalog_references": [], "prompt_length": 6142, "files_placed": 0, "status": "discard"}
{"timestamp": 1781327532.8884087, "experiment_id": "d7d530ea", "concept_title": "The file `TropicalModuliDimension.lean` establishes the cone-complex dimension t", "concept_domain": "Applications", "research_mode": "team", "quality": "partial", "quality_score": 0.68944, "catalog_references": [], "prompt_length": 23097, "files_placed": 5, "status": "keep"}
{"timestamp": 1781327551.8392043, "experiment_id": "c63a5d6b", "concept_title": "The file `Catalog/Shared/MeasurableCardinal.lean` formalizes **measurable cardin", "concept_domain": "Applications", "research_mode": "team", "quality": "partial", "quality_score": 0.38578, "catalog_references": [], "prompt_length": 17650, "files_placed": 0, "status": "discard"}
{"timestamp": 1781327572.2983952, "experiment_id": "d9de58af", "concept_title": "Close Proofs: This cycle took the *single-modulus* law of apparition from the catalo", "concept_domain": "Applications", "research_mode": "team", "quality": "partial", "quality_score": 0.5084, "catalog_references": [], "prompt_length": 6087, "files_placed": 0, "status": "keep"}
{"timestamp": 1781330529.0241528, "experiment_id": "5d886208", "concept_title": "Deepening: **order-theoretic core of G\u00f6del\u2013L\u00f6b provability logic GL**", "concept_domain": "Applications", "research_mode": "team", "quality": "substantial", "quality_score": 0.7199899999999999, "catalog_references": [], "prompt_length": 17790, "files_placed": 6, "status": "keep"}
{"timestamp": 1781330548.2391875, "experiment_id": "f70562f4", "concept_title": "Close Proofs: Thermodynamic Proof Erasure: Landauer's Principle for Mathematics", "concept_domain": "Applications", "research_mode": "team", "quality": "partial", "quality_score": 0.6708000000000001, "catalog_references": [], "prompt_length": 17657, "files_placed": 6, "status": "keep"}
{"timestamp": 1781330569.3565733, "experiment_id": "b0241bb9", "concept_title": "Deepening: **Conjecture:** If `{f_t}_{t \u2208 [0,1]}` is a continuous family of contr", "concept_domain": "Novelty", "research_mode": "team", "quality": "partial", "quality_score": 0.5484, "catalog_references": [], "prompt_length": 6460, "files_placed": 0, "status": "keep"}
{"timestamp": 1781330591.1041183, "experiment_id": "23a1cf06", "concept_title": "Goldbach Conjecture", "concept_domain": "Applications", "research_mode": "team", "quality": "partial", "quality_score": 0.4273524068258747, "catalog_references": [], "prompt_length": 5939, "files_placed": 0, "status": "discard"}
{"timestamp": 1781330613.6140604, "experiment_id": "8e0c5dea", "concept_title": "This cycle attacked the two `sorry`/missing-dependency holes left in the catalog", "concept_domain": "Applications", "research_mode": "team", "quality": "partial", "quality_score": 0.4306881118901128, "catalog_references": [], "prompt_length": 22185, "files_placed": 0, "status": "discard"}
{"timestamp": 1781330637.075125, "experiment_id": "132f9096", "concept_title": "This cycle formalized the order-theoretic engine of the persistent-homology stab", "concept_domain": "Applications", "research_mode": "team", "quality": "partial", "quality_score": 0.5011806593406594, "catalog_references": [], "prompt_length": 16673, "files_placed": 0, "status": "keep"}
{"timestamp": 1781330658.381823, "experiment_id": "51849a0e", "concept_title": "Close Proofs: Order-theoretic core of the Cook\u2013Reckhow program (built", "concept_domain": "Applications", "research_mode": "team", "quality": "partial", "quality_score": 0.5284582417582417, "catalog_references": [], "prompt_length": 6125, "files_placed": 0, "status": "keep"}
{"timestamp": 1781330679.6465418, "experiment_id": "178bd549", "concept_title": "Close Proofs: The parametric continuity theorem (`parametric_fixedPoint_continuous`)", "concept_domain": "Novelty", "research_mode": "team", "quality": "partial", "quality_score": 0.4950084507042254, "catalog_references": [], "prompt_length": 6079, "files_placed": 0, "status": "discard"}
{"timestamp": 1781332584.8962185, "experiment_id": "183ba48a", "concept_title": "This cycle isolated the *mechanism* behind the bridge between finite-description", "concept_domain": "Applications", "research_mode": "team", "quality": "partial", "quality_score": 0.57528, "catalog_references": [], "prompt_length": 27733, "files_placed": 0, "status": "keep"}
{"timestamp": 1781332617.4115274, "experiment_id": "09fc4396", "concept_title": "Close Proofs: This cycle closed the simplest non-trivial case of tropical spectral t", "concept_domain": "Applications", "research_mode": "team", "quality": "partial", "quality_score": 0.49400000000000005, "catalog_references": [], "prompt_length": 6232, "files_placed": 0, "status": "discard"}
{"timestamp": 1781334495.809552, "experiment_id": "2f5a71c8", "concept_title": "The current work proves the key ingredients \u2014 adjunction, harmonic characterizat", "concept_domain": "Applications", "research_mode": "team", "quality": "partial", "quality_score": 0.4464379298954166, "catalog_references": [], "prompt_length": 15867, "files_placed": 0, "status": "discard"}
{"timestamp": 1781334903.123403, "experiment_id": "dcafa82c", "concept_title": "The file `Core.lean` isolates the *analytic skeleton* shared by Occam, sample", "concept_domain": "Novelty", "research_mode": "team", "quality": "partial", "quality_score": 0.44478952932254917, "catalog_references": [], "prompt_length": 16320, "files_placed": 0, "status": "discard"}
{"timestamp": 1781334926.1040814, "experiment_id": "b13f43aa", "concept_title": "Deepening: Predicative-ordinal-analysis fragment", "concept_domain": "Applications", "research_mode": "team", "quality": "partial", "quality_score": 0.4632251685393259, "catalog_references": [], "prompt_length": 6459, "files_placed": 0, "status": "discard"}
{"timestamp": 1781334947.9369318, "experiment_id": "d8c92910", "concept_title": "Close Proofs: **order-theoretic core of the Cook\u2013Reckhow program** as a", "concept_domain": "Applications", "research_mode": "team", "quality": "partial", "quality_score": 0.5387595545657016, "catalog_references": [], "prompt_length": 6164, "files_placed": 0, "status": "keep"}
