{"timestamp": 1781481440.162719, "experiment_id": "1ab7ab39", "concept_title": "The discrete-Hodge program already carries a *geometric/decomposition* layer", "concept_domain": "Applications", "research_mode": "team", "quality": "partial", "quality_score": 0.51996, "catalog_references": [], "prompt_length": 17597, "files_placed": 0, "status": "keep"}
{"timestamp": 1781481763.2825763, "experiment_id": "cf4c28ef", "concept_title": "Close Proofs: Bridge IX (`InterleavingGeodesic.lean`) gave the persistence-stability", "concept_domain": "Novelty", "research_mode": "team", "quality": "partial", "quality_score": 0.48635999999999996, "catalog_references": [], "prompt_length": 6185, "files_placed": 0, "status": "discard"}
{"timestamp": 1781481787.647018, "experiment_id": "179e2428", "concept_title": "This cycle takes the catalog's single-carrier Eckmann\u2013Hilton engine", "concept_domain": "Novelty", "research_mode": "team", "quality": "partial", "quality_score": 0.5321499999999999, "catalog_references": [], "prompt_length": 22227, "files_placed": 0, "status": "keep"}
{"timestamp": 1781482787.687242, "experiment_id": "2c181743", "concept_title": "The catalog's synthetic-HoTT layer (`Catalog/Logic/HoTT/Foundations.lean`) intro", "concept_domain": "Novelty", "research_mode": "team", "quality": "partial", "quality_score": 0.65692, "catalog_references": [], "prompt_length": 24504, "files_placed": 5, "status": "keep"}
{"timestamp": 1781484868.156743, "experiment_id": "123e2af3", "concept_title": "This cycle rebuilt the discrete Hodge program on a **self-contained Mathlib foun", "concept_domain": "Applications", "research_mode": "team", "quality": "partial", "quality_score": 0.62783, "catalog_references": [], "prompt_length": 25381, "files_placed": 5, "status": "keep"}
{"timestamp": 1781486705.122611, "experiment_id": "32c81afa", "concept_title": "The persistence-stability arc of the catalog climbed a ladder of structure: a", "concept_domain": "Shared", "research_mode": "team", "quality": "substantial", "quality_score": 0.7607163636363636, "catalog_references": [], "prompt_length": 25361, "files_placed": 8, "status": "keep"}
{"timestamp": 1781488585.0981562, "experiment_id": "2509286d", "concept_title": "Self-contained, `sorry`-free local-to-global theory for abstr", "concept_domain": "Applications", "research_mode": "formalize", "quality": "partial", "quality_score": 0.4272732837662338, "catalog_references": ["Catalog/FINAL/Applications/", "Catalog/FINAL/Order/", "Catalog/FINAL/Arithmetic/"], "prompt_length": 3106, "files_placed": 0, "status": "discard"}
{"timestamp": 1781498387.5713458, "experiment_id": "6feb33cc", "concept_title": "A functorial tropical lower bound for Rips connectivity via valuation-depth sublevel graphs", "concept_domain": "Bridges", "research_mode": "prove", "quality": "partial", "quality_score": 0.6565799999999999, "catalog_references": ["Bridges/CategoricalTropicalUltrametric.lean", "Computation/PadicValuationDepth.lean", "Applications/PoincareData/MetricFiltration.lean"], "prompt_length": 17160, "files_placed": 5, "status": "keep"}
{"timestamp": 1781500292.1225224, "experiment_id": "bba57b06", "concept_title": "Tropical\u2013Ultrametric Stability of p-adic Valuation Depth", "concept_domain": "Bridges", "research_mode": "formalize", "quality": "partial", "quality_score": 0.46840000000000004, "catalog_references": ["Catalog/FINAL/", "Mathlib"], "prompt_length": 3161, "files_placed": 0, "status": "discard"}
{"timestamp": 1781502476.630003, "experiment_id": "ae5b4beb", "concept_title": "Functorial tropicalization of valuation depth via tropical valuation objects", "concept_domain": "Bridges", "research_mode": "formalize", "quality": "partial", "quality_score": 0.4150240571428571, "catalog_references": ["Catalog/FINAL/Computation/PadicValuationDepth.lean", "Catalog/Computation/PadicValuationDepth.lean"], "prompt_length": 2390, "files_placed": 0, "status": "discard"}
{"timestamp": 1781502524.0516026, "experiment_id": "10f0dba2", "concept_title": "Functorial comparison between valuation-depth sublevel filtrations and metric Rips filtrations", "concept_domain": "Bridges", "research_mode": "formalize", "quality": "partial", "quality_score": 0.5159509090909091, "catalog_references": ["Catalog/FINAL/Bridges/TheoryMorphisms/Core.lean"], "prompt_length": 3274, "files_placed": 0, "status": "keep"}
{"timestamp": 1781504990.966128, "experiment_id": "51575ef7", "concept_title": "Functorial comparison between neural observation pseudometrics and proof-spectrum congruence kernels", "concept_domain": "Bridges", "research_mode": "prove", "quality": "substantial", "quality_score": 0.794, "catalog_references": ["Bridges/CoalgebraicNeuralMyhillNerode.lean", "Algebra/ProofSpectra/Core.lean"], "prompt_length": 17648, "files_placed": 6, "status": "keep"}
{"timestamp": 1781505020.577139, "experiment_id": "88475cc5", "concept_title": "Categorical Tropicalization of Rips Filtrations and Interleaving Stability", "concept_domain": "Bridges", "research_mode": "prove", "quality": "partial", "quality_score": 0.4963626414840705, "catalog_references": ["Mathlib/Combinatorics/SimpleGraph/Basic.lean", "Mathlib/Data/Real/Basic.lean", "Mathlib/Algebra/Order/Monoid.lean"], "prompt_length": 7763, "files_placed": 0, "status": "discard"}
{"timestamp": 1781506461.6635919, "experiment_id": "a64f762c", "concept_title": "Functorial Lipschitz comparison between valuation depth and tropical valuation objects", "concept_domain": "Bridges", "research_mode": "sorry_fill", "quality": "substantial", "quality_score": 0.70472, "catalog_references": ["Computation/PadicValuationDepth.lean", "Catalog/FINAL"], "prompt_length": 17639, "files_placed": 14, "status": "keep"}
{"timestamp": 1781507809.4970794, "experiment_id": "a37014f1", "concept_title": "Functorial tropical certificates for Berggren\u2013Lorentz lattice reduction", "concept_domain": "Bridges", "research_mode": "formalize", "quality": "partial", "quality_score": 0.45555519710378123, "catalog_references": ["Catalog/FINAL/NumberTheory/", "Catalog/FINAL/LinearAlgebra/", "Catalog/FINAL/Combinatorics/"], "prompt_length": 3085, "files_placed": 0, "status": "discard"}
{"timestamp": 1781507870.6531901, "experiment_id": "fcdeb4ae", "concept_title": "Berggren\u2013Lorentz certificates for lattice reduction in Pythagorean cryptography", "concept_domain": "Bridges", "research_mode": "formalize", "quality": "partial", "quality_score": 0.44584, "catalog_references": ["Catalog/FINAL/Algebra/BerggrenLorentz/Core.lean"], "prompt_length": 3438, "files_placed": 0, "status": "discard"}
{"timestamp": 1781512106.716124, "experiment_id": "d1ba4f5a", "concept_title": "These conjectures build on `Bridges/ValuationRipsBridge.lean`, which established", "concept_domain": "MachineLearning", "research_mode": "formalize", "quality": "partial", "quality_score": 0.57034, "catalog_references": ["Catalog/Bridges/ValuationRipsBridge.lean", "Catalog/FINAL/UltrametricSpaces.lean"], "prompt_length": 3130, "files_placed": 0, "status": "keep"}
{"timestamp": 1781514103.8165622, "experiment_id": "b9cc2fac", "concept_title": "(in `Catalog/Bridges/CategoricalTropicalRipsInterleaving.", "concept_domain": "Geometry", "research_mode": "team", "quality": "substantial", "quality_score": 0.7242, "catalog_references": [], "prompt_length": 22821, "files_placed": 5, "status": "keep"}
{"timestamp": 1781514175.2258997, "experiment_id": "8e322053", "concept_title": "Tropical Automorphic Forms on the Berggren Tree", "concept_domain": "Bridges", "research_mode": "formalize", "quality": "partial", "quality_score": 0.4914663917525773, "catalog_references": ["Algebra/BerggrenLorentz/Core.lean"], "prompt_length": 3438, "files_placed": 0, "status": "discard"}
{"timestamp": 1781514196.0496378, "experiment_id": "94b6b70d", "concept_title": "This cycle rebuilds the discrete Hodge program on a **self-contained Mathlib fou", "concept_domain": "Probability", "research_mode": "formalize", "quality": "partial", "quality_score": 0.3848171428571429, "catalog_references": ["Catalog/FINAL/", "Algebra/MarkovBases/TwoWay.lean"], "prompt_length": 22710, "files_placed": 5, "status": "discard"}
{"timestamp": 1781515207.6590612, "experiment_id": "842c56ce", "concept_title": "Close Proofs: Functorial Lipschitz comparison between valuation depth and tropical v", "concept_domain": "Novelty", "research_mode": "formalize", "quality": "partial", "quality_score": 0.40856000000000003, "catalog_references": ["Catalog/FINAL/"], "prompt_length": 3021, "files_placed": 0, "status": "discard"}
{"timestamp": 1781517366.2661986, "experiment_id": "b221d007", "concept_title": "**functorial tropical certificate** for the Berggren\u2013Lo", "concept_domain": "MachineLearning", "research_mode": "sorry_fill", "quality": "partial", "quality_score": 0.4584708352941177, "catalog_references": ["Catalog/Algebra/BerggrenLorentz/Core.lean"], "prompt_length": 3101, "files_placed": 0, "status": "discard"}
{"timestamp": 1781532071.563014, "experiment_id": "a72aaf71", "concept_title": "Self-dual code length enumerators as a bridge to smooth 4-manifold intersection-form pipelines", "concept_domain": "Applications", "research_mode": "formalize", "quality": "partial", "quality_score": 0.6582600000000001, "catalog_references": ["Catalog/Applications/SmoothPoincare/DirectSum.lean", "Catalog/Applications/SmoothPoincare/Code.lean", "Catalog/Applications/SmoothPoincare/SelfDual.lean", "Catalog/Applications/SmoothPoincare/DoublyEven.lean", "Catalog/FINAL/Applications/SmoothPoincare/DirectSum.lean"], "prompt_length": 12134, "files_placed": 5, "status": "keep"}
{"timestamp": 1781534218.2366993, "experiment_id": "44a1e17f", "concept_title": "**lax monoidal functor** from the generating-function a", "concept_domain": "Computation", "research_mode": "formalize", "quality": "partial", "quality_score": 0.3397905777777779, "catalog_references": ["Catalog/FINAL/"], "prompt_length": 3665, "files_placed": 0, "status": "discard"}
{"timestamp": 1781534257.5554702, "experiment_id": "6ec4b34b", "concept_title": "Close Proofs: Intersection Form Classification Pipeline via Self-Dual Code Direct Su", "concept_domain": "Logic", "research_mode": "sorry_fill", "quality": "partial", "quality_score": 0.5346971830985916, "catalog_references": ["Catalog/FINAL/", "SmoothPoincare/"], "prompt_length": 2594, "files_placed": 0, "status": "keep"}
{"timestamp": 1781539578.2157543, "experiment_id": "cd281b27", "concept_title": "Close Proofs: This cycle delivered a self-contained Mathlib foundation for the discr", "concept_domain": "Tropical", "research_mode": "formalize", "quality": "partial", "quality_score": 0.4802389261744967, "catalog_references": ["Catalog/FINAL/"], "prompt_length": 1967, "files_placed": 0, "status": "discard"}
{"timestamp": 1781542433.6394358, "experiment_id": "a4d16ba9", "concept_title": "Close Proofs: Functorial bridge from combinatorial species generating functions to t", "concept_domain": "Probability", "research_mode": "sorry_fill", "quality": "partial", "quality_score": 0.44327589652348276, "catalog_references": ["Catalog/Probability/SpeciesBoltzmannBridge.lean", "Catalog/FINAL/Probability"], "prompt_length": 2611, "files_placed": 0, "status": "discard"}
{"timestamp": 1781543015.3061895, "experiment_id": "743f44e8", "concept_title": "Close Proofs: These directions extend the `ordEGF` bridge in", "concept_domain": "Cryptography", "research_mode": "formalize", "quality": "partial", "quality_score": 0.4888015145005371, "catalog_references": ["Catalog/FINAL/", "Catalog/Topology/", "Catalog/Order/", "Catalog/Combinatorics/"], "prompt_length": 2177, "files_placed": 0, "status": "discard"}
{"timestamp": 1781553370.178423, "experiment_id": "561a2484", "concept_title": "Close Proofs: Combinatorial species to tropical valuation profiles via coefficientwi", "concept_domain": "Cryptography", "research_mode": "formalize", "quality": "partial", "quality_score": 0.4694702117647058, "catalog_references": [], "prompt_length": 1855, "files_placed": 0, "status": "discard"}
{"timestamp": 1781553398.3361115, "experiment_id": "aba81cd6", "concept_title": "Close Proofs: This cycle added two fully-verified files (0 sorries) extending", "concept_domain": "Cryptography", "research_mode": "sorry_fill", "quality": "partial", "quality_score": 0.55584, "catalog_references": [], "prompt_length": 18018, "files_placed": 10, "status": "keep"}
{"timestamp": 1781553486.4400606, "experiment_id": "8a8b0554", "concept_title": "This cycle delivered `Catalog/Logic/FibonacciPrimitiveDivisorBounded.lean`, a", "concept_domain": "Applications", "research_mode": "formalize", "quality": "partial", "quality_score": 0.49925585666293404, "catalog_references": ["Catalog/FINAL/", "Catalog/Logic/"], "prompt_length": 21550, "files_placed": 9, "status": "discard"}
{"timestamp": 1781554292.1805031, "experiment_id": "afb009d7", "concept_title": "This cycle added **three fully-verified files (0 `sorry`s)** extending the", "concept_domain": "NumberTheory", "research_mode": "formalize", "quality": "partial", "quality_score": 0.5042399999999999, "catalog_references": ["Catalog/FINAL/Bridges/CategoricalTropicalRips.lean", "Catalog/FINAL/Bridges/CategoricalTropicalRipsInterleaving.lean", "Catalog/FINAL/Bridges/CategoricalTropicalRipsQuotient.lean"], "prompt_length": 23767, "files_placed": 5, "status": "keep"}
{"timestamp": 1781554332.8355422, "experiment_id": "87ef3294", "concept_title": "This cycle added two fully-verified files (0 sorries) extending the", "concept_domain": "MachineLearning", "research_mode": "formalize", "quality": "partial", "quality_score": 0.48797999999999997, "catalog_references": ["Catalog/FINAL/", "Bridges/KorseltExponentBridge.lean"], "prompt_length": 2231, "files_placed": 0, "status": "discard"}
{"timestamp": 1781555977.5002604, "experiment_id": "79875292", "concept_title": "Follow-up conjectures arising from `Catalog/Bridges/SpeciesTropicalValuationProf", "concept_domain": "NumberTheory", "research_mode": "formalize", "quality": "partial", "quality_score": 0.452064972972973, "catalog_references": ["Catalog/FINAL/", "Catalog/NumberTheory/", "Catalog/Bridges/SpeciesTropicalValuationProf"], "prompt_length": 2787, "files_placed": 0, "status": "discard"}
{"timestamp": 1781555999.0156386, "experiment_id": "e5fe284a", "concept_title": "Derived from the v16b research cycle that produced", "concept_domain": "Bridges", "research_mode": "formalize", "quality": "partial", "quality_score": 0.62032, "catalog_references": ["Catalog/FINAL/", "Algebra/KorseltUnitsBridge.lean"], "prompt_length": 16136, "files_placed": 5, "status": "keep"}
{"timestamp": 1781569291.974681, "experiment_id": "316c08e5", "concept_title": "Bridge the Rips-graph metric filtration to tropical valuation objects via monotone edge-count profiles", "concept_domain": "Bridges", "research_mode": "formalize", "quality": "partial", "quality_score": 0.49177388888888895, "catalog_references": [], "prompt_length": 1764, "files_placed": 0, "status": "discard"}
{"timestamp": 1781569492.640176, "experiment_id": "892391de", "concept_title": "Functorial tropical valuation object from Rips graph edge-count filtrations", "concept_domain": "Bridges", "research_mode": "sorry_fill", "quality": "partial", "quality_score": 0.497252, "catalog_references": ["Applications/PoincareData/MetricFiltration.lean"], "prompt_length": 2455, "files_placed": 0, "status": "discard"}
{"timestamp": 1781569541.530656, "experiment_id": "a87fe3e9", "concept_title": "Functorial tropical valuation object from p-adic valuation-depth profiles of finite sums", "concept_domain": "Bridges", "research_mode": "formalize", "quality": "partial", "quality_score": 0.49789250000000007, "catalog_references": ["Mathlib/Data/Nat/Prime/Defs.lean", "Mathlib/Data/Finset/Card.lean", "Mathlib/Order/Antitone.lean"], "prompt_length": 3702, "files_placed": 0, "status": "discard"}
{"timestamp": 1781569575.7132766, "experiment_id": "9f426600", "concept_title": "Rips graph monotonicity as a functor into tropical valuation objects", "concept_domain": "Bridges", "research_mode": "formalize", "quality": "partial", "quality_score": 0.5464257142857143, "catalog_references": ["Applications/PoincareData/MetricFiltration.lean", "Catalog/FINAL/"], "prompt_length": 17620, "files_placed": 7, "status": "keep"}
{"timestamp": 1781569635.4336271, "experiment_id": "096aa5b9", "concept_title": "A 1-Lipschitz functor from valuation-depth measures to tropical valuation objects", "concept_domain": "Bridges", "research_mode": "formalize", "quality": "partial", "quality_score": 0.5430773913043478, "catalog_references": ["Catalog/Bridges/DepthToTropical.lean"], "prompt_length": 17633, "files_placed": 8, "status": "keep"}
{"timestamp": 1781571666.2534144, "experiment_id": "cfed7f6c", "concept_title": "Functorial metric-to-tropical filtration from Rips graphs to ultrametric valuation objects", "concept_domain": "Bridges", "research_mode": "formalize", "quality": "partial", "quality_score": 0.4422638461538462, "catalog_references": ["Catalog/FINAL/Topology/Metric/*.lean", "Catalog/FINAL/Combinatorics/*.lean", "Catalog/FINAL/Graph/*.lean"], "prompt_length": 2746, "files_placed": 0, "status": "discard"}
{"timestamp": 1781571690.619859, "experiment_id": "b312114f", "concept_title": "Derived from the research cycle that produced", "concept_domain": "Computation", "research_mode": "formalize", "quality": "partial", "quality_score": 0.33112290909090913, "catalog_references": ["Catalog/FINAL/NumberTheory/Carmichael.lean", "Catalog/FINAL/NumberTheory/Korselt.lean", "Catalog/FINAL/NumberTheory/ZModUnits.lean"], "prompt_length": 2966, "files_placed": 0, "status": "discard"}
{"timestamp": 1781571713.4231539, "experiment_id": "7db0844d", "concept_title": "A functor from metric Rips filtrations to tropical valuation objects via simplex-count monotonicity", "concept_domain": "Bridges", "research_mode": "formalize", "quality": "partial", "quality_score": 0.42713306086956526, "catalog_references": ["Catalog/FINAL/Combinatorics/", "Catalog/FINAL/Topology/", "Catalog/FINAL/Metric/"], "prompt_length": 3002, "files_placed": 0, "status": "discard"}
{"timestamp": 1781573999.9538171, "experiment_id": "90c4ce9a", "concept_title": "Functorial tropical ultrametric from Pythagorean Lorentz triples", "concept_domain": "Bridges", "research_mode": "formalize", "quality": "partial", "quality_score": 0.49903022994652413, "catalog_references": ["Catalog/FINAL/Algebra/BerggrenLorentz/Core.lean", "Catalog/Algebra/BerggrenLorentz/Core.lean"], "prompt_length": 3559, "files_placed": 0, "status": "discard"}
{"timestamp": 1781574152.9832435, "experiment_id": "999c0f6b", "concept_title": "Follow-up conjectures arising from `Catalog/Bridges/ValuationDepthTropicalFuncto", "concept_domain": "Algebra", "research_mode": "team", "quality": "substantial", "quality_score": 0.7756000000000001, "catalog_references": [], "prompt_length": 21180, "files_placed": 7, "status": "keep"}
{"timestamp": 1781578747.026484, "experiment_id": "e72864d5", "concept_title": "These conjectures extend the results formalized in", "concept_domain": "NumberTheory", "research_mode": "formalize", "quality": "partial", "quality_score": 0.35638045714285715, "catalog_references": ["Catalog/FINAL/", "Catalog/Geometry/InformationGeometry/"], "prompt_length": 2871, "files_placed": 0, "status": "discard"}
{"timestamp": 1781581001.7876632, "experiment_id": "3fd7a316", "concept_title": "`Catalog/Bridges/FunctorialTropicalPythagorean.lean` (0 sorr", "concept_domain": "Probability", "research_mode": "team", "quality": "substantial", "quality_score": 0.8053600000000001, "catalog_references": [], "prompt_length": 22249, "files_placed": 6, "status": "keep"}
{"timestamp": 1781581110.9179642, "experiment_id": "dc77da43", "concept_title": "A tropical valuation profile of finite metric filtrations from Rips edge-count data", "concept_domain": "Applications", "research_mode": "sorry_fill", "quality": "partial", "quality_score": 0.49856, "catalog_references": ["Applications/PoincareData/MetricFiltration.lean", "Applications/PoincareData/RipsEdgeCountProfile.lean"], "prompt_length": 2417, "files_placed": 0, "status": "discard"}
{"timestamp": 1781583184.6737359, "experiment_id": "6f9401e1", "concept_title": "Deepening: Follow-up conjectures arising from `Catalog/Bridges/ValuationDepthTropicalFuncto", "concept_domain": "NumberTheory", "research_mode": "team", "quality": "substantial", "quality_score": 0.72651, "catalog_references": [], "prompt_length": 18169, "files_placed": 6, "status": "keep"}
{"timestamp": 1781583215.2558742, "experiment_id": "d9dd0490", "concept_title": "Derived from this cycle's findings in `Core.lean` and `Functoriality.lean`, whic", "concept_domain": "Novelty", "research_mode": "formalize", "quality": "partial", "quality_score": 0.6056199999999999, "catalog_references": ["Catalog/Applications/PoincareData/MetricFiltration.lean"], "prompt_length": 18822, "files_placed": 5, "status": "keep"}
{"timestamp": 1781585312.942664, "experiment_id": "b3f0c15e", "concept_title": "Monodromy Compression Principle for Neural PDE Solvers", "concept_domain": "Physics", "research_mode": "formalize", "quality": "partial", "quality_score": 0.5072000000000001, "catalog_references": ["Catalog/FINAL/", "MachineLearning/FiniteInfoGeometry.lean"], "prompt_length": 3168, "files_placed": 0, "status": "keep"}
{"timestamp": 1781585378.1454024, "experiment_id": "29017e68", "concept_title": "Follow-up conjectures arising from `Catalog/Bridges/RipsTropicalFunctor.lean`, w", "concept_domain": "Physics", "research_mode": "formalize", "quality": "substantial", "quality_score": 0.7856000000000001, "catalog_references": ["Catalog/Bridges/RipsTropicalFunctor.lean"], "prompt_length": 22388, "files_placed": 8, "status": "keep"}
