{"timestamp": 1785360082.0638375, "experiment_id": "89e28e84", "concept_title": "Renormalization Group Flow: Wilson's Epsilon Expansion", "concept_domain": "Algebra", "research_mode": "team", "quality": "substantial", "quality_score": 0.78874, "catalog_references": [], "prompt_length": 21647, "files_placed": 4, "status": "keep"}
{"timestamp": 1785363690.3046267, "experiment_id": "97183f28", "concept_title": "Quantum-Classical Bridge: de Finetti Theorem for Quantum States", "concept_domain": "Bridges", "research_mode": "team", "quality": "partial", "quality_score": 0.686, "catalog_references": [], "prompt_length": 2543, "files_placed": 3, "status": "keep"}
{"timestamp": 1785363735.3829987, "experiment_id": "576be6d2", "concept_title": "Self-Modifying Research via Reflective Type Theory", "concept_domain": "Logic", "research_mode": "team", "quality": "substantial", "quality_score": 0.75955, "catalog_references": [], "prompt_length": 23182, "files_placed": 4, "status": "keep"}
{"timestamp": 1785363777.4689093, "experiment_id": "e722c646", "concept_title": "Inverse Stereographic Renormalization Group", "concept_domain": "Physics", "research_mode": "team", "quality": "substantial", "quality_score": 0.7708899999999999, "catalog_references": [], "prompt_length": 19153, "files_placed": 4, "status": "keep"}
{"timestamp": 1785367282.2236688, "experiment_id": "42b8568d", "concept_title": "Quantum Key Distribution: BB84 Security Proof", "concept_domain": "Cryptography", "research_mode": "team", "quality": "partial", "quality_score": 0.686, "catalog_references": [], "prompt_length": 2661, "files_placed": 2, "status": "keep"}
{"timestamp": 1785367288.9264922, "experiment_id": "7799fc2c", "concept_title": "ArXiv paper: On lower bounds for canonical heights of the map $\u03c6(X,Y)=(Y,X+Y^D+b)$", "concept_domain": "Bridges", "research_mode": "team", "quality": "partial", "quality_score": 0.686, "catalog_references": [], "prompt_length": 2426, "files_placed": 3, "status": "keep"}
{"timestamp": 1785367346.6237812, "experiment_id": "d4d2267f", "concept_title": "Rota's Basis Conjecture", "concept_domain": "Combinatorics", "research_mode": "team", "quality": "substantial", "quality_score": 0.73176, "catalog_references": [], "prompt_length": 23376, "files_placed": 4, "status": "keep"}
{"timestamp": 1785367400.0976765, "experiment_id": "8aec96a6", "concept_title": "EML Information Geometry: Fisher Information of exp-log Models", "concept_domain": "Probability", "research_mode": "team", "quality": "substantial", "quality_score": 0.76977, "catalog_references": [], "prompt_length": 24255, "files_placed": 4, "status": "keep"}
{"timestamp": 1785370857.5924294, "experiment_id": "2996b72f", "concept_title": "Euler-Mascheroni Constant: Irrationality Approaches", "concept_domain": "Shared", "research_mode": "prove", "quality": "substantial", "quality_score": 0.77621, "catalog_references": [], "prompt_length": 21094, "files_placed": 4, "status": "keep"}
{"timestamp": 1785382600.1532762, "experiment_id": "d5c8afaa", "concept_title": "Tropical Dreams: The Field with One Element Meets Tropical Geometry", "concept_domain": "Tropical", "research_mode": "team", "quality": "partial", "quality_score": 0.686, "catalog_references": [], "prompt_length": 4893, "files_placed": 2, "status": "keep"}
{"timestamp": 1785382665.8957224, "experiment_id": "6ef427dd", "concept_title": "Consciousness as Emergent Fixed Point", "concept_domain": "Bridges", "research_mode": "team", "quality": "substantial", "quality_score": 0.7636799999999999, "catalog_references": [], "prompt_length": 22906, "files_placed": 4, "status": "keep"}
{"timestamp": 1785382731.3169262, "experiment_id": "c2653f80", "concept_title": "Sierpi\u0144ski Numbers: Covering Systems", "concept_domain": "NumberTheory", "research_mode": "team", "quality": "substantial", "quality_score": 0.7720099999999999, "catalog_references": [], "prompt_length": 23126, "files_placed": 4, "status": "keep"}
{"timestamp": 1785382798.2420864, "experiment_id": "3c125e46", "concept_title": "EML Algebraic Independence: Transcendence Results", "concept_domain": "NumberTheory", "research_mode": "team", "quality": "substantial", "quality_score": 0.73757, "catalog_references": [], "prompt_length": 21540, "files_placed": 4, "status": "keep"}
{"timestamp": 1785382864.502965, "experiment_id": "d1f879fc", "concept_title": "Machine Learning Generalization Bounds", "concept_domain": "Algebra", "research_mode": "team", "quality": "substantial", "quality_score": 0.76753, "catalog_references": [], "prompt_length": 23080, "files_placed": 4, "status": "keep"}
{"timestamp": 1785394268.0327892, "experiment_id": "883686fe", "concept_title": "Symmetric Group Generation Probability", "concept_domain": "Probability", "research_mode": "team", "quality": "partial", "quality_score": 0.677, "catalog_references": [], "prompt_length": 2144, "files_placed": 2, "status": "keep"}
{"timestamp": 1785405058.5707967, "experiment_id": "a1225aa5", "concept_title": "Surreal Topology: What Topology Does the Field of Surreal Numbers Have?", "concept_domain": "Novelty", "research_mode": "team", "quality": "substantial", "quality_score": 0.7423299999999999, "catalog_references": [], "prompt_length": 23130, "files_placed": 4, "status": "keep"}
{"timestamp": 1785405126.618335, "experiment_id": "1c628216", "concept_title": "Borges' Library of Babel: Combinatorics of Everything", "concept_domain": "Combinatorics", "research_mode": "team", "quality": "substantial", "quality_score": 0.76172, "catalog_references": [], "prompt_length": 22097, "files_placed": 4, "status": "keep"}
{"timestamp": 1785413520.1913083, "experiment_id": "3308088b", "concept_title": "Tropical Convexity: Helly, Caratheodory, and Radon", "concept_domain": "Geometry", "research_mode": "team", "quality": "partial", "quality_score": 0.686, "catalog_references": [], "prompt_length": 2861, "files_placed": 4, "status": "keep"}
{"timestamp": 1785413591.1634762, "experiment_id": "72d619d5", "concept_title": "Homotopy Type Theory of Cooking Recipes: Paths Between Dishes", "concept_domain": "Novelty", "research_mode": "team", "quality": "substantial", "quality_score": 0.78874, "catalog_references": [], "prompt_length": 22844, "files_placed": 4, "status": "keep"}
{"timestamp": 1785413659.0974534, "experiment_id": "593a0386", "concept_title": "Deepening: Euler-Mascheroni Constant: Irrationality Approaches", "concept_domain": "Shared", "research_mode": "team", "quality": "substantial", "quality_score": 0.7903499999999999, "catalog_references": [], "prompt_length": 23801, "files_placed": 4, "status": "keep"}
{"timestamp": 1785422438.387086, "experiment_id": "67548200", "concept_title": "Galois Theory of Cellular Automata: Which Rules Have Reversible Dynamics?", "concept_domain": "Novelty", "research_mode": "team", "quality": "substantial", "quality_score": 0.7916099999999999, "catalog_references": [], "prompt_length": 25633, "files_placed": 4, "status": "keep"}
{"timestamp": 1785422507.7073424, "experiment_id": "7edbd52d", "concept_title": "Frankl's Union-Closed Conjecture", "concept_domain": "Combinatorics", "research_mode": "team", "quality": "substantial", "quality_score": 0.78958, "catalog_references": [], "prompt_length": 23631, "files_placed": 4, "status": "keep"}
{"timestamp": 1785422577.622932, "experiment_id": "bf94368f", "concept_title": "Escher Staircases in Algebra: Infinite Ascending Chains That Loop Back", "concept_domain": "Algebra", "research_mode": "team", "quality": "substantial", "quality_score": 0.80162, "catalog_references": [], "prompt_length": 25418, "files_placed": 4, "status": "keep"}
{"timestamp": 1785430677.382268, "experiment_id": "bd7b389e", "concept_title": "Deepening: EML Information Geometry: Fisher Information of exp-log Models", "concept_domain": "Probability", "research_mode": "team", "quality": "partial", "quality_score": 0.686, "catalog_references": [], "prompt_length": 3135, "files_placed": 2, "status": "keep"}
{"timestamp": 1785430684.1843705, "experiment_id": "4ecd322f", "concept_title": "Quantum Gravity as Topological Quantum Field Theory", "concept_domain": "Physics", "research_mode": "team", "quality": "partial", "quality_score": 0.686, "catalog_references": [], "prompt_length": 2347, "files_placed": 2, "status": "keep"}
{"timestamp": 1785434388.80184, "experiment_id": "e1e4ff02", "concept_title": "EML Training Dynamics as Tropical Gradient Flow", "concept_domain": "Applications", "research_mode": "team", "quality": "substantial", "quality_score": 0.76074, "catalog_references": [], "prompt_length": 22564, "files_placed": 4, "status": "keep"}
{"timestamp": 1785437589.8786833, "experiment_id": "a8849f61", "concept_title": "The Hodge Conjecture for Neural Networks: Algebraic Cycles in Decision Surfaces", "concept_domain": "MachineLearning", "research_mode": "team", "quality": "partial", "quality_score": 0.668, "catalog_references": [], "prompt_length": 4680, "files_placed": 1, "status": "keep"}
{"timestamp": 1785437660.3985608, "experiment_id": "00b7234b", "concept_title": "Quantum Topological Phase Computation", "concept_domain": "Computation", "research_mode": "team", "quality": "substantial", "quality_score": 0.7997299999999999, "catalog_references": [], "prompt_length": 22877, "files_placed": 4, "status": "keep"}
{"timestamp": 1785437731.2439895, "experiment_id": "15429b4a", "concept_title": "Extremal Graph Theory: Tur\u00e1n and Szemer\u00e9di", "concept_domain": "Combinatorics", "research_mode": "prove", "quality": "substantial", "quality_score": 0.73393, "catalog_references": [], "prompt_length": 23361, "files_placed": 4, "status": "keep"}
{"timestamp": 1785437803.276434, "experiment_id": "726a20a7", "concept_title": "Navier-Stokes Existence and Smoothness", "concept_domain": "Physics", "research_mode": "team", "quality": "substantial", "quality_score": 0.73786, "catalog_references": [], "prompt_length": 22655, "files_placed": 4, "status": "keep"}
{"timestamp": 1785437874.6049864, "experiment_id": "6d7202c5", "concept_title": "Deepening: **Conjecture.** Let a family of decision procedures on inputs of length `n` irre", "concept_domain": "Shared", "research_mode": "team", "quality": "substantial", "quality_score": 0.73827, "catalog_references": [], "prompt_length": 20178, "files_placed": 4, "status": "keep"}
{"timestamp": 1785440360.9810596, "experiment_id": "177b02a7", "concept_title": "Bayesian Werewolf: Optimal Strategy for Social Deduction Games", "concept_domain": "Probability", "research_mode": "team", "quality": "substantial", "quality_score": 0.73659, "catalog_references": [], "prompt_length": 21304, "files_placed": 4, "status": "keep"}
{"timestamp": 1785443900.9005291, "experiment_id": "46cb7ee6", "concept_title": "EML Transseries: Asymptotic Expansions Beyond Power Series", "concept_domain": "Applications", "research_mode": "team", "quality": "substantial", "quality_score": 0.7732699999999999, "catalog_references": [], "prompt_length": 19748, "files_placed": 4, "status": "keep"}
{"timestamp": 1785450460.068185, "experiment_id": "ae875fd7", "concept_title": "EML Interpolation Theory: Stone-Weierstrass for exp-log Networks", "concept_domain": "Applications", "research_mode": "team", "quality": "partial", "quality_score": 0.686, "catalog_references": [], "prompt_length": 4444, "files_placed": 3, "status": "keep"}
{"timestamp": 1785450531.318562, "experiment_id": "513ffc93", "concept_title": "Random Graphs: Erd\u0151s-R\u00e9nyi Threshold Phenomena", "concept_domain": "Probability", "research_mode": "prove", "quality": "substantial", "quality_score": 0.7676799999999999, "catalog_references": [], "prompt_length": 23123, "files_placed": 4, "status": "keep"}
{"timestamp": 1785450603.3446069, "experiment_id": "e3c425e4", "concept_title": "ArXiv paper: The Arithmetic of Semirings Part I: Ideals", "concept_domain": "Tropical", "research_mode": "team", "quality": "substantial", "quality_score": 0.7868499999999999, "catalog_references": [], "prompt_length": 23515, "files_placed": 4, "status": "keep"}
{"timestamp": 1785454089.7629561, "experiment_id": "85fa434c", "concept_title": "BSD Conjecture: Rank Computability", "concept_domain": "Algebra", "research_mode": "team", "quality": "substantial", "quality_score": 0.73204, "catalog_references": [], "prompt_length": 20657, "files_placed": 4, "status": "keep"}
{"timestamp": 1785454924.8224242, "experiment_id": "63b75a93", "concept_title": "Moonshot: Nanotechnology Computation \u2014 Molecular Computing Limits", "concept_domain": "Novelty", "research_mode": "team", "quality": "substantial", "quality_score": 0.76935, "catalog_references": [], "prompt_length": 23963, "files_placed": 4, "status": "keep"}
{"timestamp": 1785456383.7717412, "experiment_id": "29953b58", "concept_title": "Deepening: Isogeny-SIDH: Radical Isogeny Verification on Montgomery Curves", "concept_domain": "Cryptography", "research_mode": "team", "quality": "partial", "quality_score": 0.6988599999999999, "catalog_references": [], "prompt_length": 2482, "files_placed": 2, "status": "keep"}
{"timestamp": 1785456456.8263862, "experiment_id": "3811f14c", "concept_title": "Close Proofs: Pythagorean-Energy-Spectrum: Gradient Descent Factoring on the Berggre", "concept_domain": "NumberTheory", "research_mode": "team", "quality": "substantial", "quality_score": 0.7326499999999999, "catalog_references": [], "prompt_length": 20272, "files_placed": 4, "status": "keep"}
{"timestamp": 1785457318.1662662, "experiment_id": "13e8a4d7", "concept_title": "Elliptic Curve Cryptography: Weil Pairing and BLS Signatures", "concept_domain": "Cryptography", "research_mode": "team", "quality": "substantial", "quality_score": 0.8063100000000001, "catalog_references": [], "prompt_length": 23133, "files_placed": 4, "status": "keep"}
{"timestamp": 1785468597.352415, "experiment_id": "02aa1402", "concept_title": "Retrocausal Proof Theory: Proving Theorems by Their Consequences", "concept_domain": "Novelty", "research_mode": "team", "quality": "substantial", "quality_score": 0.72637, "catalog_references": [], "prompt_length": 21285, "files_placed": 4, "status": "keep"}
{"timestamp": 1785470488.8881848, "experiment_id": "343eb494", "concept_title": "Erd\u0151s-Faber-Lov\u00e1sz Conjecture", "concept_domain": "Combinatorics", "research_mode": "team", "quality": "substantial", "quality_score": 0.76494, "catalog_references": [], "prompt_length": 19774, "files_placed": 4, "status": "keep"}
{"timestamp": 1785471929.177744, "experiment_id": "1fc64f82", "concept_title": "Inverse Stereographic Tropical Lift", "concept_domain": "Tropical", "research_mode": "team", "quality": "substantial", "quality_score": 0.79392, "catalog_references": [], "prompt_length": 21170, "files_placed": 4, "status": "keep"}
{"timestamp": 1785474682.071384, "experiment_id": "77d39a70", "concept_title": "ArXiv paper: Adjacency-degree algebras and spectral determination of graphs", "concept_domain": "Physics", "research_mode": "team", "quality": "substantial", "quality_score": 0.76844, "catalog_references": [], "prompt_length": 22475, "files_placed": 4, "status": "keep"}
{"timestamp": 1785477927.1867738, "experiment_id": "7c352e1f", "concept_title": "Sheaf Cohomology of Data: The Topology of Missing Information", "concept_domain": "Computation", "research_mode": "team", "quality": "substantial", "quality_score": 0.80603, "catalog_references": [], "prompt_length": 25570, "files_placed": 4, "status": "keep"}
{"timestamp": 1785478019.115609, "experiment_id": "70779ff4", "concept_title": "Normality of Mathematical Constants", "concept_domain": "Probability", "research_mode": "team", "quality": "substantial", "quality_score": 0.7678799999999999, "catalog_references": [], "prompt_length": 18695, "files_placed": 4, "status": "keep"}
{"timestamp": 1785478091.8173823, "experiment_id": "275a5749", "concept_title": "Deepening: Moonshot: Alien Number Systems \u2014 Mathematics Beyond Base-10", "concept_domain": "Shared", "research_mode": "team", "quality": "substantial", "quality_score": 0.75115, "catalog_references": [], "prompt_length": 22998, "files_placed": 4, "status": "keep"}
{"timestamp": 1785479609.3086514, "experiment_id": "c961538a", "concept_title": "Close Proofs: Self-Avoiding Walk: Connective Constant", "concept_domain": "Probability", "research_mode": "team", "quality": "partial", "quality_score": 0.686, "catalog_references": [], "prompt_length": 2752, "files_placed": 2, "status": "keep"}
{"timestamp": 1785483057.384797, "experiment_id": "02f69ad4", "concept_title": "Idempotent Probability: Large Deviations", "concept_domain": "Probability", "research_mode": "team", "quality": "partial", "quality_score": 0.686, "catalog_references": [], "prompt_length": 2106, "files_placed": 3, "status": "keep"}
{"timestamp": 1785486200.7485676, "experiment_id": "50db037d", "concept_title": "Secret Sharing: Shamir's Scheme and Verifiable Variants", "concept_domain": "Cryptography", "research_mode": "team", "quality": "substantial", "quality_score": 0.7722199999999999, "catalog_references": [], "prompt_length": 24605, "files_placed": 4, "status": "keep"}
{"timestamp": 1785486207.3640943, "experiment_id": "a5e9a5f6", "concept_title": "ArXiv paper: Greenberg's $\u03bc=0$ conjecture for lisse sheaves over global function fields", "concept_domain": "Pythagorean", "research_mode": "team", "quality": "partial", "quality_score": 0.699, "catalog_references": [], "prompt_length": 4178, "files_placed": 2, "status": "keep"}
{"timestamp": 1785489788.4725356, "experiment_id": "972f5eac", "concept_title": "Sums of Three Cubes", "concept_domain": "NumberTheory", "research_mode": "team", "quality": "substantial", "quality_score": 0.77705, "catalog_references": [], "prompt_length": 23069, "files_placed": 4, "status": "keep"}
{"timestamp": 1785489861.1114066, "experiment_id": "0f63237d", "concept_title": "Tropical Schemes: Foundations of Tropical Algebraic Geometry", "concept_domain": "Tropical", "research_mode": "team", "quality": "substantial", "quality_score": 0.7743899999999999, "catalog_references": [], "prompt_length": 24631, "files_placed": 4, "status": "keep"}
{"timestamp": 1785492525.5096674, "experiment_id": "78bbd545", "concept_title": "Bridge: Tropical Geometry as a Limit of Classical Algebraic Geometry", "concept_domain": "Tropical", "research_mode": "team", "quality": "substantial", "quality_score": 0.7874099999999999, "catalog_references": [], "prompt_length": 22591, "files_placed": 4, "status": "keep"}
{"timestamp": 1785492597.418883, "experiment_id": "fb6f9bc5", "concept_title": "Topological-Algebraic Bridge: Fundamental Group as a Complete Invariant", "concept_domain": "Bridges", "research_mode": "team", "quality": "substantial", "quality_score": 0.7559799999999999, "catalog_references": [], "prompt_length": 24323, "files_placed": 4, "status": "keep"}
{"timestamp": 1785492669.6114826, "experiment_id": "0fbfba35", "concept_title": "ArXiv paper: A universal leading-residue formula for Witten zeta functions", "concept_domain": "Algebra", "research_mode": "team", "quality": "substantial", "quality_score": 0.7781, "catalog_references": [], "prompt_length": 25616, "files_placed": 4, "status": "keep"}
{"timestamp": 1785509363.130284, "experiment_id": "9d058f1b", "concept_title": "The exact proposed fixed-point equation was formalized in", "concept_domain": "Logic", "research_mode": "team", "quality": "substantial", "quality_score": 0.74478, "catalog_references": [], "prompt_length": 23853, "files_placed": 4, "status": "keep"}
{"timestamp": 1785524188.7545116, "experiment_id": "8fe295b2", "concept_title": "EML Quantum Activation Functions", "concept_domain": "Applications", "research_mode": "team", "quality": "substantial", "quality_score": 0.7712399999999999, "catalog_references": [], "prompt_length": 20688, "files_placed": 4, "status": "keep"}
{"timestamp": 1785524262.081807, "experiment_id": "1cf3185d", "concept_title": "Hadwiger's Conjecture", "concept_domain": "Geometry", "research_mode": "team", "quality": "substantial", "quality_score": 0.8116299999999999, "catalog_references": [], "prompt_length": 24392, "files_placed": 4, "status": "keep"}
{"timestamp": 1785530908.1289327, "experiment_id": "aeb64258", "concept_title": "Arithmetic Mirror Symmetry for Calabi-Yau", "concept_domain": "Bridges", "research_mode": "team", "quality": "partial", "quality_score": 0.686, "catalog_references": [], "prompt_length": 2111, "files_placed": 3, "status": "keep"}
{"timestamp": 1785530983.3781862, "experiment_id": "03b10997", "concept_title": "Post-Quantum Cryptography: Lattice-Based Key Exchange", "concept_domain": "Cryptography", "research_mode": "team", "quality": "substantial", "quality_score": 0.7701199999999999, "catalog_references": [], "prompt_length": 23179, "files_placed": 4, "status": "keep"}
{"timestamp": 1785536622.3058665, "experiment_id": "4be361b7", "concept_title": "Close Proofs: Information-Geometric Bridge: Fisher Metric on Statistical Manifolds", "concept_domain": "Bridges", "research_mode": "team", "quality": "partial", "quality_score": 0.686, "catalog_references": [], "prompt_length": 2860, "files_placed": 23, "status": "keep"}
{"timestamp": 1785536697.2417648, "experiment_id": "61e33133", "concept_title": "EML Universal Approximation: Density of EML Functions", "concept_domain": "Applications", "research_mode": "team", "quality": "substantial", "quality_score": 0.7666899999999999, "catalog_references": [], "prompt_length": 23449, "files_placed": 4, "status": "keep"}
{"timestamp": 1785536772.4435875, "experiment_id": "ff2a2247", "concept_title": "Reconstruction Conjecture", "concept_domain": "Combinatorics", "research_mode": "team", "quality": "substantial", "quality_score": 0.7582199999999999, "catalog_references": [], "prompt_length": 24091, "files_placed": 4, "status": "keep"}
