{"timestamp": 1782596209.045519, "experiment_id": "f31c8198", "concept_title": "Random Graphs: Erd\u0151s-R\u00e9nyi Threshold Phenomena", "concept_domain": "Applications", "research_mode": "prove", "quality": "partial", "quality_score": 0.565585, "catalog_references": ["Catalog/Probability/Expectation.lean", "Catalog/Probability/Variance.lean", "Catalog/Probability/Independence.lean", "Catalog/Probability/UnionBound.lean", "Catalog/Combinatorics/Choose.lean", "Catalog/Analysis/Asymptotics.lean"], "prompt_length": 20307, "files_placed": 6, "status": "keep"}
{"timestamp": 1782598113.994044, "experiment_id": "8170e958", "concept_title": "Cryptographic Hash Functions: Collision Resistance from Hard Problems", "concept_domain": "Applications", "research_mode": "team", "quality": "partial", "quality_score": 0.5594, "catalog_references": [], "prompt_length": 22933, "files_placed": 7, "status": "keep"}
{"timestamp": 1782598210.2340436, "experiment_id": "c027516f", "concept_title": "Proof Complexity: Resolution and Cutting Planes", "concept_domain": "Applications", "research_mode": "prove", "quality": "substantial", "quality_score": 0.7101600000000001, "catalog_references": [], "prompt_length": 22864, "files_placed": 8, "status": "keep"}
{"timestamp": 1782599698.7608268, "experiment_id": "7e57e1f5", "concept_title": "Arithmetic Mirror Symmetry for Calabi-Yau", "concept_domain": "Novelty", "research_mode": "team", "quality": "substantial", "quality_score": 0.70122, "catalog_references": [], "prompt_length": 20660, "files_placed": 8, "status": "keep"}
{"timestamp": 1782599760.112343, "experiment_id": "c25c1b9e", "concept_title": "Extremal signed determinant of the resistance matrix of a connected simple graph", "concept_domain": "Novelty", "research_mode": "team", "quality": "substantial", "quality_score": 0.7665600000000001, "catalog_references": ["Mathlib.Combinatorics.SimpleGraph.Basic", "Mathlib.Combinatorics.SimpleGraph.Connectivity", "Mathlib.LinearAlgebra.Matrix.Determinant", "Mathlib.LinearAlgebra.Matrix.PosDef", "Mathlib.Data.Matrix.Basic"], "prompt_length": 20928, "files_placed": 7, "status": "keep"}
{"timestamp": 1782601053.8455005, "experiment_id": "470fcb83", "concept_title": "Idempotent Probability: Large Deviations", "concept_domain": "Novelty", "research_mode": "team", "quality": "substantial", "quality_score": 0.7623499999999999, "catalog_references": [], "prompt_length": 20653, "files_placed": 7, "status": "keep"}
{"timestamp": 1782601245.7639, "experiment_id": "26246c0e", "concept_title": "RSA Factorization with Partial p+q Knowledge and Small Private Exponent", "concept_domain": "Novelty", "research_mode": "team", "quality": "partial", "quality_score": 0.39061, "catalog_references": ["Wiener's 1990 attack", "Continued fractions in cryptanalysis"], "prompt_length": 20747, "files_placed": 6, "status": "discard"}
{"timestamp": 1782602586.633833, "experiment_id": "6fa4f641", "concept_title": "Maximum size of cycle-containing families of vectors", "concept_domain": "Novelty", "research_mode": "team", "quality": "substantial", "quality_score": 0.7798419999999999, "catalog_references": ["math.CO/1234567"], "prompt_length": 20829, "files_placed": 7, "status": "keep"}
{"timestamp": 1782604303.6793065, "experiment_id": "417ceff0", "concept_title": "Falsifiability of Multigraded Regularity Conjecture for Schubert Varieties via Pl\u00fccker Embedding", "concept_domain": "Novelty", "research_mode": "team", "quality": "partial", "quality_score": 0.49606231111111115, "catalog_references": ["arXiv:2503.14567", "MaclaganSmith2004", "BerkeschErmanSmith2020", "Fulton1997"], "prompt_length": 20938, "files_placed": 7, "status": "discard"}
{"timestamp": 1782606291.2126923, "experiment_id": "ba81674a", "concept_title": "Brualdi-Quinn Massey Strong Chromatic Index Conjecture for Bipartite Graphs", "concept_domain": "Novelty", "research_mode": "team", "quality": "substantial", "quality_score": 0.79596, "catalog_references": ["Brualdi and Quinn Massey (conjectured)", "arXiv:2304.12345 (current paper)"], "prompt_length": 20907, "files_placed": 7, "status": "keep"}
{"timestamp": 1782607746.1703913, "experiment_id": "2f2206c6", "concept_title": "Multiplicability of Upho Posets from Vertex-Transitive Graphs", "concept_domain": "Novelty", "research_mode": "team", "quality": "substantial", "quality_score": 0.71552, "catalog_references": ["FPZ_conjecture", "UphoPoset_definition", "LCIF_monoid_definition", "Regular_subgroup", "Cayley_graph"], "prompt_length": 23188, "files_placed": 7, "status": "keep"}
{"timestamp": 1782611720.385918, "experiment_id": "2d24ca82", "concept_title": "Regularized Sum of Primes via Analytic Continuation Beyond the Natural Boundary", "concept_domain": "Novelty", "research_mode": "team", "quality": "partial", "quality_score": 0.5835454545454546, "catalog_references": ["ArXiv: math.NT", "ArXiv: hep-th"], "prompt_length": 22965, "files_placed": 7, "status": "keep"}
{"timestamp": 1782611786.096514, "experiment_id": "f3fa5004", "concept_title": "Explicit bias lower bound for the density of n with s_2(n+t) >= s_2(n)", "concept_domain": "Novelty", "research_mode": "sorry_fill", "quality": "partial", "quality_score": 0.38602000000000003, "catalog_references": ["Catalog/Applications/CusickBitReversalInstances.lean", "Catalog/Theory/CusickPeriodicity.lean"], "prompt_length": 21792, "files_placed": 6, "status": "discard"}
{"timestamp": 1782615581.381172, "experiment_id": "ca01957a", "concept_title": "Tight asymptotic bound for the n\u2011queens completion threshold", "concept_domain": "Applications", "research_mode": "prove", "quality": "partial", "quality_score": 0.6280000000000001, "catalog_references": ["Catalog/Combinatorics/Probabilistic.lean", "Catalog/Applications/NQueens/Basic.lean", "Catalog/Combinatorics/Matchings.lean", "Catalog/Novelty/C5Threshold.lean"], "prompt_length": 22939, "files_placed": 7, "status": "keep"}
{"timestamp": 1782615717.5537872, "experiment_id": "f73687d8", "concept_title": "EML Kolmogorov-Arnold Representation", "concept_domain": "Applications", "research_mode": "team", "quality": "partial", "quality_score": 0.5230660465116279, "catalog_references": [], "prompt_length": 20957, "files_placed": 8, "status": "keep"}
{"timestamp": 1782615820.973075, "experiment_id": "c011c95b", "concept_title": "Zero-Knowledge Proofs: Schnorr Protocol", "concept_domain": "Novelty", "research_mode": "prove", "quality": "substantial", "quality_score": 0.7862199999999999, "catalog_references": [], "prompt_length": 20705, "files_placed": 8, "status": "keep"}
{"timestamp": 1782617194.8037014, "experiment_id": "49c290ff", "concept_title": "Constructing a canonical F-isocrystal to enhance the Gauss--Manin connection", "concept_domain": "Applications", "research_mode": "prove|formalize|counterexample|explore_structural_implications", "quality": "partial", "quality_score": 0.48585960124610594, "catalog_references": ["Catalog/FINAL/application/fibonacci_analysis", "Catalog/FINAL/applications/rank_of_apparition", "Catalog/FINAL/theorems/cassini_and_fibonacci"], "prompt_length": 20756, "files_placed": 6, "status": "discard"}
{"timestamp": 1782617387.692017, "experiment_id": "9e0667c2", "concept_title": "Hamiltonian Compression Factor of Cubic Edge-Transitive Graphs", "concept_domain": "Applications", "research_mode": "team", "quality": "substantial", "quality_score": 0.7800670000000001, "catalog_references": ["math.CO/graph_theory/hamiltonian_cycles", "math.CO/graph_theory/symmetric_graphs", "math.CO/graph_theory/cubic_graphs"], "prompt_length": 23079, "files_placed": 8, "status": "keep"}
{"timestamp": 1782618762.3538618, "experiment_id": "0a880828", "concept_title": "Existence of a Natural Boundary for the Prime Zeta Function in Imaginary Quadratic Fields", "concept_domain": "Novelty", "research_mode": "team", "quality": "substantial", "quality_score": 0.70384, "catalog_references": ["https://arxiv.org/abs/2001.12345", "https://arxiv.org/abs/2203.67890"], "prompt_length": 20792, "files_placed": 7, "status": "keep"}
{"timestamp": 1782619312.996782, "experiment_id": "552f4622", "concept_title": "Torsionness of \u03a3\u2011ramified Iwasawa modules over a \u2124\u209a\u2011extension", "concept_domain": "Applications", "research_mode": "formalize", "quality": "partial", "quality_score": 0.642034, "catalog_references": ["Catalog/Algebra/PowerSeries.lean", "Catalog/Algebra/IwasawaBasic.lean", "Catalog/NumberTheory/IwasawaTheory.lean"], "prompt_length": 18402, "files_placed": 6, "status": "keep"}
{"timestamp": 1782620911.1961265, "experiment_id": "72f7aee6", "concept_title": "Random Matrices: Edge Universality", "concept_domain": "Novelty", "research_mode": "team", "quality": "substantial", "quality_score": 0.73264, "catalog_references": [], "prompt_length": 22742, "files_placed": 8, "status": "keep"}
{"timestamp": 1782621044.0766122, "experiment_id": "a59363e7", "concept_title": "Exact Ratio Spectrum of Lagrange Constants under Integer Linear Fractional Transformations", "concept_domain": "Applications", "research_mode": "team", "quality": "partial", "quality_score": 0.631596, "catalog_references": ["math.NT/2301.01234", "math.NT/2105.06789"], "prompt_length": 20990, "files_placed": 8, "status": "keep"}
{"timestamp": 1782623023.0120811, "experiment_id": "f347664d", "concept_title": "A Converse to Finite Height Implying Semistability for p-adic Galois Representations", "concept_domain": "Novelty", "research_mode": "team", "quality": "partial", "quality_score": 0.535421090909091, "catalog_references": ["arXiv:2404.19603", "Liu's work on finite height representations"], "prompt_length": 20804, "files_placed": 4, "status": "keep"}
{"timestamp": 1782623092.2114577, "experiment_id": "c7101b5e", "concept_title": "Formal Verification of Algorithms", "concept_domain": "Applications", "research_mode": "prove", "quality": "partial", "quality_score": 0.6887099999999999, "catalog_references": [], "prompt_length": 20233, "files_placed": 2, "status": "keep"}
{"timestamp": 1782624477.3477142, "experiment_id": "4554c3a3", "concept_title": "EML Interpolation Theory: Stone-Weierstrass for exp-log Networks", "concept_domain": "Applications", "research_mode": "team", "quality": "partial", "quality_score": 0.630526, "catalog_references": [], "prompt_length": 20568, "files_placed": 7, "status": "keep"}
{"timestamp": 1782624562.5500867, "experiment_id": "9ee5d694", "concept_title": "EML Transseries: Asymptotic Expansions Beyond Power Series", "concept_domain": "Applications", "research_mode": "team", "quality": "partial", "quality_score": 0.6915199999999999, "catalog_references": [], "prompt_length": 20816, "files_placed": 7, "status": "keep"}
{"timestamp": 1782624718.4077506, "experiment_id": "8ffddeae", "concept_title": "Balanced Side Lengths Maximize Spanning Trees in Free Boundary Product Grids", "concept_domain": "Applications", "research_mode": "team", "quality": "substantial", "quality_score": 0.76734, "catalog_references": ["math.CO/05C05", "math.CO/05C30", "math.SP/05C50"], "prompt_length": 20861, "files_placed": 7, "status": "keep"}
{"timestamp": 1782624877.0347536, "experiment_id": "dbb7efcb", "concept_title": "EML Differential Equations: ODEs with Exponential-Logarithmic Coefficients", "concept_domain": "Novelty", "research_mode": "team", "quality": "substantial", "quality_score": 0.79816, "catalog_references": [], "prompt_length": 20815, "files_placed": 8, "status": "keep"}
{"timestamp": 1782626615.8198252, "experiment_id": "b1625408", "concept_title": "Join of Gorenstein Polytopes is Not Necessarily Gorenstein", "concept_domain": "Applications", "research_mode": "team", "quality": "partial", "quality_score": 0.69204, "catalog_references": ["math.CO", "math.AG"], "prompt_length": 20119, "files_placed": 6, "status": "keep"}
{"timestamp": 1782627888.8664072, "experiment_id": "cff6413b", "concept_title": "Exact lower semi-inducibility profile for the red\u2011blue star S_{2,1}", "concept_domain": "Novelty", "research_mode": "team", "quality": "substantial", "quality_score": 0.8251200000000001, "catalog_references": ["math.CO:2305.XXXX"], "prompt_length": 22976, "files_placed": 8, "status": "keep"}
{"timestamp": 1782628071.16387, "experiment_id": "c0f7c830", "concept_title": "Sharp lower bound for L(x,y) under Hypothesis U", "concept_domain": "Novelty", "research_mode": "formalize", "quality": "partial", "quality_score": 0.63496, "catalog_references": ["11N25", "11N37"], "prompt_length": 21006, "files_placed": 6, "status": "keep"}
{"timestamp": 1782629773.654532, "experiment_id": "5d028d25", "concept_title": "Prismatic Purity for F-Crystals on Regular Schemes", "concept_domain": "Novelty", "research_mode": "team", "quality": "substantial", "quality_score": 0.747936, "catalog_references": ["math.AG", "math.NT"], "prompt_length": 21016, "files_placed": 7, "status": "keep"}
{"timestamp": 1782631503.986569, "experiment_id": "53e074b6", "concept_title": "Invariance of the field invariant m_f under purely inseparable base change", "concept_domain": "Applications", "research_mode": "prove", "quality": "partial", "quality_score": 0.6700199999999998, "catalog_references": ["Catalog/HenselianTopology.lean", "Catalog/TropicalHensel.lean", "FINAL/Vee/CoherentSheaves.lean"], "prompt_length": 23106, "files_placed": 7, "status": "keep"}
{"timestamp": 1782631907.4585345, "experiment_id": "db606ba2", "concept_title": "Exact multicolor Ramsey threshold for stars in s-connector graphs", "concept_domain": "Applications", "research_mode": "team", "quality": "partial", "quality_score": 0.6228, "catalog_references": ["arXiv:2406.00001"], "prompt_length": 20890, "files_placed": 8, "status": "keep"}
{"timestamp": 1782633529.467013, "experiment_id": "5f11db87", "concept_title": "Hadwiger--Debrunner (p,q) theorem for convex splinters", "concept_domain": "Applications", "research_mode": "team", "quality": "partial", "quality_score": 0.6981999999999999, "catalog_references": ["Arocha--Bracho--Montejano Helly theorem for convex splinters: Helly number 2d+1", "Katchalski--Liu fractional Helly theorem", "Alon--Kleitman proof of the Hadwiger--Debrunner (p,q) theorem", "Mathlib.Analysis.Convex.Basic", "Mathlib.LinearAlgebra.AffineSpace.AffineSubspace"], "prompt_length": 20954, "files_placed": 7, "status": "keep"}
{"timestamp": 1782633945.1403706, "experiment_id": "cff12e07", "concept_title": "Super-exponential growth of the number of symmetric chain decompositions of M(n)", "concept_domain": "Novelty", "research_mode": "team", "quality": "partial", "quality_score": 0.6639999999999999, "catalog_references": ["math.CO"], "prompt_length": 23024, "files_placed": 8, "status": "keep"}
{"timestamp": 1782634273.7555282, "experiment_id": "9a7cbc8b", "concept_title": "Plethystic Triviality of the Shifted t-Schur Basis", "concept_domain": "Novelty", "research_mode": "team", "quality": "substantial", "quality_score": 0.7861499999999999, "catalog_references": ["Schur Q-functions", "strict partitions", "neutral fermion vertex operators", "odd power-sum symmetric functions", "Lean mathlib: MvPolynomial, PowerSeries, Finsupp, Nat.Odd"], "prompt_length": 21167, "files_placed": 6, "status": "keep"}
{"timestamp": 1782635220.2320335, "experiment_id": "e5555684", "concept_title": "Proof of Heged\u00e7s bound via spectral constraints in combinatorial families", "concept_domain": "Novelty", "research_mode": "team", "quality": "partial", "quality_score": 0.485834, "catalog_references": ["2409.07877"], "prompt_length": 20720, "files_placed": 8, "status": "discard"}
{"timestamp": 1782636601.4910078, "experiment_id": "a530b001", "concept_title": "Circuit Complexity: Monotone Lower Bounds", "concept_domain": "Novelty", "research_mode": "prove", "quality": "substantial", "quality_score": 0.7436, "catalog_references": [], "prompt_length": 20727, "files_placed": 7, "status": "keep"}
{"timestamp": 1782637815.4689298, "experiment_id": "5870167a", "concept_title": "Cofinite realization of every even incoherence index by maximal standard frames", "concept_domain": "Novelty", "research_mode": "team", "quality": "partial", "quality_score": 0.69256, "catalog_references": ["Moss--Pedersen coherence criterion for measurable strict-majority frames", "Conjecture 5.7 of Moss--Pedersen, resolved negatively by unbounded incoherence index", "Conjecture B.25 middle-layer family from Moss--Pedersen", "Mathlib: Finset, Fintype, List.countP, finite Boolean cubes"], "prompt_length": 23104, "files_placed": 7, "status": "keep"}
{"timestamp": 1782638013.0025723, "experiment_id": "f6f6439c", "concept_title": "Linear one-set wall-Menger bound for elementary walls", "concept_domain": "Novelty", "research_mode": "team", "quality": "partial", "quality_score": 0.5631599999999999, "catalog_references": ["Menger's theorem for finite graphs", "Robertson-Seymour wall terminology", "vertex-disjoint path packing versus vertex separator duality"], "prompt_length": 23283, "files_placed": 8, "status": "keep"}
{"timestamp": 1782640299.079798, "experiment_id": "c8e22e5a", "concept_title": "EML Differential Equations: ODEs with Exponential-Logarithmic Coefficients", "concept_domain": "Applications", "research_mode": "team", "quality": "substantial", "quality_score": 0.820584, "catalog_references": [], "prompt_length": 20825, "files_placed": 8, "status": "keep"}
{"timestamp": 1782640432.5831506, "experiment_id": "8d0e7e8c", "concept_title": "Excluded minors for Z_n-gainable biased graphs", "concept_domain": "Novelty", "research_mode": "team", "quality": "partial", "quality_score": 0.57208, "catalog_references": ["Zaslavsky 1981", "Gerards 2006", "Funk 2015", "ArXiv:2305.xxx"], "prompt_length": 20645, "files_placed": 2, "status": "keep"}
{"timestamp": 1782641265.5882857, "experiment_id": "ce8c041d", "concept_title": "EML Transseries: Asymptotic Expansions Beyond Power Series", "concept_domain": "Applications", "research_mode": "formalize", "quality": "partial", "quality_score": 0.5816, "catalog_references": ["Catalog/EML/Transseries/Valuation.lean", "Catalog/EML/Algorithms/Reconstruction.lean", "Catalog/Math/ValuationTheory/WellFounded.lean"], "prompt_length": 20821, "files_placed": 7, "status": "keep"}
{"timestamp": 1782641455.2504127, "experiment_id": "bac3bfcc", "concept_title": "Statistical Mechanics: Ising Model Phase Transition", "concept_domain": "Novelty", "research_mode": "prove", "quality": "partial", "quality_score": 0.562048, "catalog_references": [], "prompt_length": 20694, "files_placed": 6, "status": "keep"}
{"timestamp": 1782643203.2877412, "experiment_id": "00e5c711", "concept_title": "Wall-Menger Separator Optimality Conjecture", "concept_domain": "Applications", "research_mode": "team", "quality": "partial", "quality_score": 0.61002, "catalog_references": ["math.CO", "Menger_theorem", "wall_decomposition", "flat_wall_theorem"], "prompt_length": 20938, "files_placed": 7, "status": "keep"}
{"timestamp": 1782643267.181741, "experiment_id": "6ac1dc4e", "concept_title": "Rainbow triangle density lower bound conjecture", "concept_domain": "Applications", "research_mode": "team", "quality": "partial", "quality_score": 0.34884000000000004, "catalog_references": ["LiNingShiZhang2024"], "prompt_length": 20758, "files_placed": 8, "status": "discard"}
{"timestamp": 1782645193.1904337, "experiment_id": "e5dd524d", "concept_title": "EML Fixed-Point Theorem: exp-log Iteration Convergence", "concept_domain": "Applications", "research_mode": "team", "quality": "partial", "quality_score": 0.3921804000000001, "catalog_references": [], "prompt_length": 21504, "files_placed": 8, "status": "discard"}
{"timestamp": 1782646762.7168753, "experiment_id": "fdadfe48", "concept_title": "The most natural next step is to attack the residue class isolated by the", "concept_domain": "Novelty", "research_mode": "prove", "quality": "partial", "quality_score": 0.5959, "catalog_references": ["Catalog/FINAL/Physics/ErdosStraus.lean", "Catalog/FINAL/Physics/ErdosStrausUnified.lean", "Catalog/FINAL/Physics/ErdosStrausObstruction.lean"], "prompt_length": 23567, "files_placed": 10, "status": "keep"}
{"timestamp": 1782648729.0358002, "experiment_id": "4bc14309", "concept_title": "Prismatic Purity for F-Crystals on Regular Schemes", "concept_domain": "Applications", "research_mode": "prove", "quality": "partial", "quality_score": 0.49242371929824563, "catalog_references": ["Catalog/ProofAutomation/Fibonacci.lean"], "prompt_length": 23158, "files_placed": 6, "status": "discard"}
{"timestamp": 1782650526.0197988, "experiment_id": "7e2e6a70", "concept_title": "A Sharp Upper Bound for Uniform VC\u2011Dimension Families via Layered Stars", "concept_domain": "Novelty", "research_mode": "sorry_fill", "quality": "partial", "quality_score": 0.36300923636363636, "catalog_references": ["Catalog/Novelty/LayeredStarFormula.lean", "Catalog/Novelty/UniformVCStar.lean", "Catalog/Novelty/Binomial.lean"], "prompt_length": 21085, "files_placed": 8, "status": "discard"}
{"timestamp": 1782651878.4895456, "experiment_id": "ef629b7b", "concept_title": "Row Sum Fibonacci Property of Pascal-like Riordan Array", "concept_domain": "Novelty", "research_mode": "prove", "quality": "substantial", "quality_score": 0.722996, "catalog_references": ["Catalog/FINAL/EMLFibonacci.lean", "Catalog/FINAL/EMLBinomial.lean", "Catalog/FINAL/EMLGeneratingFunctions.lean"], "prompt_length": 23046, "files_placed": 6, "status": "keep"}
{"timestamp": 1782652152.741999, "experiment_id": "42ce6f47", "concept_title": "Jacobian Conjecture: Degree 2 and 3 Cases", "concept_domain": "Novelty", "research_mode": "prove", "quality": "partial", "quality_score": 0.518, "catalog_references": [], "prompt_length": 20737, "files_placed": 9, "status": "keep"}
