{"timestamp": 1784860838.107967, "experiment_id": "a9c9c0c1", "concept_title": "**Conjecture.** For a finite family of bad events with dependency degree at most", "concept_domain": "Novelty", "research_mode": "team", "quality": "partial", "quality_score": 0.67, "catalog_references": [], "prompt_length": 10451, "files_placed": 2, "status": "keep"}
{"timestamp": 1784860844.5127277, "experiment_id": "5a4bc860", "concept_title": "Novikov-Fixed-Point: Existence of Unique Solutions for Causally Loop-Closed Spacetimes", "concept_domain": "Novelty", "research_mode": "team", "quality": "partial", "quality_score": 0.58, "catalog_references": [], "prompt_length": 3239, "files_placed": 4, "status": "keep"}
{"timestamp": 1784865136.8015642, "experiment_id": "08b12f3b", "concept_title": "ArXiv paper: The Spine: A Supersingular Highway", "concept_domain": "Novelty", "research_mode": "team", "quality": "partial", "quality_score": 0.63, "catalog_references": [], "prompt_length": 11526, "files_placed": 2, "status": "keep"}
{"timestamp": 1784865145.0604134, "experiment_id": "0e007163", "concept_title": "Future directions from cycle 279ae676", "concept_domain": "Pythagorean", "research_mode": "team", "quality": "partial", "quality_score": 0.63, "catalog_references": [], "prompt_length": 13132, "files_placed": 2, "status": "keep"}
{"timestamp": 1784868624.3218353, "experiment_id": "b648d8e5", "concept_title": "Deepening: 1. **Repair the definition before studying asymptotics.** The literal rule exclu", "concept_domain": "Applications", "research_mode": "team", "quality": "partial", "quality_score": 0.6, "catalog_references": [], "prompt_length": 3983, "files_placed": 311, "status": "keep"}
{"timestamp": 1784868639.9673645, "experiment_id": "66a73fad", "concept_title": "**Conjecture.** In the random graph process, with probability tending to one, th", "concept_domain": "Physics", "research_mode": "team", "quality": "partial", "quality_score": 0.62, "catalog_references": [], "prompt_length": 15784, "files_placed": 175, "status": "keep"}
{"timestamp": 1784875666.4409106, "experiment_id": "29ba074c", "concept_title": "Pythagorean-Energy-Spectrum: Gradient Descent Factoring on the Berggren Tree", "concept_domain": "NumberTheory", "research_mode": "team", "quality": "partial", "quality_score": 0.6, "catalog_references": [], "prompt_length": 3340, "files_placed": 4, "status": "keep"}
{"timestamp": 1784875675.1138144, "experiment_id": "c760f6fc", "concept_title": "The formal development studies a precise surrogate for \u201cthe space of mathematica", "concept_domain": "Shared", "research_mode": "team", "quality": "partial", "quality_score": 0.63, "catalog_references": [], "prompt_length": 8474, "files_placed": 4, "status": "keep"}
{"timestamp": 1784875683.3300722, "experiment_id": "b853373a", "concept_title": "Close Proofs: ArXiv paper: Reproducing the k-copwin Algorithm: Theory vs. Implementa", "concept_domain": "Novelty", "research_mode": "team", "quality": "partial", "quality_score": 0.66, "catalog_references": [], "prompt_length": 3680, "files_placed": 2, "status": "keep"}
{"timestamp": 1784886129.5606968, "experiment_id": "3984694e", "concept_title": "ArXiv paper: A memorial tribute: Adriano Garsia (1928--2024)", "concept_domain": "NumberTheory", "research_mode": "team", "quality": "partial", "quality_score": 0.618, "catalog_references": [], "prompt_length": 4544, "files_placed": 2, "status": "keep"}
{"timestamp": 1784886137.4565706, "experiment_id": "73ec6b88", "concept_title": "The completed development has two complementary formalizations. `Catalog/NumberT", "concept_domain": "Probability", "research_mode": "team", "quality": "partial", "quality_score": 0.58, "catalog_references": [], "prompt_length": 10943, "files_placed": 2, "status": "keep"}
{"timestamp": 1784894645.8874474, "experiment_id": "30631f2b", "concept_title": "Random-Matrix: Wigner Semicircle Law Convergence for Wigner Ensembles", "concept_domain": "MachineLearning", "research_mode": "team", "quality": "partial", "quality_score": 0.57, "catalog_references": [], "prompt_length": 3227, "files_placed": 4, "status": "keep"}
{"timestamp": 1784897166.3746374, "experiment_id": "b4f06498", "concept_title": "ArXiv paper: Ranks of Elliptic Curves Twisted by Quadratic Forms", "concept_domain": "Applications", "research_mode": "team", "quality": "partial", "quality_score": 0.57, "catalog_references": [], "prompt_length": 10967, "files_placed": 2, "status": "keep"}
{"timestamp": 1784900819.727719, "experiment_id": "ec157a87", "concept_title": "Avoidance of t-fold sumsets in dense subsets of [n]", "concept_domain": "Logic", "research_mode": "team", "quality": "partial", "quality_score": 0.57, "catalog_references": ["arXiv:2406.XXXXX (this paper)", "Hern\u00e1ndez-Hetzel (2026) on growth of sumsets in dense sets"], "prompt_length": 10654, "files_placed": 2, "status": "keep"}
{"timestamp": 1784902348.385856, "experiment_id": "b519e277", "concept_title": "The completed Lean development proves the local arithmetic dictionary for the qu", "concept_domain": "Applications", "research_mode": "team", "quality": "partial", "quality_score": 0.63, "catalog_references": [], "prompt_length": 15820, "files_placed": 2, "status": "keep"}
{"timestamp": 1784904080.8536642, "experiment_id": "b873ab80", "concept_title": "**Conjecture.** For every family of devices that exactly resolves the first `n` ", "concept_domain": "Physics", "research_mode": "team", "quality": "partial", "quality_score": 0.62, "catalog_references": [], "prompt_length": 17427, "files_placed": 2, "status": "keep"}
{"timestamp": 1784904897.4725962, "experiment_id": "2153ae5a", "concept_title": "ArXiv paper: On Agreement Subtrees in Multiple Pylogenetic Trees", "concept_domain": "Novelty", "research_mode": "team", "quality": "partial", "quality_score": 0.64, "catalog_references": [], "prompt_length": 12013, "files_placed": 2, "status": "keep"}
{"timestamp": 1784908320.6585667, "experiment_id": "86d1611f", "concept_title": "The original proposal mixes two different notions. The files now separate them.", "concept_domain": "Applications", "research_mode": "team", "quality": "partial", "quality_score": 0.63, "catalog_references": [], "prompt_length": 13871, "files_placed": 2, "status": "keep"}
{"timestamp": 1784908328.5393124, "experiment_id": "cc3b4f99", "concept_title": "Close Proofs: Holographic Primes: The Prime Number AdS/CFT Correspondence", "concept_domain": "Applications", "research_mode": "team", "quality": "partial", "quality_score": 0.52, "catalog_references": [], "prompt_length": 3730, "files_placed": 1, "status": "keep"}
{"timestamp": 1784908336.5813448, "experiment_id": "2a754509", "concept_title": "L-Function-Zeroes: Explicit Bounds on Low-Lying Zeroes of Automorphic L-Functions", "concept_domain": "NumberTheory", "research_mode": "team", "quality": "partial", "quality_score": 0.46, "catalog_references": [], "prompt_length": 3234, "files_placed": 2, "status": "discard"}
{"timestamp": 1784915997.423531, "experiment_id": "4ffa8161", "concept_title": "Close Proofs: Cellular Automata at the Ordinals: Transfinite Computation", "concept_domain": "Logic", "research_mode": "team", "quality": "partial", "quality_score": 0.6, "catalog_references": [], "prompt_length": 18414, "files_placed": 4, "status": "keep"}
{"timestamp": 1784919712.7683797, "experiment_id": "06d71b6e", "concept_title": "Infinite-Dimensional Chess: Winning on the Hilbert Board", "concept_domain": "Geometry", "research_mode": "team", "quality": "partial", "quality_score": 0.57, "catalog_references": [], "prompt_length": 24134, "files_placed": 4, "status": "keep"}
{"timestamp": 1784922872.8472338, "experiment_id": "68dd266b", "concept_title": "Cybernetic-Symbiosis: Optimal Co-Evolution Bounds of Human-AI Neural Interfaces", "concept_domain": "Physics", "research_mode": "team", "quality": "partial", "quality_score": 0.55, "catalog_references": [], "prompt_length": 23761, "files_placed": 4, "status": "keep"}
{"timestamp": 1784922885.48563, "experiment_id": "6bb52b3a", "concept_title": "ArXiv paper: Generalizations of nets and Latin squares", "concept_domain": "Computation", "research_mode": "team", "quality": "partial", "quality_score": 0.6, "catalog_references": [], "prompt_length": 25786, "files_placed": 4, "status": "keep"}
{"timestamp": 1784922902.6170895, "experiment_id": "cb7978a9", "concept_title": "This cycle deepened the theory of the fixed-amplitude model, where every present", "concept_domain": "Computation", "research_mode": "team", "quality": "partial", "quality_score": 0.55, "catalog_references": [], "prompt_length": 29360, "files_placed": 4, "status": "keep"}
{"timestamp": 1784928715.4730246, "experiment_id": "edb35a0b", "concept_title": "Close Proofs: Speculative: Mathematics as a Phase Transition", "concept_domain": "Tropical", "research_mode": "team", "quality": "partial", "quality_score": 0.5, "catalog_references": [], "prompt_length": 3706, "files_placed": 2, "status": "keep"}
{"timestamp": 1784928733.6678407, "experiment_id": "1f866dac", "concept_title": "p-adic Langlands for GL\u2082(Q_p)", "concept_domain": "Bridges", "research_mode": "team", "quality": "partial", "quality_score": 0.63, "catalog_references": [], "prompt_length": 24852, "files_placed": 4, "status": "keep"}
{"timestamp": 1784928753.2568085, "experiment_id": "78cd863a", "concept_title": "Taxicab Number Generalizations: Hardy-Ramanujan Numbers", "concept_domain": "Computation", "research_mode": "team", "quality": "partial", "quality_score": 0.63498, "catalog_references": [], "prompt_length": 24886, "files_placed": 4, "status": "keep"}
{"timestamp": 1784935462.1128974, "experiment_id": "e8a20d63", "concept_title": "`Heegner163.lean` gives a kernel-checked elementary chain connecting Euler's", "concept_domain": "Pythagorean", "research_mode": "team", "quality": "partial", "quality_score": 0.63, "catalog_references": [], "prompt_length": 27066, "files_placed": 4, "status": "keep"}
{"timestamp": 1784935466.6244895, "experiment_id": "5a7b49b0", "concept_title": "Quantum Random Walks on Cayley Graphs: Spectral Gaps and Mixing Times", "concept_domain": "Logic", "research_mode": "team", "quality": "partial", "quality_score": 0.58, "catalog_references": [], "prompt_length": 26090, "files_placed": 5, "status": "keep"}
{"timestamp": 1784935485.5571556, "experiment_id": "a4e412f3", "concept_title": "Happy End Problem", "concept_domain": "Geometry", "research_mode": "team", "quality": "substantial", "quality_score": 0.75, "catalog_references": [], "prompt_length": 23692, "files_placed": 4, "status": "keep"}
{"timestamp": 1784939093.0873365, "experiment_id": "920a890c", "concept_title": "The formal development establishes a concrete genuinely non-strict bicategory: i", "concept_domain": "Logic", "research_mode": "team", "quality": "partial", "quality_score": 0.6, "catalog_references": [], "prompt_length": 26675, "files_placed": 4, "status": "keep"}
{"timestamp": 1784946909.4926598, "experiment_id": "41e2ee03", "concept_title": "ArXiv paper: Several families of incommensurable noncompact hyperbolic Coxeter polytopes", "concept_domain": "Bridges", "research_mode": "team", "quality": "partial", "quality_score": 0.63, "catalog_references": [], "prompt_length": 25266, "files_placed": 4, "status": "keep"}
{"timestamp": 1784946913.3726494, "experiment_id": "d05d57b6", "concept_title": "Lattice-LWE: Formal Equivalence Between Decision-LWE and Search-LWE", "concept_domain": "Cryptography", "research_mode": "team", "quality": "partial", "quality_score": 0.68, "catalog_references": [], "prompt_length": 24805, "files_placed": 4, "status": "keep"}
{"timestamp": 1784961424.2754903, "experiment_id": "81b94eec", "concept_title": "Birch and Swinnerton-Dyer Conjecture", "concept_domain": "Algebra", "research_mode": "team", "quality": "partial", "quality_score": 0.43, "catalog_references": [], "prompt_length": 3287, "files_placed": 2, "status": "discard"}
{"timestamp": 1784961440.541058, "experiment_id": "d6b505de", "concept_title": "Cross-Reality-Entropy: Second Law of Thermodynamics for Multiversal Ensembles", "concept_domain": "Physics", "research_mode": "team", "quality": "substantial", "quality_score": 0.75, "catalog_references": [], "prompt_length": 24834, "files_placed": 5, "status": "keep"}
{"timestamp": 1784971243.314774, "experiment_id": "f90ec3a1", "concept_title": "Strange Loops: Self-Reference and G\u00f6del's Incompleteness", "concept_domain": "Novelty", "research_mode": "team", "quality": "partial", "quality_score": 0.69, "catalog_references": [], "prompt_length": 21827, "files_placed": 4, "status": "keep"}
{"timestamp": 1784971247.356917, "experiment_id": "f853fcd6", "concept_title": "ArXiv paper: Matroid correspondence", "concept_domain": "Bridges", "research_mode": "team", "quality": "substantial", "quality_score": 0.73, "catalog_references": [], "prompt_length": 24086, "files_placed": 4, "status": "keep"}
{"timestamp": 1784971256.9366596, "experiment_id": "6296b01e", "concept_title": "**Conjecture.** For compact metric cognitive systems related by a topological co", "concept_domain": "Algebra", "research_mode": "team", "quality": "substantial", "quality_score": 0.75, "catalog_references": [], "prompt_length": 22600, "files_placed": 4, "status": "keep"}
{"timestamp": 1784971261.5127826, "experiment_id": "872b26ee", "concept_title": "Cryptography from the Collatz Conjecture: One-Way Functions from Iterated Maps", "concept_domain": "NumberTheory", "research_mode": "team", "quality": "substantial", "quality_score": 0.79, "catalog_references": [], "prompt_length": 25610, "files_placed": 4, "status": "keep"}
{"timestamp": 1784976784.506103, "experiment_id": "928798aa", "concept_title": "Quantum Mechanics: Spectral Theory of Hydrogen", "concept_domain": "Physics", "research_mode": "prove", "quality": "substantial", "quality_score": 0.7, "catalog_references": [], "prompt_length": 23319, "files_placed": 4, "status": "keep"}
{"timestamp": 1784976788.54347, "experiment_id": "905765f9", "concept_title": "[Reset] Fresh approach in Shared", "concept_domain": "Shared", "research_mode": "team", "quality": "substantial", "quality_score": 0.76, "catalog_references": [], "prompt_length": 24927, "files_placed": 4, "status": "keep"}
{"timestamp": 1784988591.4170275, "experiment_id": "aa1e249d", "concept_title": "ArXiv paper: The Endpoint Cardinality of Discrete Cube Skeleta", "concept_domain": "Cryptography", "research_mode": "team", "quality": "partial", "quality_score": 0.59, "catalog_references": [], "prompt_length": 4635, "files_placed": 3, "status": "keep"}
{"timestamp": 1784988599.5330396, "experiment_id": "1aa4bedd", "concept_title": "PAC-Bayes Generalization Bounds", "concept_domain": "Probability", "research_mode": "prove", "quality": "substantial", "quality_score": 0.7, "catalog_references": [], "prompt_length": 24176, "files_placed": 7, "status": "keep"}
{"timestamp": 1784988626.6534607, "experiment_id": "1163ea67", "concept_title": "Entropy Power Inequality: Sharp Version", "concept_domain": "Probability", "research_mode": "team", "quality": "partial", "quality_score": 0.68, "catalog_references": [], "prompt_length": 23624, "files_placed": 6, "status": "keep"}
{"timestamp": 1784993257.0324042, "experiment_id": "9f0b015d", "concept_title": "Proof Automation: Custom Lean 4 Tactics", "concept_domain": "Logic", "research_mode": "prove", "quality": "substantial", "quality_score": 0.74, "catalog_references": [], "prompt_length": 23229, "files_placed": 4, "status": "keep"}
{"timestamp": 1784993261.0570683, "experiment_id": "ee9035cd", "concept_title": "Tropical Hodge Theory", "concept_domain": "Tropical", "research_mode": "team", "quality": "partial", "quality_score": 0.68, "catalog_references": [], "prompt_length": 22862, "files_placed": 4, "status": "keep"}
{"timestamp": 1784994453.1539862, "experiment_id": "2ae125a9", "concept_title": "The repaired repeated-summand rule is now completely classified: its unique traj", "concept_domain": "Pythagorean", "research_mode": "team", "quality": "substantial", "quality_score": 0.78, "catalog_references": [], "prompt_length": 26042, "files_placed": 4, "status": "keep"}
{"timestamp": 1784996900.4703426, "experiment_id": "5fcde7e0", "concept_title": "EML Differential Algebra: Closure Properties", "concept_domain": "Applications", "research_mode": "team", "quality": "substantial", "quality_score": 0.76, "catalog_references": [], "prompt_length": 24357, "files_placed": 5, "status": "keep"}
{"timestamp": 1784996904.5347323, "experiment_id": "bb3a8583", "concept_title": "ArXiv paper: Dense sets without large sumsets", "concept_domain": "Computation", "research_mode": "team", "quality": "substantial", "quality_score": 0.77, "catalog_references": [], "prompt_length": 25518, "files_placed": 4, "status": "keep"}
{"timestamp": 1785000176.7086864, "experiment_id": "b59af725", "concept_title": "Spectral Theory: Self-Adjoint Operators", "concept_domain": "Physics", "research_mode": "prove", "quality": "substantial", "quality_score": 0.73, "catalog_references": [], "prompt_length": 15845, "files_placed": 4, "status": "keep"}
{"timestamp": 1785003441.1197994, "experiment_id": "901b537c", "concept_title": "Gravity as Quantum Error Correction: Spacetime from Codes", "concept_domain": "Physics", "research_mode": "team", "quality": "substantial", "quality_score": 0.77, "catalog_references": [], "prompt_length": 25713, "files_placed": 4, "status": "keep"}
{"timestamp": 1785009052.2634094, "experiment_id": "7b875dce", "concept_title": "ArXiv paper: Properties of the Tropical Characteristic Polynomial of Symmetric Matrices", "concept_domain": "Tropical", "research_mode": "team", "quality": "substantial", "quality_score": 0.71, "catalog_references": [], "prompt_length": 25463, "files_placed": 5, "status": "keep"}
{"timestamp": 1785010593.4594448, "experiment_id": "0d06265a", "concept_title": "EML Category: The Category of EML-Computable Maps", "concept_domain": "Applications", "research_mode": "team", "quality": "substantial", "quality_score": 0.75, "catalog_references": [], "prompt_length": 25009, "files_placed": 4, "status": "keep"}
{"timestamp": 1785010599.4155157, "experiment_id": "7277c96e", "concept_title": "Beal's Conjecture", "concept_domain": "NumberTheory", "research_mode": "team", "quality": "substantial", "quality_score": 0.75, "catalog_references": [], "prompt_length": 24826, "files_placed": 4, "status": "keep"}
{"timestamp": 1785010606.3614962, "experiment_id": "92c4b5fc", "concept_title": "Tropical Compactification of Moduli Spaces", "concept_domain": "Tropical", "research_mode": "team", "quality": "substantial", "quality_score": 0.72, "catalog_references": [], "prompt_length": 24904, "files_placed": 4, "status": "keep"}
{"timestamp": 1785014249.2729633, "experiment_id": "8110b227", "concept_title": "Topological Data Analysis: Persistent Homology Stability", "concept_domain": "Geometry", "research_mode": "team", "quality": "partial", "quality_score": 0.66, "catalog_references": [], "prompt_length": 23765, "files_placed": 4, "status": "keep"}
{"timestamp": 1785017896.0544302, "experiment_id": "a31e0b39", "concept_title": "Game of Life Universality", "concept_domain": "Computation", "research_mode": "team", "quality": "partial", "quality_score": 0.52, "catalog_references": [], "prompt_length": 3245, "files_placed": 2, "status": "keep"}
{"timestamp": 1785021634.4897206, "experiment_id": "311c4349", "concept_title": "Random Matrices: Edge Universality", "concept_domain": "Probability", "research_mode": "team", "quality": "partial", "quality_score": 0.54, "catalog_references": [], "prompt_length": 3161, "files_placed": 3, "status": "keep"}
{"timestamp": 1785025280.9627912, "experiment_id": "7b86dab6", "concept_title": "Holographic Mathematics: Bulk-Boundary Proof Duality", "concept_domain": "Physics", "research_mode": "team", "quality": "partial", "quality_score": 0.64, "catalog_references": [], "prompt_length": 4008, "files_placed": 2, "status": "keep"}
{"timestamp": 1785025295.4670663, "experiment_id": "3d6ad336", "concept_title": "Code-Based Cryptography: McEliece Security on the Binary Goppa Code", "concept_domain": "Cryptography", "research_mode": "team", "quality": "substantial", "quality_score": 0.7, "catalog_references": [], "prompt_length": 23132, "files_placed": 5, "status": "keep"}
{"timestamp": 1785025299.5595858, "experiment_id": "d94c6678", "concept_title": "Zero-Knowledge Theorem Proving: I Can Prove Fermat's Last Theorem Without Showing You the Proof", "concept_domain": "Cryptography", "research_mode": "team", "quality": "substantial", "quality_score": 0.71, "catalog_references": [], "prompt_length": 25894, "files_placed": 6, "status": "keep"}
{"timestamp": 1785032729.8874154, "experiment_id": "25e8f86d", "concept_title": "Neural Tangent Kernel: Convergence of Gradient Descent", "concept_domain": "Computation", "research_mode": "team", "quality": "substantial", "quality_score": 0.76, "catalog_references": [], "prompt_length": 24955, "files_placed": 6, "status": "keep"}
{"timestamp": 1785032734.2507563, "experiment_id": "830d234a", "concept_title": "ML Reinforcement Learning: Convergence of Policy Gradient Methods", "concept_domain": "Computation", "research_mode": "team", "quality": "substantial", "quality_score": 0.72, "catalog_references": [], "prompt_length": 21204, "files_placed": 4, "status": "keep"}
{"timestamp": 1785044207.1287775, "experiment_id": "55a94506", "concept_title": "Information-Geometric Bridge: Fisher Metric on Statistical Manifolds", "concept_domain": "Bridges", "research_mode": "team", "quality": "partial", "quality_score": 0.63, "catalog_references": [], "prompt_length": 2620, "files_placed": 1417, "status": "keep"}
