{"timestamp": 1782026514.6500735, "experiment_id": "51640204", "concept_title": "Lattice Cryptography: LWE Hardness", "concept_domain": "Pythagorean", "research_mode": "formalize", "quality": "partial", "quality_score": 0.6127985535714285, "catalog_references": ["Tropical/MatrixTropical.lean", "Data/Fin/Perm.lean", "Order/CompleteLattice.lean", "Data/Random.lean"], "prompt_length": 20719, "files_placed": 16, "status": "keep"}
{"timestamp": 1782031881.2056139, "experiment_id": "863d07b7", "concept_title": "Navier-Stokes: 2D Regularity and Partial 3D Results", "concept_domain": "Algebra", "research_mode": "prove", "quality": "partial", "quality_score": 0.50324, "catalog_references": ["Analysis/ODE/Gronwall.lean", "Analysis/NormedSpace/Basic.lean", "Analysis/InnerProductSpace/Basic.lean"], "prompt_length": 2017, "files_placed": 0, "status": "keep"}
{"timestamp": 1782032725.4642801, "experiment_id": "93e2fea4", "concept_title": "Ramsey Theory in Projective Fra\u00efss\u00e9 Limits Implies Extreme Amenability of Homeomorphism Groups of Continua", "concept_domain": "Cryptography", "research_mode": "formalize", "quality": "partial", "quality_score": 0.45196000000000003, "catalog_references": ["Mathlib/Topology/UniformSpace/Basic.lean", "Mathlib/Topology/UniformSpace/Compact.lean", "Mathlib/Topology/Algebra/Group/Action.lean"], "prompt_length": 3755, "files_placed": 0, "status": "discard"}
{"timestamp": 1782038063.1419725, "experiment_id": "2fe3f01b", "concept_title": "Constructive Mathematics: Bishop's Analysis", "concept_domain": "Novelty", "research_mode": "formalize", "quality": "substantial", "quality_score": 0.8085600000000002, "catalog_references": [], "prompt_length": 20714, "files_placed": 13, "status": "keep"}
{"timestamp": 1782040602.7012708, "experiment_id": "d14bdeaa", "concept_title": "Euler-Mascheroni Constant: Irrationality Approaches", "concept_domain": "Bridges", "research_mode": "formalize", "quality": "partial", "quality_score": 0.4532320481927711, "catalog_references": ["Mathlib/Analysis/SpecialFunctions/Exp.lean", "Mathlib/Analysis/NormedSpace/Basic.lean", "Mathlib/Analysis/Complex/Basic.lean", "Mathlib/Analysis/SpecialFunctions/PowReal.lean"], "prompt_length": 1341, "files_placed": 0, "status": "discard"}
{"timestamp": 1782041135.2061327, "experiment_id": "11f0f366", "concept_title": "Cryptographic Hash Functions: Collision Resistance from Hard Problems", "concept_domain": "NumberTheory", "research_mode": "team", "quality": "partial", "quality_score": 0.5660000000000001, "catalog_references": [], "prompt_length": 20802, "files_placed": 7, "status": "keep"}
{"timestamp": 1782041379.133419, "experiment_id": "d7a09318", "concept_title": "Complexity\u2011Driven Emergence of Spacetime from Random Tensor Networks", "concept_domain": "Physics", "research_mode": "formalize", "quality": "substantial", "quality_score": 0.7246, "catalog_references": ["Catalog/MachineLearning/DifferentialClosure/Defslean", "Catalog/Analysis/Real/Differentiation/Basiclean"], "prompt_length": 21747, "files_placed": 10, "status": "keep"}
{"timestamp": 1782048569.2038982, "experiment_id": "37109497", "concept_title": "Graph Coloring: Chromatic Polynomial Theory", "concept_domain": "Algebra", "research_mode": "formalize", "quality": "partial", "quality_score": 0.6924620000000001, "catalog_references": ["Catalog/FINAL/Algebra/GraphTheory/SimpleGraph.lean", "Catalog/FINAL/Algebra/GraphTheory/Basic.lean", "Catalog/FINAL/Combinatorics/Counting/Basic.lean"], "prompt_length": 20763, "files_placed": 11, "status": "keep"}
{"timestamp": 1782053760.1875513, "experiment_id": "b8df0deb", "concept_title": "Derived from the verified Lean results in", "concept_domain": "Logic", "research_mode": "formalize", "quality": "substantial", "quality_score": 0.84144, "catalog_references": ["Mathlib/GroupTheory/Index.lean", "Mathlib/GroupTheory/Subgroup/Basic.lean", "Mathlib/GroupTheory/QuotientGroup/Basic.lean"], "prompt_length": 26296, "files_placed": 13, "status": "keep"}
{"timestamp": 1782059789.2091267, "experiment_id": "a0d2774b", "concept_title": "Consciousness as Integrated Information", "concept_domain": "Novelty", "research_mode": "prove", "quality": "partial", "quality_score": 0.42573236521739133, "catalog_references": ["Bridges/MockThetaFRecurrence.lean", "Bridges/MockThetaF.lean"], "prompt_length": 2510, "files_placed": 0, "status": "discard"}
{"timestamp": 1782060655.5403018, "experiment_id": "fe4ab5a6", "concept_title": "Quantum Thermodynamics: Landauer's Principle at the Nanoscale", "concept_domain": "Logic", "research_mode": "formalize", "quality": "substantial", "quality_score": 0.85612, "catalog_references": ["JarzynskiLandauer.lean", "Formalizing Lean Mathematics"], "prompt_length": 22932, "files_placed": 15, "status": "keep"}
{"timestamp": 1782061897.7642868, "experiment_id": "22ed9246", "concept_title": "Complexity\u2011Driven Emergence of Spacetime from Random Tensor Networks", "concept_domain": "Applications", "research_mode": "prove", "quality": "partial", "quality_score": 0.37703299999999995, "catalog_references": ["Catalog/FINAL/GraphTheory/LipschitzBounds.lean", "Bridges/MonotonicityLemma.lean", "Bridges/StabilityTheorem.lean"], "prompt_length": 1004, "files_placed": 0, "status": "discard"}
{"timestamp": 1782064328.713222, "experiment_id": "3e68faef", "concept_title": "Derived from the Phase A cycle that produced `Fitness.lean`,", "concept_domain": "Logic", "research_mode": "counterexample", "quality": "partial", "quality_score": 0.52278, "catalog_references": ["Catalog/FINAL/Fitness.lean"], "prompt_length": 22315, "files_placed": 6, "status": "keep"}
{"timestamp": 1782067016.4136539, "experiment_id": "dafb1f8b", "concept_title": "Linear twin-width bound for finite posets of bounded width", "concept_domain": "Geometry", "research_mode": "prove", "quality": "partial", "quality_score": 0.397447, "catalog_references": ["Catalog/Combinatorics/List/NonCircular.lean", "Catalog/Graph/TwinWidth/Contractions.lean", "Catalog/Order/Poset/Width.lean"], "prompt_length": 23019, "files_placed": 17, "status": "discard"}
{"timestamp": 1782073683.398374, "experiment_id": "5ef4c190", "concept_title": "EML Universal Approximation: Density of EML Functions", "concept_domain": "Computation", "research_mode": "team", "quality": "substantial", "quality_score": 0.7396, "catalog_references": [], "prompt_length": 20765, "files_placed": 7, "status": "keep"}
{"timestamp": 1782073929.9284241, "experiment_id": "ddfbd83f", "concept_title": "Quantum Thermodynamics: Landauer's Principle at the Nanoscale", "concept_domain": "Applications", "research_mode": "team", "quality": "partial", "quality_score": 0.63352, "catalog_references": [], "prompt_length": 22941, "files_placed": 2, "status": "keep"}
{"timestamp": 1782078218.9019723, "experiment_id": "1d465e25", "concept_title": "Complexity\u2011Driven Emergence of Spacetime from Random Tensor Networks", "concept_domain": "Geometry", "research_mode": "prove", "quality": "substantial", "quality_score": 0.79908, "catalog_references": ["Geometry/HausdorffDimension.lean", "MetricSpace/Basic.lean", "Topology/Instances/Real.lean"], "prompt_length": 23876, "files_placed": 14, "status": "keep"}
{"timestamp": 1782078353.2235115, "experiment_id": "d6c114ef", "concept_title": "*normalization functor into the probability simplex*", "concept_domain": "Novelty", "research_mode": "team", "quality": "partial", "quality_score": 0.6766, "catalog_references": [], "prompt_length": 24453, "files_placed": 6, "status": "keep"}
{"timestamp": 1782080199.7126231, "experiment_id": "6c747cdd", "concept_title": "Random Graphs: Erd\u0151s-R\u00e9nyi Threshold Phenomena", "concept_domain": "Combinatorics", "research_mode": "formalize", "quality": "partial", "quality_score": 0.4689979318754185, "catalog_references": ["Combinatorics/SimpleGraph.lean", "Probability/ProbabilityMassFunction.lean", "Analysis/Asymptotics.lean", "Data/Finset/Basic.lean"], "prompt_length": 2305, "files_placed": 0, "status": "discard"}
{"timestamp": 1782081931.2878344, "experiment_id": "50d5b31e", "concept_title": "Ramsey Theory: Bounds and Constructions", "concept_domain": "Novelty", "research_mode": "prove", "quality": "substantial", "quality_score": 0.84432, "catalog_references": ["Catalog/Logic/Arrow.lean", "Catalog/Combinatorics/Coloring.lean", "Catalog/Algorithms/Combinatorial.lean"], "prompt_length": 22845, "files_placed": 9, "status": "keep"}
{"timestamp": 1782084829.8307376, "experiment_id": "a747a0a8", "concept_title": "Complexity\u2011Driven Emergence of Spacetime from Random Tensor Networks", "concept_domain": "Tropical", "research_mode": "prove", "quality": "partial", "quality_score": 0.60792, "catalog_references": ["Catalog/Tropical/TensorNetworkComplexity.lean", "Catalog/Tropical/EntanglementEntropy.lean", "Catalog/Analysis/MetricSpace.lean", "Catalog/Algebra/FiniteField.lean"], "prompt_length": 21745, "files_placed": 5, "status": "keep"}
{"timestamp": 1782086195.9386892, "experiment_id": "0e89ca61", "concept_title": "Modular Height Formula for Unitary Shimura Varieties", "concept_domain": "Shared", "research_mode": "formalize", "quality": "partial", "quality_score": 0.3714852771428572, "catalog_references": [], "prompt_length": 2220, "files_placed": 0, "status": "discard"}
{"timestamp": 1782087722.4350665, "experiment_id": "aa9dc0d5", "concept_title": "Perfect Numbers: Structure of Even Perfects", "concept_domain": "NumberTheory", "research_mode": "prove", "quality": "partial", "quality_score": 0.46458109090909094, "catalog_references": ["NumberTheory/DivisorSum.lean", "NumberTheory/PerfectNumbers.lean", "NumberTheory/MersennePrimes.lean"], "prompt_length": 1776, "files_placed": 0, "status": "discard"}
{"timestamp": 1782089018.2083945, "experiment_id": "34ce1554", "concept_title": "Fully verified, manifold-free combinatorial core of", "concept_domain": "Geometry", "research_mode": "prove", "quality": "partial", "quality_score": 0.5018846575342466, "catalog_references": ["Geometry/DiscreteGeometry.lean", "Algebra/LinearAlgebra.lean", "Logic/Basic.lean"], "prompt_length": 830, "files_placed": 0, "status": "keep"}
{"timestamp": 1782093337.4940095, "experiment_id": "12bdf767", "concept_title": "Fixed Point Theorems: Brouwer, Banach, Schauder", "concept_domain": "Combinatorics", "research_mode": "prove", "quality": "partial", "quality_score": 0.5597778115501519, "catalog_references": ["Mathlib/Topology/MetricSpace/Basic.lean", "Mathlib/Data/Fintype/Basic.lean", "Mathlib/Data/Finset/Basic.lean", "Mathlib/Algebra/Order/Field/Basic.lean"], "prompt_length": 22865, "files_placed": 12, "status": "keep"}
{"timestamp": 1782097954.253876, "experiment_id": "693eed6d", "concept_title": "Bridge: Tropical Geometry as a Limit of Classical Algebraic Geometry", "concept_domain": "Geometry", "research_mode": "sorry_fill", "quality": "partial", "quality_score": 0.4390899069767442, "catalog_references": [], "prompt_length": 2851, "files_placed": 0, "status": "discard"}
{"timestamp": 1782099616.8969402, "experiment_id": "f810a812", "concept_title": "Euler-Mascheroni Constant: Irrationality Approaches", "concept_domain": "MachineLearning", "research_mode": "sorry_fill", "quality": "partial", "quality_score": 0.5494902834008097, "catalog_references": ["Bridges/CycleRankFiltration.lean"], "prompt_length": 22882, "files_placed": 11, "status": "keep"}
{"timestamp": 1782100001.7813792, "experiment_id": "dafe288e", "concept_title": "Baum-Connes Conjecture", "concept_domain": "MachineLearning", "research_mode": "sorry_fill", "quality": "partial", "quality_score": 0.42662737142857143, "catalog_references": ["MachineLearning/EML/SoftplusRate.lean", "MachineLearning/EML/Softplus.lean", "MachineLearning/EML/Relu.lean"], "prompt_length": 1918, "files_placed": 0, "status": "discard"}
{"timestamp": 1782100375.0802453, "experiment_id": "e2815d63", "concept_title": "Zero-Knowledge Proofs: Schnorr Protocol", "concept_domain": "Physics", "research_mode": "sorry_fill", "quality": "partial", "quality_score": 0.5423795180722892, "catalog_references": ["Cryptography/Schnorr.lean"], "prompt_length": 20710, "files_placed": 9, "status": "keep"}
{"timestamp": 1782108230.8831723, "experiment_id": "eafa171c", "concept_title": "Weighted K5-free max-cut conjecture with triangle-discounted edges", "concept_domain": "Novelty", "research_mode": "formalize", "quality": "partial", "quality_score": 0.4968647748478702, "catalog_references": ["Mathlib/CCombinatorics/SimpleGraph/Basic.lean", "Mathlib/CCombinatorics/SimpleGraph/Clique.lean", "Mathlib/CData/Fintype/Card.lean", "Mathlib/CAlgebra/BigOperators/Group/Finset.lean"], "prompt_length": 2719, "files_placed": 0, "status": "discard"}
{"timestamp": 1782108698.8502066, "experiment_id": "5bd61b22", "concept_title": "Uniqueness of Minimal Median Decompositions for Graphs", "concept_domain": "Probability", "research_mode": "formalize", "quality": "partial", "quality_score": 0.5515805555555555, "catalog_references": ["Mathlib/Combinatorics/SimpleGraph/Connectivity.lean", "Mathlib/Combinatorics/SimpleGraph/Metric.lean", "Mathlib/Combinatorics/SimpleGraph/Acyclic.lean"], "prompt_length": 20877, "files_placed": 12, "status": "keep"}
{"timestamp": 1782108937.4687872, "experiment_id": "9ba0d905", "concept_title": "Probability Bounds for Partial Latin Squares with Bounded Dimensions", "concept_domain": "Novelty", "research_mode": "sorry_fill", "quality": "partial", "quality_score": 0.5250358274479863, "catalog_references": [], "prompt_length": 2062, "files_placed": 0, "status": "keep"}
{"timestamp": 1782113303.428696, "experiment_id": "d168a656", "concept_title": "Degree-normalized linked tree-cut decompositions for locally finite graphs", "concept_domain": "Applications", "research_mode": "sorry_fill", "quality": "partial", "quality_score": 0.5556197063805759, "catalog_references": ["Bridges/TreeCut/Sequences.lean", "Bridges/TreeCut/Multigraph.lean"], "prompt_length": 21309, "files_placed": 24, "status": "keep"}
{"timestamp": 1782119117.9708176, "experiment_id": "930ff410", "concept_title": "Riemann Zeta: Zero-Free Regions and Density Estimates", "concept_domain": "NumberTheory", "research_mode": "formalize", "quality": "partial", "quality_score": 0.5530301941466242, "catalog_references": ["Mathlib/NumberTheory/Zeta.lean", "Mathlib/Data/Nat/Mobius.lean", "Mathlib/NumberTheory/ArithmeticFunction.lean"], "prompt_length": 22898, "files_placed": 10, "status": "keep"}
{"timestamp": 1782121353.407564, "experiment_id": "032896b2", "concept_title": "Pythagorean Triples in Gaussian Integers", "concept_domain": "Logic", "research_mode": "sorry_fill", "quality": "partial", "quality_score": 0.547645269003818, "catalog_references": ["Mathlib.NumberTheory.Zsqrtd.GaussianInt"], "prompt_length": 20733, "files_placed": 13, "status": "keep"}
{"timestamp": 1782124045.4640558, "experiment_id": "4dca8a63", "concept_title": "Triviality of Modular Form Coefficients", "concept_domain": "MachineLearning", "research_mode": "prove", "quality": "partial", "quality_score": 0.5251532857142858, "catalog_references": [], "prompt_length": 1648, "files_placed": 0, "status": "keep"}
{"timestamp": 1782124128.768855, "experiment_id": "c3a3db57", "concept_title": "ABC Conjecture: Consequences and Partial Results", "concept_domain": "Combinatorics", "research_mode": "sorry_fill", "quality": "partial", "quality_score": 0.50342, "catalog_references": [], "prompt_length": 3150, "files_placed": 0, "status": "keep"}
{"timestamp": 1782126499.0573468, "experiment_id": "d5789bd5", "concept_title": "Quantum Key Distribution: BB84 Security Proof", "concept_domain": "Algebra", "research_mode": "team", "quality": "partial", "quality_score": 0.69248, "catalog_references": [], "prompt_length": 7049, "files_placed": 4, "status": "keep"}
{"timestamp": 1782127347.8237216, "experiment_id": "3d0b9aaa", "concept_title": "OEIS sequence: \"Orderly\" Friedman numbers (or \"good\" or \"nice\" Friedman numbers): Friedman numbers (A036057) where the construction digits are used in the proper order.", "concept_domain": "Applications", "research_mode": "formalize", "quality": "partial", "quality_score": 0.49636883468834697, "catalog_references": [], "prompt_length": 3989, "files_placed": 0, "status": "discard"}
{"timestamp": 1782130570.3887146, "experiment_id": "9a580942", "concept_title": "Elliptic Curve Arithmetic: Group Law Formalization", "concept_domain": "Computation", "research_mode": "formalize", "quality": "partial", "quality_score": 0.6555200000000001, "catalog_references": ["Computation/EllipticCurve/HasseBound.lean"], "prompt_length": 2142, "files_placed": 3, "status": "keep"}
{"timestamp": 1782130972.65954, "experiment_id": "48b7f4af", "concept_title": "Universal n^{-7/2} asymptotic for unlabelled connected cubic planar graphs", "concept_domain": "Combinatorics", "research_mode": "formalize", "quality": "partial", "quality_score": 0.42770230303030304, "catalog_references": ["Combinatorics/SimpleGraph/Basic.lean", "Combinatorics/SimpleGraph/Degree.lean", "Combinatorics/SimpleGraph/EdgeFinset.lean", "Order/Filter/AtTopBot.lean"], "prompt_length": 1906, "files_placed": 0, "status": "discard"}
{"timestamp": 1782140759.5065162, "experiment_id": "39103244", "concept_title": "Average-degree shattering threshold for uncrowded uniform hypergraphs", "concept_domain": "Geometry", "research_mode": "formalize", "quality": "partial", "quality_score": 0.3928874, "catalog_references": ["Mathlib/Data/Finset/Basic.lean", "Mathlib/Data/Fintype/Basic.lean", "Mathlib/Algebra/BigOperators/Group/Finset.lean"], "prompt_length": 3232, "files_placed": 0, "status": "discard"}
{"timestamp": 1782147947.7753997, "experiment_id": "16bb5867", "concept_title": "Langlands Program: Functoriality", "concept_domain": "Computation", "research_mode": "sorry_fill", "quality": "partial", "quality_score": 0.44580200000000003, "catalog_references": ["Catalog/Algebra/SymSquare.lean", "Mathlib/LinearAlgebra/Matrix/Charpoly/Basic.lean", "Mathlib/LinearAlgebra/Matrix/Determinant/Basic.lean"], "prompt_length": 2982, "files_placed": 1, "status": "discard"}
{"timestamp": 1782148405.4889045, "experiment_id": "8892ab13", "concept_title": "Finite approximate Ramsey degrees characterize metrizable universal minimal flows", "concept_domain": "Probability", "research_mode": "formalize", "quality": "partial", "quality_score": 0.43946266666666667, "catalog_references": [], "prompt_length": 1763, "files_placed": 2, "status": "discard"}
{"timestamp": 1782156582.447342, "experiment_id": "805dbd7c", "concept_title": "Membrane Computing (P-Systems) and Their Computational Power", "concept_domain": "Algebra", "research_mode": "sorry_fill", "quality": "partial", "quality_score": 0.32121642086956526, "catalog_references": ["Catalog/Computation/MembraneComputing.lean"], "prompt_length": 1910, "files_placed": 3, "status": "discard"}
{"timestamp": 1782157802.6829145, "experiment_id": "862d1e75", "concept_title": "Wolfram CA Four-Class Classification and its Computability", "concept_domain": "Cryptography", "research_mode": "formalize", "quality": "partial", "quality_score": 0.4281950461538462, "catalog_references": [], "prompt_length": 2907, "files_placed": 2, "status": "discard"}
{"timestamp": 1782163270.5564616, "experiment_id": "9537a45c", "concept_title": "Idempotent Probability: Large Deviations", "concept_domain": "Tropical", "research_mode": "team", "quality": "substantial", "quality_score": 0.7829999999999999, "catalog_references": [], "prompt_length": 20655, "files_placed": 7, "status": "keep"}
{"timestamp": 1782165202.5193887, "experiment_id": "59a725d3", "concept_title": "Projective Fra\u00efss\u00e9 Metrization Conjecture for Universal Minimal Flows", "concept_domain": "Pythagorean", "research_mode": "sorry_fill", "quality": "partial", "quality_score": 0.36443276190476187, "catalog_references": [], "prompt_length": 1986, "files_placed": 3, "status": "discard"}
{"timestamp": 1782170989.94899, "experiment_id": "2731a7eb", "concept_title": "Hilbert 13: 7th-Degree Equations via 2-Variable Functions", "concept_domain": "Bridges", "research_mode": "sorry_fill", "quality": "partial", "quality_score": 0.3034976, "catalog_references": ["MachineLearning/KolmogorovSuperposition.lean"], "prompt_length": 3170, "files_placed": 2, "status": "discard"}
{"timestamp": 1782179188.049214, "experiment_id": "bfb13379", "concept_title": "EML Transseries: Asymptotic Expansions Beyond Power Series", "concept_domain": "Applications", "research_mode": "team", "quality": "partial", "quality_score": 0.46096, "catalog_references": [], "prompt_length": 20816, "files_placed": 8, "status": "discard"}
{"timestamp": 1782184878.1015217, "experiment_id": "6e34371e", "concept_title": "Sperner's Lemma Implies Nash Equilibria: Combinatorial Fixed Points in Game Theory", "concept_domain": "NumberTheory", "research_mode": "sorry_fill", "quality": "partial", "quality_score": 0.3216371714285714, "catalog_references": ["Catalog/GameTheory/PotentialGames.lean"], "prompt_length": 2682, "files_placed": 2, "status": "discard"}
{"timestamp": 1782187351.825148, "experiment_id": "cb79327f", "concept_title": "Elliptic Curve Cryptography: Weil Pairing and BLS Signatures", "concept_domain": "Cryptography", "research_mode": "team", "quality": "substantial", "quality_score": 0.77, "catalog_references": [], "prompt_length": 22904, "files_placed": 6, "status": "keep"}
