{"timestamp": 1785987894.7745585, "experiment_id": "71b84dd8", "concept_title": "`Physics/ZeroPointHarvesting.lean` models any proposed harvesting apparatus by t", "concept_domain": "Physics", "research_mode": "team", "quality": "partial", "quality_score": 0.686, "catalog_references": [], "prompt_length": 8049, "files_placed": 2, "status": "keep"}
{"timestamp": 1785987973.6891992, "experiment_id": "9f1ee483", "concept_title": "**Conjecture.** Let `N(n)` be the number of successful prefixes of length `n` in", "concept_domain": "Algebra", "research_mode": "team", "quality": "substantial", "quality_score": 0.79301, "catalog_references": [], "prompt_length": 29287, "files_placed": 4, "status": "keep"}
{"timestamp": 1785988051.5533373, "experiment_id": "413bc2f0", "concept_title": "Generalization Bounds via Rademacher Complexity", "concept_domain": "Logic", "research_mode": "team", "quality": "substantial", "quality_score": 0.7947599999999999, "catalog_references": [], "prompt_length": 25764, "files_placed": 5, "status": "keep"}
{"timestamp": 1785993787.4883132, "experiment_id": "66bb09ac", "concept_title": "The phrase \u201cdirectly apprehended by a human brain\u201d is not presently a mathematic", "concept_domain": "Novelty", "research_mode": "team", "quality": "partial", "quality_score": 0.686, "catalog_references": [], "prompt_length": 8248, "files_placed": 6, "status": "keep"}
{"timestamp": 1785993792.1421895, "experiment_id": "31b96673", "concept_title": "EML-Pythagorean-Operator: Single-Neuron Neural Energy Guided Tree Traversal", "concept_domain": "Pythagorean", "research_mode": "team", "quality": "partial", "quality_score": 0.686, "catalog_references": [], "prompt_length": 2327, "files_placed": 2, "status": "keep"}
{"timestamp": 1785993799.137986, "experiment_id": "2784f3be", "concept_title": "Let `W\u2080 = 1`, `W\u2096\u208a\u2081 = 2^W\u2096 \u00b7 W\u2096`, and let `K(n)` be the least `k` such that `n <", "concept_domain": "Pythagorean", "research_mode": "team", "quality": "partial", "quality_score": 0.686, "catalog_references": [], "prompt_length": 5386, "files_placed": 3, "status": "keep"}
{"timestamp": 1785999649.1152716, "experiment_id": "713730e2", "concept_title": "**Conjecture.** For every integer `k \u2265 5`, there is a threshold `N\u2080(k)` such tha", "concept_domain": "Pythagorean", "research_mode": "team", "quality": "substantial", "quality_score": 0.78748, "catalog_references": [], "prompt_length": 28661, "files_placed": 4, "status": "keep"}
{"timestamp": 1786002936.0031931, "experiment_id": "39ee2889", "concept_title": "Concrete, falsifiable conjectures arising from the formalization in", "concept_domain": "Combinatorics", "research_mode": "team", "quality": "substantial", "quality_score": 0.79707, "catalog_references": [], "prompt_length": 32479, "files_placed": 5, "status": "keep"}
{"timestamp": 1786005898.7091556, "experiment_id": "96503fdf", "concept_title": "Constructive Mathematics: Bishop's Analysis", "concept_domain": "Logic", "research_mode": "prove", "quality": "partial", "quality_score": 0.686, "catalog_references": [], "prompt_length": 26027, "files_placed": 4, "status": "keep"}
{"timestamp": 1786008208.6498795, "experiment_id": "ffc2840e", "concept_title": "Group actions and orbit relations.: Instantiate `InvariantPattern` with th", "concept_domain": "Computation", "research_mode": "team", "quality": "partial", "quality_score": 0.686, "catalog_references": [], "prompt_length": 27566, "files_placed": 4, "status": "keep"}
{"timestamp": 1786019185.3339748, "experiment_id": "6c07c4d0", "concept_title": "ArXiv paper: Chebotarev geodesic theorem: non-split case", "concept_domain": "Shared", "research_mode": "team", "quality": "partial", "quality_score": 0.6858792756539236, "catalog_references": [], "prompt_length": 7467, "files_placed": 45, "status": "keep"}
{"timestamp": 1786019281.4264243, "experiment_id": "68319f3d", "concept_title": "Deepening: Bridge: Fourier Analysis as a Functor", "concept_domain": "Computation", "research_mode": "team", "quality": "partial", "quality_score": 0.686, "catalog_references": [], "prompt_length": 26337, "files_placed": 15, "status": "keep"}
{"timestamp": 1786030904.7768958, "experiment_id": "a95dbc85", "concept_title": "Fix a finite corpus of statements and charge each theory for both source length", "concept_domain": "Pythagorean", "research_mode": "team", "quality": "partial", "quality_score": 0.686, "catalog_references": [], "prompt_length": 28912, "files_placed": 4, "status": "keep"}
{"timestamp": 1786042903.888475, "experiment_id": "43d8701a", "concept_title": "Arithmetized QFT reflection.: Construct an explicit recursively enumerable", "concept_domain": "Novelty", "research_mode": "team", "quality": "partial", "quality_score": 0.6859641362821279, "catalog_references": [], "prompt_length": 5854, "files_placed": 72, "status": "keep"}
{"timestamp": 1786045610.9776924, "experiment_id": "0830d66b", "concept_title": "**Conjecture.** For a family of finite decision processes with bounded error, an", "concept_domain": "Computation", "research_mode": "team", "quality": "partial", "quality_score": 0.686, "catalog_references": [], "prompt_length": 29524, "files_placed": 63, "status": "keep"}
{"timestamp": 1786073171.3896012, "experiment_id": "3744942f", "concept_title": "Deepening: Hadwiger's Conjecture", "concept_domain": "Probability", "research_mode": "team", "quality": "partial", "quality_score": 0.6546236561723476, "catalog_references": [], "prompt_length": 7037, "files_placed": 107, "status": "keep"}
{"timestamp": 1786073177.0003703, "experiment_id": "d6f1fad6", "concept_title": "The current development proves an exact finite-domain universality result for a", "concept_domain": "MachineLearning", "research_mode": "team", "quality": "partial", "quality_score": 0.6536503144654089, "catalog_references": [], "prompt_length": 10063, "files_placed": 14, "status": "keep"}
{"timestamp": 1786076018.3365188, "experiment_id": "b2707824", "concept_title": "Hyperbolic-Pythagorean-Geodesics: Sub-Linear Trajectory Factorization in Poincar\u00e9 Disk", "concept_domain": "Geometry", "research_mode": "team", "quality": "substantial", "quality_score": 0.73419, "catalog_references": [], "prompt_length": 25998, "files_placed": 4, "status": "keep"}
{"timestamp": 1786076117.9551437, "experiment_id": "2c38bc1a", "concept_title": "ArXiv paper: Even smaller universal posets", "concept_domain": "Cryptography", "research_mode": "team", "quality": "substantial", "quality_score": 0.7055950000000001, "catalog_references": [], "prompt_length": 26287, "files_placed": 4, "status": "keep"}
{"timestamp": 1786076864.2515187, "experiment_id": "0e033e47", "concept_title": "ArXiv paper: On some perfect matching conjectures in infinite, cubic, bridgeless graphs", "concept_domain": "Bridges", "research_mode": "team", "quality": "partial", "quality_score": 0.648859294871795, "catalog_references": [], "prompt_length": 8482, "files_placed": 14, "status": "keep"}
{"timestamp": 1786076871.4274962, "experiment_id": "768360e4", "concept_title": "Bridge: Homological Algebra Connecting Algebra and Topology", "concept_domain": "Bridges", "research_mode": "team", "quality": "partial", "quality_score": 0.6509097115384616, "catalog_references": [], "prompt_length": 6794, "files_placed": 7, "status": "keep"}
{"timestamp": 1786076877.3723547, "experiment_id": "b95b0e68", "concept_title": "ArXiv paper: On the Second Moment of $ L (1/2, \\mathrm{As}(f) \\times \u03c6)$", "concept_domain": "Novelty", "research_mode": "team", "quality": "partial", "quality_score": 0.6609054304347827, "catalog_references": [], "prompt_length": 7495, "files_placed": 12, "status": "keep"}
{"timestamp": 1786080034.1870244, "experiment_id": "786dcda9", "concept_title": "The following conjectures are concrete extensions of the proved bridge.  Each is", "concept_domain": "Novelty", "research_mode": "team", "quality": "partial", "quality_score": 0.6520853, "catalog_references": [], "prompt_length": 10586, "files_placed": 18, "status": "keep"}
{"timestamp": 1786080129.4687421, "experiment_id": "8d2025bd", "concept_title": "Mobius Arithmetic: Number Theory on the Mobius Band", "concept_domain": "NumberTheory", "research_mode": "team", "quality": "partial", "quality_score": 0.627125, "catalog_references": [], "prompt_length": 26778, "files_placed": 4, "status": "keep"}
{"timestamp": 1786081202.1654828, "experiment_id": "edfd57dd", "concept_title": "Black-Hole-Entropy: Bekenstein-Hawking Metric Area Law Proof", "concept_domain": "Novelty", "research_mode": "team", "quality": "partial", "quality_score": 0.627125, "catalog_references": [], "prompt_length": 25940, "files_placed": 6, "status": "keep"}
{"timestamp": 1786086514.5979514, "experiment_id": "3590d6fa", "concept_title": "Define the multiplicity-sensitive, conjugate-symmetric sum", "concept_domain": "Algebra", "research_mode": "team", "quality": "partial", "quality_score": 0.6546970930232558, "catalog_references": [], "prompt_length": 13526, "files_placed": 7, "status": "keep"}
{"timestamp": 1786090045.837316, "experiment_id": "8dc4e6e3", "concept_title": "Tropical Linear Algebra: Eigenvalues and Determinants", "concept_domain": "Algebra", "research_mode": "team", "quality": "partial", "quality_score": 0.6583992433823346, "catalog_references": [], "prompt_length": 6872, "files_placed": 16, "status": "keep"}
{"timestamp": 1786094545.0094342, "experiment_id": "e384d0b8", "concept_title": "Deepening: Quantum Entanglement as Algebraic Topology: The Linking Number Is Entanglement", "concept_domain": "Pythagorean", "research_mode": "team", "quality": "partial", "quality_score": 0.6540809924078091, "catalog_references": [], "prompt_length": 7292, "files_placed": 91, "status": "keep"}
{"timestamp": 1786094551.4250207, "experiment_id": "c29c7fbe", "concept_title": "The following conjectures sharpen the boundary of the normalized development in", "concept_domain": "Geometry", "research_mode": "team", "quality": "partial", "quality_score": 0.657274625691032, "catalog_references": [], "prompt_length": 10150, "files_placed": 13, "status": "keep"}
{"timestamp": 1786094652.324655, "experiment_id": "f3cf4755", "concept_title": "The completed formalization deliberately studies the smallest non-trivial model:", "concept_domain": "MachineLearning", "research_mode": "team", "quality": "substantial", "quality_score": 0.7422650000000001, "catalog_references": [], "prompt_length": 27190, "files_placed": 5, "status": "keep"}
{"timestamp": 1786101359.811349, "experiment_id": "14cda033", "concept_title": "[Your Title]", "concept_domain": "Computation", "research_mode": "team", "quality": "substantial", "quality_score": 0.71918, "catalog_references": [], "prompt_length": 31862, "files_placed": 4, "status": "keep"}
{"timestamp": 1786110406.3676853, "experiment_id": "2def9e1c", "concept_title": "Lorentzian-Singularity: Penrose Hawking Singularity Theorem Verification", "concept_domain": "Physics", "research_mode": "team", "quality": "partial", "quality_score": 0.661958698156682, "catalog_references": [], "prompt_length": 6431, "files_placed": 75, "status": "keep"}
{"timestamp": 1786110414.5465047, "experiment_id": "8a90ae7b", "concept_title": "Close Proofs: ArXiv paper: Chebotarev geodesic theorem: non-split case", "concept_domain": "Shared", "research_mode": "team", "quality": "partial", "quality_score": 0.640478157722513, "catalog_references": [], "prompt_length": 6961, "files_placed": 67, "status": "keep"}
{"timestamp": 1786112105.1119237, "experiment_id": "09b12514", "concept_title": "ArXiv paper: Bipartite Extremal Numbers of Trees", "concept_domain": "Combinatorics", "research_mode": "team", "quality": "partial", "quality_score": 0.6640958333333333, "catalog_references": [], "prompt_length": 7979, "files_placed": 53, "status": "keep"}
{"timestamp": 1786114693.8977697, "experiment_id": "4152b805", "concept_title": "Hilbert 15: Schubert Calculus Rigorization", "concept_domain": "Geometry", "research_mode": "team", "quality": "partial", "quality_score": 0.6697667517006802, "catalog_references": [], "prompt_length": 6583, "files_placed": 74, "status": "keep"}
{"timestamp": 1786117498.1527805, "experiment_id": "22e93393", "concept_title": "Deepening: 1. **Finite-key probability formula.** For every finite type `V`, independent", "concept_domain": "Combinatorics", "research_mode": "team", "quality": "substantial", "quality_score": 0.71348, "catalog_references": [], "prompt_length": 26384, "files_placed": 4, "status": "keep"}
{"timestamp": 1786122856.7473984, "experiment_id": "af44a08e", "concept_title": "Fix a sound, computably axiomatized theory capable of elementary arithmetic and", "concept_domain": "Computation", "research_mode": "team", "quality": "partial", "quality_score": 0.659818701923077, "catalog_references": [], "prompt_length": 14293, "files_placed": 11, "status": "keep"}
{"timestamp": 1786126122.3284743, "experiment_id": "6e948588", "concept_title": "ArXiv paper: The small Davenport constant of the Heisenberg group of order 125", "concept_domain": "Algebra", "research_mode": "team", "quality": "partial", "quality_score": 0.6542925496031746, "catalog_references": [], "prompt_length": 8497, "files_placed": 77, "status": "keep"}
{"timestamp": 1786130552.7568145, "experiment_id": "76abd1f0", "concept_title": "Chaos and the Three-Body Problem: Lyapunov Exponent Bounds", "concept_domain": "Physics", "research_mode": "team", "quality": "partial", "quality_score": 0.6537058069977426, "catalog_references": [], "prompt_length": 6741, "files_placed": 61, "status": "keep"}
{"timestamp": 1786130559.4840798, "experiment_id": "2116bc97", "concept_title": "Deepening: Isogeny-SIDH: Radical Isogeny Verification on Montgomery Curves", "concept_domain": "Cryptography", "research_mode": "team", "quality": "partial", "quality_score": 0.6539737559241706, "catalog_references": [], "prompt_length": 6925, "files_placed": 23, "status": "keep"}
{"timestamp": 1786130663.3997147, "experiment_id": "558c6b54", "concept_title": "Diophantine-Lattice: Spectral Bounds on Non-Homogeneous Quadratic Forms", "concept_domain": "Novelty", "research_mode": "team", "quality": "partial", "quality_score": 0.6345760413043479, "catalog_references": [], "prompt_length": 26111, "files_placed": 4, "status": "keep"}
{"timestamp": 1786130767.2483428, "experiment_id": "df8839cd", "concept_title": "This cycle settled the *uniform half-canonical existence* question for almost al", "concept_domain": "Pythagorean", "research_mode": "team", "quality": "substantial", "quality_score": 0.71728, "catalog_references": [], "prompt_length": 30881, "files_placed": 4, "status": "keep"}
{"timestamp": 1786136795.3166223, "experiment_id": "ab157807", "concept_title": "The formal results show that a scalar missing rate and feature count do not dete", "concept_domain": "Algebra", "research_mode": "team", "quality": "partial", "quality_score": 0.6443439147018031, "catalog_references": [], "prompt_length": 11656, "files_placed": 2, "status": "keep"}
{"timestamp": 1786140211.4635704, "experiment_id": "100d7a9d", "concept_title": "1. **Exact finite-event bound for exposed velocities.** For every finite max-plu", "concept_domain": "Novelty", "research_mode": "team", "quality": "partial", "quality_score": 0.6599028963414636, "catalog_references": [], "prompt_length": 10865, "files_placed": 9, "status": "keep"}
{"timestamp": 1786140217.936306, "experiment_id": "0ed998a7", "concept_title": "Results of this cycle live in `Catalog/Combinatorics/ThreeQubitHyperdeterminant.", "concept_domain": "Logic", "research_mode": "team", "quality": "partial", "quality_score": 0.6603294191919192, "catalog_references": [], "prompt_length": 10772, "files_placed": 17, "status": "keep"}
{"timestamp": 1786158497.803861, "experiment_id": "52a6f28b", "concept_title": "Tropical Curves and Chip-Firing Games", "concept_domain": "Combinatorics", "research_mode": "prove", "quality": "partial", "quality_score": 0.627125, "catalog_references": [], "prompt_length": 6635, "files_placed": 13, "status": "keep"}
{"timestamp": 1786163764.386064, "experiment_id": "8643e3f8", "concept_title": "Neural-Manifold: Exact Piecewise Linear Partition Bounds for ReLU Networks", "concept_domain": "MachineLearning", "research_mode": "team", "quality": "partial", "quality_score": 0.6592476265822785, "catalog_references": [], "prompt_length": 6439, "files_placed": 28, "status": "keep"}
{"timestamp": 1786165649.068196, "experiment_id": "436f9275", "concept_title": "Deepening: Sums of Three Cubes", "concept_domain": "Probability", "research_mode": "team", "quality": "partial", "quality_score": 0.627125, "catalog_references": [], "prompt_length": 7037, "files_placed": 16, "status": "keep"}
{"timestamp": 1786165752.8788457, "experiment_id": "221c30c4", "concept_title": "strange lines and curves on a plot the berggren primitive pythagorean tree", "concept_domain": "MachineLearning", "research_mode": "team", "quality": "partial", "quality_score": 0.6272308571428571, "catalog_references": [], "prompt_length": 26122, "files_placed": 13, "status": "keep"}
{"timestamp": 1786169066.4267857, "experiment_id": "fdb5367b", "concept_title": "EML-ExpLog-Duality: Isomorphism Between EML Functional Spaces and Lie Groups", "concept_domain": "Probability", "research_mode": "team", "quality": "partial", "quality_score": 0.6513313973675711, "catalog_references": [], "prompt_length": 6503, "files_placed": 6, "status": "keep"}
{"timestamp": 1786173763.6653814, "experiment_id": "3f42ae3f", "concept_title": "This project formalises a chain of results about snakes (chordless induced", "concept_domain": "Novelty", "research_mode": "team", "quality": "partial", "quality_score": 0.6544111491354468, "catalog_references": [], "prompt_length": 26540, "files_placed": 16, "status": "keep"}
{"timestamp": 1786197837.0089505, "experiment_id": "5e2efbe9", "concept_title": "ArXiv paper: Solomon zeta functions over arithmetic orders", "concept_domain": "Shared", "research_mode": "team", "quality": "partial", "quality_score": 0.6514402131782946, "catalog_references": [], "prompt_length": 8001, "files_placed": 68, "status": "keep"}
{"timestamp": 1786201125.8817081, "experiment_id": "339ae990", "concept_title": "Sharp two-sided summand asymptotics.: For every `k : \u2115`, prove", "concept_domain": "Novelty", "research_mode": "team", "quality": "substantial", "quality_score": 0.71899, "catalog_references": [], "prompt_length": 27486, "files_placed": 4, "status": "keep"}
{"timestamp": 1786226059.7499206, "experiment_id": "344e2e8a", "concept_title": "occurrences of certain numbers in pascals triangle", "concept_domain": "Combinatorics", "research_mode": "team", "quality": "partial", "quality_score": 0.627125, "catalog_references": [], "prompt_length": 26503, "files_placed": 4, "status": "keep"}
{"timestamp": 1786280999.7514708, "experiment_id": "97241621", "concept_title": "Derived from the analysis and adversarial review of", "concept_domain": "Novelty", "research_mode": "team", "quality": "substantial", "quality_score": 0.743405, "catalog_references": [], "prompt_length": 63224, "files_placed": 4, "status": "keep"}
{"timestamp": 1786281102.9672596, "experiment_id": "36710bef", "concept_title": "The scalar-log unit-circle conjecture is now proved with a certified parameter", "concept_domain": "NumberTheory", "research_mode": "team", "quality": "substantial", "quality_score": 0.7451150000000001, "catalog_references": [], "prompt_length": 27033, "files_placed": 5, "status": "keep"}
{"timestamp": 1786285472.7544606, "experiment_id": "48492a97", "concept_title": "Formalizing Modular Bounds on Elliptic Curves over Finite Fields", "concept_domain": "Combinatorics", "research_mode": "team", "quality": "substantial", "quality_score": 0.71196, "catalog_references": [], "prompt_length": 25972, "files_placed": 4, "status": "keep"}
{"timestamp": 1786285577.3227942, "experiment_id": "1f345ab3", "concept_title": "1. **Odd-sample extension.** For every odd sample size `2k+1`, clipped unit-step", "concept_domain": "Tropical", "research_mode": "team", "quality": "substantial", "quality_score": 0.73286, "catalog_references": [], "prompt_length": 27101, "files_placed": 4, "status": "keep"}
{"timestamp": 1786285682.9963672, "experiment_id": "756b62a7", "concept_title": "ArXiv paper: Towards a characterization of idempotent Schur multipliers", "concept_domain": "Pythagorean", "research_mode": "team", "quality": "substantial", "quality_score": 0.7084450000000001, "catalog_references": [], "prompt_length": 26829, "files_placed": 4, "status": "keep"}
{"timestamp": 1786287685.9148836, "experiment_id": "08217b91", "concept_title": "occurrences of certain numbers in pascals triangle", "concept_domain": "Novelty", "research_mode": "team", "quality": "substantial", "quality_score": 0.748155, "catalog_references": [], "prompt_length": 26491, "files_placed": 5, "status": "keep"}
{"timestamp": 1786298119.2616518, "experiment_id": "e870e995", "concept_title": "ArXiv paper: Formality for rigid-analytic spaces satisfying the weight-monodromy conjecture", "concept_domain": "Novelty", "research_mode": "team", "quality": "substantial", "quality_score": 0.7131, "catalog_references": [], "prompt_length": 26312, "files_placed": 4, "status": "keep"}
{"timestamp": 1786302606.231595, "experiment_id": "0dcd87ee", "concept_title": "The new file `Catalog/Applications/SurveillanceNetworks/PrivacyThreshold.lean`", "concept_domain": "Combinatorics", "research_mode": "team", "quality": "substantial", "quality_score": 0.751005, "catalog_references": [], "prompt_length": 28079, "files_placed": 4, "status": "keep"}
