{"timestamp": 1781392918.8911643, "experiment_id": "fab579e5", "concept_title": "`Speculative/AutoResearch/FibonacciEntryPointDuality.lean`,", "concept_domain": "Novelty", "research_mode": "team", "quality": "partial", "quality_score": 0.6724, "catalog_references": [], "prompt_length": 23894, "files_placed": 5, "status": "keep"}
{"timestamp": 1781392935.0387247, "experiment_id": "20385ee4", "concept_title": "Close Proofs: Arithmetic Concentration of Nodal Counts in Random Hecke Eigenfunction", "concept_domain": "Applications", "research_mode": "team", "quality": "partial", "quality_score": 0.49285999999999996, "catalog_references": [], "prompt_length": 6258, "files_placed": 0, "status": "discard"}
{"timestamp": 1781394859.851831, "experiment_id": "2da4ffbf", "concept_title": "Close Proofs: This cycle took the single load-bearing identity of the base file", "concept_domain": "Applications", "research_mode": "team", "quality": "partial", "quality_score": 0.3401157142857143, "catalog_references": [], "prompt_length": 6264, "files_placed": 0, "status": "discard"}
{"timestamp": 1781394877.2821302, "experiment_id": "6f1514f1", "concept_title": "Close Proofs: Order-theoretic core of the Cook\u2013Reckhow program built i", "concept_domain": "Novelty", "research_mode": "team", "quality": "substantial", "quality_score": 0.70124, "catalog_references": [], "prompt_length": 17638, "files_placed": 5, "status": "keep"}
{"timestamp": 1781394898.3598773, "experiment_id": "126a3d45", "concept_title": "Deepening: This cycle isolated the *entry point* (rank of apparition) `z(p) = ` least `k > ", "concept_domain": "Applications", "research_mode": "team", "quality": "substantial", "quality_score": 0.7108000000000001, "catalog_references": [], "prompt_length": 17815, "files_placed": 5, "status": "keep"}
{"timestamp": 1781394918.237259, "experiment_id": "908ecdae", "concept_title": "The file `Catalog/Applications/CombinatorialSpecies.lean` established the expone", "concept_domain": "Novelty", "research_mode": "team", "quality": "partial", "quality_score": 0.5454000000000001, "catalog_references": [], "prompt_length": 25583, "files_placed": 6, "status": "keep"}
{"timestamp": 1781394938.615982, "experiment_id": "9fcf6502", "concept_title": "The file `Catalog/Speculative/AutoResearch/ProteinFoldingMST.lean` lifts the one", "concept_domain": "Novelty", "research_mode": "team", "quality": "partial", "quality_score": 0.39298000000000005, "catalog_references": [], "prompt_length": 18242, "files_placed": 0, "status": "discard"}
{"timestamp": 1781396889.6557477, "experiment_id": "40cb7cdb", "concept_title": "This cycle laid down the *algebraic backbone* of p-curvature for rank-one Picard", "concept_domain": "Applications", "research_mode": "team", "quality": "partial", "quality_score": 0.45736, "catalog_references": [], "prompt_length": 20276, "files_placed": 0, "status": "discard"}
{"timestamp": 1781396914.3680694, "experiment_id": "b58d8ec9", "concept_title": "The current formalization defines `HasLinearRegions` for individual functions bu", "concept_domain": "Novelty", "research_mode": "team", "quality": "partial", "quality_score": 0.42914072351421195, "catalog_references": [], "prompt_length": 14968, "files_placed": 0, "status": "discard"}
{"timestamp": 1781396935.343834, "experiment_id": "07f1d56d", "concept_title": "Spectral Universality Threshold for Hypergraph Neural Tangent Kernels on Simplic", "concept_domain": "Applications", "research_mode": "team", "quality": "partial", "quality_score": 0.42845928888888896, "catalog_references": [], "prompt_length": 8795, "files_placed": 0, "status": "discard"}
{"timestamp": 1781396955.242041, "experiment_id": "d9001a1b", "concept_title": "The file `Catalog/Speculative/AutoResearch/ProteinFoldingMST.lean` models the de", "concept_domain": "Applications", "research_mode": "team", "quality": "partial", "quality_score": 0.48661, "catalog_references": [], "prompt_length": 18581, "files_placed": 0, "status": "discard"}
{"timestamp": 1781396976.9059892, "experiment_id": "fa4df8cb", "concept_title": "Close Proofs: The file `Catalog/Applications/CombinatorialSpecies.lean` established ", "concept_domain": "Applications", "research_mode": "team", "quality": "partial", "quality_score": 0.5820299999999999, "catalog_references": [], "prompt_length": 6121, "files_placed": 0, "status": "keep"}
{"timestamp": 1781397045.6642325, "experiment_id": "5d2ec3e5", "concept_title": "The conjecture that motivated this cycle \u2014 a *noise-stability phase transition f", "concept_domain": "Applications", "research_mode": "team", "quality": "partial", "quality_score": 0.44714941992991536, "catalog_references": [], "prompt_length": 18578, "files_placed": 0, "status": "discard"}
{"timestamp": 1781398992.529108, "experiment_id": "7b63a6df", "concept_title": "Deepening: The file `Applications/CombinatorialSpecies.lean` originally established the exp", "concept_domain": "Applications", "research_mode": "team", "quality": "substantial", "quality_score": 0.7581655172413794, "catalog_references": [], "prompt_length": 17815, "files_placed": 8, "status": "keep"}
{"timestamp": 1781399013.1960654, "experiment_id": "eecdaf3b", "concept_title": "Close Proofs: The conjecture that motivated this cycle \u2014 a *noise-stability phase tr", "concept_domain": "Novelty", "research_mode": "team", "quality": "partial", "quality_score": 0.45064000000000004, "catalog_references": [], "prompt_length": 6250, "files_placed": 0, "status": "discard"}
{"timestamp": 1781400952.0942814, "experiment_id": "7745d226", "concept_title": "This cycle pushed the order-theoretic core of the Cook\u2013Reckhow program", "concept_domain": "Novelty", "research_mode": "team", "quality": "partial", "quality_score": 0.5774116746411484, "catalog_references": [], "prompt_length": 21669, "files_placed": 0, "status": "keep"}
{"timestamp": 1781401008.4283376, "experiment_id": "302a89d4", "concept_title": "This cycle is a **cold start** on the protein-folding-as-topology program. We la", "concept_domain": "Novelty", "research_mode": "team", "quality": "partial", "quality_score": 0.56376, "catalog_references": [], "prompt_length": 25084, "files_placed": 0, "status": "keep"}
{"timestamp": 1781401040.8098216, "experiment_id": "57d24d4d", "concept_title": "*pointwise* novelty-certification framework of", "concept_domain": "Applications", "research_mode": "team", "quality": "partial", "quality_score": 0.64464, "catalog_references": [], "prompt_length": 24376, "files_placed": 30, "status": "keep"}
{"timestamp": 1781401057.8453808, "experiment_id": "633a535d", "concept_title": "This cycle added `Geometry/QuasiSymmetricIterate.lean`, which closes the loop on", "concept_domain": "Novelty", "research_mode": "team", "quality": "partial", "quality_score": 0.6266499999999999, "catalog_references": [], "prompt_length": 24547, "files_placed": 7, "status": "keep"}
{"timestamp": 1781402998.4615643, "experiment_id": "0aa8e115", "concept_title": "Formalize Baker\u2013Norine's tropical Riemann-Roch theorem: for a divisor D on a met", "concept_domain": "Novelty", "research_mode": "team", "quality": "partial", "quality_score": 0.5169142857142858, "catalog_references": [], "prompt_length": 12799, "files_placed": 0, "status": "keep"}
{"timestamp": 1781403029.3035755, "experiment_id": "2b4745d6", "concept_title": "Close Proofs: The file `Catalog/Speculative/AutoResearch/ProteinFoldingMST.lean` mod", "concept_domain": "Applications", "research_mode": "team", "quality": "partial", "quality_score": 0.63384, "catalog_references": [], "prompt_length": 17661, "files_placed": 6, "status": "keep"}
{"timestamp": 1781403047.156697, "experiment_id": "d16ea1a1", "concept_title": "The previous cycle established the Hodge\u2013Deligne E-polynomial", "concept_domain": "Novelty", "research_mode": "team", "quality": "partial", "quality_score": 0.5432, "catalog_references": [], "prompt_length": 26133, "files_placed": 6, "status": "keep"}
{"timestamp": 1781403061.6108747, "experiment_id": "c8425ff8", "concept_title": "This cycle replaced *fixed* Rademacher sign vectors with the genuinely **expecte", "concept_domain": "Applications", "research_mode": "team", "quality": "partial", "quality_score": 0.66788, "catalog_references": [], "prompt_length": 23550, "files_placed": 6, "status": "keep"}
{"timestamp": 1781405012.9026155, "experiment_id": "d4cda211", "concept_title": "The order-theoretic core of the Cook\u2013Reckhow program in this catalog now describ", "concept_domain": "Novelty", "research_mode": "team", "quality": "partial", "quality_score": 0.4690586232628974, "catalog_references": [], "prompt_length": 22046, "files_placed": 0, "status": "discard"}
{"timestamp": 1781405052.627625, "experiment_id": "1631047d", "concept_title": "Catalog's arithmetic mirror-symmetry skeleton", "concept_domain": "Novelty", "research_mode": "team", "quality": "partial", "quality_score": 0.4706444444444445, "catalog_references": [], "prompt_length": 20642, "files_placed": 0, "status": "discard"}
{"timestamp": 1781405071.6058154, "experiment_id": "24946444", "concept_title": "The file `HodgeSpectralThreshold.lean` extracts a rigorous, sorry-free linear-al", "concept_domain": "Novelty", "research_mode": "team", "quality": "partial", "quality_score": 0.6830417021276596, "catalog_references": [], "prompt_length": 25349, "files_placed": 6, "status": "keep"}
{"timestamp": 1781405092.1969748, "experiment_id": "1ad51108", "concept_title": "The combinatorial species program in `Catalog/Applications/` has, over several c", "concept_domain": "Applications", "research_mode": "team", "quality": "partial", "quality_score": 0.3380334253521127, "catalog_references": [], "prompt_length": 21536, "files_placed": 0, "status": "discard"}
{"timestamp": 1781405111.6832669, "experiment_id": "a8a41988", "concept_title": "This cycle built, from scratch, the *set-local distortion* programme for Hausdor", "concept_domain": "Applications", "research_mode": "team", "quality": "partial", "quality_score": 0.46590999999999994, "catalog_references": [], "prompt_length": 21531, "files_placed": 0, "status": "discard"}
{"timestamp": 1781407081.1656678, "experiment_id": "f4e4ac27", "concept_title": "The catalog file `Applications/CombinatorialSpecies.lean` built the exponential-", "concept_domain": "Applications", "research_mode": "team", "quality": "partial", "quality_score": 0.3856922793560606, "catalog_references": [], "prompt_length": 20114, "files_placed": 0, "status": "discard"}
{"timestamp": 1781407103.6569278, "experiment_id": "ab88a1fa", "concept_title": "The species program had, before this cycle, built the exponential-generating-fun", "concept_domain": "Applications", "research_mode": "team", "quality": "partial", "quality_score": 0.3527137327025429, "catalog_references": [], "prompt_length": 24082, "files_placed": 0, "status": "discard"}
{"timestamp": 1781407122.128432, "experiment_id": "d93eaf52", "concept_title": "`Applications/BoltzmannBridge/BottleneckStability.lean` closes the catalog's", "concept_domain": "Novelty", "research_mode": "team", "quality": "substantial", "quality_score": 0.7654400000000001, "catalog_references": [], "prompt_length": 24779, "files_placed": 11, "status": "keep"}
{"timestamp": 1781407142.7898793, "experiment_id": "72c0fc14", "concept_title": "The file `IntersectionForms.lean` formalizes the algebraic core of four-dimensio", "concept_domain": "Applications", "research_mode": "team", "quality": "substantial", "quality_score": 0.73968, "catalog_references": [], "prompt_length": 23060, "files_placed": 8, "status": "keep"}
{"timestamp": 1781407161.1222122, "experiment_id": "69ec9c78", "concept_title": "This cycle executed **Direction 1** of the previous cycle's roadmap and built it", "concept_domain": "Applications", "research_mode": "team", "quality": "partial", "quality_score": 0.52704, "catalog_references": [], "prompt_length": 23579, "files_placed": 0, "status": "keep"}
{"timestamp": 1781409154.2079084, "experiment_id": "ee9b58a0", "concept_title": "Close Proofs: Catalog's arithmetic mirror-symmetry skeleton", "concept_domain": "Novelty", "research_mode": "team", "quality": "partial", "quality_score": 0.42416000000000004, "catalog_references": [], "prompt_length": 6193, "files_placed": 0, "status": "discard"}
{"timestamp": 1781409188.2208915, "experiment_id": "755f7766", "concept_title": "Ultrametric Lipschitz bounds induced by tropical valuations on arithmetic height spaces", "concept_domain": "Bridges", "research_mode": "prove", "quality": "partial", "quality_score": 0.6879818181818182, "catalog_references": ["Bridges/ArithmeticVCDimension.lean", "Bridges/CategoricalTropicalUltrametric.lean", "Computation/PadicValuationDepth.lean"], "prompt_length": 18194, "files_placed": 5, "status": "keep"}
{"timestamp": 1781409206.854119, "experiment_id": "25818ba6", "concept_title": "The catalog established the exponential generating function (EGF) as an **isomor", "concept_domain": "Applications", "research_mode": "team", "quality": "partial", "quality_score": 0.5016448780487806, "catalog_references": [], "prompt_length": 23063, "files_placed": 0, "status": "keep"}
{"timestamp": 1781409224.3193479, "experiment_id": "073bebd9", "concept_title": "Deepening: `Applications/BoltzmannBridge/BottleneckStability.lean` closes the catalog's", "concept_domain": "Applications", "research_mode": "team", "quality": "partial", "quality_score": 0.5698123943661971, "catalog_references": [], "prompt_length": 6460, "files_placed": 0, "status": "keep"}
{"timestamp": 1781411189.0983515, "experiment_id": "c5ad7784", "concept_title": "Before this cycle the species program had assembled the exponential-generating-f", "concept_domain": "Applications", "research_mode": "team", "quality": "partial", "quality_score": 0.4463569849246231, "catalog_references": [], "prompt_length": 24541, "files_placed": 0, "status": "discard"}
{"timestamp": 1781411218.1699584, "experiment_id": "3413b24f", "concept_title": "The file `Catalog/Speculative/AutoResearch/ProteinFoldingMST.lean` formalizes th", "concept_domain": "Novelty", "research_mode": "team", "quality": "partial", "quality_score": 0.6652590990990991, "catalog_references": [], "prompt_length": 23471, "files_placed": 5, "status": "keep"}
{"timestamp": 1781411236.433263, "experiment_id": "a6c77942", "concept_title": "Close Proofs: The file `HodgeSpectralThreshold.lean` extracts a rigorous, sorry-free", "concept_domain": "Applications", "research_mode": "team", "quality": "partial", "quality_score": 0.6768233009708737, "catalog_references": [], "prompt_length": 17656, "files_placed": 6, "status": "keep"}
{"timestamp": 1781411258.295997, "experiment_id": "ccb8c64a", "concept_title": "Missing metric-regularity bridge between two catalog object", "concept_domain": "Novelty", "research_mode": "team", "quality": "partial", "quality_score": 0.42150944943784996, "catalog_references": [], "prompt_length": 21348, "files_placed": 0, "status": "discard"}
{"timestamp": 1781413209.4229069, "experiment_id": "ab1551a1", "concept_title": "Tropical valuation to ultrametric filtration stability for arithmetic height spaces", "concept_domain": "Bridges", "research_mode": "prove", "quality": "partial", "quality_score": 0.45554412465508987, "catalog_references": ["Bridges/ArithmeticVCDimension.lean", "Bridges/CategoricalTropicalUltrametric.lean", "Applications/PoincareData/MetricFiltration.lean", "Computation/PadicValuationDepth.lean"], "prompt_length": 19268, "files_placed": 0, "status": "discard"}
{"timestamp": 1781413246.3051715, "experiment_id": "f8b75e7d", "concept_title": "`Applications/BoltzmannBridge/InterleavingMetric.lean` completes the catalog's", "concept_domain": "Applications", "research_mode": "team", "quality": "partial", "quality_score": 0.45960930016909407, "catalog_references": [], "prompt_length": 17988, "files_placed": 0, "status": "discard"}
{"timestamp": 1781413266.2483714, "experiment_id": "fef5c16a", "concept_title": "Close Proofs: Before this cycle the species program had assembled the exponential-ge", "concept_domain": "Novelty", "research_mode": "team", "quality": "partial", "quality_score": 0.47980999999999996, "catalog_references": [], "prompt_length": 6193, "files_placed": 0, "status": "discard"}
{"timestamp": 1781415223.3342023, "experiment_id": "a699fab7", "concept_title": "Close Proofs: The catalog established the exponential generating function (EGF) as a", "concept_domain": "Applications", "research_mode": "team", "quality": "partial", "quality_score": 0.4721365853658536, "catalog_references": [], "prompt_length": 6148, "files_placed": 0, "status": "discard"}
{"timestamp": 1781415246.7882502, "experiment_id": "c1419c05", "concept_title": "Close Proofs: Ultrametric Lipschitz bounds induced by tropical valuations on arithme", "concept_domain": "Novelty", "research_mode": "team", "quality": "partial", "quality_score": 0.49476760736196324, "catalog_references": [], "prompt_length": 6257, "files_placed": 0, "status": "discard"}
{"timestamp": 1781415262.0414646, "experiment_id": "c31aba0d", "concept_title": "Close Proofs: Missing metric-regularity bridge between two catalog object", "concept_domain": "Novelty", "research_mode": "team", "quality": "partial", "quality_score": 0.39971, "catalog_references": [], "prompt_length": 6229, "files_placed": 0, "status": "discard"}
{"timestamp": 1781415301.5985518, "experiment_id": "74e1359a", "concept_title": "Close Proofs: The order-theoretic core of the Cook\u2013Reckhow program in this catalog n", "concept_domain": "Novelty", "research_mode": "team", "quality": "partial", "quality_score": 0.5097380530973451, "catalog_references": [], "prompt_length": 17646, "files_placed": 29, "status": "keep"}
{"timestamp": 1781416576.39736, "experiment_id": "a4cf656f", "concept_title": "The file `Catalog/MachineLearning/HodgeSpectralThreshold.lean` extracts a rigoro", "concept_domain": "Novelty", "research_mode": "team", "quality": "substantial", "quality_score": 0.7568800000000001, "catalog_references": [], "prompt_length": 23660, "files_placed": 6, "status": "keep"}
{"timestamp": 1781418900.6134238, "experiment_id": "d7fdcbd1", "concept_title": "Close Proofs: `Applications/BoltzmannBridge/InterleavingMetric.lean` completes the c", "concept_domain": "Novelty", "research_mode": "team", "quality": "partial", "quality_score": 0.5633814432989691, "catalog_references": [], "prompt_length": 6269, "files_placed": 0, "status": "keep"}
{"timestamp": 1781418915.8938224, "experiment_id": "d3523e31", "concept_title": "Nonarchimedean triangle inequality for arithmetic-height-induced ultrametrics", "concept_domain": "Bridges", "research_mode": "prove", "quality": "partial", "quality_score": 0.68948, "catalog_references": ["Bridges/ArithmeticVCDimension.lean", "Bridges/CategoricalTropicalUltrametric.lean", "Computation/PadicValuationDepth.lean"], "prompt_length": 18200, "files_placed": 5, "status": "keep"}
{"timestamp": 1781418932.772108, "experiment_id": "4302919c", "concept_title": "This cycle was about *closing proofs* in the Fibonacci primitive-divisor program", "concept_domain": "Novelty", "research_mode": "team", "quality": "substantial", "quality_score": 0.726744433497537, "catalog_references": [], "prompt_length": 23557, "files_placed": 6, "status": "keep"}
{"timestamp": 1781418953.9010456, "experiment_id": "5f9afeae", "concept_title": "Missing *metric-regularity bridge* between two catalog", "concept_domain": "Applications", "research_mode": "team", "quality": "partial", "quality_score": 0.44862373887665813, "catalog_references": [], "prompt_length": 18084, "files_placed": 0, "status": "discard"}
{"timestamp": 1781420922.4306767, "experiment_id": "415b1517", "concept_title": "The catalog's `Bridges/CategoricalTropicalUltrametric.lean` built an *abstract* ", "concept_domain": "Novelty", "research_mode": "team", "quality": "partial", "quality_score": 0.5069303571428572, "catalog_references": [], "prompt_length": 21260, "files_placed": 0, "status": "keep"}
{"timestamp": 1781420967.3533514, "experiment_id": "93423274", "concept_title": "Berggren-word valuation induces an ultrametric on primitive Pythagorean triples", "concept_domain": "Bridges", "research_mode": "prove", "quality": "partial", "quality_score": 0.4815445540322001, "catalog_references": ["Algebra/BerggrenLorentz/Core.lean", "Cryptography/BerggrenLatticeReduction.lean", "Bridges/CategoricalTropicalUltrametric.lean", "Computation/MegaSphere/Defs.lean"], "prompt_length": 18612, "files_placed": 0, "status": "discard"}
{"timestamp": 1781420985.7219987, "experiment_id": "996a8ea4", "concept_title": "Close Proofs: Tropical valuation to ultrametric filtration stability for arithmetic ", "concept_domain": "Novelty", "research_mode": "team", "quality": "partial", "quality_score": 0.5113714285714286, "catalog_references": [], "prompt_length": 17648, "files_placed": 18, "status": "keep"}
{"timestamp": 1781421000.5626075, "experiment_id": "5af43ad7", "concept_title": "This cycle pushed the *spectral depth threshold* program of", "concept_domain": "Novelty", "research_mode": "team", "quality": "substantial", "quality_score": 0.7068800000000001, "catalog_references": [], "prompt_length": 24194, "files_placed": 11, "status": "keep"}
{"timestamp": 1781422963.5230618, "experiment_id": "c59638c5", "concept_title": "Close Proofs: Nonarchimedean triangle inequality for arithmetic-height-induced ultra", "concept_domain": "Applications", "research_mode": "team", "quality": "partial", "quality_score": 0.4944299999999999, "catalog_references": [], "prompt_length": 6247, "files_placed": 0, "status": "discard"}
