{"timestamp": 1782654059.1735182, "experiment_id": "6dda8a29", "concept_title": "Close Proofs: These conjectures continue the research cycle begun in", "concept_domain": "Applications", "research_mode": "prove", "quality": "partial", "quality_score": 0.6926119999999999, "catalog_references": ["Shared/CarmichaelProof.lean", "Shared/CarmichaelHelper.lean", "Applications/FibonacciPrimitiveDivisor.lean"], "prompt_length": 20894, "files_placed": 7, "status": "keep"}
{"timestamp": 1782657071.7816806, "experiment_id": "3f134ce6", "concept_title": "Existence of Inverse Sprugnoli Arrays with Closed-Form Coefficients", "concept_domain": "Novelty", "research_mode": "team", "quality": "partial", "quality_score": 0.5751195652173913, "catalog_references": ["Riordan group properties", "Sprugnoli group inverses", "Inverse power series in formal power series ring"], "prompt_length": 20562, "files_placed": 8, "status": "keep"}
{"timestamp": 1782657210.541896, "experiment_id": "bc81b3a8", "concept_title": "Optimal Transport and Wasserstein Distances", "concept_domain": "Novelty", "research_mode": "prove", "quality": "partial", "quality_score": 0.5376, "catalog_references": [], "prompt_length": 20699, "files_placed": 6, "status": "keep"}
{"timestamp": 1782657671.8547869, "experiment_id": "0eb9ce9e", "concept_title": "Degree-one triviality threshold for Grassmann schemes", "concept_domain": "Novelty", "research_mode": "team", "quality": "partial", "quality_score": 0.63032, "catalog_references": [], "prompt_length": 20846, "files_placed": 8, "status": "keep"}
{"timestamp": 1782659020.6447992, "experiment_id": "72418ed5", "concept_title": "Equality Cases for Spectral Radius Bound in Signed Graphs", "concept_domain": "Novelty", "research_mode": "team", "quality": "partial", "quality_score": 0.43096, "catalog_references": ["Sun and Das (2020)", "Lan et al. (2023)"], "prompt_length": 22838, "files_placed": 7, "status": "discard"}
{"timestamp": 1782659513.6542592, "experiment_id": "d1a8353e", "concept_title": "Recurrence relation for extended Eulerian numbers", "concept_domain": "Applications", "research_mode": "formalize", "quality": "partial", "quality_score": 0.56128, "catalog_references": ["Catalog/FINAL/CombFoundations.lean", "Catalog/FINAL/BinomialCoefficients.lean"], "prompt_length": 22920, "files_placed": 7, "status": "keep"}
{"timestamp": 1782661053.1886108, "experiment_id": "872fa119", "concept_title": "Non-Finite-Axiomatization of Measurable Majorities via the Incoherence Index", "concept_domain": "Novelty", "research_mode": "team", "quality": "substantial", "quality_score": 0.7050400000000001, "catalog_references": ["arXiv:2606.23853", "MossPedersen2026"], "prompt_length": 22965, "files_placed": 10, "status": "keep"}
{"timestamp": 1782662736.9607794, "experiment_id": "461fdf74", "concept_title": "Quantum Thermodynamics: Landauer's Principle at the Nanoscale", "concept_domain": "Novelty", "research_mode": "team", "quality": "partial", "quality_score": 0.37835341176470594, "catalog_references": [], "prompt_length": 20641, "files_placed": 8, "status": "discard"}
{"timestamp": 1782662885.111816, "experiment_id": "251e4381", "concept_title": "EML Interpolation Theory: Stone-Weierstrass for exp-log Networks", "concept_domain": "Applications", "research_mode": "team", "quality": "partial", "quality_score": 0.68488, "catalog_references": [], "prompt_length": 23851, "files_placed": 7, "status": "keep"}
{"timestamp": 1782663066.5338938, "experiment_id": "28bd8499", "concept_title": "Extremal L1 mass of normalized 1-Lipschitz grid height differences", "concept_domain": "Novelty", "research_mode": "team", "quality": "partial", "quality_score": 0.643006, "catalog_references": ["mathlib: Data.Fin.Basic", "mathlib: Algebra.BigOperators.Fin", "mathlib: Combinatorics.SimpleGraph.Basic", "Cereceda 2009, Mixing graph colourings", "Ginepro--Hull 2014, counting Miura-ori flat foldings"], "prompt_length": 23144, "files_placed": 7, "status": "keep"}
{"timestamp": 1782665966.5337977, "experiment_id": "ce5b4268", "concept_title": "Complete Characterization of Permutation Polynomials x^q + bx^2 + cx + d over F_{q^2}", "concept_domain": "Novelty", "research_mode": "team", "quality": "substantial", "quality_score": 0.71224, "catalog_references": ["Permutation polynomials over finite fields", "Weil sums and character sums", "Finite field trace and norm maps", "Canonical additive characters"], "prompt_length": 21108, "files_placed": 7, "status": "keep"}
{"timestamp": 1782667284.94941, "experiment_id": "8999eb20", "concept_title": "Girth bounds minimum distance of bipartite graph codes", "concept_domain": "Novelty", "research_mode": "team", "quality": "substantial", "quality_score": 0.7782, "catalog_references": ["math.CO", "cs.IT"], "prompt_length": 23016, "files_placed": 8, "status": "keep"}
{"timestamp": 1782667551.6156356, "experiment_id": "07ec4039", "concept_title": "EML Universal Approximation: Density of EML Functions", "concept_domain": "Applications", "research_mode": "team", "quality": "substantial", "quality_score": 0.77992, "catalog_references": [], "prompt_length": 20767, "files_placed": 7, "status": "keep"}
{"timestamp": 1782667635.3347116, "experiment_id": "35f6557d", "concept_title": "Euler-Mascheroni Constant: Irrationality Approaches", "concept_domain": "Applications", "research_mode": "prove", "quality": "partial", "quality_score": 0.61504, "catalog_references": [], "prompt_length": 22871, "files_placed": 7, "status": "keep"}
{"timestamp": 1782667842.509181, "experiment_id": "e44edf9a", "concept_title": "Existence of Non-Trivial Boolean Degree One Functions on J_q(n,2) for q \u2265 3 and n \u2265 4", "concept_domain": "Novelty", "research_mode": "prove", "quality": "partial", "quality_score": 0.39200000000000007, "catalog_references": ["Catalog/FiniteGeometry/GrassmannScheme.lean", "Catalog/FiniteGeometry/CameronLiebler.lean", "Catalog/Algebra/PolynomialDegreeOne.lean", "Catalog/FiniteGeometry/FilmusIhringer.lean"], "prompt_length": 22844, "files_placed": 6, "status": "discard"}
{"timestamp": 1782672236.3867586, "experiment_id": "37c46c25", "concept_title": "EML Fixed-Point Theorem: exp-log Iteration Convergence", "concept_domain": "Applications", "research_mode": "team", "quality": "partial", "quality_score": 0.650914, "catalog_references": [], "prompt_length": 21504, "files_placed": 7, "status": "keep"}
{"timestamp": 1782672639.9476686, "experiment_id": "0ffedaae", "concept_title": "Random Graphs: Erd\u0151s-R\u00e9nyi Threshold Phenomena", "concept_domain": "Novelty", "research_mode": "prove", "quality": "partial", "quality_score": 0.69956, "catalog_references": [], "prompt_length": 20711, "files_placed": 7, "status": "keep"}
{"timestamp": 1782674469.8553183, "experiment_id": "203b440f", "concept_title": "Frankl's Union-Closed Conjecture: Partial Results", "concept_domain": "Novelty", "research_mode": "prove", "quality": "partial", "quality_score": 0.68208, "catalog_references": [], "prompt_length": 20711, "files_placed": 8, "status": "keep"}
{"timestamp": 1782676019.5302463, "experiment_id": "8f5c44bc", "concept_title": "ML Universal Approximation: Width vs Depth Trade-offs", "concept_domain": "Applications", "research_mode": "team", "quality": "partial", "quality_score": 0.65133, "catalog_references": [], "prompt_length": 20900, "files_placed": 7, "status": "keep"}
{"timestamp": 1782677445.043696, "experiment_id": "23de9107", "concept_title": "Continued Fractions and Diophantine Approximation", "concept_domain": "Applications", "research_mode": "prove", "quality": "partial", "quality_score": 0.5948, "catalog_references": [], "prompt_length": 20749, "files_placed": 7, "status": "keep"}
{"timestamp": 1782679983.6011875, "experiment_id": "5773b0b9", "concept_title": "Logic-Physics Bridge: Consistency of Physical Theories", "concept_domain": "Applications", "research_mode": "team", "quality": "partial", "quality_score": 0.5333106912442396, "catalog_references": [], "prompt_length": 20746, "files_placed": 9, "status": "keep"}
{"timestamp": 1782681531.8161964, "experiment_id": "3f78044a", "concept_title": "Formal Verification of Algorithms", "concept_domain": "Novelty", "research_mode": "prove", "quality": "partial", "quality_score": 0.5920639999999999, "catalog_references": [], "prompt_length": 20696, "files_placed": 7, "status": "keep"}
{"timestamp": 1782681671.872473, "experiment_id": "333b621d", "concept_title": "Consciousness as Integrated Information: Mathematical Foundations", "concept_domain": "Novelty", "research_mode": "prove", "quality": "substantial", "quality_score": 0.72324, "catalog_references": ["Catalog/Novelty/Clique.lean", "Catalog/Novelty/IntegratedInformation.lean", "Catalog/Novelty/CircuitComplexity/Basic.lean"], "prompt_length": 20704, "files_placed": 8, "status": "keep"}
{"timestamp": 1782681774.5884984, "experiment_id": "52a20f8b", "concept_title": "EML Kolmogorov-Arnold Representation", "concept_domain": "Applications", "research_mode": "team", "quality": "partial", "quality_score": 0.59432, "catalog_references": [], "prompt_length": 20957, "files_placed": 8, "status": "keep"}
{"timestamp": 1782681852.3408291, "experiment_id": "dfab202e", "concept_title": "Contragredient Period Sign Formula for Betti-Whittaker Periods of GL(n)", "concept_domain": "Applications", "research_mode": "team", "quality": "substantial", "quality_score": 0.8119999999999999, "catalog_references": ["math.RT", "math.NT", "Betti-Whittaker periods", "contragredient representations", "cohomological automorphic representations"], "prompt_length": 21062, "files_placed": 7, "status": "keep"}
{"timestamp": 1782683327.551643, "experiment_id": "2b7b775f", "concept_title": "Sufficient condition for non-periodicity of awaited set of Wang tiles", "concept_domain": "Novelty", "research_mode": "team", "quality": "partial", "quality_score": 0.69949, "catalog_references": ["zbMATH07421483"], "prompt_length": 20705, "files_placed": 8, "status": "keep"}
{"timestamp": 1782686775.2100933, "experiment_id": "9ecd5b8c", "concept_title": "EML Interpolation Theory: Stone-Weierstrass for exp-log Networks", "concept_domain": "Applications", "research_mode": "prove", "quality": "substantial", "quality_score": 0.7327899999999999, "catalog_references": ["Catalog.Novelty.CircuitComplexity.Basic", "Catalog.Novelty.MaximalFunctionals.Basic"], "prompt_length": 21721, "files_placed": 6, "status": "keep"}
{"timestamp": 1782686835.2248774, "experiment_id": "bfc7b99e", "concept_title": "The Non-Existence of New Factorial Square Solutions", "concept_domain": "Applications", "research_mode": "formalize", "quality": "partial", "quality_score": 0.44995, "catalog_references": ["Algebra/FactorialNotPerfectPower.lean", "NumberTheory/LegendreFormula.lean", "NumberTheory/BertrandPostulate.lean", "Algebra/PrimeFactorization.lean"], "prompt_length": 12758, "files_placed": 6, "status": "discard"}
{"timestamp": 1782688470.8587596, "experiment_id": "0a1f99db", "concept_title": "Ramsey Theory: Bounds and Constructions", "concept_domain": "Applications", "research_mode": "prove", "quality": "partial", "quality_score": 0.57392, "catalog_references": [], "prompt_length": 20724, "files_placed": 8, "status": "keep"}
{"timestamp": 1782688640.1475425, "experiment_id": "cfea11f0", "concept_title": "Optimal Transport and Wasserstein Distances", "concept_domain": "Novelty", "research_mode": "prove", "quality": "partial", "quality_score": 0.65976, "catalog_references": [], "prompt_length": 20699, "files_placed": 10, "status": "keep"}
{"timestamp": 1782688796.2182877, "experiment_id": "f589dfb5", "concept_title": "Zero-Knowledge Proofs: Schnorr Protocol", "concept_domain": "Novelty", "research_mode": "prove", "quality": "partial", "quality_score": 0.55062, "catalog_references": [], "prompt_length": 20705, "files_placed": 8, "status": "keep"}
{"timestamp": 1782688919.9510255, "experiment_id": "60145036", "concept_title": "Tightness of the Density Threshold for Configurations in Linear Hypergraphs", "concept_domain": "Novelty", "research_mode": "team", "quality": "partial", "quality_score": 0.3726553552511416, "catalog_references": ["Theorem 1", "Corollary 1", "Brown-Erd\u0151s-S\u00f3s conjecture"], "prompt_length": 20838, "files_placed": 6, "status": "discard"}
{"timestamp": 1782690530.3272376, "experiment_id": "4f7ad584", "concept_title": "EML Universal Approximation", "concept_domain": "Applications", "research_mode": "team", "quality": "partial", "quality_score": 0.6244, "catalog_references": [], "prompt_length": 20690, "files_placed": 7, "status": "keep"}
{"timestamp": 1782690924.1147487, "experiment_id": "12b5f4b2", "concept_title": "Fano-plane threshold for additive strong blocking sets in the h=1 case", "concept_domain": "Novelty", "research_mode": "team", "quality": "partial", "quality_score": 0.6807300000000001, "catalog_references": ["Mathlib.Data.ZMod.Basic", "Mathlib.LinearAlgebra.FiniteDimensional", "Mathlib.LinearAlgebra.ProjectiveSpace", "Mathlib.LinearAlgebra.Dimension.Finrank", "Mathlib.Data.Finset.Card"], "prompt_length": 20861, "files_placed": 7, "status": "keep"}
{"timestamp": 1782692488.510035, "experiment_id": "3c64518a", "concept_title": "Complete Characterization of Minimal Forbidden Partial\u2011Cube Minors for Daisy Cubes", "concept_domain": "Novelty", "research_mode": "team", "quality": "substantial", "quality_score": 0.79664, "catalog_references": ["Djokovic1973", "Winkler1984", "XieXu2025", "Benz2012", "paper:arXiv:2107.XXXX"], "prompt_length": 21220, "files_placed": 8, "status": "keep"}
{"timestamp": 1782710096.6587472, "experiment_id": "03afc47a", "concept_title": "Langlands Correspondence: GL(1) Case", "concept_domain": "Novelty", "research_mode": "formalize", "quality": "partial", "quality_score": 0.6182000000000001, "catalog_references": ["FINAL/NumberTheory/CyclotomicGaloisGroup.lean", "FINAL/NumberTheory/DirichletCharacters.lean", "FINAL/Algebra/GroupIsoTransport.lean"], "prompt_length": 21010, "files_placed": 2, "status": "keep"}
{"timestamp": 1782721186.7665336, "experiment_id": "c78b961d", "concept_title": "Extremal Graph Theory: Tur\u00e1n and Szemer\u00e9di", "concept_domain": "Shared", "research_mode": "prove", "quality": "partial", "quality_score": 0.4367097362637363, "catalog_references": [], "prompt_length": 22822, "files_placed": 8, "status": "discard"}
{"timestamp": 1782721280.673104, "experiment_id": "e0366114", "concept_title": "Twin Prime Gaps: Zhang-Maynard Formalization", "concept_domain": "Algebra", "research_mode": "sorry_fill", "quality": "partial", "quality_score": 0.4133402545454546, "catalog_references": ["Catalog/FINAL/ExcludedMinors/ZnGain.lean"], "prompt_length": 17199, "files_placed": 5, "status": "discard"}
{"timestamp": 1782730957.6125095, "experiment_id": "fdb1bb82", "concept_title": "Euler-Mascheroni Constant: Irrationality Approaches", "concept_domain": "NumberTheory", "research_mode": "formalize", "quality": "partial", "quality_score": 0.452, "catalog_references": ["Catalog/FINAL/NumberTheory/EulerMascheroni/SeriesRepresentation.lean", "Mathlib.Analysis.SpecialFunctions.Log.Basic", "Mathlib.Analysis.Calculus.Integral.Interval", "Mathlib.Data.Nat.Harmonic", "Mathlib.Order.Floor"], "prompt_length": 22883, "files_placed": 6, "status": "discard"}
{"timestamp": 1782750384.81305, "experiment_id": "d379c591", "concept_title": "Graph Coloring: Chromatic Polynomial Theory", "concept_domain": "Combinatorics", "research_mode": "prove", "quality": "partial", "quality_score": 0.64372, "catalog_references": [], "prompt_length": 22910, "files_placed": 3, "status": "keep"}
{"timestamp": 1782751742.406184, "experiment_id": "e94880cd", "concept_title": "Elliptic Curve Cryptography: Weil Pairing and BLS Signatures", "concept_domain": "Cryptography", "research_mode": "team", "quality": "partial", "quality_score": 0.65224, "catalog_references": [], "prompt_length": 22912, "files_placed": 7, "status": "keep"}
{"timestamp": 1782755994.7980804, "experiment_id": "3ec587ed", "concept_title": "EML Differential Equations: ODEs with Exponential-Logarithmic Coefficients", "concept_domain": "Applications", "research_mode": "formalize", "quality": "partial", "quality_score": 0.624552, "catalog_references": [], "prompt_length": 17773, "files_placed": 6, "status": "keep"}
{"timestamp": 1782757387.2547066, "experiment_id": "c9fb85eb", "concept_title": "Classification of Perfect Cubes in 14-gonal Numbers", "concept_domain": "Novelty", "research_mode": "sorry_fill", "quality": "partial", "quality_score": 0.4432100000000001, "catalog_references": ["Novelty/FourteenGonalCubes.lean"], "prompt_length": 17710, "files_placed": 6, "status": "discard"}
{"timestamp": 1782764708.1089656, "experiment_id": "47d1dc51", "concept_title": "Unramified Obstruction Equals Descent Obstruction for Rationally Connected Varieties over p-adic Function Fields", "concept_domain": "Novelty", "research_mode": "team", "quality": "partial", "quality_score": 0.6155999999999999, "catalog_references": ["arXiv:2412.17486", "CT03", "Har02", "Sto07", "Sko09", "HSS15"], "prompt_length": 23337, "files_placed": 7, "status": "keep"}
{"timestamp": 1782772571.0864546, "experiment_id": "0a73d6d7", "concept_title": "Proof Complexity: Resolution and Cutting Planes", "concept_domain": "Probability", "research_mode": "prove", "quality": "substantial", "quality_score": 0.73856, "catalog_references": [], "prompt_length": 22870, "files_placed": 7, "status": "keep"}
{"timestamp": 1782772778.9578972, "experiment_id": "b86be6e3", "concept_title": "K\u00e4hler-Einstein Metrics and K-Stability", "concept_domain": "Cryptography", "research_mode": "team", "quality": "partial", "quality_score": 0.6648000000000001, "catalog_references": [], "prompt_length": 22789, "files_placed": 7, "status": "keep"}
{"timestamp": 1782775690.7303975, "experiment_id": "60fa5375", "concept_title": "Complete Solutions to the 14-gonal Fourth Power Diophantine Equation", "concept_domain": "Combinatorics", "research_mode": "team", "quality": "partial", "quality_score": 0.5186266666666667, "catalog_references": ["math.NT", "Diophantine_equations", "Polygonal_numbers"], "prompt_length": 22974, "files_placed": 7, "status": "keep"}
{"timestamp": 1782775903.4472961, "experiment_id": "ee65478f", "concept_title": "Extremality of Projective Plane Block Designs in the Coupon Collector's Problem", "concept_domain": "Combinatorics", "research_mode": "formalize", "quality": "partial", "quality_score": 0.44923399999999997, "catalog_references": ["Combinatorics/CouponCoverFramework.lean", "Combinatorics/ChromaticPolynomial.lean"], "prompt_length": 22582, "files_placed": 6, "status": "discard"}
{"timestamp": 1782778378.417306, "experiment_id": "8f9a8a82", "concept_title": "Combinatorial Nerve Chain Homotopy Equivalence", "concept_domain": "Cryptography", "research_mode": "formalize", "quality": "partial", "quality_score": 0.29062540000000003, "catalog_references": ["Mathlib.Data.Finset.Basic", "Mathlib.Algebra.BigOperators.Group.Finset.Basic", "Mathlib.Algebra.BigOperators.Ring.Finset", "Mathlib.Data.Fintype.Basic"], "prompt_length": 16859, "files_placed": 6, "status": "discard"}
{"timestamp": 1782779534.362724, "experiment_id": "99e4c1c9", "concept_title": "Projective Plane Coupon Collection Slowness", "concept_domain": "MachineLearning", "research_mode": "team", "quality": "substantial", "quality_score": 0.77624, "catalog_references": ["math.CO", "math.PR", "finite_geometry", "coupon_collector"], "prompt_length": 23201, "files_placed": 7, "status": "keep"}
{"timestamp": 1782786887.3184793, "experiment_id": "4aec8950", "concept_title": "Projective Plane Coupon Collection Slowness", "concept_domain": "Computation", "research_mode": "team", "quality": "partial", "quality_score": 0.6655200000000001, "catalog_references": ["math.CO", "math.PR", "finite_geometry", "coupon_collector"], "prompt_length": 23193, "files_placed": 7, "status": "keep"}
{"timestamp": 1782788203.0906541, "experiment_id": "230b77ce", "concept_title": "Certified Adversarial Robustness via Sheaf Cohomology", "concept_domain": "Novelty", "research_mode": "team", "quality": "substantial", "quality_score": 0.76576, "catalog_references": [], "prompt_length": 22869, "files_placed": 8, "status": "keep"}
{"timestamp": 1782797105.3223248, "experiment_id": "8acf5433", "concept_title": "Zero-Knowledge Proofs: Schnorr Protocol", "concept_domain": "Algebra", "research_mode": "prove", "quality": "partial", "quality_score": 0.6049599999999999, "catalog_references": ["Cryptography/SchnorrLemmas.lean"], "prompt_length": 22844, "files_placed": 6, "status": "keep"}
{"timestamp": 1782799635.1952877, "experiment_id": "fd05632c", "concept_title": "Sums of Three Cubes", "concept_domain": "Physics", "research_mode": "formalize", "quality": "partial", "quality_score": 0.40141157142857153, "catalog_references": ["Mathlib/Data/ZMod/Basic.lean", "Mathlib/Data/Finset/Basic.lean", "Mathlib/Tactic/Ring.lean", "Mathlib/Tactic/NormNum.lean"], "prompt_length": 19655, "files_placed": 6, "status": "discard"}
{"timestamp": 1782806197.5235271, "experiment_id": "30133a3d", "concept_title": "Exact sign law for coefficients of Ramanujan's third-order mock theta function \u03c1(q)", "concept_domain": "Novelty", "research_mode": "formalize", "quality": "partial", "quality_score": 0.3375488878571429, "catalog_references": ["FINAL/Algebra/FormalPowerSeries.lean", "FINAL/NumberTheory/Cyclotomic.lean"], "prompt_length": 22008, "files_placed": 7, "status": "discard"}
{"timestamp": 1782820676.438706, "experiment_id": "efa9038a", "concept_title": "Homotopy Type Theory as Foundations", "concept_domain": "Pythagorean", "research_mode": "formalize", "quality": "partial", "quality_score": 0.455, "catalog_references": ["Mathlib.Data.Complex.GaussianInt", "Mathlib.NumberTheory.Primes", "Mathlib.Data.Int.GCD", "Mathlib.Algebra.EuclideanDomain"], "prompt_length": 22815, "files_placed": 6, "status": "discard"}
