{"timestamp": 1790432791.5745475, "experiment_id": "85c32d45", "concept_title": "FACT round-32 #3 — UNIVERSAL-S3-CORRECTED: the law is universal across all S3 fields (paper 112)", "concept_domain": "Novelty", "research_mode": "team", "quality": "substantial", "quality_score": 0.72, "catalog_references": [], "prompt_length": 26341, "files_placed": 4, "status": "keep"}
{"timestamp": 1790473657.2377846, "experiment_id": "dea80b65", "concept_title": "FACT round-32 #2 — UNIVERSAL-S3-TEST: wrong polynomial, accidental x5-2 measurement (paper 111)", "concept_domain": "Pythagorean", "research_mode": "team", "quality": "partial", "quality_score": 0.62, "catalog_references": [], "prompt_length": 26741, "files_placed": 4, "status": "keep"}
{"timestamp": 1790493184.8970501, "experiment_id": "b6553c28", "concept_title": "FACT round-31 #2 — SEXTIC-HINT-VALUE: the hint map extends beyond degree 5 (paper 121)", "concept_domain": "Physics", "research_mode": "team", "quality": "substantial", "quality_score": 0.8, "catalog_references": [], "prompt_length": 26155, "files_placed": 4, "status": "keep"}
{"timestamp": 1790531440.1928155, "experiment_id": "4b5f9882", "concept_title": "FACT round-34 #4 — DEGREE-6-NONABELIAN: D6 type channel for x6-2 (paper 122)", "concept_domain": "Algebra", "research_mode": "team", "quality": "substantial", "quality_score": 0.72, "catalog_references": [], "prompt_length": 26233, "files_placed": 4, "status": "keep"}
{"timestamp": 1790584734.958404, "experiment_id": "f9f43bb0", "concept_title": "FACT round-34 #3 — DIAL-CROSS-TALK: independent dials are truly independent (paper 121)", "concept_domain": "Bridges", "research_mode": "team", "quality": "substantial", "quality_score": 0.72, "catalog_references": [], "prompt_length": 26198, "files_placed": 4, "status": "keep"}
{"timestamp": 1790615104.478566, "experiment_id": "ea6702d1", "concept_title": "FACT round-34 #2 — SEPTIC-FRONTIER: the framework extends beyond degree 6 (paper 120)", "concept_domain": "Novelty", "research_mode": "team", "quality": "substantial", "quality_score": 0.72, "catalog_references": [], "prompt_length": 26121, "files_placed": 4, "status": "keep"}
{"timestamp": 1790671472.866285, "experiment_id": "ba34db80", "concept_title": "FACT round-33 #3 — D5-TYPE-CHANNEL: completing the D5 measurement at m*=320 (paper 118)", "concept_domain": "Probability", "research_mode": "team", "quality": "partial", "quality_score": 0.62, "catalog_references": [], "prompt_length": 26185, "files_placed": 4, "status": "keep"}
{"timestamp": 1790694606.2033315, "experiment_id": "827b1ae9", "concept_title": "FACT round-34 #1 — MASTER-TABLE: every type-channel value in one document (paper 119)", "concept_domain": "Algebra", "research_mode": "team", "quality": "substantial", "quality_score": 0.72, "catalog_references": [], "prompt_length": 26171, "files_placed": 4, "status": "keep"}
{"timestamp": 1790735395.5993197, "experiment_id": "772fbcdb", "concept_title": "FACT round-33 #1 — PROGRAMME-MILESTONE: the post-resume programme in one document (paper 116)", "concept_domain": "Cryptography", "research_mode": "team", "quality": "partial", "quality_score": 0.66, "catalog_references": [], "prompt_length": 28936, "files_placed": 4, "status": "keep"}
{"timestamp": 1790758795.3637965, "experiment_id": "23a377e0", "concept_title": "FACT round-33 #2 — D5-CONDUCTOR: the quadratic subfield of x5+20x+32 (paper 117)", "concept_domain": "Physics", "research_mode": "team", "quality": "partial", "quality_score": 0.62, "catalog_references": [], "prompt_length": 26118, "files_placed": 4, "status": "keep"}
{"timestamp": 1790801229.668796, "experiment_id": "61abe78f", "concept_title": "FACT round-32 #4 — UNIVERSAL-S3-FOURTH: four fields, one answer (paper 115)", "concept_domain": "Pythagorean", "research_mode": "team", "quality": "partial", "quality_score": 0.6, "catalog_references": [], "prompt_length": 26164, "files_placed": 4, "status": "keep"}
{"timestamp": 1790881340.8411224, "experiment_id": "d7b08081", "concept_title": "FACT round-35 #6 — D5-HINT-VALUE: completing the D5 row (paper 125)", "concept_domain": "Bridges", "research_mode": "team", "quality": "partial", "quality_score": 0.66, "catalog_references": [], "prompt_length": 26017, "files_placed": 4, "status": "keep"}
{"timestamp": 1790907647.9798036, "experiment_id": "b39a3b1a", "concept_title": "FACT round-35 #5 — HINT-VALUE-SCALING: hints compound (paper 124)", "concept_domain": "Bridges", "research_mode": "team", "quality": "partial", "quality_score": 0.66, "catalog_references": [], "prompt_length": 26079, "files_placed": 4, "status": "keep"}
{"timestamp": 1790953632.5443127, "experiment_id": "5621f0f8", "concept_title": "FACT round-35 #4 — COMPOSITE-DIAL: emergence in the composite type channel (paper 125)", "concept_domain": "Tropical", "research_mode": "team", "quality": "substantial", "quality_score": 0.72, "catalog_references": [], "prompt_length": 26162, "files_placed": 4, "status": "keep"}
{"timestamp": 1790971050.8717642, "experiment_id": "9aae3e9c", "concept_title": "FACT round-35 #3 — THE-OCTIC-CYCLIC: degree 8 completes the high-degree ladder (paper 124)", "concept_domain": "Novelty", "research_mode": "team", "quality": "substantial", "quality_score": 0.72, "catalog_references": [], "prompt_length": 26282, "files_placed": 4, "status": "keep"}
{"timestamp": 1790994289.9149756, "experiment_id": "f81db42e", "concept_title": "FACT round-35 #2 — UNIVERSAL-S3-FIFTH: five fields, one law (paper 123)", "concept_domain": "Combinatorics", "research_mode": "team", "quality": "substantial", "quality_score": 0.72, "catalog_references": [], "prompt_length": 26238, "files_placed": 4, "status": "keep"}
{"timestamp": 1791050104.0997488, "experiment_id": "602d68e3", "concept_title": "FACT round-36 #1 — RAMIFIED-TYPE-CHANNEL: ramified contribution is negligible (paper 128)", "concept_domain": "Probability", "research_mode": "team", "quality": "substantial", "quality_score": 0.72, "catalog_references": [], "prompt_length": 26210, "files_placed": 4, "status": "keep"}
{"timestamp": 1791061846.551997, "experiment_id": "152d60cd", "concept_title": "FACT round-37 #1 — HINT-SIZE-SCALING: hint value is size-stable across a 16,384x span (paper 129)", "concept_domain": "Logic", "research_mode": "team", "quality": "substantial", "quality_score": 0.8, "catalog_references": [], "prompt_length": 27297, "files_placed": 4, "status": "keep"}
{"timestamp": 1791092706.102895, "experiment_id": "9b17c9d6", "concept_title": "FACT round-35 #9 — BIQUADRATIC-TYPE-CHANNEL: two types, full pinning (paper 127)", "concept_domain": "Novelty", "research_mode": "team", "quality": "substantial", "quality_score": 0.72, "catalog_references": [], "prompt_length": 26185, "files_placed": 4, "status": "keep"}
{"timestamp": 1791129287.8240502, "experiment_id": "0768415b", "concept_title": "FACT round-35 #8 — CONJUGATE-S3-TEST: conjugate fields produce identical type channels (paper 127)", "concept_domain": "Novelty", "research_mode": "team", "quality": "partial", "quality_score": 0.62, "catalog_references": [], "prompt_length": 26304, "files_placed": 4, "status": "keep"}
{"timestamp": 1791153118.2575917, "experiment_id": "38666d07", "concept_title": "FACT round-37 #3 — POSTERIOR-FILTER: real filter equals sham — battery capacity converts to zero factoring utility (paper 131)", "concept_domain": "Cryptography", "research_mode": "team", "quality": "partial", "quality_score": 0.62, "catalog_references": [], "prompt_length": 27524, "files_placed": 4, "status": "keep"}
{"timestamp": 1791184425.6456976, "experiment_id": "5a7633ee", "concept_title": "FACT round-38 #3 — POSITIONAL-FILTER: position pays 5.19x, the stratum beyond the residue cap is live (paper 137)", "concept_domain": "Cryptography", "research_mode": "team", "quality": "partial", "quality_score": 0.66, "catalog_references": [], "prompt_length": 27276, "files_placed": 4, "status": "keep"}
{"timestamp": 1791240454.151033, "experiment_id": "b573b2a4", "concept_title": "FACT round-38 #2 — TOY-QS-YIELD: the sieve's advantage is the survivor filter; relation pool is QR-restricted random (paper 136)", "concept_domain": "Computation", "research_mode": "team", "quality": "partial", "quality_score": 0.66, "catalog_references": [], "prompt_length": 27496, "files_placed": 4, "status": "keep"}
{"timestamp": 1791320699.317018, "experiment_id": "0f53319e", "concept_title": "FACT round-38 #1 — DEGREE-NINE: full pinning extends to Q(zeta_19)+ (paper 135)", "concept_domain": "Probability", "research_mode": "team", "quality": "substantial", "quality_score": 0.72, "catalog_references": [], "prompt_length": 27082, "files_placed": 4, "status": "keep"}
{"timestamp": 1791355083.0228784, "experiment_id": "6da44148", "concept_title": "FACT round-37 #6 — CHEBOTAREV-PRECISION: the master table reproduces simultaneously, max deviation 0.00048 bits (paper 134)", "concept_domain": "Cryptography", "research_mode": "team", "quality": "substantial", "quality_score": 0.72, "catalog_references": [], "prompt_length": 27322, "files_placed": 4, "status": "keep"}
{"timestamp": 1791381472.7511063, "experiment_id": "43e1310b", "concept_title": "NET-49: THE-REAL-MODEL-KNEE-COLLAPSES-AND-SATURATES — on Qwen2.5-0.5B the lossless attention knee is {16,32,24} at ctx={512,1024,2048}, 24–64x below the toy law d*ctx/32, sub-linear and declining; selection importance inflates an order of magnitude", "concept_domain": "Geometry", "research_mode": "team", "quality": "partial", "quality_score": 0.6, "catalog_references": [], "prompt_length": 30014, "files_placed": 4, "status": "keep"}
{"timestamp": 1791440460.444815, "experiment_id": "4f516785", "concept_title": "NET-50: THE-TROPICAL-LIMIT-IS-LOSSY-BUT-THE-RECOVERY-IS-FAST — argmax attention retains only 0.25-0.36 on Qwen2.5-0.5B, k=4 recovers to ~0.9, knees {16,32,24} replicate NET-49 exactly; Maslov-gap map isolates the diffuse tail as the only far-from-tropical region", "concept_domain": "Novelty", "research_mode": "team", "quality": "partial", "quality_score": 0.62, "catalog_references": [], "prompt_length": 28934, "files_placed": 4, "status": "keep"}
{"timestamp": 1791467347.659775, "experiment_id": "2b42a28a", "concept_title": "FACT round-37 #5 — DIAL-OVERLAP-LAW: partially overlapping dials are exactly one bit redundant (paper 133)", "concept_domain": "Logic", "research_mode": "team", "quality": "substantial", "quality_score": 0.72, "catalog_references": [], "prompt_length": 27495, "files_placed": 4, "status": "keep"}
{"timestamp": 1791525731.7387824, "experiment_id": "ce6eb638", "concept_title": "FACT round-38 #4 — EXTERNAL-HINT-FILTER: one scalar prices everything, the barrier-map triptych completes (paper 138)", "concept_domain": "Novelty", "research_mode": "team", "quality": "partial", "quality_score": 0.66, "catalog_references": [], "prompt_length": 27456, "files_placed": 4, "status": "keep"}
{"timestamp": 1791551417.1686094, "experiment_id": "acb7b707", "concept_title": "FACT round-39 #1 — QR-SMOOTHNESS: the QR bite is variance, not mean (paper 139)", "concept_domain": "Novelty", "research_mode": "team", "quality": "partial", "quality_score": 0.62, "catalog_references": [], "prompt_length": 26977, "files_placed": 4, "status": "keep"}
{"timestamp": 1791587591.9391627, "experiment_id": "14ed24f6", "concept_title": "FACT round-39 #6 — PER-N-PREDICTOR-FULL: shape transfers perfectly, level tracks each population (paper 144)", "concept_domain": "Cryptography", "research_mode": "team", "quality": "partial", "quality_score": 0.62, "catalog_references": [], "prompt_length": 26637, "files_placed": 4, "status": "keep"}
{"timestamp": 1791660233.8973775, "experiment_id": "f3f73074", "concept_title": "FACT round-39 #5 — ET-HINTS: interval hints priced by coverage x width (paper 143)", "concept_domain": "Logic", "research_mode": "team", "quality": "partial", "quality_score": 0.62, "catalog_references": [], "prompt_length": 26750, "files_placed": 4, "status": "keep"}
