{"timestamp": 1783827510.6184943, "experiment_id": "538f30a2", "concept_title": "Moonshot: Multiverse Set Theory \u2014 Mathematics Across Branches", "concept_domain": "Tropical", "research_mode": "team", "quality": "substantial", "quality_score": 0.78, "catalog_references": [], "prompt_length": 24118, "files_placed": 4, "status": "keep"}
{"timestamp": 1783827523.722575, "experiment_id": "08eba531", "concept_title": "Moonshot: Nanotechnology Computation \u2014 Molecular Computing Limits", "concept_domain": "Applications", "research_mode": "team", "quality": "substantial", "quality_score": 0.7, "catalog_references": [], "prompt_length": 24201, "files_placed": 4, "status": "keep"}
{"timestamp": 1783830540.812474, "experiment_id": "e6201bf5", "concept_title": "Moonshot: Quantum Consciousness \u2014 Penrose-Hameroff Orchestrated Reduction", "concept_domain": "Logic", "research_mode": "team", "quality": "substantial", "quality_score": 0.74, "catalog_references": [], "prompt_length": 24137, "files_placed": 4, "status": "keep"}
{"timestamp": 1783831587.0197632, "experiment_id": "245dd564", "concept_title": "Rucker: Mind Tools \u2014 Mathematics as Cognitive Extension", "concept_domain": "Applications", "research_mode": "team", "quality": "substantial", "quality_score": 0.72, "catalog_references": [], "prompt_length": 24093, "files_placed": 4, "status": "keep"}
{"timestamp": 1783832634.25108, "experiment_id": "c016fced", "concept_title": "Deepening: Infinite-Dimensional Chess: Winning on the Hilbert Board", "concept_domain": "Applications", "research_mode": "team", "quality": "substantial", "quality_score": 0.83, "catalog_references": [], "prompt_length": 24008, "files_placed": 116, "status": "keep"}
{"timestamp": 1783833657.623897, "experiment_id": "ef2405bd", "concept_title": "Moonshot: Brain-Computer Interface Mathematics \u2014 Neural Coding Theorems", "concept_domain": "Novelty", "research_mode": "team", "quality": "substantial", "quality_score": 0.82, "catalog_references": [], "prompt_length": 23587, "files_placed": 4, "status": "keep"}
{"timestamp": 1783836695.8589418, "experiment_id": "26d2653d", "concept_title": "Moonshot: The Last Theorem \u2014 Formalizing the Heat Death of Mathematics", "concept_domain": "Applications", "research_mode": "team", "quality": "substantial", "quality_score": 0.83, "catalog_references": [], "prompt_length": 24222, "files_placed": 4, "status": "keep"}
{"timestamp": 1783836700.6621528, "experiment_id": "2cd42066", "concept_title": "Conditional Refinement of Page's Theorem on Landau-Siegel Zeros", "concept_domain": "Novelty", "research_mode": "team", "quality": "substantial", "quality_score": 0.74, "catalog_references": ["math.NT", "Landau-Siegel zeros", "Page's theorem", "Dirichlet L-functions", "zero-free regions"], "prompt_length": 24013, "files_placed": 9, "status": "keep"}
{"timestamp": 1783839745.1027832, "experiment_id": "49f67430", "concept_title": "Explicit Threshold for No-(k+1)-in-line: f_k(n) = kn for all k \u2265 3 and n \u2265 k", "concept_domain": "Novelty", "research_mode": "team", "quality": "partial", "quality_score": 0.62, "catalog_references": ["math.CO", "math.MG"], "prompt_length": 3650, "files_placed": 2, "status": "keep"}
{"timestamp": 1783840771.7608953, "experiment_id": "e2c082ff", "concept_title": "Lower bounds on clique densities using generalized inverses", "concept_domain": "MachineLearning", "research_mode": "team", "quality": "substantial", "quality_score": 0.82, "catalog_references": ["turan1941extremal", "zykov1949linear", "goodman1959sets", "khadziivanov1978", "bollobas1976complete"], "prompt_length": 23756, "files_placed": 4, "status": "keep"}
{"timestamp": 1783841798.046563, "experiment_id": "71e324bf", "concept_title": "Exact AVD\u2011total chromatic number of central graphs of regular graphs", "concept_domain": "Applications", "research_mode": "team", "quality": "substantial", "quality_score": 0.7, "catalog_references": ["\"Panda, Verma, Keerti (2020)\"", "\"Zhang et al. (2005)\"", "\"Behzad (1965)\"", "\"Vizing (1968)\"", "\"Wang (2007)\"", "\"Chen (2008)\"", "\"Lu et al. (2017)\"", "\"PR (2014)\"", "\"CG (2009)\"", "\"LCM (2015)\"", "\"PM (2010)\"", "\"VFP (2022)\"", "\"Vernold (2007)\""], "prompt_length": 23640, "files_placed": 144, "status": "keep"}
{"timestamp": 1783842808.0176487, "experiment_id": "27e75405", "concept_title": "Product Hilton-Milner theorem for large n", "concept_domain": "Applications", "research_mode": "team", "quality": "partial", "quality_score": 0.62, "catalog_references": ["math.CO", "05D05"], "prompt_length": 3253, "files_placed": 50, "status": "keep"}
{"timestamp": 1783842821.2252526, "experiment_id": "b88b4225", "concept_title": "Categorifying the quantum binomial product rule via filtrations of plethystic modules", "concept_domain": "Applications", "research_mode": "team", "quality": "substantial", "quality_score": 0.82, "catalog_references": ["GSMW-Pfaff", "Hermite reciprocity", "Wronskian isomorphism"], "prompt_length": 23952, "files_placed": 52, "status": "keep"}
{"timestamp": 1783844851.1416335, "experiment_id": "c1de826b", "concept_title": "Deepening: Moonshot: Brain-Computer Interface Mathematics \u2014 Neural Coding Theorems", "concept_domain": "Applications", "research_mode": "team", "quality": "substantial", "quality_score": 0.82, "catalog_references": [], "prompt_length": 23673, "files_placed": 4, "status": "keep"}
{"timestamp": 1783844867.7728362, "experiment_id": "62dd551b", "concept_title": "Deepening: Aleph-1 Surface: Geometry Between Dimensions", "concept_domain": "Novelty", "research_mode": "team", "quality": "substantial", "quality_score": 0.82, "catalog_references": [], "prompt_length": 24008, "files_placed": 4, "status": "keep"}
{"timestamp": 1783846913.3667998, "experiment_id": "e978b5fe", "concept_title": "White's Quadratic Exchange Conjecture (Part 3)", "concept_domain": "MachineLearning", "research_mode": "team", "quality": "substantial", "quality_score": 0.78, "catalog_references": ["White1980Bases", "Blasiak2007Toric", "Lason2015Toric"], "prompt_length": 23931, "files_placed": 4, "status": "keep"}
{"timestamp": 1783847949.750577, "experiment_id": "077d3a2b", "concept_title": "Characterization of Finite Posets with RB-Domain Probabilistic Powerdomains", "concept_domain": "Applications", "research_mode": "team", "quality": "partial", "quality_score": 0.62, "catalog_references": ["abs/2305.06330", "AbramskyJung1994", "Gierz2003", "Jung1989", "JungTix1998", "Rockafellar1970"], "prompt_length": 3154, "files_placed": 2, "status": "keep"}
{"timestamp": 1783848978.9017618, "experiment_id": "c3fe1d06", "concept_title": "Deepening: That the zero-dimensional persistent homology of the prim", "concept_domain": "MachineLearning", "research_mode": "team", "quality": "substantial", "quality_score": 0.83, "catalog_references": [], "prompt_length": 24036, "files_placed": 4, "status": "keep"}
{"timestamp": 1783850993.7023778, "experiment_id": "6a70bc30", "concept_title": "Limit Distribution of Descendants in Random d-DAGs", "concept_domain": "Applications", "research_mode": "team", "quality": "substantial", "quality_score": 0.72, "catalog_references": ["Janson (2023) - Ancestries in random d-DAGs (theorems on descendant distributions)", "Jan2023 - Recent work on descendants of n in G_n", "Drm2009 - Random recursive trees (d=1 case)"], "prompt_length": 23428, "files_placed": 4, "status": "keep"}
{"timestamp": 1783852021.08515, "experiment_id": "b290e3a0", "concept_title": "Deepening: Upper bound conjecture for the cake balancing ratio sequence", "concept_domain": "Applications", "research_mode": "team", "quality": "substantial", "quality_score": 0.82, "catalog_references": [], "prompt_length": 24039, "files_placed": 4, "status": "keep"}
{"timestamp": 1783852035.639703, "experiment_id": "53945fe2", "concept_title": "Deepening: Formalizing the Probabilistic Method: Erdos Meets Lean", "concept_domain": "Novelty", "research_mode": "team", "quality": "substantial", "quality_score": 0.82, "catalog_references": [], "prompt_length": 24023, "files_placed": 4, "status": "keep"}
{"timestamp": 1783853066.0241418, "experiment_id": "a6691c84", "concept_title": "Deepening: The P vs NP of Sudoku: Phase Transitions in Constraint Satisfaction", "concept_domain": "Novelty", "research_mode": "team", "quality": "substantial", "quality_score": 0.82, "catalog_references": [], "prompt_length": 24036, "files_placed": 4, "status": "keep"}
{"timestamp": 1783855107.3569922, "experiment_id": "e618ea1a", "concept_title": "This project formalizes, from first principles in Lean 4 / Mathlib, the core of", "concept_domain": "Novelty", "research_mode": "team", "quality": "substantial", "quality_score": 0.82, "catalog_references": [], "prompt_length": 27699, "files_placed": 4, "status": "keep"}
{"timestamp": 1783855123.2335045, "experiment_id": "0930ae42", "concept_title": "The Lean development `Catalog/MachineLearning/KnottedLightAlexander.lean` formal", "concept_domain": "Novelty", "research_mode": "team", "quality": "substantial", "quality_score": 0.82, "catalog_references": [], "prompt_length": 25278, "files_placed": 4, "status": "keep"}
{"timestamp": 1783856160.4823368, "experiment_id": "25c7a40e", "concept_title": "Deepening: The Mandelbrot Set's Secret Number Theory: Quadratic Recurrence and Primality", "concept_domain": "Novelty", "research_mode": "team", "quality": "substantial", "quality_score": 0.83, "catalog_references": [], "prompt_length": 23642, "files_placed": 4, "status": "keep"}
{"timestamp": 1783857203.366906, "experiment_id": "812631ed", "concept_title": "`NeuralCoding.lean` builds a self-contained chain of neural-coding results:", "concept_domain": "Novelty", "research_mode": "team", "quality": "substantial", "quality_score": 0.82, "catalog_references": [], "prompt_length": 25920, "files_placed": 4, "status": "keep"}
{"timestamp": 1783860219.1904767, "experiment_id": "16e4b1d9", "concept_title": "This project formalizes, in `Cryptography/RamanujanOracle.lean`, the claim that ", "concept_domain": "Applications", "research_mode": "team", "quality": "substantial", "quality_score": 0.8, "catalog_references": [], "prompt_length": 26367, "files_placed": 4, "status": "keep"}
{"timestamp": 1783861255.2210317, "experiment_id": "f3dfcf44", "concept_title": "The file `PhaseTransitionCurieWeiss.lean` proves that the Curie\u2013Weiss mean-field", "concept_domain": "Applications", "research_mode": "team", "quality": "substantial", "quality_score": 0.82, "catalog_references": [], "prompt_length": 26095, "files_placed": 4, "status": "keep"}
{"timestamp": 1783862292.4002137, "experiment_id": "8cebc683", "concept_title": "Close Proofs: The Mandelbrot Set's Secret Number Theory: Quadratic Recurrence and Pr", "concept_domain": "Applications", "research_mode": "team", "quality": "substantial", "quality_score": 0.72, "catalog_references": [], "prompt_length": 23905, "files_placed": 4, "status": "keep"}
{"timestamp": 1783863334.433562, "experiment_id": "73c84a79", "concept_title": "Tightness of the Isolation Lemma bound for arbitrary edge offsets", "concept_domain": "Novelty", "research_mode": "team", "quality": "substantial", "quality_score": 0.82, "catalog_references": ["Faber & Harris (2018)", "Ta-Shma (2015)", "Mulmuley, Vazirani, Vazirani (1987)"], "prompt_length": 23698, "files_placed": 4, "status": "keep"}
{"timestamp": 1783864418.1311781, "experiment_id": "bc831bad", "concept_title": "Deepening: `NeuralCoding.lean` builds a self-contained chain of neural-coding results:", "concept_domain": "Applications", "research_mode": "team", "quality": "substantial", "quality_score": 0.83, "catalog_references": [], "prompt_length": 24048, "files_placed": 4, "status": "keep"}
{"timestamp": 1783865441.2824454, "experiment_id": "d019c88a", "concept_title": "Exact dictionary \"logical qubits = middle homology\"", "concept_domain": "Applications", "research_mode": "team", "quality": "substantial", "quality_score": 0.88, "catalog_references": [], "prompt_length": 26912, "files_placed": 4, "status": "keep"}
{"timestamp": 1783865449.144045, "experiment_id": "f8254dbf", "concept_title": "Deepening: This project formalizes, from first principles in Lean 4 / Mathlib, the core of", "concept_domain": "Novelty", "research_mode": "team", "quality": "substantial", "quality_score": 0.83, "catalog_references": [], "prompt_length": 24043, "files_placed": 4, "status": "keep"}
{"timestamp": 1783868570.1271837, "experiment_id": "edd57dbd", "concept_title": "Deepening: The Lean development `Catalog/MachineLearning/KnottedLightAlexander.lean` formal", "concept_domain": "Applications", "research_mode": "team", "quality": "substantial", "quality_score": 0.86, "catalog_references": [], "prompt_length": 24054, "files_placed": 4, "status": "keep"}
{"timestamp": 1783868588.3964396, "experiment_id": "b35b4ce5", "concept_title": "Asymptotic Clique-to-Clique Density Bound", "concept_domain": "Applications", "research_mode": "team", "quality": "substantial", "quality_score": 0.79, "catalog_references": ["bollobas1976complete", "lovasz1983limits", "reiher2020clique"], "prompt_length": 23891, "files_placed": 4, "status": "keep"}
{"timestamp": 1783868594.282539, "experiment_id": "3dfad72d", "concept_title": "Characterizing finite posets whose probabilistic powerdomain is an RB-domain", "concept_domain": "Applications", "research_mode": "team", "quality": "substantial", "quality_score": 0.7, "catalog_references": ["Jung 1989", "Jung-Tix 1998"], "prompt_length": 23770, "files_placed": 4, "status": "keep"}
{"timestamp": 1783869637.9395459, "experiment_id": "919ceb1f", "concept_title": "Deepening: Tightness of the Isolation Lemma bound for arbitrary edge offsets", "concept_domain": "Novelty", "research_mode": "team", "quality": "substantial", "quality_score": 0.83, "catalog_references": [], "prompt_length": 23465, "files_placed": 4, "status": "keep"}
{"timestamp": 1783870673.172842, "experiment_id": "494cab2e", "concept_title": "This project formalises the mission *\"Causal Loops in Category Theory: when comp", "concept_domain": "Novelty", "research_mode": "team", "quality": "substantial", "quality_score": 0.82, "catalog_references": [], "prompt_length": 30086, "files_placed": 4, "status": "keep"}
{"timestamp": 1783871711.0897844, "experiment_id": "3cdfbb0e", "concept_title": "Deepening: Automatic Sequences and the Halting Problem: When Is a Sequence Computable?", "concept_domain": "Novelty", "research_mode": "team", "quality": "substantial", "quality_score": 0.82, "catalog_references": [], "prompt_length": 24044, "files_placed": 4, "status": "keep"}
{"timestamp": 1783874775.329911, "experiment_id": "c81fdc47", "concept_title": "Bruhat Order Preserves Closure Relations for B-Orbits on Flag Variety Product", "concept_domain": "Applications", "research_mode": "team", "quality": "substantial", "quality_score": 0.82, "catalog_references": ["Bruhat order on symmetric groups", "Flag varieties and orbit theory", "Demazure products and monoid actions"], "prompt_length": 23787, "files_placed": 4, "status": "keep"}
{"timestamp": 1783874793.729609, "experiment_id": "b6e3f70d", "concept_title": "Close Proofs: Tightness of the Isolation Lemma bound for arbitrary edge offsets", "concept_domain": "Applications", "research_mode": "team", "quality": "substantial", "quality_score": 0.83, "catalog_references": [], "prompt_length": 23895, "files_placed": 4, "status": "keep"}
{"timestamp": 1783874802.3584118, "experiment_id": "ddbb821f", "concept_title": "This cycle deepens the formalization of Dung's abstract argumentation theory and", "concept_domain": "Novelty", "research_mode": "team", "quality": "substantial", "quality_score": 0.82, "catalog_references": [], "prompt_length": 26588, "files_placed": 4, "status": "keep"}
{"timestamp": 1783876868.8732126, "experiment_id": "00880e6f", "concept_title": "The cycle established a compact algebraic core for four-dimensional geometry: a", "concept_domain": "Novelty", "research_mode": "team", "quality": "substantial", "quality_score": 0.82, "catalog_references": [], "prompt_length": 27846, "files_placed": 4, "status": "keep"}
{"timestamp": 1783876880.450451, "experiment_id": "766b6e47", "concept_title": "Irreducibility of mod p reductions of crystalline representations at fractional slope and even weight", "concept_domain": "Applications", "research_mode": "team", "quality": "substantial", "quality_score": 0.8, "catalog_references": ["p-adic_Hodge_theory", "local_Langlands_mod_p", "Galois_representations"], "prompt_length": 24033, "files_placed": 4, "status": "keep"}
{"timestamp": 1783877925.4884887, "experiment_id": "6fce3466", "concept_title": "Deepening: This project formalises the mission *\"Causal Loops in Category Theory: when comp", "concept_domain": "Applications", "research_mode": "team", "quality": "substantial", "quality_score": 0.83, "catalog_references": [], "prompt_length": 23892, "files_placed": 4, "status": "keep"}
{"timestamp": 1783878962.935362, "experiment_id": "0bd39924", "concept_title": "Delta-Petrie Schur Positivity", "concept_domain": "Novelty", "research_mode": "team", "quality": "substantial", "quality_score": 0.72, "catalog_references": ["Bergeron-Garsia delta operators", "Macdonald polynomials", "Compositional shuffle conjecture", "Petrie symmetric functions (Grinberg)", "LLT polynomials"], "prompt_length": 23092, "files_placed": 4, "status": "keep"}
{"timestamp": 1783880015.291928, "experiment_id": "867d1ba2", "concept_title": "Deepening: This cycle deepens the formalization of Dung's abstract argumentation theory and", "concept_domain": "Novelty", "research_mode": "team", "quality": "substantial", "quality_score": 0.83, "catalog_references": [], "prompt_length": 24044, "files_placed": 4, "status": "keep"}
{"timestamp": 1783881057.7342088, "experiment_id": "0fe20e26", "concept_title": "Close Proofs: The Hodge Conjecture for Neural Networks: Algebraic Cycles in Decision", "concept_domain": "Novelty", "research_mode": "team", "quality": "substantial", "quality_score": 0.82, "catalog_references": [], "prompt_length": 23895, "files_placed": 4, "status": "keep"}
{"timestamp": 1783881073.825054, "experiment_id": "91f941b6", "concept_title": "Deepening: The Periodic Table Is a Lie: Elements as Eigenvalues of Spacetime", "concept_domain": "Novelty", "research_mode": "team", "quality": "substantial", "quality_score": 0.78, "catalog_references": [], "prompt_length": 23673, "files_placed": 4, "status": "keep"}
{"timestamp": 1783882149.8689406, "experiment_id": "1f9ea620", "concept_title": "Deepening: Moonshot: The Last Theorem \u2014 Formalizing the Heat Death of Mathematics", "concept_domain": "Applications", "research_mode": "team", "quality": "substantial", "quality_score": 0.82, "catalog_references": [], "prompt_length": 24051, "files_placed": 4, "status": "keep"}
{"timestamp": 1783886194.9472842, "experiment_id": "44b2d089", "concept_title": "Deepening: The cycle established a compact algebraic core for four-dimensional geometry: a", "concept_domain": "Applications", "research_mode": "team", "quality": "substantial", "quality_score": 0.83, "catalog_references": [], "prompt_length": 24053, "files_placed": 4, "status": "keep"}
{"timestamp": 1783886211.8004637, "experiment_id": "167b800e", "concept_title": "Deepening: The Hodge Conjecture for Neural Networks: Algebraic Cycles in Decision", "concept_domain": "Applications", "research_mode": "team", "quality": "substantial", "quality_score": 0.82, "catalog_references": [], "prompt_length": 23617, "files_placed": 4, "status": "keep"}
{"timestamp": 1783887266.0178316, "experiment_id": "d95af58e", "concept_title": "Deepening: Anti-Mathematics: What If All Axioms Were Negated?", "concept_domain": "Novelty", "research_mode": "team", "quality": "substantial", "quality_score": 0.82, "catalog_references": [], "prompt_length": 24019, "files_placed": 4, "status": "keep"}
{"timestamp": 1783888321.7972162, "experiment_id": "465c6137", "concept_title": "Recursive Decomposition Isomorphism for General m-Tamari Intervals and Planar Constellations", "concept_domain": "Applications", "research_mode": "team", "quality": "substantial", "quality_score": 0.72, "catalog_references": ["Dermenjian's work on greedy \u03bd-Tamari posets", "Bousquet-M\u00e9lou and Chapoton's functional equation solution for m-Tamari intervals", "Flajolet and Sedgewick's Analytic Combinatorics for tree/map decompositions"], "prompt_length": 23929, "files_placed": 4, "status": "keep"}
{"timestamp": 1783889386.0895505, "experiment_id": "61c22649", "concept_title": "The opposite-semicube Helly property characterizes harmonic-evenness in Cartesian products of partial cubes", "concept_domain": "Novelty", "research_mode": "team", "quality": "substantial", "quality_score": 0.78, "catalog_references": ["Djokovi\u0107-Winkler theorem", "Polat's theorem"], "prompt_length": 23696, "files_placed": 4, "status": "keep"}
{"timestamp": 1783892490.4614544, "experiment_id": "eb025541", "concept_title": "`ThermodynamicsOfProof.lean` \u2014 the positive theory:", "concept_domain": "Novelty", "research_mode": "team", "quality": "substantial", "quality_score": 0.83, "catalog_references": [], "prompt_length": 30769, "files_placed": 4, "status": "keep"}
{"timestamp": 1783892497.8130376, "experiment_id": "bcff067f", "concept_title": "Recursive decomposition of greedy Tamari intervals via Dyck path structures", "concept_domain": "Novelty", "research_mode": "team", "quality": "substantial", "quality_score": 0.7, "catalog_references": ["Dermenjian 2024", "Chapoton 2024", "Bousquet-M\u00e9lou 2023"], "prompt_length": 23861, "files_placed": 4, "status": "keep"}
