{"timestamp": 1787112046.489269, "experiment_id": "308f24be", "concept_title": "NET-48: The direct test survives via the MEDIAN \u2014 k*=160 at (d=4, ctx=2048, seed=3), all four point-horns refuted, the completed 16\u00d7 distribution {160,224,256} has median exactly 224 = 7/8\u00b7(d\u00b7ctx/32) \u2014 the 7/8-median law is 2/2-context, 6/6-seed", "concept_domain": "Geometry", "research_mode": "team", "quality": "substantial", "quality_score": 0.82, "catalog_references": [], "prompt_length": 30878, "files_placed": 4, "status": "keep"}
{"timestamp": 1787116499.1274776, "experiment_id": "3da67f84", "concept_title": "Pole-order obstruction", "concept_domain": "Shared", "research_mode": "team", "quality": "substantial", "quality_score": 0.78, "catalog_references": [], "prompt_length": 25999, "files_placed": 4, "status": "keep"}
{"timestamp": 1787123143.6185658, "experiment_id": "c0dccdf7", "concept_title": "Conjecture A (Parity-gap conjecture). For all `n ≥ 2`, all injective `S, T : Fin n → ZMod p`, the parity-weighted exponent counter `permCoeff S T` is nonzero somewhere; in fact `max_r |permCoeff S T r", "concept_domain": "Probability", "research_mode": "team", "quality": "substantial", "quality_score": 0.88, "catalog_references": [], "prompt_length": 26313, "files_placed": 4, "status": "keep"}
{"timestamp": 1787126078.6451116, "experiment_id": "8a3962f5", "concept_title": "The number of triples `(a,b,c)` with `0 < a,b,c ≤ H` that are Berggren-generated\nfrom a positive seed is `Θ(H)` — vanishingly few compared with `H³` — while the\nnumber of *Pythagorean* triples in the ", "concept_domain": "MachineLearning", "research_mode": "team", "quality": "substantial", "quality_score": 0.86, "catalog_references": [], "prompt_length": 26288, "files_placed": 4, "status": "keep"}
{"timestamp": 1787129722.777369, "experiment_id": "18f8232d", "concept_title": "Compression Research A1: Price of universality — minimax redundancy of universal decompressors", "concept_domain": "Bridges", "research_mode": "team", "quality": "substantial", "quality_score": 0.89, "catalog_references": [], "prompt_length": 26889, "files_placed": 5, "status": "keep"}
{"timestamp": 1787132988.1509783, "experiment_id": "5bad6114", "concept_title": "The \"if\" direction is proved (`FourierFA.poisson_summation`); the converse is open.", "concept_domain": "Probability", "research_mode": "team", "quality": "substantial", "quality_score": 0.91, "catalog_references": [], "prompt_length": 25930, "files_placed": 5, "status": "keep"}
{"timestamp": 1787132999.2067366, "experiment_id": "60572a3f", "concept_title": "The Bell defect, counted exactly", "concept_domain": "Combinatorics", "research_mode": "team", "quality": "substantial", "quality_score": 0.85, "catalog_references": [], "prompt_length": 28800, "files_placed": 4, "status": "keep"}
{"timestamp": 1787136433.6542246, "experiment_id": "f46e1405", "concept_title": "The qualitative half is now proved: `Cₛ = 1` iff the class is degenerate\n(`shtarkovSum_eq_one_iff`), so any genuinely new source makes the price strictly\npositive, and the price is monotone in the cla", "concept_domain": "Cryptography", "research_mode": "team", "quality": "substantial", "quality_score": 0.86, "catalog_references": [], "prompt_length": 26967, "files_placed": 4, "status": "keep"}
{"timestamp": 1787144945.391439, "experiment_id": "f1fd8ff1", "concept_title": "For a graded `G`-set `Y = ⨆_n Y_n` the generating function `Σ_n t_r(Y_n) q^n` is a rational\nfunction of `q` whenever the grades are eventually `r`-transitive, with denominator dividing\n`(1−q)^{r+1}`.", "concept_domain": "Physics", "research_mode": "team", "quality": "substantial", "quality_score": 0.82, "catalog_references": [], "prompt_length": 26156, "files_placed": 4, "status": "keep"}
{"timestamp": 1787144957.4042945, "experiment_id": "4ba8c40c", "concept_title": "Emergent Spacetime from Quantum Entanglement", "concept_domain": "Novelty", "research_mode": "team", "quality": "substantial", "quality_score": 0.85, "catalog_references": [], "prompt_length": 26059, "files_placed": 4, "status": "keep"}
{"timestamp": 1787151262.5747857, "experiment_id": "7299371d", "concept_title": "Erdos-Graham: Exact Coverings by Distinct Unit Fractions", "concept_domain": "Combinatorics", "research_mode": "team", "quality": "substantial", "quality_score": 0.78, "catalog_references": [], "prompt_length": 26091, "files_placed": 4, "status": "keep"}
{"timestamp": 1787154399.6564147, "experiment_id": "57212186", "concept_title": "reinforcement learning", "concept_domain": "NumberTheory", "research_mode": "team", "quality": "substantial", "quality_score": 0.9, "catalog_references": [], "prompt_length": 27796, "files_placed": 4, "status": "keep"}
{"timestamp": 1787154411.5209131, "experiment_id": "6bc62e41", "concept_title": "Both sides of the identity are already available as Lean theorems", "concept_domain": "Applications", "research_mode": "team", "quality": "substantial", "quality_score": 0.88, "catalog_references": [], "prompt_length": 26062, "files_placed": 4, "status": "keep"}
{"timestamp": 1787154420.8728802, "experiment_id": "b8ad3057", "concept_title": "What follows are the conjectures the analysis stage extracted, in decreasing order of expected\nimpact.", "concept_domain": "Shared", "research_mode": "team", "quality": "substantial", "quality_score": 0.85, "catalog_references": [], "prompt_length": 26010, "files_placed": 4, "status": "keep"}
{"timestamp": 1787161263.3109386, "experiment_id": "0f708106", "concept_title": "Both ingredients are already machine-checked (the sharp bound and 1-sum closure),", "concept_domain": "Novelty", "research_mode": "team", "quality": "substantial", "quality_score": 0.86, "catalog_references": [], "prompt_length": 26020, "files_placed": 4, "status": "keep"}
{"timestamp": 1787161272.9770534, "experiment_id": "ab33dc9e", "concept_title": "Pole-order obstruction", "concept_domain": "Cryptography", "research_mode": "team", "quality": "substantial", "quality_score": 0.82, "catalog_references": [], "prompt_length": 26011, "files_placed": 4, "status": "keep"}
{"timestamp": 1787161283.0442123, "experiment_id": "843dbe86", "concept_title": "All the moving parts — honest uniqueness decoding", "concept_domain": "Algebra", "research_mode": "team", "quality": "substantial", "quality_score": 0.82, "catalog_references": [], "prompt_length": 26088, "files_placed": 4, "status": "keep"}
{"timestamp": 1787168427.1293843, "experiment_id": "252d7c91", "concept_title": "Two new self-contained files extend the conditional Hilbert-class-field interfac", "concept_domain": "Algebra", "research_mode": "team", "quality": "substantial", "quality_score": 0.8, "catalog_references": [], "prompt_length": 33075, "files_placed": 4, "status": "keep"}
{"timestamp": 1787168440.2088144, "experiment_id": "6d98445d", "concept_title": "Future directions from cycle 4c2c71e5", "concept_domain": "Physics", "research_mode": "team", "quality": "substantial", "quality_score": 0.82, "catalog_references": [], "prompt_length": 27142, "files_placed": 4, "status": "keep"}
{"timestamp": 1787172363.203032, "experiment_id": "a985d45a", "concept_title": "Cycle 4 already provides the two witnesses and the joint-inconsistency", "concept_domain": "Combinatorics", "research_mode": "team", "quality": "substantial", "quality_score": 0.82, "catalog_references": [], "prompt_length": 26061, "files_placed": 4, "status": "keep"}
{"timestamp": 1787175713.7162745, "experiment_id": "c442a26f", "concept_title": "Conjecture D (q-series rigidity / Molien-type dichotomy). The fixed-point q-series determines the orbit-counting generating function, and conversely.", "concept_domain": "Bridges", "research_mode": "team", "quality": "substantial", "quality_score": 0.88, "catalog_references": [], "prompt_length": 26057, "files_placed": 4, "status": "keep"}
{"timestamp": 1787175727.1302557, "experiment_id": "d11810a4", "concept_title": "Derived from the three files of this line of work:", "concept_domain": "Geometry", "research_mode": "team", "quality": "substantial", "quality_score": 0.82, "catalog_references": [], "prompt_length": 34720, "files_placed": 4, "status": "keep"}
{"timestamp": 1787179320.0522768, "experiment_id": "2e28602b", "concept_title": "Inverse Stereographic Neural Field Theory", "concept_domain": "Physics", "research_mode": "team", "quality": "substantial", "quality_score": 0.85, "catalog_references": [], "prompt_length": 27055, "files_placed": 4, "status": "keep"}
{"timestamp": 1787182616.0087366, "experiment_id": "a23b48bf", "concept_title": "The \"if\" direction is proved (`FourierFA.poisson_summation`); the converse is open.", "concept_domain": "Pythagorean", "research_mode": "team", "quality": "substantial", "quality_score": 0.85, "catalog_references": [], "prompt_length": 25930, "files_placed": 4, "status": "keep"}
{"timestamp": 1787190741.2232246, "experiment_id": "daf80a32", "concept_title": "Kernel patterns", "concept_domain": "Algebra", "research_mode": "team", "quality": "substantial", "quality_score": 0.82, "catalog_references": [], "prompt_length": 25922, "files_placed": 4, "status": "keep"}
{"timestamp": 1787195438.059198, "experiment_id": "9e83a721", "concept_title": "reinforcement learning", "concept_domain": "Algebra", "research_mode": "team", "quality": "substantial", "quality_score": 0.88, "catalog_references": [], "prompt_length": 27786, "files_placed": 4, "status": "keep"}
{"timestamp": 1787195450.8448472, "experiment_id": "0750e9d7", "concept_title": "The reduction is proved, and the 194 values `c_g(1)` are tabulated", "concept_domain": "NumberTheory", "research_mode": "team", "quality": "substantial", "quality_score": 0.84, "catalog_references": [], "prompt_length": 26039, "files_placed": 4, "status": "keep"}
{"timestamp": 1787198336.368195, "experiment_id": "94e7c481", "concept_title": "Beal's Conjecture", "concept_domain": "NumberTheory", "research_mode": "team", "quality": "substantial", "quality_score": 0.78, "catalog_references": [], "prompt_length": 25971, "files_placed": 4, "status": "keep"}
{"timestamp": 1787201644.512532, "experiment_id": "17d131fb", "concept_title": "Conjecture D10 (the Molien invariant is exactly the Burnside mark vector modulo scaling)", "concept_domain": "NumberTheory", "research_mode": "team", "quality": "substantial", "quality_score": 0.78, "catalog_references": [], "prompt_length": 25945, "files_placed": 4, "status": "keep"}
{"timestamp": 1787204848.3477118, "experiment_id": "5c70a18c", "concept_title": "Deepening: The formal results in `Catalog/Applications/EMLQuantumActivation.lean` show that", "concept_domain": "NumberTheory", "research_mode": "team", "quality": "substantial", "quality_score": 0.86, "catalog_references": [], "prompt_length": 26382, "files_placed": 16, "status": "keep"}
{"timestamp": 1787209612.2547042, "experiment_id": "52846ceb", "concept_title": "Power-sum inversion", "concept_domain": "Applications", "research_mode": "team", "quality": "substantial", "quality_score": 0.82, "catalog_references": [], "prompt_length": 26034, "files_placed": 16, "status": "keep"}
{"timestamp": 1787212656.5063462, "experiment_id": "84bf9824", "concept_title": "reinforcement learning", "concept_domain": "Novelty", "research_mode": "team", "quality": "substantial", "quality_score": 0.85, "catalog_references": [], "prompt_length": 27786, "files_placed": 4, "status": "keep"}
{"timestamp": 1787216243.2132993, "experiment_id": "61305688", "concept_title": "ArXiv paper: Domination-packing ratio for planar and unit disk graphs", "concept_domain": "Bridges", "research_mode": "team", "quality": "substantial", "quality_score": 0.82, "catalog_references": [], "prompt_length": 26688, "files_placed": 4, "status": "keep"}
{"timestamp": 1787216256.580061, "experiment_id": "5b26e37d", "concept_title": "**Conjecture.** In a sparse random corpus with bounded expected document size an", "concept_domain": "Geometry", "research_mode": "team", "quality": "substantial", "quality_score": 0.8, "catalog_references": [], "prompt_length": 29777, "files_placed": 4, "status": "keep"}
{"timestamp": 1787222866.6788347, "experiment_id": "4b03d5cc", "concept_title": "Planck-Foam-Topology: Quantum Fluctuation Geometry at 10^-35 Meters", "concept_domain": "Physics", "research_mode": "team", "quality": "substantial", "quality_score": 0.86, "catalog_references": [], "prompt_length": 25927, "files_placed": 4, "status": "keep"}
{"timestamp": 1787222875.7590632, "experiment_id": "39c3166e", "concept_title": "reinforcement learning", "concept_domain": "Combinatorics", "research_mode": "team", "quality": "substantial", "quality_score": 0.74, "catalog_references": [], "prompt_length": 27798, "files_placed": 4, "status": "keep"}
{"timestamp": 1787226189.0712528, "experiment_id": "db2f2b2f", "concept_title": "Quantum-Pythagorean-Walk: Polynomial Time Integer Factorization via Tree Resonance", "concept_domain": "Physics", "research_mode": "team", "quality": "substantial", "quality_score": 0.9, "catalog_references": [], "prompt_length": 26000, "files_placed": 4, "status": "keep"}
{"timestamp": 1787231481.9722278, "experiment_id": "367abe49", "concept_title": "For the PTX-augmented optimum `q*_{β,γ}` with `γ > 0`,", "concept_domain": "Novelty", "research_mode": "team", "quality": "substantial", "quality_score": 0.85, "catalog_references": [], "prompt_length": 26129, "files_placed": 5, "status": "keep"}
{"timestamp": 1787231492.6214254, "experiment_id": "560d610e", "concept_title": "The finite-state class and its bound were constructed this cycle", "concept_domain": "Tropical", "research_mode": "team", "quality": "substantial", "quality_score": 0.82, "catalog_references": [], "prompt_length": 26060, "files_placed": 4, "status": "keep"}
{"timestamp": 1787234428.8682213, "experiment_id": "18b02a30", "concept_title": "C4.  A `q`-analogue of Kummer's theorem", "concept_domain": "NumberTheory", "research_mode": "team", "quality": "substantial", "quality_score": 0.88, "catalog_references": [], "prompt_length": 26621, "files_placed": 4, "status": "keep"}
{"timestamp": 1787234441.780125, "experiment_id": "5be71780", "concept_title": "reinforcement learning", "concept_domain": "Shared", "research_mode": "team", "quality": "substantial", "quality_score": 0.85, "catalog_references": [], "prompt_length": 27784, "files_placed": 4, "status": "keep"}
{"timestamp": 1787241011.4423351, "experiment_id": "69ffd40e", "concept_title": "The Lagrange engine `powerSum_rigidity` is already formalised and it isolates", "concept_domain": "Applications", "research_mode": "team", "quality": "substantial", "quality_score": 0.86, "catalog_references": [], "prompt_length": 26014, "files_placed": 4, "status": "keep"}
{"timestamp": 1787241022.4537437, "experiment_id": "d37c9a15", "concept_title": "reinforcement learning", "concept_domain": "MachineLearning", "research_mode": "team", "quality": "substantial", "quality_score": 0.85, "catalog_references": [], "prompt_length": 27802, "files_placed": 4, "status": "keep"}
{"timestamp": 1787244684.0242918, "experiment_id": "3b08d230", "concept_title": "is a finitely supported `a : ℕ → ℤ` with", "concept_domain": "Tropical", "research_mode": "team", "quality": "substantial", "quality_score": 0.86, "catalog_references": [], "prompt_length": 26000, "files_placed": 4, "status": "keep"}
{"timestamp": 1787247979.9235911, "experiment_id": "a0dce043", "concept_title": "Five bold, testable conjectures generated by this cycle's analysis of denominato", "concept_domain": "NumberTheory", "research_mode": "team", "quality": "substantial", "quality_score": 0.78, "catalog_references": [], "prompt_length": 35225, "files_placed": 4, "status": "keep"}
{"timestamp": 1787247990.7549477, "experiment_id": "ce273a18", "concept_title": "The upper bound is formalised (`exists_peel_stopping_time` together with", "concept_domain": "Geometry", "research_mode": "team", "quality": "substantial", "quality_score": 0.78, "catalog_references": [], "prompt_length": 25992, "files_placed": 4, "status": "keep"}
{"timestamp": 1787248000.791286, "experiment_id": "3ec7eb1a", "concept_title": "The Bonferroni machinery", "concept_domain": "Combinatorics", "research_mode": "team", "quality": "substantial", "quality_score": 0.76, "catalog_references": [], "prompt_length": 26015, "files_placed": 4, "status": "keep"}
{"timestamp": 1787252417.515078, "experiment_id": "fc85d14f", "concept_title": "The one-parameter case is already a theorem here", "concept_domain": "Shared", "research_mode": "team", "quality": "substantial", "quality_score": 0.82, "catalog_references": [], "prompt_length": 26089, "files_placed": 4, "status": "keep"}
{"timestamp": 1787255192.2183886, "experiment_id": "4494e9cb", "concept_title": "Rigidity gap for shallow product coins", "concept_domain": "Applications", "research_mode": "team", "quality": "partial", "quality_score": 0.664175, "catalog_references": [], "prompt_length": 22961, "files_placed": 4, "status": "keep"}
{"timestamp": 1787255203.9856899, "experiment_id": "254383ec", "concept_title": "All the machinery — honesty, guarding, bounded search, the", "concept_domain": "Cryptography", "research_mode": "team", "quality": "substantial", "quality_score": 0.78, "catalog_references": [], "prompt_length": 26018, "files_placed": 4, "status": "keep"}
{"timestamp": 1787262237.2331994, "experiment_id": "1a7b47b1", "concept_title": "**Conjecture.** For a generic family of `r` min-plus keys on `k` coordinates wit", "concept_domain": "Pythagorean", "research_mode": "team", "quality": "substantial", "quality_score": 0.82, "catalog_references": [], "prompt_length": 28792, "files_placed": 4, "status": "keep"}
{"timestamp": 1787269280.612154, "experiment_id": "f2707534", "concept_title": "Martingale-Concentration: Talagrand's Inequality on Product Spaces", "concept_domain": "Probability", "research_mode": "team", "quality": "substantial", "quality_score": 0.92, "catalog_references": [], "prompt_length": 26057, "files_placed": 4, "status": "keep"}
{"timestamp": 1787269291.2716482, "experiment_id": "63d0d6e2", "concept_title": "The low-tail experiment.", "concept_domain": "Physics", "research_mode": "team", "quality": "substantial", "quality_score": 0.82, "catalog_references": [], "prompt_length": 26195, "files_placed": 4, "status": "keep"}
{"timestamp": 1787269303.9137638, "experiment_id": "42f28947", "concept_title": "EML Neural Network Expressiveness: Depth vs Width", "concept_domain": "Applications", "research_mode": "team", "quality": "substantial", "quality_score": 0.85, "catalog_references": [], "prompt_length": 26236, "files_placed": 4, "status": "keep"}
{"timestamp": 1787282217.80723, "experiment_id": "6a8ae4e1", "concept_title": "For a graded `G`-set `Y = ⨆_n Y_n` the generating function `Σ_n t_r(Y_n) q^n` is a rational\nfunction of `q` whenever the grades are eventually `r`-transitive, with denominator dividing\n`(1−q)^{r+1}`.", "concept_domain": "Shared", "research_mode": "team", "quality": "substantial", "quality_score": 0.85, "catalog_references": [], "prompt_length": 26154, "files_placed": 4, "status": "keep"}
{"timestamp": 1787282229.3232336, "experiment_id": "39ef81fe", "concept_title": "Graph Coloring with Emotions: The Chromatic Polynomial Meets Psychology", "concept_domain": "Computation", "research_mode": "team", "quality": "substantial", "quality_score": 0.8, "catalog_references": [], "prompt_length": 27225, "files_placed": 4, "status": "keep"}
{"timestamp": 1787287503.6359031, "experiment_id": "eccb3315", "concept_title": "The Berggren Tree Zeta Function — Analytic Counting of Pythagorean Triples Governed by the Silver Ratio", "concept_domain": "Computation", "research_mode": "team", "quality": "substantial", "quality_score": 0.84, "catalog_references": [], "prompt_length": 28087, "files_placed": 5, "status": "keep"}
{"timestamp": 1787287519.9183214, "experiment_id": "21cbaba8", "concept_title": "Existence of δ-Dense Sets Avoiding Sumsets of Size ≥ (3+o(1)) log n / log(1/δ)", "concept_domain": "Bridges", "research_mode": "team", "quality": "substantial", "quality_score": 0.87, "catalog_references": ["Hernández and Hetzel 2026+growth", "Kra, Moreira, Richter, Robertson 2025"], "prompt_length": 26012, "files_placed": 4, "status": "keep"}
{"timestamp": 1787287531.5426862, "experiment_id": "5e41571a", "concept_title": "Firm nonexpansiveness of the median-as-projection is proved", "concept_domain": "Logic", "research_mode": "team", "quality": "substantial", "quality_score": 0.82, "catalog_references": [], "prompt_length": 25930, "files_placed": 4, "status": "keep"}
{"timestamp": 1787291331.6287165, "experiment_id": "3d7df1d3", "concept_title": "Higher-Dimensional Pythagorean Trees — Generalizing the Berggren Tree to Pythagorean Quadruples and Hyperspheres", "concept_domain": "Shared", "research_mode": "team", "quality": "substantial", "quality_score": 0.82, "catalog_references": [], "prompt_length": 28052, "files_placed": 6, "status": "keep"}
{"timestamp": 1787302740.87648, "experiment_id": "3026c1dd", "concept_title": "Higher-Dimensional Pythagorean Trees — Generalizing the Berggren Tree to Pythagorean Quadruples and Hyperspheres", "concept_domain": "Physics", "research_mode": "team", "quality": "substantial", "quality_score": 0.82, "catalog_references": [], "prompt_length": 28054, "files_placed": 4, "status": "keep"}
{"timestamp": 1787305983.9734352, "experiment_id": "1e89ff02", "concept_title": "p-adic Berggren Dynamics — The Tree of Pythagorean Triples as a p-adic Dynamical System", "concept_domain": "Geometry", "research_mode": "team", "quality": "substantial", "quality_score": 0.72, "catalog_references": [], "prompt_length": 27994, "files_placed": 4, "status": "keep"}
