{"timestamp": 1786898579.8332071, "experiment_id": "d4bd7c02", "concept_title": "NET-44: The Last Context-Extrapolation Cell Is Two-Seed and the Knee Fluctuates (k\\*=96 at (d=4, ctx=1024, s2) breaks the exact product law; two-seed bracket (64,128]; s1 chain's exactness was seed-lucky) \u2014 paper 88", "concept_domain": "Logic", "research_mode": "team", "quality": "substantial", "quality_score": 0.8, "catalog_references": [], "prompt_length": 29048, "files_placed": 4, "status": "keep"}
{"timestamp": 1786908835.699097, "experiment_id": "b3704634", "concept_title": "Teichmuller-Moduli: Analytic Structure of Riemann Surface Space", "concept_domain": "Geometry", "research_mode": "team", "quality": "substantial", "quality_score": 0.91, "catalog_references": [], "prompt_length": 26063, "files_placed": 4, "status": "keep"}
{"timestamp": 1786908846.816402, "experiment_id": "81aa12f0", "concept_title": "Emergent Spacetime from Quantum Entanglement", "concept_domain": "Novelty", "research_mode": "team", "quality": "substantial", "quality_score": 0.87, "catalog_references": [], "prompt_length": 26059, "files_placed": 4, "status": "keep"}
{"timestamp": 1786916092.076588, "experiment_id": "4f1ff831", "concept_title": "NET-46: THE-S2-ONE-GRID-STEP-DROP-REPLICATES-AT-16\u00d7-CONTEXT \u2014 k*=224 at (d=4, ctx=2048, seed=2), the NET-44 s2 break confirmed systematic", "concept_domain": "Logic", "research_mode": "team", "quality": "substantial", "quality_score": 0.82, "catalog_references": [], "prompt_length": 29231, "files_placed": 4, "status": "keep"}
{"timestamp": 1786916104.4816248, "experiment_id": "7a819734", "concept_title": "Fractal Number Theory: Hausdorff Dimension of Prime Distributions", "concept_domain": "NumberTheory", "research_mode": "team", "quality": "substantial", "quality_score": 0.86, "catalog_references": [], "prompt_length": 27445, "files_placed": 4, "status": "keep"}
{"timestamp": 1786919834.095183, "experiment_id": "39757711", "concept_title": "ArXiv paper: Cayley Graphs Of Order $pqrs$ Are Hamiltonian", "concept_domain": "Pythagorean", "research_mode": "team", "quality": "substantial", "quality_score": 0.84, "catalog_references": [], "prompt_length": 26275, "files_placed": 4, "status": "keep"}
{"timestamp": 1786923291.4810457, "experiment_id": "922db13f", "concept_title": "NET-47: The third seed at ctx=1024 reveals a SPREAD not a two-point set \u2014 k*=112 (mid-grid), the knee distribution is {96,112,128} (7/8-median law emerges)", "concept_domain": "NumberTheory", "research_mode": "team", "quality": "substantial", "quality_score": 0.82, "catalog_references": [], "prompt_length": 29941, "files_placed": 4, "status": "keep"}
{"timestamp": 1786931743.8264754, "experiment_id": "12195e06", "concept_title": "ArXiv paper: Kleber's conjecture and complementary products of symmetric functions", "concept_domain": "Algebra", "research_mode": "team", "quality": "substantial", "quality_score": 0.72, "catalog_references": [], "prompt_length": 26836, "files_placed": 4, "status": "keep"}
{"timestamp": 1786931757.7167583, "experiment_id": "6a0dc5c0", "concept_title": "NET-45: The s1 product chain survives at FIVE DOUBLINGS \u2014 k*=256 at (d=4, ctx=2048, s1) = d\u00b7ctx/32 EXACTLY at 16\u00d7 context (prediction confirmed, the longest context measured), at the tightest margin of the chain (+0.0013); selection dilutes with context (+1.7/+1.8); the ctx=2048 second seed becomes the sharpest open cell \u2014 paper 89", "concept_domain": "Logic", "research_mode": "team", "quality": "substantial", "quality_score": 0.82, "catalog_references": [], "prompt_length": 29072, "files_placed": 4, "status": "keep"}
{"timestamp": 1786936422.4147546, "experiment_id": "665c1eea", "concept_title": "Moonshot: Warp Drive Spacetime \u2014 Alcubierre Metric Formalization", "concept_domain": "Physics", "research_mode": "team", "quality": "substantial", "quality_score": 0.83, "catalog_references": [], "prompt_length": 26311, "files_placed": 4, "status": "keep"}
{"timestamp": 1786939402.3780344, "experiment_id": "86a70a4b", "concept_title": "The Anti-Fibonacci Sequence: Numbers That Avoid the Golden Ratio at All Costs", "concept_domain": "Computation", "research_mode": "team", "quality": "substantial", "quality_score": 0.88, "catalog_references": [], "prompt_length": 26837, "files_placed": 4, "status": "keep"}
{"timestamp": 1786939414.57846, "experiment_id": "094ca37a", "concept_title": "Hyper-Awareness: 11-Dimensional Perception Vectors in Synthetic Neural Nets", "concept_domain": "MachineLearning", "research_mode": "team", "quality": "substantial", "quality_score": 0.82, "catalog_references": [], "prompt_length": 25987, "files_placed": 4, "status": "keep"}
{"timestamp": 1786945855.393748, "experiment_id": "d71114d5", "concept_title": "NET-48: The direct test survives via the MEDIAN \u2014 k*=160 at (d=4, ctx=2048, seed=3), all four point-horns refuted, the completed 16\u00d7 distribution {160,224,256} has median exactly 224 = 7/8\u00b7(d\u00b7ctx/32) \u2014 the 7/8-median law is 2/2-context, 6/6-seed", "concept_domain": "Logic", "research_mode": "team", "quality": "substantial", "quality_score": 0.79, "catalog_references": [], "prompt_length": 30872, "files_placed": 4, "status": "keep"}
{"timestamp": 1786951020.125106, "experiment_id": "93afd30b", "concept_title": "Berggren-Spectral-Eigenvalues: Modular Energy Resonance for RSA Integer Factorization", "concept_domain": "Cryptography", "research_mode": "team", "quality": "substantial", "quality_score": 0.82, "catalog_references": [], "prompt_length": 26031, "files_placed": 4, "status": "keep"}
{"timestamp": 1786951031.7573113, "experiment_id": "0b339d93", "concept_title": "Bridge: Quantum Groups as Deformations of Classical Groups", "concept_domain": "Physics", "research_mode": "team", "quality": "substantial", "quality_score": 0.78, "catalog_references": [], "prompt_length": 26118, "files_placed": 4, "status": "keep"}
{"timestamp": 1786951042.2602642, "experiment_id": "507d1ef0", "concept_title": "ArXiv paper: A Fourier-analytic Uniqueness Theorem for Lattice-point Enumerators", "concept_domain": "Cryptography", "research_mode": "team", "quality": "substantial", "quality_score": 0.83, "catalog_references": [], "prompt_length": 26858, "files_placed": 4, "status": "keep"}
{"timestamp": 1786957305.047738, "experiment_id": "525aecde", "concept_title": "Fourier Analysis on Finite Groups", "concept_domain": "Shared", "research_mode": "prove", "quality": "substantial", "quality_score": 0.84, "catalog_references": [], "prompt_length": 26027, "files_placed": 4, "status": "keep"}
{"timestamp": 1786960676.9236546, "experiment_id": "615053e5", "concept_title": "Tangled Hierarchies: Proof Systems That Reference Their Own Soundness", "concept_domain": "Logic", "research_mode": "team", "quality": "substantial", "quality_score": 0.83, "catalog_references": [], "prompt_length": 26091, "files_placed": 4, "status": "keep"}
{"timestamp": 1786963744.9752572, "experiment_id": "8993bd64", "concept_title": "Compression Research B6: Compression \u2194 one-way functions (the cryptography link)", "concept_domain": "Shared", "research_mode": "team", "quality": "substantial", "quality_score": 0.81, "catalog_references": [], "prompt_length": 26799, "files_placed": 4, "status": "keep"}
{"timestamp": 1786974837.4315724, "experiment_id": "c8991a0a", "concept_title": "Topological-Algebraic Bridge: Fundamental Group as a Complete Invariant", "concept_domain": "Bridges", "research_mode": "team", "quality": "substantial", "quality_score": 0.88, "catalog_references": [], "prompt_length": 26076, "files_placed": 4, "status": "keep"}
{"timestamp": 1786974852.0081227, "experiment_id": "286b3a0e", "concept_title": "`Catalog/Novelty/MonsterMoonshineBridge.lean` proves a rigorous cross-domain bri", "concept_domain": "Bridges", "research_mode": "team", "quality": "substantial", "quality_score": 0.89, "catalog_references": [], "prompt_length": 30119, "files_placed": 4, "status": "keep"}
{"timestamp": 1786974862.6755471, "experiment_id": "2ce26220", "concept_title": "Derived from the current cycle's findings on Hardy\u2013Ramanujan taxicab numbers.", "concept_domain": "Geometry", "research_mode": "team", "quality": "substantial", "quality_score": 0.82, "catalog_references": [], "prompt_length": 29373, "files_placed": 4, "status": "keep"}
{"timestamp": 1786977926.9262416, "experiment_id": "c798c801", "concept_title": "Persistent Homology of Prime Numbers: The Topology of Arithmetic", "concept_domain": "Computation", "research_mode": "team", "quality": "substantial", "quality_score": 0.82, "catalog_references": [], "prompt_length": 27208, "files_placed": 4, "status": "keep"}
{"timestamp": 1786985168.8186445, "experiment_id": "7ee9f549", "concept_title": "Compression Research B5: PRNG-generated real-world data \u2014 detection and seed recovery", "concept_domain": "MachineLearning", "research_mode": "team", "quality": "substantial", "quality_score": 0.78, "catalog_references": [], "prompt_length": 26813, "files_placed": 4, "status": "keep"}
{"timestamp": 1786985182.8505027, "experiment_id": "e46e79a5", "concept_title": "OR-COLLAPSE-LAW: semiprime OR of a cyclic split-complete fork = g(n) = H((2n-1)/n^2) - (1/n)H(1/n) - ((n-1)/n)H(2/n) bits (round-19 #2, exp 407, v183, paper 72)", "concept_domain": "Applications", "research_mode": "team", "quality": "substantial", "quality_score": 0.86, "catalog_references": [], "prompt_length": 28474, "files_placed": 4, "status": "keep"}
{"timestamp": 1786993066.1329908, "experiment_id": "f262016d", "concept_title": "Compression Research B3: Almost-lossless / Monte Carlo compression", "concept_domain": "Applications", "research_mode": "team", "quality": "substantial", "quality_score": 0.85, "catalog_references": [], "prompt_length": 26785, "files_placed": 4, "status": "keep"}
{"timestamp": 1786995775.149621, "experiment_id": "7199d5c0", "concept_title": "Compression Research A1: Price of universality \u2014 minimax redundancy of universal decompressors", "concept_domain": "MachineLearning", "research_mode": "team", "quality": "substantial", "quality_score": 0.82, "catalog_references": [], "prompt_length": 26905, "files_placed": 4, "status": "keep"}
{"timestamp": 1786999482.2398233, "experiment_id": "97b1c345", "concept_title": "NET-48: The direct test survives via the MEDIAN \u2014 k*=160 at (d=4, ctx=2048, seed=3), all four point-horns refuted, the completed 16\u00d7 distribution {160,224,256} has median exactly 224 = 7/8\u00b7(d\u00b7ctx/32) \u2014 the 7/8-median law is 2/2-context, 6/6-seed", "concept_domain": "Probability", "research_mode": "team", "quality": "substantial", "quality_score": 0.92, "catalog_references": [], "prompt_length": 30884, "files_placed": 5, "status": "keep"}
{"timestamp": 1786999494.6172726, "experiment_id": "2e6124e7", "concept_title": "The inequality itself is proved", "concept_domain": "Physics", "research_mode": "team", "quality": "substantial", "quality_score": 0.88, "catalog_references": [], "prompt_length": 26006, "files_placed": 4, "status": "keep"}
{"timestamp": 1787006478.396681, "experiment_id": "921a0e7b", "concept_title": "It would upgrade \"the cost of internal soundness is one loop\"", "concept_domain": "Computation", "research_mode": "team", "quality": "substantial", "quality_score": 0.83, "catalog_references": [], "prompt_length": 26158, "files_placed": 4, "status": "keep"}
{"timestamp": 1787009827.108138, "experiment_id": "33519cdb", "concept_title": "Open here; the multiplicative bound `|supp f| \u00b7 |supp f\u0302| \u2265 p` is proved", "concept_domain": "MachineLearning", "research_mode": "team", "quality": "substantial", "quality_score": 0.78, "catalog_references": [], "prompt_length": 26072, "files_placed": 4, "status": "keep"}
{"timestamp": 1787017895.1447372, "experiment_id": "0cf95d8d", "concept_title": "Sharpness", "concept_domain": "Probability", "research_mode": "team", "quality": "substantial", "quality_score": 0.88, "catalog_references": [], "prompt_length": 26059, "files_placed": 4, "status": "keep"}
{"timestamp": 1787022533.746193, "experiment_id": "11c9ff9f", "concept_title": "Fibre spectrum (Conjecture E, first half, closed)", "concept_domain": "Logic", "research_mode": "team", "quality": "substantial", "quality_score": 0.86, "catalog_references": [], "prompt_length": 26084, "files_placed": 4, "status": "keep"}
{"timestamp": 1787022546.0310109, "experiment_id": "be7c0bd7", "concept_title": "Compression Research B3: Almost-lossless / Monte Carlo compression", "concept_domain": "Geometry", "research_mode": "team", "quality": "substantial", "quality_score": 0.82, "catalog_references": [], "prompt_length": 26777, "files_placed": 4, "status": "keep"}
{"timestamp": 1787025525.2660294, "experiment_id": "856336cf", "concept_title": "Kernel patterns", "concept_domain": "Pythagorean", "research_mode": "team", "quality": "substantial", "quality_score": 0.88, "catalog_references": [], "prompt_length": 25930, "files_placed": 6, "status": "keep"}
{"timestamp": 1787028759.896786, "experiment_id": "ae5d2ae6", "concept_title": "Compression Research A1: Price of universality \u2014 minimax redundancy of universal decompressors", "concept_domain": "Novelty", "research_mode": "team", "quality": "substantial", "quality_score": 0.87, "catalog_references": [], "prompt_length": 26889, "files_placed": 6, "status": "keep"}
{"timestamp": 1787031958.3810482, "experiment_id": "6ba84571", "concept_title": "NET-48: The direct test survives via the MEDIAN \u2014 k*=160 at (d=4, ctx=2048, seed=3), all four point-horns refuted, the completed 16\u00d7 distribution {160,224,256} has median exactly 224 = 7/8\u00b7(d\u00b7ctx/32) \u2014 the 7/8-median law is 2/2-context, 6/6-seed", "concept_domain": "Tropical", "research_mode": "team", "quality": "substantial", "quality_score": 0.85, "catalog_references": [], "prompt_length": 30878, "files_placed": 4, "status": "keep"}
{"timestamp": 1787031970.5832002, "experiment_id": "4bf66c09", "concept_title": "Chebotarev's theorem that every square submatrix of the `p \u00d7 p` DFT matrix", "concept_domain": "Novelty", "research_mode": "team", "quality": "substantial", "quality_score": 0.88, "catalog_references": [], "prompt_length": 26158, "files_placed": 4, "status": "keep"}
{"timestamp": 1787031981.6164742, "experiment_id": "e8a76d4f", "concept_title": "Compression Research B6: Compression \u2194 one-way functions (the cryptography link)", "concept_domain": "Novelty", "research_mode": "team", "quality": "substantial", "quality_score": 0.78, "catalog_references": [], "prompt_length": 26801, "files_placed": 4, "status": "keep"}
{"timestamp": 1787039695.8380105, "experiment_id": "cf8480d3", "concept_title": "Rigidity", "concept_domain": "Novelty", "research_mode": "team", "quality": "substantial", "quality_score": 0.85, "catalog_references": [], "prompt_length": 25917, "files_placed": 4, "status": "keep"}
{"timestamp": 1787039708.7553563, "experiment_id": "a5150a29", "concept_title": "The formal results in `Catalog/Tropical/JacobiSigned*.lean` settle the JACSIGN", "concept_domain": "Pythagorean", "research_mode": "team", "quality": "substantial", "quality_score": 0.82, "catalog_references": [], "prompt_length": 31006, "files_placed": 4, "status": "keep"}
{"timestamp": 1787043278.9747887, "experiment_id": "9aa1e8d1", "concept_title": "Bridge-NumberTheory-ML: Arithmetic Geometry of Transformer Weight Lattices", "concept_domain": "Bridges", "research_mode": "team", "quality": "substantial", "quality_score": 0.86, "catalog_references": [], "prompt_length": 25961, "files_placed": 4, "status": "keep"}
{"timestamp": 1787046573.6626816, "experiment_id": "5297c534", "concept_title": "The `\u21d0` direction is proved (`FourierFA.uncertainty_eq_coset_modulation`); the `\u21d2`", "concept_domain": "Novelty", "research_mode": "team", "quality": "substantial", "quality_score": 0.86, "catalog_references": [], "prompt_length": 25959, "files_placed": 4, "status": "keep"}
{"timestamp": 1787050028.9169338, "experiment_id": "c4b3dd3f", "concept_title": "Conjecture A, closed", "concept_domain": "Logic", "research_mode": "team", "quality": "substantial", "quality_score": 0.86, "catalog_references": [], "prompt_length": 26088, "files_placed": 4, "status": "keep"}
{"timestamp": 1787058496.6953018, "experiment_id": "23eee1e8", "concept_title": "Compression Research B5: PRNG-generated real-world data \u2014 detection and seed recovery", "concept_domain": "Probability", "research_mode": "team", "quality": "substantial", "quality_score": 0.87, "catalog_references": [], "prompt_length": 26805, "files_placed": 4, "status": "keep"}
{"timestamp": 1787058507.246978, "experiment_id": "ed687362", "concept_title": "ArXiv paper: Edge-decomposition into Two Triangular Forests is NP-complete", "concept_domain": "Logic", "research_mode": "team", "quality": "substantial", "quality_score": 0.72, "catalog_references": [], "prompt_length": 26959, "files_placed": 4, "status": "keep"}
{"timestamp": 1787061474.462236, "experiment_id": "3eeb9235", "concept_title": "Compression Research A1: Price of universality \u2014 minimax redundancy of universal decompressors", "concept_domain": "Logic", "research_mode": "team", "quality": "substantial", "quality_score": 0.84, "catalog_references": [], "prompt_length": 26885, "files_placed": 4, "status": "keep"}
{"timestamp": 1787068032.678691, "experiment_id": "13fee392", "concept_title": "The Bonferroni machinery", "concept_domain": "MachineLearning", "research_mode": "team", "quality": "substantial", "quality_score": 0.82, "catalog_references": [], "prompt_length": 26019, "files_placed": 4, "status": "keep"}
{"timestamp": 1787068045.1951084, "experiment_id": "2afe0ce6", "concept_title": "For every finite action the spectrum is log-concave: `t_r\u00b2 \u2265 t_{r\u22121}\u00b7t_{r+1}` for\n`1 \u2264 r < |X|`.", "concept_domain": "Applications", "research_mode": "team", "quality": "substantial", "quality_score": 0.82, "catalog_references": [], "prompt_length": 25960, "files_placed": 4, "status": "keep"}
{"timestamp": 1787075015.0781536, "experiment_id": "5792b548", "concept_title": "Sharpness", "concept_domain": "Shared", "research_mode": "team", "quality": "substantial", "quality_score": 0.88, "catalog_references": [], "prompt_length": 26049, "files_placed": 4, "status": "keep"}
{"timestamp": 1787079455.9736013, "experiment_id": "ef01dce6", "concept_title": "Compression Research B3: Almost-lossless / Monte Carlo compression", "concept_domain": "Bridges", "research_mode": "team", "quality": "substantial", "quality_score": 0.88, "catalog_references": [], "prompt_length": 26775, "files_placed": 4, "status": "keep"}
{"timestamp": 1787079467.4807868, "experiment_id": "09567e3d", "concept_title": "The `d = 1` case is proved (`withParity_detects_single_flip` plus the", "concept_domain": "Computation", "research_mode": "team", "quality": "substantial", "quality_score": 0.89, "catalog_references": [], "prompt_length": 26022, "files_placed": 5, "status": "keep"}
{"timestamp": 1787082078.9755888, "experiment_id": "bba7fa1e", "concept_title": "Compression Research A1: Price of universality \u2014 minimax redundancy of universal decompressors", "concept_domain": "NumberTheory", "research_mode": "team", "quality": "substantial", "quality_score": 0.84, "catalog_references": [], "prompt_length": 26899, "files_placed": 5, "status": "keep"}
{"timestamp": 1787089099.5440726, "experiment_id": "4f724156", "concept_title": "Conjecture C, closed", "concept_domain": "Probability", "research_mode": "team", "quality": "substantial", "quality_score": 0.82, "catalog_references": [], "prompt_length": 26072, "files_placed": 5, "status": "keep"}
{"timestamp": 1787089111.0131872, "experiment_id": "16c8a71d", "concept_title": "Aggregate dichotomy", "concept_domain": "Pythagorean", "research_mode": "team", "quality": "substantial", "quality_score": 0.82, "catalog_references": [], "prompt_length": 25892, "files_placed": 5, "status": "keep"}
{"timestamp": 1787089123.207962, "experiment_id": "24a12580", "concept_title": "Compression Research B5: PRNG-generated real-world data \u2014 detection and seed recovery", "concept_domain": "Pythagorean", "research_mode": "team", "quality": "substantial", "quality_score": 0.82, "catalog_references": [], "prompt_length": 26805, "files_placed": 4, "status": "keep"}
{"timestamp": 1787092963.1989717, "experiment_id": "fbb9718e", "concept_title": "The case `m = 3`, `F = x\u00b2 + y\u00b2 - z\u00b2` is fully proved", "concept_domain": "Pythagorean", "research_mode": "team", "quality": "substantial", "quality_score": 0.82, "catalog_references": [], "prompt_length": 26229, "files_placed": 4, "status": "keep"}
{"timestamp": 1787096177.63669, "experiment_id": "af68ac83", "concept_title": "~~`minimal_near_miss_size`~~ \u2014 RESOLVED in cycle 3: among all near-miss pairs at level\n   `N \u2265 1` the binomial pair also minimises the cardinality, the minimum being `2^{N-1}`\n   (`two_pow_le_two_mul_", "concept_domain": "Applications", "research_mode": "team", "quality": "substantial", "quality_score": 0.87, "catalog_references": [], "prompt_length": 26320, "files_placed": 4, "status": "keep"}
{"timestamp": 1787096189.4450078, "experiment_id": "aa4eb9d3", "concept_title": "Both endpoints of the trade-off are now formal theorems in this", "concept_domain": "Tropical", "research_mode": "team", "quality": "substantial", "quality_score": 0.86, "catalog_references": [], "prompt_length": 26051, "files_placed": 4, "status": "keep"}
{"timestamp": 1787104423.8951094, "experiment_id": "512ab986", "concept_title": "Compression Research B3: Almost-lossless / Monte Carlo compression", "concept_domain": "Logic", "research_mode": "team", "quality": "substantial", "quality_score": 0.85, "catalog_references": [], "prompt_length": 26771, "files_placed": 4, "status": "keep"}
