{"timestamp": 1784580515.6064086, "experiment_id": "1a27f9f3", "concept_title": "The Fractal Dimension of Mathematical Truth", "concept_domain": "Combinatorics", "research_mode": "team", "quality": "substantial", "quality_score": 0.7, "catalog_references": [], "prompt_length": 23817, "files_placed": 4, "status": "keep"}
{"timestamp": 1784580521.026397, "experiment_id": "bb72d587", "concept_title": "Speculative: Computational Complexity as Physical Law", "concept_domain": "NumberTheory", "research_mode": "team", "quality": "substantial", "quality_score": 0.76, "catalog_references": [], "prompt_length": 22579, "files_placed": 4, "status": "keep"}
{"timestamp": 1784586332.6047833, "experiment_id": "f2b328a7", "concept_title": "Speculative: Mathematics as an Evolving Ecosystem", "concept_domain": "Bridges", "research_mode": "team", "quality": "partial", "quality_score": 0.64, "catalog_references": [], "prompt_length": 3791, "files_placed": 18, "status": "keep"}
{"timestamp": 1784589740.993405, "experiment_id": "fc320765", "concept_title": "Speculative: Topological Quantum Error Correction from Mathematical Structures", "concept_domain": "Probability", "research_mode": "team", "quality": "partial", "quality_score": 0.69, "catalog_references": [], "prompt_length": 3712, "files_placed": 5, "status": "keep"}
{"timestamp": 1784589747.3335273, "experiment_id": "3d25b5ad", "concept_title": "Causal Loops in Category Theory: When Composition Loops Back", "concept_domain": "Pythagorean", "research_mode": "team", "quality": "substantial", "quality_score": 0.7, "catalog_references": [], "prompt_length": 23292, "files_placed": 4, "status": "keep"}
{"timestamp": 1784589751.4807043, "experiment_id": "82c8c57a", "concept_title": "Close Proofs: The Mega-Sphere: All Dimensions at Once", "concept_domain": "NumberTheory", "research_mode": "team", "quality": "substantial", "quality_score": 0.71, "catalog_references": [], "prompt_length": 21111, "files_placed": 5, "status": "keep"}
{"timestamp": 1784593184.496312, "experiment_id": "fbb9076c", "concept_title": "Thermodynamics of Mathematical Proof", "concept_domain": "Logic", "research_mode": "team", "quality": "substantial", "quality_score": 0.72, "catalog_references": [], "prompt_length": 24284, "files_placed": 18, "status": "keep"}
{"timestamp": 1784605975.6000607, "experiment_id": "3df39c71", "concept_title": "ArXiv paper: On Agreement Subtrees in Multiple Pylogenetic Trees", "concept_domain": "Novelty", "research_mode": "team", "quality": "substantial", "quality_score": 0.72, "catalog_references": [], "prompt_length": 24728, "files_placed": 5, "status": "keep"}
{"timestamp": 1784616574.3428047, "experiment_id": "7fb32c18", "concept_title": "Speculative: Category Theory as the DNA of Mathematics", "concept_domain": "Logic", "research_mode": "team", "quality": "partial", "quality_score": 0.65, "catalog_references": [], "prompt_length": 3856, "files_placed": 18, "status": "keep"}
{"timestamp": 1784616581.1163223, "experiment_id": "cd0075c8", "concept_title": "Speculative: Consciousness as Fixed Points of Recursive Type Theory", "concept_domain": "Computation", "research_mode": "team", "quality": "substantial", "quality_score": 0.75, "catalog_references": [], "prompt_length": 24457, "files_placed": 16, "status": "keep"}
{"timestamp": 1784616585.6152086, "experiment_id": "d5fe8eb3", "concept_title": "Zombies and Qualia: Mathematics of Subjective Experience", "concept_domain": "Geometry", "research_mode": "team", "quality": "substantial", "quality_score": 0.72, "catalog_references": [], "prompt_length": 24319, "files_placed": 5, "status": "keep"}
{"timestamp": 1784627305.4876158, "experiment_id": "1a2d7e50", "concept_title": "Speculative: Proof Complexity and Thermodynamic Cost", "concept_domain": "Tropical", "research_mode": "team", "quality": "partial", "quality_score": 0.69, "catalog_references": [], "prompt_length": 3771, "files_placed": 2, "status": "keep"}
{"timestamp": 1784627310.557344, "experiment_id": "c4a6ce21", "concept_title": "Thermodynamics of Mathematical Proof", "concept_domain": "Algebra", "research_mode": "team", "quality": "partial", "quality_score": 0.65, "catalog_references": [], "prompt_length": 3569, "files_placed": 7, "status": "keep"}
{"timestamp": 1784635717.846446, "experiment_id": "1f9eb531", "concept_title": "Speculative: The Universe Computes Its Own Existence (Physics = Computation)", "concept_domain": "Geometry", "research_mode": "team", "quality": "substantial", "quality_score": 0.71, "catalog_references": [], "prompt_length": 23783, "files_placed": 15, "status": "keep"}
{"timestamp": 1784644279.8972418, "experiment_id": "91cdf1e0", "concept_title": "Speculative: The Lean Theorem Prover as an Ecological Niche", "concept_domain": "Combinatorics", "research_mode": "team", "quality": "partial", "quality_score": 0.69, "catalog_references": [], "prompt_length": 11575, "files_placed": 17, "status": "keep"}
{"timestamp": 1784644287.1002831, "experiment_id": "fee59e0b", "concept_title": "Speculative: Ramanujan-Style Intuition as Formalizable Meta-Reasoning", "concept_domain": "Cryptography", "research_mode": "team", "quality": "partial", "quality_score": 0.69, "catalog_references": [], "prompt_length": 3859, "files_placed": 2, "status": "keep"}
{"timestamp": 1784644300.4352236, "experiment_id": "95b84694", "concept_title": "Speculative: Anti-Gravity Mathematics \u2014 Theorems That Resist Proof", "concept_domain": "Bridges", "research_mode": "team", "quality": "substantial", "quality_score": 0.7, "catalog_references": [], "prompt_length": 23102, "files_placed": 5, "status": "keep"}
{"timestamp": 1784644305.5262244, "experiment_id": "977e8d8d", "concept_title": "Speculative: Topological Data Analysis of Theorem Networks", "concept_domain": "Cryptography", "research_mode": "team", "quality": "substantial", "quality_score": 0.74, "catalog_references": [], "prompt_length": 23034, "files_placed": 4, "status": "keep"}
{"timestamp": 1784652602.1242132, "experiment_id": "2fdbedee", "concept_title": "Speculative: Theorems as Phase Transitions in Proof Space", "concept_domain": "Shared", "research_mode": "team", "quality": "substantial", "quality_score": 0.75, "catalog_references": [], "prompt_length": 24429, "files_placed": 4, "status": "keep"}
{"timestamp": 1784659678.9255605, "experiment_id": "279ae676", "concept_title": "Rucker: Infinity and the Mind \u2014 Formalizing Different Sizes of Infinity", "concept_domain": "MachineLearning", "research_mode": "team", "quality": "substantial", "quality_score": 0.76, "catalog_references": [], "prompt_length": 22785, "files_placed": 4, "status": "keep"}
{"timestamp": 1784659683.3756394, "experiment_id": "0268a2b5", "concept_title": "Rucker: The Fourth Dimension as a Mathematical Playground", "concept_domain": "Shared", "research_mode": "team", "quality": "substantial", "quality_score": 0.79, "catalog_references": [], "prompt_length": 24360, "files_placed": 4, "status": "keep"}
{"timestamp": 1784666723.3889108, "experiment_id": "bf4ad478", "concept_title": "ArXiv paper: A Census of New Snake-in-the-Box Records", "concept_domain": "Probability", "research_mode": "team", "quality": "partial", "quality_score": 0.66, "catalog_references": [], "prompt_length": 10724, "files_placed": 18, "status": "keep"}
{"timestamp": 1784666760.5847101, "experiment_id": "f3a76d9a", "concept_title": "Rucker: Mind Tools \u2014 Mathematics as Cognitive Extension", "concept_domain": "Geometry", "research_mode": "team", "quality": "partial", "quality_score": 0.67, "catalog_references": [], "prompt_length": 4132, "files_placed": 2, "status": "keep"}
{"timestamp": 1784666771.0455985, "experiment_id": "9d505535", "concept_title": "Speculative: Tropical Mathematics of Social Choice", "concept_domain": "Algebra", "research_mode": "team", "quality": "substantial", "quality_score": 0.75, "catalog_references": [], "prompt_length": 24477, "files_placed": 8, "status": "keep"}
{"timestamp": 1784672350.7883868, "experiment_id": "ea115bd0", "concept_title": "Speculative: Number Theory as Music Theory", "concept_domain": "Computation", "research_mode": "team", "quality": "substantial", "quality_score": 0.7, "catalog_references": [], "prompt_length": 17274, "files_placed": 5, "status": "keep"}
{"timestamp": 1784672359.5177824, "experiment_id": "a4c98532", "concept_title": "Hofstadter: G\u00f6del, Escher, Bach \u2014 Isomorphism Across Domains", "concept_domain": "Geometry", "research_mode": "team", "quality": "substantial", "quality_score": 0.76, "catalog_references": [], "prompt_length": 24487, "files_placed": 4, "status": "keep"}
{"timestamp": 1784679264.3596275, "experiment_id": "decbe545", "concept_title": "ArXiv paper: Efficient Hamilton covers and linear arboricity of random graphs", "concept_domain": "Computation", "research_mode": "team", "quality": "partial", "quality_score": 0.64, "catalog_references": [], "prompt_length": 12424, "files_placed": 12, "status": "keep"}
{"timestamp": 1784679270.0254226, "experiment_id": "759f53fa", "concept_title": "Hofstadter: Fluid Concepts and Creative Analogies \u2014 Analogy as a Mathematical Operation", "concept_domain": "Combinatorics", "research_mode": "team", "quality": "partial", "quality_score": 0.66, "catalog_references": [], "prompt_length": 4189, "files_placed": 12, "status": "keep"}
{"timestamp": 1784679275.8578613, "experiment_id": "11a0fcb2", "concept_title": "Rucker: Spacetime Donuts \u2014 Topology of the Universe", "concept_domain": "Logic", "research_mode": "team", "quality": "substantial", "quality_score": 0.74, "catalog_references": [], "prompt_length": 24390, "files_placed": 4, "status": "keep"}
{"timestamp": 1784679280.2516258, "experiment_id": "b31f2cf9", "concept_title": "Hofstadter: Strange Loops in Formal Systems \u2014 Self-Reference as a Theorem", "concept_domain": "Logic", "research_mode": "team", "quality": "substantial", "quality_score": 0.83, "catalog_references": [], "prompt_length": 24609, "files_placed": 4, "status": "keep"}
{"timestamp": 1784687462.165154, "experiment_id": "4d85ad7f", "concept_title": "Moonshot: Warp Drive Spacetime \u2014 Alcubierre Metric Formalization", "concept_domain": "MachineLearning", "research_mode": "team", "quality": "substantial", "quality_score": 0.74, "catalog_references": [], "prompt_length": 23775, "files_placed": 4, "status": "keep"}
{"timestamp": 1784692447.596382, "experiment_id": "4bc3344b", "concept_title": "Hofstadter: I Am a Strange Loop \u2014 Consciousness as Self-Reference", "concept_domain": "MachineLearning", "research_mode": "team", "quality": "substantial", "quality_score": 0.72, "catalog_references": [], "prompt_length": 24669, "files_placed": 4, "status": "keep"}
{"timestamp": 1784695722.0718992, "experiment_id": "09546bb0", "concept_title": "Rucker: Saucer Wisdom \u2014 Non-Human Mathematical Intuition", "concept_domain": "Tropical", "research_mode": "team", "quality": "substantial", "quality_score": 0.74, "catalog_references": [], "prompt_length": 22670, "files_placed": 4, "status": "keep"}
{"timestamp": 1784695726.597614, "experiment_id": "ea214ad9", "concept_title": "Rucker: The Lifebox \u2014 Information-Theoretic Identity", "concept_domain": "Applications", "research_mode": "team", "quality": "substantial", "quality_score": 0.75, "catalog_references": [], "prompt_length": 24523, "files_placed": 4, "status": "keep"}
{"timestamp": 1784695731.2213166, "experiment_id": "939843de", "concept_title": "ArXiv paper: Lattice slices, Ehrhart polynomials, and magic positivity of generalized parking-function polytopes", "concept_domain": "Cryptography", "research_mode": "team", "quality": "substantial", "quality_score": 0.71, "catalog_references": [], "prompt_length": 24856, "files_placed": 4, "status": "keep"}
{"timestamp": 1784703281.0335388, "experiment_id": "47ca7342", "concept_title": "Moonshot: Nanotechnology Computation \u2014 Molecular Computing Limits", "concept_domain": "Bridges", "research_mode": "team", "quality": "partial", "quality_score": 0.65, "catalog_references": [], "prompt_length": 4347, "files_placed": 2, "status": "keep"}
{"timestamp": 1784703285.9644194, "experiment_id": "2a77d2cb", "concept_title": "ArXiv paper: A decomposition of Weyl group multiple Dirichlet series for symmetrizable Kac-Moody root systems", "concept_domain": "Geometry", "research_mode": "team", "quality": "partial", "quality_score": 0.66, "catalog_references": [], "prompt_length": 12948, "files_placed": 2, "status": "keep"}
{"timestamp": 1784713580.1165106, "experiment_id": "3e9a9a06", "concept_title": "Moonshot: Multiverse Set Theory \u2014 Mathematics Across Branches", "concept_domain": "Applications", "research_mode": "team", "quality": "partial", "quality_score": 0.69, "catalog_references": [], "prompt_length": 10921, "files_placed": 4, "status": "keep"}
{"timestamp": 1784713589.9427502, "experiment_id": "e24b36f0", "concept_title": "Moonshot: Alien Number Systems \u2014 Mathematics Beyond Base-10", "concept_domain": "NumberTheory", "research_mode": "team", "quality": "substantial", "quality_score": 0.84, "catalog_references": [], "prompt_length": 25191, "files_placed": 4, "status": "keep"}
{"timestamp": 1784713594.6313396, "experiment_id": "3511fbf3", "concept_title": "Hofstadter: Tangled Hierarchies in Type Theory", "concept_domain": "Computation", "research_mode": "team", "quality": "substantial", "quality_score": 0.73, "catalog_references": [], "prompt_length": 25281, "files_placed": 4, "status": "keep"}
{"timestamp": 1784722435.2725031, "experiment_id": "3dce6722", "concept_title": "Moonshot: Dyson Sphere Mathematics \u2014 Energy Collection Optimization", "concept_domain": "Applications", "research_mode": "team", "quality": "substantial", "quality_score": 0.77, "catalog_references": [], "prompt_length": 25264, "files_placed": 4, "status": "keep"}
{"timestamp": 1784730605.138922, "experiment_id": "227d6015", "concept_title": "Moonshot: The Mathematics of Dyson's Intelligence Explosion", "concept_domain": "NumberTheory", "research_mode": "team", "quality": "substantial", "quality_score": 0.75, "catalog_references": [], "prompt_length": 22493, "files_placed": 4, "status": "keep"}
{"timestamp": 1784739261.6293592, "experiment_id": "0a1b5635", "concept_title": "Close Proofs: Non-Desarguesian Worlds: Geometry Without Desargues", "concept_domain": "Shared", "research_mode": "team", "quality": "partial", "quality_score": 0.64, "catalog_references": [], "prompt_length": 3718, "files_placed": 3, "status": "keep"}
{"timestamp": 1784739273.2901254, "experiment_id": "24111e1f", "concept_title": "Moonshot: The Last Theorem \u2014 Formalizing the Heat Death of Mathematics", "concept_domain": "Novelty", "research_mode": "team", "quality": "substantial", "quality_score": 0.7, "catalog_references": [], "prompt_length": 24880, "files_placed": 4, "status": "keep"}
{"timestamp": 1784745731.6648893, "experiment_id": "43fa6482", "concept_title": "**Conjecture.** Let a family of decision procedures on inputs of length `n` irre", "concept_domain": "Applications", "research_mode": "team", "quality": "substantial", "quality_score": 0.77, "catalog_references": [], "prompt_length": 25061, "files_placed": 4, "status": "keep"}
{"timestamp": 1784745735.980449, "experiment_id": "c612ec41", "concept_title": "For any family of local stabilizer codes admitting a geometric realization, conj", "concept_domain": "Cryptography", "research_mode": "team", "quality": "substantial", "quality_score": 0.7, "catalog_references": [], "prompt_length": 26129, "files_placed": 4, "status": "keep"}
{"timestamp": 1784745741.5306823, "experiment_id": "699db10f", "concept_title": "ArXiv paper: A few remarks on the Baez-Duarte Criterion", "concept_domain": "Computation", "research_mode": "team", "quality": "substantial", "quality_score": 0.7, "catalog_references": [], "prompt_length": 24488, "files_placed": 4, "status": "keep"}
{"timestamp": 1784745747.9321125, "experiment_id": "5d6a1919", "concept_title": "1. **Repair the definition before studying asymptotics.** The literal rule exclu", "concept_domain": "Novelty", "research_mode": "team", "quality": "substantial", "quality_score": 0.76, "catalog_references": [], "prompt_length": 24180, "files_placed": 4, "status": "keep"}
{"timestamp": 1784752765.5957, "experiment_id": "f65064a1", "concept_title": "ArXiv paper: Counting Odd Cycles in Graphs with Bounded Circumference", "concept_domain": "Physics", "research_mode": "team", "quality": "partial", "quality_score": 0.69, "catalog_references": [], "prompt_length": 11750, "files_placed": 2, "status": "keep"}
{"timestamp": 1784759098.4268122, "experiment_id": "1efa5ae1", "concept_title": "ArXiv paper: Spectral extremal problems on planar and outerplanar graphs without $C_{k,l}", "concept_domain": "Bridges", "research_mode": "team", "quality": "partial", "quality_score": 0.61, "catalog_references": [], "prompt_length": 12022, "files_placed": 2, "status": "keep"}
{"timestamp": 1784762638.4663718, "experiment_id": "6622cac1", "concept_title": "Moonshot: Brain-Computer Interface Mathematics \u2014 Neural Coding Theorems", "concept_domain": "Novelty", "research_mode": "team", "quality": "partial", "quality_score": 0.69, "catalog_references": [], "prompt_length": 4291, "files_placed": 2, "status": "keep"}
{"timestamp": 1784832355.244018, "experiment_id": "642478f0", "concept_title": "Conjecture: there are natural state spaces in which functional observation forms", "concept_domain": "Probability", "research_mode": "team", "quality": "substantial", "quality_score": 0.77, "catalog_references": [], "prompt_length": 22522, "files_placed": 4, "status": "keep"}
{"timestamp": 1784832360.546319, "experiment_id": "f14d2570", "concept_title": "ArXiv paper: Online Beck--Fiala Down to Logarithmic Sparsity", "concept_domain": "Novelty", "research_mode": "team", "quality": "partial", "quality_score": 0.55, "catalog_references": [], "prompt_length": 5163, "files_placed": 2, "status": "keep"}
{"timestamp": 1784832364.8928115, "experiment_id": "ddd2821f", "concept_title": "Deepening: 1. **Repair the definition before studying asymptotics.** The literal rule exclu", "concept_domain": "Logic", "research_mode": "team", "quality": "substantial", "quality_score": 0.77, "catalog_references": [], "prompt_length": 23505, "files_placed": 4, "status": "keep"}
{"timestamp": 1784832367.9529335, "experiment_id": "2f329d75", "concept_title": "The motivating fixed-length claim was **disproved**, not proved. With a finite a", "concept_domain": "Bridges", "research_mode": "team", "quality": "substantial", "quality_score": 0.73, "catalog_references": [], "prompt_length": 28309, "files_placed": 4, "status": "keep"}
{"timestamp": 1784838522.5802965, "experiment_id": "07e03295", "concept_title": "ArXiv paper: On Matrix Product Factorization in Association Schemes", "concept_domain": "Physics", "research_mode": "team", "quality": "substantial", "quality_score": 0.7, "catalog_references": [], "prompt_length": 24589, "files_placed": 4, "status": "keep"}
{"timestamp": 1784845084.0758815, "experiment_id": "ec11492d", "concept_title": "This development formalizes the finite coordinate core of Curtin's *Generalizati", "concept_domain": "Cryptography", "research_mode": "team", "quality": "partial", "quality_score": 0.68, "catalog_references": [], "prompt_length": 14218, "files_placed": 2, "status": "keep"}
{"timestamp": 1784845088.9443526, "experiment_id": "6c18f01c", "concept_title": "The conjectures below are ranked by expected scientific impact. Each proposal se", "concept_domain": "MachineLearning", "research_mode": "team", "quality": "substantial", "quality_score": 0.77, "catalog_references": [], "prompt_length": 28889, "files_placed": 6, "status": "keep"}
{"timestamp": 1784848340.296343, "experiment_id": "abab9083", "concept_title": "Moonshot: Quantum Consciousness \u2014 Penrose-Hameroff Orchestrated Reduction", "concept_domain": "Logic", "research_mode": "team", "quality": "partial", "quality_score": 0.53, "catalog_references": [], "prompt_length": 4241, "files_placed": 2, "status": "keep"}
{"timestamp": 1784848345.831901, "experiment_id": "2c3f15cd", "concept_title": "1. **Replace discrete carriers by actual categories.** Define an analogy from fu", "concept_domain": "Pythagorean", "research_mode": "team", "quality": "partial", "quality_score": 0.55, "catalog_references": [], "prompt_length": 14522, "files_placed": 2, "status": "keep"}
{"timestamp": 1784850729.2401073, "experiment_id": "274c401c", "concept_title": "**Conjecture.** For a chordal interference graph with nonnegative vertex spill c", "concept_domain": "Pythagorean", "research_mode": "team", "quality": "partial", "quality_score": 0.55, "catalog_references": [], "prompt_length": 17017, "files_placed": 2, "status": "keep"}
{"timestamp": 1784850734.6879103, "experiment_id": "6c3aaf50", "concept_title": "1. **Internal Cartesian-closed formulation.** Generalize the type-level Lawvere ", "concept_domain": "Combinatorics", "research_mode": "team", "quality": "partial", "quality_score": 0.66, "catalog_references": [], "prompt_length": 15731, "files_placed": 2, "status": "keep"}
{"timestamp": 1784856457.3481195, "experiment_id": "2f76a8a3", "concept_title": "Deepening: Erdos-Renyi on Acid: Random Graphs That Hallucinate", "concept_domain": "Logic", "research_mode": "team", "quality": "substantial", "quality_score": 0.7, "catalog_references": [], "prompt_length": 25188, "files_placed": 4, "status": "keep"}
{"timestamp": 1784859574.7056787, "experiment_id": "82236c9f", "concept_title": "**Conjecture.** For every strictly convex radiator-cost function, every finite s", "concept_domain": "Geometry", "research_mode": "team", "quality": "partial", "quality_score": 0.65, "catalog_references": [], "prompt_length": 18161, "files_placed": 4, "status": "keep"}
