{"timestamp": 1781422982.70133, "experiment_id": "2ec5aa6f", "concept_title": "Close Proofs: This cycle was about *closing proofs* in the Fibonacci primitive-divis", "concept_domain": "Applications", "research_mode": "team", "quality": "partial", "quality_score": 0.4708199999999999, "catalog_references": [], "prompt_length": 6269, "files_placed": 0, "status": "discard"}
{"timestamp": 1781423021.7620425, "experiment_id": "e955f9f8", "concept_title": "The order-theoretic core of the Cook\u2013Reckhow program in this catalog has, over s", "concept_domain": "Novelty", "research_mode": "team", "quality": "substantial", "quality_score": 0.721521095890411, "catalog_references": [], "prompt_length": 26052, "files_placed": 7, "status": "keep"}
{"timestamp": 1781423036.5689607, "experiment_id": "81efc5ef", "concept_title": "`Applications/BoltzmannBridge/InterleavingMetric.lean` closes the catalog's", "concept_domain": "Novelty", "research_mode": "team", "quality": "partial", "quality_score": 0.59781, "catalog_references": [], "prompt_length": 24647, "files_placed": 5, "status": "keep"}
{"timestamp": 1781425004.9181056, "experiment_id": "06ca9cfe", "concept_title": "Close Proofs: Berggren-word valuation induces an ultrametric on primitive Pythagorea", "concept_domain": "Applications", "research_mode": "team", "quality": "partial", "quality_score": 0.48819999999999997, "catalog_references": [], "prompt_length": 6140, "files_placed": 0, "status": "discard"}
{"timestamp": 1781425037.8992789, "experiment_id": "3b32f006", "concept_title": "This cycle pushed the catalog's synthetic homotopy module `Logic.HomotopyTypeThe", "concept_domain": "Novelty", "research_mode": "team", "quality": "partial", "quality_score": 0.6461466666666668, "catalog_references": [], "prompt_length": 23919, "files_placed": 6, "status": "keep"}
{"timestamp": 1781425059.338627, "experiment_id": "7adea9e1", "concept_title": "Close Proofs: The catalog's `Bridges/CategoricalTropicalUltrametric.lean` built an *", "concept_domain": "Applications", "research_mode": "team", "quality": "partial", "quality_score": 0.6996, "catalog_references": [], "prompt_length": 17657, "files_placed": 8, "status": "keep"}
{"timestamp": 1781427035.928318, "experiment_id": "b898a49e", "concept_title": "Close Proofs: This cycle pushed the *spectral depth threshold* program of", "concept_domain": "Applications", "research_mode": "team", "quality": "partial", "quality_score": 0.4727919191919192, "catalog_references": [], "prompt_length": 6178, "files_placed": 0, "status": "discard"}
{"timestamp": 1781427058.5301137, "experiment_id": "bcb8c391", "concept_title": "This cycle took the catalog's existing arithmetic-height bridge", "concept_domain": "Applications", "research_mode": "team", "quality": "partial", "quality_score": 0.5131950877192983, "catalog_references": [], "prompt_length": 18950, "files_placed": 0, "status": "keep"}
{"timestamp": 1781427079.4833643, "experiment_id": "1f36001e", "concept_title": "Close Proofs: `Applications/BoltzmannBridge/InterleavingMetric.lean` closes the cata", "concept_domain": "Novelty", "research_mode": "team", "quality": "partial", "quality_score": 0.43215959870323317, "catalog_references": [], "prompt_length": 6131, "files_placed": 0, "status": "discard"}
{"timestamp": 1781427109.8367965, "experiment_id": "87e9d710", "concept_title": "This cycle closed two of the standing conjectures of the *spectral depth thresho", "concept_domain": "Applications", "research_mode": "team", "quality": "substantial", "quality_score": 0.7047844776119403, "catalog_references": [], "prompt_length": 26283, "files_placed": 7, "status": "keep"}
{"timestamp": 1781427135.61473, "experiment_id": "73abb816", "concept_title": "This cycle treated the rank of apparition `fibRank` not as an ad-hoc arithmetic", "concept_domain": "Applications", "research_mode": "team", "quality": "substantial", "quality_score": 0.7671145762711864, "catalog_references": [], "prompt_length": 23458, "files_placed": 10, "status": "keep"}
{"timestamp": 1781427175.3579526, "experiment_id": "bee9630f", "concept_title": "Close Proofs: This cycle pushed the catalog's synthetic homotopy module `Logic.Homot", "concept_domain": "Novelty", "research_mode": "team", "quality": "partial", "quality_score": 0.5914076470588235, "catalog_references": [], "prompt_length": 6155, "files_placed": 0, "status": "keep"}
{"timestamp": 1781429165.9225883, "experiment_id": "de15e0b3", "concept_title": "This cycle closed a concrete gap between two halves of the catalog that had only", "concept_domain": "Applications", "research_mode": "team", "quality": "substantial", "quality_score": 0.7247030769230769, "catalog_references": [], "prompt_length": 24746, "files_placed": 11, "status": "keep"}
{"timestamp": 1781429183.8409965, "experiment_id": "0bab5b6a", "concept_title": "This cycle took the fibrewise characterisation of equivalences proved last cycle", "concept_domain": "Applications", "research_mode": "team", "quality": "partial", "quality_score": 0.6547329411764705, "catalog_references": [], "prompt_length": 25873, "files_placed": 9, "status": "keep"}
{"timestamp": 1781429232.9005816, "experiment_id": "910ca369", "concept_title": "Close Proofs: This cycle closed two of the standing conjectures of the *spectral dep", "concept_domain": "Novelty", "research_mode": "team", "quality": "partial", "quality_score": 0.43592142857142846, "catalog_references": [], "prompt_length": 6250, "files_placed": 0, "status": "discard"}
{"timestamp": 1781429265.1871305, "experiment_id": "73275714", "concept_title": "Close Proofs: This cycle treated the rank of apparition `fibRank` not as an ad-hoc a", "concept_domain": "Applications", "research_mode": "team", "quality": "partial", "quality_score": 0.5360399999999998, "catalog_references": [], "prompt_length": 6203, "files_placed": 0, "status": "keep"}
{"timestamp": 1781429293.6913104, "experiment_id": "40bdd3cd", "concept_title": "Close Proofs: This cycle took the catalog's existing arithmetic-height bridge", "concept_domain": "Novelty", "research_mode": "team", "quality": "partial", "quality_score": 0.5772114285714285, "catalog_references": [], "prompt_length": 6225, "files_placed": 0, "status": "keep"}
{"timestamp": 1781429321.0898423, "experiment_id": "b4dc2042", "concept_title": "This cycle stopped treating the rank of apparition `fibRank` as an ad-hoc arithm", "concept_domain": "Novelty", "research_mode": "team", "quality": "partial", "quality_score": 0.52082, "catalog_references": [], "prompt_length": 19525, "files_placed": 0, "status": "keep"}
{"timestamp": 1781431306.0685904, "experiment_id": "06bed695", "concept_title": "Close Proofs: The order-theoretic core of the Cook\u2013Reckhow program in this catalog h", "concept_domain": "Novelty", "research_mode": "team", "quality": "substantial", "quality_score": 0.7543200000000001, "catalog_references": [], "prompt_length": 17647, "files_placed": 19, "status": "keep"}
{"timestamp": 1781431323.6840606, "experiment_id": "b352d088", "concept_title": "Deepening: This cycle treated the rank of apparition `fibRank` not as an ad-hoc arithmetic", "concept_domain": "Novelty", "research_mode": "team", "quality": "partial", "quality_score": 0.6842497560975611, "catalog_references": [], "prompt_length": 17805, "files_placed": 6, "status": "keep"}
{"timestamp": 1781431375.8253114, "experiment_id": "47ed24d5", "concept_title": "Arithmetic Holography via Prime Geodesic Echoes on Modular Quantum Graphs", "concept_domain": "Novelty", "research_mode": "team", "quality": "partial", "quality_score": 0.386199070633065, "catalog_references": [], "prompt_length": 7844, "files_placed": 0, "status": "discard"}
{"timestamp": 1781433331.1130075, "experiment_id": "3b0048b9", "concept_title": "Close Proofs: This cycle took the fibrewise characterisation of equivalences proved ", "concept_domain": "Applications", "research_mode": "team", "quality": "partial", "quality_score": 0.35416666666666674, "catalog_references": [], "prompt_length": 6175, "files_placed": 0, "status": "discard"}
{"timestamp": 1781433353.4745657, "experiment_id": "b7aaac14", "concept_title": "The previous cycles built the *spectral depth threshold* skeleton", "concept_domain": "Applications", "research_mode": "team", "quality": "partial", "quality_score": 0.38607398347157895, "catalog_references": [], "prompt_length": 19653, "files_placed": 0, "status": "discard"}
{"timestamp": 1781433372.5454037, "experiment_id": "f0bae6d0", "concept_title": "This cycle promoted the *Hodge\u2013Betti dimension count* of `HodgeBettiRank.lean` f", "concept_domain": "Novelty", "research_mode": "team", "quality": "partial", "quality_score": 0.5244, "catalog_references": [], "prompt_length": 25806, "files_placed": 8, "status": "keep"}
{"timestamp": 1781434979.725948, "experiment_id": "9812538e", "concept_title": "Close Proofs: This cycle closed a concrete gap between two halves of the catalog tha", "concept_domain": "Novelty", "research_mode": "team", "quality": "substantial", "quality_score": 0.74728, "catalog_references": [], "prompt_length": 17651, "files_placed": 13, "status": "keep"}
{"timestamp": 1781434996.5350106, "experiment_id": "8e266d30", "concept_title": "`Applications/BoltzmannBridge/InterleavingQuotient.lean` discharges **Future", "concept_domain": "Applications", "research_mode": "team", "quality": "substantial", "quality_score": 0.7527200000000001, "catalog_references": [], "prompt_length": 24624, "files_placed": 9, "status": "keep"}
{"timestamp": 1781436962.7640822, "experiment_id": "18e0da51", "concept_title": "Universal Scaling of Minimal Neural PDE Solvers at Operator-Spectrum Phase Trans", "concept_domain": "Novelty", "research_mode": "team", "quality": "partial", "quality_score": 0.4159726737821565, "catalog_references": [], "prompt_length": 8485, "files_placed": 0, "status": "discard"}
{"timestamp": 1781436998.9377353, "experiment_id": "8f76f4ec", "concept_title": "Monodromy-Driven Quantum Advantage in Hypergeometric Period Sampling", "concept_domain": "Applications", "research_mode": "team", "quality": "partial", "quality_score": 0.4935706582633053, "catalog_references": [], "prompt_length": 7974, "files_placed": 0, "status": "discard"}
{"timestamp": 1781437020.8974392, "experiment_id": "c6fd83da", "concept_title": "Topological Error-Correcting Codes from Exotic Smooth Structures", "concept_domain": "Novelty", "research_mode": "team", "quality": "partial", "quality_score": 0.45926457142857147, "catalog_references": [], "prompt_length": 7525, "files_placed": 0, "status": "discard"}
{"timestamp": 1781437041.5737777, "experiment_id": "50c856d4", "concept_title": "The grand conjecture \u2014 that spectral form factors of modular quantum graphs carr", "concept_domain": "Applications", "research_mode": "team", "quality": "partial", "quality_score": 0.562, "catalog_references": [], "prompt_length": 17545, "files_placed": 0, "status": "keep"}
{"timestamp": 1781439026.111479, "experiment_id": "7e713d87", "concept_title": "Close Proofs: This cycle promoted the *Hodge\u2013Betti dimension count* of `HodgeBettiRa", "concept_domain": "Applications", "research_mode": "team", "quality": "partial", "quality_score": 0.5021562790697675, "catalog_references": [], "prompt_length": 6167, "files_placed": 0, "status": "keep"}
{"timestamp": 1781439040.1605024, "experiment_id": "5c6d3fa8", "concept_title": "The previous cycle established the **spectral depth threshold** picture", "concept_domain": "Novelty", "research_mode": "team", "quality": "substantial", "quality_score": 0.7638400000000001, "catalog_references": [], "prompt_length": 23944, "files_placed": 6, "status": "keep"}
{"timestamp": 1781439068.3722801, "experiment_id": "c22c1c99", "concept_title": "This cycle attacked the conjecture that *smooth structure is a usable computatio", "concept_domain": "Applications", "research_mode": "team", "quality": "partial", "quality_score": 0.53356, "catalog_references": [], "prompt_length": 19105, "files_placed": 0, "status": "keep"}
{"timestamp": 1781439108.6172154, "experiment_id": "ec894072", "concept_title": "Close Proofs: Universal Scaling of Minimal Neural PDE Solvers at Operator-Spectrum P", "concept_domain": "Novelty", "research_mode": "team", "quality": "partial", "quality_score": 0.39319250122129945, "catalog_references": [], "prompt_length": 6236, "files_placed": 0, "status": "discard"}
{"timestamp": 1781441106.4261873, "experiment_id": "636bb98c", "concept_title": "Close Proofs: `Applications/BoltzmannBridge/InterleavingQuotient.lean` discharges **", "concept_domain": "Novelty", "research_mode": "team", "quality": "substantial", "quality_score": 0.7054400000000001, "catalog_references": [], "prompt_length": 17650, "files_placed": 9, "status": "keep"}
{"timestamp": 1781441124.9420156, "experiment_id": "bdf748b3", "concept_title": "Close Proofs: Topological Error-Correcting Codes from Exotic Smooth Structures", "concept_domain": "Applications", "research_mode": "team", "quality": "partial", "quality_score": 0.6847152941176471, "catalog_references": [], "prompt_length": 17649, "files_placed": 15, "status": "keep"}
{"timestamp": 1781441148.5976686, "experiment_id": "c2f078e3", "concept_title": "This cycle hardened the foundation the previous cycle was *resting on but had no", "concept_domain": "Applications", "research_mode": "team", "quality": "partial", "quality_score": 0.40909333333333336, "catalog_references": [], "prompt_length": 24013, "files_placed": 0, "status": "discard"}
{"timestamp": 1781443140.093482, "experiment_id": "bb1c4aac", "concept_title": "Close Proofs: The previous cycle established the **spectral depth threshold** pictur", "concept_domain": "Applications", "research_mode": "team", "quality": "partial", "quality_score": 0.49434999999999996, "catalog_references": [], "prompt_length": 6165, "files_placed": 0, "status": "discard"}
{"timestamp": 1781443167.0892532, "experiment_id": "d3b0eeba", "concept_title": "Deepening: The order-theoretic core of the Cook\u2013Reckhow program in this catalog h", "concept_domain": "Applications", "research_mode": "team", "quality": "partial", "quality_score": 0.6192341176470588, "catalog_references": [], "prompt_length": 17800, "files_placed": 23, "status": "keep"}
{"timestamp": 1781443188.7870612, "experiment_id": "0645fcab", "concept_title": "The file `Core.lean` distills the (empirical, ML-flavored) conjecture", "concept_domain": "Novelty", "research_mode": "team", "quality": "partial", "quality_score": 0.6242644628099173, "catalog_references": [], "prompt_length": 25021, "files_placed": 5, "status": "keep"}
{"timestamp": 1781443203.092916, "experiment_id": "6fec53b5", "concept_title": "This cycle delivered `FibCarmichaelStructure.lean`, a **self-contained, `sorry`-", "concept_domain": "Novelty", "research_mode": "team", "quality": "substantial", "quality_score": 0.77481, "catalog_references": [], "prompt_length": 23104, "files_placed": 5, "status": "keep"}
{"timestamp": 1781445185.884767, "experiment_id": "0e6eb2a4", "concept_title": "Deepening: The previous cycle established the **spectral depth threshold** picture", "concept_domain": "Applications", "research_mode": "team", "quality": "partial", "quality_score": 0.33001334448160535, "catalog_references": [], "prompt_length": 6461, "files_placed": 0, "status": "discard"}
{"timestamp": 1781445224.3192317, "experiment_id": "fb032be0", "concept_title": "Close Proofs: This cycle attacked the conjecture that *smooth structure is a usable ", "concept_domain": "Applications", "research_mode": "team", "quality": "partial", "quality_score": 0.37487111111111115, "catalog_references": [], "prompt_length": 6133, "files_placed": 0, "status": "discard"}
{"timestamp": 1781445244.2617178, "experiment_id": "de75d365", "concept_title": "This cycle did two things. First, it **repaired and re-established the foundatio", "concept_domain": "Applications", "research_mode": "team", "quality": "partial", "quality_score": 0.60545, "catalog_references": [], "prompt_length": 26063, "files_placed": 7, "status": "keep"}
{"timestamp": 1781445264.5133665, "experiment_id": "209bf283", "concept_title": "The catalog's `SmoothPoincare` files develop the *lattice* side of the smooth /", "concept_domain": "Applications", "research_mode": "team", "quality": "partial", "quality_score": 0.6648000000000001, "catalog_references": [], "prompt_length": 24843, "files_placed": 8, "status": "keep"}
{"timestamp": 1781445286.857997, "experiment_id": "e1443601", "concept_title": "This cycle closes the conceptual loop opened by the two preceding cycles. The", "concept_domain": "Novelty", "research_mode": "team", "quality": "partial", "quality_score": 0.5238363636363637, "catalog_references": [], "prompt_length": 21466, "files_placed": 0, "status": "keep"}
{"timestamp": 1781445310.922893, "experiment_id": "3856eb7f", "concept_title": "This cycle delivered `Catalog/Applications/StrongDivPrimitiveCriterion.lean`, a ", "concept_domain": "Applications", "research_mode": "team", "quality": "partial", "quality_score": 0.5294885714285714, "catalog_references": [], "prompt_length": 18419, "files_placed": 0, "status": "keep"}
{"timestamp": 1781445332.1133611, "experiment_id": "e8dede57", "concept_title": "Close Proofs: The file `Core.lean` distills the (empirical, ML-flavored) conjecture", "concept_domain": "Novelty", "research_mode": "team", "quality": "partial", "quality_score": 0.5065777777777778, "catalog_references": [], "prompt_length": 6260, "files_placed": 0, "status": "keep"}
{"timestamp": 1781447330.4640312, "experiment_id": "9f75da83", "concept_title": "`Applications/BoltzmannBridge/InterleavingClosure.lean` discharges **Future", "concept_domain": "Novelty", "research_mode": "team", "quality": "partial", "quality_score": 0.6715834782608695, "catalog_references": [], "prompt_length": 26890, "files_placed": 6, "status": "keep"}
{"timestamp": 1781447353.9038897, "experiment_id": "ac0f7856", "concept_title": "Close Proofs: This cycle did two things. First, it **repaired and re-established the", "concept_domain": "Applications", "research_mode": "team", "quality": "partial", "quality_score": 0.5428499999999999, "catalog_references": [], "prompt_length": 6201, "files_placed": 0, "status": "keep"}
{"timestamp": 1781447408.654823, "experiment_id": "f2f1f778", "concept_title": "Close Proofs: Monodromy-Driven Quantum Advantage in Hypergeometric Period Sampling", "concept_domain": "Novelty", "research_mode": "team", "quality": "partial", "quality_score": 0.4139457293643264, "catalog_references": [], "prompt_length": 6189, "files_placed": 0, "status": "discard"}
{"timestamp": 1781449398.1427865, "experiment_id": "6c2e238b", "concept_title": "Deepening: This cycle delivered `FibCarmichaelStructure.lean`, a **self-contained, `sorry`-", "concept_domain": "Novelty", "research_mode": "team", "quality": "substantial", "quality_score": 0.8078933333333334, "catalog_references": [], "prompt_length": 17800, "files_placed": 9, "status": "keep"}
{"timestamp": 1781449420.450958, "experiment_id": "a7e4a8d3", "concept_title": "Close Proofs: This cycle delivered `Catalog/Applications/StrongDivPrimitiveCriterion", "concept_domain": "Applications", "research_mode": "team", "quality": "substantial", "quality_score": 0.7199621052631578, "catalog_references": [], "prompt_length": 17661, "files_placed": 8, "status": "keep"}
{"timestamp": 1781449440.7409544, "experiment_id": "7cc436bd", "concept_title": "Close Proofs: This cycle hardened the foundation the previous cycle was *resting on ", "concept_domain": "Applications", "research_mode": "team", "quality": "partial", "quality_score": 0.4886400000000001, "catalog_references": [], "prompt_length": 17660, "files_placed": 6, "status": "discard"}
{"timestamp": 1781449456.7233393, "experiment_id": "12557248", "concept_title": "Close Proofs: This cycle delivered `FibCarmichaelStructure.lean`, a **self-contained", "concept_domain": "Novelty", "research_mode": "team", "quality": "partial", "quality_score": 0.6776800000000001, "catalog_references": [], "prompt_length": 17646, "files_placed": 6, "status": "keep"}
{"timestamp": 1781449490.4496355, "experiment_id": "aef805b6", "concept_title": "Close Proofs: `Applications/BoltzmannBridge/InterleavingClosure.lean` discharges **F", "concept_domain": "Novelty", "research_mode": "team", "quality": "partial", "quality_score": 0.55536, "catalog_references": [], "prompt_length": 6218, "files_placed": 0, "status": "keep"}
{"timestamp": 1781451740.5968194, "experiment_id": "0914fa07", "concept_title": "`Applications/BoltzmannBridge/InterleavingIsometry.lean` discharges **Future", "concept_domain": "Novelty", "research_mode": "team", "quality": "substantial", "quality_score": 0.7653149514563107, "catalog_references": [], "prompt_length": 26715, "files_placed": 9, "status": "keep"}
{"timestamp": 1781453747.2764876, "experiment_id": "448d8857", "concept_title": "The previous strands of this project pinned down two complementary pictures of", "concept_domain": "Applications", "research_mode": "team", "quality": "partial", "quality_score": 0.5232763636363637, "catalog_references": [], "prompt_length": 21487, "files_placed": 0, "status": "keep"}
{"timestamp": 1781453801.4825625, "experiment_id": "c73ec1f1", "concept_title": "Close Proofs: This cycle closes the conceptual loop opened by the two preceding cycl", "concept_domain": "Novelty", "research_mode": "team", "quality": "substantial", "quality_score": 0.7388800000000001, "catalog_references": [], "prompt_length": 17646, "files_placed": 19, "status": "keep"}
{"timestamp": 1781453818.98639, "experiment_id": "f164e37c", "concept_title": "This cycle pushed the discrete Hodge program from its *geometric/decomposition* ", "concept_domain": "Novelty", "research_mode": "team", "quality": "substantial", "quality_score": 0.7433942857142857, "catalog_references": [], "prompt_length": 27282, "files_placed": 9, "status": "keep"}
