{"timestamp": 1781683722.8575542, "experiment_id": "728f60d4", "concept_title": "Speculative: Theorems as Phase Transitions in Proof Space", "concept_domain": "Logic", "research_mode": "formalize", "quality": "partial", "quality_score": 0.4504, "catalog_references": ["Catalog/FINAL/"], "prompt_length": 2982, "files_placed": 0, "status": "discard"}
{"timestamp": 1781685796.6660337, "experiment_id": "77489d34", "concept_title": "The Riemann-Roch Theorem for Graphs: Chip-Firing and the Canonical Divisor", "concept_domain": "Tropical", "research_mode": "formalize", "quality": "partial", "quality_score": 0.5406000000000001, "catalog_references": ["Catalog/FINAL/", "Mathlib/Combinatorics/SimpleGraph/Basic", "Mathlib/Combinatorics/SimpleGraph/Finite", "Mathlib/Data/Finset/Card", "Mathlib/Algebra/BigOperators/Basic"], "prompt_length": 18835, "files_placed": 5, "status": "keep"}
{"timestamp": 1781687866.0901918, "experiment_id": "8c9d3809", "concept_title": "The Mathematics of Memes: Viral Information Topology", "concept_domain": "Logic", "research_mode": "formalize", "quality": "partial", "quality_score": 0.6462399999999999, "catalog_references": ["Logic/InductiveDefinitions.lean", "Order/FixedPoints.lean", "Data/Set/Basic.lean", "Data/Finset/Basic.lean"], "prompt_length": 15273, "files_placed": 5, "status": "keep"}
{"timestamp": 1781689861.7012424, "experiment_id": "6493a7ff", "concept_title": "Crystallographic Groups and Music: The 17 Wallpaper Groups of Rhythm", "concept_domain": "Computation", "research_mode": "formalize", "quality": "partial", "quality_score": 0.5668, "catalog_references": ["Catalog/FINAL/", "Computation/DrumPatternTranslationSymmetry.lean"], "prompt_length": 19206, "files_placed": 11, "status": "keep"}
{"timestamp": 1781691838.4694219, "experiment_id": "c2929b61", "concept_title": "Retrocausal Mathematics: Where Effects Precede Causes", "concept_domain": "Cryptography", "research_mode": "team", "quality": "partial", "quality_score": 0.5083935828877005, "catalog_references": [], "prompt_length": 17912, "files_placed": 6, "status": "keep"}
{"timestamp": 1781691877.9353673, "experiment_id": "95c512f5", "concept_title": "Mind vs G\u00f6del: Can Minds Outperform Algorithms?", "concept_domain": "Logic", "research_mode": "formalize", "quality": "partial", "quality_score": 0.57324, "catalog_references": ["Catalog/FINAL/Logic/", "Catalog/FINAL/Foundations/", "Mathlib/Logic/Function/Basic", "Mathlib/Data/Bool/Basic", "Mathlib/Data/Set/Basic"], "prompt_length": 15997, "files_placed": 5, "status": "keep"}
{"timestamp": 1781693923.4270318, "experiment_id": "667542f0", "concept_title": "Counterfactual Number Theory: What If Primes Were Random?", "concept_domain": "Cryptography", "research_mode": "formalize", "quality": "partial", "quality_score": 0.5307999999999999, "catalog_references": ["Catalog/FINAL/"], "prompt_length": 17890, "files_placed": 6, "status": "keep"}
{"timestamp": 1781701339.0247045, "experiment_id": "595ce011", "concept_title": "The Spectral Gap of Sudoku: When Puzzles Become Phase Transitions", "concept_domain": "Novelty", "research_mode": "formalize", "quality": "partial", "quality_score": 0.6122400000000001, "catalog_references": ["Catalog/FINAL/", "Computation/SudokuConstraintGraph.lean"], "prompt_length": 19110, "files_placed": 7, "status": "keep"}
{"timestamp": 1781701466.5428758, "experiment_id": "5884df3d", "concept_title": "Phantom Topologies: Spaces That Change When You Look at Them", "concept_domain": "Combinatorics", "research_mode": "formalize", "quality": "partial", "quality_score": 0.60834, "catalog_references": ["Mathlib/Topology/Order", "Mathlib/Topology/Basic", "Mathlib/Order/LowerSet", "Catalog/FINAL"], "prompt_length": 14671, "files_placed": 5, "status": "keep"}
{"timestamp": 1781703497.8208845, "experiment_id": "46951c2e", "concept_title": "The L-Function Oracle: What If We Could Compute L-Functions Instantly?", "concept_domain": "Probability", "research_mode": "formalize", "quality": "partial", "quality_score": 0.36179759999999994, "catalog_references": ["Probability/FactoringOracle.lean"], "prompt_length": 2600, "files_placed": 0, "status": "discard"}
{"timestamp": 1781705767.603703, "experiment_id": "ab2bf6f4", "concept_title": "Quantum Error Correction from Homological Algebra: CSS Codes as Cohomology", "concept_domain": "Algebra", "research_mode": "formalize", "quality": "partial", "quality_score": 0.5330519163763068, "catalog_references": ["Catalog/FINAL/Algebra/", "Catalog/FINAL/LinearAlgebra/"], "prompt_length": 3540, "files_placed": 0, "status": "keep"}
{"timestamp": 1781710186.6339924, "experiment_id": "8e98f715", "concept_title": "Transreal Arithmetic: Computing Beyond Plus-Minus Infinity", "concept_domain": "Combinatorics", "research_mode": "formalize", "quality": "partial", "quality_score": 0.46684, "catalog_references": ["Mathlib"], "prompt_length": 4410, "files_placed": 0, "status": "discard"}
{"timestamp": 1781712226.3178036, "experiment_id": "16b03c84", "concept_title": "Cellular Automata as Algebraic Geometry: Wolfram's Rules Meet Grothendieck", "concept_domain": "Combinatorics", "research_mode": "formalize", "quality": "partial", "quality_score": 0.49697377834557654, "catalog_references": ["Catalog/FINAL/"], "prompt_length": 2640, "files_placed": 0, "status": "discard"}
{"timestamp": 1781714299.7784662, "experiment_id": "cb56480f", "concept_title": "The Mathematics of Jigsaw Puzzles: NP-Completeness and Topology", "concept_domain": "Logic", "research_mode": "formalize", "quality": "partial", "quality_score": 0.4729431683168317, "catalog_references": ["Catalog/FINAL/"], "prompt_length": 3649, "files_placed": 0, "status": "discard"}
{"timestamp": 1781714703.0560496, "experiment_id": "74e64b1f", "concept_title": "Algebraic Geometry of Neural Networks: Varieties of Decision Boundaries", "concept_domain": "Novelty", "research_mode": "formalize", "quality": "partial", "quality_score": 0.43286675, "catalog_references": ["Catalog/FINAL/", "Mathlib"], "prompt_length": 3891, "files_placed": 0, "status": "discard"}
{"timestamp": 1781717035.3094316, "experiment_id": "61934e8a", "concept_title": "Isomorphisms of Meaning: When Structures Collide", "concept_domain": "Novelty", "research_mode": "sorry_fill", "quality": "partial", "quality_score": 0.531269226006192, "catalog_references": ["Mathlib.CategoryTheory.Iso", "Mathlib.CategoryTheory.Aut", "Mathlib.CategoryTheory.GroupIso"], "prompt_length": 2331, "files_placed": 0, "status": "keep"}
{"timestamp": 1781724267.3570013, "experiment_id": "9ff40964", "concept_title": "The Fermi Paradox as a Pigeonhole Principle: Why We Are Alone", "concept_domain": "Applications", "research_mode": "formalize", "quality": "partial", "quality_score": 0.5532343961470463, "catalog_references": ["FINAL/MinimalArithmetic.lean", "FINAL/Pigeonhole.lean"], "prompt_length": 19150, "files_placed": 12, "status": "keep"}
{"timestamp": 1781724401.3314922, "experiment_id": "949d41e5", "concept_title": "Hypergraph Ramsey Theory: Beyond Graphs", "concept_domain": "MachineLearning", "research_mode": "formalize", "quality": "partial", "quality_score": 0.6052, "catalog_references": ["Catalog/FINAL/"], "prompt_length": 18792, "files_placed": 5, "status": "keep"}
{"timestamp": 1781734657.1771333, "experiment_id": "bf4e21b7", "concept_title": "Knots That Think: Cognition as Braiding in Category Theory", "concept_domain": "Novelty", "research_mode": "formalize", "quality": "partial", "quality_score": 0.33194676, "catalog_references": ["Catalog/FINAL/Foundations/Int/IntBasic.lean", "Catalog/FINAL/Foundations/List/ListLemmas.lean", "Catalog/FINAL/Combinatorics/Syntax/InductiveStructures.lean"], "prompt_length": 4342, "files_placed": 0, "status": "discard"}
{"timestamp": 1781735421.740691, "experiment_id": "856aa6ac", "concept_title": "Holographic Primes: The Prime Number AdS/CFT Correspondence", "concept_domain": "NumberTheory", "research_mode": "sorry_fill", "quality": "partial", "quality_score": 0.4037273333333333, "catalog_references": ["Mathlib/Logic/Ultranatural.lean", "Mathlib/Algebra/Field/Defs.lean", "Mathlib/Algebra/Ring/Quotient.lean", "Mathlib/Data/Setoid/Basic.lean", "Mathlib/Topology/Filter/Ultrafilter.lean"], "prompt_length": 2490, "files_placed": 0, "status": "discard"}
{"timestamp": 1781737884.645404, "experiment_id": "21cfd7dd", "concept_title": "The Prime Number Crossword: Filling the Gaps in the Primes", "concept_domain": "Cryptography", "research_mode": "formalize", "quality": "partial", "quality_score": 0.36289866666666665, "catalog_references": ["FINAL/Math/Filter/Germ.lean", "FINAL/Algebra/Quotient.lean"], "prompt_length": 2478, "files_placed": 0, "status": "discard"}
{"timestamp": 1781742731.488298, "experiment_id": "880250ea", "concept_title": "Impossible Geometries: Where Parallel Lines Converge AND Diverge", "concept_domain": "Bridges", "research_mode": "sorry_fill", "quality": "partial", "quality_score": 0.40832662857142854, "catalog_references": ["Catalog/Geometry/SplitGeometry.lean"], "prompt_length": 1808, "files_placed": 0, "status": "discard"}
{"timestamp": 1781748654.4816325, "experiment_id": "6e109ffd", "concept_title": "Close Proofs: The Spectral Gap of Sudoku: When Puzzles Become Phase Transitions", "concept_domain": "Cryptography", "research_mode": "sorry_fill", "quality": "partial", "quality_score": 0.4288495652173913, "catalog_references": ["Computation/SudokuConstraintGraph.lean"], "prompt_length": 1468, "files_placed": 0, "status": "discard"}
{"timestamp": 1781759073.6113014, "experiment_id": "2710f166", "concept_title": "Renormalization of Proofs: Phase Transitions in Automated Theorem Search", "concept_domain": "Novelty", "research_mode": "sorry_fill", "quality": "partial", "quality_score": 0.5415909090909091, "catalog_references": [], "prompt_length": 21124, "files_placed": 13, "status": "keep"}
{"timestamp": 1781762656.8668845, "experiment_id": "50e9a2da", "concept_title": "Scaling Laws from Statistical Mechanics", "concept_domain": "MachineLearning", "research_mode": "formalize", "quality": "partial", "quality_score": 0.5529929095354524, "catalog_references": ["Mathlib/Data/Real/Basic.lean", "Mathlib/Analysis/SpecialFunctions/Pow/Real.lean"], "prompt_length": 22330, "files_placed": 13, "status": "keep"}
{"timestamp": 1781766169.6859462, "experiment_id": "15e84b40", "concept_title": "Sheaf-Theoretic Data Integration: When Databases Form a Sheaf", "concept_domain": "Cryptography", "research_mode": "formalize", "quality": "partial", "quality_score": 0.5413687224669603, "catalog_references": [], "prompt_length": 21467, "files_placed": 6, "status": "keep"}
{"timestamp": 1781771777.0964878, "experiment_id": "0d2b0b43", "concept_title": "Tropical Curve Counting: Gromov-Witten Invariants", "concept_domain": "Tropical", "research_mode": "formalize", "quality": "partial", "quality_score": 0.5115800000000001, "catalog_references": [], "prompt_length": 21927, "files_placed": 9, "status": "keep"}
{"timestamp": 1781773499.2149339, "experiment_id": "d6f5cc61", "concept_title": "Quantum Random Walks on Cayley Graphs: Spectral Gaps and Mixing Times", "concept_domain": "Shared", "research_mode": "sorry_fill", "quality": "partial", "quality_score": 0.36854137254901964, "catalog_references": [], "prompt_length": 2207, "files_placed": 0, "status": "discard"}
{"timestamp": 1781784526.6560774, "experiment_id": "5ddac85b", "concept_title": "Spectral Universality of LLM Weight Matrices: Random-Matrix Phase Transitions in", "concept_domain": "Novelty", "research_mode": "formalize", "quality": "partial", "quality_score": 0.38904000000000005, "catalog_references": [], "prompt_length": 2824, "files_placed": 0, "status": "discard"}
{"timestamp": 1781802347.6707556, "experiment_id": "f6a45eec", "concept_title": "Euler-Mascheroni Constant: Irrationality Approaches", "concept_domain": "NumberTheory", "research_mode": "prove", "quality": "partial", "quality_score": 0.4949979545454546, "catalog_references": [], "prompt_length": 6763, "files_placed": 0, "status": "discard"}
{"timestamp": 1781816755.967411, "experiment_id": "6c118cd3", "concept_title": "Proof Automation: Custom Lean 4 Tactics", "concept_domain": "Bridges", "research_mode": "prove", "quality": "partial", "quality_score": 0.4716, "catalog_references": [], "prompt_length": 20249, "files_placed": 8, "status": "discard"}
{"timestamp": 1781820503.9931273, "experiment_id": "fb1d7cfa", "concept_title": "Topological Quantum Compiling: Braid Groups as Universal Gates", "concept_domain": "Geometry", "research_mode": "formalize", "quality": "partial", "quality_score": 0.536, "catalog_references": [], "prompt_length": 23332, "files_placed": 12, "status": "keep"}
{"timestamp": 1781847863.0034137, "experiment_id": "9afcaae7", "concept_title": "Spectral Universality of LLM Weight Matrices: Random-Matrix Phase Transitions in", "concept_domain": "Pythagorean", "research_mode": "formalize", "quality": "partial", "quality_score": 0.35798030000000003, "catalog_references": ["Catalog/FINAL/Mathlib/Data/Finset/Card.lean", "Catalog/FINAL/Mathlib/Algebra/Algebraic/Basic.lean", "Catalog/FINAL/Mathlib/Tactic/Positivity.lean"], "prompt_length": 1781, "files_placed": 0, "status": "discard"}
{"timestamp": 1781849825.8279033, "experiment_id": "3c627a3f", "concept_title": "Close Proofs: These conjectures extend `Catalog/Bridges/CodeThresholdValuation.lean`", "concept_domain": "Geometry", "research_mode": "formalize", "quality": "partial", "quality_score": 0.4785, "catalog_references": [], "prompt_length": 3227, "files_placed": 0, "status": "discard"}
{"timestamp": 1781851656.6686373, "experiment_id": "f53b6be3", "concept_title": "Topological Quantum Compiling: Braid Groups as Universal Gates", "concept_domain": "Physics", "research_mode": "formalize", "quality": "partial", "quality_score": 0.6543599999999999, "catalog_references": ["Catalog/FINAL/Algebra/JonesTemperleyLiebBraid4.lean", "Algebra/JonesTemperleyLiebBraid4.lean"], "prompt_length": 17975, "files_placed": 6, "status": "keep"}
{"timestamp": 1781851890.611964, "experiment_id": "74320b24", "concept_title": "Non-Archimedean Probability via Surreal Numbers", "concept_domain": "Novelty", "research_mode": "formalize", "quality": "partial", "quality_score": 0.6584800000000001, "catalog_references": ["Novelty/InfinitesimalFiniteProbability.lean"], "prompt_length": 20494, "files_placed": 6, "status": "keep"}
{"timestamp": 1781855456.8725016, "experiment_id": "b53ecc44", "concept_title": "Kakeya Conjecture: Known Cases and Bounds", "concept_domain": "Tropical", "research_mode": "prove", "quality": "partial", "quality_score": 0.43941381818181824, "catalog_references": [], "prompt_length": 7197, "files_placed": 0, "status": "discard"}
{"timestamp": 1781857276.324579, "experiment_id": "3d9b7416", "concept_title": "Sheaf-Theoretic Data Integration: When Databases Form a Sheaf", "concept_domain": "Algebra", "research_mode": "team", "quality": "partial", "quality_score": 0.5508906250000001, "catalog_references": [], "prompt_length": 23583, "files_placed": 5, "status": "keep"}
{"timestamp": 1781861813.0322697, "experiment_id": "c9ad0581", "concept_title": "Tropical Cryptography: Min-Plus Encryption with Tropical Matrices", "concept_domain": "MachineLearning", "research_mode": "prove", "quality": "substantial", "quality_score": 0.829866, "catalog_references": ["Algebra/TropicalMatrices.lean", "Applied/TropicalCryptography.lean"], "prompt_length": 23712, "files_placed": 6, "status": "keep"}
{"timestamp": 1781862016.119636, "experiment_id": "54f377a3", "concept_title": "Sheaf-Theoretic Data Integration: When Databases Form a Sheaf", "concept_domain": "Bridges", "research_mode": "team", "quality": "partial", "quality_score": 0.3998539157894737, "catalog_references": [], "prompt_length": 23583, "files_placed": 8, "status": "discard"}
{"timestamp": 1781863848.5040734, "experiment_id": "26902e54", "concept_title": "Dream Logic: Non-Monotone Reasoning Where Contradictions Coexist", "concept_domain": "Shared", "research_mode": "formalize", "quality": "partial", "quality_score": 0.4953453636363636, "catalog_references": ["Mathlib/Logic/Propositional/Basic.lean", "Mathlib/Logic/Propositional/Tautology.lean"], "prompt_length": 4167, "files_placed": 0, "status": "discard"}
{"timestamp": 1781865456.0643907, "experiment_id": "be5e0ab8", "concept_title": "Speculative: Anti-Gravity Mathematics \u2014 Theorems That Resist Proof", "concept_domain": "Computation", "research_mode": "formalize", "quality": "substantial", "quality_score": 0.8895200000000001, "catalog_references": ["Algebra/JonesTemperleyLiebBraid4.lean", "Algebra/TemperleyLieb.lean", "Topology/MarkovTrace.lean"], "prompt_length": 20567, "files_placed": 10, "status": "keep"}
{"timestamp": 1781865583.3350816, "experiment_id": "a2755e7b", "concept_title": "The Library of Babel: Combinatorics of the Universal Library", "concept_domain": "Algebra", "research_mode": "formalize", "quality": "partial", "quality_score": 0.5554623188405797, "catalog_references": ["Mathlib/Data/Finset/Basic.lean", "Mathlib/MeasureTheory/Measure/Uniform.lean", "Mathlib/Probability/Basic.lean", "Mathlib/Analysis/SpecialFunctions/Pow/Real.lean"], "prompt_length": 21337, "files_placed": 8, "status": "keep"}
{"timestamp": 1781867991.6780503, "experiment_id": "0abb7f10", "concept_title": "Tropical Cryptography: Min-Plus Encryption with Tropical Matrices", "concept_domain": "Logic", "research_mode": "team", "quality": "substantial", "quality_score": 0.8183200000000002, "catalog_references": [], "prompt_length": 21560, "files_placed": 6, "status": "keep"}
{"timestamp": 1781869086.0221577, "experiment_id": "4f74256d", "concept_title": "Sheaf-Theoretic Data Integration: When Databases Form a Sheaf", "concept_domain": "Computation", "research_mode": "team", "quality": "partial", "quality_score": 0.4968983018867924, "catalog_references": [], "prompt_length": 21460, "files_placed": 19, "status": "discard"}
{"timestamp": 1781869691.0239384, "experiment_id": "e88eb144", "concept_title": "Dream Logic: Non-Monotone Reasoning Where Contradictions Coexist", "concept_domain": "Combinatorics", "research_mode": "team", "quality": "substantial", "quality_score": 0.7144, "catalog_references": [], "prompt_length": 20337, "files_placed": 8, "status": "keep"}
{"timestamp": 1781871498.104132, "experiment_id": "7f1e65fe", "concept_title": "Average-Degree Bound for Locally Sparse Uniform Hypergraphs", "concept_domain": "Bridges", "research_mode": "prove", "quality": "partial", "quality_score": 0.476594, "catalog_references": ["Catalog/FINAL/HypergraphCore.lean", "Catalog/FINAL/SetTheory/IndependentSets.lean", "Catalog/FINAL/Combinatorics/DeletionLemmas.lean"], "prompt_length": 22602, "files_placed": 11, "status": "discard"}
{"timestamp": 1781875244.7303488, "experiment_id": "60ec8c30", "concept_title": "Quantum Error Correction Threshold: The Eastin-Knill Theorem", "concept_domain": "Shared", "research_mode": "sorry_fill", "quality": "partial", "quality_score": 0.48337107438016536, "catalog_references": ["Catalog/FINAL/Quantum/TL_Braid_Local.lean"], "prompt_length": 20296, "files_placed": 6, "status": "discard"}
{"timestamp": 1781880117.9072297, "experiment_id": "b3d82bf4", "concept_title": "Tropical Cryptography: Min-Plus Encryption with Tropical Matrices", "concept_domain": "Cryptography", "research_mode": "team", "quality": "substantial", "quality_score": 0.74352, "catalog_references": [], "prompt_length": 21574, "files_placed": 7, "status": "keep"}
{"timestamp": 1781880355.6932282, "experiment_id": "78320320", "concept_title": "The Library of Babel: Combinatorics of the Universal Library", "concept_domain": "Cryptography", "research_mode": "formalize", "quality": "partial", "quality_score": 0.5258320497819382, "catalog_references": ["Algebra/LibraryOfBabel.lean"], "prompt_length": 3108, "files_placed": 0, "status": "keep"}
{"timestamp": 1781882274.8069913, "experiment_id": "6495e602", "concept_title": "Sheaf-Theoretic Data Integration: When Databases Form a Sheaf", "concept_domain": "Probability", "research_mode": "formalize", "quality": "substantial", "quality_score": 0.8166, "catalog_references": ["MachineLearning/CechComplex.lean", "Catalog/FINAL/Probability/IndependentEvents.lean", "Catalog/FINAL/Combinatorics/BinomialCoefficients.lean"], "prompt_length": 23596, "files_placed": 20, "status": "keep"}
{"timestamp": 1781882624.640383, "experiment_id": "a449aa2a", "concept_title": "Speculative: Anti-Gravity Mathematics \u2014 Theorems That Resist Proof", "concept_domain": "NumberTheory", "research_mode": "formalize", "quality": "partial", "quality_score": 0.39323663366336636, "catalog_references": [], "prompt_length": 20569, "files_placed": 14, "status": "discard"}
{"timestamp": 1781884674.770487, "experiment_id": "4b892cf9", "concept_title": "Tropical Cryptography: Min-Plus Encryption with Tropical Matrices", "concept_domain": "Applications", "research_mode": "team", "quality": "partial", "quality_score": 0.481562, "catalog_references": [], "prompt_length": 9360, "files_placed": 0, "status": "discard"}
{"timestamp": 1781884791.8438585, "experiment_id": "3b2adc6d", "concept_title": "Birch and Swinnerton-Dyer Conjecture", "concept_domain": "Applications", "research_mode": "team", "quality": "substantial", "quality_score": 0.7756000000000001, "catalog_references": [], "prompt_length": 20210, "files_placed": 6, "status": "keep"}
{"timestamp": 1781889101.3001924, "experiment_id": "6bd9e95d", "concept_title": "Dream Logic: Non-Monotone Reasoning Where Contradictions Coexist", "concept_domain": "Probability", "research_mode": "sorry_fill", "quality": "partial", "quality_score": 0.5233429030396415, "catalog_references": ["Logic/BelnapRetractable.lean"], "prompt_length": 1252, "files_placed": 0, "status": "keep"}
