{"timestamp": 1784018407.5952227, "experiment_id": "13e584ca", "concept_title": "Deepening: Sharp Lower Bounds for Sumsets in L\u2081 Balls in \u2124\u1d48", "concept_domain": "Applications", "research_mode": "team", "quality": "substantial", "quality_score": 0.83, "catalog_references": [], "prompt_length": 24022, "files_placed": 4, "status": "keep"}
{"timestamp": 1784018417.1802108, "experiment_id": "bcaaf8f2", "concept_title": "Elementary spectral-moment foundations of Seidel", "concept_domain": "Applications", "research_mode": "team", "quality": "substantial", "quality_score": 0.72, "catalog_references": [], "prompt_length": 35140, "files_placed": 4, "status": "keep"}
{"timestamp": 1784019508.9971423, "experiment_id": "b78ccbe1", "concept_title": "Deepening: **suspension tower** `S\u1d4f(K)` of a free \u2124\u2082-complex as", "concept_domain": "Novelty", "research_mode": "team", "quality": "substantial", "quality_score": 0.82, "catalog_references": [], "prompt_length": 24016, "files_placed": 4, "status": "keep"}
{"timestamp": 1784020623.4544935, "experiment_id": "b6231f58", "concept_title": "Deepening: This cycle deepened the combinatorial core of the set-theoretic multiverse by", "concept_domain": "Applications", "research_mode": "team", "quality": "substantial", "quality_score": 0.82, "catalog_references": [], "prompt_length": 24051, "files_placed": 4, "status": "keep"}
{"timestamp": 1784023716.5762866, "experiment_id": "6e60d0a1", "concept_title": "Close Proofs: **suspension tower** `S\u1d4f(K)` of a free \u2124\u2082-complex as", "concept_domain": "Novelty", "research_mode": "team", "quality": "substantial", "quality_score": 0.8, "catalog_references": [], "prompt_length": 23872, "files_placed": 4, "status": "keep"}
{"timestamp": 1784023722.093805, "experiment_id": "385fff12", "concept_title": "Exact Exponent for Constrained Coset Guesswork", "concept_domain": "Applications", "research_mode": "team", "quality": "substantial", "quality_score": 0.83, "catalog_references": ["cs.IT", "cs.GT", "math.CO", "math.PR"], "prompt_length": 23873, "files_placed": 4, "status": "keep"}
{"timestamp": 1784024732.6058953, "experiment_id": "c4aa235b", "concept_title": "Deepening: Exact AVD\u2011total chromatic number of central graphs of regular graphs", "concept_domain": "Novelty", "research_mode": "team", "quality": "substantial", "quality_score": 0.82, "catalog_references": [], "prompt_length": 24032, "files_placed": 4, "status": "keep"}
{"timestamp": 1784024751.247657, "experiment_id": "b2384a8a", "concept_title": "Limit Distribution of Descendants in Random d-DAGs", "concept_domain": "Applications", "research_mode": "team", "quality": "substantial", "quality_score": 0.82, "catalog_references": ["Janson (2023) - Ancestries in random d-DAGs (theorems on descendant distributions)", "Jan2023 - Recent work on descendants of n in G_n", "Drm2009 - Random recursive trees (d=1 case)"], "prompt_length": 23700, "files_placed": 4, "status": "keep"}
{"timestamp": 1784026791.6278896, "experiment_id": "ef403dbc", "concept_title": "Deepening: White's Quadratic Exchange Conjecture (Part 3)", "concept_domain": "Applications", "research_mode": "team", "quality": "substantial", "quality_score": 0.8, "catalog_references": [], "prompt_length": 24030, "files_placed": 4, "status": "keep"}
{"timestamp": 1784027826.857547, "experiment_id": "bce13597", "concept_title": "The previous cycle established the **suspension tower** `S\u1d4f(K)` of a free `\u2124\u2082`-c", "concept_domain": "Applications", "research_mode": "team", "quality": "substantial", "quality_score": 0.83, "catalog_references": [], "prompt_length": 26851, "files_placed": 4, "status": "keep"}
{"timestamp": 1784033991.4571986, "experiment_id": "482ba253", "concept_title": "Deepening: **suspension tower** `S\u1d4f(K)` of a free \u2124\u2082-complex as", "concept_domain": "Novelty", "research_mode": "team", "quality": "substantial", "quality_score": 0.82, "catalog_references": [], "prompt_length": 24016, "files_placed": 4, "status": "keep"}
{"timestamp": 1784034003.0675728, "experiment_id": "0c7f8736", "concept_title": "Close Proofs: Maximum Determinant Bound for 4\u00d74 Unimodular Matrices with Bounded Ent", "concept_domain": "Applications", "research_mode": "team", "quality": "substantial", "quality_score": 0.78, "catalog_references": [], "prompt_length": 23905, "files_placed": 4, "status": "keep"}
{"timestamp": 1784035207.3035305, "experiment_id": "bd6ccec1", "concept_title": "This cycle established, with no finiteness or well-foundedness hypothesis on the", "concept_domain": "Novelty", "research_mode": "team", "quality": "substantial", "quality_score": 0.83, "catalog_references": [], "prompt_length": 27345, "files_placed": 4, "status": "keep"}
{"timestamp": 1784036273.896477, "experiment_id": "d09018a9", "concept_title": "OEIS sequence: Maximal number of \"good\" manifolds in an n-nice polytope.", "concept_domain": "Applications", "research_mode": "team", "quality": "substantial", "quality_score": 0.82, "catalog_references": [], "prompt_length": 23783, "files_placed": 4, "status": "keep"}
{"timestamp": 1784038401.4061522, "experiment_id": "c5cfd9ce", "concept_title": "Deepening: Negative-Dimensional Topology: What Lives in Dimension -1?", "concept_domain": "Applications", "research_mode": "team", "quality": "substantial", "quality_score": 0.83, "catalog_references": [], "prompt_length": 24037, "files_placed": 5, "status": "keep"}
{"timestamp": 1784038444.637676, "experiment_id": "479516dd", "concept_title": "Deepening: Bypassed", "concept_domain": "Novelty", "research_mode": "team", "quality": "substantial", "quality_score": 0.83, "catalog_references": [], "prompt_length": 23685, "files_placed": 5, "status": "keep"}
{"timestamp": 1784038476.7442727, "experiment_id": "d2eb77e2", "concept_title": "Additive / geometric / analytic scaffolding around th", "concept_domain": "Novelty", "research_mode": "team", "quality": "substantial", "quality_score": 0.82, "catalog_references": [], "prompt_length": 27563, "files_placed": 4, "status": "keep"}
{"timestamp": 1784039573.5688245, "experiment_id": "656eecef", "concept_title": "Deepening: Cone Colorful Carath\u00e9odory Theorem", "concept_domain": "Novelty", "research_mode": "team", "quality": "substantial", "quality_score": 0.84, "catalog_references": [], "prompt_length": 23982, "files_placed": 4, "status": "keep"}
{"timestamp": 1784043656.1890123, "experiment_id": "85360393", "concept_title": "Engel's Interval Packing Theorem", "concept_domain": "Applications", "research_mode": "team", "quality": "partial", "quality_score": 0.6, "catalog_references": ["math.CO", "Engel's interval packing problem", "Boolean lattice", "Set systems"], "prompt_length": 3513, "files_placed": 2, "status": "keep"}
{"timestamp": 1784043673.698485, "experiment_id": "2c734846", "concept_title": "Close Proofs: Tangled Hierarchies: Proof Systems That Reference Their Own Soundness", "concept_domain": "Applications", "research_mode": "team", "quality": "substantial", "quality_score": 0.78, "catalog_references": [], "prompt_length": 22605, "files_placed": 4, "status": "keep"}
{"timestamp": 1784044695.3170228, "experiment_id": "202302de", "concept_title": "This cycle formalized (in `HoggattTotals.lean`) the **sharp `d = 1` vs `d = 2`", "concept_domain": "Novelty", "research_mode": "team", "quality": "substantial", "quality_score": 0.83, "catalog_references": [], "prompt_length": 26802, "files_placed": 4, "status": "keep"}
{"timestamp": 1784044702.5596483, "experiment_id": "16f220a2", "concept_title": "Deepening: This cycle established, with no finiteness or well-foundedness hypothesis on the", "concept_domain": "Novelty", "research_mode": "team", "quality": "substantial", "quality_score": 0.83, "catalog_references": [], "prompt_length": 24044, "files_placed": 4, "status": "keep"}
{"timestamp": 1784045770.2253385, "experiment_id": "e6dfc1d4", "concept_title": "Extension of Matsuno's Formula for Non-Vanishing \u03bc-Invariants", "concept_domain": "Novelty", "research_mode": "team", "quality": "substantial", "quality_score": 0.78, "catalog_references": ["Spr12", "Pol03", "Mat08", "Hatley-Ray"], "prompt_length": 23725, "files_placed": 4, "status": "keep"}
{"timestamp": 1784045795.1384327, "experiment_id": "3361b315", "concept_title": "Deepening: The Topology of Knotted Light: How Laser Beams Get Tangled", "concept_domain": "Novelty", "research_mode": "team", "quality": "substantial", "quality_score": 0.83, "catalog_references": [], "prompt_length": 24030, "files_placed": 4, "status": "keep"}
{"timestamp": 1784048094.131509, "experiment_id": "2360ad91", "concept_title": "Deepening: Surveillance Networks: Information-Theoretic Undetectability", "concept_domain": "Novelty", "research_mode": "team", "quality": "substantial", "quality_score": 0.82, "catalog_references": [], "prompt_length": 22555, "files_placed": 4, "status": "keep"}
{"timestamp": 1784049181.439493, "experiment_id": "a3c4f06b", "concept_title": "Deepening: Exact Exponent for Constrained Coset Guesswork", "concept_domain": "Novelty", "research_mode": "team", "quality": "substantial", "quality_score": 0.83, "catalog_references": [], "prompt_length": 23765, "files_placed": 4, "status": "keep"}
{"timestamp": 1784051255.607369, "experiment_id": "44ee6caf", "concept_title": "Deepening: Consciousness as Emergent Fixed Point", "concept_domain": "Applications", "research_mode": "team", "quality": "substantial", "quality_score": 0.83, "catalog_references": [], "prompt_length": 23962, "files_placed": 4, "status": "keep"}
{"timestamp": 1784053341.7300513, "experiment_id": "5b1c1bd3", "concept_title": "Deepening: Sperner's Lemma Implies Nash Equilibria: Combinatorial Fixed Points in Game Theo", "concept_domain": "Novelty", "research_mode": "team", "quality": "substantial", "quality_score": 0.82, "catalog_references": [], "prompt_length": 23803, "files_placed": 4, "status": "keep"}
{"timestamp": 1784054396.5683563, "experiment_id": "07d73c91", "concept_title": "This cycle formalizes, in Lean 4 with Mathlib, the *combinatorial core* of the", "concept_domain": "Novelty", "research_mode": "team", "quality": "substantial", "quality_score": 0.82, "catalog_references": [], "prompt_length": 26901, "files_placed": 4, "status": "keep"}
{"timestamp": 1784056571.0661445, "experiment_id": "14656387", "concept_title": "This cycle isolated a single scalar invariant \u2014 the **M\u00f6bius discriminant**", "concept_domain": "Novelty", "research_mode": "team", "quality": "substantial", "quality_score": 0.83, "catalog_references": [], "prompt_length": 27728, "files_placed": 4, "status": "keep"}
{"timestamp": 1784058690.1751983, "experiment_id": "45e15555", "concept_title": "Colorful Carath\u00e9odory theorem for spanning k-trees admits a polynomial-size witness", "concept_domain": "Applications", "research_mode": "team", "quality": "substantial", "quality_score": 0.82, "catalog_references": ["colorful_caratheodory_theorem", "spanning_k_trees", "join_of_simplicial_complexes", "convex_hull_intersection"], "prompt_length": 23848, "files_placed": 4, "status": "keep"}
{"timestamp": 1784059788.5939753, "experiment_id": "19e0135d", "concept_title": "This cycle established, unconditionally, that the variational (Rayleigh-quotient", "concept_domain": "Applications", "research_mode": "team", "quality": "substantial", "quality_score": 0.83, "catalog_references": [], "prompt_length": 27420, "files_placed": 4, "status": "keep"}
{"timestamp": 1784059818.7222297, "experiment_id": "1e9bf31c", "concept_title": "Deepening: This cycle formalizes, in Lean 4 with Mathlib, the *combinatorial core* of the", "concept_domain": "Novelty", "research_mode": "team", "quality": "substantial", "quality_score": 0.83, "catalog_references": [], "prompt_length": 23539, "files_placed": 4, "status": "keep"}
{"timestamp": 1784060888.3677578, "experiment_id": "ef88d58c", "concept_title": "Deepening: Extension of Matsuno's Formula for Non-Vanishing \u03bc-Invariants", "concept_domain": "Novelty", "research_mode": "team", "quality": "substantial", "quality_score": 0.83, "catalog_references": [], "prompt_length": 23957, "files_placed": 4, "status": "keep"}
{"timestamp": 1784063118.2284923, "experiment_id": "0725f80e", "concept_title": "Deepening: This cycle isolated a single scalar invariant \u2014 the **M\u00f6bius discriminant**", "concept_domain": "Novelty", "research_mode": "team", "quality": "substantial", "quality_score": 0.86, "catalog_references": [], "prompt_length": 24039, "files_placed": 4, "status": "keep"}
{"timestamp": 1784066266.484178, "experiment_id": "daf8e94d", "concept_title": "Working with a self\u2011contained model of total colourings (proper vertex colouring", "concept_domain": "Novelty", "research_mode": "team", "quality": "substantial", "quality_score": 0.82, "catalog_references": [], "prompt_length": 25847, "files_placed": 4, "status": "keep"}
{"timestamp": 1784066284.571695, "experiment_id": "9a38651d", "concept_title": "The file `Catalog/Logic/TimeTravelCausalConsistency.lean` formalizes causal loop", "concept_domain": "Novelty", "research_mode": "team", "quality": "substantial", "quality_score": 0.78, "catalog_references": [], "prompt_length": 27676, "files_placed": 4, "status": "keep"}
{"timestamp": 1784068584.1212182, "experiment_id": "8ceb2563", "concept_title": "The prior cycle (`CosetGuesswork.lean`) proved the exact coset-exponent *shift*", "concept_domain": "Novelty", "research_mode": "team", "quality": "substantial", "quality_score": 0.82, "catalog_references": [], "prompt_length": 26262, "files_placed": 4, "status": "keep"}
{"timestamp": 1784068590.2950492, "experiment_id": "12ea9340", "concept_title": "Constructive, lower-bound half of the co-index theory", "concept_domain": "Novelty", "research_mode": "team", "quality": "substantial", "quality_score": 0.82, "catalog_references": [], "prompt_length": 26593, "files_placed": 4, "status": "keep"}
{"timestamp": 1784069638.4084282, "experiment_id": "a46f1a93", "concept_title": "Deepening: Sharp threshold characterization for Seidel energy increase in complete bipartit", "concept_domain": "Novelty", "research_mode": "team", "quality": "substantial", "quality_score": 0.82, "catalog_references": [], "prompt_length": 24049, "files_placed": 4, "status": "keep"}
{"timestamp": 1784069655.4889219, "experiment_id": "10dfa4e0", "concept_title": "The file `Catalog/Novelty/Z2CoindexSuspension.lean` develops a self-contained co", "concept_domain": "Applications", "research_mode": "team", "quality": "substantial", "quality_score": 0.82, "catalog_references": [], "prompt_length": 26576, "files_placed": 4, "status": "keep"}
{"timestamp": 1784070708.026329, "experiment_id": "1207283c", "concept_title": "The verified cycle established that the maximal number of good manifolds in an", "concept_domain": "Applications", "research_mode": "team", "quality": "substantial", "quality_score": 0.82, "catalog_references": [], "prompt_length": 26757, "files_placed": 4, "status": "keep"}
{"timestamp": 1784070713.861235, "experiment_id": "a25c6e48", "concept_title": "`KnottedLight.lean` formalizes the topological charge of an orbital-angular-mome", "concept_domain": "Applications", "research_mode": "team", "quality": "substantial", "quality_score": 0.82, "catalog_references": [], "prompt_length": 25524, "files_placed": 4, "status": "keep"}
{"timestamp": 1784070732.8570764, "experiment_id": "ccd67871", "concept_title": "Deepening: Working with a self\u2011contained model of total colourings (proper vertex colouring", "concept_domain": "Applications", "research_mode": "team", "quality": "substantial", "quality_score": 0.83, "catalog_references": [], "prompt_length": 24054, "files_placed": 4, "status": "keep"}
{"timestamp": 1784071835.0622165, "experiment_id": "0e4c0a6c", "concept_title": "These conjectures are distilled from the current cycle, which closed the bridge", "concept_domain": "Applications", "research_mode": "team", "quality": "substantial", "quality_score": 0.78, "catalog_references": [], "prompt_length": 27768, "files_placed": 5, "status": "keep"}
{"timestamp": 1784076155.1643686, "experiment_id": "71637775", "concept_title": "Close Proofs: Constructive, lower-bound half of the co-index theory", "concept_domain": "Novelty", "research_mode": "team", "quality": "substantial", "quality_score": 0.83, "catalog_references": [], "prompt_length": 23873, "files_placed": 8, "status": "keep"}
{"timestamp": 1784076178.9983718, "experiment_id": "50098ece", "concept_title": "Close Proofs: The prior cycle (`CosetGuesswork.lean`) proved the exact coset-exponen", "concept_domain": "Novelty", "research_mode": "team", "quality": "substantial", "quality_score": 0.84, "catalog_references": [], "prompt_length": 23890, "files_placed": 9, "status": "keep"}
{"timestamp": 1784076203.7961984, "experiment_id": "c23e4bea", "concept_title": "Deepening: Constructive, lower-bound half of the co-index theory", "concept_domain": "Applications", "research_mode": "team", "quality": "substantial", "quality_score": 0.83, "catalog_references": [], "prompt_length": 24027, "files_placed": 7, "status": "keep"}
{"timestamp": 1784076211.2975426, "experiment_id": "cc9e6854", "concept_title": "Close Proofs: The file `Catalog/Novelty/Z2CoindexSuspension.lean` develops a self-co", "concept_domain": "Applications", "research_mode": "team", "quality": "substantial", "quality_score": 0.93, "catalog_references": [], "prompt_length": 22455, "files_placed": 5, "status": "keep"}
{"timestamp": 1784076243.6653442, "experiment_id": "dbf870e8", "concept_title": "Close Proofs: Speculative: Topological Quantum Error Correction from Mathematical St", "concept_domain": "Novelty", "research_mode": "team", "quality": "substantial", "quality_score": 0.88, "catalog_references": [], "prompt_length": 22012, "files_placed": 8, "status": "keep"}
{"timestamp": 1784076262.092874, "experiment_id": "c4f680cf", "concept_title": "Deepening: The file `Catalog/Logic/TimeTravelCausalConsistency.lean` formalizes causal loop", "concept_domain": "Novelty", "research_mode": "team", "quality": "substantial", "quality_score": 0.83, "catalog_references": [], "prompt_length": 24044, "files_placed": 9, "status": "keep"}
{"timestamp": 1784077409.9244125, "experiment_id": "99a1b43f", "concept_title": "Spectral Transfer Sharpness for Trees Beyond the Sidorenko Range", "concept_domain": "Novelty", "research_mode": "team", "quality": "substantial", "quality_score": 0.93, "catalog_references": ["Sidorenko's conjecture (Sidorenko 1991)", "Lov\u00e1sz-Szegedy graphon theory (Lov\u00e1sz 2012)", "Tensor amplification methods (this paper)"], "prompt_length": 18790, "files_placed": 4, "status": "keep"}
{"timestamp": 1784080172.8618872, "experiment_id": "86efe295", "concept_title": "Deepening: This project formalizes a **cross-domain connector** (v27 \"Connector\" mission): ", "concept_domain": "Algebra", "research_mode": "team", "quality": "substantial", "quality_score": 0.91, "catalog_references": [], "prompt_length": 22145, "files_placed": 8, "status": "keep"}
{"timestamp": 1784080178.2960825, "experiment_id": "41e1526b", "concept_title": "Deepening: Asymptotic Clique-to-Clique Density Bound", "concept_domain": "Logic", "research_mode": "team", "quality": "substantial", "quality_score": 0.86, "catalog_references": [], "prompt_length": 21425, "files_placed": 5, "status": "keep"}
{"timestamp": 1784081505.6973338, "experiment_id": "37f1d216", "concept_title": "Two-parameter picture of *witness complexity* for the", "concept_domain": "Computation", "research_mode": "team", "quality": "substantial", "quality_score": 0.91, "catalog_references": [], "prompt_length": 26776, "files_placed": 4, "status": "keep"}
{"timestamp": 1784082723.492946, "experiment_id": "9243b8b5", "concept_title": "Close Proofs: The mission asked to interrogate the claim:", "concept_domain": "Shared", "research_mode": "team", "quality": "substantial", "quality_score": 0.92, "catalog_references": [], "prompt_length": 22589, "files_placed": 4, "status": "keep"}
{"timestamp": 1784082746.046796, "experiment_id": "ef5b75b5", "concept_title": "Topological charge of an orbital-angular-momentum bea", "concept_domain": "Pythagorean", "research_mode": "team", "quality": "substantial", "quality_score": 0.91, "catalog_references": [], "prompt_length": 30437, "files_placed": 4, "status": "keep"}
{"timestamp": 1784082753.4731255, "experiment_id": "da85fe77", "concept_title": "Deepening: The file `Catalog/Speculative/AutoResearch/MixedRadixFactorialBridge.lean`", "concept_domain": "Computation", "research_mode": "team", "quality": "substantial", "quality_score": 0.9, "catalog_references": [], "prompt_length": 24051, "files_placed": 5, "status": "keep"}
{"timestamp": 1784082764.6934154, "experiment_id": "4b27af05", "concept_title": "Deepening: Bruhat Order Preserves Closure Relations for B-Orbits on Flag Variety Product", "concept_domain": "Tropical", "research_mode": "team", "quality": "substantial", "quality_score": 0.88, "catalog_references": [], "prompt_length": 21660, "files_placed": 4, "status": "keep"}
{"timestamp": 1784082777.1668112, "experiment_id": "6097a507", "concept_title": "Deepening: The prior cycle (`CosetGuesswork.lean`) proved the exact coset-exponent *shift*", "concept_domain": "MachineLearning", "research_mode": "team", "quality": "substantial", "quality_score": 0.91, "catalog_references": [], "prompt_length": 22478, "files_placed": 4, "status": "keep"}
{"timestamp": 1784085055.7825582, "experiment_id": "f243395d", "concept_title": "This cycle recast analogy-making between two ordered structures as the taking of", "concept_domain": "Tropical", "research_mode": "team", "quality": "substantial", "quality_score": 0.91, "catalog_references": [], "prompt_length": 28840, "files_placed": 8, "status": "keep"}
