{"timestamp": 1782343918.1812541, "experiment_id": "226a5c12", "concept_title": "Bridge: Galois Connections Between Order Theory and Topology", "concept_domain": "Novelty", "research_mode": "formalize", "quality": "partial", "quality_score": 0.57117, "catalog_references": ["Bridges/KnasterTarskiBridge.lean"], "prompt_length": 20841, "files_placed": 7, "status": "keep"}
{"timestamp": 1782348350.6312804, "experiment_id": "c37a84a2", "concept_title": "Close Proofs: These conjectures continue the research cycle begun in", "concept_domain": "Computation", "research_mode": "prove", "quality": "partial", "quality_score": 0.5709080000000001, "catalog_references": ["Computation/StrongDivisibilitySequences", "Applications/RankOfApparition"], "prompt_length": 16840, "files_placed": 6, "status": "keep"}
{"timestamp": 1782350888.3314242, "experiment_id": "99725b45", "concept_title": "Asymptotic C5-decomposition threshold equals 5/8", "concept_domain": "Novelty", "research_mode": "team", "quality": "substantial", "quality_score": 0.708, "catalog_references": ["Nash-Williams triangle decomposition conjecture", "Delcourt--Postle theorem on triangle decompositions", "Glock--K\u00fchn--Osthus decomposition threshold problem", "Wilson's theorem on graph decompositions", "mathlib: Mathlib.Combinatorics.SimpleGraph.Basic", "mathlib: Mathlib.Data.Fintype.Card"], "prompt_length": 20945, "files_placed": 7, "status": "keep"}
{"timestamp": 1782350985.0003572, "experiment_id": "eb2eee3d", "concept_title": "Perfect Numbers: Structure of Even Perfects", "concept_domain": "Applications", "research_mode": "prove", "quality": "partial", "quality_score": 0.6766, "catalog_references": ["Catalog/FINAL/NumberTheory/SigmaFunction.lean", "Catalog/FINAL/NumberTheory/MultiplicativeFunctions.lean", "Catalog/FINAL/NumberTheory/Divisibility.lean"], "prompt_length": 22883, "files_placed": 6, "status": "keep"}
{"timestamp": 1782351085.6153076, "experiment_id": "cc1a412b", "concept_title": "Quadratic irrational density in the ratio spectrum", "concept_domain": "Computation", "research_mode": "sorry_fill", "quality": "partial", "quality_score": 0.6594499999999999, "catalog_references": ["Tropical/MatrixNormRatioSpectrum.lean"], "prompt_length": 16602, "files_placed": 6, "status": "keep"}
{"timestamp": 1782352711.8335001, "experiment_id": "7242c7d6", "concept_title": "EML Differential Equations: ODEs with Exponential-Logarithmic Coefficients", "concept_domain": "Applications", "research_mode": "formalize", "quality": "partial", "quality_score": 0.6932800000000001, "catalog_references": ["Catalog/FINAL/Applications/EMLAiryPolynomialFactorObstruction.lean"], "prompt_length": 19829, "files_placed": 6, "status": "keep"}
{"timestamp": 1782358122.6472769, "experiment_id": "3e805dd4", "concept_title": "Extremal Graph Theory: Tur\u00e1n and Szemer\u00e9di", "concept_domain": "Applications", "research_mode": "prove", "quality": "partial", "quality_score": 0.45636596791938716, "catalog_references": [], "prompt_length": 20695, "files_placed": 4, "status": "discard"}
{"timestamp": 1782359204.4311502, "experiment_id": "f25c8810", "concept_title": "Alien Number Systems: Beyond Base-N", "concept_domain": "Computation", "research_mode": "formalize", "quality": "substantial", "quality_score": 0.7545600000000001, "catalog_references": ["Catalog/NumberTheory/FactorialNumberSystem.lean"], "prompt_length": 19033, "files_placed": 6, "status": "keep"}
{"timestamp": 1782364637.7992237, "experiment_id": "4ab1c862", "concept_title": "GeneralizedPeriod Relation for Betti-Whittaker Periods and Contragredient Representations of GL(n)", "concept_domain": "Logic", "research_mode": "team", "quality": "partial", "quality_score": 0.5380114482758622, "catalog_references": ["C24", "JLS26", "BW", "Clo"], "prompt_length": 22952, "files_placed": 7, "status": "keep"}
{"timestamp": 1782365057.8302155, "experiment_id": "7ca7bb8c", "concept_title": "NISQ-Optimized Quantum Error Mitigation via Algebraic Topology", "concept_domain": "Novelty", "research_mode": "prove", "quality": "substantial", "quality_score": 0.886574, "catalog_references": ["Catalog/Novelty/QuantumTopoMitigation/ErrorMitigation.lean", "Catalog/Novelty/QuantumTopoMitigation/Betti.lean"], "prompt_length": 17241, "files_placed": 7, "status": "keep"}
{"timestamp": 1782371073.0989585, "experiment_id": "ff8131d4", "concept_title": "Minimal Minor-Closed Classes Below 3/2 Have Single Forbidden Minors", "concept_domain": "Novelty", "research_mode": "team", "quality": "partial", "quality_score": 0.4658475833333334, "catalog_references": ["Diestel2010Book"], "prompt_length": 22862, "files_placed": 7, "status": "discard"}
{"timestamp": 1782373382.2291088, "experiment_id": "1311df1d", "concept_title": "Finite type of cluster algebras on Schubert cells in type A flag varieties", "concept_domain": "Geometry", "research_mode": "formalize", "quality": "substantial", "quality_score": 0.8125600000000002, "catalog_references": ["Geometry/ClusterFiniteTypeA.lean"], "prompt_length": 20849, "files_placed": 6, "status": "keep"}
{"timestamp": 1782375119.4202113, "experiment_id": "eee0a16a", "concept_title": "Brocard-Ramanujan Triangular Classification", "concept_domain": "Geometry", "research_mode": "team", "quality": "partial", "quality_score": 0.42575842352941173, "catalog_references": ["Nat.factorial", "Nat.sqrt", "Nat.Prime", "Nat.ModEq", "Nat.dvd_iff_modEq_zero", "Nat.even_iff", "Nat.odd_iff"], "prompt_length": 20779, "files_placed": 7, "status": "discard"}
{"timestamp": 1782377004.8211038, "experiment_id": "ef874ad4", "concept_title": "Statistical Mechanics: Ising Model Phase Transition", "concept_domain": "Probability", "research_mode": "prove", "quality": "partial", "quality_score": 0.512, "catalog_references": [], "prompt_length": 20702, "files_placed": 7, "status": "keep"}
{"timestamp": 1782377560.784691, "experiment_id": "73a5599a", "concept_title": "Diffusion Models as Stochastic Differential Equations", "concept_domain": "Geometry", "research_mode": "team", "quality": "partial", "quality_score": 0.69548, "catalog_references": [], "prompt_length": 22928, "files_placed": 8, "status": "keep"}
{"timestamp": 1782385864.1276326, "experiment_id": "854c699d", "concept_title": "Spectral Modular Signatures of Formal Proof Difficulty", "concept_domain": "Computation", "research_mode": "formalize", "quality": "partial", "quality_score": 0.64162, "catalog_references": ["Catalog/FINAL/Algebra/ProofSpectra/Core.lean", "Catalog/Computation/SpectralProofSignature/Core.lean"], "prompt_length": 21229, "files_placed": 6, "status": "keep"}
{"timestamp": 1782391005.9954975, "experiment_id": "292d0525", "concept_title": "Quadratic Reciprocity: Five Proofs Formalized", "concept_domain": "NumberTheory", "research_mode": "prove", "quality": "partial", "quality_score": 0.54302, "catalog_references": [], "prompt_length": 22870, "files_placed": 8, "status": "keep"}
{"timestamp": 1782391142.1793013, "experiment_id": "bd1f81a7", "concept_title": "P\u00f3lya tree coefficient divisor-sum recurrence", "concept_domain": "Cryptography", "research_mode": "team", "quality": "substantial", "quality_score": 0.80372, "catalog_references": ["MR1577579", "MR0025715", "MR2483235"], "prompt_length": 18351, "files_placed": 6, "status": "keep"}
{"timestamp": 1782398775.4110956, "experiment_id": "fb5aee47", "concept_title": "Brocard-Ramanujan Triangular Classification", "concept_domain": "Novelty", "research_mode": "sorry_fill", "quality": "partial", "quality_score": 0.30151606086956523, "catalog_references": [], "prompt_length": 15985, "files_placed": 6, "status": "discard"}
{"timestamp": 1782405034.682962, "experiment_id": "701dddb6", "concept_title": "P\u00f3lya tree coefficient recurrence formula", "concept_domain": "Bridges", "research_mode": "team", "quality": "substantial", "quality_score": 0.78684, "catalog_references": ["MR1577579", "MR0025715", "MR2483235"], "prompt_length": 22894, "files_placed": 7, "status": "keep"}
{"timestamp": 1782409206.0232985, "experiment_id": "7ae59772", "concept_title": "Normality of Mathematical Constants", "concept_domain": "Algebra", "research_mode": "team", "quality": "substantial", "quality_score": 0.7357199999999999, "catalog_references": [], "prompt_length": 20602, "files_placed": 8, "status": "keep"}
{"timestamp": 1782411531.0932493, "experiment_id": "364ec557", "concept_title": "EML Differential Algebra: Closure Properties", "concept_domain": "Applications", "research_mode": "formalize", "quality": "partial", "quality_score": 0.57649, "catalog_references": [], "prompt_length": 19382, "files_placed": 6, "status": "keep"}
{"timestamp": 1782411742.0223083, "experiment_id": "fb2780d5", "concept_title": "Langlands Correspondence: GL(1) Case", "concept_domain": "Novelty", "research_mode": "prove", "quality": "substantial", "quality_score": 0.7235799999999999, "catalog_references": [], "prompt_length": 20700, "files_placed": 7, "status": "keep"}
{"timestamp": 1782413427.0684278, "experiment_id": "ab9c78a7", "concept_title": "Extremal Graph Theory: Tur\u00e1n and Szemer\u00e9di", "concept_domain": "Novelty", "research_mode": "prove", "quality": "substantial", "quality_score": 0.72533, "catalog_references": [], "prompt_length": 20685, "files_placed": 7, "status": "keep"}
{"timestamp": 1782414696.4952068, "experiment_id": "54abcfb1", "concept_title": "Tropical Differential Equations: Power Series Solutions", "concept_domain": "Computation", "research_mode": "team", "quality": "partial", "quality_score": 0.45116, "catalog_references": [], "prompt_length": 22978, "files_placed": 8, "status": "discard"}
{"timestamp": 1782417817.758291, "experiment_id": "6218af01", "concept_title": "Irrational Densities from Parabola-Circumscribed Quadrilaterals in Aperiodic Tilings", "concept_domain": "Physics", "research_mode": "team", "quality": "partial", "quality_score": 0.550667741935484, "catalog_references": ["MR857454", "MR1417578", "MR2742574"], "prompt_length": 20677, "files_placed": 9, "status": "keep"}
{"timestamp": 1782427043.6575298, "experiment_id": "0cb84107", "concept_title": "Primes of the Form n\u00b2+1", "concept_domain": "Cryptography", "research_mode": "formalize", "quality": "partial", "quality_score": 0.506378, "catalog_references": ["Mathlib/NumberTheory/LegendreSymbol.lean", "Mathlib/NumberTheory/QuadraticReciprocity.lean", "Mathlib/NumberTheory/Analytic/PNT.lean"], "prompt_length": 22788, "files_placed": 6, "status": "keep"}
{"timestamp": 1782427518.3356035, "experiment_id": "a8f472f7", "concept_title": "Existence of a Satisfactory Multiplier Vector for 2D Lacunary Distance Graphs", "concept_domain": "Algebra", "research_mode": "prove", "quality": "partial", "quality_score": 0.56056, "catalog_references": [], "prompt_length": 17557, "files_placed": 6, "status": "keep"}
{"timestamp": 1782434419.735153, "experiment_id": "e8c93c85", "concept_title": "Interval Property for Connected Slice-Projections of Polymatroids", "concept_domain": "Shared", "research_mode": "prove|formalize|counterexample", "quality": "partial", "quality_score": 0.6236999999999999, "catalog_references": ["Domain/File.lean", "Catalog/FINAL"], "prompt_length": 20950, "files_placed": 6, "status": "keep"}
{"timestamp": 1782437483.0249257, "experiment_id": "2e536cee", "concept_title": "Discrepancy of Random Linear Codes for All Hamming Balls", "concept_domain": "Computation", "research_mode": "team", "quality": "substantial", "quality_score": 0.7725600000000001, "catalog_references": ["arXiv:2305.12345", "Blinovsky 1987", "Goldreich\u2013Levin 1989"], "prompt_length": 21077, "files_placed": 9, "status": "keep"}
{"timestamp": 1782437574.4912348, "experiment_id": "cfcd856c", "concept_title": "Noether's Theorem: Symmetries and Conservation Laws", "concept_domain": "Physics", "research_mode": "prove", "quality": "partial", "quality_score": 0.66768, "catalog_references": [], "prompt_length": 22875, "files_placed": 8, "status": "keep"}
{"timestamp": 1782437724.1059637, "experiment_id": "1983a01c", "concept_title": "Bourgain's Slicing Problem", "concept_domain": "Pythagorean", "research_mode": "team", "quality": "substantial", "quality_score": 0.7400800000000001, "catalog_references": [], "prompt_length": 22738, "files_placed": 8, "status": "keep"}
{"timestamp": 1782439010.5708413, "experiment_id": "25d6b815", "concept_title": "Central Gaussian coefficient maximizes binary 2-binomial class size", "concept_domain": "Probability", "research_mode": "team", "quality": "partial", "quality_score": 0.5960000000000001, "catalog_references": ["Gaussian binomial coefficients", "binary words and inversion number", "unimodality of q-binomial coefficients", "Rigo--Salimov binary 2-binomial equivalence", "Mathlib.Data.Finset.Card", "Mathlib.Combinatorics.Enumerative.Partition"], "prompt_length": 20891, "files_placed": 6, "status": "keep"}
{"timestamp": 1782441719.9986079, "experiment_id": "9e1a2820", "concept_title": "Generalized Gawron\u2013Miska\u2013Ulas unboundedness for arbitrary integer bases", "concept_domain": "Logic", "research_mode": "team", "quality": "partial", "quality_score": 0.52704, "catalog_references": ["Prouhet-Thue-Morse sequence", "Gawron-Miska-Ulas conjecture", "Infinite products in formal power series", "Mahler-type functional equations", "k-regular sequences"], "prompt_length": 21017, "files_placed": 8, "status": "keep"}
{"timestamp": 1782441802.0683959, "experiment_id": "0dc2bca1", "concept_title": "Fourier Analysis on Finite Groups", "concept_domain": "Combinatorics", "research_mode": "prove", "quality": "substantial", "quality_score": 0.7367999999999999, "catalog_references": [], "prompt_length": 20358, "files_placed": 6, "status": "keep"}
{"timestamp": 1782443790.0769374, "experiment_id": "0548f2b9", "concept_title": "Navier-Stokes: 2D Regularity and Partial 3D Results", "concept_domain": "Novelty", "research_mode": "prove", "quality": "substantial", "quality_score": 0.7095, "catalog_references": [], "prompt_length": 20736, "files_placed": 8, "status": "keep"}
{"timestamp": 1782443911.4718711, "experiment_id": "d4c70419", "concept_title": "Random Graphs: Erd\u0151s-R\u00e9nyi Threshold Phenomena", "concept_domain": "Algebra", "research_mode": "prove", "quality": "partial", "quality_score": 0.65696, "catalog_references": [], "prompt_length": 22842, "files_placed": 8, "status": "keep"}
{"timestamp": 1782445420.731697, "experiment_id": "f6b20d87", "concept_title": "Exact Value of the Binomial GCD in OEIS A080170", "concept_domain": "Novelty", "research_mode": "team", "quality": "partial", "quality_score": 0.554, "catalog_references": ["OEIS A080170", "Ralf Stephan's OEIS conjecture list, conjecture (17)", "Ram's theorem on gcds of rows of Pascal's triangle", "Lucas theorem and Kummer theorem for binomial coefficients", "Formal Conjectures project / FC100OpenSet1"], "prompt_length": 20872, "files_placed": 7, "status": "keep"}
{"timestamp": 1782445509.804634, "experiment_id": "4364c6f1", "concept_title": "Statistical Mechanics: Ising Model Phase Transition", "concept_domain": "Applications", "research_mode": "prove", "quality": "partial", "quality_score": 0.546, "catalog_references": [], "prompt_length": 20704, "files_placed": 9, "status": "keep"}
{"timestamp": 1782450369.0333598, "experiment_id": "8f6e0a03", "concept_title": "Quadratic irrational density in the ratio spectrum", "concept_domain": "Novelty", "research_mode": "team", "quality": "partial", "quality_score": 0.40623618823529417, "catalog_references": ["Lagarias-Shallit bounds for Lagrange constants under integer linear fractional transformations", "Smith normal form over Z for reducing integer matrices", "Lagrange constant formula via two-sided continued fractions", "Lagrange theorem: real quadratic irrationals are exactly eventually periodic continued fractions", "Mathlib modules: Mathlib.Data.Matrix.Basic, Mathlib.NumberTheory.ContinuedFractions, Mathlib.Topology.Algebra.Order.LiminfLimsup"], "prompt_length": 20863, "files_placed": 7, "status": "discard"}
{"timestamp": 1782450967.4433064, "experiment_id": "8344a207", "concept_title": "Birch and Swinnerton-Dyer Conjecture", "concept_domain": "Novelty", "research_mode": "team", "quality": "partial", "quality_score": 0.6688000000000001, "catalog_references": [], "prompt_length": 22795, "files_placed": 7, "status": "keep"}
{"timestamp": 1782451104.7700295, "experiment_id": "f0b7b2e4", "concept_title": "Ramsey Theory: Bounds and Constructions", "concept_domain": "Applications", "research_mode": "prove", "quality": "partial", "quality_score": 0.53943, "catalog_references": [], "prompt_length": 22855, "files_placed": 7, "status": "keep"}
{"timestamp": 1782451961.8745012, "experiment_id": "ab7f1188", "concept_title": "Duality of Sublevel Set Homotopy Types for RC Functions on Finite\u2011Dimensional Banach Spaces", "concept_domain": "Geometry", "research_mode": "team", "quality": "partial", "quality_score": 0.49574803827751207, "catalog_references": ["math.FA/2301.01234", "math.GN/2105.06789", "Lean4 Mathlib: Topology/Algebra/Module.lean", "Lean4 Mathlib: Analysis/Convex/Basic.lean"], "prompt_length": 21125, "files_placed": 8, "status": "discard"}
{"timestamp": 1782454558.5574708, "experiment_id": "dfb56ea4", "concept_title": "Navier-Stokes Existence and Smoothness", "concept_domain": "Novelty", "research_mode": "team", "quality": "partial", "quality_score": 0.52355, "catalog_references": [], "prompt_length": 20687, "files_placed": 7, "status": "keep"}
{"timestamp": 1782456548.7278068, "experiment_id": "01ec1037", "concept_title": "Signless Laplacian Spectral Radius of Pure Simplicial Complexes with vanishing link homology in dimension t", "concept_domain": "Novelty", "research_mode": "team", "quality": "partial", "quality_score": 0.55696, "catalog_references": ["arXiv:2303.04252", "doi:10.1016/j.disc.2023.112345"], "prompt_length": 21031, "files_placed": 8, "status": "keep"}
{"timestamp": 1782457087.104865, "experiment_id": "d7fd1af1", "concept_title": "Domain Finiteness", "concept_domain": "Bridges", "research_mode": "prove", "quality": "partial", "quality_score": 0.67919, "catalog_references": ["Bridges/NumberTheoryBridge.lean", "Algebra/Field.lean", "Algebra/CyclicGroup.lean"], "prompt_length": 17440, "files_placed": 6, "status": "keep"}
{"timestamp": 1782460624.637502, "experiment_id": "0f17133d", "concept_title": "Girth-Expansion Equivalence for Optimal Small-Set Expanders", "concept_domain": "Bridges", "research_mode": "team", "quality": "substantial", "quality_score": 0.76536, "catalog_references": ["math.CO", "cs.IT", "cs.CR"], "prompt_length": 20862, "files_placed": 7, "status": "keep"}
{"timestamp": 1782460780.4055479, "experiment_id": "151fa435", "concept_title": "Continued Fractions and Diophantine Approximation", "concept_domain": "Novelty", "research_mode": "prove", "quality": "substantial", "quality_score": 0.7885600000000001, "catalog_references": [], "prompt_length": 20739, "files_placed": 7, "status": "keep"}
{"timestamp": 1782462405.985051, "experiment_id": "5c41b780", "concept_title": "Tightness of the unit-shift bound for Euler's totient function", "concept_domain": "Bridges", "research_mode": "team", "quality": "partial", "quality_score": 0.44476594336283193, "catalog_references": ["Euler's totient function", "shifted equal values", "Graham--Holt--Pomerance construction"], "prompt_length": 22827, "files_placed": 7, "status": "discard"}
{"timestamp": 1782466331.6759326, "experiment_id": "ad454ca1", "concept_title": "ML Generalization Bounds: Rademacher Complexity of Neural Networks", "concept_domain": "MachineLearning", "research_mode": "team", "quality": "partial", "quality_score": 0.6776, "catalog_references": [], "prompt_length": 20837, "files_placed": 7, "status": "keep"}
{"timestamp": 1782470296.3741596, "experiment_id": "da5cb31c", "concept_title": "Homotopy Equivalence of Line Transversal Spaces to Spheres", "concept_domain": "Novelty", "research_mode": "prove", "quality": "partial", "quality_score": 0.5496381818181819, "catalog_references": ["Catalog/FINAL/Homology.lean", "Catalog/FINAL/Topology.lean", "Catalog/Final/Geometry/Convex.lean"], "prompt_length": 20958, "files_placed": 8, "status": "keep"}
{"timestamp": 1782470637.0719683, "experiment_id": "3718ce68", "concept_title": "Betti-Whittaker Period Relation for Contragredient Representations of GL(n)", "concept_domain": "NumberTheory", "research_mode": "formalize", "quality": "substantial", "quality_score": 0.71376, "catalog_references": ["NumberTheory/NumberField/Discriminant.lean", "Algebra/Group/GLn.lean", "Algebra/LinearAlgebra/Matrix.lean", "Topology/Algebra/Group.lean", "GroupTheory/Representations/Generic.lean", "Cohomology/GroupCohomology.lean"], "prompt_length": 20997, "files_placed": 6, "status": "keep"}
{"timestamp": 1782472368.0714, "experiment_id": "49f14a50", "concept_title": "Graph Coloring: Chromatic Polynomial Theory", "concept_domain": "Tropical", "research_mode": "prove", "quality": "partial", "quality_score": 0.51904, "catalog_references": [], "prompt_length": 22892, "files_placed": 9, "status": "keep"}
{"timestamp": 1782472429.9439669, "experiment_id": "18edb6fb", "concept_title": "Secret Sharing: Shamir's Scheme and Verifiable Variants", "concept_domain": "Cryptography", "research_mode": "team", "quality": "partial", "quality_score": 0.6521899999999999, "catalog_references": [], "prompt_length": 22941, "files_placed": 7, "status": "keep"}
